1	во всех этих случаях	1	6
2	в тех случаях когда	1	6
3	с этой точки зрения	1	3
4	до сих пор мы	1	2
5	с другой стороны и	1	2
6	но тем не менее	1	2
7	его за руку и	1	1
8	видим таким образом что	1	1
9	не может выйти за	1	1
10	с другой стороны оно	1	1
11	с одной стороны и	3	1
12	друг с другом и	1	1
13	ничем не отличается от	1	1
14	только после этого мы	1	1
15	нами в предыдущей главе	1	1
16	и не может быть	5	1
17	как мы видели не	1	1
18	один и тот же	3	1
19	это не совсем так	1	1
20	как мы уже знаем	4	1
21	бы то ни было	12	1
22	мы видим таким образом	1	1
23	вместе с тем и	1	1
24	одна и та же	2	1
25	в том что он	4	1
26	иначе обстоит дело с	1	1
27	более или менее случайно	1	1
28	в более или менее	1	1
29	с одной стороны эти	1	1
30	с другой же стороны	1	1
31	так же как и	2	1
