1	в то же время	1	7
2	во времени и пространстве	1	5
3	состоит в том что	1	5
4	мы имеем дело с	1	4
5	внимание на то что	2	2
6	и в то же	3	2
7	одно и то же	4	2
8	в войне и мире	2	2
9	с той или иной	1	2
10	и не может быть	1	2
11	дело в том что	10	2
12	одного и того же	3	2
13	в том смысле как	1	1
14	тип в том смысле	1	1
15	в связи с этим	4	1
16	не объективна и не	1	1
17	с одной стороны и	3	1
18	который в данном случае	1	1
19	является в данном случае	1	1
20	в том случае если	1	1
21	ни в чем не	5	1
22	он не может быть	1	1
23	во всяком случае он	1	1
24	одним и тем же	4	1
25	по себе но как	3	1
26	а в то же	1	1
27	не для того чтобы	1	1
28	сам по себе а	2	1
29	можно сказать что он	2	1
30	в связи с этой	2	1
31	настаивать на том что	1	1
32	еще и потому что	4	1
33	и не только в	1	1
34	но для того чтобы	1	1
35	один и тот же	2	1
36	сами по себе но	1	1
37	дело здесь не только	1	1
38	мысль о том что	2	1
39	одной из этих сторон	1	1
40	может быть не только	1	1
41	и в самом деле	1	1
42	и не может существовать	1	1
43	иметь в виду и	1	1
44	какой бы то ни	1	1
45	но в зависимости от	1	1
46	может быть и не	1	1
47	в том числе и	4	1
48	здесь мы имеем дело	2	1
49	в нем не только	1	1
50	в той или иной	10	1
51	в то время как	12	1
52	если бы не было	3	1
53	то что не имеет	1	1
54	в определенный момент времени	1	1
55	том смысле как мы	1	1
56	здесь не только в	1	1
57	к тому или иному	2	1
58	ответ на этот вопрос	1	1
59	с этой точки зрения	3	1
60	объективна и не субъективна	1	1
61	но на этот раз	1	1
62	в том или ином	4	1
63	никак не может быть	1	1
64	не сами по себе	1	1
65	той или иной области	1	1
66	бы то ни было	6	1
