1	в то время как	1	7
2	с одной стороны и	1	4
3	с этой точки зрения	1	4
4	состоит в том что	6	3
5	одно и то же	2	3
6	точно так же как	2	3
7	одного и того же	2	3
8	смысле можно сказать что	2	2
9	внимание на то что	3	2
10	известном смысле можно сказать	2	2
11	той мере в какой	2	2
12	в известном смысле можно	2	2
13	в той мере в	2	2
14	представление о том что	1	2
15	в том смысле что	1	2
16	в том числе и	1	2
17	одним и тем же	1	2
18	в той же мере	1	2
19	и не может быть	2	2
20	в том что он	1	2
21	который в свою очередь	1	1
22	в свою очередь не	1	1
23	единство слова и мысли	1	1
24	только по отношению к	1	1
25	не что иное как	1	1
26	состоит как раз в	1	1
27	мы имеем дело с	5	1
28	в качестве одного из	1	1
29	дело здесь не в	1	1
30	представляет собой один из	1	1
31	есть не что иное	1	1
32	но для того чтобы	1	1
33	и то же слово	1	1
34	в этом и состоит	3	1
35	же как и в	1	1
36	о том что в	1	1
37	в то же время	8	1
38	что с точки зрения	1	1
39	как и всякий другой	1	1
40	то же самое происходит	1	1
41	не обращая внимания на	1	1
42	в одинаковой степени и	1	1
