1	в то же время	14	10
2	и в то же	6	6
3	в связи с этим	4	4
4	одно и то же	12	4
5	как мы уже сказали	1	4
6	ни в чем не	2	3
7	в одно и то	1	3
8	и то же время	1	3
9	с одной стороны и	4	2
10	мы имеем в виду	1	2
11	бы она ни была	1	2
12	времени и пространства в	1	2
13	одна и та же	8	2
14	в то время как	8	2
15	одних и тех же	3	2
16	так же как и	2	2
17	можно прямо сказать что	1	2
18	дело в том что	2	2
19	но в то же	3	2
20	все более и более	1	2
21	ни с чем не	1	2
22	в основе ее лежит	1	1
23	не было и не	1	1
24	но это значит что	4	1
25	неизвестно кем и неизвестно	1	1
26	все это не имеет	1	1
27	в том что они	1	1
28	и вместе с тем	1	1
29	что в основе их	1	1
30	все больше и больше	1	1
31	в том что все	1	1
32	в том что в	1	1
33	и пр и пр	1	1
34	время человеческой жизни и	1	1
35	не вызывает никаких сомнений	2	1
36	и в этом отношении	1	1
37	нечего и говорить о	1	1
38	до сих пор не	1	1
39	именно в том что	1	1
40	друг с другом в	1	1
41	и т д он	1	1
42	как мы это уже	1	1
43	что они вовсе не	1	1
44	и в частности от	1	1
45	но дело в том	1	1
46	в широком смысле но	1	1
47	мы вовсе не имеем	1	1
48	и может быть только	1	1
49	времени и пространства и	1	1
50	но в конце концов	1	1
51	друг от друга и	1	1
52	и до сих пор	1	1
53	с другой стороны в	1	1
54	с этой точки зрения	4	1
55	что на самом деле	1	1
56	жизнь со всеми ее	2	1
57	в жизни и в	1	1
