1	в то же время	15	6
2	мы можем сказать что	1	5
3	не может быть и	4	4
4	один и тот же	3	3
5	но во всяком случае	1	3
6	внутренней и внешней речи	1	3
7	и не может быть	5	3
8	может быть и речи	4	3
9	но в то же	9	3
10	одной и той же	3	3
11	– это и есть	2	2
12	в следующей главе глава	1	2
13	и пр и пр	5	2
14	как раз и не	1	2
15	а с другой –	1	2
16	с объективной точки зрения	3	2
17	в том что он	4	2
18	нет и не может	2	2
19	– это вовсе не	1	2
20	ни в каком случае	1	2
21	на самом же деле	5	2
22	ни в какой степени	1	2
23	не чем иным как	1	2
24	бы то ни было	12	2
25	в большинстве случаев только	1	1
26	видим таким образом что	1	1
27	жизни в ее целом	1	1
28	не может обойтись без	1	1
29	это и есть та	1	1
30	с марксистской точки зрения	1	1
31	т.е с точки зрения	1	1
32	ничего общего не имеет	1	1
33	само собою разумеется что	1	1
34	это не совсем так	1	1
35	только при этом условии	2	1
36	и в таком случае	1	1
37	итоги остается подвести итоги	1	1
38	в индивидуальную душу но	1	1
39	в собственном смысле слова	2	1
40	ни в коем случае	2	1
41	мы видим таким образом	1	1
42	в свою очередь является	1	1
43	но тем не менее	1	1
44	– все это является	1	1
45	они не могут быть	1	1
46	не может быть понято	1	1
47	– говорит он –	2	1
48	если бы он был	2	1
49	далек от того чтобы	1	1
50	одно и то же	3	1
51	нам уже приходилось говорить	1	1
52	очень важный момент в	1	1
53	в таком случае это	2	1
54	с которыми имеет дело	1	1
55	одни и те же	5	1
56	до сих пор не	1	1
57	в самом деле если	2	1
58	как мы уже знаем	4	1
59	по отношению к окружающему	1	1
60	не может быть ничего	2	1
61	с точки зрения этого	1	1
62	только с точки зрения	1	1
63	его не касается но	1	1
64	как мы уже сказали	1	1
65	процессы в нервной системе	1	1
66	в самом деле ведь	3	1
67	точки зрения индивидуальной психологии	1	1
68	той социальной группы к	1	1
69	не что иное как	1	1
70	каких бы то ни	4	1
71	по роду своего бытия	1	1
72	самом деле если мы	1	1
73	с точки зрения индивидуальной	1	1
74	в какой степени не	1	1
75	к сохранению и развитию	1	1
76	но теперь мы должны	1	1
77	может быть ничего общего	1	1
78	и по отношению к	1	1
79	что она слагается из	1	1
80	идеологией нет принципиальной границы	1	1
81	друг с другом и	1	1
82	приходит к выводу что	1	1
83	то же время –	1	1
84	в гораздо большей степени	1	1
85	то же время это	1	1
86	или во всяком случае	1	1
87	достигнутого в данный момент	1	1
88	не может быть непосредственно	2	1
89	дело в том что	1	1
90	– очень важный момент	1	1
91	социальной группы к которой	1	1
92	не будет никаких оснований	1	1
93	в коем случае не	1	1
94	а может быть и	1	1
95	– как раз и	1	1
96	сохранению и развитию ее	1	1
97	мы уже указывали что	1	1
98	на первый план выдвигается	1	1
99	в жизни и в	1	1
100	не выходит за пределы	1	1
101	уже приходилось говорить о	1	1
