1	в то же время	14	15
2	но в то же	3	6
3	и в то же	6	6
4	как мы уже сказали	1	3
5	и с другой стороны	2	2
6	и в том и	1	2
7	одно и то же	12	2
8	то же время и	2	2
9	до сих пор не	1	2
10	с точки зрения самого	3	2
11	никогда не может быть	1	2
12	можно прямо сказать что	1	2
13	в то время как	8	2
14	с одной стороны и	4	2
15	уходит своими корнями в	1	2
16	на ту же тему	1	2
17	и в другом случае	1	2
18	в том и в	1	2
19	том и в другом	1	2
20	необходимо иметь в виду	1	1
21	но и в смысле	1	1
22	для нас в данном	1	1
23	и не может избежать	1	1
24	и нет ничего что	1	1
25	не уходит своими корнями	1	1
26	не может находиться в	1	1
27	как одно и то	1	1
28	ту же тему и	1	1
29	то время как поэзия	1	1
30	не с точки зрения	2	1
31	нас в данном случае	1	1
32	привело к тому что	1	1
33	тем не менее в	2	1
34	с той или иной	2	1
35	то с точки зрения	1	1
36	мы имеем в виду	1	1
37	как бы она ни	1	1
38	ни в чем не	2	1
39	бы она ни была	1	1
40	именно в том что	1	1
41	может идти не о	1	1
42	дело в том что	2	1
43	все более и более	1	1
44	не только в смысле	1	1
45	в том что он	1	1
46	рассматривать с точки зрения	1	1
47	и т д если	1	1
48	только один и единственный	1	1
49	в широком смысле но	1	1
50	а в том что	1	1
51	нужно отнести также и	1	1
52	с этой точки зрения	4	1
53	в том что в	1	1
54	на самом же деле	3	1
55	и с точки зрения	1	1
56	одной и той же	5	1
57	в зависимости от характера	1	1
58	бы то ни было	1	1
