786	предками фаза возвращения символическое	1	1
787	существа или зрелище чужой	1	1
788	касается референтной компетенции того	1	1
789	но о том что	2	1
790	чья жизнь достойна сказания	1	1
791	возможности когда мы строим	1	1
792	знания даже будучи порой	1	1
793	о поэтике здесь пока	1	1
794	мира вокруг я героя	2	1
795	умудрение приобретение знаний и	1	1
796	в качестве своего культурно-исторического	1	1
797	его в иной коммуникативный	1	1
798	она определяется картиной мира	1	1
799	уготованной ему позиции но	1	1
800	постулирует адресата занимающего позицию	1	1
801	не предполагается ни столь	1	1
802	монологизированного слова в слове	1	1
803	в смертельно опасном испытании	1	1
804	именовал веком героев бытийная	1	1
805	в основе своей обнаруживает	1	1
806	время жанры существенно связаны	1	1
807	времени данная археосюжетная фаза	1	1
808	случайно напоминает такой органический	1	1
809	сказания это позиция активного	1	1
810	качестве своего культурно-исторического субстрата	1	1
811	притчи иносказательность является своего	1	1
812	в классической работе ю.м	1	1
813	но всегда имплицитно присутствующего	1	1
814	смерти героя или посещения	1	1
815	царем и ставшего мужем	1	1
816	фоне которых акцентируется его	1	1
817	но и невымышленные анекдотические	1	1
818	в рамках современной научной	1	1
819	ним определенные задания реализуют	1	1
820	жанровой схемы и в	1	1
821	они бытуют как слухи	1	1
822	сами по себе они	1	1
823	ситуации общения то синхрония	1	1
824	состоит в смыслополагающей конвенции	1	1
825	всего к ценностной однозначности	1	1
826	и формы высказывания как	1	1
827	коммуникативному статусу тождественно мнению	1	1
828	с еще не развившимся	1	1
829	на мифологическое мышление человека	1	1
830	мире слово сказания еще	1	1
831	есть до известной степени	1	1
832	столь свободным как к	1	1
833	эффективное поведение героя в	1	1
834	мы и сами участвуем	1	1
835	царских детях покидающих свою	1	1
836	рамках современной научной парадигмы	1	1
837	неотличимая от мифа даже	1	1
838	апофегма то есть острота	1	1
839	ориентировано на непосредственную ответную	1	1
840	безответственную передаваемость из уст	1	1
841	стороны субъективной компетентности индивидуального	1	1
842	занять этой уготованной ему	1	1
843	может быть осуществлено только	1	1
844	острота наизнанку глупость неуместность	1	1
845	компетенция жанра при несоответствии	1	1
846	притча повествует не о	1	1
847	анекдота обычно неприемлемо ни	1	1
848	практически неотличимая от мифа	1	1
849	острота или острота наизнанку	1	1
850	прежних родовых связей индивида	1	1
851	передаваемость из уст в	1	1
852	закон собственно и составляющий	1	1
853	не предначертанность судьбы а	1	1
854	смыслов оно стремится к	1	1
855	фольклора являет собой лишь	1	1
856	запрета есть профанация священного	1	1
857	сказать первофеномены жанров в	1	1
858	акт притчевого типа есть	1	1
859	может быть редуцирован комическая	1	1
860	субъекта и формы высказывания	1	1
861	их внутреннюю структуру и	1	1
862	даже в сказке обнаруживается	1	1
863	диалект культуры он предполагает	1	1
864	наизнанку глупость неуместность ошибка	1	1
865	форме например утрата близкого	1	1
866	от жанра высказывания жанр	1	1
867	же обратное влияние со	1	1
868	наконец четвертая фаза преображения	1	1
869	ю.м лотмана происхождение сюжета	1	1
870	проходит стадию умудрения стадию	1	1
871	внутреннюю структуру и все	1	1
872	слово общенародной хвалы или	1	1
873	однако символическая смерть и	1	1
874	власти царя-жреца не от	1	1
875	высказывания > кто говорит	1	1
876	в частности до поединка	1	1
877	общения то синхрония жанра	1	1
878	напротив предполагает как раз	1	1
879	застывшее целое и жанровые	1	1
880	существо рецептивной компетенции жанра	1	1
881	притчевого назидания притча повествует	1	1
882	креативная и рецептивная стороны	1	1
883	элиминирования из нее нарративности	1	1
884	в частности такого рода	1	1
885	центр мира и круговорот	1	1
886	той или иной преемственно	1	1
887	стороны адресата позицию сотворчества	1	1
888	рассказчика не только вымышленные	1	1
889	мы строим свою речь	1	1
890	парадигма инициируемого автором коммуникативного	1	1
891	предполагает хоровой сказание или	1	1
892	компетентности индивидуального речевого замысла	1	1
893	от мастерства рассказчика не	1	1
894	позиции и риторического поведения	1	1
895	есть непосредственно коммуникативными способами	1	1
896	анекдота выбор лексики например	1	1
897	притчи креативная компетенция говорящего	1	1
898	и сами участвуем как	1	1
899	и ставшего мужем царской	1	1
900	героя или посещения им	1	1
901	компетенция анекдота полярно противостоит	1	1
902	поэтому жанры как формы	1	1
903	предел до которого анекдот	1	1
904	статус научной истины соответственно	1	1
905	разрыв или существенное ослабление	1	1
906	место перемена статуса героя	1	1
907	или существенное ослабление прежних	1	1
908	и рецептивная установка адресованности	1	1
909	действующее лицо часто подвергается	1	1
910	курьезное любопытное занимательное неожиданное	1	1
911	репродуктивной компетентностью последняя предполагает	1	1
912	завершения учета слушателя по	1	1
913	кумулятивный сюжет воспитания третью	1	1
914	прежде всего к ценностной	1	1
915	археосюжетная фаза порой гипертрофируется	1	1
916	морализаторскую премудрость притчевого назидания	1	1
917	целое внеязыковое и потому	1	1
918	к тому же обратное	1	1
919	таковы герои сказания или	1	1
920	второе рождение сопровождается возвращением	1	1
921	иной ситуации иным рассказчиком	1	1
922	в какой это существо	1	1
923	внешнего собственно пространственного ухода	1	1
924	премудрость притчевого назидания притча	1	1
925	умудрения стадию пробных искушений	1	1
926	достойна сказания отведена определенная	1	1
927	одной стороны проповедь где	1	1
928	сказание или диалогической анекдот	1	1
929	верификация такого знания означала	1	1
930	сюжетного мышления напротив горизонталь	1	1
931	к индивидуальной жизненной практике	1	1
932	испытаний до вступления в	1	1
933	о действительно необратимом историческом	1	1
934	анекдот рекреативная компетентность предполагающая	1	1
935	оно живет в готовом	1	1
936	не как объекты эстетического	1	1
937	притче о блудном сыне	1	1
938	сказания субъект дискурсии обладает	1	1
939	выбора риторический предел до	1	1
940	множества преданий о царских	1	1
941	что случилось однажды но	1	1
942	претерпевшего к тому же	1	1
943	моделирует ролевую картину мира	1	1
944	предполагающей разрыв или существенное	1	1
945	ван геннепа и в	1	1
946	мы имеем дело не	3	1
947	это парадигма инициируемого автором	1	1
948	которых акцентируется его новое	1	1
949	принципе можно припоминая и	1	1
950	которой притча редуцируется в	1	1
951	ранней традиционной но и	1	1
952	притчевого дискурса случается постоянно	1	1
953	формы построения речевого целого	1	1
954	существенная зависимость анекдота не	1	1
955	традиционной но и позднейшей	1	1
956	нейтральное к языку поэтому	1	1
957	такое перерождение символическое второе	1	1
958	и вторичные идеологические жанры	1	1
959	жанра сказание моделирует ролевую	1	1
960	инфраструктуры не только ранней	1	1
961	в произведении и событие	1	1
962	не признает никакого миропорядка	1	1
963	до вступления в решающую	1	1
964	в этом последнем мы	1	1
965	собственно пространственного ухода в	1	1
966	собственно и составляющий морализаторскую	1	1
967	до адресата авторские инвенции	1	1
968	некую общую четырехфазную модель	1	1
969	одну из модификаций анекдотического	1	1
970	также уходом в себя	1	1
971	всегда имплицитно присутствующего в	1	1
972	позицией предполагающей разрыв или	1	1
973	б.о корман адресата концепт	1	1
974	отвечает на какие-то вопросы	1	1
975	сообщенному знанию как несомненно	1	1
976	авторские инвенции термин классической	1	1
977	событиях общенародной сказание или	1	1
978	древо игравшее особую организующую	1	1
979	трактовали не об однократных	1	1
980	как к содержанию сказания	1	1
981	> в нем звучит	1	1
982	или иной преемственно воспроизводимой	1	1
983	но как субъекты этического	1	1
984	инициации предстает рассказ о	1	1
985	идеологические жанры как формы	1	1
986	новое жизненное качество представленная	1	1
987	предполагает исторически сложившуюся систему	1	1
988	связей в конечном счете	1	1
989	до которого анекдот легко	1	1
990	или частной анекдот жизни	1	1
991	необходимая коммуникативная характеристика того	1	1
992	новелла ночной жанр посрамляющий	1	1
993	как это бывает в	1	1
994	кому рассказывается анекдот рекреативная	1	1
995	иносказательность является своего рода	1	1
996	том что по убеждению	1	1
997	может быть представлена избранничеством	1	1
998	следовательно предметно-смысловые формы междуязычны	1	1
999	отличается в этом отношении	1	1
1000	составляющий морализаторскую премудрость притчевого	1	1
1001	авторитарной притча не предполагает	1	1
1002	залогом воспроизводимости нерушимого миропорядка	1	1
1003	лиминальную пороговую фазу испытания	2	1
1004	иным рассказчиком с иными	1	1
1005	растительностью мировое древо выступало	1	1
1006	осуществляется или преступается не	1	1
1007	не случайно напоминает такой	1	1
1008	непристойность необыкновенное в новелле	1	1
1009	при наложении множества позднейших	1	1
1010	восприятия со стороны адресата	1	1
1011	другой паремия до которой	1	1
1012	карнавального отношения к сообщаемому	1	1
1013	риска в частности до	1	1
1014	обычно неприемлемо ни для	1	1
1015	сказки как правило проходит	1	1
1016	в исконном значении этого	1	1
1017	протосюжету инициации предстает рассказ	1	1
1018	стране мертвых умудрение приобретение	1	1
1019	четырех а не трех	1	1
1020	типа есть монолог в	1	1
1021	сообщает нечто смешное но	1	1
1022	коммуникативного события предносящееся целое	1	1
1023	синхрония жанра это парадигма	1	1
1024	до легкого повреждения или	1	1
1025	выбора все их поступки	1	1
1026	повышающим уровень его жизненной	1	1
1027	субъект объект и адресат	1	1
1028	характеристика того кому рассказывается	1	1
1029	освещении было проведено четкое	1	1
1030	эта широко распространенная в	1	1
1031	сказать что жанр это	1	1
1032	рассказывается анекдот рекреативная компетентность	1	1
1033	выше она названа маской	1	1
1034	общения объединяющая субъекта и	1	1
1035	точными они бытуют как	1	1
1036	способность хранения и передачи	1	1
1037	пробы жизненного поведения в	1	1
1038	то синхрония жанра это	1	1
1039	однозначности и прежде всего	1	1
1040	перед ним определенные задания	1	1
1041	то есть непосредственно коммуникативными	1	1
1042	мира которая своей карнавальной	1	1
1043	композиционным костяком так сказать	1	1
1044	это и позволяет говорить	1	1
1045	разнятся бытийными референтными компетенциями	1	1
1046	их основные параметры соотносимое	1	1
1047	и свершают картина мира	1	1
1048	человека к норме и	1	1
1049	жизненной практике может быть	1	1
1050	современной передаче средствами линейного	1	1
1051	или пишущего постигает неудача	1	1
1052	до поединка а может	1	1
1053	жизненных связей в конечном	1	1
1054	монолог в чистом виде	1	1
1055	и соответствующими коммуникативными компетенциями	1	1
1056	художественной словесности представляются сказание	1	1
1057	с иными подробностями и	1	1
1058	сказание моделирует ролевую картину	1	1
1059	инициации имеет место перемена	1	1
1060	практике может быть осуществлено	1	1
1061	есть принадлежат самой ситуации	1	1
1062	притча редуцируется в случае	1	1
1063	в частности форма авторства	1	1
1064	стороны проповедь где притча	1	1
1065	героя статуса внешнего социального	1	1
1066	повествования составила фиксация однократных	1	1
1067	бахтинский подход к изучению	1	1
1068	предметно-смысловые формы междуязычны интернациональны	1	1
1069	о том что бывает	1	1
1070	компетенция рассказывающего анекдот недостоверное	1	1
1071	социального или особенно в	1	1
1072	как несомненно достоверному и	1	1
1073	священного новелла ночной жанр	1	1
1074	являются изустными то есть	1	1
1075	сообщаемое в нарративном дискурсе	1	1
1076	состоит в том чтобы	1	1
1077	напоминает такой органический процесс	1	1
1078	компетентность восприятия со стороны	1	1
1079	жизни оно исключало необратимость	1	1
1080	может быть определена как	1	1
1081	установка адресованности соотносительная с	1	1
1082	в тэрнера следует обозначить	1	1
1083	сознания однако внутренняя активность	1	1
1084	ее содержание к собственной	1	1
1085	первофеномены жанров в частности	1	1
1086	говоря жанр представляет собой	1	1
1087	в новелле есть нарушение	1	1
1088	яичко личинка куколка имаго	1	1
1089	самозванством а в литературе	1	1
1090	как притчу в принципе	1	1
1091	куста последующих жанровых форм	1	1
1092	и четвертой фаз герой	1	1
1093	паремия до которой притча	1	1
1094	весьма разнородны говорить о	1	1
1095	говорит концепты авторской позиции	1	1
1096	из древнейших этапов становления	1	1
1097	пришел увидел победил или	1	1
1098	широко распространенная в мировом	1	1
1099	и позднейшей оригинальной сюжетики	1	1
1100	в принципе можно припоминая	1	1
1101	бытуют как слухи или	1	1
1102	устного диалога и вторичные	1	1
1103	отношении от притчи современный	1	1
1104	фазы способна решить предыстория	1	1
1105	в притче универсального опыта	1	1
1106	дж фрэзером при рассмотрении	1	1
1107	стороны художественной литературы анекдот	1	1
1108	мастерства рассказчика не только	1	1
1109	в нем определенные возможности	1	1
1110	события мыслилась как необратимая	1	1
1111	лишь одну из модификаций	1	1
1112	здесь как и на	1	1
1113	лотмана происхождение сюжета в	1	1
1114	ответственность свободного выбора в	1	1
1115	сами участвуем как слушатели-читатели	1	1
1116	то что ни на	1	1
1117	есть монолог в чистом	1	1
1118	случилось однажды но о	1	1
1119	слово деритуализовано инициативно личностно	1	1
1120	металингвистический язык диалект культуры	1	1
1121	на поучающего и поучаемого	1	1
1122	о беспрецедентных событиях общенародной	1	1
1123	готовом стабильно дифференцированном и	1	1
1124	компетенции персонажа то она	1	1
1125	и в тэрнера следует	1	1
1126	подробностями и интонациями он	1	1
1127	то она определяется картиной	1	1
1128	при общности складывающейся и	1	1
1129	предполагающая в частности наличие	1	1
1130	знания аналогичному адресату компетентность	1	1
1131	свободным как к содержанию	1	1
1132	навыков взрослой жизни накопленных	1	1
1133	жанра высказывания жанр в	1	1
1134	самой ситуации рассказывания а	1	1
1135	как формы построения речевого	1	1
1136	том что бывает всегда	1	1
1137	нахождения или изобретения говорящего	1	1
1138	конкретным мифологическим системам определяя	1	1
1139	порой фактически точными они	1	1
1140	нечто смешное но обязательно	1	1
1141	аналогии с мировым древом	1	1
1142	той мере в какой	2	1
1143	рассказчика ни для слушателей	1	1
1144	игрового переиначивающего отношения к	1	1
1145	коммуникативный статус знания убеждения	1	1
1146	и в форме индивидуального	1	1
1147	текста позволяющую донести до	1	1
1148	в самом деле не	1	1
1149	речевого замысла говорящего или	1	1
1150	тогда как притчу в	1	1
1151	предваряющие эффективное поведение героя	1	1
1152	высказывания письменные формы их	1	1
1153	сакральный центр мира и	1	1
1154	риторика ролевого обезличенного словарного	1	1
1155	как целого кто говорит	1	1
1156	всего они разнятся бытийными	1	1
1157	мертвых может заостряться до	1	1
1158	на какие-то вопросы то	1	1
1159	тип высказывания реализующий некоторую	1	1
1160	архаичному состоянию общественных отношений	1	1
1161	в полном его составе	1	1
1162	интернациональны в то же	1	1
1163	действительно необратимом историческом событии	1	1
1164	жанр посрамляющий умершее солнце	1	1
1165	сюжет бесконечно репродуцируемых испытаний	1	1
1166	высказывания как целого кто	1	1
1167	времени также уходом в	1	1
1168	истории не претендуют на	1	1
1169	в частности наличие так	1	1
1170	как слухи или сплетни	1	1
1171	поэтике здесь пока еще	1	1
