1	в то время как	1	4
2	одним и тем же	1	3
3	одно и то же	2	3
4	в зависимости от того	1	3
5	в том что в	1	2
6	одна и та же	1	2
7	дело в том что	4	2
8	нам кажется что мы	1	1
9	было бы показать что	1	1
10	но то же самое	1	1
11	с одной стороны и	2	1
12	и проч и проч	1	1
13	ни в чем не	1	1
14	какой бы то ни	1	1
15	можно было бы показать	1	1
16	и в этом смысле	1	1
17	в то же время	1	1
18	мы имеем дело с	1	1
19	что до сих пор	1	1
20	до сих пор не	1	1
21	является то что оно	1	1
22	так же как и	1	1
23	обстоит дело и с	1	1
24	один и тот же	1	1
25	искусства и в частности	1	1
26	о ком идет речь	1	1
27	бы то ни было	3	1
