1	в то же время	14	11
2	и в самом деле	1	4
3	только в том что	1	3
4	состоит в том что	7	3
5	но в то же	2	3
6	дело не только в	1	2
7	в том случае если	1	2
8	не только в том	1	2
9	героя и читателя в	1	2
10	приводит к тому что	1	2
11	автора героя и читателя	1	2
12	одних и тех же	2	2
13	то же самое что	1	2
14	в такой же мере	2	2
15	в конечном счете в	1	1
16	в другом найдя другого	2	1
17	мягким взглядом очень здоровая	1	1
18	обойтись без другого не	1	1
19	белую шею с темной	1	1
20	несмотря на то что	1	1
21	как субъекты этического выбора	1	1
22	и точность словесного выражения	1	1
23	незаместимого места в мире	1	1
24	бы постепенно снята а	1	1
25	добродушная жалостливая барышня с	1	1
26	во времени и пространстве	4	1
27	анекдот конденсируется в остроту	1	1
28	с темной родинкой и	1	1
29	как раз в том	1	1
30	в качестве некоторого я	1	1
31	том что он не	1	1
32	таков что душевная характеристика	1	1
33	напомним в этой связи	1	1
34	снята а так она	1	1
35	собою без другого я	1	1
36	это была тихая добродушная	1	1
37	в себе во взаимоотражении	1	1
38	ее полные розовые щеки	1	1
39	вступает в противоречие с	1	1
40	я не байрон я	1	1
41	недуховность была бы постепенно	1	1
42	и в этом смысле	1	1
43	кротким мягким взглядом очень	1	1
44	но с другой стороны	1	1
45	можно было бы определить	1	1
46	в том числе и	1	1
47	своего незаместимого места в	1	1
48	роли в миропорядке то	1	1
49	о себе как о	1	1
50	другого я должен найти	1	1
51	личности я не могу	1	1
52	а между тем в	1	1
53	тихая добродушная жалостливая барышня	1	1
54	состоит как раз в	1	1
55	мы имеем дело с	5	1
56	не только в рамках	1	1
57	раз в том что	1	1
58	другом найдя другого в	2	1
59	жалостливая барышня с кротким	1	1
60	не может претендовать на	1	1
61	без другого не могу	1	1
62	специфически человеческий способ существования	1	1
63	себя в другом найдя	2	1
64	на мягкую белую шею	1	1
65	есть на самом деле	1	1
66	лишь по отношению к	1	1
67	том и состоит что	1	1
68	и дело не только	1	1
69	совокупности факторов художественного впечатления	2	1
70	стать самим собою без	1	1
71	мы уже говорили о	1	1
72	заключается в том что	2	1
73	ни то ни другое	1	1
74	определений таков что душевная	1	1
75	была тихая добродушная жалостливая	1	1
76	вновь как и в	1	1
77	дамы с собачкой и	1	1
78	я должен найти себя	1	1
79	предстают перед нами не	1	1
80	нами не как объекты	1	1
81	в паремию пословично-афористическую сентенцию	1	1
82	в самом деле в	1	1
83	впервые в русской литературе	1	1
84	могу обойтись без другого	1	1
85	постепенно снята а так	1	1
86	так или иначе в	1	1
87	между повествователем и героем	3	1
88	в том что он	4	1
89	по нашему убеждению повести	1	1
90	должен найти себя в	1	1
91	розовые щеки на мягкую	1	1
92	с кротким мягким взглядом	1	1
93	я не могу обойтись	1	1
94	в том и состоит	1	1
95	с самим собою в	1	1
96	которому казалось бы место	1	1
97	и дело здесь не	1	1
98	во взаимоотражении во взаимоприятии	1	1
99	при таком взгляде на	1	1
100	и содержит в себе	1	1
101	перед нами своего рода	1	1
102	его недуховность была бы	1	1
103	была бы постепенно снята	1	1
104	притча в паремию пословично-афористическую	1	1
105	и в этом случае	1	1
106	не могу стать самим	1	1
107	другого не могу стать	1	1
108	а притча в паремию	1	1
109	самим собою без другого	1	1
110	без другого я должен	1	1
111	нет я не байрон	1	1
112	представляет собой один из	2	1
113	на ее полные розовые	1	1
114	не байрон я другой	1	1
115	другого в себе во	1	1
116	щеки на мягкую белую	1	1
117	лишь в том случае	1	1
118	полные розовые щеки на	1	1
119	себе во взаимоотражении во	1	1
120	не могу обойтись без	1	1
121	барышня с кротким мягким	1	1
122	и того и другого	2	1
123	дело в том что	3	1
124	в полном соответствии с	2	1
125	не в состоянии заменить	1	1
126	и состоит что он	1	1
127	в самом деле не	1	1
128	так и не наступает	1	1
129	найдя другого в себе	2	1
130	на самом же деле	1	1
131	одна и та же	1	1
132	с этой точки зрения	2	1
133	могу стать самим собою	1	1
134	но как субъекты этического	1	1
135	упускать из виду что	1	1
136	шею с темной родинкой	1	1
137	почти то же самое	1	1
138	перед нами не как	1	1
139	не в том что	1	1
140	мягкую белую шею с	1	1
141	не будем забывать что	1	1
142	и к себе самому	1	1
143	а так она подхваченная	1	1
144	найти себя в другом	2	1
145	глядя на ее полные	1	1
