1	в то же время	20	14
2	но в то же	3	6
3	дело в том что	1	4
4	на самом же деле	3	4
5	в связи с этим	5	3
6	и в то же	6	3
7	в том числе и	3	3
8	нужно сказать что и	1	2
9	дело здесь не в	1	2
10	как и во всех	1	2
11	жизни и прежде всего	1	2
12	и с точки зрения	2	2
13	бы нелепо думать что	1	1
14	но это единство не	1	1
15	это достигается тем что	1	1
16	с другой стороны в	1	1
17	с одной стороны и	5	1
18	может быть и речи	3	1
19	не может быть конечно	1	1
20	то же время в	1	1
21	нами в предыдущей главе	1	1
22	ни в коем случае	1	1
23	а в связи с	2	1
24	но вместе с тем	1	1
25	одного и того же	1	1
26	и в этой области	1	1
27	мы уже знаем что	3	1
28	но в это время	1	1
29	ни в чем не	1	1
30	то же время и	2	1
31	один и тот же	3	1
32	не только в искусстве	1	1
33	большей или меньшей степени	1	1
34	в огромном большинстве случаев	1	1
35	мы можем сказать что	1	1
36	в этом отношении он	1	1
37	нам в корне неверным	1	1
38	не имеет никакого отношения	1	1
39	и в общем не	1	1
40	не что иное как	1	1
41	вместе с тем и	3	1
42	с начала и до	3	1
43	одной и той же	1	1
44	как мы видели совершенно	1	1
45	но и с точки	1	1
46	ни в истории литературы	1	1
47	в одной из своих	2	1
48	в этом отношении очень	2	1
49	если мы обратимся к	1	1
50	не может быть и	4	1
51	нет и не может	4	1
52	в том что это	1	1
53	и не может быть	7	1
54	к одной и той	1	1
55	начала и до конца	3	1
56	в большей или меньшей	1	1
57	человек не боится мира	1	1
58	оказывает определяющее влияние и	1	1
59	в искусстве и в	1	1
60	одно и то же	1	1
61	определяющее влияние и на	1	1
62	было бы нелепо думать	1	1
63	есть не что иное	1	1
64	мы уже говорили что	1	1
