1	в то же время	2	11
2	и в самом деле	1	4
3	к тому что он	2	4
4	только в том что	8	3
5	состоит в том что	17	3
6	о том что в	2	3
7	в тот момент когда	4	3
8	в связи с этим	3	2
9	в том случае если	2	2
10	и в то же	1	2
11	по отношению к другому	1	2
12	по отношению к личности	1	2
13	приводит к тому что	5	2
14	между внешним и внутренним	1	2
15	одних и тех же	1	2
16	то же самое что	7	2
17	но тем не менее	2	2
18	в такой же мере	10	2
19	же как и все	1	1
20	в том смысле как	1	1
21	в известном смысле можно	3	1
22	только для того чтобы	2	1
23	что мы узнаем из	1	1
24	смысле можно сказать что	4	1
25	так можно было бы	2	1
26	несмотря на то что	4	1
27	при этом не только	1	1
28	с одной стороны и	10	1
29	как раз и состоит	1	1
30	известном смысле можно сказать	3	1
31	тем не менее едва	1	1
32	а для того чтобы	1	1
33	не чем иным как	3	1
34	как раз в том	1	1
35	нам о том как	1	1
36	прежде всего в том	2	1
37	том что он не	2	1
38	не только потому что	1	1
39	ни в чем не	1	1
40	вступает в противоречие с	1	1
41	и в этом смысле	1	1
42	то можно было бы	1	1
43	отличаются друг от друга	2	1
44	в этом и состоит	1	1
45	но с другой стороны	1	1
46	в том что в	8	1
47	в том числе и	10	1
48	опять как и в	1	1
49	в том что она	3	1
50	состоит как раз в	1	1
51	мы имеем дело с	2	1
52	так и по отношению	1	1
53	в этом отношении она	2	1
54	то и другое в	1	1
55	точно так же как	6	1
56	раз в том что	1	1
57	в первую очередь на	1	1
58	раз и состоит в	1	1
59	дело здесь не в	1	1
60	заключается в том что	43	1
61	она не может быть	2	1
62	с точки зрения развития	2	1
63	что она не может	1	1
64	этом не только не	1	1
65	то что принято называть	1	1
66	убеждает нас в том	2	1
67	в том что он	8	1
68	так же как и	16	1
69	можно было бы подумать	1	1
70	и по отношению к	2	1
71	в один ряд с	2	1
72	том случае если бы	1	1
73	и то и другое	1	1
74	то же время не	1	1
75	в этом и заключается	5	1
76	всего в том что	2	1
77	наконец в заключительной главе	1	1
78	как по отношению к	1	1
79	едва ли может быть	1	1
80	не менее едва ли	1	1
81	в гораздо большей степени	2	1
82	представляет собой один из	1	1
83	том смысле как мы	1	1
84	если можно так выразиться	2	1
85	дело в том что	3	1
86	только о том что	1	1
87	в равной мере и	2	1
88	на самом же деле	2	1
89	одна и та же	3	1
90	с этой точки зрения	16	1
91	и в этом отношении	1	1
92	между внешней и внутренней	1	1
93	было бы подумать что	1	1
94	все более и более	8	1
95	не обращая внимания на	1	1
96	не потому что он	2	1
