1	в том числе и	1	13
2	в то же время	8	8
3	и не может быть	2	5
4	и в то же	2	3
5	до сих пор еще	1	2
6	дело в том что	3	2
7	не было и не	1	1
8	смысле можно сказать что	2	1
9	и с точки зрения	1	1
10	состоит в том что	6	1
11	к себе и к	1	1
12	одним и тем же	1	1
13	к себе самому и	1	1
14	в том что на	1	1
15	мы имеем дело с	5	1
16	один и тот же	1	1
17	по отношению к ним	2	1
18	и не могло быть	1	1
19	не что иное как	1	1
20	все то что было	1	1
21	в той или иной	2	1
22	по мере того как	1	1
23	было и не могло	1	1
24	одно и то же	2	1
25	что с точки зрения	1	1
26	с большей или меньшей	1	1
27	дистанцию по отношению к	1	1
28	есть не что иное	1	1
