1	в то время как	4	6
2	ни от чего не	1	5
3	с этой точки зрения	1	4
4	одной и той же	1	4
5	в то же время	18	3
6	одна и та же	2	3
7	но это значит что	1	2
8	и ни от чего	1	2
9	и в то же	8	2
10	одно и то же	5	2
11	одних и тех же	4	2
12	и в этом мире	1	1
13	в связи с этим	4	1
14	с одной стороны и	5	1
15	но в то же	3	1
16	в том что они	1	1
17	мы имеем в виду	5	1
18	ни в чем не	3	1
19	что в основе их	1	1
20	в том что в	1	1
21	и пр и пр	1	1
22	в том что все	1	1
23	друг от друга и	2	1
24	можно прямо сказать что	3	1
25	как мы уже сказали	6	1
26	все это не имеет	1	1
27	и т д он	1	1
28	до сих пор говорили	1	1
29	как мы это уже	1	1
30	жизнь со всеми ее	1	1
31	и в частности от	1	1
32	мы вовсе не имеем	1	1
33	лежит и в основе	1	1
34	мы до сих пор	1	1
35	как и все прочие	1	1
36	так же как и	3	1
