1	в той или иной	1	7
2	не что иное как	1	6
3	или по крайней мере	1	6
4	есть не что иное	1	6
5	бы то ни было	2	4
6	заключается в том что	1	4
7	тем не менее в	1	3
8	одно и то же	3	3
9	той или иной мере	1	3
10	и в этом случае	1	3
11	дело в том что	5	3
12	ни в чем не	1	2
13	и в то же	2	2
14	чего бы то ни	1	2
15	не имеют никакого отношения	1	2
16	то же самое можно	4	2
17	в том что вся	1	2
18	в том или ином	1	2
19	все дело в том	1	1
20	одной и той же	2	1
21	только в том что	1	1
22	с одной стороны и	5	1
23	же самое можно сказать	4	1
24	в том что они	1	1
25	по крайней мере в	1	1
26	не одно и то	1	1
27	с той или иной	2	1
28	выхожу один я на	2	1
29	одним и тем же	2	1
30	можно даже сказать что	1	1
31	в том что всякое	1	1
32	содержит в себе как	1	1
33	в данном случае мы	1	1
34	в тех случаях когда	2	1
35	в войне и мире	1	1
36	тем самым он не	1	1
37	подобно тому как мы	1	1
38	с другой стороны это	1	1
39	свидетельствует о том что	1	1
40	тем не менее первый	1	1
41	отступает на второй план	1	1
42	то это не есть	1	1
43	то есть то что	1	1
44	в том числе и	3	1
45	в том что он	1	1
46	одного и того же	4	1
47	ни о чем не	2	1
48	и потому как бы	1	1
49	здесь как и в	1	1
50	и прежде всего с	1	1
51	один я на дорогу	2	1
52	к тому или иному	1	1
53	в том что и	1	1
54	но на этот раз	1	1
55	той или иной области	1	1
