1	состоит в том что	3	4
2	в то же время	1	4
3	и тем не менее	2	4
4	в том случае если	2	3
5	и т д и	1	3
6	в том что он	1	3
7	с этой точки зрения	1	3
8	не что иное как	2	2
9	и т д это	1	2
10	можно было бы сказать	1	2
11	уже не может быть	1	2
12	в тех случаях когда	2	2
13	только в том случае	1	2
14	хотя и здесь несомненно	1	1
15	в собственном смысле слова	3	1
16	ниже мы увидим что	1	1
17	в этом случае он	1	1
18	было бы считать вообще	1	1
19	одно и то же	1	1
20	то во всяком случае	1	1
21	тех случаях когда в	1	1
22	можно себе представить что	1	1
23	во всех этих случаях	1	1
24	и т д все	1	1
25	ответить на этот вопрос	1	1
26	лишь после того как	1	1
27	все более и более	1	1
28	и т д словом	1	1
29	которые хотя и не	2	1
30	это еще не все	1	1
31	и пр таким образом	1	1
32	и т д а	2	1
33	бы то ни было	2	1
34	с тех пор как	1	1
35	есть не что иное	1	1
