1	состоит в том что	3	7
2	с этой точки зрения	1	7
3	один и тот же	1	5
4	в то время как	3	4
5	в тот момент когда	1	4
6	в том что он	1	3
7	все более и более	1	3
8	прежде чем перейти к	1	2
9	начинается с того что	2	2
10	не что иное как	2	2
11	связи функций между собой	2	2
12	есть не что иное	1	2
13	видим таким образом что	1	1
14	сомневаться в том что	1	1
15	это не значит что	2	1
16	вопрос о том как	1	1
17	в собственном смысле слова	3	1
18	мы видим таким образом	1	1
19	было бы сказать что	1	1
20	на то что в	1	1
21	одно и то же	1	1
22	в тех случаях когда	2	1
23	мы постараемся показать что	1	1
24	ответить на этот вопрос	1	1
25	образом мы видим что	4	1
26	можно было бы сказать	1	1
27	в связи с этим	4	1
28	но как мы уже	1	1
29	указанием на то что	1	1
30	этой точки зрения совершенно	1	1
31	которые не могут быть	1	1
32	таким образом мы видим	4	1
33	бы то ни было	2	1
34	мы видим что в	1	1
