1	заключается в том что	3	7
2	в то время как	1	6
3	одной и той же	1	5
4	с этой точки зрения	1	5
5	с психологической точки зрения	1	3
6	то что у него	1	3
7	несмотря на то что	2	2
8	в том случае если	4	2
9	только в том случае	1	2
10	представление о том что	1	2
11	же самое что и	1	2
12	то же самое что	1	2
13	в то же время	2	2
14	и в конце концов	1	1
15	что в настоящее время	1	1
16	не играет никакой роли	1	1
17	мы указывали на то	1	1
18	а между тем в	1	1
19	состоит в том что	1	1
20	нечего и говорить что	3	1
21	в широком смысле слова	1	1
22	о том что он	1	1
23	но вместе с тем	2	1
24	одно и то же	1	1
25	таким образом мы видим	1	1
26	в том виде как	1	1
27	в том что все	1	1
28	приводит к тому что	1	1
29	вместе с тем и	1	1
30	а потому не может	1	1
31	только тогда когда оно	1	1
32	том виде как оно	1	1
33	в таком же виде	1	1
34	для того чтобы проверить	1	1
35	в том числе и	1	1
36	одного и того же	3	1
37	из поколения в поколение	1	1
38	одному и тому же	1	1
39	в том что при	1	1
40	том случае если бы	1	1
41	что же касается до	2	1
42	но для того чтобы	1	1
43	указывали на то что	1	1
44	совершенно так же как	3	1
45	совершенно в таком же	1	1
46	и не может быть	1	1
47	таким образом и на	1	1
48	образом мы видим что	1	1
49	вступить в противоречие с	1	1
50	дело в том что	1	1
51	так же трудно как	1	1
52	в том что он	1	1
53	на все эти вопросы	1	1
54	и для того чтобы	1	1
55	таким образом оказывается что	1	1
56	не в том что	1	1
57	в том или ином	1	1
58	бы то ни было	3	1
59	что это действительно так	1	1
60	и более или менее	1	1
