1	одно и то же	3	8
2	в то же время	7	7
3	не что иное как	1	4
4	и в то же	2	3
5	с одной стороны и	1	3
6	есть не что иное	1	3
7	как один из видов	1	2
8	как более или менее	1	2
9	в связи с этим	1	2
10	иметь в виду что	1	2
11	не сама по себе	1	1
12	всегда так или иначе	1	1
13	том или ином отношении	1	1
14	не содержит в себе	1	1
15	то или иное логическое	1	1
16	ни в коем случае	2	1
17	в том что она	1	1
18	точно так же как	1	1
19	приводит к тому что	2	1
20	в том что он	2	1
21	но в то же	1	1
22	но в силу своей	1	1
23	сама по себе а	1	1
24	в коем случае не	2	1
