1	в то же время	14	7
2	одно и то же	12	5
3	одной и той же	5	4
4	в связи с этим	4	2
5	ни к чему не	2	2
6	все больше и больше	1	2
7	и в то же	6	2
8	не что иное как	18	2
9	но в то же	3	2
10	то что мы называем	1	2
11	есть не что иное	11	2
12	будем говорить не о	1	1
13	с их точки зрения	1	1
14	само по себе не	1	1
15	ту или иную степень	1	1
16	от тех или иных	1	1
17	мы не знаем как	1	1
18	и в голову не	1	1
19	этом мы будем говорить	1	1
20	на ту или иную	1	1
21	то же время и	2	1
22	не забудем что мы	1	1
23	это дает нам возможность	1	1
24	между внутренним и внешним	1	1
25	не может сказать ни	1	1
26	об этом мы будем	1	1
27	и ни от чего	2	1
28	одна и та же	8	1
29	у нас есть такие	1	1
30	как только мы начинаем	1	1
31	то же самое и	1	1
32	но то что мы	1	1
33	одному и тому же	1	1
34	и есть не что	1	1
35	одних и тех же	3	1
36	и не может быть	1	1
37	так а не иначе	1	1
38	к одному и тому	1	1
39	мы будем говорить не	1	1
40	если мы будем говорить	1	1
41	в одних и тех	1	1
42	и тех же словах	1	1
43	мы как раз и	1	1
44	в жизни и в	1	1
45	только тогда когда мы	1	1
46	иметь в виду что	4	1
47	по существу ничем не	1	1
