1	и тем не менее	5	8
2	ни в каком случае	4	6
3	взятая сама по себе	1	6
4	не что иное как	12	5
5	и уж тем более	1	5
6	есть не что иное	8	5
7	и т д и	11	4
8	в то же самое	1	4
9	то же самое время	1	4
10	или по крайней мере	2	4
11	в каком случае не	2	4
12	до сих пор мы	1	3
13	свидетельствует о том что	3	3
14	дело в том что	4	3
15	каком случае не может	1	3
16	указывает на то что	3	3
17	можно ли сказать что	3	3
18	т д и т	10	3
19	вовсе не есть только	1	2
20	по самому своему смыслу	1	2
21	не только не мешает	1	2
22	с одной стороны и	1	2
23	по крайней мере в	2	2
24	если мы скажем что	1	2
25	при современном состоянии науки	1	2
26	в этом смысле и	1	2
27	д и т д	10	2
28	а тем не менее	3	2
29	случае не может считаться	1	2
30	то это значит что	3	2
31	заключается в том что	2	2
32	что бы то ни	1	2
33	также и то что	1	2
34	когда мы говорим что	1	2
35	в то время как	4	2
36	одного и того же	1	2
37	в себе не содержит	1	2
38	с самого же начала	1	1
39	с тем или другим	1	1
40	одной стороны и с	1	1
41	имеем дело не с	2	1
42	мы еще не знаем	1	1
43	по себе отнюдь не	1	1
44	взятый сам по себе	1	1
45	ни при каких условиях	1	1
46	это не значит что	1	1
47	не только то что	1	1
48	есть ни только сущность	1	1
49	еще ничего не говорит	1	1
50	тоже никуда не годится	1	1
51	это такой смысл который	1	1
52	уже одно то что	1	1
53	о том о чем	1	1
54	это значит что мы	4	1
55	не только потому что	1	1
56	и в то же	3	1
57	можно только тогда когда	1	1
58	не только понятие но	1	1
59	и с другой стороны	1	1
60	и даже больше того	1	1
61	одно и то же	5	1
62	не есть она сама	2	1
63	и следовательно вообще не	1	1
64	только на то что	1	1
65	свой собственный смысл и	1	1
66	только и возможно при	1	1
67	тем не менее сущность	1	1
68	еще и потому что	1	1
69	но еще и потому	1	1
70	мы говорили о смысле	1	1
71	а это значит что	1	1
72	один и тот же	1	1
73	она содержит в себе	1	1
74	то что не есть	2	1
75	от самой вещи и	1	1
76	себе отнюдь не есть	1	1
77	если бы оно было	1	1
78	не может быть никакого	2	1
79	никак нельзя сказать что	1	1
80	пусть хотя бы и	1	1
81	вещь есть именно вещь	1	1
82	да и то это	1	1
83	и в самом деле	1	1
84	без труда заметим что	1	1
85	ни то ни другое	1	1
86	это совершенно не важно	1	1
87	это значит не только	1	1
88	значит ли это что	4	1
89	ни только сущность ни	1	1
90	не есть ни только	2	1
91	не есть ни просто	2	1
92	сущность ни только явление	1	1
93	то что он обозначает	1	1
94	мы без труда заметим	1	1
95	говорили о смысле вещи	1	1
96	мы должны сказать что	1	1
97	есть ни то ни	1	1
98	т д все это	1	1
99	мы имеем дело не	2	1
100	предстают перед нами как	1	1
101	не есть ни то	1	1
102	не может не быть	1	1
103	и возможно при помощи	1	1
104	только сущность ни только	1	1
105	не только не есть	1	1
106	уж во всяком случае	1	1
107	но раз уж мы	1	1
108	указание на то что	1	1
109	но в то же	1	1
110	каком случае не есть	1	1
111	на самом же деле	1	1
112	и т д все	1	1
113	ничего не говорит о	1	1
114	и в этом отношении	1	1
115	но даже и в	1	1
116	имеют свой собственный смысл	1	1
117	есть то что не	1	1
118	только один из моментов	1	1
119	можно сказать даже больше	2	1
120	относится к смысловой сфере	1	1
121	и должно быть в	1	1
