1	в то же время	2	6
2	не трудно видеть что	1	5
3	в широком смысле слова	1	4
4	дело в том что	1	3
5	одной и той же	1	2
6	состоит в том что	1	2
7	одно и то же	1	2
8	одного и того же	3	2
9	заключается в том что	3	2
10	то же самое что	1	2
11	с этой точки зрения	1	2
12	в том или ином	1	2
13	и в конце концов	1	1
14	же самое что и	1	1
15	в том виде в	1	1
16	не говоря уже о	1	1
17	разница лишь в том	1	1
18	в том же направлении	1	1
19	но вместе с тем	2	1
20	но с другой стороны	1	1
21	кто так или иначе	1	1
22	и в целом ряде	1	1
23	то для того чтобы	1	1
24	также и то что	1	1
25	что с течением времени	1	1
26	то что входит в	1	1
27	в нем не осталось	1	1
28	в целом ряде других	1	1
29	представление о том что	1	1
30	может быть и не	1	1
31	лишь в том что	3	1
32	говоря уже о том	1	1
33	уже и без того	1	1
34	для того чтобы быть	2	1
35	в том что он	1	1
36	в том виде как	1	1
37	и для того чтобы	1	1
38	уже о том что	1	1
39	бы то ни было	3	1
40	идет речь в общем	1	1
