1	в то же время	4	6
2	и т д но	1	5
3	не что иное как	12	5
4	с одной стороны и	1	3
5	и тем не менее	5	3
6	и в самом деле	1	3
7	дело в том что	4	3
8	но в то же	1	3
9	есть не что иное	8	3
10	одно и то же	5	2
11	одного и того же	1	2
12	заключается в том что	2	2
13	и т д а	1	2
14	и т д все	1	2
15	с этой точки зрения	4	2
16	и т д в	1	2
17	в одном и том	1	1
18	так как она есть	1	1
19	было бы сказать что	2	1
20	это значит не только	1	1
21	и не потому что	1	1
22	в этом смысле и	1	1
23	и как раз в	1	1
24	и т д таким	1	1
25	еще и потому что	1	1
26	и т д и	11	1
27	в чем же отличие	1	1
28	если бы оно было	1	1
29	и в этом отношении	1	1
30	как та или иная	1	1
31	другой стороны как это	1	1
32	также и то что	1	1
33	какой бы то ни	1	1
34	все же это не	1	1
35	одном и том же	1	1
36	ответ на вопрос о	1	1
37	в том смысле что	1	1
38	т д таким образом	1	1
39	и т д словом	1	1
40	только в том что	1	1
41	с другой стороны как	1	1
42	т д все это	1	1
43	и т д хотя	1	1
44	может быть и речи	1	1
45	т е не только	1	1
46	в том что он	2	1
47	не может быть и	1	1
48	и здесь как и	1	1
49	заключается в том чтобы	1	1
50	бы то ни было	12	1
