N	4gram	Tiupa_Anal	Hudozhes
407	как упорядоченная последовательность медленных	1	1
408	художник вследствие этого словами	1	1
409	обыденной внехудожественной действительности приобщение	1	1
410	всю субъектную организацию литературного	1	1
411	подводит некий общий знаменатель	1	1
412	обобщения могущие иметь место	1	1
413	не разложимое а в	1	1
414	о мире и жизни	1	1
415	личность является таким я-в-мире	1	1
416	той или иной форме	1	1
417	все что может или	1	1
418	б построение фразы выбор	1	1
419	менее насыщенный деталями кадр	1	1
420	полные розовые щеки на	1	1
421	слияние пространственных и временных	1	1
422	непосредственно к внутреннему зрению	1	1
423	> мы встречаем его	1	1
424	момент нечто движущееся изменчивое	1	1
425	в принципе недоступна между	1	1
426	под все прочие его	1	1
427	в своем составе столько	1	1
428	вдруг заслоняется крупным планом	1	1
429	событий в проекции текста	1	1
430	центра периферии верха низа	1	1
431	организацию литературного произведения в	1	1
432	внутреннее единство духовного я	1	1
433	состоит в соотносительности слов	1	1
434	сосредоточенное в конечном счете	1	1
435	существования предметом такого знания	1	1
436	собственно же художественное знание	1	1
437	абзацы далеко не всякий	1	1
438	являются наиболее генерализованные кругозоры	1	1
439	обращена непосредственно к внутреннему	1	1
440	первостепенная проблема субъектной организации	1	1
441	акта в отличие от	1	1
442	значимы при этом особенно	1	1
443	зачерпнуть тем общее всем	1	1
444	кротким мягким взглядом очень	1	1
445	длиной ритмических рядов измеряемой	1	1
446	не только такие специфические	1	1
447	химическом соединении с художественной	1	1
448	и души личности более	1	1
449	отношений личности к своему	1	1
450	своей биографической жизнью человека	1	1
451	в общеязыковом отношении художественному	1	1
452	мире и жизни однако	1	1
453	психологические социальные политические входят	1	1
454	голосами то ритм представляет	1	1
455	материала литературы как искусства	1	1
456	внешнего внутреннего центра периферии	1	1
457	верха низа левого правого	1	1
458	его полюсами предмет созерцания	1	1
459	соразмерных отрезков звучания ритмика	1	1
460	клаузулы и формирующие тем	1	1
461	также употребленных при этом	1	1
462	автору приписано быть не	1	1
463	речи такова специфика самого	1	1
464	последовательно осуществлено и введено	1	1
465	членения а также строфы	1	1
466	тем самым интонационные оттенки	1	1
467	внешнем мире и составляет	1	1
468	или противопоставлены в произведении	1	1
469	смыслосообразно скомпонованное из речений	1	1
470	отношении ибо и в	1	1
471	в составе персонажей появление	1	1
472	тот что даже в	1	1
473	в которую облекается в	1	1
474	внутреннего личностного присутствия во	1	1
475	какому-нибудь объекту речи такова	1	1
476	как говорит и объектной	1	1
477	не в самом наличии	1	1
478	а также употребленных при	1	1
479	ритм является фундаментом всей	1	1
480	отдельные слова не разложимое	1	1
481	значима имеющая порой место	1	1
482	концовки клаузулы и формирующие	1	1
483	внутреннего я во внешнем	2	1
484	место слияние пространственных и	1	1
485	рода обогащает наш духовный	1	1
486	разнообразные в частности научные	1	1
487	нечто движущееся изменчивое текучее	1	1
488	взглядом очень здоровая порядок	1	1
489	число композиционных субъектов высказывания	1	1
490	числе и трагическое есть	1	1
491	по отдельности автору приписано	1	1
492	что из нас самих	1	1
493	неспецифичны собственно же художественное	1	1
494	говорится и о чём	1	1
495	лишь в химическом соединении	1	1
496	наше читательское внимание не	1	1
497	самые разнообразные в частности	1	1
498	он состоит в соотносительности	1	1
499	столь же значима имеющая	1	1
500	числом слогов между двумя	1	1
501	текста поскольку подводит некий	1	1
502	объектных деталей а также	1	1
503	или пожелает представить себе	1	1
504	ритмического ряда тем выше	1	1
505	художественного содержания лишь в	1	1
506	граница двух соседних эпизодов	1	1
507	стилистике здесь также может	1	1
508	только не умел высказать	1	1
509	всеохватывающей своей широте на	1	1
510	в событии художественного творчества	1	1
511	особенно внешних начало и	1	1
512	соотносительности стилистико-речевую определенность собственный	1	1
513	корманом объектную и субъектную	1	1
514	некую систему голосов нормативная	1	1
515	виду не только такие	1	1
516	приписано быть не может	1	1
517	творческого акта в отличие	1	1
518	употребленных при этом синтаксических	1	1
519	себя свою душу чем	1	1
520	интересно всем потому что	1	1
521	принадлежит только целое текста	1	1
522	логическое отношение между ними	1	1
523	к иного рода стилистике	1	1
524	в пределах тех или	1	1
525	универсально родственно всем любая	1	1
526	текстовых показателей а выбор	1	1
527	обладают некое событие индивидуальный	1	1
528	тексты способны запечатлевать самые	1	1
529	последовательного наращивания текста наиболее	1	1
530	текста смыслосообразно скомпонованное из	1	1
531	бы не затрагивая хода	1	1
532	внешних начало и конец	1	1
533	на отдельные слова не	1	1
534	что иное как организация	1	1
535	упорядоченного движения бенвенист ритм	1	1
536	событие индивидуальный характер поступок	1	1
537	более поверхностные психологические социальные	1	1
538	углом по отношению к	1	1
539	текста между несколькими голосами	1	1
540	определенных языковых стилей социальных	1	1
541	организации художественного произведения обнаруживается	1	1
542	также может приобретать статус	1	1
543	принадлежит какому-нибудь речевому субъекту	1	1
544	стержень художественного восприятия все	1	1
545	нормативная литературная речь выступая	1	1
546	читаем это была тихая	1	1
547	состоит в нелингвистической упорядоченности	1	1
548	обозначает ту форму в	1	1
549	делает его речевой строй	1	1
550	смена субъекта речи кто	1	1
551	подчеркивал м.м бахтин дело	1	1
552	чем произведение оригинальнее тем	1	1
553	оригинальнее тем оно универсальнее	1	1
554	своего рода субъектной детализации	1	1
555	щеки на мягкую белую	1	1
556	крупные членения а также	1	1
557	текста абзац знаменующий паузу	1	1
558	голосов сколько диалогически соотнесенных	1	1
559	которую облекается в данный	1	1
560	говорит и объектной что	1	1
561	той или иной эстетической	2	1
562	ни убавить ни изменить	1	1
563	познанию тайна внутреннего я	1	1
564	лексических синтаксических и фонологических	1	1
565	душу чем глубже зачерпнуть	1	1
566	восприятию задана как более	1	1
567	к знанию такого рода	1	1
568	движений текста наиболее значимы	1	1
569	рядов измеряемой числом слогов	1	1
570	сдвиг текста абзац знаменующий	1	1
571	и быстрых движений бенвенист	1	1
572	того личность как внутреннее	1	1
573	представленных в тексте может	1	1
574	быть не может всякое	1	1
575	если говорить о прозе	1	1
576	отношению к иного рода	1	1
577	т.п глоссализация текста делает	1	1
578	характеристика душечки постепенно углубляемая	1	1
579	детализирует их создает эффект	1	1
580	адресата к какому-нибудь объекту	1	1
581	как это происходит в	1	1
582	личности более того личность	1	1
583	в субъектной организации художественного	1	1
584	всякий сдвиг текста абзац	1	1
585	принципе недоступна между тем	1	1
586	недвусмысленно встречается таким образом	1	1
587	или движется один отдельный	1	1
588	в данный момент нечто	1	1
589	всем любая личность является	1	1
590	слой факторов художественного впечатления	1	1
591	этом особенно если говорить	1	1
592	языковых нормативов актуальных для	1	1
593	времени и в действия	1	1
594	только мы родственные ему	1	1
595	состав художественного содержания лишь	1	1
596	деталями кадр внутреннего зрения	1	1
597	как ценностного центра этого	2	1
598	очевидная граница между двумя	1	1
599	в произведении искусства но	1	1
600	в том случае если	1	1
601	простых текстовых показателей а	1	1
602	я уникально и одновременно	1	1
603	а в том под	1	1
604	это была тихая добродушная	1	1
605	но и души личности	1	1
606	читателю ракурс видения в	1	1
607	в химическом соединении с	1	1
608	человека но мы встречаемся	1	1
609	также строфы абзацы и	1	1
610	примет в осмысленном и	1	1
611	в рассказе чехова душечка	1	1
612	принципом упорядоченного движения бенвенист	1	1
613	раздельно и сочетаться подобно	1	1
614	таков что душевная характеристика	1	1
615	быстрых движений бенвенист ритм	1	1
616	образующие ритмические зачины анакрусы	1	1
617	последний получает вследствие этой	1	1
618	может или пожелает представить	1	1
619	самоопределение к ролевому сверх-я	1	1
620	духовного я есть высшая	1	1
621	этого словами гегеля духовная	1	1
622	текста делает его речевой	1	1
623	белую шею с темной	1	1
624	ритмических рядов измеряемой числом	1	1
625	обращен к интимному самопониманию	1	1
626	иное как организация ментального	1	1
627	актуализировано на основе весьма	1	1
628	как уже говорилось выше	1	1
629	иных языковых нормативов актуальных	1	1
630	и более крупные членения	1	1
631	как живущего своей биографической	1	1
632	ее никто не решает	1	1
633	субъектной организации литературного произведения	1	1
634	конечном счете искусство в	1	1
635	трех фундаментальных отношений личности	1	1
636	только целостность тела вещи	1	1
637	более того личность как	1	1
638	временных примет в осмысленном	1	1
639	в таком случае это	1	1
640	жалостливая барышня с кротким	1	1
641	я героя как ценностного	2	1
642	и нераздельными его полюсами	1	1
643	осмысленном и конкретном целом	1	1
644	высказывания смена субъекта речи	1	1
645	одновременно универсально родственно всем	1	1
646	может быть актуализировано на	1	1
647	вследствие этой соотносительности стилистико-речевую	1	1
648	иное логическое отношение между	1	1
649	действительности приобщение к знанию	1	1
650	творцом и в самом	1	1
651	знанию такого рода обогащает	1	1
652	произведения как живущего своей	1	1
653	о жизни по всеохватывающей	1	1
654	тайна внутреннего я ядра	1	1
655	тексту слой факторов художественного	1	1
656	и взаимодействиях с объектной	1	1
657	и более поверхностные психологические	1	1
658	наиболее значимы при этом	1	1
659	нераздельными его полюсами предмет	1	1
660	ее полные розовые щеки	1	1
661	времени высказывания и соответственно	1	1
662	к интимному самопониманию всех	1	1
663	образом характеризует говорящего иначе	1	1
664	задаваемый читателю ракурс видения	1	1
665	дискурса состоит в том	1	1
666	а также строфы абзацы	1	1
667	места б времени и	1	1
668	пределами этой субсистемы художественных	1	1
669	субъектной организации художественного произведения	1	1
670	а в то же	2	1
671	высшая форма целостности доступной	1	1
672	мира вокруг я героя	2	1
673	жизни по всеохватывающей своей	1	1
674	и неизбыточность явлений между	1	1
675	м.м бахтин дело не	1	1
676	с творцом и в	1	1
677	представляет собой речевую генерализацию	1	1
678	произведения обнаруживается еще один	1	1
679	в ходе последовательного наращивания	1	1
680	форма целостности доступной человеческому	1	1
681	ничего нельзя не сделав	1	1
682	входят в состав художественного	1	1
683	дело не в самом	1	1
684	родственно всем любая личность	1	1
685	и наоборот созерцающий становится	1	1
686	меньше и больше нежели	1	1
687	особенно если говорить о	1	1
688	нельзя не сделав хуже	1	1
689	к паузам ударения начальные	1	1
690	отрезков звучания ритмика интонирует	1	1
691	и временных примет в	1	1
692	и субъектную организации художественного	1	1
693	в самом наличии определенных	1	1
694	живущего своей биографической жизнью	1	1
695	осуществление которой определенным образом	1	1
696	речь выступая под определенным	1	1
697	эпизодов знаменуется переносом в	1	1
698	абзацы и особенно внешних	1	1
699	и как говорит и	1	1
700	он расчленяет произведение на	1	1
701	способны запечатлевать самые разнообразные	1	1
702	уплотнение воображаемого мира вокруг	1	1
703	и привлекает внимание адресата	1	1
704	не спрашивай о ком	1	1
705	то ритм представляет собой	1	1
706	духовная ценность которой обладают	1	1
707	облекается в данный момент	1	1
708	здесь также может приобретать	1	1
709	социальных диалектов а в	1	1
710	факультативными сигналами границы эпизодов	1	1
711	эстетического созерцания может выступать	1	1
712	двумя паузами как чередование	1	1
713	самопониманию всех и каждого	1	1
714	взаимодействиях с объектной организацией	1	1
715	все люди такие и	1	1
716	том или ином отношении	1	1
717	ту форму в которую	1	1
718	как содержание эстетической деятельности	1	1
719	объект эстетического отношения являются	1	1
720	рассказ о счастье существования	1	1
721	несколькими голосами то ритм	1	1
722	с кротким мягким взглядом	1	1
723	факторов художественного впечатления он	1	1
724	в соотносительности слов избранных	1	1
725	ценностного центра этого мира	2	1
726	как с творцом и	1	1
727	построение фразы выбор синтаксической	1	1
728	диалогическим углом они сопоставлены	1	1
729	периферии верха низа левого	1	1
730	чередование напряжений и спадов	1	1
731	говорит лишь чужими устами	1	1
732	заключительные в ритмическом ряду	1	1
733	встречаем его то есть	1	1
734	образом с самим собой	1	1
735	героя как ценностного центра	2	1
736	заслоняется крупным планом заключительного	1	1
737	плотность акцентуации количество ударных	1	1
738	кадрового единства фразы устанавливает	1	1
739	художественному восприятию задана как	1	1
740	жизненных позиций может быть	1	1
741	глоссой нейтральной в стилистическом	1	1
742	однако начало нового эпизода	1	1
743	оно универсальнее вы говорите	1	1
744	логический субъект и то	1	1
745	есть высшая форма целостности	1	1
746	и заключительные в ритмическом	1	1
747	всегда имеется некоторая возможность	1	1
748	какое-то утверждение о жизни	1	1
749	внутреннего центра периферии верха	1	1
750	есть его активность прежде	1	1
751	речи последний получает вследствие	1	1
752	разложимое а в то	1	1
753	и что ж результат	1	1
754	во всей своей полноте	1	1
755	глоссализации имеет в своем	1	1
756	между двумя паузами как	1	1
757	и спадов бенвенист ритм	1	1
758	деталей в пределах кадрового	1	1
759	только перед лицом эстетического	1	1
760	реальность героя это еще	1	1
761	не ее оболочек психологии	1	1
762	начало и конец текста	1	1
763	счете искусство в том	1	1
764	во внешнем мире и	1	1
765	одна вымышленная условная индивидуальность	1	1
766	художественного произведения обнаруживается еще	1	1
767	более крупные членения а	1	1
768	поведения в принципе недоступна	1	1
769	и то или иное	1	1
770	определенным диалогическим углом по	1	1
771	исходном своем значении греческое	1	1
772	прочие обобщения могущие иметь	1	1
773	ставшие общеизвестными после романа	1	1
774	это еще одна вымышленная	1	1
775	чем выше плотность акцентуации	1	1
776	стилей социальных диалектов а	1	1
777	в кадры повествования а	1	1
778	имеющая порой место размытость	1	1
779	под каким диалогическим углом	1	1
780	однако все они для	1	1
781	быть актуализировано на основе	1	1
782	но факультативные и более	1	1
783	раз художественно значимые исключения	1	1
784	затрагивая хода самих событий	1	1
785	поименованное в тексте а	1	1
786	шеллингу чем произведение оригинальнее	1	1
787	сигналами границы эпизодов служат	1	1
788	левого правого далекого близкого	1	1
789	выбор слова б построение	1	1
790	по всеохватывающей своей широте	1	1
791	я самоопределение к ролевому	1	1
792	все они для искусства	1	1
793	логический объект логический субъект	1	1
794	своем значении греческое слово	1	1
795	известную цельность как бы	1	1
796	же значима имеющая порой	1	1
797	композиции произведения он расчленяет	1	1
798	перефразируя строки дж донна	1	1
799	дневниковая запись документ но	1	1
800	как письмо дневниковая запись	1	1
801	исполнения как упорядоченная последовательность	1	1
802	кадр внутреннего зрения герои	1	1
803	феноменов человеческого бытия я-в-мире	1	1
804	является высказыванием действующего лица	1	1
805	кадры повествования а читателем	1	1
