1	заключается в том что	4	10
2	одного и того же	4	8
3	состоит в том что	4	7
4	с этой точки зрения	5	7
5	один и тот же	2	5
6	в то время как	1	4
7	в той мере в	7	3
8	в том что он	3	3
9	одной и той же	2	3
10	все более и более	1	3
11	несмотря на то что	1	2
12	а с другой стороны	3	2
13	только в том что	1	2
14	ответ на этот вопрос	1	2
15	уже по одному тому	1	2
16	по одному тому что	1	2
17	не что иное как	2	2
18	когда мы говорим что	1	2
19	той мере в какой	7	2
20	то же самое что	1	2
21	и в другом случае	1	2
22	есть не что иное	1	2
23	он имеет в виду	1	1
24	и вместе с тем	3	1
25	собственном смысле этого слова	1	1
26	и приводит к положению	1	1
27	письменной речи в письменной	1	1
28	в том что мы	1	1
29	можно было бы назвать	1	1
30	в этом последнем случае	1	1
31	во всяком случае все	1	1
32	в собственном смысле слова	2	1
33	мы имеем в виду	1	1
34	было бы сказать что	4	1
35	не говоря уже о	5	1
36	этой точки зрения мы	1	1
37	свидетельствуют о том что	1	1
38	по отношению к синтаксису	1	1
39	есть в сущности говоря	1	1
40	одно и то же	1	1
41	остановиться на нем подробнее	1	1
42	мере в какой они	1	1
43	в тех случаях когда	3	1
44	из того факта что	1	1
45	ответить на этот вопрос	1	1
46	до самого последнего времени	1	1
47	можно было бы сказать	6	1
48	сводится к тому чтобы	1	1
49	в связи с этим	1	1
50	устной и письменной речью	1	1
51	в одном ряду с	1	1
52	что он в своем	1	1
53	в этом смысле можно	1	1
54	является то обстоятельство что	1	1
55	но во всяком случае	1	1
56	только в той мере	1	1
57	но в той мере	1	1
58	по отношению к таким	1	1
59	в том смысле что	2	1
60	как это часто бывает	1	1
61	будет видно из дальнейшего	1	1
62	в самом деле как	1	1
63	до того как он	1	1
64	после того как ему	1	1
65	для того чтобы понять	1	1
66	но для того чтобы	3	1
67	такое положение при котором	1	1
68	чтобы ответить на этот	1	1
69	которую можно было бы	2	1
70	не то что он	1	1
71	ничего не говорит нам	1	1
72	в том и в	1	1
73	том и в другом	1	1
74	что для того чтобы	1	1
75	и в другом отношении	1	1
76	не сказал бы что	1	1
77	бы то ни было	1	1
78	потому что оно имеет	1	1
79	это можно было бы	1	1
80	но не до конца	1	1
81	сводится в сущности к	1	1
82	задолго до того как	1	1
