1	по мере того как	1	6
2	только в том что	1	5
3	в том смысле в	1	4
4	том смысле в каком	1	4
5	и в этом смысле	2	3
6	в то же время	9	3
7	и сами по себе	1	3
8	дело в том что	9	3
9	одной и той же	1	3
10	не в том что	2	3
11	тем не менее в	1	2
12	но с другой стороны	2	2
13	бы они ни были	1	2
14	но дело в том	1	2
15	ни для кого не	1	2
16	в том смысле что	3	2
17	не в том смысле	1	2
18	все более и более	2	2
19	в том и другом	1	2
20	показать что и в	1	1
21	в том смысле как	1	1
22	тем не менее и	1	1
23	то же время не	1	1
24	той мере в какой	3	1
25	по его словам есть	1	1
26	в каждом из этих	1	1
27	в том что здесь	4	1
28	только тем что в	1	1
29	том виде в каком	1	1
30	не говоря уже о	3	1
31	не только потому что	1	1
32	не только в том	1	1
33	на то что в	4	1
34	языка не может быть	1	1
35	в том что именно	1	1
36	явления до сих пор	1	1
37	не имеет ничего общего	3	1
38	точно так же как	1	1
39	д и т д	1	1
40	в той мере в	3	1
41	и в том и	1	1
42	потому что не может	1	1
43	и т д и	2	1
44	во всяком случае не	3	1
45	имеет ничего общего с	3	1
46	само по себе не	1	1
47	заключается в том что	6	1
48	с тем что мы	1	1
49	что бы то ни	1	1
50	бы то ни стало	1	1
51	и та и другая	1	1
52	и в том что	1	1
53	в том что он	3	1
54	а не в том	1	1
55	во что бы то	1	1
56	в том виде в	1	1
57	говоря уже о том	1	1
58	к первому из этих	1	1
59	в словах того же	1	1
60	в то время как	5	1
61	мы до сих пор	1	1
62	указание на то что	1	1
63	что не может быть	2	1
64	с этой точки зрения	1	1
65	и в этом отношении	2	1
66	уже о том что	2	1
67	но даже и в	1	1
68	с другой стороны и	1	1
69	и т д в	1	1
70	но это не так	1	1
71	бы то ни было	2	1
