N	4gram	Tiupa_Anal	Hudozhes
1	в то же время	7	7
2	присутствия я в мире	1	5
3	состоит в том что	6	4
4	в виду не только	1	3
5	имеем в виду не	1	3
6	не следует смешивать с	1	3
7	мы имеем в виду	1	3
8	одно и то же	2	3
9	одного и того же	2	3
10	в том числе и	1	2
11	ни в коем случае	2	2
12	и в самом деле	1	2
13	в том что он	2	2
14	бы то ни было	3	2
15	в коем случае не	2	2
16	случае не следует смешивать	1	2
17	как совокупность факторов художественного	2	2
18	совокупность факторов художественного впечатления	2	2
19	в той или иной	3	2
20	коем случае не следует	1	2
21	приводит к тому что	1	2
22	с этой точки зрения	2	2
23	в том и состоит	1	2
24	узкое и сосредоточенное в	1	1
25	личность как внутреннее единство	1	1
26	длиной ритмического ряда и	1	1
27	характера социального поведения в	1	1
28	субъектной кто говорит и	1	1
29	отношение между ними могут	1	1
30	недоступна между тем художественная	1	1
31	ходе последовательного наращивания текста	1	1
32	на ее полные розовые	1	1
33	читателем в ходе чтения	1	1
34	субъектная организация литературного произведения	2	1
35	художественных значимостей являются наиболее	1	1
36	текста так же точно	1	1
37	между несколькими голосами то	1	1
38	встречается таким образом с	1	1
39	количество ударных слогов относительно	1	1
40	ее взаимоналожениях и взаимодействиях	1	1
41	говорящего иначе говоря помимо	1	1
42	творческое волеизъявление автора становится	1	1
43	искусство в том числе	1	1
44	углом они сопоставлены или	1	1
45	субъект и то или	1	1
46	общеязыковом отношении художественному восприятию	1	1
47	место лишь в самом	1	1
48	облечён в молчание бахтин	1	1
49	субъектом речи последний получает	1	1
50	говорит и как говорит	1	1
51	преимуществу внешнюю полноту и	1	1
52	литературного произведения состоит в	1	1
53	дневного ночного мгновенного вечного	1	1
54	прозе ближайшие к паузам	1	1
55	в осмысленном и конкретном	1	1
56	с субъектом речи последний	1	1
57	наиболее очевидная граница между	1	1
58	биографической жизнью человека но	1	1
59	основе весьма простых текстовых	1	1
60	времени в поле зрения	1	1
61	и сочетаться подобно кубикам	1	1
62	этой соотносительности стилистико-речевую определенность	1	1
63	т.п крайними пределами этой	1	1
64	ценностное уплотнение воображаемого мира	1	1
65	никакому логическому познанию тайна	1	1
66	политические входят в состав	1	1
67	текста наиболее значимы при	1	1
68	лишь поименованное в тексте	1	1
69	генерализацию текста поскольку подводит	1	1
70	и жизни однако все	1	1
71	речевыми характеристиками глоссами как	1	1
72	эффект распределенности текста между	1	1
73	мы имеем дело не	1	1
74	между тем объектом эстетического	1	1
75	составе персонажей появление исчезновение	1	1
76	в конечном счете искусство	1	1
77	той мере в какой	2	1
78	изображающей и изображенной речи	1	1
79	к какому-нибудь объекту речи	1	1
80	специфически человеческий способ существования	1	1
81	движется один отдельный кадр	1	1
82	или менее насыщенный деталями	1	1
83	являются неслиянными и нераздельными	1	1
84	измеряемой числом слогов между	1	1
85	слов избранных для обозначения	1	1
86	строфы абзацы и особенно	1	1
87	явлений между тем объектом	1	1
88	глядя на ее полные	1	1
89	объектом только в присутствии	1	1
90	устанавливает задаваемый читателю ракурс	1	1
91	социальные политические входят в	1	1
92	как организация ментального созерцания	1	1
93	всего в композиции произведения	1	1
94	и прозрачнее чем это	1	1
95	прибавить ни убавить ни	1	1
96	слогов между двумя паузами	3	1
97	художественного восприятия все прочие	1	1
98	кубикам то субъект и	1	1
99	люди такие и что	1	1
100	тривиальная в общеязыковом отношении	1	1
101	поле зрения читателя находится	1	1
102	общее всем знакомее и	1	1
103	анакрусы и ритмические концовки	1	1
104	всякое я уникально и	1	1
105	равнопротяженный тексту слой факторов	1	1
106	произведении искусства но факультативные	1	1
107	обнаруживается еще один равнопротяженный	1	1
108	доверенной его романному герою	1	1
109	автора мы находим вне	1	1
110	и ритмические концовки клаузулы	1	1
111	составе столько голосов сколько	1	1
112	при этом особенно если	1	1
113	взаимоналожениях и взаимодействиях с	1	1
114	достоевский описывал себя в	1	1
115	но иностранцы узнают себя	1	1
116	высказыванием действующего лица актанта	1	1
117	трагическое есть рассказ о	1	1
118	его то есть его	1	1
119	некоторая возможность выбора лингвистических	1	1
120	ни прибавить ни убавить	1	1
121	распределенности текста между несколькими	1	1
122	целое текста смыслосообразно скомпонованное	1	1
123	родственные ему люди но	1	1
124	во времени или переменой	1	1
125	незаместимое место в событии	1	1
126	такого знания является специфическая	1	1
127	каждый малый отрезок времени	1	1
128	речевую генерализацию текста поскольку	1	1
129	в различных речевых жанрах	1	1
130	поверхностные психологические социальные политические	1	1
131	диалогическим углом по отношению	1	1
132	точка пересечения трех фундаментальных	1	1
133	тех или иных языковых	1	1
134	их создает эффект распределенности	1	1
135	способа высказывания смена субъекта	1	1
136	человек недвусмысленно встречается таким	1	1
137	в композиции произведения он	1	1
138	исключительных лицах не только	1	1
139	не было и не	1	1
140	к своему собственному я	1	1
141	упорядоченная последовательность медленных и	1	1
142	высказывание принадлежит какому-нибудь речевому	1	1
143	обозначения объектных деталей а	1	1
144	ее художник вследствие этого	1	1
145	опыт внутреннего личностного присутствия	1	1
146	еще один равнопротяженный тексту	1	1
147	бенвенист ритм является фундаментом	1	1
148	а не ее оболочек	1	1
149	и не наступает вместо	1	1
150	упорядоченности лексических синтаксических и	1	1
151	ритмическом ряду образующие ритмические	1	1
152	тихая добродушная жалостливая барышня	1	1
153	ему известную цельность как	1	1
154	и объект эстетического отношения	1	1
155	всей своей полноте и	1	1
156	и трагическое есть рассказ	1	1
157	субъект и объект эстетического	1	1
158	находим вне произведения как	1	1
159	я другого межличностная данность	1	1
160	кадры читательского восприятия в	1	1
161	казалось бы место лишь	1	1
162	своих героях воображая что	1	1
163	находится или движется один	1	1
164	характеризует говорящего иначе говоря	1	1
165	фраза текста даже самая	1	1
166	в каждый малый отрезок	1	1
167	организации художественного текста словами	1	1
168	б времени и в	1	1
169	крайними пределами этой субсистемы	1	1
170	было последовательно осуществлено и	1	1
171	творческом акте художественного письма	1	1
172	художественно значимые исключения столь	1	1
173	автором в кадры повествования	1	1
174	соотносительности слов избранных для	1	1
175	которой обладают некое событие	1	1
176	следует смешивать с гносеологическими	1	1
177	варваризмы неологизмы и т.п	1	1
178	не что иное как	5	1
179	своего присутствия в мире	1	1
180	не всякий сдвиг текста	1	1
181	акцентуации количество ударных слогов	1	1
182	случае мы имеем дело	1	1
183	же время узкое и	1	1
184	художественное знание по мысли	1	1
185	сочетаться подобно кубикам то	1	1
186	текста по отдельности автору	1	1
187	оказывается эстетическим объектом только	1	1
188	что все люди такие	1	1
189	том под каким диалогическим	1	1
190	отношении художественному восприятию задана	1	1
191	мягкую белую шею с	1	1
192	души вдруг заслоняется крупным	1	1
193	это какое-то утверждение о	1	1
194	самом произведении > мы	1	1
195	с абзацем это правило	1	1
196	и одновременно универсально родственно	1	1
197	и способа высказывания смена	1	1
198	движения бенвенист ритм является	1	1
199	восприятия все прочие обобщения	1	1
200	ни изменить ничего нельзя	1	1
201	художественного впечатления он состоит	1	1
202	встречаемся с ним как	1	1
203	ряду образующие ритмические зачины	1	1
204	не затрагивая хода самих	1	1
205	иностранцы узнают себя свою	1	1
206	ее оболочек психологии характера	1	1
207	а не все что	1	1
208	тем художественная реальность героя	1	1
209	ними могут мыслиться раздельно	1	1
210	фразы устанавливает задаваемый читателю	1	1
211	в своего рода субъектной	1	1
212	каким диалогическим углом они	1	1
213	креативного и рецептивного сознаний	1	1
214	универсальнее вы говорите писал	1	1
215	малый отрезок времени в	1	1
216	героях воображая что все	1	1
217	люди но иностранцы узнают	1	1
218	смешивать с гносеологическими понятиями	1	1
219	отдельности автору приписано быть	1	1
220	соседних эпизодов знаменуется переносом	1	1
221	воображаемого мира вокруг я	1	1
222	заключается в том что	1	1
223	ценность которой обладают некое	1	1
224	место в произведении искусства	1	1
225	становится эстетическим субъектом только	1	1
226	начальные и заключительные в	1	1
227	это интересно всем потому	1	1
228	эстетического отношения являются неслиянными	1	1
229	что говорится и о	1	1
230	мягким взглядом очень здоровая	1	1
231	сотворивший ее художник вследствие	1	1
232	ударения начальные и заключительные	1	1
233	характеристиками глоссами как именовал	1	1
234	только в присутствии эстетического	1	1
235	своей полноте и неизбыточности	1	1
236	и т.п глоссализация текста	1	1
237	же художественное знание по	1	1
238	деталей а также употребленных	1	1
239	читательского внутреннего исполнения как	1	1
240	я во внешнем мире	1	1
241	весьма простых текстовых показателей	1	1
242	строки дж донна ставшие	1	1
243	внутреннего исполнения как упорядоченная	1	1
244	что достоевский описывал себя	1	1
245	упорядоченность семантики лингвистических единиц	1	1
246	иметь место в произведении	1	1
247	говорит искусство человек недвусмысленно	1	1
248	такого кадра входит лишь	1	1
249	текста так и не	1	1
250	в обыденной внехудожественной действительности	1	1
251	том и состоит что	1	1
252	всем знакомее и роднее	1	1
253	не только мы родственные	1	1
254	а читателем в ходе	1	1
255	читательского восприятия в каждый	1	1
256	глоссами как именовал аристотель	1	1
257	рода стилистике здесь также	1	1
258	объектом эстетического созерцания может	1	1
259	вокруг я героя как	2	1
260	может приобретать статус самостоятельного	1	1
261	и в пределах тех	1	1
262	нелингвистической упорядоченности лексических синтаксических	1	1
263	архаизмы варваризмы неологизмы и	1	1
264	логическому познанию тайна внутреннего	1	1
265	в самом произведении >	1	1
266	создает эффект распределенности текста	1	1
267	самая тривиальная в общеязыковом	1	1
268	очень здоровая порядок фокусирующих	1	1
269	тем выше напряжение речевых	1	1
270	своих других для него	1	1
271	жизнью человека но мы	1	1
272	или своих других для	1	1
273	барышня с кротким мягким	1	1
274	тем объектом эстетического созерцания	1	1
275	мы встречаем его то	1	1
276	в присутствии эстетического субъекта	1	1
277	в самом начале этой	1	1
278	субъектную организацию литературного произведения	1	1
279	имеет в своем составе	1	1
280	в той мере в	2	1
281	единством а места б	1	1
282	подобно режиссёру спектакля облечён	1	1
283	прочие его конструктивные членения	1	1
284	мы встречаемся с ним	1	1
285	привлекает внимание адресата к	1	1
286	факультативные и более поверхностные	1	1
287	этих исключительных лицах не	1	1
288	по шеллингу чем произведение	1	1
289	фразы выбор синтаксической конструкции	1	1
290	организация ментального созерцания читателем	1	1
291	собственно говоря и состоит	2	1
292	проблема взаимоотношений изображающей и	1	1
293	присутствие во внешней реальности	1	1
294	данный момент нечто движущееся	1	1
295	так же точно и	1	1
296	ж результат тот что	1	1
297	они сопоставлены или противопоставлены	1	1
298	нейтральной в стилистическом отношении	1	1
299	могущие иметь место в	1	1
300	социального поведения в принципе	1	1
301	собственному я самоопределение к	1	1
302	звучания ритмика интонирует всю	1	1
303	тем оно универсальнее вы	1	1
304	единство духовного я есть	1	1
305	служат абзацы далеко не	1	1
306	наращивания текста наиболее очевидная	1	1
307	всем потому что из	1	1
308	в стилистическом отношении ибо	1	1
309	широте на отдельные слова	1	1
310	героя это еще одна	1	1
311	и т.п крайними пределами	1	1
312	выше напряжение речевых движений	1	1
313	форму в которую облекается	1	1
314	литературная речь выступая под	1	1
315	и в самом произведении	1	1
316	вне произведения как живущего	1	1
317	пределах тех или иных	1	1
318	такие и что ж	1	1
319	внутренняя целостность не только	1	1
320	не все что может	1	1
321	получает вследствие этой соотносительности	1	1
322	в формах внутренней речи	1	1
323	главы и более крупные	1	1
324	насыщенный деталями кадр внутреннего	1	1
325	в поле зрения читателя	2	1
326	свое незаместимое место в	1	1
327	как более или менее	1	1
328	что говорит искусство человек	1	1
329	значимые исключения столь же	1	1
330	произведении чище и прозрачнее	1	1
331	есть точка пересечения трех	1	1
332	между ними могут мыслиться	1	1
333	хода самих событий в	1	1
334	значимостей являются наиболее генерализованные	1	1
335	входит лишь поименованное в	1	1
336	осуществлено и введено в	1	1
337	созерцания направленной на произведение	1	1
338	спектакля облечён в молчание	1	1
339	более или менее насыщенный	1	1
340	субъекта объекта и адресата	1	1
341	лингвистических средств осуществление которой	1	1
342	соотнесенности внешнего внутреннего центра	1	1
343	время узкое и сосредоточенное	1	1
344	предельную меру обобщения личностного	1	1
345	которой определенным образом характеризует	1	1
346	была тихая добродушная жалостливая	1	1
347	поскольку подводит некий общий	1	1
348	и конец текста заглавие	1	1
349	задана как более или	1	1
350	словами гегеля духовная ценность	1	1
351	личности к своему собственному	1	1
352	на мягкую белую шею	1	1
353	выше плотность акцентуации количество	1	1
354	двух соседних эпизодов знаменуется	1	1
355	превращается в урок языка	1	1
356	и объектной что говорится	1	1
357	перед лицом эстетического объекта	1	1
358	наличии определенных языковых стилей	1	1
359	дает ему известную цельность	1	1
360	в том под каким	1	1
361	и внутренняя целостность не	1	1
362	произведения он расчленяет произведение	1	1
363	созерцающий становится эстетическим субъектом	1	1
364	ритмические концовки клаузулы и	1	1
365	фундаментом всей субъектной организации	1	1
366	пределах кадрового единства фразы	1	1
367	искусство человек недвусмысленно встречается	1	1
368	синтаксических конструкций с субъектом	1	1
369	б.о корманом объектную и	1	1
370	состава актантов действующих лиц	1	1
371	гегеля духовная ценность которой	1	1
372	неологизмы и т.п глоссализация	1	1
373	в этих случаях оказывается	1	1
374	его читательского внутреннего исполнения	1	1
375	из нас самих состоят	1	1
376	чем это возможно в	1	1
377	но мы встречаемся с	1	1
378	знания является специфическая целостность	1	1
379	соединении с художественной идеологемой	1	1
380	в творческом акте художественного	1	1
381	в исходном своем значении	1	1
382	ходе чтения в кадры	1	1
383	слогов относительно длины ритмического	1	1
384	состоит что он обращен	1	1
385	ритмика интонирует всю субъектную	1	1
386	и слово литературной нормы	1	1
387	специфическая целостность феноменов человеческого	1	1
388	внутреннее присутствие во внешней	1	1
389	речевых движений текста наиболее	1	1
390	текста наиболее очевидная граница	1	1
391	единства фразы устанавливает задаваемый	1	1
392	расчленяет произведение на части	1	1
393	с темной родинкой и	1	1
394	и особенно внешних начало	1	1
395	нуждается в своего рода	1	1
396	ряда тем выше напряжение	1	1
397	субъектом только перед лицом	1	1
398	предметом такого знания является	1	1
399	выступать и внутренняя целостность	1	1
400	но в таком случае	1	1
401	говорить о прозе ближайшие	1	1
402	глоссализация текста делает его	1	1
403	ролевому сверх-я сверхличная заданность	1	1
404	мы родственные ему люди	1	1
405	цитатного типа как письмо	1	1
406	цельность как бы личность	1	1
