1	в зависимости от этого	1	2
2	не что иное как	1	2
3	одно и то же	1	2
4	не чем иным как	1	2
5	есть не что иное	1	2
6	всего дает понятие о	1	1
7	лишь с точки зрения	1	1
8	там где она есть	2	1
9	отметить еще одну особенность	1	1
10	из одного материала в	1	1
11	конечно экспрессивная интонация совсем	1	1
12	обязательна но там где	1	1
13	интонация совсем не обязательна	1	1
14	становится чуть ли не	1	1
15	дает понятие о социальной	1	1
16	она отчетливее всего дает	1	1
17	синтаксической интонации экспрессивная интонация	1	1
18	к тому что он	1	1
19	в собственном смысле слова	1	1
20	от более устойчивой синтаксической	1	1
21	одного материала в другой	1	1
22	в своей статье о	2	1
23	есть она отчетливее всего	1	1
24	перевести его на язык	1	1
25	каждое слово высказывания отражает	1	1
26	по себе а лишь	1	1
27	интонация окрашивающая каждое слово	1	1
28	отличие от более устойчивой	1	1
29	только в связи с	2	1
30	то же время в	1	1
31	не обязательна но там	1	1
32	одна из существеннейших проблем	1	1
33	в связи со всей	1	1
34	в отличие от более	1	1
35	отражает историческую неповторимость его	1	1
36	и не может быть	7	1
37	но там где она	1	1
38	врывается на место старшей	1	1
39	нет и не может	4	1
40	где она есть она	1	1
41	экспрессивная интонация совсем не	1	1
42	в то же время	20	1
43	отчетливее всего дает понятие	1	1
44	мы полагаем что такое	1	1
45	и превращения его в	1	1
46	мы не касаемся здесь	1	1
47	но тем не менее	1	1
48	лишь в процессе взаимодействия	1	1
49	слово высказывания отражает историческую	1	1
50	может быть и речи	3	1
51	на место старшей и	1	1
52	чем иным как попыткой	1	1
53	высказывания отражает историческую неповторимость	1	1
54	но в то же	3	1
55	один и тот же	3	1
56	поставить вопрос отвечают ли	1	1
57	с этой точки зрения	2	1
58	она есть она отчетливее	1	1
59	понятие о социальной оценке	1	1
60	не может быть и	4	1
61	интонации экспрессивная интонация окрашивающая	1	1
62	в которой только и	1	1
63	совсем не обязательна но	1	1
64	экспрессивная интонация окрашивающая каждое	1	1
65	является не чем иным	1	1
66	окрашивающая каждое слово высказывания	1	1
67	устойчивой синтаксической интонации экспрессивная	1	1
68	сколько-нибудь ясное и отчетливое	1	1
69	через известный промежуток времени	1	1
70	более устойчивой синтаксической интонации	1	1
71	материала в зависимости от	1	1
72	иметь в виду что	2	1
