1	в том числе и	2	4
2	и вместе с тем	5	3
3	во всяком случае не	1	3
4	но вместе с тем	8	2
5	точно так же как	6	2
6	с этой точки зрения	6	2
7	в то же время	1	2
8	бы то ни было	3	2
9	как бы то ни	1	2
10	свидетельствует о том что	1	1
11	что мы знаем о	1	1
12	указывает на то что	2	1
13	между человеком и животным	2	1
14	вместе с тем и	1	1
15	с тем что в	1	1
16	надо иметь в виду	1	1
17	и у многих других	1	1
18	ближайшем рассмотрении оказывается что	1	1
19	при ближайшем рассмотрении оказывается	1	1
20	в том что они	3	1
21	о котором здесь идет	1	1
22	но этим дело не	1	1
23	и есть то самое	1	1
24	состоит в том что	4	1
25	невозможно но все же	1	1
26	до сих пор были	1	1
27	совершенно так же как	8	1
28	похожи друг на друга	2	1
29	а с точки зрения	1	1
30	широком смысле этого слова	1	1
31	в широком смысле этого	1	1
32	до сих пор не	3	1
33	все что связано с	1	1
34	и даже там где	1	1
35	мы должны прежде всего	2	1
36	котором здесь идет речь	1	1
37	один и тот же	3	1
38	но при ближайшем рассмотрении	1	1
39	с нашей точки зрения	1	1
40	во всяком случае в	1	1
41	а в том что	1	1
42	но тем не менее	6	1
43	здесь идет речь есть	1	1
