1	один и тот же	1	6
2	одной и той же	1	5
3	одни и те же	1	3
4	не подлежит никакому сомнению	1	2
5	не что иное как	1	2
6	подлежит никакому сомнению что	1	2
7	с помощью которых он	1	2
8	с одной стороны и	1	1
9	друг с другом мы	1	1
10	когда мы говорим о	1	1
11	таким образом ясно что	1	1
12	в том что эта	1	1
13	во всяком случае не	1	1
14	не хотим сказать что	1	1
15	совершенно так же как	1	1
16	одна и та же	1	1
17	то же самое что	1	1
18	в такой же мере	1	1
19	все более и более	1	1
20	но тем не менее	1	1
21	есть не что иное	1	1
22	бы то ни было	1	1
