1	не что иное как	4	12
2	бы то ни было	2	12
3	есть не что иное	2	8
4	одно и то же	2	5
5	и тем не менее	2	5
6	в то же время	9	4
7	ни в каком случае	1	4
8	в то время как	5	4
9	дело в том что	11	4
10	то это значит что	4	3
11	и в то же	5	3
12	а тем не менее	1	3
13	свидетельствует о том что	2	3
14	указывает на то что	1	3
15	с этой точки зрения	1	3
16	по крайней мере в	1	2
17	не имеет никакого отношения	2	2
18	и т д до	1	2
19	от всего прочего и	1	2
20	в том что он	3	2
21	чего бы то ни	1	2
22	или по крайней мере	2	2
23	в каком случае не	1	2
24	заключается в том что	3	2
25	т д до бесконечности	1	2
26	сказать даже больше того	1	2
27	с самого же начала	1	1
28	стоит на точке зрения	1	1
29	и вместе с тем	4	1
30	содержит в себе и	2	1
31	не может остановиться на	1	1
32	содержит в себе в	1	1
33	взятый сам по себе	1	1
34	не содержит в себе	4	1
35	с одной стороны и	2	1
36	но в то же	2	1
37	того и у другого	1	1
38	тоже никуда не годится	1	1
39	не входя в подробности	1	1
40	том что он не	1	1
41	для тех кто не	2	1
42	конечно ни в каком	1	1
43	о том как эта	1	1
44	может быть речи о	1	1
45	в том что и	1	1
46	а в том что	1	1
47	если подойти к делу	1	1
48	то и в нем	1	1
49	у того и у	1	1
50	и т д в	1	1
51	о них мы не	1	1
52	еще и потому что	4	1
53	заключается в том чтобы	1	1
54	а это значит что	1	1
55	один и тот же	2	1
56	и то и другое	1	1
57	заключается не в том	1	1
58	то же самое время	1	1
59	что бы то ни	3	1
60	не было ни в	1	1
61	также и то что	4	1
62	есть только логика и	1	1
63	какой бы то ни	1	1
64	мы и подходим к	1	1
65	отрыве от всего прочего	1	1
66	не может быть речи	1	1
67	что несмотря на все	1	1
68	в отрыве от всего	1	1
69	то можно с полной	1	1
70	даже и не только	1	1
71	мы должны сказать что	2	1
72	ничего общего ни с	1	1
73	смысла и больше ничего	1	1
74	никакого отношения ни к	1	1
75	в то же самое	1	1
76	в том что это	1	1
77	это вовсе еще не	1	1
78	каком случае не может	1	1
79	дело не в этом	1	1
80	собственно говоря совсем не	1	1
81	как бы его ни	1	1
82	на самом же деле	3	1
83	ничего не говорит о	2	1
84	связи с вопросом о	1	1
85	в связи с вопросом	1	1
86	не есть только логика	1	1
87	имеет никакого отношения к	2	1
