1	в то же время	14	4
2	в том случае если	1	3
3	с этой точки зрения	5	3
4	заключается в том что	2	2
5	в тех случаях когда	1	2
6	одного и того же	1	2
7	большей или меньшей степени	1	2
8	в большей или меньшей	1	2
9	только в том случае	1	2
10	само по себе не	2	1
11	ни на минуту забывать	1	1
12	несмотря на то что	1	1
13	не говоря уже об	1	1
14	поскольку речь идет о	1	1
15	именно с этой точки	1	1
16	не говоря уже о	1	1
17	и в то же	8	1
18	что само по себе	1	1
19	как мы видели в	1	1
20	во всех этих случаях	1	1
21	что в тех случаях	1	1
22	ответить на этот вопрос	1	1
23	состоит вовсе не в	1	1
24	рассматривать как одно из	1	1
25	в том смысле что	1	1
26	и во многих других	1	1
27	чтобы ответить на этот	1	1
28	дело в том что	1	1
29	и с точки зрения	1	1
30	не только в том	1	1
31	бы то ни было	4	1
