1	в то время как	1	6
2	в то же время	55	5
3	к тому же в	1	5
4	в том что он	1	4
5	бы то ни было	2	4
6	за то что он	1	2
7	в том же году	1	1
8	мы не находим в	1	1
9	в связи с этим	4	1
10	во ii веке нашей	1	1
11	с другой стороны он	1	1
12	тот же что и	1	1
13	в одном из своих	1	1
14	в том что они	1	1
15	которым он действует в	1	1
16	ни в коем случае	2	1
17	состоит в том что	1	1
18	в том случае если	1	1
19	ни в чем не	1	1
20	и те и другие	3	1
21	в это время и	1	1
22	в том что в	1	1
23	из дошедших до нас	1	1
24	в нашу задачу не	1	1
25	нет никаких оснований предполагать	1	1
26	до сих пор не	2	1
27	можно было бы сравнить	1	1
28	сложнее обстоит дело с	1	1
29	во всяком случае в	1	1
30	до сих пор остается	2	1
31	ii веке нашей эры	1	1
32	на площадях и улицах	2	1
33	не что иное как	3	1
34	не в отрыве от	1	1
35	одна и та же	2	1
36	но это вовсе не	1	1
37	так же как и	2	1
38	но и в тех	1	1
39	то же время он	2	1
40	в основе его лежит	1	1
41	в том числе и	17	1
42	в тех случаях когда	1	1
43	жизни но и в	1	1
44	было бы сравнить с	1	1
45	как и во всех	2	1
46	в большинстве случаев не	2	1
47	в конце концов в	1	1
48	в котором каждый из	1	1
49	выходит далеко за пределы	1	1
50	повлек за собой и	1	1
51	на протяжении всего средневековья	5	1
52	нашу задачу не входит	1	1
53	в сущности одна и	1	1
54	с другой стороны в	2	1
55	в соответствии с этим	1	1
56	и во всех других	2	1
57	в то время когда	2	1
58	по отношению к людям	1	1
59	современников и ближайших потомков	1	1
60	сущности одна и та	1	1
