1	дело в том что	1	4
2	на самом же деле	3	4
3	дело здесь не в	1	2
4	так же как и	3	2
5	это подтверждается и другими	1	1
6	и того же явления	1	1
7	и связанные с ним	1	1
8	это все же не	1	1
9	а в связи с	1	1
10	не может так как	1	1
11	но вместе с тем	3	1
12	одного и того же	1	1
13	в том что в	8	1
14	в данном случае обряд	1	1
15	не имеют ничего общего	1	1
16	в одном и том	1	1
17	в огромном большинстве случаев	1	1
18	самом же деле эти	1	1
19	в то время когда	1	1
20	не что иное как	4	1
21	вместе с тем и	2	1
22	одна и та же	1	1
23	одном и том же	1	1
24	как это ни странно	1	1
25	но это все же	1	1
26	в том что это	3	1
27	вместе с тем он	1	1
28	можно сказать что в	1	1
29	как мы видели такие	1	1
30	в тех местах где	2	1
