1	в то же время	1	7
2	одно и то же	2	5
3	одной и той же	2	4
4	но и в области	1	2
5	в связи с этим	1	2
6	все больше и больше	2	2
7	одни и те же	1	2
8	в тех случаях когда	10	2
9	не что иное как	11	2
10	вместе с тем и	1	2
11	в зависимости от того	1	2
12	не только в области	1	2
13	есть не что иное	5	2
14	содержит в себе элементы	1	1
15	само по себе не	1	1
16	тем не менее и	1	1
17	это не совсем так	3	1
18	мы должны были бы	4	1
19	как мы видели есть	1	1
20	сколько бы мы ни	2	1
21	для наших целей достаточно	1	1
22	но вместе с тем	8	1
23	мы уже видели что	2	1
24	как мы видели не	1	1
25	если бы нам удалось	1	1
26	как мы уже знаем	1	1
27	и как мы видели	1	1
28	прежде всего мы должны	2	1
29	но все же и	1	1
30	мысль о том что	1	1
31	все это дает нам	1	1
32	от того в какой	1	1
33	как мы увидим ниже	7	1
34	одна и та же	1	1
35	мы должны помнить что	1	1
36	как только мы начинаем	1	1
37	то же самое и	1	1
38	независимо от того в	1	1
39	о том что такое	1	1
40	с нашей точки зрения	1	1
41	и не может быть	2	1
42	и тем что он	1	1
43	мы видим что и	1	1
44	это происходит потому что	4	1
45	и легче всего поддается	1	1
46	иметь в виду что	2	1
