1	в то же время	15	14
2	но в то же	9	6
3	дело в том что	1	4
4	на самом же деле	5	4
5	в связи с этим	3	3
6	как мы уже сказали	1	3
7	в том числе и	3	3
8	так же как и	2	2
9	и с точки зрения	1	2
10	для того чтобы не	1	1
11	с одной стороны и	3	1
12	может быть и речи	4	1
13	все то что не	1	1
14	жизни в ее целом	1	1
15	нами в предыдущей главе	1	1
16	ни в коем случае	2	1
17	а в связи с	1	1
18	и в соответствии с	1	1
19	одного и того же	9	1
20	как раз того что	1	1
21	не имеют ничего общего	1	1
22	до сих пор не	1	1
23	один и тот же	3	1
24	с точки зрения этого	1	1
25	мы можем сказать что	1	1
26	в коем случае нельзя	1	1
27	мы видим таким образом	1	1
28	не что иное как	1	1
29	вместе с тем и	1	1
30	той или иной форме	1	1
31	одна и та же	2	1
32	в самом деле в	1	1
33	можно прямо сказать что	1	1
34	одной и той же	3	1
35	имеют ничего общего с	1	1
36	и то же слово	2	1
37	как бы он ни	1	1
38	в той или иной	3	1
39	не может быть и	4	1
40	то же время он	1	1
41	нет и не может	2	1
42	в том что это	1	1
43	и не может быть	5	1
44	в лучшем случае объяснить	1	1
45	то что не имеет	1	1
46	очень тесно связана с	1	1
47	в большей или меньшей	1	1
48	то же самое что	1	1
49	в соответствии с этим	1	1
50	быть и речи о	3	1
51	одно и то же	3	1
52	мы уже говорили что	1	1
