1	в то же время	1	14
2	так же как и	3	2
3	начинается после того как	1	1
4	в резком противоречии с	1	1
5	может быть и речи	1	1
6	бы он ни был	1	1
7	находится в противоречии с	1	1
8	ни в чем не	2	1
9	до сих пор не	1	1
10	из самых замечательных и	1	1
11	того что преподносится в	1	1
12	в своем художественном творчестве	1	1
13	не что иное как	4	1
14	одна и та же	3	1
15	одной и той же	3	1
16	мы еще вернемся к	1	1
17	не может быть и	2	1
18	в том что это	1	1
19	и не может быть	1	1
20	еще в одном отношении	1	1
21	вместе с тем он	2	1
22	ничего не остается кроме	1	1
23	быть и речи о	1	1
24	не одна а две	1	1
25	есть не что иное	3	1
26	потому что в основе	1	1
