1	одного и того же	1	6
2	в то же время	24	3
3	и в свою очередь	1	3
4	дело в том что	4	3
5	не что иное как	1	2
6	в том смысле что	1	2
7	все более и более	1	2
8	в том и другом	1	2
9	сами по себе а	1	1
10	не только потому что	1	1
11	и тем самым заставляет	1	1
12	д и т д	1	1
13	что в каждом человеке	1	1
14	и т д и	1	1
15	лишь в том что	1	1
16	заключается в том что	2	1
17	не имеют для них	1	1
18	если так можно выразиться	1	1
19	не противоречит тому что	1	1
20	с самого начала и	1	1
21	очень важную роль в	1	1
22	но и потому что	1	1
23	с другой стороны и	1	1
24	и т д в	1	1
25	бы то ни было	1	1
