1	в то же время	6	7
2	одного и того же	2	4
3	дело в том что	3	3
4	то же время в	1	2
5	в той или иной	1	2
6	в том что он	1	2
7	одной и той же	2	2
8	состоит в том что	2	1
9	и того же произведения	1	1
10	не говоря уже о	1	1
11	по тем или иным	2	1
12	лишь в том что	1	1
13	заключается в том что	2	1
14	тем не менее не	1	1
15	речь идет уже не	1	1
16	не что иное как	5	1
17	в этом втором случае	1	1
18	и сам по себе	1	1
19	во всяком случае не	2	1
20	приходит к выводу что	1	1
21	по крайней мере не	1	1
22	в том или ином	2	1
23	мы имеем дело с	1	1
24	есть не что иное	3	1
25	но с другой стороны	1	1
