1	в то же время	8	8
2	присутствия я в мире	1	6
3	состоит в том что	7	5
4	одного и того же	4	4
5	сближение но не слияние	2	3
6	даль и сближение но	2	2
7	то что они хотят	2	2
8	тот или иной строй	1	2
9	природе суть то что	2	2
10	и в то же	2	2
11	в войне и мире	1	2
12	что в имени тебе	1	2
13	своей роли в миропорядке	1	2
14	преодолеваемая даль и сближение	2	2
15	и не могло быть	1	2
16	и сближение но не	2	2
17	суть то что они	2	2
18	что они хотят и	2	2
19	в том числе и	3	2
20	по своей природе суть	2	2
21	своей природе суть то	2	2
22	они хотят и свершают	2	2
23	в силу своей принципиальной	1	2
24	в том что он	1	2
25	одно и то же	3	2
26	бы то ни было	2	2
27	между которыми устанавливаются отношения	1	1
28	не было и не	1	1
29	от позиции учителя жизни	1	1
30	и возможность иной интонации	1	1
31	текст анекдота выбор лексики	1	1
32	опыт жизни а также	1	1
33	фон романного видения мира	1	1
34	запечатлеваемый и запечатлевающий основу	1	1
35	выхода его за пределы	1	1
36	а некий нравственный закон	1	1
37	для рассказчика ни для	1	1
38	и строго отграниченная система	2	1
39	следует иметь в виду	1	1
40	выводится в просторную сферу	1	1
41	коммуникативную стратегию эстетического по	1	1
42	которого анекдот легко может	1	1
43	самому тогда как притчу	1	1
44	своему герою определяемое отсутствием	1	1
45	совершается как бы в	1	1
46	сказание в известном смысле	1	1
47	отсутствием ценностной дистанции между	1	1
48	манифестирующего двоякий жизненный опыт	1	1
49	в имени тебе моем	1	1
50	юмора умения отрешиться от	1	1
51	анекдот но без благоговейного	1	1
52	моделью причастности к общему	1	1
53	отделен от своей судьбы	1	1
54	в значительной степени зависим	1	1
55	в мире это требует	1	1
56	адресата при этом остается	1	1
57	не дай мне бог	1	1
58	его ценностно-смысловой позиции в	1	1
59	герою определяемое отсутствием ценностной	1	1
60	ним всегда преодолеваемая даль	1	1
61	и раскованной беседы автора	1	1
62	анекдот не знает к	1	1
63	припоминая и примеряя ее	1	1
64	коммуникативного события на поучающего	1	1
65	здесь действующие лица по	1	1
66	представляет собой исторически продуктивный	1	1
67	звук в архитектуру души	1	1
68	едины судьба выражает внеличную	1	1
69	несет в себе рецептивную	1	1
70	ни столь пассивным как	1	1
71	речь включая разные формы	1	1
72	не столько от содержания	1	1
73	но не верифицируемым знанием	1	1
74	пассивным как к содержанию	1	1
75	самим собою в точке	1	1
76	его уникальным жизненным опытом	1	1
77	освоена в анекдоте подготовившем	1	1
78	их отношении к предмету	1	1
79	говорит и кому говорят	1	1
80	стилевых формах косвенной речи	1	1
81	быть субъектом данного высказывания	1	1
82	к однозначности и прежде	1	1
83	запрета есть профанация священного	1	1
84	к реальному человеческому существованию	1	1
85	своим коммуникативным параметрам сродни	1	1
86	из уст в уста	1	1
87	адресат протороманного коммуникативного события	1	1
88	ни столь свободным как	1	1
89	не требует анекдот но	1	1
90	благоговейного приятия и ученичества	1	1
91	достоверным но не верифицируемым	1	1
92	при этом и сам	1	1
93	словесное кощунство и непристойность	1	1
94	между вещами и ценностями	1	1
95	деятельности персонажа то она	1	1
96	в форме определенной жанровой	1	1
97	определяемое отсутствием ценностной дистанции	1	1
98	следит за блужданиями его	1	1
99	как субъекты этического выбора	1	1
100	что касается ментальной и	1	1
101	прямой речи именно диалог	1	1
102	как правило лишь в	1	1
103	ни к чему не	1	1
104	или преступается не предначертанность	1	1
105	и реализатором самобытного смысла	1	1
106	нормативное самоотождествление с человеком	1	1
107	голоса зримого жеста и	1	1
108	опыт присутствия в мире	1	1
109	по отношению к самому	1	1
110	это разделение иерархично оно	1	1
111	в анекдоте подготовившем почву	1	1
112	определенной жанровой схемы и	1	1
113	зависит от жанра высказывания	1	1
114	переходит к позиции изобразителя	1	1
115	нарушение запрета есть профанация	1	1
116	глазами анекдота это игра	1	1
117	фуко представляет собой позицию	1	1
118	изобразителя жизни повествователя о	1	1
119	в стилевых формах косвенной	1	1
120	нельзя не сделав хуже	1	1
121	с одной стороны и	5	1
122	или острота наизнанку глупость	1	1
123	ночной жанр посрамляющий умершее	1	1
124	бог сойти с ума	1	1
125	своего рода механизмом активизации	1	1
126	случая непредсказуемое стечение обстоятельств	1	1
127	в таком случае его	1	1
128	определенные задания реализуют в	1	1
129	слушатель читатель может и	1	1
130	случайности полноценная биография возможна	1	1
131	но и характерное для	1	1
132	присутствует как правило лишь	1	1
133	особое отношение к своему	1	1
134	еще не есть биография	1	1
135	между ними здесь невозможно	1	1
136	потому нейтральное к языку	1	1
137	иллюзии живого голоса зримого	1	1
138	притче была впервые освоена	1	1
139	судьба выражает внеличную сторону	1	1
140	собою в точке выхода	1	1
141	вполне самобытно но и	1	1
142	что из нас самих	1	1
143	несобственно-прямая речь включая разные	1	1
144	они едины судьба выражает	1	1
145	мне бог сойти с	1	1
146	глупость неуместность ошибка оговорка	1	1
147	события на поучающего и	1	1
148	универсального опыта к индивидуальной	1	1
149	предварительное знакомство слушателей с	1	1
150	сюжетообразующим при этом и	1	1
151	оно не предполагает хоровой	1	1
152	ошибка оговорка где слово	1	1
153	искусство заинтересовывать судьбой отдельных	1	1
154	отграниченная система смыслов оно	1	1
155	содержанию анекдота ни столь	1	1
156	но в таком случае	1	1
157	занять любой индивид чтобы	1	1
158	но без благоговейного приятия	1	1
159	на свой опыт жизни	1	1
160	в сказании повествуемой ситуации	1	1
161	с его уникальным жизненным	1	1
162	нашего высказывания и в	1	1
163	не сводится к служебной	1	1
164	не отделен от своей	1	1
165	как бы непосредственного присутствия	1	1
166	чужой экзистенциальный опыт присутствия	1	1
167	и примеряя ее содержание	1	1
168	вследствие которого он от	1	1
169	фактически точными они бытуют	1	1
170	не предполагает внутренне свободного	1	1
171	ибо предметно-тематическое содержание жизнеописания	1	1
172	биография и не дает	1	1
173	виде целенаправленно устремленный от	1	1
174	носителем и реализатором самобытного	1	1
175	и его поступки только	1	1
176	моментам родственным анекдотическому дискурсу	1	1
177	одного сознания к другому	1	1
178	о ней установка не	1	1
179	том что он не	1	1
180	занимательное неожиданное маловероятное беспрецедентное	1	1
181	случае его вступление в	1	1
182	у-влекать слушателей преодолевая их	1	1
183	к этим моментам родственным	1	1
184	образа и романного слова	1	1
185	сколько от мастерства рассказчика	1	1
186	иными границами между вещами	1	1
187	с языком ставят перед	1	1
188	другому что касается ментальной	1	1
189	ценностно-смысловой позиции в мире	1	1
190	жизненным опытом выводится в	1	1
191	составляет преломляющая несобственно-прямая речь	1	1
192	необходимости ни в мире	1	1
193	собственной ситуации жизненного выбора	1	1
194	в чистом виде целенаправленно	1	1
195	его поступки только раскрывают	1	1
196	система смыслов оно стремится	1	1
197	литературного произведения по своим	1	1
198	кто говорит и кому	1	1
199	жизненного опыта их свободного	1	1
200	протороманного коммуникативного события суть	1	1
201	позицию которую может и	1	1
202	в классическом романе реалистической	1	1
203	в том случае если	2	1
204	монологизированного слова в слове	1	1
205	скрытой полускрытой рассеянной чужой	1	1
206	и развития самоопределяющегося субъекта	1	1
207	ним определенные задания реализуют	1	1
208	взаимная условленность конвенциональность общения	1	1
209	когда мы строим свою	1	1
210	острота наизнанку глупость неуместность	1	1
211	несовпадения человека с самим	1	1
212	закон собственно и составляющий	1	1
213	смыслов оно стремится к	1	1
214	акт притчевого типа есть	1	1
215	опыта их свободного согласия	1	1
216	дискурсу речевая маска биографа	1	1
217	мире императивной нормы ни	1	1
218	извлечения адресатом некоего ценностного	1	1
219	бы непосредственного присутствия рассказчика	1	1
220	пространственно-временных масштабов и соотношений	1	1
221	мы строим свою речь	1	1
222	прибавить ни убавить ни	1	1
223	это игра случая непредсказуемое	1	1
224	курьезное любопытное занимательное неожиданное	1	1
225	прежде всего к ценностной	1	1
226	слова манифестирующего двоякий жизненный	1	1
227	и поучаемого это разделение	1	1
228	к индивидуальной жизненной практике	1	1
229	просторную сферу исторического бытия	1	1
230	формах косвенной речи хотя	1	1
231	от жанра высказывания жанр	1	1
232	к интонации доверительной и	1	1
233	игра случая непредсказуемое стечение	1	1
234	как к содержанию сказания	1	1
235	целенаправленно устремленный от одного	1	1
236	возможность иного включает в	1	1
237	притчевое нормативное самоотождествление с	1	1
238	со стороны адресата притчи	1	1
239	чувства юмора умения отрешиться	1	1
240	одним и тем же	2	1
241	восприятия со стороны адресата	1	1
242	знает к его ценностно-смысловой	1	1
243	дискурсе речевой акт притчевого	1	1
244	повеленья сказание в известном	1	1
245	только раскрывают содержание судьбы	1	1
246	но от божья повеленья	1	1
247	в сказании или притче	1	1
248	однозначности и прежде всего	1	1
249	человека с самим собою	1	1
250	жизненной практике может быть	1	1
251	быть определена как регулятивная	1	1
252	морализаторскую премудрость притчевого назидания	1	1
253	чтобы быть субъектом данного	1	1
254	иных пространственно-временных масштабов и	1	1
255	жизни то есть субъектом	1	1
256	в точке этого несовпадения	1	1
257	сознания к другому что	1	1
258	жизнеописание несет в себе	1	1
259	опыт чужой жизненной позиции	1	1
260	бытуют как слухи или	1	1
261	суть равнодостойные субъекты смыслополагания	1	1
262	иного языка и возможность	1	1
263	акте выбора осуществляется или	1	1
264	в противоположность характеру типу	1	1
265	чего не требует анекдот	1	1
266	любопытное занимательное неожиданное маловероятное	1	1
267	иными соседствами именно это	1	1
268	той мере в какой	2	1
269	в евгении онегине но	1	1
270	и в форме индивидуального	1	1
271	не несет в себе	1	1
272	видения мира романного образа	1	1
273	речи именно диалог персонажей	1	1
274	в том что в	3	1
275	жанр посрамляющий умершее солнце	1	1
276	ментальной и речевой деятельности	1	1
277	преломляющая несобственно-прямая речь включая	1	1
278	смыслополагания между которыми устанавливаются	1	1
279	является сюжетообразующим при этом	1	1
280	исторически продуктивный тип высказывания	1	1
281	картина мира которая своей	1	1
282	в дискурсе речевой акт	1	1
283	персонажи не выбирают а	1	1
284	опираясь на индивидуальный опыт	1	1
285	наличие так называемого чувства	1	1
286	как бы в точке	1	1
287	столь пассивным как к	1	1
288	себя и возможность иного	1	1
289	проецировать чужой экзистенциальный опыт	1	1
290	запечатленного в притче универсального	1	1
291	ощущение составляет необходимый фон	1	1
292	не знает к его	1	1
293	некий нравственный закон собственно	1	1
294	или притче была впервые	1	1
295	в целом ряде произведений	1	1
296	их свободного согласия за	1	1
297	притчевого типа есть монолог	1	1
298	отношению к самому герою	1	1
299	ней установка не на	1	1
300	в той мере в	2	1
301	восприятия сказания или анекдота	1	1
302	совершенно иными границами между	1	1
303	будучи порой фактически точными	1	1
304	внеязыковое и потому нейтральное	1	1
305	можно вести речь о	1	1
306	жизнеописания вполне самобытно но	1	1
307	определяется предметом целью и	3	1
308	быть осуществлено только самим	1	1
309	они бытуют как слухи	1	1
310	вещами и ценностями иными	1	1
311	интонации доверительной и раскованной	1	1
312	с позиций классического реализма	1	1
313	может обладать собственным смыслом	1	1
314	недопустимая в сказании или	1	1
315	события суть равнодостойные субъекты	1	1
316	не есть биография и	1	1
317	точке выхода его за	1	1
318	оценки и иных пространственно-временных	1	1
319	высказывания и в форме	1	1
320	жизни как исполненной некоторого	1	1
321	впервые освоена в анекдоте	1	1
322	столь свободным как к	1	1
323	поступки только раскрывают содержание	1	1
324	выготским и н.и жинкиным	2	1
325	непредубежденное любопытство к реальному	1	1
326	оно живет в готовом	2	1
327	строго отграниченная система смыслов	2	1
328	и оценки и иных	1	1
329	коммуникативным параметрам сродни любому	1	1
330	включает в себя и	1	1
331	которого он от позиции	1	1
332	мы имеем дело с	1	1
333	гегель именовал веком героев	1	1
334	беседы автора с читателем	1	1
335	по своей коммуникативной природе	1	1
336	как слухи или сплетни	1	1
337	в эпических жанрах а	1	1
338	можно даже сказать что	1	1
339	свою очередь определяется предметом	2	1
340	разделение иерархично оно не	1	1
341	сплетни то есть принадлежат	1	1
342	ними здесь невозможно притчевое	1	1
343	разные формы скрытой полускрытой	1	1
344	жизнеописания чего анекдот не	1	1
345	речевой деятельности персонажа то	1	1
346	требует анекдот но без	1	1
347	на индивидуальный опыт чужой	1	1
348	реализатором самобытного смысла развертывающейся	1	1
349	учителя жизни постоянно переходит	1	1
350	иного включает в себя	1	1
351	задания реализуют в нем	1	1
352	и речевой деятельности персонажа	1	1
353	неадекватным субъект объект и	1	1
354	читателем к иллюзии живого	1	1
355	форме определенной жанровой схемы	1	1
356	интересно всем потому что	1	1
357	зримого жеста и как	1	1
358	в одноименной трагедии софокла	1	1
359	жизненную позицию опираясь на	1	1
360	этим моментам родственным анекдотическому	1	1
361	активного приятия не удовлетворяясь	1	1
362	нравственный закон собственно и	1	1
363	и должен занять любой	1	1
364	и романного слова эта	1	1
365	в просторную сферу исторического	1	1
366	и непристойность необыкновенное в	1	1
367	к иллюзии живого голоса	1	1
368	но раз-влекать их предлагая	1	1
369	в акте выбора осуществляется	1	1
370	раскованной беседы автора с	1	1
371	реальному человеческому существованию вследствие	1	1
372	диалогизм биографического слова не	1	1
373	сознаний встречающихся в дискурсе	1	1
374	комическая апофегма то есть	1	1
375	известном смысле домонологично оно	1	1
376	регулятивная отношение слушателя к	1	1
377	так называемого чувства юмора	1	1
378	в готовом стабильно дифференцированном	2	1
379	то есть субъектом самоопределения	1	1
380	здесь присутствует как правило	1	1
381	содержание к собственной ситуации	1	1
382	мире всеобщей межличностной соотносительности	1	1
383	становления и развития самоопределяющегося	1	1
384	выражает внеличную сторону индивида	1	1
385	то есть принадлежат самой	1	1
386	к собственной ситуации жизненного	1	1
387	смыслом ни в мире	1	1
388	целое нашего высказывания и	1	1
389	ценностями иными соседствами именно	1	1
390	бросает звук в архитектуру	1	1
391	и характерное для восприятия	1	1
392	и не дает позвоночника	1	1
393	и иных пространственно-временных масштабов	1	1
394	и запечатлевающий основу такой	1	1
395	свой опыт жизни а	1	1
396	отношение слушателя к содержанию	1	1
397	блужданиями его под сводами	1	1
398	необходимый фон романного видения	1	1
399	поучаемого это разделение иерархично	1	1
400	выбирают а по своей	2	1
401	оно стремится к однозначности	1	1
402	завершенная и строго отграниченная	2	1
403	к его ценностно-смысловой позиции	1	1
404	за которым обнаруживается преодолеваемая	1	1
405	текста да и персонажи	1	1
406	картины мира с совершенно	1	1
407	и сам текст анекдота	1	1
408	далеко не сводится к	1	1
409	есть профанация священного новелла	1	1
410	как уже говорилось ранее	1	1
411	свободного согласия за которым	1	1
412	в самом общем виде	2	1
413	рода механизмом активизации воспринимающего	1	1
414	может быть проделано и	1	1
415	принципиально недопустимая в сказании	1	1
416	живет в готовом стабильно	2	1
417	постоянно переходит к позиции	1	1
418	как уже говорилось выше	1	1
419	отношении к предмету речи	1	1
