1	не что иное как	6	6
2	совершенно так же как	1	4
3	так же как и	5	3
4	с другой стороны и	2	3
5	мы видели что в	2	2
6	состоит в том что	4	2
7	могло бы составить предмет	1	2
8	точно так же как	4	2
9	как мы увидим ниже	1	2
10	в то время как	13	2
11	раньше чем перейти к	1	2
12	одной и той же	12	2
13	так же как в	2	2
14	есть не что иное	2	2
15	точно так же и	2	1
16	в том смысле как	1	1
17	но они не только	1	1
18	по-видимому заключается в том	1	1
19	с одной стороны жизнь	1	1
20	несмотря на то что	3	1
21	мы должны были бы	1	1
22	с одной стороны он	2	1
23	в связи с этим	1	1
24	что они находятся в	1	1
25	то это означало бы	1	1
26	к тому что в	1	1
27	не только то что	2	1
28	и т д с	1	1
29	вступает с ней в	1	1
30	но в таком случае	1	1
31	дело конечно не просто	1	1
32	том смысле как это	1	1
33	это означало бы что	1	1
34	который точно так же	1	1
35	но вместе с тем	2	1
36	в том что в	4	1
37	мы уже знаем что	1	1
38	на все эти вопросы	1	1
39	после того как она	1	1
40	не имеют ничего общего	1	1
41	конечно не просто в	1	1
42	мы имеем дело с	1	1
43	когда он говорит что	3	1
44	что при помощи этого	1	1
45	до сих пор не	2	1
46	здесь мы видим что	2	1
47	они еще не вполне	1	1
48	в средние века в	1	1
49	и каждое из них	1	1
50	если это так то	1	1
51	образом мы видим что	5	1
52	из ложной предпосылки что	1	1
53	заключается в том что	23	1
54	по существу мы можем	1	1
55	в данном случае в	1	1
56	указывает на то что	11	1
57	если бы она не	1	1
58	на то что вообще	1	1
59	имеют ничего общего с	1	1
60	иметь в виду то	1	1
61	мы видим что здесь	1	1
62	указывают на то что	1	1
63	это еще не все	1	1
64	а не сам он	1	1
65	с нашей точки зрения	1	1
66	и не может быть	2	1
67	мы увидим ниже что	1	1
68	но это только одна	1	1
69	в силу того что	4	1
70	здесь могут быть два	1	1
71	то же самое что	4	1
72	с этой точки зрения	10	1
73	таким образом мы видим	3	1
74	и т д все	2	1
75	мы видим что в	1	1
76	с другой стороны она	1	1
