1	в то же время	18	13
2	в связи с этим	1	4
3	и в то же	6	4
4	с одной стороны и	4	4
5	и не может быть	2	4
6	бы она ни была	1	3
7	но в то же	7	3
8	все более и более	1	3
9	менее всего может быть	1	2
10	то же время и	2	2
11	не может войти в	1	2
12	как бы ни были	1	2
13	нет и не может	1	2
14	в самом языке как	1	2
15	и т п в	8	2
16	и до настоящего времени	1	2
17	во всех своих моментах	2	2
18	т п в основе	1	1
19	в этом отношении он	1	1
20	и т п слово	1	1
21	не с точки зрения	1	1
22	мы имеем в виду	1	1
23	в том случае если	1	1
24	тем не менее в	1	1
25	то же время в	2	1
26	в этом романе и	1	1
27	быть более или менее	3	1
28	не для того чтобы	2	1
29	все новые и новые	1	1
30	и т п все	3	1
31	с точки зрения самого	2	1
32	тем что он есть	2	1
33	дело идет уже не	1	1
34	в том чтобы раскрыть	1	1
35	только с точки зрения	1	1
36	и прежде всего в	1	1
37	в значительной степени и	1	1
38	во всей ее конкретности	1	1
39	в зависимости от этого	1	1
40	нового специально поэтического языка	1	1
41	по самому своему существу	1	1
42	и т п на	1	1
43	в том числе и	1	1
44	заключается в том чтобы	1	1
45	языка не может быть	2	1
46	и в этом случае	2	1
47	большей или меньшей степени	4	1
48	а часто и вовсе	1	1
49	не может быть конечно	1	1
50	между поэтом и его	1	1
51	различия между этими двумя	1	1
52	в большей или меньшей	4	1
53	может быть более или	2	1
54	на самом же деле	1	1
55	и с точки зрения	1	1
56	с этой точки зрения	2	1
57	не выходит за пределы	3	1
58	бы то ни было	1	1
