1	заключается в том что	1	9
2	в то время как	13	7
3	в силу того что	2	6
4	одной и той же	2	5
5	с одной стороны и	3	4
6	с этой точки зрения	6	4
7	состоит в том что	4	3
8	одно и то же	2	3
9	точно так же как	6	3
10	не содержат в себе	1	3
11	приводит к тому что	1	3
12	то же самое что	4	3
13	и вместе с тем	5	2
14	и в меньшей мере	1	2
15	не содержит в себе	1	2
16	внимание на то что	3	2
17	все больше и больше	2	2
18	но вместе с тем	8	2
19	в том что в	1	2
20	в том что она	1	2
21	вместе с тем и	1	2
22	так же как и	9	2
23	в том смысле что	1	2
24	в том числе и	2	2
25	только в том что	1	2
26	содержит в себе ничего	1	2
27	в этом случае в	1	2
28	и не может быть	2	2
29	что в этом случае	1	2
30	в том что он	2	2
31	не чем иным как	1	2
32	видим таким образом что	2	1
33	вместе с тем они	1	1
34	таким образом мы можем	2	1
35	до сих пор мы	5	1
36	несмотря на то что	1	1
37	на самом же деле	2	1
38	друг с другом и	1	1
39	даже если бы мы	2	1
40	сказывается в том что	1	1
41	частный случай более общего	1	1
42	само по себе но	2	1
43	прийти к выводу что	1	1
44	образом мы можем установить	1	1
45	одной стороны и его	1	1
46	и то что он	1	1
47	ясность в этот вопрос	1	1
48	мы видели что в	3	1
49	связаны друг с другом	1	1
50	до сих пор в	1	1
51	приводят к тому что	2	1
52	но если это так	2	1
53	только по отношению к	1	1
54	и в соответствии с	1	1
55	но с другой стороны	1	1
56	как мы видели не	1	1
57	не что иное как	11	1
58	мы имеем дело с	1	1
59	он никак не мог	1	1
60	могут быть поставлены в	1	1
61	чтобы ответить на этот	1	1
62	видно из того что	1	1
63	ответить на этот вопрос	1	1
64	можно было бы объяснить	1	1
65	мы можем установить что	3	1
66	только после того как	5	1
67	как мы увидим ниже	7	1
68	но мы знаем что	3	1
69	только в самое последнее	1	1
70	мы видим таким образом	2	1
71	таким образом оказывается что	1	1
72	и то и другое	2	1
73	встречается не так часто	1	1
74	ни у одного из	1	1
75	говорят о том что	1	1
76	есть не что иное	5	1
77	в этом случае не	1	1
78	приводит нас к той	1	1
79	иначе обстоит дело с	2	1
80	с другой стороны как	1	1
81	к самому себе и	1	1
82	потому что у него	2	1
83	мог бы показать что	1	1
84	не может быть понят	2	1
85	совершенно так же как	8	1
86	в зависимости от того	1	1
87	как мы видели выше	3	1
88	же как и в	2	1
89	о том что в	3	1
90	мы остановимся только на	1	1
91	в то же время	1	1
92	только частный случай более	1	1
93	в силу присущих ему	2	1
94	в непосредственной связи с	1	1
95	той ситуации в которой	1	1
96	мы уже говорили выше	1	1
97	на первый план выдвигается	1	1
98	в самое последнее время	1	1
99	для этого мы должны	1	1
100	в том что они	3	1
