1	в то же время	9	10
2	но в то же	2	5
3	в том что он	3	4
4	и в то же	2	3
5	так же как и	1	3
6	то же время не	1	3
7	и в этом смысле	2	2
8	но с другой стороны	2	2
9	а может быть даже	1	2
10	именно в том что	1	2
11	в той или иной	2	2
12	совершенно так же как	2	2
13	в то время как	5	2
14	и в этом отношении	2	2
15	том и другом случае	1	2
16	в том и другом	1	2
17	бы то ни было	2	2
18	и во всяком случае	1	1
19	ни на минуту не	1	1
20	в той мере в	3	1
21	одной и той же	1	1
22	ни в каком смысле	1	1
23	для своего времени и	1	1
24	и в частности на	1	1
25	в другом месте и	1	1
26	независимо от того кто	1	1
27	то же время оно	1	1
28	не имеет ничего общего	3	1
29	но это не значит	1	1
30	только и могут быть	1	1
31	той мере в какой	3	1
32	говорить о том что	1	1
33	можно даже сказать что	1	1
34	она была для него	1	1
35	не все в этой	1	1
36	тем не менее и	1	1
37	и в том и	1	1
38	характерен в этом отношении	1	1
39	особенно характерен в этом	1	1
40	до сих пор еще	1	1
41	во всяком случае не	3	1
42	имеет ничего общего с	3	1
43	но на самом деле	1	1
44	само по себе не	1	1
45	заключается в том что	6	1
46	до самого последнего времени	1	1
47	только с точки зрения	1	1
48	что бы то ни	1	1
49	бы то ни стало	1	1
50	в данном случае в	2	1
51	иначе и быть не	1	1
52	в самом деле в	1	1
53	в том отношении что	4	1
54	и в том что	1	1
55	с точки зрения их	2	1
56	в том числе и	2	1
57	и по отношению к	1	1
58	что же это за	1	1
59	в отличие от других	1	1
60	во что бы то	1	1
61	с точки зрения своей	1	1
62	дело в том что	9	1
63	не копировал и не	1	1
64	может быть даже и	1	1
65	с этой точки зрения	1	1
66	не в том что	2	1
67	с другой стороны и	1	1
68	не потому что он	1	1
69	которой можно было бы	1	1
