1	в то же время	24	7
2	одного и того же	1	4
3	в том что в	3	3
4	дело в том что	4	3
5	в том числе и	2	3
6	потому что в них	1	2
7	и в то же	6	2
8	как уже было сказано	1	2
9	если можно так выразиться	1	2
10	было в том что	1	1
11	бахтина о том что	1	1
12	но в таком случае	1	1
13	но и потому что	1	1
14	сами по себе не	1	1
15	то же время они	1	1
16	не только потому что	1	1
17	ни в чем не	1	1
18	в русской литературе xix	1	1
19	между автором и читателем	1	1
20	заключается в том что	2	1
21	по отношению к самому	1	1
22	не может быть ни	1	1
23	уже в е годы	1	1
24	и не может быть	3	1
25	первую очередь по отношению	1	1
26	или во всяком случае	1	1
27	нет и не может	2	1
28	в первую очередь по	1	1
29	очередь по отношению к	1	1
