1	заключается в том что	2	9
2	в то время как	4	7
3	с одной стороны и	1	4
4	с этой точки зрения	4	4
5	одно и то же	5	3
6	одном и том же	1	3
7	одного и того же	1	3
8	и вместе с тем	1	2
9	не содержит в себе	1	2
10	в том смысле что	1	2
11	только в том что	1	2
12	в том что он	2	2
13	одной стороны и с	1	1
14	видим таким образом что	1	1
15	до сих пор мы	1	1
16	на самом же деле	1	1
17	содержит в себе в	1	1
18	само по себе но	1	1
19	вопрос о том как	2	1
20	и то что он	1	1
21	а и в и	1	1
22	том что он не	1	1
23	но если это так	2	1
24	в том или другом	2	1
25	в этом и заключается	1	1
26	из того что мы	1	1
27	не что иное как	12	1
28	точка зрения приводит к	1	1
29	как видно уже из	1	1
30	не только не мешает	1	1
31	в качестве одного из	1	1
32	мы видим таким образом	1	1
33	и то и другое	1	1
34	с тем же правом	1	1
35	есть не что иное	8	1
36	то же самое время	1	1
37	его заключается в том	1	1
38	с другой стороны как	1	1
39	в то же самое	1	1
40	в том что это	1	1
41	не иначе как в	1	1
42	нельзя сказать что оно	1	1
43	не только не есть	1	1
44	в то же время	4	1
45	только на то что	1	1
46	что с точки зрения	1	1
47	не есть то что	2	1
