1	по мере того как	1	6
2	одного и того же	1	6
3	но тем не менее	1	6
4	в том смысле в	1	4
5	том смысле в каком	1	4
6	в то же время	20	3
7	и в свою очередь	1	3
8	и сами по себе	1	3
9	дело в том что	1	3
10	одной и той же	1	3
11	не в том что	2	3
12	с одной стороны и	5	2
13	тем не менее в	1	2
14	и как бы ни	1	2
15	мере того как мы	1	2
16	не что иное как	1	2
17	и то и другое	3	2
18	бы иначе если бы	1	2
19	в том смысле что	2	2
20	не в том смысле	2	2
21	так а не иначе	1	2
22	все более и более	4	2
23	то же время не	3	1
24	той мере в какой	2	1
25	взятом отдельно независимо от	1	1
26	что же касается до	2	1
27	и его форм в	1	1
28	между предшествующим и последующим	1	1
29	ли нужно говорить что	1	1
30	не говоря уже о	2	1
31	в том случае если	1	1
32	и т п мы	1	1
33	в противном случае мы	1	1
34	и потому не могут	1	1
35	языка не может быть	1	1
36	языка и его форм	1	1
37	одно из необходимых условий	1	1
38	не для того чтобы	1	1
39	лишь в той мере	1	1
40	это нисколько не противоречит	1	1
41	в той мере в	2	1
42	но мы видели что	1	1
43	один и тот же	3	1
44	друг другу и не	1	1
45	так и в каждом	1	1
46	что бы то ни	3	1
47	бы то ни стало	3	1
48	смысле этого слова и	1	1
49	и в том что	1	1
50	имеет место и в	1	1
51	есть одно из необходимых	1	1
52	не могло бы быть	1	1
53	тем что в нем	1	1
54	во что бы то	3	1
55	было бы если бы	1	1
56	и т п однако	1	1
57	как и во всех	1	1
58	в более или менее	1	1
59	к одной и той	1	1
60	как бы ни были	3	1
61	чтобы она могла стать	1	1
62	не могут быть названы	1	1
63	с этой точки зрения	2	1
64	и в этом отношении	2	1
65	чтобы убедиться в этом	3	1
66	с другой стороны и	1	1
67	бы то ни было	7	1
68	прежде всего должны быть	1	1
