1	в то же время	9	14
2	и в то же	2	8
3	с этой точки зрения	1	5
4	бы то ни было	2	4
5	так же как и	1	3
6	в той или иной	2	3
7	каких бы то ни	1	2
8	само по себе не	1	2
9	и в этом смысле	2	2
10	но в то же	2	2
11	заключается в том что	6	2
12	том смысле что оно	1	1
13	в то время как	5	1
14	в связи с этим	1	1
15	как и всякая иная	1	1
16	в том смысле что	3	1
17	дело в том что	9	1
18	в том числе и	2	1
19	нам кажется что в	1	1
20	не говоря уже о	3	1
21	не только в том	1	1
22	поскольку речь идет о	1	1
23	на то что в	4	1
24	и та и другая	1	1
25	только в том случае	1	1
26	с одной стороны в	1	1
27	то же время не	1	1
28	но как бы ни	1	1
29	как бы ни была	1	1
