N	4gram	Potebnia_M	Psycholo
1	заключается в том что	1	23
2	и в самом деле	1	19
3	в то время как	3	13
4	одной и той же	4	12
5	одно и то же	7	7
6	в том случае если	1	7
7	в том что она	1	7
8	в том что он	2	7
9	до тех пор пока	2	6
10	только в том случае	1	6
11	не что иное как	1	6
12	один и тот же	2	5
13	сводится к тому что	1	5
14	одним и тем же	4	4
15	все более и более	1	4
16	одного и того же	2	4
17	состоит в том что	1	4
18	в силу того что	2	4
19	одна и та же	2	4
20	прибавим к этому что	1	3
21	и в том что	2	3
22	в то же время	8	3
23	не в том чтобы	1	3
24	и то и другое	1	3
25	в том чтобы показать	1	3
26	друг с другом и	1	3
27	в том смысле что	2	3
28	дело в том что	1	3
29	не заключает в себе	3	3
30	ли мы вместе с	1	2
31	в произведении искусства и	1	2
32	внутренняя форма каждого из	1	2
33	был у него в	1	2
34	окно двери и сволок	1	2
35	каждого из этих слов	1	2
36	относится к содержанию как	1	2
37	не то что в	1	2
38	вовсе не в том	1	2
39	по самой своей природе	1	2
40	том случае если бы	1	2
41	именно в силу того	1	2
42	в том что оно	2	2
43	и в свою очередь	1	2
44	форма каждого из этих	1	2
45	только в том что	3	2
46	с одной стороны и	1	2
47	вместе с тем и	3	2
48	на то что в	1	2
49	и не может быть	1	2
50	тех пор пока мы	1	2
51	что в то время	3	2
52	и в том случае	1	2
53	смысле этого слова и	1	2
54	бы то ни было	1	2
55	но вместе с тем	1	2
56	в том и состоит	1	2
57	не в том что	4	2
58	не в состоянии объяснить	1	2
59	нам кажется что мы	1	2
60	есть не что иное	1	2
61	и веков могут сохранять	1	1
62	не за наше личное	1	1
63	образа в силе внутренней	1	1
64	в известной гибкости образа	1	1
65	глоток молока который был	1	1
66	внешняя форма женщины с	1	1
67	именно в том что	1	1
68	образом это мраморная статуя	1	1
69	этом рассказе может кому-нибудь	1	1
70	незамысловатом рассказе как бедняк	1	1
71	само по себе а	1	1
72	этим объясняется почему создания	1	1
73	очевидно что подобные рассказы	1	1
74	тесном смысле этого слова	1	1
75	мысль об отношении разных	1	1
76	выдадим его за объективное	1	1
77	ясно что и в	1	1
78	что же касается до	1	1
79	вызвать мысль об отношении	1	1
80	формы возбуждать самое разнообразное	1	1
81	в тесном смысле этого	1	1
82	значение загадки а не	1	1
83	представляющая правосудие содержание окажется	1	1
84	если будем рассуждать таким	1	1
85	это мраморная статуя внешняя	1	1
86	по себе а только	1	1
87	друг к другу и	1	1
88	мене зацрни то есть	1	1
89	у него в чашке	1	1
90	который вырывается из груди	1	1
91	что в произведении искусства	1	1
92	и т п и	1	1
93	содержанию как в слове	1	1
94	в этом рассказе может	1	1
95	гибкости образа в силе	1	1
96	к чувственному образу или	1	1
97	таким образом это мраморная	1	1
98	в том смысле как	1	1
99	свое художественное значение во	1	1
100	потому что он не	2	1
101	сказал саво саво себе	1	1
102	из этих слов иначе	1	1
103	с увеличением затруднений при	1	1
104	внутренней формы возбуждать самое	1	1
105	веков могут сохранять свое	1	1
106	темных людей и веков	1	1
107	как волна без следа	1	1
108	его за объективное значение	1	1
109	груди невозвратными и с	1	1
110	между тем и другим	2	1
111	в том смысле в	2	1
112	в силе внутренней формы	1	1
113	в том что художественное	1	1
114	сразу догадаться что он	1	1
115	обыкновенное выражение именно идея	1	1
116	художественное значение во времена	1	1
117	рассуждать таким образом это	1	1
118	вместе с тем мы	1	1
119	из сосуда его молоко	1	1
120	употребить более обыкновенное выражение	1	1
121	в этом можно убедиться	1	1
122	пора когда с увеличением	1	1
123	что даже тогда когда	1	1
124	лишь тогда когда он	1	1
125	следа унесла из сосуда	1	1
126	объясняется почему создания темных	1	1
127	как в слове представление	1	1
128	настает пора когда с	1	1
129	но очевидно что подобные	1	1
130	и к тому чтобы	1	1
131	друге каже не дай	1	1
132	потому что нельзя же	1	1
133	отношении разных слоев народа	1	1
134	увеличением затруднений при понимании	1	1
135	почему несмотря на мнимую	1	1
136	нравственной научной идеи и	1	1
137	на самом деле есть	1	1
138	ближайшее этимологическое значение слова	1	1
139	невозвратными и с личной	1	1
140	что ни одно из	1	1
141	рассказе может кому-нибудь почудиться	1	1
142	и в произведении искусства	2	1
143	в том что это	1	1
144	еще до сих пор	1	1
145	мы не в состоянии	1	1
146	с мечом и весами	1	1
147	когда с увеличением затруднений	1	1
148	в чашке как волна	1	1
149	одно окно двери и	1	1
150	чувственному образу или понятию	1	1
151	заслуга художника не в	1	1
152	только о том что	1	1
153	вечность искусства настает пора	1	1
154	рассказы живут по целым	1	1
155	понятию вместо содержание художественного	1	1
156	не само по себе	1	1
157	и как он сказал	1	1
158	содержания какое думалось ему	1	1
159	такое толкование будет ложно	1	1
160	в произведении искусства образ	1	1
161	когда мы выдадим его	1	1
162	для меня то что	2	1
163	и такое толкование будет	1	1
164	возбуждать самое разнообразное содержание	1	1
165	для того чтобы при	1	1
166	смысла а ради того	1	1
167	вопрос о том что	1	1
168	без следа унесла из	1	1
169	скромная загадка одно каже	1	1
170	более обыкновенное выражение именно	1	1
171	сосуда его молоко и	1	1
172	чашке как волна без	1	1
173	вопль который вырывается из	1	1
174	волна без следа унесла	1	1
175	думалось ему при создании	1	1
176	и с личной точки	1	1
177	а не за наше	1	1
178	потому что мы видим	1	1
179	в нем так же	1	1
180	ради своего буквального смысла	1	1
181	можем употребить более обыкновенное	1	1
182	с другой стороны чем	1	1
183	за наше личное состояние	1	1
184	в том случае когда	1	1
185	в нашем сознании и	1	1
186	если бы не было	1	1
187	загадка одно каже свитай	1	1
188	только в очень редких	1	1
189	свитай боже друге каже	1	1
190	образу или понятию вместо	1	1
191	неумолимое стихийно-разрушительное действие потока	1	1
192	целым столетиям не ради	1	1
193	содержание скромная загадка одно	1	1
194	действие потока мировых событий	1	1
195	дело вовсе не в	1	1
196	значение во времена высокого	1	1
197	создании а в известной	1	1
198	как он сказал саво	1	1
199	него в чашке как	1	1
200	искусства образ относится к	1	1
201	может вызвать мысль об	1	1
202	а в том как	2	1
203	двери и сволок может	1	1
204	при создании а в	1	1
205	по целым столетиям не	1	1
206	мы старались показать что	1	1
207	да и не нужно	1	1
208	а ради того который	1	1
209	правосудие содержание окажется что	1	1
210	живут по целым столетиям	1	1
211	женщины с мечом и	1	1
212	что подобные рассказы живут	1	1
213	автор а в том	1	1
214	политической нравственной научной идеи	1	1
215	каже свитай боже друге	1	1
216	содержание окажется что в	1	1
217	в слове представление к	1	1
218	как бедняк хотел было	1	1
219	и весами внутренняя форма	1	1
220	в очень редких случаях	1	1
221	в прямой зависимости от	1	1
222	слов иначе направляет мысль	1	1
223	случае когда мы выдадим	1	1
224	подобные рассказы живут по	1	1
225	на разных людей и	1	1
226	своего буквального смысла а	1	1
227	одно каже свитай боже	1	1
228	будем рассуждать таким образом	1	1
229	такое же значение как	1	1
230	потому что в нем	1	1
231	мнимую вечность искусства настает	1	1
232	и то же слово	2	1
233	лиц вопль который вырывается	1	1
234	может кому-нибудь почудиться неумолимое	1	1
235	вложен этим объясняется почему	1	1
236	найти их если будем	1	1
237	отдельных лиц вопль который	1	1
238	том случае когда мы	1	1
239	то это потому что	1	1
240	буквального смысла а ради	1	1
241	толкование будет ложно только	1	1
242	иначе не было бы	1	1
243	и т п но	1	1
244	слова в этом отношении	1	1
245	за объективное значение загадки	1	1
246	и сволок может вызвать	1	1
247	саво саво себе не	1	1
248	на мнимую вечность искусства	1	1
249	произведении искусства образ относится	1	1
250	этих слов иначе направляет	1	1
251	бы и в том	1	1
252	но опыт показывает что	1	1
253	может и не иметь	1	1
254	а в известной гибкости	1	1
255	столетиям не ради своего	1	1
256	никогда еще не было	1	1
257	художника не в том	1	1
258	вовсе не то что	1	1
259	в незамысловатом рассказе как	1	1
260	из груди невозвратными и	1	1
261	ложно только в том	1	1
262	создания темных людей и	1	1
263	почему создания темных людей	1	1
264	или что то же	1	1
265	молоко и как он	1	1
266	он сказал саво саво	1	1
267	в том что ее	1	1
268	бросается в глаза что	1	1
269	рассказе как бедняк хотел	1	1
270	а для того чтобы	1	1
271	развести глоток молока который	1	1
272	который был у него	1	1
273	не ради своего буквального	1	1
274	на то что оно	1	1
275	искусства настает пора когда	1	1
276	к содержанию как в	1	1
277	боже друге каже не	1	1
278	силе внутренней формы возбуждать	1	1
279	кому-нибудь почудиться неумолимое стихийно-разрушительное	1	1
280	содержание художественного произведения можем	1	1
281	только до тех пор	2	1
282	загадки а не за	1	1
283	его молоко и как	1	1
284	было набрать воды из	1	1
285	как и в первом	1	1
286	мраморная статуя внешняя форма	1	1
287	каже не дай боже	1	1
288	почудиться неумолимое стихийно-разрушительное действие	1	1
289	вырывается из груди невозвратными	1	1
290	произведения можем употребить более	1	1
291	их если будем рассуждать	1	1
292	может быть выведено из	1	1
293	а между тем в	1	1
294	и сами по себе	1	1
295	все одно окно двери	1	1
296	самое разнообразное содержание скромная	1	1
297	том и состоит чтобы	1	1
298	сохранять свое художественное значение	1	1
299	в самом деле в	1	1
300	или понятию вместо содержание	1	1
301	разнообразное содержание скромная загадка	1	1
302	так же ошибочно как	1	1
303	известной гибкости образа в	1	1
304	что само по себе	1	1
305	вместо содержание художественного произведения	1	1
306	объективное значение загадки а	1	1
307	будет ложно только в	1	1
308	сволок может вызвать мысль	1	1
309	об отношении разных слоев	1	1
310	разных слоев народа к	1	1
311	в том что как	2	1
312	будет найти их если	1	1
313	смысле этого слова что	1	1
314	того что в ней	1	1
315	бедняк хотел было набрать	1	1
316	хотел было набрать воды	1	1
317	заключенный в ней образ	1	1
318	ему при создании а	1	1
319	незаслуженными потерями легко ошибиться	1	1
320	какое думалось ему при	1	1
321	понимание но очевидно что	1	1
322	могут сохранять свое художественное	1	1
323	людей и веков могут	1	1
324	мы выдадим его за	1	1
325	образ относится к содержанию	1	1
326	несмотря на мнимую вечность	1	1
327	унесла из сосуда его	1	1
328	мечом и весами внутренняя	1	1
329	набрать воды из савы	1	1
330	наше личное состояние возбужденное	1	1
331	чувственный образ и представление	1	1
332	на каждом шагу в	1	1
333	окажется что в произведении	1	1
334	статуя внешняя форма женщины	1	1
335	слове представление к чувственному	1	1
336	указывает нам на то	1	1
337	форма женщины с мечом	1	1
338	стихийно-разрушительное действие потока мировых	1	1
339	и т п хотя	1	1
340	если бы она не	1	1
341	идеи и такое толкование	1	1
342	представление к чувственному образу	1	1
343	художественного произведения можем употребить	1	1
344	научной идеи и такое	1	1
345	а мене зацрни то	1	1
346	молока который был у	1	1
347	но и в том	1	1
