1	состоит в том что	7	16
2	в том что в	3	6
3	не что иное как	1	3
4	в тех случаях когда	2	2
5	состояло в том что	1	2
6	и в этом случае	1	2
7	но в данном случае	2	1
8	одно из значений слова	1	1
9	в том что они	1	1
10	подобно тому как в	1	1
11	не только потому что	1	1
12	говорит о том что	1	1
13	только по отношению к	1	1
14	одни и те же	1	1
15	это пока еще не	1	1
16	в данном случае мы	1	1
17	но ни одна из	1	1
18	одном и том же	1	1
19	одного и того же	4	1
20	но и потому что	1	1
21	не только по отношению	1	1
22	иметь в виду что	1	1
