1	в то же время	6	14
2	но в то же	3	6
3	дело в том что	3	4
4	в связи с этим	1	3
5	и до наших дней	1	1
6	с одной стороны и	3	1
7	может быть и речи	1	1
8	то же время в	1	1
9	но вместе с тем	1	1
10	одного и того же	2	1
11	в том что в	1	1
12	говорить о том что	1	1
13	это то же самое	1	1
14	нечего и говорить о	1	1
15	в одном и том	1	1
16	большей или меньшей степени	1	1
17	не что иное как	5	1
18	одном и том же	1	1
19	одной и той же	2	1
20	степени в зависимости от	1	1
21	в той или иной	1	1
22	не может быть и	1	1
23	можно сказать что в	1	1
24	свое значение и как	1	1
25	в большей или меньшей	1	1
26	то же самое что	2	1
27	в соответствии с этим	1	1
28	одно и то же	2	1
29	есть не что иное	3	1
