1	в том числе и	1	4
2	во времени и пространстве	4	4
3	обращает на себя внимание	4	3
4	в то же время	14	3
5	бы то ни было	3	3
6	в его событийной полноте	1	2
7	не что иное как	6	2
8	одного сознания к другому	1	2
9	состоит в том что	7	2
10	в той или иной	5	2
11	того или иного нарративного	1	2
12	от одного сознания к	1	2
13	в том или ином	4	2
14	пространственного ухода в частности	1	1
15	и искушенность в смертельно	1	1
16	линейного повествования размыкающего и	1	1
17	диалога и вторичные идеологические	1	1
18	как формы целого следовательно	1	1
19	инициации инверсией третьей и	1	1
20	ситуации рассказывания а не	1	1
21	не было и не	1	1
22	в свою очередь определяется	1	1
23	автором коммуникативного события предносящееся	1	1
24	своей природе суть то	1	1
25	мира и круговорот жизни	1	1
26	самому тогда как притчу	1	1
27	текст анекдота выбор лексики	1	1
28	субъектов дискурсии и ее	1	1
29	приобретение знаний и навыков	1	1
30	томлением разочарованием ожесточением мечтательностью	1	1
31	к сообщаемому рецептивная компетенция	1	1
32	кто говорит и как	2	1
33	адресату компетентность восприятия со	1	1
34	обряд инициации в качестве	1	1
35	индивида фаза символической смерти	1	1
36	иной коммуникативный статус научной	1	1
37	какой это существо начинало	1	1
38	модификаций анекдотического дискурса претерпевшего	1	1
39	позиции но в таком	1	1
40	в известном смысле домонологично	1	1
41	исследованная дж фрэзером при	1	1
42	увидел победил или а	1	1
43	отвечает представляется нам бессмысленным	1	1
44	притчи современный сугубо смеховой	1	1
45	окказионального ситуативного диалогизированного слова	1	1
46	продуктивный тип высказывания реализующий	1	1
47	вопросы то что ни	1	1
48	такое слово анекдота уже	1	1
49	сюжета в типологическом освещении	1	1
50	осуществлено только самим слушающим	1	1
51	репродуцируемых испытаний наконец четвертая	1	1
52	общенародной хвале хуле или	1	1
53	того кому рассказывается анекдот	1	1
54	а некий нравственный закон	1	1
55	для рассказчика ни для	1	1
56	последнем мы и сами	1	1
57	существенным образом ориентировано на	1	1
58	в частности сказание постулирует	1	1
59	не только ранней традиционной	1	1
60	устремленная от начала к	1	1
61	и ситуацией высказывания >	1	1
62	сказания героическая апофегма до	1	1
63	и строго отграниченная система	1	1
64	учета слушателя по бахтину	1	1
65	в сущности застывшее целое	1	1
66	иерархично оно не предполагает	1	1
67	сопровождается возвращением героя к	1	1
68	аспекте бахтин различал жанр	1	1
69	от отца к сыну	1	1
70	ценностно дистанцированной в сказании	1	1
71	опасном испытании порой в	1	1
72	здесь только исполнитель передаваемого	1	1
73	мужем царской дочери эта	1	1
74	один голос > оно	1	1
75	бахтин может ощущаться завершенная	1	1
76	передаче средствами линейного повествования	1	1
77	может быть сведена к	1	1
78	партнерства установление новых межсубъектных	1	1
79	мере в какой это	1	1
80	частности наличие так называемого	1	1
81	притчу в принципе можно	1	1
82	превращение юноши в мужчину	1	1
83	он оказывается уже по	1	1
84	собой не что иное	1	1
85	креативная компетенция жанра при	1	1
86	бесконечно репродуцируемых испытаний наконец	1	1
87	тематические и языковые с	1	1
88	анекдота или притчи явственно	1	1
89	которого анекдот легко может	1	1
90	внезакономерных явлениях а о	1	1
91	персонажи сказания не от	1	1
92	концепты героя и картины	1	1
93	веком героев бытийная компетенция	1	1
94	власти о воцарении пришельца	1	1
95	обязательно сообщает нечто смешное	1	1
96	складывается из четырех а	1	1
97	воспроизводимой в культуре коммуникативной	1	1
98	воспитания третью фазу в	1	1
99	сказание в известном смысле	1	1
100	перевод его в иной	1	1
101	дистанцированной в сказании повествуемой	1	1
102	разочарованием ожесточением мечтательностью вообще	1	1
103	форме индивидуального речевого замысла	1	1
104	системам определяя их внутреннюю	1	1
105	индивидуального речевого замысла говорящего	1	1
106	близкого существа или зрелище	1	1
107	прежних ранее расторгнутых или	1	1
108	стремится к однозначности и	1	1
109	и невымышленные анекдотические истории	1	1
110	событии о перемене власти	1	1
111	встречается в качестве нарративного	1	1
112	акцентируется его новое жизненное	1	1
113	здесь сводится к реализации	1	1
114	быть представлена избранничеством или	1	1
115	есть реализация такого выбора	1	1
116	названа маской в.т зависит	1	1
117	где притча нередко встречается	1	1
118	фазой обособления помимо внешнего	1	1
119	что по убеждению соучастников	1	1
120	воцариться в чужой стране	1	1
121	себя томлением разочарованием ожесточением	1	1
122	языку поэтому жанры как	1	1
123	пороговую фазу испытания смертью	2	1
124	моделируемая притчей напротив предполагает	1	1
125	древнейших этапов становления государственности	1	1
126	исконном значении этого слова	1	1
127	стадиально разнородных структур мышления	1	1
128	на заключительной стадии инициации	1	1
129	читатель может и не	1	1
130	отношения к сообщаемому характерно	1	1
131	от начала к концу	1	1
132	это существо начинало мыслиться	1	1
133	стадии инициации имеет место	1	1
134	донести до адресата авторские	1	1
135	рода существенно повышающим уровень	1	1
136	до которой притча редуцируется	1	1
137	жанр в свою очередь	1	1
138	родину чтобы воцариться в	1	1
139	к сообщенному знанию как	1	1
140	предполагает как раз ответственность	1	1
141	в диахронии жанр знаменует	1	1
142	статус события мыслилась как	1	1
143	таком случае его вступление	1	1
144	победил или а все-таки	1	1
145	суть референтная предметно-тематическая и	1	1
146	юмора умения отрешиться от	1	1
147	воскресающей весной растительностью мировое	1	1
148	сообщаемому характерно что несмотря	1	1
149	легкого повреждения или до	1	1
150	единственный в тексте случай	1	1
151	картины мира креативная компетенция	1	1
152	этического выбора все их	1	1
153	имеем дело не с	2	1
154	разнородных структур мышления мифологическое	1	1
155	есть нарушение запрета есть	1	1
156	в значительной степени зависим	1	1
157	зиме но воскресающей весной	1	1
158	риторика сказания риторика притчи	1	1
159	механизмом активизации воспринимающего сознания	1	1
160	сознанию той или иной	1	1
161	модели умирающего и воскресающего	1	1
162	к тому же в	2	1
163	бытования опосредованной коммуникации вторичны	1	1
164	смертельно опасном испытании порой	1	1
165	данной фазы способна решить	1	1
166	какой бы то ни	2	1
167	ложное партнерство предваряющие эффективное	1	1
168	при этом остается авторитарной	1	1
169	суть то что они	1	1
170	со стороны субъективной компетентности	1	1
171	происхождение сюжета в типологическом	1	1
172	общеизвестные пришел увидел победил	1	1
173	искушенности в литературе нового	1	1
174	в этом отношении от	1	1
175	жизненной позицией предполагающей разрыв	1	1
176	этом последнем мы и	1	1
177	к содержанию притчи не	1	1
178	конвенции концепированного б.о корман	1	1
179	соответственно риторика сказания это	1	1
180	событие самого рассказывания в	1	1
181	в качестве нарративного вкрапления	1	1
182	воспроизводимости нерушимого миропорядка символизируя	1	1
183	или иной позицией соучастника	1	1
184	адресата при этом остается	1	1
185	и аномалий который окружал	1	1
186	непреложный и неоспоримый миропорядок	1	1
187	референтная компетенция анекдота полярно	1	1
188	рассмотрении множества преданий о	1	1
189	реализация такого выбора не	1	1
190	нудительной серьезности бахтин жизни	1	1
191	урока из сюжета притчи	1	1
192	первое может быть проделано	1	1
193	рассказано в произведении и	1	1
194	помощников и/или вредителей нередко	1	1
195	к языку поэтому жанры	1	1
196	со смертью в той	1	1
197	зрелище чужой смерти и	1	1
198	пришельца доказавшего свою силу	1	1
199	традиционные для него концепты	1	1
200	предстают перед нами не	1	1
201	оно исключало необратимость свершающихся	1	1
202	решающую фазу смертельного испытания	1	1
203	преступается не предначертанность судьбы	1	1
204	в новейшее время внутреннего	1	1
205	установление новых межсубъектных связей	1	1
206	и быть может не	1	1
207	прежних жизненных связей в	1	1
208	речь нам всегда предносится	1	1
209	степени зависим от диалогической	1	1
210	притча нередко встречается в	1	1
211	недолжные пробы жизненного поведения	1	1
212	коммуникативного события на поучающего	1	1
213	инициируемого автором коммуникативного события	1	1
214	здесь действующие лица по	1	1
215	этом отношении от притчи	1	1
216	из четырех а не	1	1
217	рассказывания поскольку оно существенным	1	1
218	жанра состоит в смыслополагающей	1	1
219	о котором рассказано в	1	1
220	представляет собой исторически продуктивный	1	1
221	предметно-смысловые нахождения или изобретения	1	1
222	или сплетни то есть	1	1
223	героя к месту своих	1	1
224	отграниченная система смыслов оно	1	1
225	наиболее продуктивным в рамках	1	1
226	ни столь пассивным как	1	1
227	жизненное качество представленная последовательность	1	1
228	целого его завершения учета	1	1
229	частности возможно ложное партнерство	1	1
230	хотят и свершают картина	1	1
231	письменные формы их бытования	1	1
232	и жанровые зародыши тематические	1	1
233	повлиявший на мифологическое мышление	1	1
234	не может быть сведена	1	1
235	этого знания аналогичному адресату	1	1
236	поучающего и поучаемого это	1	1
237	себе самому тогда как	1	1
238	не трех как иногда	1	1
239	свою силу и искушенность	1	1
240	не верифицируемым знанием верификация	1	1
241	иной преемственно воспроизводимой в	1	1
242	но не верифицируемым знанием	1	1
243	хоровой сказание или диалогической	1	1
244	и круговорот жизни оно	1	1
245	существо начинало мыслиться индивидуальностью	1	1
246	нами не как объекты	1	1
247	сплетни то есть принадлежат	1	1
248	пассивным как к содержанию	1	1
249	для притчи иносказательность является	1	1
250	есть металингвистический язык диалект	1	1
251	соответствующего жанра сказание моделирует	1	1
252	репродуцируемых не о том	1	1
253	анекдотические истории не претендуют	1	1
254	инверсией третьей и четвертой	1	1
255	тому же обратное влияние	1	1
256	и до сего времени	1	1
257	предлагая адресату позицию внутренне	1	1
258	по себе они таковыми	1	1
259	условностей организации текста позволяющую	1	1
260	говорит и кому говорят	1	1
261	чтобы воцариться в чужой	1	1
262	строим свою речь нам	1	1
263	и картины мира креативная	1	1
264	а не трех как	1	1
265	к однозначности и прежде	1	1
266	в типологическом освещении было	1	1
267	предметно-тематическая и рецептивная установка	1	1
268	выбора в качестве бытийной	1	1
269	нормативное приложение запечатленного в	1	1
270	смерть и символическое воскресение	1	1
271	перерождение символическое второе рождение	1	1
272	они трактовали не об	1	1
273	поскольку оно существенным образом	1	1
274	соучастника данного коммуникативного события	1	1
275	роль по отношению к	1	1
276	вкрапления с другой паремия	1	1
277	представлена избранничеством или самозванством	1	1
278	из уст в уста	1	1
279	конвенции определяющие референтную компетенцию	1	1
280	табу дозволенное посрамление словесное	1	1
281	например утрата близкого существа	1	1
282	событием поэтому повторное выслушивание	1	1
283	текста поразительно и быть	1	1
284	достигшего половой зрелости человеческого	1	1
285	архаических формах ритуально-символической смерти	1	1
286	нередко встречается в качестве	1	1
287	зрелости человеческого существа приобретала	1	1
288	что ни на что	1	1
289	отвергает извращает осмеивает всякую	1	1
290	культуре коммуникативной ситуации типической	1	1
291	ни столь свободным как	1	1
292	личинка куколка имаго взрослая	1	1
293	котором рассказано в произведении	1	1
294	жизненного поведения в частности	1	1
295	от нудительной серьезности бахтин	1	1
296	приобщения к общенародной хвале	1	1
297	необыкновенное в новелле есть	1	1
298	реализуют в нем определенные	1	1
299	от своея воля рекоша	1	1
300	в себя томлением разочарованием	1	1
301	литературе нового времени данная	1	1
302	частности такого рода первофеноменами	1	1
303	поединка а может редуцироваться	1	1
304	например в значительной степени	1	1
305	солирует риторический предел сказания	1	1
306	или хотя бы достаточно	1	1
307	вступление в коммуникацию не	1	1
308	и рецептивная стороны коммуникативного	1	1
309	к зиме но воскресающей	1	1
310	эксцессов и аномалий который	1	1
311	достоверным но не верифицируемым	1	1
312	персонажа выделяющая его из	1	1
313	может и не занять	1	1
314	актанта здесь сводится к	1	1
315	второй в этом ряду	1	1
316	риторическими пределами притчи выступают	1	1
317	легкую безответственную передаваемость из	1	1
318	смертельного риска в частности	1	1
319	миропорядка жизнь глазами анекдота	1	1
320	словесное кощунство и непристойность	1	1
321	анекдот не признает никакого	1	1
322	воспринимающего сознания однако внутренняя	1	1
323	весной растительностью мировое древо	1	1
324	как объекты эстетического наблюдения	1	1
325	есть креативная компетенция жанра	1	1
326	царя-жреца не от отца	1	1
327	рассказчиком с иными подробностями	1	1
328	знания означала бы перевод	1	1
329	не рассчитан на репродуцирование	1	1
330	адресованности соотносительная с формой	1	1
331	рассказывания а не ценностно	1	1
332	персонажа референтная компетенция анекдота	1	1
333	плачу и наделенного репродуктивной	1	1
334	моделируемой текстами соответствующего жанра	1	1
335	сказания и одновременно резко	1	1
336	зерно сюжетного повествования составила	1	1
337	как субъекты этического выбора	1	1
338	однократных и внезакономерных явлениях	1	1
339	и все их основные	1	1
340	нарушение табу дозволенное посрамление	1	1
341	это риторика ролевого обезличенного	1	1
342	архитектоническим вектором мифологического мышления	1	1
343	жанровое целое внеязыковое и	1	1
344	по отношению к конкретным	1	1
345	слушателей преодолевая их внутреннюю	1	1
346	порой гипертрофируется и разворачивается	1	1
347	есть уже необратимое превращение	1	1
348	предыстория или хотя бы	1	1
349	бахтин жизни анекдот должен	1	1
350	притчи выступают с одной	1	1
351	внутренняя активность адресата при	1	1
352	в поединке с прежним	1	1
353	при рассмотрении множества преданий	1	1
354	как раз ответственность свободного	1	1
355	или преступается не предначертанность	1	1
356	на репродуцирование сообщенный в	1	1
357	картина мира где персонажем	1	1
358	фаз герой волшебной сказки	1	1
359	выслушивание одного и того	1	1
360	доказавшего свою силу и	1	1
361	к тому архаичному состоянию	1	1
362	сказания исторически восходит к	1	1
363	не всегда эксплицированного в	1	1
364	субъекта и адресата высказывания	1	1
365	мыслилась как необратимая в	1	1
366	беспрецедентных событиях общенародной сказание	1	1
367	и слушающих общим знанием	1	1
368	этой уготованной ему позиции	1	1
369	маской в.т зависит от	1	1
370	анекдот недостоверное знание что	1	1
371	рассказ о действительно необратимом	1	1
372	предполагается ни столь свободным	1	1
373	дифференцированном и оцененном мире	1	1
374	его вступление в коммуникацию	1	1
375	геннепа и в тэрнера	1	1
376	только ранней традиционной но	1	1
377	литературе новейшего времени также	1	1
378	убеждения организующего учительный дискурс	1	1
379	отношений анекдот не признает	1	1
380	вид сюжетных сами по	1	1
381	недостоверностью отвергает извращает осмеивает	1	1
382	смешное но обязательно курьезное	1	1
383	себе они таковыми не	1	1
384	на себя внимание и	1	1
385	соотносимое с умирающей к	1	1
386	говорящего или пишущего постигает	1	1
387	принадлежат самой ситуации рассказывания	1	1
388	затворничества она может быть	1	1
389	пределами притчи выступают с	1	1
390	а не ценностно дистанцированной	1	1
391	и как говорит концепты	1	1
392	отрешиться от нудительной серьезности	1	1
393	то что они хотят	1	1
394	сказания еще не такое	1	1
395	на что не отвечает	1	1
