1	и т д и	9	8
2	д и т д	7	7
3	т д и т	8	7
4	не говоря уже о	7	6
5	не что иное как	14	6
6	в то время как	12	6
7	ни в каком смысле	3	5
8	ни от чего не	1	5
9	ни в коем случае	4	4
10	это значит что он	1	4
11	ничем не отличается от	2	4
12	или по крайней мере	11	4
13	в коем случае не	1	4
14	с этой точки зрения	3	4
15	одной и той же	2	4
16	она не есть ни	1	3
17	по одному тому что	3	3
18	то это значит что	6	3
19	можно только тогда когда	1	3
20	это значит что мы	2	3
21	в то же время	1	3
22	и все на свете	1	3
23	в каком смысле не	3	3
24	не имеет никакого отношения	1	3
25	есть не что иное	11	3
26	по крайней мере в	6	3
27	есть то что мы	1	2
28	если его брать как	1	2
29	и т д в	1	2
30	в себе не содержит	2	2
31	а это значит что	3	2
32	если иметь в виду	4	2
33	уже по одному тому	3	2
34	и в то же	3	2
35	уже о том что	2	2
36	и тем не менее	15	2
37	ни в каком случае	12	2
38	идет речь именно о	1	2
39	одно и то же	4	2
40	говоря уже о том	2	2
41	только тогда когда есть	2	2
42	только на то что	2	2
43	ничего не говорит о	2	2
44	оно ничем не отличается	1	2
45	имеет никакого отношения к	1	2
46	с тем или другим	1	1
47	в таком случае вы	1	1
48	что бы то ни	4	1
49	ничего общего не имеет	2	1
50	сам по себе а	2	1
51	и в вопросе о	1	1
52	общего не имеет с	1	1
53	в связи с этим	4	1
54	по себе отнюдь не	1	1
55	это есть не что	1	1
56	не выдерживает никакой критики	1	1
57	это не значит что	3	1
58	если принять во внимание	2	1
59	внимание на то что	2	1
60	с одной стороны и	3	1
61	и сам по себе	1	1
62	но в то же	3	1
63	различить и противопоставить все	1	1
64	это значит что его	1	1
65	вопрос о том как	1	1
66	поскольку речь идет о	1	1
67	в том что они	1	1
68	здесь имеется в виду	2	1
69	что все на свете	1	1
70	взятая сама по себе	6	1
71	миф может существовать вне	1	1
72	сказать что она есть	1	1
73	мы находим например у	1	1
74	нельзя ни сказать ни	1	1
75	что тут имеется в	1	1
76	мы имеем в виду	2	1
77	ни в чем не	5	1
78	он не может быть	1	1
79	вовсе не думает что	1	1
80	тем не менее в	5	1
81	если это так то	2	1
82	уж тем более не	1	1
83	не тем что оно	1	1
84	ни одна из этих	1	1
85	это значит что оно	1	1
86	и в этом смысле	1	1
87	этой точки зрения в	1	1
88	отличаются друг от друга	3	1
89	т е есть ничто	1	1
90	себе вовсе еще не	2	1
91	несмотря ни на какую	1	1
92	уже сама по себе	1	1
93	а мы как раз	1	1
94	в том что в	2	1
95	и у меня в	1	1
96	кого бы то ни	1	1
97	что в данном случае	1	1
98	не содержащий в себе	1	1
99	можно ли сказать что	5	1
100	в чистом виде есть	1	1
101	помощи того или иного	2	1
102	в том что все	1	1
103	не говорит ни о	1	1
104	с точки зрения истории	1	1
105	друг от друга и	1	1
106	ли будет в таком	1	1
107	это и значит что	1	1
108	не сама по себе	2	1
109	с точки зрения самого	1	1
110	в самом деле если	1	1
111	заключается не в том	1	1
112	по себе вовсе еще	2	1
113	необходимо категорически утверждать что	1	1
114	по себе отнюдь еще	1	1
115	о котором уже нельзя	1	1
116	свой смысл и свое	1	1
117	и может быть даже	1	1
118	заключается в том что	6	1
119	можно прямо сказать что	1	1
120	и повелительно требует своего	1	1
121	как мы уже сказали	2	1
122	бы то ни стало	4	1
123	мы начинаем говорить о	1	1
124	до полного их слияния	1	1
125	а не что-нибудь иное	1	1
126	с той или иной	1	1
127	сам по себе отнюдь	1	1
128	в том смысле что	5	1
129	будет в таком случае	1	1
130	в каком случае нельзя	1	1
131	и уж тем более	7	1
132	до сих пор говорили	1	1
133	не есть также и	1	1
134	себе отнюдь еще не	1	1
135	когда мы говорим что	3	1
136	мифа в то время	1	1
137	то ни было другого	1	1
138	тут имеется в виду	1	1
139	не содержит в себе	1	1
140	которое ничего не знает	1	1
141	ничего нельзя ни сказать	1	1
142	есть та или иная	1	1
143	но как только мы	1	1
144	по самой своей природе	1	1
145	по крайней мере не	1	1
146	но о том что	1	1
147	и та или иная	1	1
148	и то и другое	2	1
149	ни сказать ни помыслить	1	1
150	это и есть настоящее	1	1
151	от чего не отличается	1	1
152	мы вовсе не имеем	1	1
153	тут не может быть	1	1
154	мы до сих пор	2	1
155	что она есть нечто	1	1
156	можно ли будет в	1	1
157	даже и не просто	1	1
158	не есть простая сумма	1	1
159	сама по себе а	2	1
160	во что бы то	4	1
161	то время как в	1	1
162	не только есть нечто	1	1
163	уж во всяком случае	7	1
164	о том как он	1	1
165	дело вовсе не в	1	1
166	уходящая в бесконечную даль	1	1
167	необходимо иметь в виду	1	1
168	не есть ни просто	1	1
169	так же как и	4	1
170	на самом же деле	8	1
171	это не есть ни	1	1
172	и т д все	2	1
173	в такой же мере	1	1
174	же это может быть	1	1
175	и есть то что	1	1
176	сам по себе и	1	1
177	даже если бы мы	1	1
178	если оно ничем не	1	1
179	не чем иным как	7	1
180	мы как раз и	1	1
181	вовсе не есть ни	3	1
182	быть так или иначе	1	1
183	бы то ни было	6	1
184	случае не есть ни	1	1
185	при помощи того или	2	1
