1	в том числе и	3	4
2	в то же время	15	3
3	бы то ни было	12	3
4	не что иное как	1	2
5	которым можно было бы	1	2
6	в той или иной	3	2
7	именно в том что	2	2
8	в том или ином	2	2
9	может быть сведена к	1	1
10	какой бы то ни	3	1
11	не может быть сведена	1	1
12	всего в том что	1	1
13	друг с другом и	1	1
14	в том что он	4	1
15	ничем не отличается от	1	1
16	одного и того же	9	1
17	по отношению к нему	1	1
18	прежде всего в том	1	1
19	то же время они	1	1
20	не с точки зрения	1	1
21	сам по себе а	1	1
22	дело в том что	1	1
23	с этой точки зрения	1	1
24	один и тот же	3	1
25	не может быть и	4	1
26	и с точки зрения	1	1
27	или даже вовсе не	1	1
28	той или иной форме	1	1
29	той или иной степени	2	1
