1	дело в том что	1	7
2	до тех пор пока	3	2
3	в том что в	8	2
4	как мы увидим ниже	1	2
5	не что иное как	4	2
6	в то время как	1	2
7	каждый из этих элементов	1	1
8	из всего этого видно	1	1
9	о чем можно судить	1	1
10	тех пор пока не	1	1
11	самом же деле это	1	1
12	в полной уверенности что	1	1
13	привело к тому что	2	1
14	всего этого видно что	1	1
15	но вместе с тем	3	1
16	и т д в	1	1
17	мы уже видели что	1	1
18	как мы уже знаем	2	1
19	состояла в том чтобы	1	1
20	по этому поводу с	1	1
21	вместе с тем и	2	1
22	том что в этот	1	1
23	в том чтобы установить	1	1
24	с места на место	1	1
25	необходимо указать еще на	1	1
26	приходит к выводу что	1	1
27	о том что в	1	1
28	а может быть и	1	1
29	но тем не менее	2	1
30	чем можно судить по	1	1
31	места на место в	1	1
32	никто из них не	1	1
33	на самом же деле	3	1
34	точно так же в	1	1
