1	одно и то же	5	6
2	так же как и	3	6
3	одной и той же	1	5
4	в то время как	4	5
5	одного и того же	9	5
6	только в том что	1	4
7	вместе с тем и	1	4
8	с этой точки зрения	1	4
9	как мы уже говорили	6	3
10	в том числе и	5	3
11	в том что в	1	3
12	и вместе с тем	1	2
13	в связи с этим	4	2
14	что в основе их	1	2
15	то что в основе	1	2
16	одном и том же	1	2
17	с нашей точки зрения	3	2
18	в том что они	1	2
19	мы уже говорили что	1	2
20	же как и все	1	1
21	этот вопрос в положительном	1	1
22	на первый план выступает	1	1
23	с одной стороны и	5	1
24	между этими двумя моментами	1	1
25	одну и ту же	1	1
26	во всяком случае нечто	1	1
27	том что он не	1	1
28	то время как другие	1	1
29	друг с другом мы	2	1
30	совершенно понятно что в	1	1
31	все больше и больше	1	1
32	мы наблюдаем и в	1	1
33	для того чтобы они	4	1
34	когда мы говорим о	1	1
35	на более высокой ступени	1	1
36	каковы бы они ни	1	1
37	мы будем говорить особо	1	1
38	связи с тем что	1	1
39	друг с другом в	1	1
40	это значит что если	1	1
41	более высокой ступени развития	1	1
42	и не могло бы	1	1
43	совершенно так же как	1	1
44	одна и та же	2	1
45	в том что он	1	1
46	выступает на первый план	1	1
47	или во всяком случае	1	1
48	и того же типа	1	1
49	все новых и новых	1	1
50	бы они ни были	1	1
51	как и во всех	1	1
52	в буквальном смысле слова	1	1
53	одних и тех же	4	1
54	с другой стороны они	1	1
55	в основе его лежит	1	1
56	в другом месте как	1	1
57	оно не может быть	1	1
58	и к которому мы	1	1
59	не выходит за пределы	1	1
60	которая в свою очередь	1	1
61	это мы наблюдаем и	1	1
62	в связи с тем	1	1
63	во всех этих случаях	1	1
64	и с точки зрения	1	1
65	все же в них	1	1
66	все более и более	2	1
67	в своем дальнейшем развитии	1	1
68	о которой мы говорили	1	1
