1	состоит в том что	7	3
2	в собственном смысле слова	1	3
3	ни к чему не	1	2
4	в том случае если	1	2
5	не что иное как	6	2
6	в тех случаях когда	2	2
7	бы то ни было	3	2
8	то что они хотят	1	1
9	одна из них не	1	1
10	с тех пор как	1	1
11	ни в коем случае	2	1
12	есть на самом деле	1	1
13	в то же время	14	1
14	одно и то же	2	1
15	во всех этих случаях	1	1
16	один и тот же	2	1
17	ни одна из них	1	1
18	приводит к тому что	1	1
19	в том что он	4	1
20	или во всяком случае	1	1
21	во всех подобных случаях	1	1
22	с точки зрения исторической	1	1
23	в отдельных случаях может	1	1
24	в коем случае не	2	1
25	с этой точки зрения	2	1
26	мы видим что в	1	1
27	есть не что иное	5	1
