1	не что иное как	1	6
2	состоит в том что	6	2
3	точно так же как	2	2
4	начинается с того что	1	2
5	в то время как	1	2
6	есть не что иное	1	2
7	в том смысле как	1	1
8	в связи с этим	1	1
9	дело не только в	2	1
10	и так или иначе	1	1
11	мы имеем дело с	5	1
12	в данном случае в	1	1
13	все время пребывания в	1	1
14	ни тот ни другой	1	1
15	и не может быть	2	1
16	как если бы она	1	1
17	и здесь мы имеем	1	1
18	с этой точки зрения	1	1
19	в том что и	1	1
20	это все те же	1	1
21	точно так же в	1	1
22	но все же не	1	1
