1	одно и то же	5	6
2	одной и той же	4	5
3	одному и тому же	1	5
4	к одному и тому	1	5
5	одного и того же	1	5
6	вместе с тем и	2	4
7	одним и тем же	1	4
8	в собственном смысле слова	1	3
9	одни и те же	2	3
10	и то же слово	2	3
11	в связи с этим	2	2
12	одном и том же	2	2
13	не что иное как	2	2
14	с нашей точки зрения	1	2
15	к одной и той	1	2
16	с их точки зрения	1	1
17	с помощью которого он	1	1
18	при этом не только	1	1
19	одну и ту же	2	1
20	этом мы будем говорить	1	1
21	все больше и больше	2	1
22	что же представляет собой	1	1
23	можем подвести некоторые итоги	1	1
24	само по себе не	1	1
25	как мы увидим ниже	1	1
26	мы можем подвести некоторые	1	1
27	мы никогда не сможем	1	1
28	и содержание и форму	2	1
29	итак мы видим что	1	1
30	одна и та же	1	1
31	в дальнейшем мы будем	1	1
32	то что мы в	1	1
33	теми или иными предметами	1	1
34	одних и тех же	1	1
35	играет решающую роль в	1	1
36	уже содержит в себе	1	1
37	есть не что иное	2	1
38	которые являются как бы	1	1
