N	4gram	Tiupa_Disk	Narrotol
1	в даме с собачкой	1	9
2	в то же время	7	8
3	состоит в том что	2	6
4	мы имеем дело с	1	5
5	дело в том что	3	3
6	внимание на то что	1	3
7	главное действующее лицо события	2	2
8	мысль о том что	1	2
9	рассказывания в этом последнем	1	2
10	действующее лицо события свидетель	2	2
11	с той или иной	2	2
12	сами участвуем как слушатели-читатели	1	2
13	и не может быть	1	2
14	последнем мы и сами	1	2
15	и сами участвуем как	1	2
16	самого рассказывания в этом	1	2
17	едва ли не наиболее	1	2
18	и в то же	2	2
19	одного и того же	4	2
20	события свидетель и судия	2	2
21	этом последнем мы и	1	2
22	мы и сами участвуем	1	2
23	одно и то же	2	2
24	в этом последнем мы	1	2
25	то же самое следует	1	2
26	в той или иной	1	2
27	лицо события свидетель и	2	2
28	человеческого я в мире	1	2
29	новое и главное действующее	1	1
30	примера временного отступления от	1	1
31	[...] то потому что	1	1
32	речи формировать культурную память	1	1
33	и не могло быть	1	1
34	организованности высказываний как неизбежно	1	1
35	к различным статусам местам	1	1
36	чтобы'' ''из-за'' и т.д	1	1
37	в полном его составе	1	1
38	классической эстетической завершенности целого	1	1
39	того чтобы'' ''из-за'' и	1	1
40	этому времени наррация давно	1	1
41	удовлетворил мучается бессонницей от	1	1
42	себя в другом и	1	1
43	мотивы первых двух историй	1	1
44	беликов а сам алехин	1	1
45	автор облеченный в молчание	1	1
46	с каждым читателем ведет	1	1
47	внутритекстовые наррации разобщают молчали	1	1
48	интригу мировой истории а	1	1
49	в готовом стабильно дифференцированном	2	1
50	создается характерный эффект чеховского	1	1
51	оно живет в готовом	2	1
52	в едином но сложном	1	1
53	дифференцированном и оцененном мире	2	1
54	уж это вы из	1	1
55	того что является событием	1	1
56	традиционно комическую карнавальную пару	1	1
57	апокалипсис с книгой бытия	1	1
58	искусно формирует все необходимые	1	1
59	шагом природного социального или	1	1
60	порицают своих персонажей решительно	1	1
61	участвуем как слушатели-читатели события	1	1
62	солидарность двух равнодостойных не	1	1
63	не было и не	1	1
64	и того и другого	1	1
65	повторяются ситуации и мотивы	1	1
66	различные и по длительности	1	1
67	говорящий ни слушающий не	1	1
68	мифов-нарраций никогда не было	1	1
69	писателями [...] то потому	1	1
70	ту самую коммуникативную ситуацию	1	1
71	засыпает а слушатель которого	1	1
72	они сходятся в новом	1	1
73	не было в предыдущих	1	1
74	оставляет читателю апеллируя к	1	1
75	характерный эффект чеховского письма	1	1
76	задушевный разговор наедине отсюда	1	1
77	нем осуществляется прямолинейная оценка	1	1
78	не упускать из виду	1	1
79	дистанцию по отношению к	1	1
80	события событие о котором	1	1
81	четкий и двусмысленный четкий	1	1
82	момент в [...] смысл	1	1
83	герою своему искусно сохраните	1	1
84	должны предполагать наличие [...]	1	1
85	аффективное состояние получателя которое	1	1
86	может претендовать на статус	1	1
87	а их былое разобщение	1	1
88	по природе своей не	1	1
89	этом первые два рассказчика	1	1
90	не рассказывает а показывает	1	1
91	содержание и того и	1	1
92	нарративность в качестве способности	1	1
93	в напряжении событийного ряда	2	1
94	рассказе о ней мифов-нарраций	1	1
95	о своем как будто	1	1
96	укладом своей жизни напоминает	1	1
97	черты характера среди любых	1	1
98	мыслей при этом первые	1	1
99	этим создается характерный эффект	1	1
100	перед нами два события	1	1
101	только в учебниках по	1	1
102	полюс подлинного положителен по	1	1
103	и социальные характеристики другие	1	1
104	истине красоте и т.п	1	1
105	события эти происходят в	1	1
106	не в рассказе о	1	1
107	ивана иваныча и только	1	1
108	ситуацию читательского выбора между	1	1
109	дело рассказ алехина хотя	1	1
110	регулярности различных позиций субъективности	1	1
111	глухи к ответной реакции	1	1
112	цитирование стенографическая передача карикатурное	1	1
113	того о ком или	1	1
114	равнодостойных не соподчиненных сознаний	1	1
115	предпосылки для классической эстетической	1	1
116	живет в готовом стабильно	2	1
117	хорошо известными слушателям чего	1	1
118	даль и сближение но	1	1
119	облеченный в молчание бахтин	1	1
120	в речевой практике общения	1	1
121	и того о ком	1	1
122	иной области дискурсивных практик	1	1
123	открытую ситуацию читательского выбора	1	1
124	характера среди любых событий	1	1
125	остаются каждый в своем	1	1
126	каждым читателем ведет задушевный	1	1
127	нем звучит один голос	2	1
128	разобщение преодолевается что подчеркнуто	1	1
129	но этико-интеллектуальное содержание и	1	1
130	строгом значении этого термина	1	1
131	стенографическая передача карикатурное передразнивание	1	1
132	как слушатели-читатели события эти	1	1
133	себе дорогу через сеть	1	1
134	например сапожника иначе говоря	1	1
135	в рассказе о ней	1	1
136	формирует все необходимые предпосылки	1	1
137	трактует последний как коммуникативное	1	1
138	тойн а ван дейк	2	1
139	эмоционально-волевой тональности одного и	1	1
140	нашей способности прослеживать историю	1	1
141	только в перформативной установке	1	1
142	и описываемое как вещь	1	1
143	оценка [...] в нем	1	1
144	пиететное цитирование стенографическая передача	1	1
145	возможностей пролагающий себе дорогу	1	1
146	сердились друг на друга	1	1
147	две внутритекстовые наррации разобщают	1	1
148	подчеркнуто в финале привходящими	1	1
149	картина мира которая может	1	1
150	автора слушающего читателя и	1	1
151	то что и должно	2	1
152	практик дискурсивная деятельность опирается	1	1
153	дискурса проявляется как непрерывный	1	1
154	и на разных местах	1	1
155	строго отграниченная система смыслов	2	1
156	котором рассказано в произведении	1	1
157	занимать или принимать когда	1	1
158	произведении и событие самого	1	1
159	вследствие непроизвольно возникающей солидарности	1	1
160	порой расхождения в истолковании	1	1
161	истолкованием всего рассказанного как	1	1
162	всякий раз спокойно засыпает	1	1
163	том что и буркин	1	1
164	читателя и того о	1	1
165	знакомством с повествовательной традицией	1	1
166	с одной стороны и	3	1
167	как произведение в его	1	1
168	не может передать оборотов	1	1
169	сближение но не слияние	1	1
170	индивида и его поступки	1	1
171	всякая литературная интрига своего	1	1
172	событием самого рассказывания в	1	1
173	объединены в едином но	1	1
174	может ощущаться завершенная и	1	1
175	формировать культурную память как	1	1
176	историй в лугановиче легко	1	1
177	иваныч говорят о своем	1	1
178	едином но сложном событии	1	1
179	же самое следует сказать	1	1
180	новом третьем мире мире	1	1
181	связная сюжетная цепь воспроизводилась	1	1
182	статусам местам и позициям	1	1
183	понимание входит как диалогический	1	1
184	представляет собой грандиозную интригу	1	1
185	взаимодействия трех говорящего автора	1	1
186	обозначить как произведение в	1	1
187	установка [...] наблюдателя упраздняет	1	1
188	воспроизведение чужих высказываний пиететное	1	1
189	а не в рассказе	1	1
190	но именно солидарность двух	1	1
191	и т.п и требующий	1	1
192	дискурсивное умение которое ничем	1	1
193	завершения ответ на правильно	1	1
194	к этому времени наррация	1	1
195	тем или иным образом	1	1
196	и двусмысленный четкий потому	1	1
197	в слове писал бахтин	1	1
198	целого но заключительный акт	1	1
199	следствие овладения понятийным мышлением	1	1
200	после рассказа ивана иваныча	1	1
201	молчали после рассказа ивана	1	1
202	от их жизненного опыта	1	1
203	состоит в напряжении событийного	2	1
204	нами два события событие	1	1
205	на друга на утро	1	1
206	ни говорящий ни слушающий	1	1
207	между жизнью и смертью	1	1
208	непроизвольно возникающей солидарности взаимодействующих	1	1
209	рассказчика-охотника своими портретными характеристиками	1	1
210	и строго отграниченная система	2	1
211	третьего рассказа оказались хорошо	1	1
212	двух равнодостойных не соподчиненных	1	1
213	истолковании эмоционально-волевой тональности одного	1	1
214	мира по природе своей	1	1
215	уступает умению например сапожника	1	1
216	интриги соединяющей апокалипсис с	1	1
217	принадлежащих к той или	1	1
218	но сложном событии которое	1	1
219	рассказ не удовлетворил мучается	1	1
220	прямолинейная оценка [...] в	1	1
221	счастья общеинтересными в концовке	1	1
222	по бахтину нельзя понять	1	1
223	умение которое ничем не	1	1
224	сеть ограничений постольку дискурс	1	1
225	неизбежно принадлежащих к той	1	1
226	проблематика тайны личного счастья	1	1
227	с большей или меньшей	1	1
228	как примера временного отступления	1	1
229	ничем не уступает умению	1	1
230	не только потому что	1	1
231	что и должно происходить	1	1
232	характеристики другие аспекты социальной	1	1
233	к истине красоте и	1	1
234	высказываний пиететное цитирование стенографическая	1	1
235	позициям которые субъект может	1	1
236	времени и пространства а	1	1
237	решительно отстраняются от их	1	1
238	наблюдаемое и описываемое как	1	1
239	вы из другой оперы	1	1
240	первого и второго лица	1	1
241	иное дело рассказ алехина	1	1
242	и притчевым его восприятием	1	1
243	ну уж это вы	1	1
244	трех говорящего автора слушающего	1	1
245	ряда возбуждающем некие рецептивные	1	1
246	бахтину нельзя понять со	1	1
247	т.п и требующий ответного	1	1
248	повседневная практика общения доступна	1	1
249	на утро после рассказа	1	1
250	самое следует сказать и	1	1
251	друг на друга на	1	1
252	разные времена различные и	1	1
253	которое ничем не уступает	1	1
254	футляре крыжовник о любви	1	1
255	не отделен от своей	1	1
256	предполагать наличие [...] компетенции	1	1
257	видов не только словесные	1	1
258	но одновременно это и	1	1
259	построений зрелого чехова всегда	1	1
260	наррации разобщают молчали точно	1	1
261	напряжении событийного ряда возбуждающем	1	1
262	и только третья рассказ	1	1
263	состояние получателя которое возникает	1	1
264	завершенная и строго отграниченная	2	1
265	том что ни говорящий	1	1
266	же время они неразрывно	1	1
267	это непосредственное воспроизведение чужих	1	1
268	жизненного опыта иное дело	1	1
269	происходят в разные времена	1	1
270	читателем ведет задушевный разговор	1	1
271	своей судьбы они едины	1	1
272	греймас выводит из организованности	1	1
273	ней мифов-нарраций никогда не	1	1
274	возникающей солидарности взаимодействующих сознаний	1	1
275	истории а всякая литературная	1	1
276	дискурсивная деятельность опирается на	1	1
277	цепь воспроизводилась древними писателями	1	1
278	то потому что к	1	1
279	выводит из организованности высказываний	1	1
280	гостиной и молчали после	1	1
281	отсюда столь значительные порой	1	1
282	и того же текста	1	1
283	в том что и	1	1
284	в нем осуществляется прямолинейная	1	1
285	двух историй в лугановиче	1	1
286	событийного ряда возбуждающем некие	1	1
287	считал главной для чеховских	1	1
288	объединяет собеседников дело в	1	1
289	с адресатом как иерархические	1	1
290	как будто просил лично	1	1
291	что к этому времени	1	1
292	едины судьба выражает внеличную	1	1
293	деятельность опирается на дискурсивное	1	1
294	и его поступки только	1	1
295	что нарративность в качестве	1	1
296	возможность наделять чеховский текст	1	1
297	а предмет разговора стали	1	1
298	что ни говорящий ни	1	1
299	красоте и т.п и	1	1
300	стали говорить о любви	1	1
301	упраздняет коммуникативные роли первого	1	1
302	в связи с кристаллизацией	1	1
303	предыдущих повествованиях а предмет	1	1
304	открытым вопрос следует ли	1	1
305	временного отступления от всеобщего	1	1
306	же текста чеховедами самой	1	1
307	и позициям которые субъект	1	1
308	всех видов не только	1	1
309	практике общения это непосредственное	1	1
310	произведение в его событийной	1	1
311	преодолевается что подчеркнуто в	1	1
312	восприятием как примера временного	1	1
313	и молчали после рассказа	1	1
314	ни в чем не	1	1
315	однозначности [...] в нем	2	1
316	их былое разобщение преодолевается	1	1
317	объяснить производство и восприятие	1	1
318	сознаний содержание рассказа в	1	1
319	получает дальнейшее развитие а	1	1
320	может быть сведена к	1	1
321	сюжетная цепь воспроизводилась древними	1	1
322	известными слушателям чего не	1	1
323	главной для чеховских произведений	1	1
324	слушающего читателя и того	1	1
325	умению например сапожника иначе	1	1
326	привходящими моментами символического характера	1	1
327	между анекдотическим истолкованием всего	1	1
328	по мифологии если же	1	1
329	говоря мы должны предполагать	1	1
330	или иной области дискурсивных	1	1
331	и требующий ответного понимания	1	1
332	освоение человеческим сознанием событийной	1	1
333	каждый в своем собственном	1	1
334	потому что к этому	1	1
335	автор оставляет читателю апеллируя	1	1
336	правильно поставленный вопрос автор	1	1
337	звучит один голос [...]	2	1
338	как диалогический момент в	1	1
339	через сеть ограничений постольку	1	1
340	коммуникативной эстетической и моральной	1	1
341	все необходимые предпосылки для	1	1
342	времени наррация давно функционировала	1	1
343	рассказа буркина сидели в	1	1
344	мучается бессонницей от наплыва	1	1
345	которые отсылают к различным	1	1
346	просил лично для себя	1	1
347	буркин и иван иваныч	1	1
348	его коммуникативной эстетической и	1	1
349	той или иной области	1	1
350	ком или о чем	1	1
351	оставляя открытым вопрос следует	1	1
352	рассказывается буркиным как анекдот	1	1
353	получателя которое возникает в	1	1
354	ван дейк четко разграничивая	1	1
355	тональности одного и того	1	1
356	оказались хорошо известными слушателям	1	1
357	добра и зла или	1	1
358	стороны бытия следствие овладения	1	1
359	пролагающий себе дорогу через	1	1
360	читателю апеллируя к его	1	1
361	соединяющей апокалипсис с книгой	1	1
362	событие самого рассказывания в	1	1
363	на разных местах и	1	1
364	способности человеческой речи формировать	1	1
365	которое возникает в результате	1	1
366	в окказиональном мире в	1	1
367	произведения всех видов не	1	1
368	наблюдателя упраздняет коммуникативные роли	1	1
369	мышлением которое по фрейденберг	1	1
370	сапожника иначе говоря мы	1	1
371	следует сказать и о	1	1
372	повторяющееся действие или положение	1	1
373	спокойно засыпает а слушатель	1	1
374	нем повторяются ситуации и	1	1
375	один голос [...] оно	2	1
376	грандиозную интригу мировой истории	1	1
377	слушателям чего не было	1	1
378	говорящего автора слушающего читателя	1	1
379	подлинного положителен по отношению	1	1
380	именно солидарность двух равнодостойных	1	1
381	места времени и действия	1	1
382	со стороны самое понимание	1	1
383	рассказывает а показывает имитирует	1	1
384	два события событие о	1	1
385	для классической эстетической завершенности	1	1
386	своих персонажей решительно отстраняются	1	1
387	в том что ни	1	1
388	в креслах в разных	1	1
389	потому что полюс подлинного	1	1
390	выговорившийся всякий раз спокойно	1	1
391	о ней мифов-нарраций никогда	1	1
392	ценности к истине красоте	1	1
393	событии которое мы можем	1	1
394	своего рода миниатюра большой	1	1
395	[...] компетенции если хотим	1	1
396	дающей масштабы того что	1	1
397	говорить о любви и	1	1
398	к тому или иному	1	1
399	беликова рассказывается буркиным как	1	1
400	[...] в нем осуществляется	1	1
401	чужих высказываний пиететное цитирование	1	1
402	понять со стороны самое	1	1
403	в нем звучит один	2	1
404	в новом третьем мире	1	1
405	при этом первые два	1	1
406	общеинтересными в концовке рассказа	1	1
407	и главное действующее лицо	1	1
408	заново актуализированная женеттом была	1	1
409	практика общения доступна нам	1	1
410	своем собственном мире напротив	1	1
411	и восприятие конкретных дискурсов	1	1
412	местам и позициям которые	1	1
413	''для того чтобы'' ''из-за''	1	1
414	высказываний как неизбежно принадлежащих	1	1
415	мира дающей масштабы того	1	1
416	оптимистически настроенный читатель получает	1	1
417	своему искусно сохраните черты	1	1
418	а слушатель которого рассказ	1	1
419	точно сердились друг на	1	1
420	разных концах гостиной и	1	1
