1	и тем не менее	1	8
2	не что иное как	1	5
3	есть не что иное	1	5
4	свидетельствует о том что	1	3
5	дело в том что	3	3
6	если бы не было	1	3
7	в связи с этим	1	2
8	внимание на то что	3	2
9	с одной стороны и	1	2
10	можно сказать что он	1	2
11	одним и тем же	1	2
12	по себе но как	1	2
13	мысль о том что	2	2
14	в том числе и	1	2
15	в то время как	1	2
16	одного и того же	2	2
17	в определенный момент времени	1	1
18	иметь в виду и	1	1
19	не объективна и не	1	1
20	является в данном случае	1	1
21	в том случае если	1	1
22	не только потому что	1	1
23	и в то же	2	1
24	одно и то же	2	1
25	не для того чтобы	1	1
26	именно то что он	1	1
27	мы пока еще не	1	1
28	он не может быть	1	1
29	настаивать на том что	1	1
30	еще и потому что	2	1
31	но еще и потому	1	1
32	и не только в	1	1
33	один и тот же	1	1
34	и с точки зрения	1	1
35	и в самом деле	1	1
36	как и многие другие	1	1
37	представление о том что	1	1
38	в той или иной	2	1
39	но для того чтобы	1	1
40	и в них тоже	1	1
41	и не может быть	2	1
42	о том что в	1	1
43	уж во всяком случае	1	1
44	к тому или иному	1	1
45	до поры до времени	1	1
46	объективна и не субъективна	1	1
47	в том или ином	1	1
