1	в то же время	15	10
2	друг с другом и	1	2
3	тот или иной момент	1	1
4	в свою очередь является	1	1
5	в данном частном вопросе	1	1
6	до сих пор мы	1	1
7	несмотря на то что	2	1
8	ни к чему не	1	1
9	на самом деле ничего	1	1
10	в том числе и	3	1
11	сводится к тому что	2	1
12	то же время эти	1	1
13	связаны друг с другом	1	1
14	одного и того же	9	1
15	одну и ту же	1	1
16	она может лишь в	1	1
17	само собой разумеется что	1	1
18	котором она могла бы	1	1
19	и в этом случае	1	1
20	но в то же	9	1
21	указывает на то что	1	1
22	и не может быть	5	1
23	от этого не меняется	1	1
24	в самом деле для	1	1
25	в тот или иной	1	1
26	дело в том что	1	1
27	во всех этих случаях	1	1
28	и с точки зрения	1	1
29	друг с другом как	1	1
30	ведь в данном случае	1	1
31	бы то ни было	12	1
32	отнюдь не может быть	2	1
33	только с точки зрения	1	1
34	и более или менее	1	1
35	и прежде всего в	1	1
