1	в то же время	2	10
2	и в то же	1	6
3	одного и того же	1	6
4	в том числе и	4	4
5	с нашей точки зрения	1	3
6	мы имеем в виду	1	2
7	те же что и	1	2
8	похожи друг на друга	1	2
9	но в то же	1	2
10	все более и более	1	2
11	в одном и том	1	1
12	между этими двумя моментами	1	1
13	в том что они	1	1
14	и вместе с тем	3	1
15	мы уже говорили о	1	1
16	но вместе с тем	2	1
17	в связи с тем	1	1
18	и в этом отношении	1	1
19	вместе с тем и	1	1
20	до сих пор не	1	1
21	и для того чтобы	2	1
22	говорили о том что	2	1
23	до сих пор еще	2	1
24	одном и том же	1	1
25	уже говорили о том	1	1
26	но в конце концов	1	1
27	он не имеет ни	1	1
28	в данном случае мы	1	1
29	с этой точки зрения	2	1
30	не похожи друг на	1	1
31	же что и у	1	1
32	то же время он	1	1
