1	той мере в какой	2	6
2	в то же время	8	6
3	в той мере в	2	6
4	не что иное как	1	5
5	с одной стороны и	5	3
6	дело в том что	5	3
7	есть не что иное	1	3
8	одной и той же	2	2
9	состоит в том что	7	2
10	одно и то же	3	2
11	по тем или иным	1	2
12	одного и того же	4	2
13	заключается в том что	1	2
14	как уже было сказано	2	2
15	только после того как	1	2
16	в том или ином	1	2
17	не может быть вполне	1	1
18	но в этом случае	1	1
19	не говоря уже о	3	1
20	с данной точки зрения	1	1
21	в той или иной	1	1
22	в большей или меньшей	1	1
23	в том что в	3	1
24	не одно и то	1	1
25	в науке о литературе	2	1
26	не только в том	1	1
27	мы имеем дело с	1	1
28	большей или меньшей степени	1	1
29	того же автора и	1	1
30	это как будто бы	1	1
31	одном и том же	1	1
32	только в одном отношении	1	1
33	и именно в этом	1	1
34	только в том что	1	1
35	в том что с	1	1
36	в том что не	1	1
37	тех или иных отношениях	1	1
38	она во всяком случае	1	1
39	в соответствии с правилами	1	1
40	в том что он	1	1
41	этим в частности объясняется	1	1
42	в принципе не может	1	1
43	в тех или иных	1	1
44	бы то ни было	2	1
