1	по мере того как	8	6
2	но тем не менее	6	6
3	только в том что	1	5
4	в том смысле в	1	4
5	том смысле в каком	1	4
6	и в этом смысле	1	3
7	в то же время	1	3
8	дело в том что	2	3
9	одной и той же	2	3
10	с одной стороны и	3	2
11	уже с самого начала	2	2
12	не может быть названо	1	2
13	тем не менее в	1	2
14	но с другой стороны	1	2
15	не что иное как	11	2
16	и то и другое	2	2
17	начнем с указания на	1	2
18	а в том что	1	2
19	в том смысле что	1	2
20	которые не могут быть	1	2
21	сами по себе а	1	1
22	в том смысле как	1	1
23	тем не менее и	1	1
24	более или менее ясно	1	1
25	связь с тем что	1	1
26	сам по себе не	1	1
27	тем не менее если	1	1
28	с другой стороны он	2	1
29	что в некоторых случаях	2	1
30	подобно тому как в	1	1
31	не говоря уже о	1	1
32	не только в том	1	1
33	сами по себе они	1	1
34	это будет видно из	1	1
35	тем не менее они	1	1
36	друг на друга и	1	1
37	равно как если бы	1	1
38	точно так же как	6	1
39	д и т д	1	1
40	т д то это	2	1
41	между человеком и животным	2	1
42	в чем бы ни	1	1
43	смысле этого слова при	1	1
44	один и тот же	3	1
45	и т д и	5	1
46	тем не менее он	1	1
47	переходят друг в друга	1	1
48	во всяком случае не	1	1
49	видно из того что	1	1
50	само по себе не	1	1
51	заключается в том что	1	1
52	указывает на то что	2	1
53	не менее и они	1	1
54	в том что он	2	1
55	кого мы до сих	1	1
56	можно бы думать что	2	1
57	говоря уже о том	1	1
58	и т д то	5	1
59	все равно как если	1	1
60	выше мы видели что	7	1
61	в то время как	13	1
62	в более или менее	1	1
63	мы до сих пор	4	1
64	сама по себе не	1	1
65	сказать что и в	1	1
66	только после того как	5	1
67	узнает что у него	1	1
68	бы не в состоянии	1	1
69	то это было бы	1	1
70	нельзя сказать чтобы все	2	1
71	с этой точки зрения	6	1
72	уже о том что	1	1
73	с другой стороны и	5	1
74	и т д в	5	1
75	бы то ни было	3	1
76	и с этой стороны	1	1
