1	в то же время	55	10
2	но в то же	20	5
3	в том что он	1	4
4	и в то же	12	3
5	это не значит конечно	1	3
6	не значит конечно что	1	3
7	на мир и на	2	3
8	так же как и	2	3
9	то же время не	2	3
10	под этим углом зрения	1	2
11	на протяжении всего романа	1	2
12	подобно тому как в	1	2
13	мы имеем в виду	5	2
14	точка зрения на мир	1	2
15	и в целом ряде	2	2
16	бы он ни был	1	2
17	той или иной степени	3	2
18	мы можем сказать что	2	2
19	видения и понимания мира	1	2
20	с начала и до	14	2
21	точку зрения на мир	3	2
22	они уже не могут	1	2
23	в целом ряде других	2	2
24	в той или иной	10	2
25	совершенно так же как	2	2
26	в то время как	1	2
27	начала и до конца	14	2
28	и в этом отношении	1	2
29	бы то ни было	2	2
30	в пятой главе нашей	1	1
31	можно сказать что в	2	1
32	в обычном смысле слова	1	1
33	одной и той же	4	1
34	но не только в	1	1
35	на котором мы остановимся	2	1
36	в своей книге о	1	1
37	недопустимо сводить к нему	1	1
38	друг к другу и	1	1
39	в одном из своих	1	1
40	у него в руках	1	1
41	жизни в ее целом	1	1
42	с таким же успехом	1	1
43	не так как его	1	1
44	точкой зрения на мир	1	1
45	судить о нем по	1	1
46	в своей статье о	2	1
47	а потому что они	1	1
48	неотделимы друг от друга	1	1
49	плоскости на одном уровне	2	1
50	то же время оно	1	1
51	как бы он ни	1	1
52	него в руках и	1	1
53	к себе самому и	1	1
54	не имеет ничего общего	1	1
55	говорить о том что	1	1
56	нужно сказать что и	3	1
57	в отличие от этого	1	1
58	подчеркиваем что дело идет	1	1
59	пятой главе нашей работы	1	1
60	все новые и новые	2	1
61	есть все то что	1	1
62	и в том и	1	1
63	на равных правах с	1	1
64	то же время и	2	1
65	таким же успехом могла	1	1
66	поэтому он и не	1	1
67	весь с начала и	1	1
68	все сферы идеологической жизни	1	1
69	до сих пор еще	15	1
70	во всяком случае не	1	1
71	то есть все то	2	1
72	имеет ничего общего с	1	1
73	но на самом деле	3	1
74	в одной плоскости на	1	1
75	мы остановимся лишь на	1	1
76	и на равных правах	1	1
77	заключается в том что	2	1
78	здесь углубляться в эту	1	1
79	только то что для	1	1
80	и т.п все это	4	1
81	как мы уже говорили	15	1
82	на самом деле нет	1	1
83	в данном случае в	1	1
84	не видит и не	1	1
85	но несмотря на это	1	1
86	так сказать второго порядка	1	1
87	как мы уже отмечали	1	1
88	в самом деле в	1	1
89	произведение очень характерно для	1	1
90	и в том что	2	1
91	как бы оно ни	2	1
92	сферы идеологической жизни в	1	1
93	и воспринимать ее как	1	1
94	своего становления и роста	1	1
95	мы можем судить о	2	1
96	то что может быть	1	1
97	с точки зрения их	1	1
98	в том числе и	17	1
99	и до известной степени	1	1
100	одного и того же	3	1
101	какой бы то ни	2	1
102	человека а следовательно и	1	1
103	и по отношению к	2	1
104	они в той или	1	1
105	как бы ни были	1	1
106	так в особенности и	1	1
107	одной плоскости на одном	1	1
108	то есть только в	1	1
109	в годах то есть	1	1
110	не можем здесь углубляться	1	1
111	можем здесь углубляться в	1	1
112	в том что это	2	1
113	и не может быть	4	1
114	мы уже говорили в	3	1
115	об этом мы уже	1	1
116	в большинстве случаев в	2	1
117	нет и не может	3	1
118	никогда не совпадает с	1	1
119	точки зрения на мир	4	1
120	зрения на мир и	2	1
121	во все сферы идеологической	1	1
122	бы нелепо думать что	1	1
123	дело идет именно об	1	1
124	но здесь мы должны	1	1
125	дело в том что	13	1
126	мы не можем здесь	1	1
127	бы оно ни было	3	1
128	имеем в виду прежде	3	1
129	только то что может	1	1
130	проявляется и в целом	1	1
131	этом мы уже говорили	1	1
132	а не так как	1	1
133	в этом отношении не	1	1
134	можно было бы привести	1	1
135	заключается в том чтобы	1	1
136	не в том что	1	1
137	с другой стороны эта	1	1
138	можно прямо сказать что	3	1
139	в виду прежде всего	3	1
140	и видеть в нем	1	1
141	ни с одним из	3	1
142	как бы в точке	1	1
143	было бы нелепо думать	1	1
144	которой можно было бы	2	1
145	в литературе о нем	1	1
146	еще раз подчеркнуть что	1	1
