1	заключается в том что	2	10
2	один и тот же	3	5
3	в том что он	2	3
4	одной и той же	3	3
5	от того что он	1	2
6	в том что в	1	2
7	в самом деле если	1	2
8	ответ на этот вопрос	1	2
9	того что нам известно	1	2
10	не что иное как	1	2
11	есть не что иное	1	2
12	видим таким образом что	1	1
13	с объективной точки зрения	2	1
14	собственном смысле этого слова	1	1
15	в этом отношении может	1	1
16	не исчерпывается мы должны	1	1
17	мы могли бы говорить	1	1
18	в собственном смысле этого	1	1
19	в собственном смысле слова	1	1
20	но этим дело не	1	1
21	мы видим таким образом	1	1
22	мы имеем в виду	1	1
23	речи так как это	1	1
24	не может быть понято	1	1
25	с их помощью мы	1	1
26	одно и то же	1	1
27	одни и те же	1	1
28	ответить на этот вопрос	1	1
29	равно как и на	1	1
30	не имеющие ничего общего	1	1
31	сводится к тому чтобы	1	1
32	но мы знаем что	2	1
33	он приходит к выводу	1	1
34	но во всяком случае	3	1
35	мы знаем что в	1	1
36	имеющие ничего общего с	1	1
37	дело не исчерпывается мы	1	1
38	что он делает и	1	1
39	этим дело не исчерпывается	1	1
40	и по отношению к	1	1
41	мы знаем что это	1	1
42	чтобы ответить на этот	1	1
43	приходит к выводу что	1	1
44	того что мы знаем	1	1
45	которую можно было бы	1	1
46	в гораздо большей степени	1	1
47	если можно так выразиться	1	1
48	с точки зрения обоих	1	1
49	и связанное с ним	1	1
50	как мы уже указывали	3	1
51	но и по отношению	1	1
52	бы то ни было	2	1
