1	в то же время	7	5
2	и в то же	2	3
3	и не может быть	1	2
4	одном и том же	2	2
5	одну и ту же	2	1
6	в одном и том	1	1
7	иметь в виду что	1	1
8	на то или иное	1	1
9	не может обойтись без	1	1
10	об одном и том	1	1
11	но вместе с тем	1	1
12	всего бросается в глаза	1	1
13	одно и то же	5	1
14	но все же и	1	1
15	та или иная оценка	1	1
16	что оно является только	1	1
17	в плоть и кровь	1	1
18	из которых он может	1	1
19	которое не было бы	1	1
20	и по отношению к	1	1
21	нет и не может	1	1
22	но в то же	2	1
