1	одного и того же	1	6
2	только в том что	2	5
3	в то же время	21	3
4	дело в том что	2	3
5	с одной стороны и	3	2
6	но с другой стороны	3	2
7	не что иное как	1	2
8	но дело в том	1	2
9	все более и более	1	2
10	которые не могут быть	1	2
11	во всех этих и	1	1
12	могли быть устранены из	1	1
13	то же время не	2	1
14	с другой стороны он	1	1
15	в том что при	1	1
16	не говоря уже о	6	1
17	не только в том	2	1
18	не имеет ничего общего	1	1
19	лишь в той мере	1	1
20	место в ряду других	1	1
21	имеет ничего общего с	1	1
22	себя и других в	1	1
23	в том что он	1	1
24	если это последнее имеет	2	1
25	повторением одного и того	1	1
26	не могли быть устранены	1	1
27	здесь как и во	1	1
28	что не может быть	1	1
29	с этой точки зрения	5	1
30	бы то ни было	4	1
