1172	наконец существо рецептивной компетенции	1	1
1173	референтная предметно-тематическая и рецептивная	1	1
1174	резюмируя можно сказать что	1	1
1175	всегда тогда как зерно	1	1
1176	предстает рассказ о действительно	1	1
1177	подробная характеристика персонажа выделяющая	1	1
1178	условленность общения объединяющая субъекта	1	1
1179	человеческих отношений анекдот не	1	1
1180	продуктивным в рамках современной	1	1
1181	всего лишь одним из	1	1
1182	отношения к сообщаемому рецептивная	1	1
1183	передачи этого знания аналогичному	1	1
1184	рода хоровое слово общенародной	1	1
1185	говорящего иначе говоря жанр	1	1
1186	и сам текст анекдота	1	1
1187	исторически продуктивный тип высказывания	1	1
1188	картина мира которая своей	1	1
1189	умения отрешиться от нудительной	1	1
1190	мира моделируемая притчей напротив	1	1
1191	императивного монологизированного слова в	1	1
1192	в дискурсе речевой акт	1	1
1193	риторический предел до которого	1	1
1194	в нарративном дискурсе может	1	1
1195	типическим ситуациям речевого общения	1	1
1196	работе ю.м лотмана происхождение	1	1
1197	в качестве бытийной компетенции	1	1
1198	слово сказания еще не	1	1
1199	потусторонней страны мертвых может	1	1
1200	чужой смерти и эта	1	1
1201	в недискурсивных формах внутренней	1	1
1202	необратимом историческом событии о	1	1
1203	своея воля рекоша но	1	1
1204	собой исторически продуктивный тип	1	1
1205	свою родину чтобы воцариться	1	1
1206	жанров разграничивающий первичные определенные	1	1
1207	как рассказчик анекдота или	1	1
1208	означала бы перевод его	1	1
1209	наличие так называемого чувства	1	1
1210	внутреннюю обособленность но раз-влекать	1	1
1211	рода механизмом активизации воспринимающего	1	1
1212	первичные определенные типы устного	1	1
1213	в архаических формах ритуально-символической	1	1
1214	авторитарная риторика императивного монологизированного	1	1
1215	ср общеизвестные пришел увидел	1	1
1216	что касается референтной компетенции	1	1
1217	формах ритуально-символической смерти героя	1	1
1218	диахронии жанр знаменует традицию	1	1
1219	покидающих свою родину чтобы	1	1
1220	запечатленного в притче универсального	1	1
1221	к протосюжету инициации предстает	1	1
1222	но воскресающей весной растительностью	1	1
1223	вступления в решающую фазу	1	1
1224	мечтательностью вообще жизненной позицией	1	1
1225	сказание или частной анекдот	1	1
1226	анекдот должен не у-влекать	1	1
1227	наличии у него убеждения	1	1
1228	и наделенного репродуктивной компетентностью	1	1
1229	такого выбора не всегда	1	1
1230	посрамление словесное кощунство и	1	1
1231	модель исследованная дж фрэзером	1	1
1232	говорит и как говорит	2	1
1233	говорить о поэтике здесь	1	1
1234	анекдота ни столь пассивным	1	1
1235	в смыслополагающей конвенции концепированного	1	1
1236	некий нравственный закон собственно	1	1
1237	способами высказывания письменные формы	1	1
1238	риторический предел сказания героическая	1	1
1239	нового времени данная археосюжетная	1	1
1240	признает никакого миропорядка жизнь	1	1
1241	ранее расторгнутых или ослабленных	1	1
1242	символическая смерть и символическое	1	1
1243	реализующий некоторую коммуникативную стратегию	1	1
1244	преданий о царских детях	1	1
1245	еще не такое слово	1	1
1246	классической риторики то есть	1	1
1247	фактический слушатель читатель может	1	1
1248	текстами соответствующего жанра сказание	1	1
1249	креативная компетенция жанра предполагает	1	1
1250	быть проделано и рассказывающим	1	1
1251	произведении и событие самого	1	1
1252	анекдот равнодостойности сознаний встречающихся	1	1
1253	наделенного репродуктивной компетентностью последняя	1	1
1254	притчевого типа есть монолог	1	1
1255	детях покидающих свою родину	1	1
1256	есть острота или острота	1	1
1257	концепты авторской позиции и	1	1
1258	этом остается авторитарной притча	1	1
1259	общенародной сказание или частной	1	1
1260	особую организующую роль по	1	1
1261	может заостряться до смертельного	1	1
1262	оно существенным образом ориентировано	1	1
1263	до встречи со смертью	1	1
1264	определенные возможности когда мы	1	1
1265	умирающего и воскресающего бога	1	1
1266	субъект дискурсии обладает достоверным	1	1
1267	в той мере в	2	1
1268	мира моделируемой текстами соответствующего	1	1
1269	она может быть представлена	1	1
1270	будучи порой фактически точными	1	1
1271	внеязыковое и потому нейтральное	1	1
1272	тому архаичному состоянию общественных	1	1
1273	возвращением героя к месту	1	1
1274	мировое древо выступало залогом	1	1
1275	притча разъединяет участников коммуникативного	1	1
1276	ролевую картину мира это	1	1
1277	высказывания в том или	1	1
1278	а не безликой роевой	1	1
1279	смыслополагающей конвенции концепированного б.о	1	1
1280	о царских детях покидающих	1	1
1281	жанра предполагает текстообразующую конвенциональность	1	1
1282	событие о котором рассказано	1	1
1283	предначертанность судьбы а некий	1	1
1284	знание что по своему	1	1
1285	определяется предметом целью и	1	1
1286	с другой паремия до	1	1
1287	или плачу и наделенного	1	1
1288	в иной ситуации иным	1	1
1289	бахтинским параметрам предмета цели	1	1
1290	воскресение человека есть уже	1	1
1291	проповедь где притча нередко	1	1
1292	назидания притча повествует не	1	1
1293	быть осуществлено только самим	1	1
1294	так сказать первофеномены жанров	1	1
1295	от мифа даже в	1	1
1296	не будет адекватным данному	1	1
1297	побега погони или напротив	1	1
1298	полюсом анекдотического дискурса выступает	1	1
1299	дело в том что	3	1
1300	что в отличие от	1	1
1301	не предполагает хоровой сказание	1	1
1302	волшебной сказки как правило	1	1
1303	иными подробностями и интонациями	1	1
1304	исторически сложившихся интерсубъективных компетенций	1	1
1305	словарного слова говорящий здесь	1	1
1306	том что случилось однажды	2	1
1307	рода первофеноменами целого спектра	1	1
1308	организации кадров внутреннего зрения	1	1
1309	переиначивающего отношения к сообщаемому	1	1
1310	активизации воспринимающего сознания однако	1	1
1311	лицо часто подвергается искушениям	1	1
1312	третью фазу в соответствии	1	1
1313	в форме определенной жанровой	1	1
1314	случае элиминирования из нее	1	1
1315	еще преждевременно поскольку мы	1	1
1316	партнерство предваряющие эффективное поведение	1	1
1317	из модификаций анекдотического дискурса	1	1
1318	притче универсального опыта к	1	1
1319	мыслиться индивидуальностью а не	1	1
1320	для него концепты героя	1	1
1321	в отличие от элементов	1	1
1322	однако столь архаическая фабула	1	1
1323	символическое воскресение в новом	1	1
1324	насекомого яичко личинка куколка	1	1
1325	все их основные параметры	1	1
1326	выступать в архаических формах	1	1
1327	правило проходит стадию умудрения	1	1
1328	высказывания реализующий некоторую коммуникативную	1	1
1329	их внутреннюю обособленность но	1	1
1330	иначе говоря жанр представляет	1	1
1331	их предлагая адресату позицию	1	1
1332	быть может не случайно	1	1
1333	тогда как зерно сюжетного	1	1
1334	жизни анекдот должен не	1	1
1335	что по своему коммуникативному	1	1
1336	зависим от диалогической ситуации	1	1
1337	точнее всего было бы	1	1
1338	не с собственно художественными	1	1
1339	жанр сказания исторически восходит	1	1
1340	мифологические тексты приобретают вид	1	1
1341	по своей природе суть	1	1
1342	смеховой жанр городского фольклора	1	1
1343	когда мы строим свою	1	1
1344	в коммуникацию не будет	1	1
1345	и того же анекдота	1	1
1346	может редуцироваться до легкого	1	1
1347	выбора не всегда эксплицированного	1	1
1348	месту своих прежних ранее	1	1
1349	дочери эта широко распространенная	1	1
1350	как композиционно определенное в	1	1
1351	нарративного вкрапления с другой	1	1
1352	должен не у-влекать слушателей	1	1
1353	иной форме например утрата	1	1
1354	референтная креативная и рецептивная	1	1
1355	строго отграниченная система смыслов	1	1
1356	инициация достигшего половой зрелости	1	1
1357	сюжет воспитания третью фазу	1	1
1358	компетентность предполагающая в частности	1	1
1359	если в диахронии жанр	1	1
1360	с формой авторства референтная	1	1
1361	как зерно сюжетного повествования	1	1
1362	корман адресата концепт читателя	1	1
1363	есть система исторически сложившихся	1	1
1364	фаза порой гипертрофируется и	1	1
1365	целого следовательно предметно-смысловые формы	1	1
1366	ухода расторжение прежних родовых	1	1
1367	со стороны адресата притчи	1	1
1368	в том что именно	1	1
1369	чувства юмора умения отрешиться	1	1
1370	особенно в новейшее время	1	1
1371	стадию умудрения стадию пробных	1	1
1372	рецептивной компетенции жанра состоит	1	1
1373	и позволяет говорить о	1	1
1374	в сказке обнаруживается далеко	1	1
1375	с этой точки зрения	2	1
1376	но от божья повеленья	1	1
1377	мы имеем дело с	5	1
1378	действительным зерном сюжетного повествования	1	1
1379	субъекты этического выбора все	1	1
1380	непосредственно коммуникативными способами высказывания	1	1
1381	его из общей картины	1	1
1382	гегель именовал веком героев	1	1
1383	распространенная в мировом фольклоре	1	1
1384	или зрелище чужой смерти	1	1
1385	нарративном дискурсе может иметь	1	1
1386	можно выявить некую общую	1	1
1387	объединяющая субъекта и адресата	1	1
1388	субъективной компетентности индивидуального речевого	1	1
1389	вертикаль мировое древо игравшее	1	1
1390	форма авторства выше она	1	1
1391	дозволенное посрамление словесное кощунство	1	1
1392	о том что по	1	1
1393	компетенция жанра предполагает текстообразующую	1	1
1394	речевого целого его завершения	1	1
1395	оказывается уже по сути	1	1
1396	о том что случилось	2	1
1397	в наличии у него	1	1
1398	предназначения когда персонажи не	1	1
1399	городского фольклора являет собой	1	1
1400	языковые с еще не	1	1
1401	где всякому чья жизнь	1	1
1402	новейшего времени также уходом	1	1
1403	композиционно определенное в сущности	1	1
1404	частности сказание постулирует адресата	1	1
1405	свою очередь определяется предметом	1	1
1406	древо выступало залогом воспроизводимости	1	1
1407	и потому нейтральное к	1	1
1408	со стороны адресата позицию	1	1
1409	по аналогии с мировым	1	1
1410	предполагает текстообразующую конвенциональность субъекта	1	1
1411	являет собой лишь одну	1	1
1412	поскольку мы имеем дело	1	1
1413	рассказывания в этом последнем	1	1
1414	не от отца к	1	1
1415	компетенций в диахроническом аспекте	1	1
1416	современный сугубо смеховой жанр	1	1
1417	в последние десятилетия с	1	1
1418	выявить некую общую четырехфазную	1	1
1419	бы перевод его в	1	1
1420	столь пассивным как к	1	1
1421	не претендуют на статус	1	1
1422	коммуникативная характеристика того кому	1	1
1423	говорящих и слушающих общим	1	1
1424	не занять этой уготованной	1	1
1425	костяком так сказать первофеномены	1	1
1426	ни для рассказчика ни	1	1
1427	обезличенного словарного слова говорящий	1	1
1428	коммуникативной ситуации типической ситуации	1	1
1429	редуцироваться до легкого повреждения	1	1
1430	мира креативная компетенция жанра	1	1
1431	и составляющий морализаторскую премудрость	1	1
1432	> кто говорит и	1	1
1433	сказания или притчи это	1	1
1434	базовой инфраструктуры не только	1	1
1435	соотносительная с формой авторства	1	1
1436	инициации в качестве своего	1	1
1437	и прежде всего к	1	1
1438	диахроническом аспекте бахтин различал	1	1
1439	стадию пробных искушений и	1	1
1440	здесь имеют место неудачные	1	1
1441	окружал человека к норме	1	1
1442	разнородны говорить о поэтике	1	1
1443	один и тот же	2	1
1444	обретение героем помощников и/или	1	1
1445	этом ряду выступает фаза	1	1
1446	недискурсивных формах внутренней речи	1	1
1447	или до встречи со	1	1
1448	иной позицией соучастника данного	1	1
1449	жанровые зародыши тематические и	1	1
1450	эстетического наблюдения именно таковы	1	1
1451	воцарении пришельца доказавшего свою	1	1
1452	влияние со стороны художественной	1	1
1453	есть профанация священного новелла	1	1
1454	жанров в частности такого	1	1
1455	система исторически сложившихся интерсубъективных	1	1
1456	задания реализуют в нем	1	1
1457	слова говорящий здесь только	1	1
1458	рецептивная стороны коммуникативного события	1	1
1459	обособления помимо внешнего собственно	1	1
1460	обособленность но раз-влекать их	1	1
1461	оцененном мире слово сказания	1	1
1462	норме и устройству хотя	1	1
1463	схемы и в форме	1	1
1464	к ценностной однозначности >	1	1
1465	мифологической модели умирающего и	1	1
1466	от диалогической ситуации рассказывания	1	1
1467	встречи со смертью в	1	1
1468	достаточно подробная характеристика персонажа	1	1
1469	форме определенной жанровой схемы	1	1
1470	есть не что иное	5	1
1471	мир эксцессов и аномалий	1	1
1472	напротив затворничества она может	1	1
1473	противоположным полюсом анекдотического дискурса	1	1
1474	несмотря на свою столь	1	1
1475	нередко здесь имеют место	1	1
1476	связей индивида фаза символической	1	1
1477	уровень его жизненной искушенности	1	1
1478	фабула практически неотличимая от	1	1
1479	к конкретным мифологическим системам	1	1
1480	и делает героя в	1	1
1481	родовых связей индивида фаза	1	1
1482	является своего рода механизмом	1	1
1483	тексты приобретают вид сюжетных	1	1
1484	природе суть то что	1	1
1485	дискурса подобно тому как	1	1
1486	анекдота полярно противостоит событийности	1	1
1487	терминологией а ван геннепа	1	1
1488	структуру и все их	1	1
1489	нравственный закон собственно и	1	1
1490	всегда отвечает на какие-то	1	1
1491	ситуации иным рассказчиком с	1	1
1492	домонологично оно объединяет говорящих	1	1
1493	отводимой воспринимающему сознанию той	1	1
1494	формы целого следовательно предметно-смысловые	1	1
1495	преемственно воспроизводимой в культуре	1	1
1496	необратимая в той мере	1	1
1497	убеждению соучастников притчевого дискурса	1	1
1498	ситуации рассказывания поскольку оно	1	1
1499	есть предметно-смысловые нахождения или	1	1
1500	фазу испытания смертью она	1	1
1501	именно таковы герои сказания	1	1
1502	рождение сопровождается возвращением героя	1	1
1503	своего рода ключ к	1	1
1504	курьезная риторика окказионального ситуативного	1	1
1505	того же анекдота обычно	1	1
1506	они хотят и свершают	1	1
1507	силу и искушенность в	1	1
1508	знаний и навыков взрослой	1	1
1509	но раз-влекать их предлагая	1	1
1510	а в литературе новейшего	1	1
1511	культуры он предполагает исторически	1	1
1512	жизненной искушенности в литературе	1	1
1513	анекдот как бы не	1	1
1514	определенное в сущности застывшее	1	1
1515	типологическом освещении было проведено	1	1
1516	и поучаемого это разделение	1	1
1517	тогда как рассказчик анекдота	1	1
1518	опыта к индивидуальной жизненной	1	1
1519	сознаний встречающихся в дискурсе	1	1
1520	комическая апофегма то есть	1	1
1521	неоспоримый миропорядок где всякому	1	1
1522	тексте но всегда имплицитно	1	1
1523	диалогической анекдот равнодостойности сознаний	1	1
1524	они разнятся бытийными референтными	1	1
1525	явственно солирует риторический предел	1	1
1526	прежним царем и ставшего	1	1
1527	известном смысле домонологично оно	1	1
1528	бы достаточно подробная характеристика	1	1
1529	в форме индивидуального речевого	1	1
1530	в притче есть реализация	1	1
1531	о воцарении пришельца доказавшего	1	1
1532	все их поступки в	1	1
1533	оно объединяет говорящих и	1	1
1534	глупость неуместность ошибка оговорка	1	1
1535	пробных искушений и испытаний	1	1
1536	конвенциональность субъекта и формы	1	1
1537	никакого миропорядка жизнь глазами	1	1
1538	так называемого чувства юмора	1	1
1539	том или ином отношении	1	1
1540	дискурса то есть система	1	1
1541	столь легкую безответственную передаваемость	1	1
1542	аномалий который окружал человека	1	1
1543	этом и сам текст	1	1
1544	существенно связаны с языком	1	1
1545	называемого чувства юмора умения	1	1
1546	утрата близкого существа или	1	1
1547	и передачи этого знания	1	1
1548	и навыков взрослой жизни	1	1
1549	или иного нарративного высказывания	1	1
1550	как необратимая в той	1	1
