1	одно и то же	5	5
2	в то же время	18	4
3	в то время как	4	4
4	дело в том что	2	4
5	и в то же	8	3
6	с этой точки зрения	1	3
7	или что то же	1	2
8	в том что он	1	2
9	и вместе с тем	1	1
10	но это значит что	1	1
11	в одном и том	1	1
12	с одной стороны и	5	1
13	но в то же	3	1
14	о том как его	1	1
15	том что он не	1	1
16	то время как другие	1	1
17	и как бы ни	1	1
18	друг с другом они	1	1
19	не было бы и	1	1
20	одном и том же	1	1
21	только в том что	1	1
22	одного и того же	9	1
23	с самим собою в	1	1
24	с точки зрения этого	1	1
25	ни с чем не	2	1
26	есть все то что	1	1
27	может быть и речи	2	1
28	в его отношении к	1	1
29	не может быть и	2	1
30	и в этом отношении	1	1
31	в нем нет ничего	3	1
