1	и до сих пор	1	2
2	на самом же деле	3	2
3	дело в том что	1	2
4	можно сказать что в	1	1
5	ничего общего не имеет	1	1
6	общего не имеет с	1	1
7	так как это не	1	1
8	в одном из своих	1	1
9	до сих пор в	1	1
10	состоит в том что	26	1
11	для них таким же	1	1
12	в том что на	1	1
13	мы не будем останавливаться	2	1
14	самом же деле эти	1	1
15	самом же деле это	1	1
16	не что иное как	4	1
17	греческой и особенно римской	1	1
18	мы не будем здесь	2	1
19	или во всяком случае	1	1
20	а может быть и	1	1
21	но тем не менее	2	1
