1	не говоря уже о	1	5
2	не имеет ничего общего	1	4
3	имеет ничего общего с	1	3
4	с одной стороны и	2	2
5	не чем иным как	1	2
6	же в таком случае	1	2
7	в том числе и	2	2
8	в то время как	1	2
9	только в том случае	1	2
10	о том что и	1	1
11	в какой мере не	1	1
12	только в этом случае	1	1
13	как один из видов	1	1
14	в том случае если	1	1
15	речь может идти только	1	1
16	и в то же	3	1
17	если бы он был	1	1
18	одно и то же	1	1
19	может идти только о	1	1
20	в точном смысле слова	2	1
21	в этом отношении ему	1	1
22	уже по одному тому	2	1
23	можно говорить только о	1	1
24	по крайней мере сам	1	1
25	не может быть никакого	1	1
26	по одному тому что	2	1
27	было бы значительно увеличить	1	1
28	по этому поводу с	1	1
29	значит ли это что	1	1
30	то как будто бы	1	1
31	так же как и	1	1
32	ни в какой мере	1	1
33	один из них не	1	1
34	той или иной мере	1	1
35	говоря уже о том	1	1
36	в той или иной	1	1
37	и не может быть	2	1
38	о том как он	1	1
39	но в то же	1	1
40	ни один из них	1	1
41	можно было бы значительно	1	1
42	уже о том что	1	1
43	является не чем иным	1	1
44	в том или ином	1	1
45	и в результате этого	1	1
