1	по отношению к нему	1	4
2	один и тот же	4	3
3	в то же время	13	2
4	бы он ни был	1	2
5	одна и та же	2	2
6	и тот же с	1	2
7	бы то ни было	2	2
8	только в том что	8	1
9	это значило бы что	1	1
10	имеет место и в	1	1
11	тем не менее в	3	1
12	в противном случае мы	1	1
13	как бы он ни	1	1
14	и того же лица	1	1
15	и может быть только	1	1
16	в том смысле в	6	1
17	а не в ее	1	1
18	здесь дело не в	1	1
19	до сих пор не	1	1
20	для него самого и	1	1
21	в том случае когда	2	1
22	но во всяком случае	3	1
23	хотя бы и с	1	1
24	с точки зрения той	1	1
25	одного и того же	9	1
26	не подлежит сомнению но	1	1
27	не само по себе	1	1
28	и по отношению к	2	1
29	и в этом смысле	4	1
30	никогда не может стать	1	1
31	по отношению к последнему	1	1
32	не в том смысле	2	1
33	то же самое что	2	1
34	дело в том что	4	1
35	само по себе а	1	1
36	по отношению к другим	1	1
37	не в одном только	1	1
38	в том что между	2	1
