1	в то же время	3	6
2	ни в чем не	1	4
3	один и тот же	5	3
4	и не может быть	2	3
5	одной и той же	12	3
6	в том что она	7	2
7	в узком смысле слова	1	2
8	заключается в том что	23	2
9	с объективной точки зрения	1	2
10	и тем не менее	2	2
11	в том что он	7	2
12	в зависимости от того	4	2
13	ни в каком случае	2	2
14	ни в какой степени	1	2
15	бы то ни было	2	2
16	видим таким образом что	2	1
17	это и есть та	1	1
18	коем случае не может	1	1
19	остается ничего другого как	2	1
20	мы никогда не поймем	2	1
21	о том что это	1	1
22	вне общества и следовательно	1	1
23	можно согласиться с тем	1	1
24	в собственном смысле слова	4	1
25	том что он не	3	1
26	ни в коем случае	1	1
27	мы видим таким образом	2	1
28	все больше и больше	5	1
29	том что она не	1	1
30	на этот вопрос нам	1	1
31	я не сомневаюсь что	1	1
32	получает смысл и значение	1	1
33	от того что он	1	1
34	в том что в	4	1
35	мы уже знаем что	1	1
36	одно и то же	7	1
37	том что с точки	1	1
38	в таком случае это	1	1
39	из того что мы	1	1
40	одни и те же	3	1
41	до сих пор не	2	1
42	в самом деле если	4	1
43	что это вовсе не	1	1
44	и тот же предмет	1	1
45	чтобы ответить на этот	1	1
46	ответить на этот вопрос	1	1
47	от начала и до	1	1
48	то это означает что	1	1
49	равно как и на	1	1
50	всего они свидетельствуют о	1	1
51	случае не может быть	3	1
52	в самом деле что	1	1
53	что бы то ни	1	1
54	отличает его от других	1	1
55	сводится к тому чтобы	1	1
56	деле если мы обратимся	1	1
57	бы то ни стало	1	1
58	в данном случае в	1	1
59	мы увидим что и	2	1
60	дело только с этими	1	1
61	уже не может быть	1	1
62	не что иное как	6	1
63	самом деле если мы	2	1
64	сейчас же заметим что	1	1
65	в какой степени не	1	1
66	и потому не может	1	1
67	если мы обратимся к	2	1
68	друг с другом и	3	1
69	в каком случае не	1	1
70	приходит к выводу что	2	1
71	ответ на этот вопрос	3	1
72	все время как бы	3	1
73	смысл и значение в	1	1
74	психологии они утверждают что	1	1
75	в каком случае нельзя	1	1
76	но это совсем не	1	1
77	или во всяком случае	2	1
78	обстоит дело и с	1	1
79	во что бы то	1	1
80	таким расчетом чтобы вызвать	2	1
81	но именно в этой	1	1
82	нельзя не согласиться с	1	1
83	в бессознательное мы можем	1	1
84	не остается ничего другого	2	1
85	дело в том что	3	1
86	с таким расчетом чтобы	2	1
87	не нуждается ни в	1	1
88	и связанная с ним	1	1
89	в коем случае не	1	1
90	мы старались показать что	1	1
91	от начала до конца	3	1
92	между субъективной и объективной	1	1
93	на один и тот	1	1
94	во всяком случае в	2	1
95	что с точки зрения	2	1
96	только потому что оно	1	1
97	в жизни и в	1	1
98	есть не что иное	2	1
99	в этом отношении совершенно	2	1
100	о которой мы говорили	1	1
