1	в нашем смысле слова	1	7
2	в той или иной	2	7
3	и тем не менее	7	6
4	не что иное как	2	6
5	в то время как	1	6
6	есть не что иное	1	6
7	д и т д	3	5
8	и т д и	4	5
9	также и то что	1	5
10	т д и т	4	5
11	бы то ни было	1	4
12	заключается в том что	4	4
13	мы должны сказать что	1	4
14	в том смысле что	2	4
15	одно и то же	1	3
16	и в этом случае	1	3
17	дело в том что	1	3
18	и в то же	2	2
19	но с другой стороны	3	2
20	можно ли сказать что	1	2
21	и с точки зрения	1	2
22	в том или ином	1	2
23	все дело в том	1	1
24	тем не менее по	1	1
25	само по себе не	1	1
26	с этой точки зрения	5	1
27	как мы видели выше	1	1
28	в научном ни в	1	1
29	в какой мере не	2	1
30	значит также и то	1	1
31	в связи с этим	1	1
32	этой точки зрения в	1	1
33	одной и той же	2	1
34	не говоря уже об	1	1
35	только в том что	1	1
36	для одной и той	1	1
37	и в таком случае	1	1
38	который в данном случае	1	1
39	в собственном смысле слова	2	1
40	по крайней мере в	1	1
41	только для того чтобы	3	1
42	мы имеем в виду	1	1
43	в свое время в	1	1
44	если это так то	1	1
45	по себе еще не	1	1
46	на известной ступени культурного	1	1
47	но если это так	1	1
48	одним и тем же	2	1
49	или несколько или даже	1	1
50	в этом случае он	1	1
51	то это вовсе не	1	1
52	вовсе не потому что	1	1
53	и т д в	1	1
54	о котором говорилось выше	1	1
55	известной ступени культурного развития	1	1
56	еще и потому что	1	1
57	когда мы говорим что	1	1
58	один и тот же	2	1
59	тот же звук который	1	1
60	и т д все	1	1
61	в узком смысле слова	1	1
62	в тех случаях когда	3	1
63	в войне и мире	1	1
64	о том что он	1	1
65	в этом смысле есть	1	1
66	можно ли в этом	1	1
67	и в вопросе о	1	1
68	уже по одному тому	1	1
69	по одному тому что	1	1
70	свидетельствует о том что	1	1
71	бы то ни стало	1	1
72	это можно было бы	1	1
73	какой бы то ни	1	1
74	свободу и т д	1	1
75	здесь можно было бы	3	1
76	потому что он есть	1	1
77	мы приходим к проблеме	1	1
78	в литературе и искусстве	1	1
79	так по крайней мере	1	1
80	только о том что	1	1
81	в том что он	3	1
82	только тогда когда мы	1	1
83	язык и вместо него	1	1
84	одного и того же	4	1
85	ни в какой мере	3	1
86	по себе и не	1	1
87	точки зрения в качестве	1	1
88	нас в том что	1	1
89	для того чтобы не	1	1
90	ответ на этот вопрос	1	1
91	т д все это	1	1
92	в таких словах как	1	1
93	с точки зрения их	1	1
94	когда имеется в виду	1	1
95	во что бы то	1	1
96	что бы то ни	1	1
97	не имеется в виду	1	1
98	но все дело в	1	1
99	что в живом языке	1	1
100	в том что и	1	1
101	и т д мы	1	1
102	в то или иное	1	1
103	ни в научном ни	1	1
104	и тот же звук	1	1
105	все более и более	1	1
106	поскольку речь идет о	2	1
107	можно было бы сказать	6	1
108	которое мы находим в	1	1
109	никак не может быть	1	1
110	не выходит за пределы	1	1
