1	в то же время	14	13
2	в связи с этим	1	4
3	и в то же	8	4
4	с одной стороны и	6	4
5	но в то же	2	3
6	в том смысле что	1	2
7	то же время не	1	2
8	и до настоящего времени	1	2
9	не говоря уже о	1	1
10	в том случае если	1	1
11	от этого отнюдь не	1	1
12	то же время в	1	1
13	с точки зрения этих	1	1
14	так и в характере	1	1
15	и прежде всего в	1	1
16	из всего этого следует	1	1
17	и то и другое	1	1
18	в этом отношении в	1	1
19	совершенно очевидно что в	1	1
20	в том числе и	1	1
21	что как бы ни	1	1
22	в их отношении к	3	1
23	в гораздо большей степени	1	1
24	большей или меньшей степени	1	1
25	в большей или меньшей	1	1
26	как и всякая иная	1	1
27	только в том случае	1	1
28	поскольку дело идет о	1	1
29	и с точки зрения	1	1
30	с этой точки зрения	5	1
31	бы то ни было	4	1
