1	заключается в том что	4	6
2	в собственном смысле слова	2	4
3	в то время как	1	4
4	а с другой стороны	3	3
5	состоит в том что	4	3
6	в пользу того что	1	3
7	ответ на этот вопрос	1	3
8	все более и более	1	3
9	собственном смысле этого слова	1	3
10	только для того чтобы	3	2
11	дело в том что	1	2
12	которой мы говорили выше	1	2
13	он в другом месте	1	2
14	одно и то же	1	2
15	что с точки зрения	2	2
16	одной и той же	2	2
17	не потому что он	1	2
18	о которой мы говорили	1	2
19	для того чтобы стать	1	1
20	которые могут быть сделаны	1	1
21	прежде всего то что	1	1
22	в одном и том	1	1
23	в какой мере не	2	1
24	несмотря на то что	1	1
25	если бы речь шла	1	1
26	в том что мы	1	1
27	как уже сказано выше	1	1
28	можно было бы назвать	1	1
29	как мы видели выше	1	1
30	и с другой стороны	1	1
31	ни в коем случае	1	1
32	с другой стороны в	1	1
33	то это потому что	1	1
34	мы имеем в виду	1	1
35	что можно было бы	1	1
36	нас в данном случае	1	1
37	и в то же	2	1
38	со своей точки зрения	1	1
39	когда речь идет о	2	1
40	к которому он принадлежит	1	1
41	речи с другой стороны	1	1
42	стать на точку зрения	2	1
43	в то же время	6	1
44	это не могло не	1	1
45	в целом и в	1	1
46	и пр и пр	4	1
47	стороны а с другой	1	1
48	ничего принципиально нового в	1	1
49	возразить против того что	1	1
50	с этим вопросом о	1	1
51	точно так же как	3	1
52	зависит не только от	1	1
53	один и тот же	2	1
54	то это не только	1	1
55	в предисловии к книге	1	1
56	можно было бы сравнить	1	1
57	никогда не может быть	1	1
58	в тех случаях когда	3	1
59	и в силу этого	1	1
60	о том что он	1	1
61	если это так то	1	1
62	и с точки зрения	1	1
63	что как увидим ниже	1	1
64	в силу того что	3	1
65	одном и том же	1	1
66	само по себе не	1	1
67	зато с другой стороны	1	1
68	до самого последнего времени	1	1
69	и в самом деле	10	1
70	сводится к тому чтобы	1	1
71	именно в силу того	1	1
72	шаг вперед в области	1	1
73	потому что как увидим	1	1
74	и до некоторой степени	1	1
75	для того чтобы с	2	1
76	с одной стороны а	1	1
77	не оставляет сомнений в	1	1
78	в одно и то	1	1
79	приводит к тому что	1	1
80	помимо того что она	1	1
81	находит свое выражение в	1	1
82	потому что он не	1	1
83	в зависимости от того	4	1
84	в том что он	3	1
85	связи с вопросом о	1	1
86	ни в какой мере	3	1
87	мы должны сказать что	1	1
88	но сам по себе	1	1
89	и целый ряд других	1	1
90	чтобы показать что в	1	1
91	которые хотя и не	1	1
92	в той или иной	2	1
93	по мере того как	3	1
94	но для того чтобы	3	1
95	для того чтобы быть	2	1
96	прежде всего потому что	2	1
97	так как он является	1	1
98	только тогда когда он	2	1
99	о том что в	1	1
100	одной стороны а с	1	1
101	то же самое что	1	1
102	невозможно с точки зрения	1	1
103	и не могут быть	1	1
104	заключается не столько в	1	1
105	с этой точки зрения	5	1
106	и в этом отношении	1	1
107	зависит прежде всего от	1	1
108	что это действительно так	1	1
109	бы то ни было	1	1
