1	в то же время	14	11
2	и в самом деле	1	7
3	один и тот же	2	3
4	и там и здесь	1	3
5	обращает на себя внимание	4	3
6	бы то ни было	3	3
7	и к тому же	2	2
8	не говоря уже о	2	2
9	мы имеем в виду	1	2
10	в том числе и	1	2
11	как и вся его	1	1
12	у меня в доме	1	1
13	до тех пор пока	1	1
14	который в свою очередь	2	1
15	только в том что	1	1
16	на себя внимание в	1	1
17	не выходят за пределы	1	1
18	и все же если	1	1
19	в собственном смысле слова	1	1
20	к тому же не	1	1
21	состоит в том что	7	1
22	на этот раз не	1	1
23	не следует думать что	1	1
24	тем не менее в	1	1
25	если бы он был	1	1
26	в тех случаях когда	2	1
27	подобно тому как мы	1	1
28	не следует забывать что	1	1
29	к тому же в	2	1
30	состоит в том чтобы	1	1
31	в самом его конце	1	1
32	и в том что	1	1
33	одних и тех же	2	1
34	на себя внимание что	1	1
35	одного и того же	6	1
36	в этом случае в	1	1
37	каков бы ни был	1	1
38	по отношению ко всем	1	1
39	и в этом случае	1	1
40	о своей любви к	1	1
41	в ответ на слова	1	1
42	но и в том	1	1
43	то же самое что	1	1
44	той мере в какой	2	1
45	в той мере в	2	1
46	в самом деле не	1	1
47	с этой точки зрения	2	1
48	лицом к лицу с	1	1
49	несмотря на то что	1	1
