1	в том что они	1	3
2	выше мы видели что	1	3
3	в то время как	1	3
4	мы уже знаем что	1	2
5	образом мы видим что	1	2
6	то же самое что	1	2
7	дело в том что	1	2
8	таким образом мы видим	1	2
9	бы то ни было	3	2
10	мы видели что при	1	1
11	надо иметь в виду	1	1
12	не говоря уже о	1	1
13	но вместе с тем	2	1
14	стоит в связи с	1	1
15	на более высокой ступени	1	1
16	если бы нам удалось	1	1
17	в тех случаях когда	1	1
18	приводит к тому что	1	1
19	невыгодное положение по сравнению	1	1
20	в том что он	1	1
21	говоря уже о том	1	1
22	а на самом деле	1	1
23	уже о том что	1	1
