1	и в самом деле	1	14
2	заключается в том что	43	8
3	в том случае если	2	4
4	то же самое в	1	4
5	все более и более	8	4
6	и вместе с тем	5	3
7	указывает на то что	4	3
8	в самом деле когда	1	3
9	и то и другое	1	3
10	в то время как	20	3
11	в том что он	8	3
12	одно и то же	12	3
13	одной и той же	15	3
14	до тех пор пока	1	2
15	это имеет место в	1	2
16	друг с другом и	1	2
17	в том что они	4	2
18	для того чтобы открыть	1	2
19	ни в малой степени	1	2
20	том что он не	2	2
21	все больше и больше	5	2
22	в малой степени не	1	2
23	того чтобы увидеть что	1	2
24	в том что она	3	2
25	в самом деле если	4	2
26	образом мы видим что	1	2
27	мы не можем не	3	2
28	одна и та же	3	2
29	смысле этого слова и	1	2
30	ни одно из этих	1	2
31	для того чтобы увидеть	1	2
32	в самом деле стоит	1	2
33	ни в какой мере	3	2
34	или во всяком случае	3	2
35	то же самое что	7	2
36	для того чтобы показать	4	2
37	о которых мы говорили	4	2
38	другой можно было бы	1	2
39	указал на то что	1	2
40	с этой точки зрения	16	2
41	нового по сравнению с	4	1
42	почти с самого начала	1	1
43	с точки зрения тех	1	1
44	в том смысле как	1	1
45	больше чем то что	1	1
46	с такой очевидностью как	1	1
47	в одном и в	1	1
48	лежащих в его основе	1	1
49	когда он говорит что	1	1
50	в той же мере	3	1
51	в какой мере не	3	1
52	было бы показать что	1	1
53	то что он не	1	1
54	то же самое относится	2	1
55	мы должны были бы	2	1
56	которых мы говорили выше	3	1
57	что в сущности говоря	1	1
58	которое могло бы быть	1	1
59	того чтобы показать что	2	1
60	только в том что	8	1
61	по прямой линии как	1	1
62	не только то что	2	1
63	то время как у	1	1
64	в полном смысле этого	1	1
65	заключается вовсе не в	1	1
66	в том виде как	4	1
67	в сущности говоря в	1	1
68	и к тому чтобы	1	1
69	самом деле когда мы	1	1
70	что то же самое	1	1
71	ничего нового по сравнению	1	1
72	только для того чтобы	2	1
73	которая состоит в том	1	1
74	до сих пор в	1	1
75	состоит в том что	17	1
76	с другой стороны мы	2	1
77	для того чтобы объяснить	1	1
78	в более сложном виде	1	1
79	привело к тому что	1	1
80	кратчайшему расстоянию между двумя	1	1
81	было бы сказать что	1	1
82	и в первом случае	1	1
83	это означало бы что	1	1
84	во всяком случае то	1	1
85	как раз обратным образом	1	1
86	можно было бы показать	1	1
87	с самого начала что	4	1
88	говорит нам о том	2	1
89	есть в сущности говоря	2	1
90	в том и заключается	2	1
91	мы могли бы сказать	14	1
92	в том что в	8	1
93	того же самого порядка	1	1
94	том и заключается что	1	1
95	совершенно прав когда он	1	1
96	не имеют ничего общего	3	1
97	прав когда он говорит	1	1
98	в том что всякое	2	1
99	на две части в	1	1
100	том что всякое обобщение	1	1
101	есть не более как	1	1
102	точно так же как	6	1
103	в басне стрекоза и	1	1
104	по сравнению с той	1	1
105	один и тот же	12	1
106	как и все прочие	1	1
107	в полном согласии с	2	1
108	он все больше и	1	1
109	в том что эта	1	1
110	состоит в том чтобы	1	1
111	имеют ничего общего с	3	1
112	расстоянию между двумя точками	1	1
113	согласны в том что	2	1
114	мы никогда не можем	1	1
115	не может понять как	1	1
116	можно было бы сказать	1	1
117	он должен был оставить	1	1
118	случае не может быть	1	1
119	том виде как она	1	1
120	как мы уже говорили	9	1
121	как мы увидим ниже	2	1
122	это или не так	1	1
123	только в самом конце	1	1
124	а отнюдь не как	1	1
125	на то что он	1	1
126	так же точно как	2	1
127	мы могли бы формулировать	1	1
128	полном смысле этого слова	1	1
129	мы видим что все	2	1
130	на то что с	1	1
131	не что иное как	6	1
132	что она не может	1	1
133	то мы увидим что	1	1
134	потому что эта фраза	1	1
135	так же как и	16	1
136	с которыми приходится иметь	1	1
137	если с самого начала	1	1
138	по самому своему существу	1	1
139	имеет в виду не	1	1
140	во всяком случае очень	1	1
141	тем и другим есть	1	1
142	которые она себе ставит	1	1
143	когда речь идет о	1	1
144	в том смысле что	5	1
145	и целый ряд других	1	1
146	которая никак не может	1	1
147	если мы обратимся к	6	1
148	по самой своей природе	6	1
149	и мы сейчас же	1	1
150	в том что оно	3	1
151	как это имеет место	2	1
152	что они представляют собой	1	1
153	что с одной стороны	2	1
154	ответ на этот вопрос	5	1
155	мы вправе были бы	1	1
156	и во всех остальных	1	1
157	прибавим к этому что	1	1
158	прежде всего тем что	1	1
159	басне стрекоза и муравей	1	1
160	образом мы могли бы	1	1
161	была в том что	2	1
162	к тому или иному	3	1
163	и то же слово	4	1
164	две части в первой	1	1
165	в одной и той	4	1
166	между тем и другим	4	1
167	того чтобы показать как	1	1
168	могли бы сказать так	1	1
169	мы сейчас же увидим	1	1
170	одном и в другом	1	1
171	же самое в отношении	1	1
172	ни в каком случае	1	1
173	таким образом мы видим	1	1
174	но совершенно очевидно что	1	1
175	мы старались показать что	1	1
176	для того чтобы с	2	1
177	о чем идет речь	3	1
178	в такой же мере	10	1
179	и с точки зрения	2	1
180	и в этом отношении	1	1
181	как и всякий другой	1	1
182	он прямо говорит что	1	1
183	мы видим что в	1	1
184	которая лежит в основе	1	1
185	ясно до какой степени	1	1
186	заключается в том чтобы	7	1
187	имеет совершенно другой смысл	1	1
188	которыми приходится иметь дело	1	1
189	было бы величайшей ошибкой	1	1
190	в том и другом	3	1
191	в сущности говоря это	2	1
192	одного и того же	17	1
193	мы уже говорили что	3	1
