1	в то же время	2	13
2	в том что он	8	4
3	то же время не	1	3
4	как мы уже говорили	9	2
5	по отношению к себе	1	2
6	и в то же	1	2
7	и в этом смысле	1	2
8	но с другой стороны	1	2
9	в то время как	20	2
10	и в этом отношении	1	2
11	бы то ни было	3	2
12	бы глубоки они ни	1	1
13	совершенно в той же	1	1
14	с точки зрения того	2	1
15	по себе не имеет	1	1
16	с другой стороны мы	2	1
17	и во всяком случае	3	1
18	в этом смысле он	1	1
19	но с таким же	1	1
20	то же самое слово	2	1
21	то что он не	1	1
22	как бы глубоки они	1	1
23	так как если бы	2	1
24	следует за ней в	1	1
25	с одной стороны и	10	1
26	слова с точки зрения	2	1
27	на то что он	1	1
28	мы увидим дальше что	1	1
29	такие разнородные явления как	1	1
30	с таким же успехом	2	1
31	одну и ту же	4	1
32	в собственном смысле слова	9	1
33	подобно тому как в	4	1
34	не с точки зрения	1	1
35	мы имеем в виду	3	1
36	о том что он	1	1
37	в другом месте и	2	1
38	само по себе не	2	1
39	и не потому что	1	1
40	только и могут быть	1	1
41	уже сама по себе	1	1
42	в том или другом	1	1
43	точки зрения своей собственной	1	1
44	том или другом слове	1	1
45	в неразрывной связи с	1	1
46	как более или менее	4	1
47	лежащие в основе этого	1	1
48	то что должно быть	1	1
49	не могли войти в	1	1
50	никогда не может быть	1	1
51	во всяком случае не	1	1
52	как бы рядом с	1	1
53	он сам по себе	1	1
54	само по себе но	1	1
55	но на самом деле	2	1
56	и не могут быть	2	1
57	до сих пор остается	1	1
58	до самого последнего времени	3	1
59	можно было бы сказать	1	1
60	как если бы он	2	1
61	в виду прежде всего	1	1
62	и в другом случае	2	1
63	в сущности ничего не	2	1
64	в этом отношении не	1	1
65	глубоки они ни были	1	1
66	так же как и	16	1
67	что дело идет не	1	1
68	рядом друг с другом	2	1
69	не может быть понято	1	1
70	в зависимости от того	2	1
71	которые сами по себе	1	1
72	ничем не отличается от	1	1
73	таким образом как бы	1	1
74	с двух точек зрения	1	1
75	с самого начала все	1	1
76	слова к тому же	1	1
77	и по отношению к	2	1
78	как бы он ни	1	1
79	в той или иной	2	1
80	по мере того как	1	1
81	над всеми остальными и	1	1
82	она не может быть	2	1
83	взаимно исключающих друг друга	1	1
84	в том что это	2	1
85	и не может быть	2	1
86	отношении друг к другу	1	1
87	может найти своего выражения	1	1
88	найти своего выражения в	1	1
89	слово как бы вбирает	1	1
90	в том числе и	10	1
91	с точки зрения своей	1	1
92	но тем не менее	2	1
93	дело в том что	3	1
94	то время как обычно	1	1
95	свое последнее слово в	1	1
96	как мы увидим в	2	1
97	с точки зрения ее	1	1
98	не может найти своего	1	1
99	друг с другом как	1	1
100	что с точки зрения	4	1
101	в том и в	1	1
102	заключается в том что	43	1
103	можно прямо сказать что	1	1
104	в той же плоскости	1	1
105	том и в другом	1	1
106	мы уже говорили что	3	1
107	в том и другом	3	1
108	друг с другом но	3	1
