1	состоит в том что	2	16
2	в том что в	4	6
3	но вместе с тем	2	3
4	так же как и	1	3
5	в том что этот	2	2
6	это не значит что	3	2
7	и в этом случае	2	2
8	еще до того как	3	1
9	в том что один	1	1
10	сомнений в том что	2	1
11	пришел к выводу что	1	1
12	не только потому что	1	1
13	сомнения в том что	2	1
14	говорит о том что	5	1
15	не имеет ничего общего	3	1
16	одни и те же	1	1
17	вопрос о том кто	2	1
18	во всяком случае не	3	1
19	и т д и	2	1
20	была вместе с тем	1	1
21	не все в этой	1	1
22	по этому поводу с	1	1
23	также в том что	1	1
24	приводит к тому что	1	1
25	имеет ничего общего с	3	1
26	в другом месте своей	1	1
27	к тому что в	1	1
28	себе дело так что	1	1
29	т е как бы	1	1
30	в то время как	5	1
31	такое же значение как	1	1
32	о том что в	2	1
33	вместе с тем он	1	1
34	в отличие от других	1	1
35	обращает на себя внимание	3	1
36	ничего не говорится о	1	1
37	иметь в виду что	1	1
