1	в то же время	15	13
2	в единстве социальной жизни	1	5
3	в связи с этим	3	4
4	и пр и пр	5	4
5	с одной стороны и	3	4
6	и не может быть	5	4
7	но в то же	9	3
8	все более и более	3	3
9	в свою очередь является	1	2
10	за свой страх и	1	2
11	у нас не было	1	2
12	сам по себе а	1	2
13	вместе с тем и	1	2
14	свой страх и риск	1	2
15	нет и не может	2	2
16	и до настоящего времени	3	2
17	не может быть и	4	2
18	отнюдь не следует что	1	2
19	а в связи с	1	1
20	в большинстве же случаев	1	1
21	отношении в высшей степени	1	1
22	в данной социальной группе	1	1
23	идеалистическая философия культуры и	2	1
24	необходимо прежде всего определить	1	1
25	точном смысле этого слова	4	1
26	если дело идет о	1	1
27	дистанцию по отношению к	1	1
28	может быть от него	1	1
29	данную эпоху и в	1	1
30	ориентируется в отношении к	1	1
31	нами в предыдущей главе	1	1
32	не говоря уже о	1	1
33	не с точки зрения	1	1
34	в широком смысле слова	1	1
35	какие бы тонкие и	1	1
36	в нашу задачу не	1	1
37	тем не менее в	1	1
38	этом отношении в высшей	1	1
39	до настоящего времени не	1	1
40	такая абстракция совершенно правомерна	1	1
41	и пр все эти	1	1
42	не подлежит конечно сомнению	1	1
43	эпоху и в данной	1	1
44	наука до сих пор	1	1
45	же в таком случае	1	1
46	дело обстоит чрезвычайно плохо	2	1
47	друг друга не по	1	1
48	остается подвести итоги нашего	1	1
49	как раз и не	1	1
50	пр и пр в	1	1
51	все время учитывать все	1	1
52	правда не столько в	1	1
53	с точки зрения самого	3	1
54	первая наука об идеологиях	1	1
55	свою очередь является лишь	1	1
56	только в процессе социального	1	1
57	наука об идеологиях и	1	1
58	не может быть уже	1	1
59	только с точки зрения	1	1
60	и прежде всего в	1	1
61	не может быть от	1	1
62	в самом деле ведь	3	1
63	не что иное как	1	1
64	сменяют друг друга не	1	1
65	и в том что	2	1
66	в этом отношении в	1	1
67	если же мы возьмем	1	1
68	нашу задачу не входит	1	1
69	в том числе и	3	1
70	сюда относятся прежде всего	1	1
71	в их отношении к	1	1
72	разобранные нами в предыдущей	1	1
73	в самом деле с	1	1
74	строгом смысле этого слова	1	1
75	упускается из виду что	1	1
76	с точки зрения строго	1	1
77	в целом ряде существенных	1	1
78	какого бы то ни	2	1
79	то ни было идеологического	1	1
80	по себе а лишь	1	1
81	языка не может быть	1	1
82	науки об идеологиях и	1	1
83	подвести итоги нашего анализа	1	1
84	и в этом случае	1	1
85	в высшей степени характерна	1	1
86	как и все остальные	1	1
87	и в свою очередь	1	1
88	в гораздо большей степени	1	1
89	в процессе социального общения	3	1
90	в более или менее	1	1
91	этих и подобных им	1	1
92	глава первая наука об	1	1
93	что и до настоящего	1	1
94	не сам по себе	1	1
95	со всею конкретностью исторического	1	1
96	отнюдь не могут быть	1	1
97	различия между этими двумя	1	1
98	с точки зрения своей	1	1
99	в большей или меньшей	1	1
100	но даже и допустив	1	1
101	на самом деле в	1	1
102	с точки зрения ее	1	1
103	может быть и речи	4	1
104	та среда в которой	1	1
105	как данная единичная вещь	1	1
106	ни было значительно и	1	1
107	на самом же деле	5	1
108	и с точки зрения	1	1
109	с этой точки зрения	1	1
110	в строгом смысле этого	1	1
111	в точном смысле этого	4	1
112	в данную эпоху и	1	1
113	является не чем иным	1	1
114	не чем иным как	1	1
115	в том или ином	2	1
116	осуществляется только в процессе	1	1
117	но тем не менее	1	1
118	не выходит за пределы	1	1
119	бы то ни было	12	1
120	в каждую данную эпоху	1	1
