1	в то же время	6	13
2	начала и до конца	1	7
3	но в то же	3	7
4	то же время это	1	3
5	один и тот же	3	3
6	мы имеем в виду	1	2
7	и в то же	1	2
8	в узком смысле слова	2	2
9	как мы уже сказали	1	2
10	дело в том что	1	2
11	одной и той же	3	2
12	сказать несколько слов о	1	1
13	в конечном счете всегда	1	1
14	с помощью которого они	1	1
15	ни в коем случае	1	1
16	только то что может	1	1
17	как раз и не	2	1
18	до сих пор не	1	1
19	смысл и значение в	1	1
20	в данном случае в	1	1
21	не что иное как	1	1
22	свой смысл и значение	1	1
23	не теряет своей силы	1	1
24	нет и не может	2	1
25	и не может быть	3	1
26	или во всяком случае	1	1
27	уже приходилось упоминать о	1	1
28	нам уже приходилось упоминать	1	1
29	и в данном случае	1	1
30	на самом же деле	2	1
31	есть не что иное	1	1
32	во всяком случае в	1	1
33	не может быть отнесено	2	1
34	бы то ни было	2	1
