1	в то же время	3	7
2	одно и то же	7	5
3	одной и той же	12	4
4	в связи с этим	1	2
5	ни к чему не	1	2
6	одну и ту же	1	2
7	точном смысле этого слова	4	2
8	все больше и больше	5	2
9	мы никогда не сумеем	2	2
10	одни и те же	3	2
11	и для того чтобы	2	2
12	не что иное как	6	2
13	вместе с тем и	2	2
14	одном и том же	1	2
15	и то же слово	1	2
16	но для того чтобы	1	2
17	в зависимости от того	4	2
18	в точном смысле этого	2	2
19	есть не что иное	2	2
20	приходится иметь дело с	3	1
21	при этом мы условно	1	1
22	само по себе не	2	1
23	ни на минуту не	2	1
24	в одной и той	2	1
25	в той же мере	1	1
26	мы должны были бы	1	1
27	при этом не только	1	1
28	в те времена когда	1	1
29	это только одна из	1	1
30	от тех или иных	1	1
31	только благодаря тому что	1	1
32	в собственном смысле слова	4	1
33	всегда несет в себе	1	1
34	и т.д что же	1	1
35	и то же событие	2	1
36	и не было бы	1	1
37	говорит один из героев	1	1
38	но вместе с тем	2	1
39	котором мы говорили выше	1	1
40	все сильнее и сильнее	1	1
41	до того как перейти	1	1
42	то же самое происходит	1	1
43	при этом она приобретает	1	1
44	что у нас не	1	1
45	которые с точки зрения	1	1
46	мысль о том что	3	1
47	то для того чтобы	2	1
48	как мы увидим ниже	1	1
49	которые в действительной жизни	1	1
50	одна и та же	4	1
51	в таких словах как	1	1
52	связь между языком и	1	1
53	одним и тем же	4	1
54	мы никогда не найдем	3	1
55	одного и того же	4	1
56	то же самое и	4	1
57	убедиться в том что	2	1
58	того или иного решения	1	1
59	одному и тому же	1	1
60	о том что такое	1	1
61	с нашей точки зрения	1	1
62	и не может быть	2	1
63	становится совершенно ясным что	1	1
64	как говорит один из	1	1
65	к одному и тому	1	1
66	если мы будем говорить	1	1
67	мы видим что и	1	1
68	того как перейти к	1	1
69	в жизни и в	1	1
70	в том и другом	1	1
71	том и другом случае	1	1
72	о котором мы говорили	2	1
