1	заключается в том что	43	7
2	в то время как	20	6
3	одной и той же	15	5
4	с этой точки зрения	16	5
5	в том что она	3	4
6	указывает на то что	4	4
7	заключается в том чтобы	7	4
8	так же точно и	1	3
9	одни и те же	4	3
10	точно так же как	6	3
11	и в самом деле	1	3
12	так же точно как	2	3
13	с психологической точки зрения	3	3
14	в силу того что	9	3
15	то что у него	1	3
16	с таким образом и	2	2
17	до тех пор пока	1	2
18	остается ничего другого как	2	2
19	несмотря на то что	4	2
20	все время в виду	1	2
21	в собственном смысле слова	9	2
22	в том и заключается	2	2
23	в том случае если	2	2
24	все больше и больше	5	2
25	с точки зрения социальной	2	2
26	надо сказать что в	1	2
27	в полном согласии с	2	2
28	состоит в том чтобы	1	2
29	никогда не может быть	1	2
30	во всяком случае в	1	2
31	для того чтобы заметить	1	2
32	приходит к выводу что	5	2
33	случае не может быть	1	2
34	не что иное как	6	2
35	если мы примем во	1	2
36	мы примем во внимание	1	2
37	представление о том что	5	2
38	которая не может быть	1	2
39	ни в какой мере	3	2
40	же самое что и	1	2
41	у него могут быть	1	2
42	же как и в	2	2
43	не остается ничего другого	2	2
44	один и тот же	12	2
45	то же самое что	7	2
46	в то же время	2	2
47	так же как и	16	2
48	все дело в том	1	1
49	и подобно тому как	2	1
50	всегда имеет дело с	1	1
51	то же что и	1	1
52	в результате этого исследования	2	1
53	все равно что сказать	1	1
54	и в конце концов	1	1
55	рассказывает о том как	1	1
56	само по себе не	2	1
57	убедиться в том что	2	1
58	и до наших дней	1	1
59	станет совершенно ясно что	1	1
60	в сущности говоря это	2	1
61	к тому же самому	1	1
62	что в основе этого	1	1
63	и точно так же	1	1
64	в той мере в	5	1
65	бы вбирает в себя	1	1
66	в какой мере не	3	1
67	а с другой стороны	5	1
68	в связи с этим	3	1
69	вместе с тем является	1	1
70	при этом не только	1	1
71	от поколения к поколению	1	1
72	с одной стороны и	10	1
73	в том что мы	4	1
74	что в настоящее время	1	1
75	равно что сказать что	1	1
76	друг к другу и	2	1
77	во всяком случае все	1	1
78	так как мы знаем	1	1
79	необходимо включает в себя	1	1
80	место только тогда когда	1	1
81	мы видели что в	2	1
82	одну и ту же	4	1
83	так и во всех	1	1
84	всегда и постоянно от	1	1
85	ли может быть отнесена	1	1
86	только благодаря тому что	1	1
87	ни в коем случае	1	1
88	по тому же самому	1	1
89	задача заключается в том	1	1
90	легко убедиться в том	1	1
91	состоит в том что	17	1
92	если мы скажем что	1	1
93	по самой природе своей	1	1
94	как бы вбирает в	1	1
95	привело к тому что	1	1
96	о том что он	1	1
97	само собой разумеется что	2	1
98	было бы сказать что	1	1
99	в светлое поле сознания	1	1
100	может быть отнесена к	1	1
101	в коем случае не	1	1
102	одним и тем же	6	1
103	легко заметить что это	1	1
104	не только ничего не	1	1
105	на вопрос о том	5	1
106	но вместе с тем	9	1
107	явлений и процессов в	1	1
108	того чтобы подойти к	2	1
109	факт заключается в том	1	1
110	той мере в какой	4	1
111	от того что он	2	1
112	знаем о чем идет	1	1
113	в том что в	8	1
114	и ту же мысль	2	1
115	одно и то же	12	1
116	вовсе не следует что	1	1
117	таким образом мы видим	1	1
118	не имеет никакого значения	1	1
119	в том виде как	4	1
120	том и заключается что	1	1
121	так же точно в	1	1
122	что с этой точки	1	1
123	если принять во внимание	4	1
124	тех или иных элементов	1	1
125	в том что на	1	1
126	в этой области как	1	1
127	в этом смысле думается	1	1
128	когда он говорит что	1	1
129	говорит по этому поводу	2	1
130	мы видим в том	2	1
131	и что в основе	1	1
132	говорит он что ребенок	1	1
133	для того чтобы вскрыть	1	1
134	что в основе его	1	1
135	в ту или другую	1	1
136	вопрос о том что	1	1
137	том чтобы понять что	1	1
138	для того чтобы с	2	1
139	в самом деле стоит	1	1
140	из того факта что	1	1
141	и тот же предмет	5	1
142	согласны в том что	2	1
143	точки зрения социальной психологии	2	1
144	сама по себе мысль	1	1
145	в самом деле что	1	1
146	занимает среднее место между	1	1
147	именно в силу того	2	1
148	в чем именно заключается	1	1
149	приводит к тому что	5	1
150	и в том что	1	1
151	что мы имеем дело	1	1
152	на целый ряд отдельных	1	1
153	самым существенным из этих	1	1
154	мы знаем о чем	1	1
155	вместе с тем и	7	1
156	только тогда когда оно	1	1
157	свидетельствовать о том что	1	1
158	одном и том же	6	1
159	и с психологической точки	1	1
160	совершенно ясно что с	1	1
161	отношении друг к другу	1	1
162	то мы увидим что	1	1
163	в том смысле что	5	1
164	с одного языка на	1	1
165	все согласны в том	1	1
166	едва ли может быть	1	1
167	в основе его лежит	1	1
168	в том числе и	10	1
169	самом деле стоит только	1	1
170	только о том что	1	1
171	и там и здесь	1	1
172	в том что ребенок	6	1
173	одного и того же	17	1
174	никакой роли и что	1	1
175	по самой психологической природе	1	1
176	на один и тот	3	1
177	было бы если бы	1	1
178	одному и тому же	7	1
179	в том что при	1	1
180	и в известном смысле	3	1
181	к решению этого вопроса	1	1
182	если мы обратимся к	6	1
183	по самой своей природе	6	1
184	для того чтобы дать	1	1
185	это все равно что	1	1
186	том случае если бы	1	1
187	но для того чтобы	3	1
188	что с одной стороны	2	1
189	одного языка на другой	1	1
190	указанием на то что	2	1
191	ту или другую сторону	1	1
192	и во всех остальных	1	1
193	совершенно так же как	5	1
194	прибавим к этому что	1	1
195	не иначе как в	1	1
196	в сущности ничего не	2	1
197	прежде всего тем что	1	1
198	в зависимости от того	2	1
199	и не может быть	2	1
200	есть в сущности говоря	2	1
201	но если присмотреться внимательно	1	1
202	для того чтобы выяснить	3	1
203	как говорит французская пословица	1	1
204	то не удивительно что	1	1
205	так же и в	1	1
206	к одному и тому	7	1
207	и то что мы	1	1
208	ясно что с точки	1	1
209	образом мы видим что	1	1
210	в самом деле для	1	1
211	потому что все это	1	1
212	заключается только в том	4	1
213	это не потому что	1	1
214	мы никогда не знаем	1	1
215	с другой стороны в	1	1
216	дело в том что	3	1
217	столько же сколько и	1	1
218	то время как для	1	1
219	в чем же заключаются	1	1
220	же точно как в	1	1
221	само по себе но	1	1
222	пришел к той же	1	1
223	в том что он	8	1
224	для того чтобы подойти	2	1
225	о чем идет речь	3	1
226	которые отличают его от	1	1
227	в такой же мере	10	1
228	на каждом шагу в	2	1
229	на все эти вопросы	1	1
230	до сих пор значение	1	1
231	что с точки зрения	4	1
232	для того чтобы сделать	4	1
233	до сих пор ни	1	1
234	во всяком случае они	1	1
235	в том чтобы понять	2	1
236	того чтобы заметить что	1	1
237	он указывает на то	1	1
238	таким образом оказывается что	2	1
239	эта точка зрения была	2	1
240	он прямо говорит что	1	1
241	это можно было бы	1	1
242	ни в какой степени	2	1
243	с точки зрения этой	2	1
244	какой мере не является	1	1
245	к тому что и	1	1
246	какого бы то ни	2	1
247	точки зрения этой теории	1	1
248	которые не могут быть	2	1
249	не заключает в себе	1	1
250	есть не что иное	4	1
251	бы то ни было	3	1
252	что это действительно так	1	1
253	и более или менее	1	1
