1	в то же время	1	13
2	но в то же	3	7
3	по себе еще не	1	4
4	в том что он	3	4
5	с другой стороны и	1	3
6	и в то же	3	2
7	и в этом смысле	1	2
8	но с другой стороны	2	2
9	а в то же	1	2
10	в то время как	12	2
11	и в этом отношении	1	2
12	бы то ни было	6	2
13	ни в одном из	1	2
14	в обычном смысле слова	1	1
15	собственном смысле слова и	1	1
16	в этом смысле он	1	1
17	ничего общего не имеет	2	1
18	тем не менее и	1	1
19	тоже не может быть	1	1
20	с точки зрения которого	1	1
21	мы не знаем о	1	1
22	с одной стороны и	3	1
23	от человека от его	1	1
24	общего не имеет с	1	1
25	ведь в конце концов	1	1
26	в конце концов не	2	1
27	но в таком случае	7	1
28	и в литературной речи	1	1
29	в собственном смысле слова	4	1
30	и в логике и	1	1
31	мы имеем в виду	2	1
32	тем не менее в	5	1
33	о том что он	2	1
34	само по себе не	1	1
35	но это не значит	1	1
36	он остается в пределах	1	1
37	то это вовсе не	1	1
38	уже сама по себе	1	1
39	в том или другом	1	1
40	что до сих пор	1	1
41	и в том и	1	1
42	в логике и в	1	1
43	до сих пор не	1	1
44	по крайней мере для	2	1
45	если мы не знаем	1	1
46	в связи с теми	2	1
47	во всяком случае не	4	1
48	если бы оно было	1	1
49	можно было бы сказать	1	1
50	и это не только	1	1
51	что же тут в	1	1
52	что бы то ни	4	1
53	бы то ни стало	4	1
54	и в другом случае	1	1
55	какой бы то ни	1	1
56	в этом отношении не	1	1
57	которая как раз и	1	1
58	как бы оно ни	1	1
59	так же как и	4	1
60	на том или другом	1	1
61	в конце концов как	2	1
62	ничем не отличается от	2	1
63	таким образом как бы	1	1
64	в конце концов так	1	1
65	человека а следовательно и	1	1
66	к другому от одного	1	1
67	в той или иной	10	1
68	именно потому что он	1	1
69	что же это за	1	1
70	и не может быть	1	1
71	по крайней мере не	1	1
72	если бы не было	3	1
73	выходить за пределы данного	1	1
74	ни на что другое	1	1
75	во что бы то	4	1
76	каких бы то ни	2	1
77	в том числе и	4	1
78	и до сих пор	1	1
79	каковы бы ни были	1	1
80	но тем не менее	2	1
81	дело в том что	10	1
82	бы оно ни было	1	1
83	а может быть и	2	1
84	в зависимости от своего	1	1
85	и есть то что	1	1
86	в том и в	1	1
87	заключается в том что	6	1
88	можно прямо сказать что	1	1
89	в свете формулированного нами	1	1
90	том и в другом	1	1
