1	заключается в том что	2	6
2	так же как и	3	4
3	в то время как	1	4
4	с одной стороны и	6	3
5	в том числе и	1	3
6	дело в том что	1	2
7	из того что в	1	2
8	с точки зрения развития	1	2
9	несмотря на то что	1	1
10	с другой стороны в	1	1
11	в некотором смысле она	1	1
12	и в то же	8	1
13	так и со стороны	1	1
14	если оставить в стороне	1	1
15	в то же время	14	1
16	и та и другая	1	1
17	один и тот же	1	1
18	и не быть в	1	1
19	то же время не	1	1
20	в тех случаях когда	1	1
21	и с точки зрения	1	1
22	само по себе не	2	1
23	и в применении к	1	1
24	с точки зрения этих	1	1
25	того что мы знаем	1	1
26	в той или иной	3	1
27	с этой точки зрения	5	1
28	бы то ни было	4	1
29	о котором мы говорили	1	1
