1	в то же время	3	14
2	с одной стороны и	2	6
3	с этой точки зрения	10	5
4	бы то ни было	2	4
5	так же как и	5	3
6	само по себе не	2	2
7	и в этом смысле	1	2
8	например с точки зрения	1	2
9	заключается в том что	23	2
10	ту или иную идеологию	1	1
11	может быть сведена к	2	1
12	совершенно очевидно что в	2	1
13	и то и другое	3	1
14	одна и та же	4	1
15	в то время как	13	1
16	несмотря на то что	3	1
17	в связи с этим	1	1
18	то мы увидим что	2	1
19	в том смысле что	3	1
20	дело в том что	3	1
21	в том числе и	1	1
22	то есть в порядке	1	1
23	одну и ту же	1	1
24	в том случае если	7	1
25	в двух противоположных направлениях	4	1
26	например в том что	1	1
27	того чтобы ответить на	1	1
28	заключает в себе ничего	2	1
29	поскольку речь идет о	2	1
30	чтобы ответить на этот	1	1
31	на то что в	2	1
32	если оставить в стороне	1	1
33	к тому или иному	1	1
34	которая выпадает на долю	2	1
35	с другой стороны в	1	1
36	но если оставить в	1	1
37	только в том случае	6	1
38	что само по себе	1	1
39	один и тот же	5	1
40	и с точки зрения	1	1
41	и для того чтобы	2	1
42	находит себе подтверждение в	1	1
43	указать на то что	2	1
44	роль которая выпадает на	2	1
45	но не только это	1	1
46	ответить на этот вопрос	1	1
47	для того чтобы ответить	1	1
48	не заключает в себе	3	1
49	не кто иной как	1	1
50	одного и того же	4	1
51	о котором мы говорили	2	1
