1	в то же время	6	3
2	бы то ни было	1	3
3	не что иное как	5	2
4	состоит в том что	2	2
5	в той или иной	1	2
6	точно так же как	1	2
7	в том или ином	2	2
8	собой не что иное	1	1
9	какой бы то ни	1	1
10	и до наших дней	1	1
11	в том что он	1	1
12	одного и того же	2	1
13	по отношению к нему	1	1
14	той мере в какой	6	1
15	в том что в	1	1
16	в той мере в	6	1
17	дело в том что	3	1
18	с этой точки зрения	2	1
19	мы имеем дело с	1	1
20	не может быть и	1	1
21	есть не что иное	3	1
22	той или иной степени	1	1
