1	в то же время	1	11
2	один и тот же	3	3
3	иначе обстоит дело с	2	3
4	в то время как	13	3
5	бы то ни было	3	3
6	только для того чтобы	1	2
7	едва ли не самым	1	2
8	с одной стороны и	3	2
9	не говоря уже о	1	2
10	до сих пор не	3	2
11	в том числе и	2	2
12	как бы то ни	1	2
13	и между ними происходит	1	1
14	никто об этом не	1	1
15	тем не менее и	1	1
16	после того как эти	1	1
17	с одной стороны он	2	1
18	даже в тех случаях	3	1
19	только в том что	1	1
20	следует понимать как это	1	1
21	друг с другом и	1	1
22	дело следовательно не в	1	1
23	что в некоторых случаях	2	1
24	на вопрос почему в	1	1
25	состоит в том что	4	1
26	тем не менее в	1	1
27	до сих пор в	1	1
28	до сих пор были	1	1
29	а с точки зрения	1	1
30	таким образом и здесь	4	1
31	но вместе с тем	8	1
32	о том что она	1	1
33	в том что она	1	1
34	в том что девушку	1	1
35	в тех случаях когда	10	1
36	и далеко не всегда	1	1
37	начинается с того что	7	1
38	мы можем сказать что	1	1
39	не заставляет себя ждать	1	1
40	много лет тому назад	2	1
41	несколько иначе обстоит дело	1	1
42	в том что в	1	1
43	об этом можно судить	1	1
44	в этом случае в	1	1
45	мы знаем их в	1	1
46	мы опять не знаем	1	1
47	вместе с тем мы	1	1
48	в зависимости от того	1	1
49	в самом деле и	1	1
50	по тому что она	1	1
51	с ним а в	1	1
52	сама по себе не	1	1
53	то же самое что	4	1
54	что он отправляется в	1	1
55	с этой точки зрения	6	1
56	только после того как	5	1
57	как будут развиваться события	1	1
58	несмотря на то что	1	1
