1	бы то ни было	4	11
2	одного и того же	1	9
3	в то же время	21	7
4	но в то же	1	6
5	и не может быть	1	5
6	одно и то же	2	3
7	и того же слова	1	3
8	какой бы то ни	1	3
9	в том числе и	3	3
10	в том что он	1	3
11	в той или иной	1	3
12	до тех пор пока	2	2
13	одним и тем же	1	2
14	какого бы то ни	3	2
15	нет и не может	1	2
16	все более и более	1	2
17	мыслится при этом как	2	1
18	с одной стороны и	3	1
19	тех пор пока не	1	1
20	не говоря уже о	6	1
21	только по отношению к	1	1
22	и в соответствии с	1	1
23	именно в том что	1	1
24	и прежде всего в	1	1
25	не что иное как	1	1
26	приводит к тому что	1	1
27	по крайней мере двух	1	1
28	с точки зрения говорящего	1	1
29	дело в том что	2	1
30	с предшествующим и последующим	1	1
31	с этой точки зрения	5	1
32	не только по отношению	1	1
