1	дело в том что	2	4
2	не что иное как	1	3
3	и вместе с тем	1	2
4	бы то ни было	4	2
5	не говоря уже о	6	2
6	не только в том	2	2
7	не имеет ничего общего	1	2
8	в той или иной	1	2
9	в том что он	1	2
10	той или иной мере	1	2
11	но в то же	1	2
12	с этой точки зрения	5	2
13	о том что не	2	1
14	с точки зрения которого	1	1
15	только в том что	2	1
16	с другой стороны он	1	1
17	же самое можно сказать	2	1
18	вопрос о том как	1	1
19	мандельштам еще в году	1	1
20	видит в том что	1	1
21	одним и тем же	1	1
22	в то же время	21	1
23	и в частности для	1	1
24	эти и подобные им	2	1
25	в том что его	2	1
26	имеется в виду не	1	1
27	мы имеем дело с	1	1
28	бы ни были его	1	1
29	в войне и мире	1	1
30	имеет ничего общего с	1	1
31	означает не что иное	1	1
32	и тем не менее	1	1
33	о себе в третьем	1	1
34	том числе и в	1	1
35	в виду не только	1	1
36	в том числе и	3	1
37	все хотят увидеть всех	2	1
38	состоит в том что	8	1
39	человека в этом же	1	1
40	каковы бы ни были	1	1
41	в том что в	1	1
42	в такой же мере	1	1
43	все более и более	1	1
44	здесь как и во	1	1
45	то же самое можно	2	1
46	но так или иначе	1	1
47	себе в третьем лице	1	1
