1	в то же время	5	7
2	не говоря уже о	1	3
3	и в то же	3	3
4	с его точки зрения	1	2
5	к н н страхову	1	2
6	в то время как	1	2
7	но в то же	1	2
8	и вместе с тем	1	1
9	о том что и	1	1
10	в письме к а	2	1
11	письме к н н	1	1
12	но вместе с тем	1	1
13	мы имеем дело с	1	1
14	письме к а а	1	1
15	них не может быть	1	1
16	еще из другого письма	1	1
17	и не может быть	2	1
18	по этому поводу с	1	1
19	уже о том что	1	1
20	из них не может	1	1
21	в письме к н	2	1
22	говоря уже о том	1	1
23	нет и не может	1	1
24	говорит в письме к	1	1
25	одно и то же	1	1
26	в силу чего он	1	1
27	не в том что	2	1
28	а в том что	1	1
