1	в то время как	3	6
2	с этой точки зрения	1	5
3	в собственном смысле слова	3	2
4	в том случае если	2	2
5	только в том случае	1	2
6	и тем не менее	2	2
7	не может быть объяснено	1	2
8	не что иное как	2	2
9	один и тот же	1	2
10	в то же время	1	2
11	в том порядке в	1	1
12	совершенно ясно что и	1	1
13	в связи с этим	4	1
14	друг к другу и	2	1
15	ни в коем случае	1	1
16	состоит в том что	3	1
17	было бы сказать что	1	1
18	том порядке в каком	1	1
19	в коем случае не	1	1
20	одно и то же	1	1
21	таким образом мы видим	4	1
22	если мы не сумеем	1	1
23	в том что все	1	1
24	во всем ее объеме	1	1
25	и т д и	1	1
26	и т д с	1	1
27	что бы то ни	1	1
28	бы то ни стало	1	1
29	приводит к тому что	1	1
30	на составные части но	1	1
31	в том случае когда	1	1
32	уже не может быть	1	1
33	точно так же и	1	1
34	отношении друг к другу	1	1
35	изучения в то время	1	1
36	и т д то	1	1
37	указанием на то что	1	1
38	с точки зрения их	1	1
39	во что бы то	1	1
40	даже в тех случаях	1	1
41	образом мы видим что	4	1
42	действующих лиц и их	1	1
43	в том что он	1	1
44	и т д все	1	1
45	какого бы то ни	1	1
46	которые не могут быть	1	1
47	есть не что иное	1	1
48	бы то ни было	2	1
