1	бы то ни было	2	11
2	одного и того же	4	9
3	в то же время	8	7
4	одни и те же	1	5
5	и не может быть	2	5
6	одно и то же	3	3
7	в том числе и	3	3
8	в том что он	1	3
9	в той или иной	1	3
10	и до настоящего времени	1	3
11	одним и тем же	2	2
12	из одного и того	1	2
13	нет и не может	1	2
14	одной и той же	2	2
15	пролить свет и на	1	1
16	с одной стороны и	5	1
17	не говоря уже о	3	1
18	с той или иной	2	1
19	только по отношению к	1	1
20	как и все остальные	1	1
21	в большей или меньшей	1	1
22	отнюдь не сводится к	1	1
23	как мы видели не	1	1
24	между внутренним и внешним	1	1
25	тем не менее в	1	1
26	именно в том что	1	1
27	может быть сведена к	1	1
28	не что иное как	1	1
29	в их отношении к	1	1
30	именно здесь в области	1	1
31	по крайней мере двух	1	1
32	то же время они	1	1
33	не имеют никакого отношения	1	1
34	ни к чему не	1	1
35	или во всяком случае	1	1
36	в одной и той	1	1
37	дело в том что	5	1
38	к тому или иному	1	1
39	не только по отношению	1	1
