1	только в том что	1	5
2	в то же время	5	3
3	в одном и том	1	3
4	одном и том же	2	3
5	не в том что	2	3
6	с одной стороны и	2	2
7	но с другой стороны	1	2
8	а в том что	1	2
9	в том смысле что	1	2
10	во всех этих и	2	1
11	чтобы не впасть в	1	1
12	с другой стороны он	1	1
13	не говоря уже о	1	1
14	в том случае если	1	1
15	не имеет ничего общего	1	1
16	не может обойтись без	1	1
17	что без них не	1	1
18	имеет ничего общего с	1	1
19	не могло бы быть	1	1
20	говоря уже о том	1	1
21	в том что оно	1	1
22	в то время как	1	1
23	мы хотим сказать что	1	1
24	с этой точки зрения	1	1
25	уже о том что	1	1
