1	в то же время	14	13
2	но в то же	3	7
3	в том что он	1	4
4	и в то же	6	2
5	и в этом смысле	4	2
6	но потому что она	2	2
7	и не входит в	1	2
8	в то время как	8	2
9	и в этом отношении	1	2
10	бы то ни было	1	2
11	по себе не имеет	1	1
12	с другой стороны мы	1	1
13	и во всяком случае	1	1
14	ничего общего не имеет	1	1
15	уже само по себе	1	1
16	если бы это было	1	1
17	того что он есть	4	1
18	с одной стороны и	4	1
19	на самом деле это	1	1
20	общего не имеет с	1	1
21	и т д как	1	1
22	он есть т е	1	1
23	в конце концов не	1	1
24	точка зрения с которой	1	1
25	не с точки зрения	2	1
26	мы имеем в виду	1	1
27	тем не менее в	2	1
28	можно было бы дать	1	1
29	как бы в некотором	1	1
30	не потому что она	3	1
31	само по себе не	1	1
32	так всегда и бывает	1	1
33	но это не значит	1	1
34	бы это было так	1	1
35	то это вовсе не	1	1
36	уже сама по себе	2	1
37	не может не признать	1	1
38	все новые и новые	1	1
39	и в том и	1	1
40	что она уже не	1	1
41	в одном месте и	1	1
42	то же время и	2	1
43	как более или менее	2	1
44	с точки зрения воли	1	1
45	до сих пор не	1	1
46	не знаете что такое	1	1
47	никогда не может быть	1	1
48	именно в том что	1	1
49	что бы то ни	2	1
50	бы то ни стало	2	1
51	и в другом случае	1	1
52	лишь с точки зрения	1	1
53	о себе самом не	1	1
54	так же как и	2	1
55	на том или другом	1	1
56	которые сами по себе	1	1
57	ничем не отличается от	4	1
58	по мере того как	1	1
59	положения которые сами по	1	1
60	что же это за	1	1
61	и не может быть	1	1
62	а в том что	1	1
63	по крайней мере не	1	1
64	если бы не было	1	1
65	ни на что другое	1	1
66	это было так то	1	1
67	во что бы то	2	1
68	само по себе достаточно	1	1
69	с точки зрения своей	1	1
70	каково бы ни было	1	1
71	и до сих пор	1	1
72	но тем не менее	1	1
73	оно и не может	1	1
74	дело в том что	2	1
75	в этом смысле она	1	1
76	на ту же тему	1	1
77	и есть то что	3	1
78	и независимо от того	1	1
79	что с точки зрения	2	1
80	в том и в	1	1
81	заключается в том что	1	1
82	не в том что	5	1
83	с другой стороны эта	1	1
84	можно прямо сказать что	1	1
85	в зависимости от характера	1	1
86	в своей последней основе	1	1
87	том и в другом	1	1
88	иметь в виду что	4	1
