1	в то время как	1	4
2	сводится к тому что	1	3
3	до тех пор пока	3	2
4	состоит в том что	26	2
5	не что иное как	4	2
6	в том что в	8	2
7	одного и того же	1	2
8	одна и та же	1	2
9	что в этом случае	2	2
10	дело в том что	1	2
11	каждый из этих элементов	1	1
12	в том что ее	1	1
13	до сих пор в	1	1
14	например в том что	1	1
15	привело к тому что	2	1
16	это приводит к тому	1	1
17	может быть только человек	2	1
18	прав когда полагает что	1	1
19	пишет для того чтобы	1	1
20	и т д и	2	1
21	и что в этом	1	1
22	сомнения в том что	1	1
23	о том что на	1	1
24	вместе с тем и	2	1
25	приводит к тому что	1	1
26	так же как и	3	1
27	а как раз наоборот	1	1
28	но вместе с тем	3	1
29	в том что на	1	1
30	мы видели что в	1	1
