1	в то же время	18	12
2	но с другой стороны	1	3
3	с этой точки зрения	2	3
4	дело не только в	1	2
5	дело в том что	1	2
6	и т п это	1	1
7	он не может быть	1	1
8	и в то же	6	1
9	в том что в	1	1
10	именно в том что	1	1
11	оттесняет на задний план	1	1
12	не исключают друг друга	2	1
13	о себе как бы	1	1
14	только и не столько	1	1
15	то же время он	2	1
16	в том что он	1	1
17	с одной стороны и	4	1
18	нет и не может	1	1
19	и не может быть	2	1
20	каковы бы ни были	1	1
21	но в то же	7	1
22	не только и не	1	1
23	одно и то же	3	1
24	все более и более	1	1
25	и прежде всего в	1	1
26	бы то ни было	1	1
