1	до сих пор мы	1	3
2	в том что они	1	3
3	не что иное как	3	3
4	в то время как	1	3
5	в тот момент когда	1	3
6	и вместе с тем	1	2
7	мы уже знаем что	2	2
8	на этот вопрос мы	2	2
9	один и тот же	4	2
10	то же самое что	1	2
11	дело в том что	13	2
12	после того как он	2	2
13	сих пор мы рассматривали	1	2
14	есть не что иное	3	2
15	бы то ни было	2	2
16	и в средние века	1	1
17	не подлежит никакому сомнению	5	1
18	по существу так как	1	1
19	они до сих пор	1	1
20	но это конечно не	2	1
21	с одной стороны и	5	1
22	в своей книге о	1	1
23	о том как он	1	1
24	дело вовсе не в	2	1
25	в сопровождении своего отца	1	1
26	можно было бы думать	1	1
27	какой бы то ни	2	1
28	таким образом и здесь	2	1
29	и в соответствии с	1	1
30	но вместе с тем	1	1
31	в большей или меньшей	14	1
32	с другой стороны с	1	1
33	но все это не	1	1
34	в тех случаях когда	1	1
35	не может так как	1	1
36	все дело в том	2	1
37	мы можем сказать что	2	1
38	сводится к тому чтобы	1	1
39	из этого описания мы	1	1
40	то мы увидим что	1	1
41	так же как и	2	1
42	что у него родился	1	1
43	и связанные с ними	2	1
44	в том что он	1	1
45	элементы при всем их	1	1
46	говорят о том что	1	1
47	большую роль и в	1	1
48	в средние века и	5	1
49	в силу того что	1	1
50	о том что в	3	1
51	только после того как	1	1
52	до сих пор в	1	1
53	с другой стороны в	2	1
54	в соответствии с этим	1	1
55	сказать что и в	1	1
56	что для того чтобы	1	1
57	на самом же деле	10	1
58	мы видим что в	2	1
59	с большей или меньшей	2	1
60	не чем иным как	1	1
61	социальной и культурной жизни	1	1
