1	заключается в том что	6	10
2	состоит в том что	2	7
3	с этой точки зрения	1	7
4	в то время как	5	4
5	но вместе с тем	2	3
6	в той мере в	3	3
7	в том что он	3	3
8	на вопрос о том	2	3
9	одной и той же	1	3
10	все более и более	2	3
11	а с другой стороны	1	2
12	только в том что	1	2
13	в том что в	4	2
14	если принять во внимание	3	2
15	ответ на этот вопрос	1	2
16	с тем что мы	1	2
17	так же как и	1	2
18	в том числе и	2	2
19	одному и тому же	1	2
20	той мере в какой	3	2
21	вообще не существует все	1	1
22	и вместе с тем	2	1
23	не отделены друг от	1	1
24	сомневаться в том что	2	1
25	отделены друг от друга	1	1
26	это не значит что	3	1
27	внимание на то что	2	1
28	что он не сумел	1	1
29	но и это не	1	1
30	в собственном смысле этого	1	1
31	и в конце концов	2	1
32	нас нет никаких оснований	1	1
33	само собой разумеется что	1	1
34	не говоря уже о	3	1
35	свидетельствуют о том что	1	1
36	это находит свое выражение	1	1
37	на то что в	4	1
38	одно и то же	1	1
39	мере в какой они	1	1
40	мы имеем дело с	1	1
41	одни и те же	1	1
42	надо сказать что в	1	1
43	принять во внимание что	1	1
44	себе отчета в том	1	1
45	но на самом деле	1	1
46	до самого последнего времени	1	1
47	той и другой стороны	1	1
48	в связи с этим	1	1
49	потому что он был	1	1
50	как мы видели уже	1	1
51	вопрос о том что	1	1
52	дело только в том	1	1
53	в том смысле что	3	1
54	на то что эти	1	1
55	вопрос о том в	1	1
56	обратил внимание на то	1	1
57	ответа на вопрос о	1	1
58	можно было бы подумать	1	1
59	в той же мере	1	1
60	и по отношению к	1	1
61	в этой области не	2	1
62	совершенно так же как	2	1
63	мы до сих пор	1	1
64	не может не быть	1	1
65	в прямом смысле этого	1	1
66	то время как в	1	1
67	у нас нет никаких	1	1
68	на вопрос что такое	1	1
69	но в высшей степени	1	1
70	в известном смысле является	1	1
71	не сказал бы что	1	1
72	бы то ни было	2	1
73	с точки зрения задач	1	1
74	в этом случае и	1	1
