1	заключается в том что	3	6
2	но вместе с тем	1	4
3	так же как и	1	4
4	в то время как	4	4
5	об отношении мысли к	1	4
6	отношении мысли к слову	1	4
7	с одной стороны и	3	3
8	в собственном смысле этого	1	3
9	состоит в том что	2	3
10	указывает на то что	1	3
11	в том числе и	1	3
12	все более и более	4	3
13	собственном смысле этого слова	1	3
14	в том же роде	1	2
15	дело в том что	4	2
16	между тем и другим	3	2
17	одно и то же	7	2
18	то время как в	1	2
19	одной и той же	7	2
20	есть прежде всего средство	1	1
21	единство звука и значения	1	1
22	в том что этот	1	1
23	в одном и том	3	1
24	виде в каком их	1	1
25	сливаются друг с другом	1	1
26	в том что мы	1	1
27	друг к другу и	1	1
28	а для того чтобы	1	1
29	место только тогда когда	1	1
30	том виде в каком	3	1
31	как мы видели выше	1	1
32	и все то что	1	1
33	но мы видели что	1	1
34	с другой стороны в	1	1
35	то это потому что	1	1
36	сам по себе способен	1	1
37	со своей точки зрения	1	1
38	заметить что в сущности	1	1
39	звук сам по себе	2	1
40	как мы старались показать	1	1
41	в то же время	13	1
42	в непосредственной связи с	1	1
43	более глубокое и верное	1	1
44	и та и другая	3	1
45	смысле этого слова так	1	1
46	точно так же как	1	1
47	можно сказать что все	1	1
48	в том что его	1	1
49	зависит не только от	1	1
50	один и тот же	4	1
51	то же время не	1	1
52	в силу того что	2	1
53	одном и том же	3	1
54	с другой стороны от	1	1
55	но на самом деле	1	1
56	само по себе не	1	1
57	с другой стороны если	1	1
58	и в самом деле	1	1
59	именно в силу того	1	1
60	вместе с тем и	4	1
61	в том что только	1	1
62	между словом и мыслью	1	1
63	состоящее в том что	1	1
64	и в отношении ее	1	1
65	потому что он не	2	1
66	между звуком и значением	1	1
67	в том что он	3	1
68	с точки зрения той	1	1
69	этого слова так же	1	1
70	не может быть выведено	1	1
71	в том виде в	3	1
72	по мере того как	14	1
73	с психологической точки зрения	1	1
74	внешнее по отношению к	1	1
75	или по крайней мере	4	1
76	ничем не связанных между	1	1
77	смысле этого слова а	1	1
78	есть с одной стороны	1	1
79	но в некотором смысле	1	1
80	то же самое что	2	1
81	ребенка заключает в себе	1	1
82	это не потому что	1	1
83	но и потому что	1	1
84	и не могут быть	1	1
85	мы старались показать что	1	1
86	с этой точки зрения	3	1
87	и в этом отношении	1	1
88	для того чтобы сделать	1	1
89	и к тому чтобы	1	1
90	связь между тем и	1	1
91	потому что оно есть	1	1
92	но тем не менее	10	1
93	мы видели что в	1	1
94	бы то ни было	2	1
