1	одно и то же	1	8
2	в то же время	6	7
3	ни в каком случае	2	5
4	не что иное как	1	4
5	мы можем сказать что	5	3
6	и в то же	1	3
7	в каком случае не	1	3
8	есть не что иное	1	3
9	на самом же деле	2	2
10	мы уже знаем что	1	2
11	или по крайней мере	1	2
12	ни в коем случае	1	1
13	все больше и больше	1	1
14	– одна из основных	1	1
15	ни в чем не	4	1
16	в том что она	2	1
17	до сих пор не	1	1
18	еще одно очень важное	1	1
19	и тем не менее	2	1
20	и в голову не	1	1
21	и во многих отношениях	1	1
22	в каком случае нельзя	1	1
23	в том что он	2	1
24	оно не есть только	1	1
25	и ни в какой	1	1
26	но в то же	3	1
27	что же это за	1	1
28	говорить о том что	2	1
29	дело в том что	1	1
30	не нуждается ни в	1	1
31	в коем случае не	1	1
32	то что мы называем	2	1
33	одной и той же	3	1
34	в жизни и в	1	1
35	в этом отношении совершенно	1	1
