1	до сих пор не	1	5
2	в том случае если	1	4
3	нечего и говорить что	1	3
4	отличаются друг от друга	1	3
5	заключается в том что	1	3
6	бы то ни было	1	3
7	несмотря на то что	3	2
8	из поставленных выше вопросов	1	2
9	в то же время	14	2
10	лишь в том случае	1	2
11	что в данном случае	1	1
12	мы уже сказали что	1	1
13	можно представить себе как	1	1
14	надо иметь в виду	1	1
15	что это есть не	1	1
16	в том что они	1	1
17	а между тем в	1	1
18	и в голову не	1	1
19	не говоря уже о	7	1
20	тем не менее в	2	1
21	отнюдь не тем что	1	1
22	мы уже знаем что	2	1
23	одно и то же	12	1
24	и в том и	1	1
25	мы находим в разных	1	1
26	как и все прочие	1	1
27	в том что все	1	1
28	есть не более как	1	1
29	не есть ли это	1	1
30	в самом деле если	1	1
31	о том что все	1	1
32	одно из двух или	3	1
33	никому и в голову	1	1
34	принять во внимание что	1	1
35	именно в том что	1	1
36	ни то ни другое	1	1
37	то ни другое ни	1	1
38	ни другое ни третье	1	1
39	только тогда когда оно	2	1
40	приводит к тому что	1	1
41	о котором мы только	1	1
42	в том что он	1	1
43	именно с точки зрения	1	1
44	одному и тому же	1	1
45	говоря уже о том	2	1
46	в то время как	8	1
47	а на самом деле	1	1
48	и не может быть	1	1
49	а в том что	1	1
50	на самом деле есть	1	1
51	и до сих пор	1	1
52	ее с точки зрения	1	1
53	дело в том что	2	1
54	том и в другом	1	1
55	и с точки зрения	1	1
56	с этой точки зрения	4	1
57	и в другом случае	1	1
58	в том и в	1	1
59	уже о том что	2	1
60	одной и той же	5	1
61	от того будет ли	1	1
62	не в том что	5	1
63	котором мы только что	1	1
