1	в то же время	14	6
2	мы можем сказать что	3	5
3	ни в чем не	2	4
4	и не может быть	1	3
5	но в то же	3	3
6	одной и той же	5	3
7	– это и есть	1	2
8	говорить о том что	1	2
9	и пр и пр	1	2
10	в том что она	1	2
11	то что мы называем	1	2
12	заключается в том что	1	2
13	и тем не менее	5	2
14	в том что он	1	2
15	ни в каком случае	7	2
16	на самом же деле	3	2
17	не чем иным как	1	2
18	бы то ни было	1	2
19	принципиально не отличается от	1	1
20	с научной точки зрения	2	1
21	ничем принципиально не отличается	1	1
22	приходится принимать во внимание	1	1
23	коем случае не может	1	1
24	ничего общего не имеет	1	1
25	конечно с точки зрения	1	1
26	и во многих отношениях	1	1
27	и сама она есть	1	1
28	это как мы уже	1	1
29	и в голову не	1	1
30	ни в коем случае	6	1
31	мы имеем в виду	1	1
32	все больше и больше	1	1
33	но тем не менее	1	1
34	– одна из основных	1	1
35	и в то же	6	1
36	все это учение о	1	1
37	не приходится принимать во	1	1
38	в том что в	1	1
39	мы уже знаем что	2	1
40	одно и то же	12	1
41	что в данном случае	1	1
42	удивительного в том что	1	1
43	до сих пор не	1	1
44	в самом деле если	1	1
45	что это вовсе не	1	1
46	нет ничего удивительного в	1	1
47	еще одно очень важное	1	1
48	в самом деле что	2	1
49	что бы то ни	2	1
50	и в вопросе о	1	1
51	как мы уже сказали	1	1
52	бы то ни стало	2	1
53	в данном случае в	1	1
54	уже не может быть	1	1
55	не что иное как	18	1
56	т д таким образом	1	1
57	и т д таким	1	1
58	и ни в какой	1	1
59	ничего удивительного в том	1	1
60	в каком случае не	3	1
61	ничего что давало бы	1	1
62	что же это за	1	1
63	в каком случае нельзя	2	1
64	оно не есть только	1	1
65	или по крайней мере	8	1
66	во что бы то	2	1
67	и только он один	1	1
68	дело в том что	2	1
69	не нуждается ни в	1	1
70	в коем случае не	6	1
71	– только одно из	1	1
72	все это – только	1	1
73	что с точки зрения	2	1
74	в жизни и в	1	1
75	и пр – все	1	1
76	есть не что иное	11	1
77	в этом отношении совершенно	1	1
