1	в то же время	26	7
2	и не может быть	1	4
3	в той или иной	5	3
4	в том или ином	1	3
5	бы то ни было	6	3
6	и к тому же	2	2
7	какой бы то ни	2	2
8	в том что он	5	2
9	одного и того же	1	2
10	но в то же	11	2
11	а в то же	3	2
12	одно и то же	3	2
13	но в таком случае	1	1
14	к тому же и	1	1
15	он в то же	1	1
16	несмотря на то что	1	1
17	так как если бы	1	1
18	в собственном смысле слова	1	1
19	событийна и рождается в	1	1
20	в пределы одного сознания	2	1
21	бы оно ни было	1	1
22	мы имеем в виду	1	1
23	же время оно и	1	1
24	тем не менее в	1	1
25	и в этом смысле	3	1
26	в большей или меньшей	3	1
27	во всей своей полноте	1	1
28	в таком случае это	1	1
29	и в самом деле	1	1
30	как более или менее	1	1
31	один и тот же	1	1
32	большей или меньшей степени	3	1
33	заключается в том что	1	1
34	в самом деле не	1	1
35	и вместе с тем	1	1
36	той или иной форме	2	1
37	одна и та же	2	1
38	в самом деле в	1	1
39	в том числе и	1	1
40	чего бы то ни	2	1
41	или во всяком случае	1	1
42	точке соприкосновения разных сознаний	1	1
43	но не может быть	1	1
44	и рождается в точке	1	1
45	то же время оно	2	1
46	с точки зрения художественного	1	1
47	оно и не может	1	1
48	в точке соприкосновения разных	1	1
49	произведения неизбежно оказывается в	1	1
50	на самом же деле	1	1
51	то же время он	1	1
52	рождается в точке соприкосновения	1	1
