1	в то же время	14	4
2	с одной стороны и	4	3
3	не в том что	5	2
4	не было и не	1	1
5	и в то же	6	1
6	внимание на то что	1	1
7	а стало быть и	2	1
8	том смысле что они	1	1
9	он не может быть	1	1
10	о том что будет	1	1
11	с той или иной	2	1
12	сомневаться в том что	1	1
13	исходя из того что	1	1
14	как более или менее	2	1
15	он может и должен	1	1
16	никогда не может быть	1	1
17	же самое и в	1	1
18	той или другой стороны	1	1
19	не что иное как	18	1
20	одна и та же	8	1
21	если бы не было	1	1
22	ли это что в	1	1
23	так же как и	2	1
24	в том смысле что	4	1
25	то же самое и	1	1
26	и не претендует на	1	1
27	с другой стороны эта	1	1
28	одних и тех же	3	1
29	и не может быть	1	1
30	уж во всяком случае	1	1
31	с другой стороны в	1	1
32	дело в том что	2	1
33	но в то же	3	1
34	в первом случае мы	1	1
35	мог бы и не	1	1
36	одно и то же	12	1
37	и тем более не	3	1
38	и в другом случае	1	1
39	одной и той же	5	1
