1	в том случае если	2	4
2	заключается в том что	1	3
3	одного и того же	4	3
4	бы то ни было	2	3
5	в то же время	8	2
6	лишь в том случае	1	2
7	что как сказано выше	1	2
8	в том что они	1	1
9	не говоря уже о	3	1
10	состоит в том что	7	1
11	же более или менее	1	1
12	тем не менее в	1	1
13	в данном случае не	1	1
14	только по отношению к	1	1
15	более или менее значительный	1	1
16	одно и то же	3	1
17	все же более или	1	1
18	и в том и	1	1
19	как и все прочие	1	1
20	именно в том что	1	1
21	мысль о том что	2	1
22	в тех случаях когда	2	1
23	в том числе и	3	1
24	в том что он	1	1
25	одному и тому же	1	1
26	состоит именно в том	1	1
27	в том или ином	1	1
28	и не может быть	2	1
29	а в том что	2	1
30	нет и не может	1	1
31	дело в том что	5	1
32	том и в другом	1	1
33	только в том случае	1	1
34	и в другом случае	1	1
35	в том и в	1	1
36	одной и той же	2	1
37	не в том что	1	1
38	не только по отношению	1	1
