1	дело в том что	1	4
2	в связи с этим	1	3
3	только для того чтобы	1	2
4	до сих пор еще	1	2
5	так же как и	1	2
6	совершенно так же как	1	2
7	и связанные с ним	1	1
8	в основе их лежит	1	1
9	не нуждается в особом	1	1
10	ни в коем случае	1	1
11	одного и того же	1	1
12	говорить о том что	1	1
13	мы уже знаем что	1	1
14	нечего и говорить о	1	1
15	ни в чем не	3	1
16	мы можем сказать что	1	1
17	но мы уже знаем	1	1
18	в коем случае нельзя	1	1
19	не что иное как	1	1
20	одна и та же	1	1
21	подлежит конечно никакому сомнению	1	1
22	не подлежит конечно никакому	1	1
23	это касается не только	1	1
24	в самых широких кругах	1	1
