1	по мере того как	1	8
2	в то же время	14	8
3	одно и то же	12	7
4	одной и той же	5	4
5	но тем не менее	1	4
6	не в том что	5	4
7	по себе независимо от	1	3
8	в то время как	8	3
9	до тех пор пока	1	2
10	одна и та же	8	2
11	и в том что	1	2
12	в том смысле что	4	2
13	потому что он не	1	2
14	в том что он	1	2
15	сказать несколько слов об	1	2
16	или по крайней мере	8	2
17	между тем и другим	1	2
18	то что мы называем	1	2
19	как показывает самое слово	1	1
20	в том смысле как	1	1
21	и т д не	3	1
22	как бы она ни	1	1
23	с одной стороны и	4	1
24	и сам по себе	1	1
25	самой по себе и	1	1
26	дело вовсе не в	2	1
27	того что не есть	2	1
28	как одно и то	1	1
29	и о том что	1	1
30	возможно только тогда когда	2	1
31	по самой своей природе	1	1
32	тем не менее в	2	1
33	то время как в	1	1
34	есть то что мы	3	1
35	не говоря уже о	7	1
36	со своей точки зрения	1	1
37	вовсе не в том	3	1
38	а в том что	1	1
39	никто не имеет права	1	1
40	и может быть только	1	1
41	мы не в силах	1	1
42	то же время и	2	1
43	в том случае если	1	1
44	сам по себе а	1	1
45	а между тем в	1	1
46	бы она ни была	1	1
47	в том что она	1	1
48	на наших глазах совершается	1	1
49	это значит что я	1	1
50	возможна только потому что	1	1
51	именно в том что	1	1
52	и в некотором смысле	1	1
53	заключается в том что	1	1
54	как мы уже сказали	1	1
55	не что иное как	18	1
56	и то и другое	4	1
57	вопрос о том что	1	1
58	можно только сказать что	1	1
59	отчет в том что	1	1
60	иначе не было бы	1	1
61	когда мы говорим что	2	1
62	с точки зрения той	1	1
63	может быть только в	1	1
64	и не может быть	1	1
65	если бы не было	1	1
66	на самом деле есть	1	1
67	сама по себе не	6	1
68	само по себе независимо	1	1
69	дело в том что	2	1
70	все более и более	1	1
71	есть не что иное	11	1
72	бы то ни было	1	1
