396	коммуникативный статус научной истины	1	1
397	связаны с языком ставят	1	1
398	как правило проходит стадию	1	1
399	не развившимся твердым композиционным	1	1
400	анекдот легко может быть	1	1
401	ощущаться завершенная и строго	1	1
402	риторика императивного монологизированного слова	1	1
403	фаза символической смерти фаза	1	1
404	нерушимого миропорядка символизируя сакральный	1	1
405	бахтин различал жанр как	1	1
406	но обязательно курьезное любопытное	1	1
407	определенной жанровой схемы и	1	1
408	поразительно и быть может	1	1
409	то есть острота или	1	1
410	царской дочери эта широко	1	1
411	имеет место перемена статуса	1	1
412	хотя бы достаточно подробная	1	1
413	рассказывать себе самому тогда	1	1
414	со стороны художественной литературы	1	1
415	зависит от жанра высказывания	1	1
416	что они хотят и	1	1
417	этнографии терминологией а ван	1	1
418	четвертой фаз герой волшебной	1	1
419	высказывания феномен жанровости есть	1	1
420	у него убеждения организующего	1	1
421	всегда эксплицированного в тексте	1	1
422	определяя их внутреннюю структуру	1	1
423	роль судьба или долг	1	1
424	нарушение запрета есть профанация	1	1
425	полярно противостоит событийности сказания	1	1
426	повествования размыкающего и выпрямляющего	1	1
427	глазами анекдота это игра	1	1
428	истины соответственно риторика сказания	1	1
429	сказания это риторика ролевого	1	1
430	с собственно художественными а	1	1
431	статуса героя статуса внешнего	1	1
432	замысла говорящего или пишущего	1	1
433	деритуализовано инициативно личностно окрашено	1	1
434	авторства референтная креативная и	1	1
435	заключительной стадии инициации имеет	1	1
436	на свою столь легкую	1	1
437	нем звучит один голос	1	1
438	авторской позиции и риторического	1	1
439	обязательно курьезное любопытное занимательное	1	1
440	противостоит событийности сказания и	1	1
441	то есть система исторически	1	1
442	событий архитектоническим вектором мифологического	1	1
443	до смертельного риска в	1	1
444	переход магической власти царя-жреца	1	1
445	может ощущаться завершенная и	1	1
446	представляется бахтинский подход к	1	1
447	частности до поединка а	1	1
448	состоит в наличии у	1	1
449	можно припоминая и примеряя	1	1
450	креативного и рецептивного сознаний	1	1
451	на непосредственную ответную реакцию	1	1
452	по своему коммуникативному статусу	1	1
453	в диахроническом аспекте бахтин	1	1
454	позволяющую донести до адресата	1	1
455	коммуникацию не будет адекватным	1	1
456	при этом и сам	1	1
457	или острота наизнанку глупость	1	1
458	испытания смертью она может	1	1
459	ночной жанр посрамляющий умершее	1	1
460	своего рода механизмом активизации	1	1
461	организующую роль по отношению	1	1
462	предметом целью и ситуацией	1	1
463	риторика окказионального ситуативного диалогизированного	1	1
464	размыкающего и выпрямляющего круговорот	1	1
465	героем помощников и/или вредителей	1	1
466	мифологическое мышление человека как	1	1
467	неудача две другие компетенции	1	1
468	уст в уста анекдот	1	1
469	она названа маской в.т	1	1
470	различал жанр как композиционно	1	1
471	стабильно дифференцированном и оцененном	1	1
472	искушений и испытаний до	1	1
473	герои сказания или анекдота	1	1
474	твердым композиционным костяком так	1	1
475	содержанию притчи не предполагается	1	1
476	им потусторонней страны мертвых	1	1
477	сказке обнаруживается далеко не	1	1
478	ставят перед ним определенные	1	1
479	разграничивающий первичные определенные типы	1	1
480	в таком случае его	1	1
481	определенные задания реализуют в	1	1
482	слушатель читатель может и	1	1
483	своему коммуникативному статусу тождественно	1	1
484	в тексте но всегда	1	1
485	обратное влияние со стороны	1	1
486	и адресата высказывания феномен	1	1
487	однажды но о том	1	1
488	хвале хуле или плачу	1	1
489	одновременно резко отличается в	1	1
490	фазу в соответствии с	1	1
491	лично для себя если	1	1
492	и непристойность необыкновенное в	1	1
493	что несмотря на свою	1	1
494	термин классической риторики то	1	1
495	серьезности бахтин жизни анекдот	1	1
496	бывает всегда тогда как	1	1
497	слово анекдота уже не	1	1
498	однако с другой стороны	1	1
499	определяется картиной мира моделируемой	1	1
500	хуле или плачу и	1	1
501	как единого художественного высказывания	1	1
502	к общенародной хвале хуле	1	1
503	жизни накопленных предками фаза	1	1
504	потому нейтральное к языку	1	1
505	для себя если первое	1	1
506	средствами линейного повествования размыкающего	1	1
507	параметры соотносимое с умирающей	1	1
508	значительной степени зависим от	1	1
509	порой в поединке с	1	1
510	характерно что несмотря на	1	1
511	не о том что	2	1
512	вообще жизненной позицией предполагающей	1	1
513	поэтому повторное выслушивание одного	1	1
514	голос > оно живет	1	1
515	с одной стороны проповедь	1	1
516	хоровое слово общенародной хвалы	1	1
517	то есть предметно-смысловые нахождения	1	1
518	знанием верификация такого знания	1	1
519	не ценностно дистанцированной в	1	1
520	а по своей природе	1	1
521	научной истины соответственно риторика	1	1
522	маски наконец существо рецептивной	1	1
523	четвертая фаза преображения здесь	1	1
524	интерсубъективных компетенций определенных возможностей	1	1
525	бахтину жанровое целое внеязыковое	1	1
526	к норме и устройству	1	1
527	существенно повлиявший на мифологическое	1	1
528	и оцененном мире слово	1	1
529	умирающей к зиме но	1	1
530	прежде всего они разнятся	1	1
531	ролевого обезличенного словарного слова	1	1
532	риторики то есть предметно-смысловые	1	1
533	содержанию сказания это позиция	1	1
534	в том что он	4	1
535	может выступать в архаических	1	1
536	который окружал человека к	1	1
537	избранничеством или самозванством а	1	1
538	предмета цели и ситуации	1	1
539	начинало мыслиться индивидуальностью а	1	1
540	новелле есть нарушение запрета	1	1
541	фаза ухода расторжение прежних	1	1
542	текстообразующую конвенциональность субъекта и	1	1
543	переходный обряд инициации в	1	1
544	постулирует со стороны адресата	1	1
545	данная археосюжетная фаза порой	1	1
546	решить предыстория или хотя	1	1
547	свободного игрового переиначивающего отношения	1	1
548	статуса внешнего социального или	1	1
549	и представляет собой не	1	1
550	горизонталь устремленная от начала	1	1
551	судьбы а некий нравственный	1	1
552	предел сказания героическая апофегма	1	1
553	предносящееся целое дискурса то	1	1
554	свободного выбора в качестве	1	1
555	жизненного выбора риторический предел	1	1
556	события на поучающего и	1	1
557	универсального опыта к индивидуальной	1	1
558	в уста анекдот как	1	1
559	поиска побега погони или	1	1
560	новейшее время внутреннего психологического	1	1
561	жанровых компетенций в диахроническом	1	1
562	рецептивная установка адресованности соотносительная	1	1
563	звучит один голос >	1	1
564	или притчи явственно солирует	1	1
565	сообщенный в иной ситуации	1	1
566	равнодостойности сознаний встречающихся в	1	1
567	смертью в той или	1	1
568	она может выступать в	1	1
569	притчей напротив предполагает как	1	1
570	в готовом стабильно дифференцированном	1	1
571	него убеждения организующего учительный	1	1
572	именовать фазой обособления помимо	1	1
573	в.т зависит от жанра	1	1
574	разделение иерархично оно не	1	1
575	способна решить предыстория или	1	1
576	цели и ситуации высказывания	1	1
577	оно не предполагает хоровой	1	1
578	жизнь достойна сказания отведена	1	1
579	историческом событии о перемене	1	1
580	даже будучи порой фактически	1	1
581	две другие компетенции суть	1	1
582	живет в готовом стабильно	1	1
583	от тестя к зятю	1	1
584	в современной передаче средствами	1	1
585	гипертрофируется и разворачивается в	1	1
586	редуцируется в случае элиминирования	1	1
587	в решающую фазу смертельного	1	1
588	и не занять этой	1	1
589	одного и того же	6	1
590	бесконечно репродуцируемых не о	1	1
591	воспринимающему сознанию той или	1	1
592	по убеждению соучастников притчевого	1	1
593	профанация священного новелла ночной	1	1
594	слушающих общим знанием поэтому	1	1
595	третьей и четвертой фаз	1	1
596	содержанию анекдота ни столь	1	1
597	не от своея воля	1	1
598	такого знания означала бы	1	1
599	приложение запечатленного в притче	1	1
600	об однократных и внезакономерных	1	1
601	свершают картина мира моделируемая	1	1
602	компетенции того или иного	1	1
603	и устройству хотя в	1	1
604	или изобретения говорящего иначе	1	1
605	типы устного диалога и	1	1
606	припоминая и примеряя ее	1	1
607	вектор сюжетного мышления напротив	1	1
608	поучаемого это разделение иерархично	1	1
609	и воскресающего бога однако	1	1
610	хранения и передачи этого	1	1
611	с прежним царем и	1	1
612	жизнь глазами анекдота это	1	1
613	разъединяет участников коммуникативного события	1	1
614	может не случайно напоминает	1	1
615	не выбирают а по	1	1
616	дискурсии и ее адресатов	1	1
617	фрэзером при рассмотрении множества	1	1
618	зародыши тематические и языковые	1	1
619	как и на заключительной	1	1
620	аналогичному адресату компетентность восприятия	1	1
621	нам всегда предносится целое	1	1
622	развившимся твердым композиционным костяком	1	1
623	необратимое превращение юноши в	1	1
624	кощунство и непристойность необыкновенное	1	1
625	а ван геннепа и	1	1
626	выбор лексики например в	1	1
627	жанровости есть металингвистический язык	1	1
628	половой зрелости человеческого существа	1	1
629	воскресающего бога однако символическая	1	1
630	фаза возвращения символическое воскресение	1	1
631	бога однако символическая смерть	1	1
632	но в таком случае	2	1
633	и/или вредителей нередко здесь	1	1
634	жанр городского фольклора являет	1	1
635	риторика сказания это риторика	1	1
636	соответствии с установившейся в	1	1
637	рассказчик анекдота или притчи	1	1
638	частной анекдот жизни но	1	1
639	такого высказывания своего рода	1	1
640	не обязательно сообщает нечто	1	1
641	смысле домонологично оно объединяет	1	1
642	постигает неудача две другие	1	1
643	в нем звучит один	1	1
644	и персонажи сказания не	1	1
645	если первое может быть	1	1
646	ослабление прежних жизненных связей	1	1
647	соучастников притчевого дискурса случается	1	1
648	в этом ряду выступает	1	1
649	поведение героя в последующих	1	1
650	формы междуязычны интернациональны в	1	1
651	мифа даже в сказке	1	1
652	в случае элиминирования из	1	1
653	инвенции термин классической риторики	1	1
654	анекдотического дискурса выступает исповедальное	1	1
655	или особенно в новейшее	1	1
656	в организации кадров внутреннего	1	1
657	сюжетного повествования составила фиксация	1	1
658	повреждения или до встречи	1	1
659	магической власти царя-жреца не	1	1
660	вертится противоположный предел язык	1	1
661	редуцирован комическая апофегма то	1	1
662	возвращения символическое воскресение в	1	1
663	ценностной однозначности > в	1	1
664	и примеряя ее содержание	1	1
665	не безликой роевой единицей	1	1
666	уходом в себя томлением	1	1
667	однозначности > в нем	1	1
668	ритуально-символической смерти героя или	1	1
669	организации текста позволяющую донести	1	1
670	перед нами не как	1	1
671	сюжета притчи лично для	1	1
672	всегда предносится целое нашего	1	1
673	жанры существенно связаны с	1	1
674	высказывания и в форме	1	1
675	испытаний наконец четвертая фаза	1	1
676	же анекдота обычно неприемлемо	1	1
677	определяется креативная компетенция наррации	1	1
678	событийности сказания и одновременно	1	1
679	фактически точными они бытуют	1	1
680	не предполагает внутренне свободного	1	1
681	с умирающей к зиме	1	1
682	однако внутренняя активность адресата	1	1
683	раз ответственность свободного выбора	1	1
684	выделяющая его из общей	1	1
685	страны мертвых может заостряться	1	1
686	тэрнера следует обозначить как	1	1
687	обнаруживается далеко не всегда	1	1
688	что вообще характерно для	1	1
689	участников коммуникативного события на	1	1
690	такого рода первофеноменами целого	1	1
691	обладает достоверным но не	1	1
692	круговорот жизни оно исключало	1	1
693	феномен жанровости есть металингвистический	1	1
694	архаическая фабула практически неотличимая	1	1
695	символическое второе рождение сопровождается	1	1
696	коммуникативным событием поэтому повторное	1	1
697	героическая апофегма до которой	1	1
698	определенные типы устного диалога	1	1
699	сюжетных сами по себе	1	1
700	авторства выше она названа	1	1
701	восходит к тому архаичному	1	1
702	нем определенные возможности когда	1	1
703	лексики например в значительной	1	1
704	не такое слово анекдота	1	1
705	смерти и эта фаза	1	1
706	построения речевого целого его	1	1
707	миропорядок где всякому чья	1	1
708	эксплицированного в тексте но	1	1
709	погони или напротив затворничества	1	1
710	в сказании повествуемой ситуации	1	1
711	нашего высказывания и в	1	1
712	своих прежних ранее расторгнутых	1	1
713	случае его вступление в	1	1
714	у-влекать слушателей преодолевая их	1	1
715	рассчитан на репродуцирование сообщенный	1	1
716	формой авторства референтная креативная	1	1
717	говорящий здесь только исполнитель	1	1
718	в мужчину охотника воина	1	1
719	не отвечает представляется нам	1	1
720	анекдот невозможно рассказывать себе	1	1
721	расторжение прежних родовых связей	1	1
722	взаимная условленность общения объединяющая	1	1
723	возможно ложное партнерство предваряющие	1	1
724	креативная компетенция говорящего состоит	1	1
725	существенное ослабление прежних жизненных	1	1
726	их поступки в притче	1	1
727	изустными то есть непосредственно	1	1
728	ожесточением мечтательностью вообще жизненной	1	1
729	внутренне свободного игрового переиначивающего	1	1
730	и на заключительной стадии	1	1
731	с языком ставят перед	1	1
732	внешнего социального или особенно	1	1
733	то же время они	2	1
734	символическое воскресение человека есть	1	1
735	исторически сложившуюся систему традиционных	1	1
736	человека есть уже необратимое	1	1
737	исторически восходит к тому	1	1
738	параметрам предмета цели и	1	1
739	или диалогической анекдот равнодостойности	1	1
740	однако и до сего	1	1
741	в себе не заключает	1	1
742	а все-таки она вертится	1	1
743	в частности писал что	1	1
744	верифицируемым знанием верификация такого	1	1
745	от притчи современный сугубо	1	1
746	собственной ситуации жизненного выбора	1	1
747	посещения им потусторонней страны	1	1
748	референтной компетенции того или	1	1
749	примеряя ее содержание к	1	1
750	жанры как формы построения	1	1
751	столь архаическая фабула практически	1	1
752	выступало залогом воспроизводимости нерушимого	1	1
753	только исполнитель передаваемого текста	1	1
754	ситуации типической ситуации общения	1	1
755	вымышленные но и невымышленные	1	1
756	и испытаний до вступления	1	1
757	него концепты героя и	1	1
758	не об однократных и	1	1
759	или ослабленных связей на	1	1
760	целое и жанровые зародыши	1	1
761	отношение к сообщенному знанию	1	1
762	основные параметры соотносимое с	1	1
763	кто говорит и кому	1	1
764	о перемене власти о	1	1
765	креативная компетенция рассказывающего анекдот	1	1
766	еще не развившимся твердым	1	1
767	жанр как композиционно определенное	1	1
768	хотя в современной передаче	1	1
769	в соответствии с установившейся	1	1
770	формы высказывания как целого	1	1
771	перемена статуса героя статуса	1	1
772	целого куста последующих жанровых	1	1
773	ослабленных связей на фоне	1	1
774	ставшего мужем царской дочери	1	1
775	слушателя к содержанию притчи	1	1
776	легко может быть редуцирован	1	1
777	себя если первое может	1	1
778	анекдота курьезная риторика окказионального	1	1
779	качестве нарративного вкрапления с	1	1
780	пока еще преждевременно поскольку	1	1
781	что не отвечает представляется	1	1
782	целого кто говорит и	1	1
783	символизируя сакральный центр мира	1	1
784	высказывания жанр в свою	1	1
785	бы не рассчитан на	1	1
