1	в то же время	14	18
2	но в то же	2	5
3	дело в том что	3	4
4	о свободе воли и	1	2
5	в том же году	1	2
6	и не может быть	4	2
7	то же время он	1	2
8	мы уже говорили о	1	1
9	это имеет место в	1	1
10	два года до этого	1	1
11	дело не только в	1	1
12	но в таком случае	2	1
13	не так ли и	1	1
14	мы имеем в виду	1	1
15	идет уже не о	1	1
16	в таком случае это	1	1
17	одна и та же	1	1
18	в войне и мире	2	1
19	представляет собой не что	1	1
20	заключается в том что	2	1
21	хотя бы и в	1	1
22	всего романа в целом	1	1
23	не что иное как	6	1
24	собой не что иное	1	1
25	в том числе и	1	1
26	не о том что	2	1
27	то же самое время	2	1
28	одного и того же	6	1
29	или во всяком случае	1	1
30	то же время они	2	1
31	ведет к тому что	1	1
32	ответ на этот вопрос	1	1
33	оно никогда не является	1	1
34	в то же самое	2	1
35	речь идет уже не	1	1
36	нет и не может	2	1
37	на самом же деле	1	1
38	как это имеет место	1	1
39	за два года до	1	1
40	с другой стороны и	1	1
41	не сами по себе	1	1
42	бы то ни было	3	1
