1	в то же время	9	7
2	дело в том что	11	3
3	по крайней мере в	1	2
4	в том что он	3	2
5	одной и той же	1	2
6	в этом отношении он	2	1
7	что несмотря на свою	1	1
8	в отставку в году	1	1
9	том что он не	1	1
10	состоит в том что	1	1
11	сам бог не есть	1	1
12	не говоря уже о	4	1
13	это было не так	1	1
14	один и тот же	2	1
15	состояла в том чтобы	1	1
16	в известном смысле и	1	1
17	лишь в том что	1	1
18	заключается в том что	3	1
19	тем не менее не	1	1
20	хотя и не всегда	1	1
21	и то что с	1	1
22	не что иное как	4	1
23	и в том что	2	1
24	о своей любви к	1	1
25	и в данном случае	1	1
26	но уже в новом	1	1
27	что же касается самого	3	1
28	которое как раз и	1	1
29	но дело в том	2	1
30	ни к чему не	1	1
31	сообщение о том что	1	1
32	что и в данном	1	1
33	приходит к выводу что	1	1
34	а в том что	1	1
35	обращает на себя внимание	2	1
36	мы и будем рассматривать	1	1
37	он так и не	1	1
38	в такой же мере	1	1
39	не в том что	1	1
40	в этом же году	1	1
41	мы имеем дело с	1	1
42	в дальнейшем мы будем	1	1
43	могут и должны быть	1	1
44	есть не что иное	2	1
