1	на самом же деле	5	7
2	в той или иной	3	7
3	не что иное как	1	6
4	ни в каком случае	1	5
5	бы то ни было	12	4
6	тем не менее в	1	3
7	одно и то же	3	3
8	так же как и	2	3
9	и в этом случае	1	3
10	дело в том что	1	3
11	до сих пор мы	1	2
12	в ту или иную	2	2
13	не чем иным как	1	2
14	не может обойтись без	1	2
15	если мы скажем что	1	2
16	же в таком случае	1	2
17	чем же в таком	1	2
18	отчет в том что	1	2
19	не имеют никакого отношения	1	2
20	себе отчет в том	1	2
21	и с точки зрения	1	2
22	как мы только что	1	2
23	и там и здесь	1	2
24	в том или ином	2	2
25	имеют никакого отношения к	1	2
26	с этой точки зрения	1	1
27	ничего общего не имеет	1	1
28	в какой мере не	1	1
29	в связи с этим	3	1
30	одной и той же	3	1
31	здесь одно и то	1	1
32	на то или иное	1	1
33	с одной стороны и	3	1
34	в связи с тем	1	1
35	и в таком случае	1	1
36	в собственном смысле слова	2	1
37	что они состоят из	1	1
38	само собой но что	1	1
39	не было бы в	1	1
40	и не было бы	1	1
41	сами по себе в	1	1
42	с той или иной	1	1
43	одним и тем же	3	1
44	имеет дело вовсе не	1	1
45	а в то же	1	1
46	у нас не было	1	1
47	не имеют ничего общего	1	1
48	дело вовсе не с	1	1
49	один и тот же	3	1
50	в данном случае мы	1	1
51	не может быть и	4	1
52	то что обычно называется	1	1
53	в тех случаях когда	1	1
54	имеют ничего общего с	1	1
55	само собой разумеется что	1	1
56	можно прямо сказать что	1	1
57	в настоящее время является	1	1
58	свидетельствует о том что	1	1
59	самом же деле это	1	1
60	не прав в том	1	1
61	какой бы то ни	3	1
62	каких бы то ни	4	1
63	благодаря тому что в	1	1
64	если же мы возьмем	1	1
65	в том числе и	3	1
66	в том что он	4	1
67	ничем не отличается от	1	1
68	выступает на первый план	1	1
69	одного и того же	9	1
70	мы не будем здесь	1	1
71	ни в какой мере	1	1
72	в связи с той	1	1
73	для того чтобы не	1	1
74	неразрывно связаны между собой	1	1
75	то что не имеет	1	1
76	может быть и речи	4	1
77	ведь с точки зрения	1	1
78	к тому или иному	1	1
79	этот вопрос мы не	1	1
80	все более и более	3	1
81	связи с той или	1	1
82	является не чем иным	1	1
83	с другой стороны и	1	1
84	не сами по себе	1	1
85	не выходит за пределы	1	1
