1	дело в том что	3	4
2	не что иное как	5	3
3	бы то ни было	1	2
4	в до н э	2	2
5	не говоря уже о	1	2
6	не только в том	1	2
7	вв до н э	1	2
8	в той или иной	1	2
9	еще и потому что	1	2
10	также и то что	1	2
11	в том что он	1	2
12	не сам по себе	1	2
13	но в то же	3	2
14	с этой точки зрения	2	2
15	в одном и том	1	1
16	и в значительной мере	1	1
17	в связи с этим	1	1
18	всяком случае не есть	1	1
19	только в том что	1	1
20	если принять во внимание	1	1
21	говоря уже о том	1	1
22	и в этом смысле	1	1
23	в то же время	6	1
24	мы имеем дело с	1	1
25	не может быть никакой	1	1
26	сих пор и в	1	1
27	во всяком случае не	2	1
28	только в том чтобы	1	1
29	и тем не менее	3	1
30	уже о том что	1	1
31	одном и том же	1	1
32	заключается не только в	1	1
33	в том смысле что	1	1
34	состоит в том что	2	1
35	xix в и в	1	1
36	для того чтобы понять	3	1
37	то более то менее	1	1
38	во-вторых с точки зрения	1	1
39	приходит к выводу что	1	1
40	в том что в	1	1
41	так или иначе но	2	1
42	заключается в том чтобы	1	1
43	до сих пор и	1	1
44	той или иной идеи	1	1
45	и в конце концов	1	1
