1	в то же время	26	3
2	и в то же	7	2
3	во всех его разновидностях	1	2
4	не может и не	1	2
5	ни в чем не	2	2
6	бы то ни было	6	2
7	что бы то ни	1	1
8	по отношению к нему	2	1
9	бы то ни стало	1	1
10	это и есть та	1	1
11	в том и в	2	1
12	позиции по отношению к	1	1
13	несмотря на то что	1	1
14	выйти за их пределы	1	1
15	на себя самого как	1	1
16	с одной стороны и	1	1
17	строгом смысле этого слова	1	1
18	и быть не может	1	1
19	чего бы то ни	2	1
20	не чем иным как	1	1
21	а вовсе не как	1	1
22	на протяжении всего романа	2	1
23	если бы не было	1	1
24	в большинстве случаев они	1	1
25	и в том и	2	1
26	мы можем сказать что	2	1
27	в то время как	3	1
28	имеют все же некоторую	1	1
29	и не может быть	1	1
30	к себе самому к	1	1
31	ведь в противном случае	1	1
32	каково бы ни было	1	1
33	дело в том что	2	1
34	дело конечно не в	1	1
35	но в то же	11	1
36	на самом же деле	1	1
37	во что бы то	1	1
38	и в этом отношении	2	1
39	с самим собою и	4	1
40	в строгом смысле этого	1	1
41	никогда не может быть	1	1
42	иметь в виду что	1	1
43	до своих последних пределов	1	1
44	именно в том что	1	1
45	не в том что	1	1
46	бы они ни были	1	1
47	на самом деле и	1	1
48	точка зрения на мир	2	1
49	но в большинстве случаев	1	1
50	и в другом направлении	1	1
51	том и в другом	2	1
