1	и вместе с тем	1	4
2	у достоевского никогда не	2	2
3	ни в чем не	2	2
4	в своей записной книжке	2	2
5	никогда не может быть	1	2
6	одна и та же	2	2
7	в то время как	3	2
8	место в творчестве достоевского	1	2
9	в записках из подполья	2	2
10	ивана карамазова со смердяковым	1	1
11	в обычном смысле слова	1	1
12	но это не значит	1	1
13	ивана карамазова и др	1	1
14	в творчестве достоевского но	1	1
15	что он мог бы	1	1
16	одну и ту же	1	1
17	и по отношению к	2	1
18	в самой жизни а	1	1
19	подобно тому как в	1	1
20	к униженным и оскорбленным	1	1
21	мы имеем в виду	1	1
22	не потому что она	1	1
23	это имел в виду	1	1
24	это не значит конечно	2	1
25	и всегда у достоевского	1	1
26	не значит конечно что	2	1
27	к нему как к	1	1
28	но для этого необходимо	1	1
29	что до сих пор	1	1
30	потому что он сам	1	1
31	самой жизни а не	1	1
32	до сих пор не	1	1
33	о том что все	1	1
34	как и всегда у	1	1
35	но не может быть	1	1
36	и в братьях карамазовых	1	1
37	и в самом деле	1	1
38	и не может быть	1	1
39	кто бы он ни	2	1
40	в своем художественном творчестве	1	1
41	у достоевского нельзя найти	1	1
42	так же как и	1	1
43	для себя и для	1	1
44	по отношению к нему	2	1
45	в центре его творчества	1	1
46	в том что это	1	1
47	и к чему бы	1	1
48	она не может быть	1	1
49	потому что она не	3	1
50	становится по ту сторону	1	1
51	что они не могут	1	1
52	может быть и речи	1	1
53	легенда о великом инквизиторе	1	1
54	занимает очень важное место	1	1
55	а может быть и	1	1
56	в том что он	5	1
57	не может быть и	1	1
58	и есть то что	1	1
59	бы он ни был	5	1
60	все более и более	1	1
61	в братьях карамазовых но	1	1
62	друг к другу как	1	1
63	хотя бы и самый	1	1
