1	в то же время	6	10
2	одного и того же	2	6
3	в связи с этим	1	4
4	одно и то же	2	4
5	с одной стороны и	3	2
6	мы имеем в виду	1	2
7	не может быть и	1	2
8	в той или иной	1	2
9	дело в том что	3	2
10	может быть и речи	1	2
11	в соответствии с этим	1	2
12	но в то же	3	2
13	здесь не место для	1	1
14	целого но все же	1	1
15	наряду с этим в	1	1
16	в одном и том	1	1
17	только в том что	1	1
18	дело не только в	1	1
19	когда мы говорим о	1	1
20	в широком смысле слова	4	1
21	но вместе с тем	1	1
22	в том что в	1	1
23	и прежде всего в	1	1
24	не только в том	1	1
25	и в этом отношении	1	1
26	нечего и говорить о	1	1
27	как мы уже знаем	2	1
28	и для того чтобы	1	1
29	той или иной степени	1	1
30	все же в них	1	1
31	вообще не может быть	1	1
32	одном и том же	1	1
33	и в особенности в	1	1
34	но дело не только	1	1
35	для того чтобы быть	1	1
36	приходит к выводу что	1	1
37	имеет свои корни в	1	1
38	с этой точки зрения	2	1
