1	одной и той же	1	5
2	с одной стороны и	1	4
3	то же самое что	1	3
4	в такой же мере	1	3
5	до сих пор в	1	1
6	не только ничего не	1	1
7	и во всех деталях	1	1
8	только и могут быть	1	1
9	развития с точки зрения	1	1
10	ясно что при таком	1	1
11	не что иное как	1	1
12	к которому они относятся	1	1
13	развития в зависимости от	1	1
14	но мы знаем что	1	1
15	что это совершенно невозможно	1	1
16	есть не что иное	1	1
17	в конце развития мы	1	1
18	совершенно так же как	1	1
19	в то же время	1	1
20	то же самое в	1	1
