829	образ становящегося человека с	1	1
830	речевой акт притчевого типа	1	1
831	призван обладать проективной компетентностью	1	1
832	слухи или сплетни то	1	1
833	которым обнаруживается преодолеваемая даль	1	1
834	человека с его уникальным	1	1
835	соседствами именно это ощущение	1	1
836	не сводится к этим	1	1
837	к содержанию сказания это	1	1
838	ставят перед ним определенные	1	1
839	самоотождествление с человеком неким	1	1
840	есть не что иное	1	1
841	и в форме определенной	1	1
842	раз-влекать их предлагая адресату	1	1
843	индивидуальной жизненной практике может	1	1
844	преодолевая их внутреннюю обособленность	1	1
845	собой исторически продуктивный тип	1	1
846	существенно связаны с языком	1	1
847	ничего нельзя не сделав	1	1
848	иметь в виду что	1	1
849	жизни повествователя о ней	1	1
850	персонажи сказания не от	1	1
851	не у-влекать слушателей преодолевая	1	1
852	романного видения мира романного	1	1
853	да и персонажи сказания	1	1
854	очередь определяется предметом целью	2	1
855	посрамление словесное кощунство и	1	1
856	встречающихся в дискурсе речевой	1	1
857	от содержания сколько от	1	1
858	свободным как к содержанию	1	1
859	эта возможность иного включает	1	1
860	обычно является сюжетообразующим при	1	1
861	знакомство слушателей с содержанием	1	1
