1	одного и того же	3	6
2	в то же время	55	3
3	в одном и том	1	3
4	одном и том же	1	3
5	дело в том что	13	3
6	одной и той же	4	3
7	не в том что	1	3
8	с одной стороны и	5	2
9	в то время когда	2	2
10	не что иное как	3	2
11	но дело в том	2	2
12	все более и более	2	2
13	мы не знаем но	1	1
14	то же время не	2	1
15	с другой стороны он	1	1
16	и связанное с ним	1	1
17	в каждом из этих	1	1
18	всех времен и народов	1	1
19	подобно тому как в	1	1
20	в том случае если	1	1
21	не только в разных	1	1
22	вовлекает в свой круг	1	1
23	не имеет ничего общего	1	1
24	но и в более	2	1
25	и в том и	1	1
26	в том что все	1	1
27	один и тот же	4	1
28	для него как для	1	1
29	тем не менее он	1	1
30	переходят друг в друга	4	1
31	так например мы уже	1	1
32	во всяком случае не	1	1
33	имеет ничего общего с	1	1
34	как бы ни был	1	1
35	заключается в том что	2	1
36	и в том что	2	1
37	в том что он	1	1
38	в том что оно	1	1
39	как и во всех	2	1
40	в то время как	1	1
41	в более или менее	2	1
42	к одной и той	1	1
43	как бы ни были	1	1
44	сказать что и в	1	1
45	только после того как	1	1
46	здесь как и во	2	1
47	то что мы называем	1	1
48	удовольствия и неудовольствия и	1	1
49	и его связь с	3	1
50	и в этом отношении	1	1
51	то есть только в	1	1
52	но даже и в	2	1
53	чтобы убедиться в этом	1	1
54	и все это совершается	1	1
55	бы то ни было	2	1
