1	в то же время	26	13
2	с начала и до	2	7
3	начала и до конца	2	7
4	но в то же	11	7
5	как мы уже говорили	3	4
6	один и тот же	1	3
7	в том числе и	1	3
8	с одной стороны и	1	2
9	мы имеем в виду	1	2
10	и в то же	7	2
11	большей или меньшей степени	3	2
12	в виду прежде всего	1	2
13	имеем в виду прежде	1	2
14	до сих пор еще	1	2
15	в той или иной	5	2
16	в конце концов он	1	2
17	в большей или меньшей	3	2
18	и до сих пор	1	2
19	дело в том что	2	2
20	в обычном смысле слова	1	1
21	то же время не	6	1
22	на протяжении всего романа	2	1
23	подобно тому как в	1	1
24	все более и более	1	1
25	это не значит конечно	2	1
26	только то что может	1	1
27	не входит в нашу	1	1
28	на мир и на	2	1
29	как раз и не	1	1
30	до сих пор не	1	1
31	поэтому он и не	1	1
32	той или иной степени	2	1
33	но на самом деле	5	1
34	до сих пор остается	1	1
35	то же время оно	2	1
36	и прежде всего в	1	1
37	видения и понимания мира	3	1
38	на самом деле нет	1	1
39	до мельчайших деталей до	1	1
40	какой бы то ни	2	1
41	не видит и не	1	1
42	той или иной форме	2	1
43	остановимся прежде всего на	1	1
44	то же время он	1	1
45	такой же характер носит	1	1
46	как и все что	1	1
47	входит в нашу задачу	1	1
48	мы увидим дальше что	1	1
49	то что может быть	1	1
50	в то время как	3	1
51	и не может быть	1	1
52	или во всяком случае	1	1
53	не значит конечно что	2	1
54	на самом же деле	1	1
55	что на самом деле	1	1
56	можно было бы привести	1	1
57	во всяком случае в	1	1
58	лишь в этом случае	1	1
59	то вполне понятно что	1	1
60	бы то ни было	6	1
61	одного и того же	1	1
62	мы уже говорили что	4	1
