1	в то же время	20	4
2	с одной стороны и	5	3
3	той мере в какой	2	2
4	в той мере в	2	2
5	не в том что	2	2
6	и в то же	6	1
7	той или иной идеологической	1	1
8	дистанцию по отношению к	1	1
9	он не может быть	1	1
10	могло бы быть и	1	1
11	с той или иной	1	1
12	в том числе и	3	1
13	отнюдь не сводится к	1	1
14	он может и должен	1	1
15	один и тот же	3	1
16	в той же мере	1	1
17	состоит в том чтобы	1	1
18	во всяком случае в	3	1
19	же самое и в	1	1
20	не что иное как	1	1
21	в том смысле что	2	1
22	то же самое и	1	1
23	одного и того же	1	1
24	не могло бы возникнуть	1	1
25	в том что без	1	1
26	и в этом случае	1	1
27	одних и тех же	2	1
28	и не может быть	7	1
29	отнюдь не в том	1	1
30	к одной и той	1	1
31	с другой стороны в	1	1
32	дело в том что	1	1
33	но в то же	3	1
34	одно и то же	1	1
35	одной и той же	1	1
36	или иной идеологической сферой	1	1
37	в том или ином	2	1
38	если бы оно было	2	1
