1	в то же время	8	14
2	дело в том что	5	4
3	и в то же	2	3
4	в том числе и	3	3
5	имеет дело только с	1	1
6	между вещами и ценностями	1	1
7	с другой стороны в	1	1
8	с одной стороны и	5	1
9	а также и в	1	1
10	не может быть ни	1	1
11	в данном случае не	1	1
12	одного и того же	4	1
13	в том что в	3	1
14	в этом отношении на	1	1
15	ни в чем не	1	1
16	то же время и	2	1
17	большей или меньшей степени	1	1
18	не что иное как	1	1
19	одном и том же	1	1
20	одной и той же	2	1
21	ни о чем не	2	1
22	в той или иной	1	1
23	нет и не может	1	1
24	и не может быть	2	1
25	начала и до конца	1	1
26	в большей или меньшей	1	1
27	между жизнью и смертью	2	1
28	одно и то же	3	1
29	есть не что иное	1	1
