1	в то же время	5	12
2	но с другой стороны	1	3
3	с этой точки зрения	1	3
4	только в том что	1	2
5	не говоря уже о	1	2
6	в конечном счете вся	1	2
7	во всех этих и	2	1
8	и т п это	1	1
9	него в конечном счете	1	1
10	то же время она	1	1
11	с другой стороны он	1	1
12	не удивительно поэтому что	1	1
13	и в то же	3	1
14	мы имеем дело с	1	1
15	именно в том что	1	1
16	имеет ничего общего с	1	1
17	приводит к тому что	2	1
18	с одной стороны и	2	1
19	нет и не может	1	1
20	и не может быть	2	1
21	но в то же	1	1
22	для него в конечном	1	1
23	одно и то же	1	1
24	чего бы не было	2	1
25	не имеет ничего общего	1	1
