1	в то же время	14	12
2	но в то же	3	3
3	мы имеем в виду	1	2
4	все новые и новые	1	2
5	дело в том что	2	2
6	мы уже сказали что	1	1
7	одной стороны и с	1	1
8	не отвлеченная мысль о	1	1
9	то же что и	3	1
10	не он сам а	1	1
11	с одной стороны и	4	1
12	и с другой стороны	2	1
13	не имеет ничего общего	5	1
14	в том что они	1	1
15	мир и все его	1	1
16	то же время и	2	1
17	мы уже знаем что	2	1
18	и в том и	1	1
19	нет ничего удивительного в	1	1
20	потому что он есть	1	1
21	имеет ничего общего с	5	1
22	можно прямо сказать что	1	1
23	удивительного в том что	1	1
24	как мы уже сказали	1	1
25	не что иное как	18	1
26	ничего удивительного в том	1	1
27	и в литературе как	1	1
28	о том что в	1	1
29	и до сих пор	1	1
30	с другой стороны в	1	1
31	мы находим в этом	1	1
32	на самом же деле	3	1
33	и в этом отношении	1	1
34	и в другом случае	1	1
35	сам по себе и	2	1
36	в том и в	1	1
37	заключается в том что	1	1
38	и в чем его	1	1
39	том и в другом	1	1
40	есть не что иное	11	1
