420	параметрам сродни любому иному	1	1
421	без благоговейного приятия и	1	1
422	притчи может быть определена	1	1
423	ни прибавить ни убавить	2	1
424	к другому что касается	1	1
425	ни притча не знают	1	1
426	содержания сколько от мастерства	1	1
427	дает позвоночника роману человек	1	1
428	жизненный опыт запечатлеваемый и	1	1
429	оговорка где слово деритуализовано	1	1
430	к содержанию анекдота ни	1	1
431	заключается в том что	1	1
432	и возможность иного языка	1	1
433	бы в точке этого	1	1
434	позицию по отношению к	1	1
435	составляет необходимый фон романного	1	1
436	по своим коммуникативным параметрам	1	1
437	чужому слову чего не	1	1
438	выбора осуществляется или преступается	1	1
439	биографического слова не сводится	1	1
440	компетентность восприятия со стороны	1	1
441	и прежде всего к	1	1
442	всем потому что из	1	1
443	в известном смысле домонологично	1	1
444	продуктивный тип высказывания реализующий	1	1
445	иерархично оно не предполагает	1	1
446	ценностно-смысловой картины мира с	1	1
447	персонажем в акте выбора	1	1
448	формы скрытой полускрытой рассеянной	1	1
449	изменить ничего нельзя не	1	1
450	типу актанту не может	1	1
451	форме индивидуального речевого замысла	1	1
452	носителей различного жизненного опыта	1	1
453	стремится к однозначности и	1	1
454	сочинение литературного произведения по	1	1
455	противоположность характеру типу актанту	1	1
456	романного образа и романного	1	1
457	иной интонации и оценки	1	1
458	читатель может и не	1	1
459	жанр в свою очередь	1	1
460	может и должен занять	1	1
461	дистанции между ними здесь	1	1
462	ни анекдот ни притча	1	1
463	таком случае его вступление	1	1
464	при этом остается регламентированной	1	1
465	есть нарушение запрета есть	1	1
466	механизмом активизации воспринимающего сознания	1	1
467	субъекты смыслополагания между которыми	1	1
468	диалогизированного слова прямой речи	1	1
469	ситуации произнесения сказания субъект	1	1
470	первое может быть проделано	1	1
471	или субъектом инициативного самообнаружения	1	1
472	обладать собственным смыслом ни	1	1
473	это ощущение составляет необходимый	1	1
474	предстают перед нами не	1	1
475	ни изменить ничего нельзя	1	1
476	преступается не предначертанность судьбы	1	1
477	от героя окажется неадекватным	1	1
478	или сплетни то есть	1	1
479	кощунство и непристойность необыкновенное	1	1
480	себе самому тогда как	1	1
481	не что иное как	1	1
482	нами не как объекты	1	1
483	но в отличие от	1	1
484	для притчи иносказательность является	1	1
485	нормативное приложение запечатленного в	1	1
486	коммуникативного события суть равнодостойные	1	1
487	не может обладать собственным	1	1
488	которую может и должен	1	1
489	по тем или иным	1	1
490	это известного рода взаимная	1	1
491	от нудительной серьезности бахтин	1	1
492	приобщения к общенародной хвале	1	1
493	необыкновенное в новелле есть	1	1
494	реализуют в нем определенные	1	1
495	одном и том же	1	1
496	характерное для восприятия сказания	1	1
497	становящегося человека с его	1	1
498	предносится целое нашего высказывания	1	1
499	например в значительной степени	1	1
500	может и не занять	1	1
501	персонажа то она здесь	1	1
502	слушателей с содержанием анекдота	1	1
503	где образ становящегося человека	1	1
504	рассказывания а не ценностно	1	1
505	включая разные формы скрытой	1	1
506	существованию вследствие которого он	1	1
507	той или иной мере	1	1
508	биография возможна только в	1	1
509	слушателей преодолевая их внутреннюю	1	1
510	полноценная биография возможна только	1	1
511	внутренняя активность адресата при	1	1
512	и слушающих общим знанием	1	1
513	касается ментальной и речевой	1	1
514	императивной нормы ни в	1	1
515	не удовлетворяясь репродуктивной рецепцией	1	1
516	самобытно но и характерное	1	1
517	должен занять любой индивид	1	1
518	далеко не сводятся к	1	1
519	и проистекающим из нее	1	1
520	дифференцированном и оцененном мире	2	1
521	не быть субъектом ролевого	1	1
522	или субъектом этического выбора	1	1
523	иной конкретной ценностно-смысловой картины	1	1
524	романного слова эта возможность	1	1
525	принадлежат самой ситуации рассказывания	1	1
526	это позиция активного приятия	1	1
527	а не ценностно дистанцированной	1	1
528	адресата от героя окажется	1	1
529	столько от содержания сколько	1	1
530	сказания не от своея	1	1
531	представляет собой позицию которую	1	1
532	связаны с языком ставят	1	1
533	анекдот легко может быть	1	1
534	жизнь личности совершается как	1	1
535	того требует авторитетное слово	1	1
536	даже будучи порой фактически	1	1
537	повествователя о ней установка	1	1
538	живого голоса зримого жеста	1	1
539	можно припоминая и примеряя	1	1
540	слова эта возможность иного	1	1
541	жизни постоянно переходит к	1	1
542	адресата притчи может быть	1	1
543	романного дискурса призван обладать	1	1
544	предметом целью и ситуацией	3	1
545	стабильно дифференцированном и оцененном	2	1
546	которыми устанавливаются отношения ценностно-смысловой	1	1
547	в себя и возможность	1	1
548	позиции в мире это	1	1
549	л.с выготским и н.и	2	1
550	ценностной дистанции между ними	1	1
551	сторону индивида и его	1	1
552	точными они бытуют как	1	1
553	героя окажется неадекватным субъект	1	1
554	в точке выхода его	1	1
555	правило лишь в стилевых	1	1
556	неким ибо предметно-тематическое содержание	1	1
557	в первую очередь по	1	1
558	возможна только в вероятностном	1	1
559	с совершенно иными границами	1	1
560	за ним всегда преодолеваемая	1	1
561	отрешиться от нудительной серьезности	1	1
562	значительной степени зависим от	1	1
563	хоровое слово общенародной хвалы	1	1
564	установка не на раскрытие	1	1
565	любой индивид чтобы быть	1	1
566	невозможно притчевое нормативное самоотождествление	1	1
567	содержанию сказания это позиция	1	1
568	ощущаться завершенная и строго	1	1
569	судьбы а некий нравственный	1	1
570	возможность иного языка и	1	1
571	чего бы то ни	1	1
572	этом и сам текст	1	1
573	принципиальная для притчи иносказательность	1	1
574	самому герою жизнеописания чего	1	1
575	стороны адресата притчи может	1	1
576	сродни любому иному роду	1	1
577	сводится к этим моментам	1	1
578	слушающих общим знанием поэтому	1	1
579	героя как ценностного центра	1	1
580	приложение запечатленного в притче	1	1
581	анекдоте подготовившем почву для	1	1
582	жизнь глазами анекдота это	1	1
583	не выбирают а по	2	1
584	с ее иносказательностью требует	1	1
585	нам всегда предносится целое	1	1
586	как того требует авторитетное	1	1
587	в мире императивной нормы	1	1
588	своей судьбы они едины	1	1
589	выбор лексики например в	1	1
590	для восприятия сказания или	1	1
591	в нем звучит один	2	1
592	и персонажи сказания не	1	1
593	ответную реакцию предварительное знакомство	1	1
594	лишь в стилевых формах	1	1
595	в свою очередь определяется	2	1
596	с человеком неким ибо	1	1
597	типа есть монолог в	1	1
598	неуместность ошибка оговорка где	1	1
599	под сводами чужой психики	1	1
600	всегда предносится целое нашего	1	1
601	в том и состоит	1	1
602	с самим собою в	1	1
603	равнодостойности сознаний встречающихся в	1	1
604	участников коммуникативного события на	1	1
605	обладает достоверным но не	1	1
606	лексики например в значительной	1	1
607	ни в мире императивной	1	1
608	нем звучит один голос	2	1
609	то же время они	1	1
610	поведение двух сыновей в	1	1
611	опытом выводится в просторную	1	1
612	закономерно приводит к интонации	1	1
613	индивида и его поступки	1	1
614	перед ним определенные задания	1	1
615	двуголосого слова манифестирующего двоякий	1	1
616	в той или иной	1	1
617	примеряя ее содержание к	1	1
618	целью и ситуацией высказывания	3	1
619	анекдот ни притча не	1	1
620	рассеянной чужой речи и	1	1
621	свою жизненную позицию опираясь	1	1
622	мира которая своей карнавальной	1	1
623	устремленный от одного сознания	1	1
624	легко может быть редуцирован	1	1
625	причастности к общему миропорядку	1	1
626	однако в отличие от	1	1
627	она здесь присутствует как	1	1
628	произведения по своим коммуникативным	1	1
629	мира вокруг я героя	1	1
630	сказания это позиция активного	1	1
631	всего к ценностной однозначности	1	1
632	мира с совершенно иными	1	1
633	однако диалогизм биографического слова	1	1
634	позицию опираясь на индивидуальный	1	1
635	наизнанку глупость неуместность ошибка	1	1
636	чего анекдот не знает	1	1
637	острота или острота наизнанку	1	1
638	экзистенциальный опыт присутствия в	1	1
639	анекдота выбор лексики например	1	1
640	убавить ни изменить ничего	1	1
641	предел до которого анекдот	1	1
642	слову чего не требует	1	1
643	собственным смыслом ни в	1	1
644	понимание излагаемой жизни как	1	1
645	жеста и как бы	1	1
646	притчи иносказательность является своего	1	1
647	он от позиции учителя	1	1
648	к чужому слову чего	1	1
649	мы имеем дело не	2	1
650	первую очередь по отношению	1	1
651	собственно и составляющий морализаторскую	1	1
652	индивид чтобы быть субъектом	1	1
653	здесь невозможно притчевое нормативное	1	1
654	было и не могло	1	1
655	смысле домонологично оно объединяет	1	1
656	до которого анекдот легко	1	1
657	излагаемой жизни как исполненной	1	1
658	человеком неким ибо предметно-тематическое	1	1
659	двоякий жизненный опыт запечатлеваемый	1	1
660	иносказательность является своего рода	1	1
661	составляющий морализаторскую премудрость притчевого	1	1
662	в новелле есть нарушение	1	1
663	была впервые освоена в	1	1
664	осуществляется или преступается не	1	1
665	непристойность необыкновенное в новелле	1	1
666	анекдотическому дискурсу речевая маска	1	1
667	границами между вещами и	1	1
668	дай мне бог сойти	1	1
669	субъект объект и адресат	1	1
670	ни убавить ни изменить	1	1
671	с читателем к иллюзии	1	1
672	когда ни прибавить ни	1	1
673	развития самоопределяющегося субъекта жизни	1	1
674	рода взаимная условленность конвенциональность	1	1
675	может быть осуществлено только	1	1
676	монолог в чистом виде	1	1
677	практике может быть осуществлено	1	1
678	есть принадлежат самой ситуации	1	1
679	приводит к интонации доверительной	1	1
680	уникальным жизненным опытом выводится	1	1
681	ее содержание к собственной	1	1
682	уметь проецировать чужой экзистенциальный	1	1
683	чужой речи и т.п	2	1
684	полускрытой рассеянной чужой речи	1	1
685	проектировать свою жизненную позицию	1	1
686	фактический слушатель читатель может	1	1
687	есть монолог в чистом	1	1
688	за блужданиями его под	1	1
689	на поучающего и поучаемого	1	1
690	реакцию предварительное знакомство слушателей	1	1
691	занять уготованной ему позиции	1	1
692	масштабов и соотношений такая	1	1
693	в притче универсального опыта	1	1
694	окажется неадекватным субъект объект	1	1
695	обнаруживается преодолеваемая даль и	1	1
696	и составляющий морализаторскую премудрость	1	1
697	в нем определенные возможности	1	1
698	внеличную сторону индивида и	1	1
699	точке этого несовпадения человека	1	1
700	из нас самих состоят	1	1
701	и не быть субъектом	1	1
702	в другом и другого	1	1
703	слова прямой речи именно	1	1
704	культуры в самом общем	1	1
705	объект и адресат протороманного	1	1
706	анекдот должен не у-влекать	1	1
707	непреложный и неоспоримый круговорот	1	1
708	нас самих состоят все	1	1
709	различного жизненного опыта их	1	1
710	сказания или анекдота ценностное	1	1
711	быть проделано и рассказывающим	1	1
712	может ощущаться завершенная и	1	1
713	предметно-тематическое содержание жизнеописания вполне	1	1
714	готовом стабильно дифференцированном и	2	1
715	притча разъединяет участников коммуникативного	1	1
716	предначертанность судьбы а некий	1	1
717	собой позицию которую может	1	1
718	и адресат протороманного коммуникативного	1	1
719	я помню чудное мгновенье	1	1
720	и как бы непосредственного	1	1
721	не дает позвоночника роману	1	1
722	опыт запечатлеваемый и запечатлевающий	1	1
723	известного рода взаимная условленность	1	1
724	жанра высказывания жанр в	1	1
725	совершенно иной конкретной ценностно-смысловой	1	1
726	дело в том что	5	1
727	сказании или притче была	1	1
728	доверительной и раскованной беседы	1	1
729	от божья повеленья сказание	1	1
730	а по своей природе	2	1
731	языка и возможность иной	1	1
732	заинтересовывать судьбой отдельных лиц	1	1
733	притче универсального опыта к	1	1
734	разъединяет участников коммуникативного события	1	1
735	характеру типу актанту не	1	1
736	нечто смешное но обязательно	1	1
737	любопытство к реальному человеческому	1	1
738	и ценностями иными соседствами	1	1
739	доверия к чужому слову	1	1
740	равнодостойные субъекты смыслополагания между	1	1
741	фатально непреложный и неоспоримый	1	1
742	должен не у-влекать слушателей	1	1
743	приятия не удовлетворяясь репродуктивной	1	1
744	всегда преодолеваемая даль и	1	1
745	к позиции изобразителя жизни	1	1
746	потому что из нас	1	1
747	личности совершается как бы	1	1
748	самой ситуации рассказывания а	1	1
749	анекдота ни столь пассивным	1	1
750	и потому нейтральное к	1	1
751	то она здесь присутствует	1	1
752	ни для рассказчика ни	1	1
753	герою жизнеописания чего анекдот	1	1
754	дискурса призван обладать проективной	1	1
755	высказывания жанр в свою	1	1
756	может быть определена как	5	1
757	проделано и рассказывающим притчу	1	1
758	есть биография и не	1	1
759	схемы и в форме	1	1
760	ситуации рассказывания а не	1	1
761	конкретной ценностно-смысловой картины мира	1	1
762	мишеля фуко представляет собой	1	1
763	согласия за которым обнаруживается	1	1
764	произведение искусства не сводится	1	1
765	является своего рода механизмом	1	1
766	в их отношении к	1	1
767	позиции учителя жизни постоянно	1	1
768	позиции изобразителя жизни повествователя	1	1
769	опыта к индивидуальной жизненной	1	1
770	от своей судьбы они	1	1
771	возможность иной интонации и	1	1
772	но как субъекты этического	1	1
773	языком ставят перед ним	1	1
774	жанровой схемы и в	1	1
775	анекдота не столько от	1	1
776	в форме индивидуального речевого	1	1
777	очередь по отношению к	1	1
778	притче о блудном сыне	1	1
779	мире случайности полноценная биография	1	1
780	живое непредубежденное любопытство к	1	1
781	называемого чувства юмора умения	1	1
782	поучающего и поучаемого это	1	1
783	индивидуальный опыт чужой жизненной	1	1
784	божья повеленья сказание в	1	1
785	именно это ощущение составляет	1	1
786	от одного сознания к	1	1
787	умения отрешиться от нудительной	1	1
788	порой фактически точными они	1	1
789	мира романного образа и	1	1
790	актанту не может обладать	1	1
791	активность адресата при этом	1	1
792	судьбы они едины судьба	1	1
793	интонации и оценки и	1	1
794	чистом виде целенаправленно устремленный	1	1
795	в себе ему надлежит	1	1
796	анекдота это игра случая	1	1
797	как к содержанию анекдота	1	1
798	как регулятивная отношение слушателя	1	1
799	человеческому существованию вследствие которого	1	1
800	перед нами не как	1	1
801	родственным анекдотическому дискурсу речевая	1	1
802	слова не сводится к	1	1
803	сам текст анекдота выбор	1	1
804	этого несовпадения человека с	1	1
805	субъекта объекта и адресата	2	1
806	здесь обычно является сюжетообразующим	1	1
807	которые лежат в основе	1	1
808	содержание жизнеописания вполне самобытно	1	1
809	его под сводами чужой	1	1
810	в том или ином	1	1
811	и соотношений такая возможность	1	1
812	присутствия в мире на	1	1
813	автора с читателем к	1	1
814	к самому герою жизнеописания	1	1
815	быть субъектом ролевого действия	1	1
816	подлинная жизнь личности совершается	1	1
817	позиция активного приятия не	1	1
818	определена как регулятивная отношение	1	1
819	отношение к своему герою	1	1
820	адресатом некоего ценностного урока	1	1
821	рекоша но от божья	1	1
822	грани между индивидуальными жизнями	1	1
823	новелле есть нарушение запрета	1	1
824	сводится к служебной роли	1	1
825	неприемлемо ни для рассказчика	1	1
826	не предначертанность судьбы а	1	1
827	к своему герою определяемое	1	1
828	подготовившем почву для жизнеописания	1	1
