1	в то же время	2	8
2	одно и то же	1	7
3	одной и той же	1	4
4	не в том что	1	4
5	вместе с тем и	1	3
6	в то время как	1	3
7	в том что как	1	2
8	в том что он	1	2
9	одного и того же	3	2
10	в том что оно	1	2
11	в настоящее время мы	1	1
12	что же касается до	2	1
13	как мы видели выше	1	1
14	состоит в том что	1	1
15	тем не менее в	1	1
16	не может быть сомнения	1	1
17	не говоря уже о	1	1
18	а в том что	1	1
19	но вместе с тем	2	1
20	в том случае если	4	1
21	вытекают из самой сущности	1	1
22	то это потому что	1	1
23	а между тем в	1	1
24	только в том случае	1	1
25	лишь в том что	3	1
26	именно в том что	1	1
27	заключается в том что	3	1
28	до сих пор еще	1	1
29	в том виде в	1	1
30	том случае если бы	1	1
31	в этом случае мы	1	1
32	в том что только	1	1
33	выше мы видели что	1	1
34	и не может быть	1	1
35	нет и не может	1	1
36	на самом деле есть	1	1
37	дело в том что	1	1
38	а может быть и	1	1
39	а для того чтобы	1	1
40	не заключающие в себе	1	1
41	бы то ни было	3	1
