1	так как если бы	1	4
2	дело в том что	3	4
3	бы то ни было	1	3
4	с одной стороны и	3	2
5	не может быть и	1	2
6	одно и то же	2	2
7	в зависимости от того	1	1
8	и в этом смысле	1	1
9	какой бы то ни	1	1
10	с другой стороны как	1	1
11	сама по себе не	1	1
12	в том что в	1	1
13	то ни было области	1	1
14	в науке о литературе	1	1
15	это только одна сторона	1	1
16	но в то же	3	1
17	мы имеем дело с	1	1
18	в то же время	6	1
19	в ее отношении к	1	1
20	как если бы оно	1	1
21	в руках у нас	1	1
22	мы имеем в виду	1	1
23	прежде всего именно в	1	1
