1	в то же время	6	7
2	состоит в том что	2	4
3	мы имеем в виду	1	3
4	одно и то же	2	3
5	одного и того же	2	3
6	с этой точки зрения	2	2
7	и в самом деле	3	2
8	в том что он	1	2
9	в той или иной	1	2
10	бы то ни было	1	2
11	в одном и том	1	1
12	в связи с этим	1	1
13	с одной стороны и	3	1
14	в этом втором случае	1	1
15	той мере в какой	6	1
16	точно так же как	1	1
17	еще и потому что	1	1
18	в той мере в	6	1
19	мы имеем дело с	1	1
20	специфическом значении этого термина	1	1
21	заключается в том что	2	1
22	тем не менее не	1	1
23	какой бы то ни	1	1
24	то что входит в	1	1
25	не что иное как	5	1
26	в том отношении что	3	1
27	одном и том же	1	1
28	мере в какой их	1	1
29	по отношению к нему	1	1
30	но в то же	3	1
31	не может быть и	1	1
32	и в том отношении	2	1
33	в том или ином	2	1
34	есть не что иное	3	1
35	по тем или иным	2	1
