1	в то время как	13	6
2	в то же время	1	5
3	не говоря уже о	1	4
4	в том что он	2	4
5	бы то ни было	3	4
6	между небом и землей	2	2
7	в связи с этим	1	1
8	с другой стороны он	2	1
9	ясно во всяком случае	1	1
10	а в другом случае	1	1
11	от начала до конца	1	1
12	что у него в	1	1
13	в том что они	3	1
14	состоял в том что	2	1
15	и целые страны в	1	1
16	состоит в том что	4	1
17	и в том числе	1	1
18	мы имеем дело с	1	1
19	в том что в	1	1
20	мы и здесь найдем	1	1
21	до сих пор не	3	1
22	как мы уже знаем	1	1
23	во всяком случае в	1	1
24	как бы то ни	1	1
25	так и более поздние	1	1
26	тем не менее это	1	1
27	не что иное как	11	1
28	одна и та же	1	1
29	и каждый из них	1	1
30	так же как и	9	1
31	одна из них не	1	1
32	в том числе и	2	1
33	в тех случаях когда	10	1
34	остается предположить что они	1	1
35	только в связи с	3	1
36	а может быть даже	1	1
37	о которых идет речь	1	1
38	и здесь нет необходимости	3	1
39	с другой стороны в	2	1
40	в соответствии с этим	2	1
41	и т д все	6	1
42	с этой точки зрения	6	1
43	населения и прежде всего	1	1
44	о чем говорилось выше	1	1
45	мы ничего не знаем	1	1
