1	в то же время	13	13
2	в той же книге	1	3
3	один и тот же	4	3
4	в том числе и	1	3
5	с одной стороны и	3	2
6	дело вовсе не в	1	2
7	как мы уже сказали	1	2
8	до сих пор еще	1	2
9	в большей или меньшей	1	2
10	и до сих пор	2	2
11	переходят друг в друга	1	2
12	дело в том что	4	2
13	одной и той же	7	2
14	если она и есть	1	1
15	не подлежит сомнению что	1	1
16	и его связь с	2	1
17	то же время не	1	1
18	с другой стороны он	1	1
19	что мы уже не	1	1
20	подобно тому как в	1	1
21	в том случае если	2	1
22	все более и более	4	1
23	не только в разных	1	1
24	одним и тем же	4	1
25	но и в более	1	1
26	до сих пор не	1	1
27	для него как для	1	1
28	но на самом деле	1	1
29	и тот же образ	1	1
30	не что иное как	4	1
31	то есть то что	2	1
32	что в то же	1	1
33	нет и не может	1	1
34	в то время как	4	1
35	и не может быть	1	1
36	но что в то	1	1
37	есть не что иное	1	1
38	но даже и в	1	1
39	бы то ни было	2	1
40	одного и того же	9	1
