1	в то время как	8	4
2	дело в том что	2	4
3	ни в какой мере	1	3
4	в какой мере не	1	3
5	а с другой стороны	1	3
6	не чем иным как	1	3
7	по крайней мере в	6	3
8	ни в коем случае	6	3
9	не что иное как	18	3
10	и вместе с тем	1	2
11	это не имеет ничего	1	2
12	бы то ни было	1	2
13	и о том что	1	2
14	не говоря уже о	7	2
15	ни в чем не	2	2
16	тем не менее в	2	2
17	не имеет ничего общего	5	2
18	сам по себе а	1	2
19	в том что он	1	2
20	интереснее всего то что	1	2
21	уж во всяком случае	1	2
22	но в то же	3	2
23	с этой точки зрения	4	2
24	в том смысле как	1	1
25	здесь в связи с	1	1
26	что бы то ни	2	1
27	ничего общего не имеет	1	1
28	общего не имеет с	1	1
29	несмотря на то что	3	1
30	в связи с этим	4	1
31	несмотря ни на какие	1	1
32	это не значит что	4	1
33	если принять во внимание	2	1
34	ни в каком смысле	6	1
35	различить и противопоставить все	1	1
36	вопрос о том как	1	1
37	бы то ни стало	2	1
38	в конце концов не	1	1
39	это значит что мы	5	1
40	говоря уже о том	2	1
41	по крайней мере три	1	1
42	то это значит что	5	1
43	только они и являются	1	1
44	уже по одному этому	1	1
45	познания добра и зла	1	1
46	с точки зрения истории	1	1
47	и в этом смысле	4	1
48	а мы как раз	1	1
49	в то же время	14	1
50	и у меня в	1	1
51	случае не есть ни	1	1
52	что в данном случае	1	1
53	имеется в виду не	1	1
54	это нисколько не мешает	1	1
55	помощи того или иного	1	1
56	кого бы то ни	1	1
57	заключается не в том	1	1
58	только и состоит из	1	1
59	имеет ничего общего с	5	1
60	на очень высокой ноте	1	1
61	только в том чтобы	1	1
62	в каком смысле не	3	1
63	уже по одному тому	3	1
64	по одному тому что	4	1
65	также и учение о	1	1
66	и тем не менее	5	1
67	и то и другое	4	1
68	уже о том что	2	1
69	в коем случае не	6	1
70	в том смысле что	4	1
71	и уж тем более	1	1
72	мифа в то время	1	1
73	при помощи того или	1	1
74	мы должны сказать что	1	1
75	не потому что они	1	1
76	но о том что	2	1
77	здесь нет никакой возможности	1	1
78	или по крайней мере	8	1
79	но в конце концов	1	1
80	что на самом деле	1	1
81	во что бы то	2	1
82	но даже и просто	1	1
83	и до сих пор	1	1
84	не выдерживает никакой критики	1	1
85	на всех этих примерах	1	1
86	оно во всяком случае	1	1
87	не зная что такое	2	1
88	несмотря на всю ее	2	1
89	в том что в	1	1
90	и как будто бы	1	1
91	в такой же мере	1	1
92	и с точки зрения	1	1
93	все более и более	1	1
94	мы как раз и	1	1
95	но тем не менее	1	1
96	в жизни и в	1	1
97	но так или иначе	1	1
98	то время как в	1	1
