1257	которое выдержит двойное испытание	1	1
1258	превратить внешний мир в	1	1
1259	с любым процессом и	1	1
1260	объективного физиологического анализа травмы	1	1
1261	законы образования этих символов	1	1
1262	всей жизни человека совершается	1	1
1263	рождения является по ранку	1	1
1264	ни фрейдисты никогда не	1	1
1265	бессознательного т.е и она	1	1
1266	брать его в постель	1	1
1267	точки зрения каждого из	1	1
1268	и связанных с ними	2	1
1269	приобщить женщину к сексуальному	1	1
1270	редко желает чего-нибудь меньше	1	1
1271	явлений на волю желания	1	1
1272	только то душевное образование	1	1
1273	latente traumgedanken боящиеся света	1	1
1274	значение имеют эти замещающие	1	1
1275	эстетическим явлениям шутки и	1	1
1276	землю мать-земля сидячее положение	1	1
1277	громадный запас чувств и	1	1
1278	понимание смерти как возврата	1	1
1279	первого и самого тяжелого	1	1
1280	облачившись в форму остроты	1	1
1281	ребенку именно нормальный половой	1	1
1282	маскирует свою тенденцию делает	1	1
1283	борьбы сил внутри организма	1	1
1284	во время психоаналитических сеансов	1	1
1285	образования замещающих представлений тот	1	1
1286	атлет свободно играющий во	1	1
1287	мобилизована сила сопротивления компромиссные	1	1
1288	имеют какое-либо отношение к	1	1
1289	находит исследователь и подвергает	1	1
1290	большой палец руки или	1	1
1291	суррогатом рая наиболее полной	1	1
1292	в науке фрейд и	1	1
1293	отношение к современной им	1	1
1294	инфантильным влечениям сексуальным или	1	1
1295	освободить свое libido от	1	1
1296	внутренние раздражения имеют соматический	1	1
1297	современной ему субъективной психологии	1	1
1298	переводе на язык сознания	1	1
1299	переносится бессознательное отношение к	1	1
1300	физиологическую теорию их его	1	1
1301	чистому принципу наслаждения если	1	1
1302	и техника символичны мы	1	1
1303	мир для них почти	1	1
1304	друга в более позднее	1	1
1305	одной стороны сохранить какую-нибудь	1	1
1306	к этим скрытым мыслям	1	1
1307	установлению государству браку на	1	1
1308	чувство эмоции аффекты и	1	1
1309	совершается механически без всякого	1	1
1310	психология как наука о	1	1
1311	мифах и сагах характеристики	1	1
1312	выполнил в ранний инфантильный	1	1
1313	тетенса и благодаря канту	1	1
1314	пробиться в сознание потому-то	1	1
1315	творчества философские социальные и	1	1
1316	часто инфантильно-эротического образы явного	1	1
1317	важный момент в психоаналитической	1	1
1318	привилегией для накопления громадного	1	1
1319	ассоциативными нитями с другими	1	1
1320	недостаток фрейдизма психоаналитическая школа	1	1
1321	взрослой жизни заимствуют свою	1	1
1322	являются только одною из	1	1
1323	зародыша только греческий человек	1	1
1324	серьезности жизни и дать	1	1
1325	психические представительства этих внутренних	1	1
1326	всей жизни человека культура	1	1
1327	и невозможного полезного и	1	1
1328	человека в мир травматично	1	1
1329	прикрепляется к врачу полутемный	1	1
1330	принять вполне легальную корректную	1	1
1331	совершенно готовом очищенном виде	1	1
1332	и мобилизована сила сопротивления	1	1
1333	все эти компромиссные образования	1	1
1334	его отношение к интроспективному	1	1
1335	ничего общего не может	1	1
1336	культура и культурный рост	1	1
1337	может быть это отличие	1	1
1338	ее возможного влияния на	1	1
1339	бессознательное и этим очищать	1	1
1340	совершили коренную реформу старой	1	1
1341	давая себе даже труда	1	1
1342	влечения они являются только	1	1
1343	рая охраняет суровый страж	1	1
1344	единство с ее объектом	1	1
1345	не может быть даже	1	1
1346	желания которые на следующих	1	1
1347	реальности и культуры было	1	1
1348	законы которые созидают формальную	1	1
1349	сознания сознание получает себя	1	1
1350	под давлением принципа реальности	1	1
1351	сна это содержание оказывается	1	1
1352	полную свободу своей психике	1	1
1353	психический отбор и только	1	1
1354	его ученики цитируют только	1	1
1355	на самом деле фрейдизм	1	1
1356	по-видимому в этом убеждены	1	1
1357	с инцестуозными влечениями и	1	1
1358	ни в коем случае	1	1
1359	с ними представлений и	1	1
1360	фрейдизм догматически усвоил старое	1	1
1361	продолжается на протяжении всей	1	1
1362	ко всякому другому человеку	1	1
1363	к вытесненному влечению законы	1	1
1364	первые судороги рождающегося организма	1	1
1365	становится ясным какой громадный	1	1
1366	это отличие психоанализа от	1	1
1367	ними успешно конкурируют другие	1	1
1368	и влияний наконец сновидения	1	1
1369	живем в мире символов	1	1
1370	детском страхе в неврозах	1	1
1371	которую фрейд образно называет	1	1
1372	позднее время начали цитировать	1	1
1373	для подавленных энергий бессознательного	1	1
1374	биологическое состояние организма во	1	1
1375	все снова и снова	2	1
1376	ни разу не сделал	1	1
1377	раздеты мы укутываемся одеялом	1	1
1378	этом легко убедиться надо	1	1
1379	этих способностей какие были	1	1
1380	служит в конечном счете	1	1
1381	что такое пещера в	1	1
1382	представлением а с другой	1	1
1383	греческий способ сжигать трупы	1	1
1384	влияния на последующую жизнь	1	1
1385	черты своего происхождения из	1	1
1386	формальную структуру образов сна	1	1
1387	не может быть ничего	1	1
1388	быть самостоятельным обходиться без	1	1
1389	забивался первобытный человек? что	1	1
1390	прочными ассоциативными нитями с	1	1
1391	накопившихся в глубине ее	1	1
1392	в него что такое	1	1
1393	науки о психическом к	1	1
1394	первую эрекцию ребенок тянется	1	1
1395	фрейдисты полагают что они	1	1
1396	ребенка органически влечет к	1	1
1397	и процессам их удовлетворения	1	1
1398	учение фрейда об эрогенных	1	1
1399	только греческий человек пластики	1	1
1400	ученого мира замкнулась в	1	1
1401	бессознательное понимание смерти как	1	1
1402	цитируют только себя и	1	1
1403	себя обмануть его сектантской	1	1
1404	ко всякому закону установлению	1	1
1405	исследование фрейда посвящено сновидениям	1	1
1406	стороны сохранить какую-нибудь хотя	1	1
1407	двусмысленности перенесения значения из	1	1
1408	половые органы еще не	1	1
1409	начала повернулся спиной к	1	1
1410	все это выдает бессознательное	1	1
1411	освободить от серьезности жизни	1	1
1412	от остальной психологии действительно	1	1
1413	сознания хорошая шутка нуждается	1	1
1414	случае имеют какое-либо отношение	1	1
1415	хочет приобщить женщину к	1	1
1416	выдает бессознательное понимание смерти	1	1
1417	сектантской но в общем	1	1
1418	всем этим процессам сексуальную	1	1
1419	женщину к сексуальному возбуждению	1	1
1420	и с наличным во	1	1
1421	частичное освобождение от реальности	1	1
1422	представления мысли притом он	1	1
1423	из непристойности как ее	1	1
1424	в дальнейшей жизни человек	1	1
1425	под прикрытием художественной формы	1	1
1426	враждебность ко всякому другому	1	1
1427	раздражений фрейд называет влечениями	1	1
1428	это часто делает невозможным	1	1
1429	счетов и для размежевания?	1	1
1430	концепцию психического всей остальной	1	1
1431	коренную реформу старой психологии	1	1
1432	отношения ребенка к матери	2	1
1433	культура и техника символичны	1	1
1434	наконец связанные с погребением	1	1
1435	замыкается от всех внешних	1	1
1436	его многообразных проявлениях наконец	1	1
1437	фрейд и фрейдисты полагают	1	1
1438	полезного и вредного дозволенного	1	1
1439	к интерпретирующему истолковывающему анализу	1	1
1440	желания стремления чувство эмоции	1	1
1441	в мир но наилучшим	1	1
1442	придавая всем этим процессам	1	1
1443	общего языка который необходим	1	1
1444	эрекцию ребенок тянется в	1	1
1445	участия сознания сознание получает	1	1
1446	соблазна называние непристойных предметов	1	1
1447	потрясение равным которому будет	1	1
1448	ранний инфантильный период жизни	1	1
1449	он был предоставлен чистому	1	1
1450	путем компромисса и искажения	1	1
1451	потрясение смерти ужас и	1	1
1452	рай с его все	1	1
1453	закону установлению государству браку	1	1
1454	этой травмы есть и	1	1
1455	эстетическая замена что такое	1	1
1456	такой работе мы сейчас	1	1
1457	только друг на друга	1	1
1458	наконец враждебность ко всякому	1	1
1459	или во всяком случае	1	1
1460	в сознание или только	1	1
1461	любовь к матери нарочито	1	1
1462	древнейшие формы погребения зарывание	1	1
1463	сидячими телами недвусмысленно выдают	1	1
1464	показатель достигнутого в этой	1	1
1465	для вытесненных влечений позволяют	1	1
1466	между ними уже не	1	1
1467	знает различия действительного и	1	1
1468	чем-то поверхностным головным не	1	1
1469	есть частичное повторение внутриутробного	1	1
1470	полутемный кабинет в освещенной	1	1
1471	желаний и связанных с	2	1
1472	ее приемлемее для культурного	1	1
1473	с точки зрения психической	1	1
1474	страх инцеста сделавший для	1	1
1475	сам фрейд применил метод	1	1
1476	сектантские навыки работы и	1	1
1477	обратим внимание на работу	1	1
1478	в этом легко убедиться	1	1
1479	проходящие через сознание свободные	1	1
1480	и ницше весь остальной	1	1
1481	старое идущее от тетенса	1	1
1482	можно подразделить на две	1	1
1483	разу не сделал серьезной	1	1
1484	мы критикуем приходящие нам	1	1
1485	вырастает из тех же	1	1
1486	так как примат гениталий	1	1
1487	уже войдя в сознание	1	1
1488	ставшее общепринятым разделение душевных	1	1
1489	образований приток которых продолжается	1	1
1490	дифференциацию в самом деле	1	1
1491	и мышления не совсем	1	1
1492	этих влечениях маленького эдипа	1	1
1493	в смеющемся союзника и	1	1
1494	и аффектов с их	1	1
1495	но libido все снова	1	1
1496	из безразличных впечатлений ближайшего	1	1
1497	к матери нарочито духовной	1	1
1498	были в ходу в	1	1
1499	всякому другому человеку инфантильное	1	1
1500	повернулся спиной к физиологии	1	1
1501	рождаются такие представления чувства	1	1
1502	знает различения возможного и	1	1
1503	так ли это? увы	1	1
1504	на женщину на ее	1	1
1505	мире символов которые в	1	1
1506	ходу в психологии его	1	1
1507	тормозит и теперь нашу	1	1
1508	в суррогат ersatzbildung материнского	1	1
1509	сознание получает себя в	1	1
1510	из одного плана в	1	1
1511	совокупность усилий превратить внешний	1	1
1512	в общем можно сказать	1	1
1513	но в общем яркой	1	1
1514	не сделал серьезной попытки	1	1
1515	добраться до вытесненного влечения	1	1
1516	бы он был предоставлен	1	1
1517	в мире символов которые	1	1
1518	же законы которые созидают	1	1
1519	и с ними успешно	1	1
1520	сознательного для психоанализа же	1	1
1521	сознания представляются чем-то поверхностным	1	1
1522	корень бессознательного и вообще	1	1
1523	в мир травматично организм	1	1
1524	неизбежно соперником в этих	1	1
1525	укутываемся одеялом поджимаем ноги	1	1
1526	в материнское лоно мы	1	1
1527	реформу старой психологии что	1	1
1528	организм все характеристики рая	1	1
1529	болезненных симптомах в детском	1	1
1530	бессознательного группа этих влечений	1	1
1531	ранка даже пребывание зародыша	1	1
1532	всех внешних раздражений и	1	1
1533	во всех его многообразных	1	1
1534	движение внешними и внутренними	1	1
1535	в голову мысли и	1	1
1536	всяким уважением со всякой	1	1
1537	не могут быть поняты	1	1
1538	при сосании anus или	1	1
1539	в движение внешними и	1	1
1540	разыгрывает все снова и	1	1
1541	из тех же психоорганических	1	1
1542	это выдает бессознательное понимание	1	1
1543	жизни человек разыгрывает все	1	1
1544	и образы не имеющие	1	1
1545	рождения человек не может	1	1
1546	может быть ничего общего	1	1
1547	что ими заложено основание	1	1
1548	по смыслу образов перенесением	1	1
1549	дозволенного и недозволенного она	1	1
1550	бесспорно есть и вытесненное	1	1
1551	таким образом и острота	1	1
1552	новых и новых вытеснений	1	1
1553	только отдушина для подавленных	1	1
1554	цитировать еще шопенгауэра и	1	1
1555	невозможного полезного и вредного	1	1
1556	организма внутренние раздражения имеют	1	1
1557	беспощадному вытеснению в бессознательное	1	1
1558	работы и мышления не	1	1
1559	и внутренними раздражениями организма	1	1
1560	они совершили коренную реформу	1	1
1561	равным которому будет только	1	1
1562	ученики цитируют только себя	1	1
1563	всяком случае имеют какое-либо	1	1
1564	влечения фрейд разделяет по	1	1
1565	до скрытого содержания сна	1	1
1566	бессознательным дозволенного с недозволенным	1	1
1567	всех влечений и желаний	1	1
1568	с одной стороны сохранить	1	1
1569	механизм обхода легального путем	1	1
1570	своего прямого объекта на	1	1
1571	индивида эти две группы	1	1
1572	мир но наилучшим суррогатом	1	1
1573	в высшую систему психического	1	1
1574	соматических раздражений фрейд называет	1	1
1575	кажется что явное содержание	1	1
1576	не захватывающим самых глубин	1	1
1577	звеньев связанных как с	1	1
1578	выдают черты своего происхождения	1	1
1579	состояние организма во время	1	1
1580	даже пребывание зародыша в	1	1
1581	на две группы патологические	1	1
1582	не чем иным как	1	1
1583	быть это отличие психоанализа	1	1
1584	рождения древнейшие формы погребения	1	1
1585	шопенгауэра и ницше весь	1	1
1586	психологии его времени и	1	1
1587	как со стороны формы	1	1
1588	внутриутробной жизни однажды пережитой	1	1
1589	тех же психоорганических корней	1	1
1590	что она встречает сильное	1	1
1591	к разбираемому сновидению надо	1	1
1592	в ранний инфантильный период	1	1
1593	которые созидают формальную структуру	1	1
1594	его ученики противопоставляют свою	1	1
1595	очищать психику от накопившихся	1	1
1596	мир травматично организм вытолкнутый	1	1
1597	стремления чувство эмоции аффекты	1	1
1598	еще не стали организующим	1	1
1599	происхождения из этой же	1	1
1600	работе совершенно субъективны он	1	1
1601	когда фрейд и его	1	1
1602	мысли и образы не	1	1
1603	стремятся пробиться в сознание	1	1
1604	и этим очищать психику	1	1
1605	суррогат их видения показывания	1	1
1606	отличие психоанализа от остальной	1	1
1607	ненависть к отцу так	1	1
1608	матери и связанная с	1	1
1609	тенденция шутки и остроты	1	1
1610	прежде всего к эстетическим	1	1
1611	ими заложено основание совершенно	1	1
1612	скрюченными сидячими телами недвусмысленно	1	1
1613	психическую силу от этого	1	1
1614	образов словесной двусмысленности перенесения	1	1
1615	мыслям т.е как истолковать	1	1
1616	либидинозный характер и собственно	1	1
1617	самым ортодоксальным фрейдистом книга	1	1
1618	внимание на работу цензуры	1	1
1619	откуда у ребенка безнравственные	1	1
1620	самостоятельным обходиться без материнской	1	1
1621	погребения зарывание в землю	1	1
1622	еще не знает различия	1	1
1623	и с его галлюцинаторным	1	1
1624	представлений и слов замены	1	1
1625	сознания и искусно замаскированные	1	1
1626	фрейд применил метод толкования	1	1
1627	точки зрения обоих принципов	1	1
1628	мать отношения ребенка к	1	1
1629	деле фрейдизм перенес в	1	1
1630	грех в агрессивных остротах	1	1
1631	т.е рождаются в нашем	1	1
1632	последние судороги агонии по	1	1
1633	нужно отметить что ранк	1	1
1634	практике под ним фрейд	1	1
