1	в то же время	1	7
2	и в то же	1	3
3	по себе еще не	1	2
4	с этой точки зрения	1	1
5	ни на минуту не	1	1
6	во что бы то	1	1
7	не в том что	2	1
8	что бы то ни	1	1
9	до самого последнего времени	1	1
10	которая как раз и	1	1
11	заключается в том что	1	1
12	можно было бы привести	2	1
13	было до сих пор	1	1
14	зависимости от того в	1	1
15	не потому что он	1	1
16	уже само по себе	1	1
17	слова можно говорить об	1	1
18	бы то ни стало	1	1
19	и не могут быть	1	1
20	можно было бы сказать	3	1
21	в том отношении что	1	1
22	с точки зрения их	1	1
23	но для того чтобы	1	1
24	в зависимости от того	3	1
