1	в то же время	2	14
2	равноценности и качественной несоизмеримости	2	5
3	бы то ни было	2	4
4	культур и народов земного	1	3
5	всех культур и народов	1	3
6	и качественной несоизмеримости всех	1	2
7	абсолютно высшее и совершенное	1	2
8	или частью представителей данного	1	2
9	заключается в том что	3	2
10	частью представителей данного народа	1	2
11	принцип равноценности и качественной	1	2
12	и народов земного шара	1	2
13	всеми или частью представителей	1	2
14	качественной несоизмеримости всех культур	1	2
15	нечто абсолютно высшее и	1	2
16	несоизмеримости всех культур и	1	2
17	вместо лестницы мы получаем	1	1
18	культуры древности были разрушены	1	1
19	предметы военного снаряжения и	1	1
20	при воспринимании европейской культуры	1	1
21	развитии представителей человеческого рода	1	1
22	себя как на отсталых	1	1
23	время в сознании каждого	1	1
24	в тех случаях когда	1	1
25	и с точки зрения	1	1
26	и механические приспособления для	1	1
27	культур ныне существующих или	2	1
28	чем побеждаемые ими туземцы	1	1
29	должна быть ясна для	1	1
30	как бы то ни	2	1
31	и различие между отцами	1	1
32	получаем горизонтальную плоскость вместо	1	1
33	лестницы мы получаем горизонтальную	1	1
34	в том случае если	4	1
35	приходится признавать что победа	1	1
36	в своем развитии представителей	1	1
37	том же темпе как	1	1
38	несмотря на то что	2	1
39	только в том случае	1	1
40	на вопрос можно ли	1	1
41	смотреть на самих себя	1	1
42	и наиболее распространенное доказательство	1	1
43	элементах этой культуры нечто	1	1
44	и норма права и	1	1
45	народов и культур по	2	1
46	мы получаем горизонтальную плоскость	1	1
47	и культур по степеням	1	1
48	наивность этого доказательства должна	1	1
49	культурных чем побеждаемые ими	1	1
50	культуры не будет уже	1	1
51	доказательства должна быть ясна	1	1
52	не говоря уже о	1	1
53	вполне могут очищать ее	1	1
54	этого доказательства должна быть	1	1
55	китайцев индусов арабов негров	1	1
56	постоянно приходится признавать что	1	1
57	могут очищать ее от	1	1
58	степеням совершенства новый принцип	1	1
59	самих себя как на	1	1
60	того чтобы ответить на	1	1
61	славян китайцев индусов арабов	1	1
62	между отцами и детьми	1	1
63	этой культуры нечто абсолютно	1	1
64	снаряжения и механические приспособления	1	1
65	это может быть и	1	1
66	живет и по сие	1	1
67	воспринимании европейской культуры вполне	1	1
68	различие между отцами и	1	1
69	и техническое приспособление и	1	1
70	по степеням совершенства новый	1	1
71	культуры вполне могут очищать	1	1
72	для того чтобы ответить	1	1
73	одного и того же	3	1
74	быть ясна для всякого	1	1
75	туземную культуру в угоду	1	1
76	прочих культур ныне существующих	2	1
77	долю народов менее культурных	1	1
78	культур по степеням совершенства	1	1
79	можно ли объективно доказать	2	1
80	будет тем меньше чем	1	1
81	признавать что победа весьма	1	1
82	учреждение и техническое приспособление	1	1
83	все признаваемые европейской наукой	1	1
84	градации народов и культур	1	1
85	выпадает на долю народов	1	1
86	народы при воспринимании европейской	1	1
87	что победа весьма часто	1	1
88	техническое приспособление и научное	1	1
89	новый принцип равноценности и	1	1
90	очищать ее от эгоцентризма	1	1
91	древности были разрушены именно	1	1
92	вопрос можно ли объективно	1	1
93	на самих себя как	1	1
94	и наивность этого доказательства	1	1
95	самое простое и наиболее	1	1
96	по сие время в	1	1
97	дикарей грубость и наивность	1	1
98	в том числе и	1	1
99	простое и наиболее распространенное	1	1
100	по сравнению с культурой	1	1
101	совершеннее всех прочих культур	2	1
102	характера тех племен которые	1	1
103	менее культурных чем побеждаемые	1	1
104	на долю народов менее	1	1
105	всех прочих культур ныне	2	1
106	народов менее культурных чем	1	1
107	победа весьма часто выпадает	1	1
108	свою туземную культуру в	1	1
109	и учреждение и техническое	1	1
110	насколько поклонение грубой силе	1	1
111	во всех элементах этой	1	1
112	человека этот аргумент ясно	1	1
113	дело в том что	1	1
114	тех племен которые создали	1	1
115	объективно доказать что культура	2	1
116	ли объективно доказать что	2	1
117	в то время как	1	1
118	и по сие время	1	1
119	военного снаряжения и механические	1	1
120	часто выпадает на долю	1	1
121	норма права и художественное	1	1
122	в области культуры он	1	1
123	механические приспособления для передвижения	1	1
124	весьма часто выпадает на	1	1
125	в том же темпе	1	1
126	может быть и норма	1	1
127	сие время в сознании	1	1
128	быть и норма права	1	1
129	всех элементах этой культуры	1	1
130	арабов негров и других	1	1
131	своем развитии представителей человеческого	1	1
132	культуры нечто абсолютно высшее	1	1
133	цивилизацию живет и по	1	1
134	европейской культуры вполне могут	1	1
135	культуру в угоду европейской	1	1
136	грубость и наивность этого	1	1
137	из того что в	1	1
138	победы европейцев над дикарями	1	1
139	совершенства новый принцип равноценности	1	1
140	сравнению с культурой дикарей	1	1
141	индусов арабов негров и	1	1
