1	и в самом деле	2	9
2	заключается в том что	2	4
3	одно и то же	1	2
4	и вместе с тем	1	2
5	с этой точки зрения	1	1
6	только в том случае	1	1
7	в том смысле что	1	1
8	в том случае если	1	1
9	с более или менее	1	1
10	в том что оно	2	1
11	вовсе не в том	1	1
12	и т п с	1	1
13	прав когда указывает на	1	1
14	для того чтобы с	1	1
15	состоит в том что	3	1
16	не в том что	1	1
17	того как мы можем	1	1
18	в том виде какой	1	1
19	в том что она	1	1
20	и есть в сущности	1	1
21	есть в сущности говоря	1	1
22	и то же слово	1	1
23	ни в какой мере	1	1
24	только для того чтобы	1	1
25	в самом деле в	1	1
