1	в том что в	1	5
2	но тем не менее	1	2
3	в том что этот	1	2
4	вместе с тем и	1	2
5	оставляет сомнений в том	1	1
6	в тех случаях когда	1	1
7	не оставляет сомнений в	1	1
8	как мы уже знаем	1	1
9	так же как и	4	1
10	в одном и том	1	1
11	о том что в	1	1
12	с той только разницей	1	1
13	приводит к тому что	1	1
14	одном и том же	1	1
15	но и потому что	1	1
16	но вместе с тем	4	1
17	как это ни странно	1	1
18	сомнений в том что	1	1
19	приходит к выводу что	3	1
20	который мы наблюдаем в	1	1
21	той только разницей что	1	1
