1	в то же время	10	8
2	но в то же	2	5
3	бы то ни было	1	4
4	на самом же деле	1	3
5	в той или иной	1	3
6	какой бы то ни	1	2
7	может быть и речи	1	2
8	с одной стороны и	1	2
9	и до настоящего времени	2	2
10	той или иной степени	1	2
11	не может быть и	1	2
12	то же время это	1	1
13	дело в том что	2	1
14	никогда не может быть	1	1
15	мы уже говорили что	5	1
16	как мы уже сказали	1	1
17	в контексте определенных высказываний	1	1
18	бы оно ни было	1	1
19	но и в основе	1	1
20	в том что это	1	1
21	как впрочем и в	1	1
22	в том числе и	2	1
23	как бы оно ни	1	1
24	можно прямо сказать что	1	1
25	за пределы нашей работы	1	1
