1	в то же время	12	3
2	и в то же	5	2
3	бы то ни было	1	2
4	в большинстве случаев не	1	2
5	с точки зрения самого	2	2
6	во всех своих моментах	1	2
7	входит в эстетический объект	1	2
8	оно не выходит за	1	1
9	и с точки зрения	1	1
10	точка зрения на мир	1	1
11	бы они ни были	1	1
12	то же время этот	1	1
13	или в лучшем случае	1	1
14	а иногда и прямо	1	1
15	во всех его моментах	4	1
16	но в то же	4	1
17	никогда не может быть	1	1
18	на самом же деле	1	1
19	в том и в	2	1
20	не выходит за пределы	3	1
21	не входит в эстетический	1	1
22	и т п и	1	1
23	и в том и	2	1
24	всех его моментах как	1	1
25	дело в том что	1	1
26	в то время как	2	1
27	том и в другом	2	1
