N	4gram	Tiupa_Anal_1	TeoriaLi
416	чем глубже зачерпнуть тем	1	1
417	единство духовного я есть	1	1
418	ни в коем случае	2	1
419	разложимое а в то	1	1
420	доверенной его романному герою	1	1
421	изменить ничего нельзя не	1	1
422	произведение оригинальнее тем оно	1	1
423	в ходе последовательного наращивания	1	1
424	пришвин это интересно всем	1	1
425	эстетического отношения являются неслиянными	1	1
426	запечатлевать самые разнообразные в	1	1
427	высшая форма целостности доступной	1	1
428	предметом такого знания является	1	1
429	кубикам то субъект и	1	1
430	во всей своей полноте	1	1
431	познанию тайна внутреннего я	1	1
432	только в присутствии эстетического	1	1
433	духовная ценность которой обладают	1	1
434	ни изменить ничего нельзя	1	1
435	даже в этих исключительных	1	1
436	сотворивший ее художник вследствие	1	1
437	в обыденной внехудожественной действительности	1	1
438	узнают себя свою душу	1	1
439	объект эстетического отношения являются	1	1
440	и то или иное	1	1
441	сочетаться подобно кубикам то	1	1
442	личности а не ее	1	1
443	искусства но факультативные и	1	1
444	я самоопределение к ролевому	1	1
445	интересно всем потому что	1	1
446	вокруг я героя как	1	1
447	ходе последовательного наращивания текста	1	1
448	что все люди такие	1	1
