1	в то же время	4	9
2	но в то же	2	5
3	в целом ряде других	1	2
4	мы должны перейти к	1	1
5	они и не могут	1	1
6	что же это за	1	1
7	во что бы то	1	1
8	теперь мы должны перейти	1	1
9	что бы то ни	1	1
10	это и есть та	1	1
11	во всяком случае не	1	1
12	и быть не может	1	1
13	бы то ни было	2	1
14	зависимости от того в	1	1
15	и в нем мы	1	1
16	с точки зрения сознания	2	1
17	мы имеем в виду	1	1
18	и не могут быть	1	1
19	бы то ни стало	1	1
20	и по отношению к	1	1
21	другая точка зрения на	1	1
22	в пределах того что	1	1
23	в зависимости от того	2	1
