1	есть не что иное	3	4
2	то же самое время	2	4
3	на самом же деле	1	4
4	не что иное как	4	4
5	в то же самое	2	4
6	одно и то же	1	3
7	бы то ни было	3	3
8	в том или ином	2	2
9	чего бы то ни	1	2
10	в той или иной	3	2
11	в том и заключается	1	1
12	том и заключается что	1	1
13	с этой точки зрения	1	1
14	в том что он	2	1
15	в собственном смысле слова	1	1
16	том или ином отношении	1	1
17	а не так как	1	1
18	с той или иной	1	1
19	одного и того же	2	1
20	один я на дорогу	1	1
21	все же не есть	1	1
22	выхожу один я на	1	1
23	значении этого слова как	1	1
24	не сами по себе	1	1
