1	в то же время	8	3
2	по отношению к содержанию	1	3
3	и в то же	1	2
4	ни в чем не	1	2
5	этический момент которым созерцание	1	1
6	в равной мере и	1	1
7	несмотря на то что	1	1
8	как-то транскрибировать этический момент	1	1
9	нет и быть не	1	1
10	с одной стороны и	1	1
11	но в то же	3	1
12	созерцание овладевает путем сопереживания	1	1
13	на самом же деле	1	1
14	должен как-то транскрибировать этический	1	1
15	а в том как	1	1
16	транскрибировать этический момент которым	1	1
17	момент которым созерцание овладевает	1	1
18	не чем иным как	1	1
19	не в том что	1	1
20	которым созерцание овладевает путем	1	1
