1	в том что в	1	2
2	в том что он	2	2
3	том что он не	1	2
4	той мере в какой	2	2
5	в той мере в	2	2
6	оставляет никаких сомнений в	1	1
7	точно так же как	2	1
8	внимание на то что	1	1
9	заключается в том что	4	1
10	одно и то же	3	1
11	не оставляет никаких сомнений	1	1
12	в этом случае и	1	1
13	и вместе с тем	2	1
14	в пользу того что	1	1
15	до сих пор в	1	1
16	для того чтобы показать	1	1
17	только потому что они	1	1
18	но вместе с тем	1	1
19	в том что она	2	1
20	сомнений в том что	1	1
21	одним и тем же	2	1
