1	в то же время	3	3
2	мы имеем дело с	1	2
3	мысль о том что	1	2
4	отделен от своей судьбы	1	1
5	как раз в том	1	1
6	и дело здесь не	1	1
7	не отделен от своей	1	1
8	его поступки только раскрывают	1	1
9	выражает внеличную сторону индивида	1	1
10	раз в том что	1	1
11	представляет собой один из	1	1
12	не что иное как	1	1
13	своей судьбы они едины	1	1
14	есть на самом деле	1	1
15	внеличную сторону индивида и	1	1
16	позицию по отношению к	1	1
17	только раскрывают содержание судьбы	1	1
18	они едины судьба выражает	1	1
19	не для того чтобы	1	1
20	и его поступки только	1	1
21	от своей судьбы они	1	1
22	судьбы они едины судьба	1	1
23	есть не что иное	1	1
24	в той или иной	1	1
25	индивида и его поступки	1	1
26	и к себе самому	1	1
27	поступки только раскрывают содержание	1	1
28	одного и того же	3	1
29	дело здесь не только	1	1
30	присутствия я в мире	2	1
31	едины судьба выражает внеличную	1	1
32	сторону индивида и его	1	1
33	здесь не только в	1	1
34	имеет в своем составе	1	1
35	и здесь мы имеем	1	1
36	судьба выражает внеличную сторону	1	1
