1	сводится к тому что	1	2
2	в то же время	3	2
3	на самом же деле	2	2
4	какой бы то ни	1	1
5	с этой точки зрения	1	1
6	так же как и	2	1
7	в самом деле ведь	2	1
8	не будем здесь входить	1	1
9	бы то ни было	8	1
10	второй половины xix века	1	1
11	не выходит за пределы	1	1
12	выходит далеко за пределы	1	1
13	и в таком случае	1	1
14	в том что он	1	1
15	до сих пор не	1	1
16	мы не будем здесь	1	1
17	себе отчет в том	1	1
18	к тому что все	1	1
19	отчет в том что	1	1
20	будем здесь входить в	1	1
21	с другой стороны оно	1	1
