1	состоит в том что	1	2
2	в то время как	1	2
3	отличаются друг от друга	3	1
4	это может быть и	1	1
5	которые не находят себе	1	1
6	таким образом мы видим	1	1
7	на все эти вопросы	1	1
8	до сих пор не	4	1
9	в тех случаях когда	1	1
10	и так или иначе	1	1
11	заключается в том что	3	1
12	что в данном случае	1	1
13	одной и той же	1	1
14	выше мы видели что	1	1
15	следить за тем чтобы	1	1
16	как мы видели выше	1	1
17	но вместе с тем	1	1
18	образом мы видим что	1	1
19	мы уже знаем что	1	1
20	в этом случае мы	1	1
