1	в то время как	4	2
2	заключается в том что	2	2
3	лежащих в его основе	1	1
4	с этой точки зрения	1	1
5	все дело в том	1	1
6	так же как и	1	1
7	в каком случае нельзя	1	1
8	взятые сами по себе	4	1
9	в том или ином	2	1
10	ничего общего с тем	2	1
11	если мы припомним то	1	1
12	дело в том что	2	1
13	мы припомним то что	1	1
14	в том что он	1	1
15	т д все это	1	1
16	бы то ни было	3	1
17	заключается в том чтобы	1	1
18	но все дело в	1	1
19	и т д все	1	1
20	ни в каком случае	2	1
21	точно так же и	1	1
22	взятый сам по себе	2	1
23	только для того чтобы	1	1
24	не что иное как	4	1
