1	в то же время	8	6
2	но в то же	5	4
3	в той или иной	3	2
4	в том числе и	1	2
5	той или иной форме	1	1
6	в обычном смысле слова	1	1
7	в точном смысле слова	1	1
8	какой бы то ни	2	1
9	то же время это	1	1
10	бы то ни было	4	1
11	как мы уже сказали	1	1
12	свидетельствует о том что	1	1
13	именно для того чтобы	2	1
14	дело в том что	1	1
15	же время это и	1	1
16	и не может быть	1	1
17	не что иное как	1	1
18	одним и тем же	2	1
19	той или иной степени	2	1
20	уже названная нами книга	1	1
21	мы уже говорили что	1	1
