1	в то же время	9	7
2	точки зрения нашего тезиса	1	5
3	с точки зрения нашего	1	5
4	сознаний с их мирами	4	4
5	в том что он	4	4
6	я не как объект	3	3
7	героя о себе самом	4	3
8	с точки зрения монологического	3	3
9	в кругозор самого героя	3	3
10	на мир и на	2	3
11	самосознание как художественная доминанта	2	3
12	дело идет не об	2	3
13	чужое я не как	3	3
14	объект а как другой	3	3
15	утвердить чужое я не	3	3
16	личного стиля и тона	3	3
17	а как другой субъект	3	3
18	и в то же	2	3
19	не как объект а	3	3
20	достоевского с точки зрения	1	3
21	как объект а как	3	3
22	о себе самом и	4	3
23	по себе еще не	2	2
24	становится живым существом и	2	2
25	от характера типа и	2	2
26	себе самом и о	4	2
27	и в этом отношении	2	2
28	пространстве а не во	2	2
29	лежащими в их основе	2	2
30	а в то же	2	2
31	не нарушает строгой определенности	2	2
32	является лишь одним из	2	2
33	именно в том что	1	2
34	в пределах отдельных сознаний	2	2
35	не значит конечно что	2	2
36	романной структуры у достоевского	1	2
37	в пространстве а не	2	2
38	они уже не могут	2	2
39	определение романа достоевского как	2	2
40	глубокий отпечаток его личного	2	2
41	среды почвы и земли	2	2
42	равноправных сознаний с их	2	2
43	а не во времени	2	2
44	характера типа и темперамента	2	2
45	но в то же	5	2
46	бы то ни было	1	2
47	ивана карамазова и других	1	2
48	как в дантовском мире	2	2
49	кругозор самого героя и	2	2
50	точки зрения монологического понимания	2	2
51	рядом с другими чертами	2	2
52	мир и на себя	1	2
53	у ивана карамазова и	1	2
54	как звенья единого диалектического	2	2
55	роман роман с идеей	2	2
56	в разрезе данного мгновения	2	2
57	в их основе идеями	2	2
58	слово героя о себе	2	2
59	в самой структуре романа	2	2
60	лентяй да ведь это	2	2
61	раскольникова ивана карамазова и	2	2
62	как и благодаря чему	2	2
63	материале произведений достоевского мы	2	2
64	на материале произведений достоевского	2	2
65	и на себя самого	1	2
66	критической литературы о достоевском	2	2
67	отпечаток его личного стиля	2	2
68	что может быть осмысленно	2	2
69	только в этой форме	2	2
70	на вопрос кто он?	2	2
71	его о себе самом	2	2
72	художественная доминанта в построении	1	2
73	звенья единого диалектического ряда	2	2
74	точка зрения на мир	2	2
75	его личного стиля и	2	2
76	в полифоническом романе достоевского	2	2
77	но и не служит	2	2
78	художественного видения и изображения	2	2
79	сами по себе еще	2	2
80	как художественная доминанта в	1	2
81	то же время не	3	2
82	достоевского утвердить чужое я	2	2
83	видения и понимания мира	2	2
84	той же основной особенности	2	2
85	множественность равноправных сознаний с	2	2
86	все эти композиционные приемы	2	2
87	потому что она не	3	2
88	в самом построении романа	2	2
89	идея как предмет изображения	2	2
90	это не значит конечно	2	2
91	с заметкой из дневника	1	1
92	и полноправным носителем собственного	1	1
93	и показывать все рядом	1	1
94	романов достоевского с трагедией	1	1
95	должна была быть особенно	1	1
96	живет идея и романист	1	1
97	сознанию героя автор может	1	1
98	историографом идеи доминантой образной	1	1
99	со своим двойником с	1	1
100	но сознание критиков и	1	1
101	мир достоевского глубоко персоналистичен	1	1
102	идеологии как воплощенную в	1	1
103	самого начала единства как	1	1
104	достоевского и отто каус	1	1
105	сочетаясь статическую фигуру как	1	1
106	полифонического романа но объяснения	1	1
107	тигеля все новые и	1	1
108	во всяком случае была	1	1
109	была проявиться особенно резко	1	1
110	этой особенности привела к	1	1
111	самого героя и его	1	1
112	глубокая органичность последовательность и	1	1
113	не обыкновенный идейный роман	1	1
114	нарушая конечно художественного единства	1	1
115	этико-религиозный постулат автора и	1	1
116	ввести его в кругозор	1	1
117	которую так остро и	1	1
118	сочетаются по своим эмоционально-волевым	1	1
119	и групп не ослабивших	1	1
120	в мировоззрении достоевского но	1	1
121	структуры у достоевского глубоко	1	1
122	является та или иная	1	1
123	и тона если бы	1	1
124	в самом деле взаимоотношения	1	1
125	элемент произведения в самом	1	1
126	в монологически формулированное авторское	1	1
127	лежит глубже чем вопрос	1	1
128	его ум и сердце	1	1
129	все устойчивые объективные качества	1	1
130	в окружающем является та	1	1
131	героем был человек и	1	1
132	также является лишь одним	1	1
133	укладываясь рядом с другими	1	1
134	в дантовском мире образовать	1	1
135	авторского замысла нет эта	1	1
136	трагедии в этом смысле	1	1
137	время часто вопреки прагматическому	1	1
138	его положением журналиста требующим	1	1
139	же объясняет каус эту	1	1
140	иванов правда только нащупал	1	1
141	с полифонией и с	1	1
142	произведений но этого вячеслав	1	1
143	такой образ в стиле	1	1
144	семена из миров иных	1	1
145	для себя самого это	1	1
146	героев ни героев отрицательных	1	1
147	зрения последовательно-монологического видения и	1	1
148	человека требуется нарушение законов	1	1
149	случае и неизбежна и	1	1
150	драматический диалог может играть	1	1
151	и подлиннейшим выражением духа	1	1
152	взаимодействия сознаний и втиснутая	1	1
153	для него не существенно	1	1
154	делают его многопланным напротив	1	1
155	ее в драме невозможно	1	1
156	у достоевского также ограничивается	1	1
157	воле то в полифонии	1	1
158	и оставалось в нем	1	1
159	аналогичные явления в мышлении	1	1
160	в последнюю минуту но	1	1
161	как таковой и всякий	1	1
162	ценность личности это делали	1	1
163	цельное художественное создание вот	1	1
164	в одном художественном создании	1	1
165	уверенное идеологическое взаимное игнорирование	1	1
166	единого духа глубоко чужд	1	1
167	противоречия он стремится воспринять	1	1
168	героем достоевского можно было	1	1
169	выражения но именно в	1	1
170	и окружающий его внешний	1	1
171	акценты самосознания героя действительно	1	1
172	большую неправдоподобность предположив что	1	1
173	наблюдений над отдельными художественными	1	1
174	до конца противоречием в	1	1
175	ни одно не стало	1	1
176	и не входит в	2	1
177	духа наконец третий план	1	1
178	и свое объективное определение	1	1
179	вытянуть в становящийся ряд	1	1
180	может быть лишь другое	1	1
181	кроткой является лишь одним	1	1
182	вспоминают у них нет	1	1
183	человека из подполья и	1	1
184	иванова утвердить чужое я	1	1
185	существом и излагается взволнованным	1	1
186	что из каждого противоречия	1	1
187	выбор таким образом производится	1	1
188	правильным и уже совсем	1	1
189	которому как бы тяготеет	1	1
190	в авторский замысел этот	1	1
191	в аспекте данной идеи	1	1
192	периода являются мистериями мистерия	1	1
193	и социальном сознании ибо	1	1
194	единый становящийся дух даже	1	1
195	как и его предшественники	1	1
196	у вас нет решимости	1	1
197	в зеркале но благодаря	1	1
198	в чужих сознаниях строить	1	1
199	этом плане энгельгардт это	1	1
200	мировоззрения автора от этого	1	1
201	приходится признать что главное	1	1
202	единство романа достоевского комарович	1	1
203	как преломлялась утверждаемая нами	1	1
204	пытаясь теоретически разобраться в	1	1
205	слово автора противостоит полноценному	1	1
206	от монологизации этого мира	1	1
207	быть сделан из одного	1	1
208	как бы в пространстве	1	1
209	и музыкальную полифонию в	1	1
210	самостоятельность и свобода его	1	1
211	рядом прямых метафизических и	1	1
212	дневника происшествий или лакейская	1	1
213	оно перестает быть тем	1	1
214	только объекты авторского слова	1	1
215	соподчинение прагматически разъединенных элементов	1	1
216	замечаем аналогичные явления в	1	1
217	второстепенную роль существеннее утверждение	1	1
218	не собираемся здесь давать	1	1
219	определенными художественными средствами это	1	1
220	грешники и праведники или	1	1
221	остался в своем существе	1	1
222	чуждые части и перед	1	1
223	как формула аскольдова монологичнее	1	1
224	вещное и объектное все	1	1
225	с которой ведется рассказ	1	1
226	образа сливаются воедино только	1	1
227	оно есть если бы	1	1
228	из одного куска обточенной	1	1
229	внешних условий второй план	1	1
230	духа своего и чужого	1	1
231	в той же плоскости	1	1
232	и поглощается словом как	1	1
233	ослаблению драматизма герои диалогически	1	1
234	дать художественный ответ на	1	1
235	мысли и рассматривать как	1	1
236	особенность находит свое внешнее	1	1
237	рассказа до простой мотивировки	1	1
238	полифонического романа мир частушки	1	1
239	по отношению к себе	1	1
240	обходятся или трактуются лишь	1	1
241	он создал существенно новый	1	1
242	упорно и мучительно рассасывает	1	1
243	нечто на первый взгляд	1	1
244	зрения среди уже существующих	1	1
245	именно потому что он	1	1
246	лишь помог ему глубже	1	1
247	заранее обессилена и лишена	1	1
248	изображаемого события мысль вовлеченная	1	1
249	становления этот личный опыт	1	1
250	достоевском б.м.энгельгардт разбираясь в	1	1
251	случае был бы философский	1	1
252	нет ни композиционного ни	1	1
253	однако в этой статье	1	1
254	неслиянных сознаний указан верно	1	1
255	крестоносцев орла души императоров	1	1
256	произведения утверждение чужого сознания	1	1
257	к правде правда неотразимо	1	1
258	на сей земле это	1	1
259	если же мы поставим	1	1
260	умел слышать два спорящих	1	1
261	мы уже говорили менее	1	1
262	невозможно сочетание целостных кругозоров	1	1
263	какие мы привыкли прилагать	1	1
264	также является только компонентом	1	1
265	средой он почти никогда	1	1
266	достоевского бесконечная функция герой	1	1
267	как попытка свести новую	1	1
268	характера своей типичности своего	1	1
269	у которого лежит на	1	1
270	характеризуемая нами особенность достоевского	1	1
271	романы его как художественные	1	1
272	слова это особенность его	1	1
273	планом земли то романы	1	1
274	сосредоточить в одном месте	1	1
275	или ослабления композиционного авторского	1	1
276	и оценки однако не	1	1
277	спор видение достоевского было	1	1
278	единстве высшего порядка чем	1	1
279	оставлял за собою употребляя	1	1
280	твердым и завершающим авторским	1	1
281	лирической не сливая с	1	1
282	каус эту исключительную многосторонность	1	1
283	в свете формулированного нами	1	1
284	своеобразно сочетается здесь с	1	1
285	отношении друг к другу	1	1
286	проходит ищущий в своем	1	1
287	как не нарушает строгой	1	1
288	здесь положений для понимания	1	1
289	лишь как прошлое или	1	1
290	взаимоотношения в разрезе одного	1	1
291	образующих целое романа настоящая	1	1
292	достоевского и показывает как	1	1
293	черты людей но они	1	1
294	о диалектическом становлении духа	1	1
295	в его мире стало	1	1
296	аскольдова будь личностью ивановская	1	1
297	для него самого для	1	1
298	последнюю минуту но не	1	1
299	условиях определенной художественной конструкции	1	1
300	личным переживанием здесь мы	1	1
301	и отчасти философский диалог	1	1
302	действительно многопланна и до	1	1
303	одинаково толкуют его как	1	1
304	построить его цельный образ	1	1
305	даже прохарчин то что	1	1
306	боговдохновенные страницы священных книг	1	1
307	материале конкретных литературных произведений	1	1
308	изображено любовь ненависть версилова	1	1
309	достоевского не столько в	1	1
310	индивидуальной воле то в	1	1
311	историк случайного племени становится	1	1
312	трактует в плане современности	1	1
313	были бы ничьими были	1	1
314	таким образом все элементы	1	1
315	символически изображено любовь ненависть	1	1
316	и дантовский мир но	1	1
317	действие романа протекает одновременно	1	1
318	сознаний из которых ни	1	1
319	вполне преодоленные на самом	1	1
320	в процессе постепенного наступления	1	1
321	закрыт и его смысловые	1	1
322	не становление а сосуществование	1	1
323	несущественного только то что	1	1
324	изменяется сравнительно с беспорядочным	1	1
325	факт нераскрытым ведь дух	1	1
326	в полной мере осуществлен	1	1
327	духе а в объективном	1	1
328	и действительно неоднократно трактуется	1	1
329	личности в самой жизни	1	1
330	гроссман связал композиционный принцип	1	1
331	и во всяком случае	1	1
332	уже не как завершающая	1	1
333	окошка он в смятении	1	1
334	достоевского в его сознании	1	1
335	духа вообще нет становления	1	1
336	кругозор никак не представлен	1	1
337	сознаниями художественно наиболее сдержанные	1	1
338	а не как этико-религиозный	1	1
339	ибо подчинена проникающему ее	1	1
340	ему как бы слить	1	1
341	преломление этого принципа в	1	1
342	того пытаясь теоретически разобраться	1	1
343	совпадает с самим собою	1	1
344	как целое одного сознания	1	1
345	в высшее единство так	1	1
346	романа в его произведениях	1	1
347	был глубок достаточны для	1	1
348	задачи если же мы	1	1
349	и могут думать другие	1	1
350	из решений этой проблемы	1	1
351	друг против друга экстенсивно	1	1
352	взрастил господь взяв семена	1	1
353	всякого рода общепринятостью отсюда	1	1
354	только находим у достоевского	1	1
355	сделать двух людей чтобы	1	1
356	но фантастическое тут есть	1	1
357	или к антиномике или	1	1
358	голосов для третьих наконец	1	1
359	диалог в повествовательных формах	1	1
360	книга иова откровение св	1	1
361	мира и нашел наиболее	1	1
362	реальным но фантастическое тут	1	1
363	не сосредоточены просто на	1	1
364	достоевского дело идет не	1	1
365	случайного племени такой человек	1	1
366	отдельными художественными особенностями достоевского	1	1
367	ибо драматическое построение не	1	1
368	не делал только из	1	1
369	был человек и изображал	1	1
370	его мировоззрения в обычном	1	1
371	в результате обзора его	1	1
372	этому пути шли розанов	1	1
373	гроссмана что романы достоевского	1	1
374	объясняется не только его	1	1
375	не вывод из него	1	1
376	рядом с другими сознаниями	1	1
377	этой проповеди аскольдов правильно	1	1
378	по своим комнатам и	1	1
379	все еще учится у	1	1
380	но он не улавливает	1	1
381	и их спокойное и	1	1
382	и контрапункта указывает лишь	1	1
383	в вечности по достоевскому	1	1
384	переживается ими как настоящее	1	1
385	образ действительности теперь все	1	1
386	до крайней степени достоевский	1	1
387	замысел художника другие не	1	1
388	важности высказанных здесь положений	1	1
389	служит комплекс идей-сил над	1	1
390	здесь с самого начала	1	1
391	в системно-монологические рамки единого	1	1
392	и развернуть его экстенсивно	1	1
393	авторском кругозоре может быть	1	1
394	достоевского распределены между несколькими	1	1
395	и рассматривать как сплошное	1	1
396	завершено хотя правда завершено	1	1
397	знакомой художественной воле в	1	1
398	например мир гофмана но	1	1
399	так резко выделяются в	1	1
400	это предисловие почти полностью	1	1
401	библии рядом с заметкой	1	1
402	в нарушении органического единства	1	1
403	и романист дает не	1	1
404	мировоззрения автора и в	1	1
405	системно-монологические рамки единого мировоззрения	1	1
406	мира в драме он	1	1
407	здесь естественным продуктом внешних	1	1
408	или иным его главам	1	1
409	по аскольдову преступление преступление	1	1
410	как и дантовский мир	1	1
411	а как субъект сознания	1	1
412	не закрывается не становится	1	1
413	литературе точек зрения на	1	1
414	художником такой монологический мир	1	1
415	его истина открывается несчастному	1	1
416	и разрешить ее в	1	1
417	новый состав и примут	1	1
418	зрения на него при	1	1
419	дантовском мире или созерцает	1	1
420	в романе достоевского идея	1	1
421	объекта является этико-религиозным постулатом	1	1
422	этапы стремился воспринять в	1	1
423	к откровениям новой мистерии	1	1
424	равную ценность именно в	1	1
425	мир и разрушить сложившиеся	1	1
426	вызывали его на сложную	1	1
427	превращает романа достоевского в	1	1
428	с его кругозором другой	1	1
429	как художественные единства не	1	1
430	образ в стиле самого	1	1
431	в каждом выражении надлом	1	1
432	остановимся лишь на немногих	1	1
433	всех этих идеологических голосов	1	1
434	достоевском по этому пути	1	1
435	где многопланность переносится в	1	1
436	уже говорили менее всего	1	1
437	против друга является для	1	1
438	монолог во втором монологически	1	1
439	радости на самом деле	1	1
440	переместилась и весь мир	1	1
