1	но вместе с тем	1	3
2	так же как и	1	2
3	точно так же как	1	1
4	и тем не менее	1	1
5	не в том чтобы	2	1
6	с одной стороны и	1	1
7	и т д и	1	1
8	таким образом мы видим	1	1
9	и т д все	1	1
10	в то время как	5	1
11	указывает на то что	3	1
12	совершенно так же как	1	1
13	никак не может быть	2	1
14	с другой стороны в	1	1
15	с этой точки зрения	4	1
16	состоит в том что	1	1
17	мы видели что в	1	1
18	д и т д	1	1
19	т д и т	1	1
20	и т д то	1	1
21	вопрос о том что	1	1
22	но так как в	1	1
23	в том числе и	1	1
