1	не имеют ничего общего	1	4
2	но в таком случае	1	4
3	не что иное как	3	2
4	есть не что иное	1	2
5	как мы увидим ниже	1	2
6	имеют ничего общего с	1	1
7	и т д здесь	1	1
8	что здесь кроется нечто	1	1
9	бы обратить внимание еще	1	1
10	на самом же деле	1	1
11	не только то что	1	1
12	весьма близко подходит к	1	1
13	хотелось бы обратить внимание	1	1
14	как мы видели выше	1	1
15	в то время как	2	1
16	тем не менее они	1	1
17	заключается в том что	1	1
18	обратить внимание еще на	1	1
19	тем не менее если	1	1
20	мы до сих пор	1	1
