N	4gram	Tiupa_Anal_1	TeoriaLi
1	в то же время	6	6
2	присутствия я в мире	1	5
3	состоит в том что	3	3
4	одно и то же	1	2
5	не следует смешивать с	1	2
6	одного и того же	2	2
7	обращает на себя внимание	1	1
8	знанию такого рода обогащает	1	1
9	есть высшая форма целостности	1	1
10	мы имеем дело с	3	1
11	и наоборот созерцающий становится	1	1
12	в той мере в	2	1
13	личностного присутствия во внешнем	1	1
14	смена субъекта речи кто	1	1
15	содержание эстетической деятельности созерцания	1	1
16	мы имеем в виду	1	1
17	своих героях воображая что	1	1
18	специфически человеческий способ существования	1	1
19	незаместимое место в событии	1	1
20	личность как внутреннее единство	1	1
21	мира вокруг я героя	1	1
22	и неспецифичны собственно же	1	1
23	факультативные и более поверхностные	1	1
24	донна ставшие общеизвестными после	1	1
25	числе и трагическое есть	1	1
26	ядра личности а не	1	1
27	специфическая целостность феноменов человеческого	1	1
28	нераздельными его полюсами предмет	1	1
29	этого словами гегеля духовная	1	1
30	выступать и внутренняя целостность	1	1
31	мире и жизни однако	1	1
32	и способа высказывания смена	1	1
33	общее всем знакомее и	1	1
34	и что ж результат	1	1
35	и сосредоточенное в конечном	1	1
36	ни убавить ни изменить	1	1
37	того или иного рода	1	1
38	объектом только в присутствии	1	1
39	и прозрачнее чем это	1	1
40	художник вследствие этого словами	1	1
41	целостность феноменов человеческого бытия	1	1
42	очевидная граница между двумя	1	1
43	тем художественная реальность героя	1	1
44	но факультативные и более	1	1
45	эстетической деятельности созерцания направленной	1	1
46	дискурса состоит в том	1	1
47	к знанию такого рода	1	1
48	известную цельность как бы	1	1
49	ее художник вследствие этого	1	1
50	чего бы то ни	1	1
51	человеческое я есть точка	1	1
52	ему люди но иностранцы	1	1
53	есть точка пересечения трех	1	1
54	сказать не спрашивай о	1	1
55	ценностное уплотнение воображаемого мира	1	1
56	оно универсальнее вы говорите	1	1
57	тайна внутреннего я ядра	1	1
58	художественное знание по мысли	1	1
59	свое незаместимое место в	1	1
60	чем произведение оригинальнее тем	1	1
61	наш духовный опыт внутреннего	1	1
62	хемингуэя фиеста можно сказать	1	1
63	счете искусство в том	1	1
64	всем любая личность является	1	1
65	гегеля духовная ценность которой	1	1
66	собственному я самоопределение к	1	1
67	своей полноте и неизбыточности	1	1
68	одна вымышленная условная индивидуальность	1	1
69	отдельные слова не разложимое	1	1
70	ее никто не решает	1	1
71	можно сказать не спрашивай	1	1
72	входят в состав художественного	1	1
73	эстетического созерцания может выступать	1	1
74	личности к своему собственному	1	1
75	внутреннее единство духовного я	1	1
76	люди но иностранцы узнают	1	1
77	внутренняя целостность не только	1	1
78	более поверхностные психологические социальные	1	1
79	той мере в какой	2	1
80	я героя как ценностного	1	1
81	не ее оболочек психологии	1	1
82	единством субъекта и способа	1	1
83	это возможно в обыденной	1	1
84	некое событие индивидуальный характер	1	1
85	в том и состоит	1	1
86	оригинальнее тем оно универсальнее	1	1
87	оказывается эстетическим объектом только	1	1
88	не спрашивай о ком	1	1
89	как внутреннее единство духовного	1	1
90	логический объект логический субъект	1	1
91	является специфическая целостность феноменов	1	1
92	субъекта и способа высказывания	1	1
93	становится эстетическим субъектом только	1	1
94	по всеохватывающей своей широте	1	1
95	и более поверхностные психологические	1	1
96	узкое и сосредоточенное в	1	1
97	родственно всем любая личность	1	1
98	внешнюю полноту и неизбыточность	1	1
99	явлений между тем объектом	1	1
100	и не наступает вместо	1	1
101	дж донна ставшие общеизвестными	1	1
102	пастернака доверенной его романному	1	1
103	перед лицом эстетического объекта	1	1
104	в художественном произведении чище	1	1
105	могущие иметь место в	1	1
106	страхову что достоевский описывал	1	1
107	внешнем мире и составляет	1	1
108	в виду не только	1	1
109	ж результат тот что	1	1
110	текста наиболее очевидная граница	1	1
111	такого рода обогащает наш	1	1
112	которой обладают некое событие	1	1
113	в том случае если	1	1
114	прозрачнее чем это возможно	1	1
115	тот что даже в	1	1
116	если логический объект логический	1	1
117	ценность которой обладают некое	1	1
118	необязательны и неспецифичны собственно	1	1
119	высказывания смена субъекта речи	1	1
120	я другого межличностная данность	1	1
121	принципе недоступна между тем	1	1
122	же время они существенно	1	1
123	творческого акта в отличие	1	1
124	граница между двумя соседними	1	1
125	мыслиться раздельно и сочетаться	1	1
126	утверждение о жизни по	1	1
127	являются неслиянными и нераздельными	1	1
128	бы то ни было	3	1
129	объектом эстетического созерцания может	1	1
130	способны запечатлевать самые разнообразные	1	1
131	с этой точки зрения	1	1
132	присутствия во внешнем мире	1	1
133	могут мыслиться раздельно и	1	1
134	может выступать и внутренняя	1	1
135	воображая что все люди	1	1
136	недоступна между тем художественная	1	1
137	такого знания является специфическая	1	1
138	личности более того личность	1	1
139	зачерпнуть тем общее всем	1	1
140	и неизбыточность явлений между	1	1
141	только перед лицом эстетического	1	1
142	свою душу чем глубже	1	1
143	субъекта объекта и адресата	1	1
144	в том что он	2	1
145	однако все они для	1	1
146	духовного я есть высшая	1	1
147	ему известную цельность как	1	1
148	созерцания направленной на произведение	1	1
149	но в то же	2	1
150	раздельно и сочетаться подобно	1	1
151	тем общее всем знакомее	1	1
152	место в событии художественного	1	1
153	целостность не только целостность	1	1
154	своей широте на отдельные	1	1
155	соседними сегментами субъектной организации	1	1
156	феноменов человеческого бытия я-в-мире	1	1
157	неслиянными и нераздельными его	1	1
158	дневниковая запись документ но	1	1
159	произведении чище и прозрачнее	1	1
160	ними могут мыслиться раздельно	1	1
161	психологии характера социального поведения	1	1
162	трех фундаментальных отношений личности	1	1
163	по преимуществу внешнюю полноту	1	1
164	я уникально и одновременно	1	1
165	во внешнем мире и	1	1
166	в различных речевых жанрах	1	1
167	всеохватывающей своей широте на	1	1
168	описывал себя в своих	1	1
169	из нас самих состоят	1	1
170	отношение между ними могут	1	1
171	отношения являются неслиянными и	1	1
172	лицах не только мы	1	1
173	вещи но и души	1	1
174	и внутренняя целостность не	1	1
175	пересечения трех фундаментальных отношений	1	1
176	мы родственные ему люди	1	1
177	сосредоточенное в конечном счете	1	1
178	убавить ни изменить ничего	1	1
179	опыт внутреннего личностного присутствия	1	1
180	ничего нельзя не сделав	1	1
181	то или иное логическое	1	1
182	широте на отдельные слова	1	1
183	в принципе недоступна между	1	1
184	героях воображая что все	1	1
185	между тем объектом эстетического	1	1
186	письмо дневниковая запись документ	1	1
187	прочие обобщения могущие иметь	1	1
188	еще одна вымышленная условная	1	1
189	случае мы имеем дело	1	1
190	этих исключительных лицах не	1	1
191	время узкое и сосредоточенное	1	1
192	исключительных лицах не только	1	1
193	эстетическим объектом только в	1	1
194	как письмо дневниковая запись	1	1
195	как содержание эстетической деятельности	1	1
196	виду не только такие	1	1
197	достоевский описывал себя в	1	1
198	конечном счете искусство в	1	1
199	тем оно универсальнее вы	1	1
200	подобно кубикам то субъект	1	1
201	в исходном значении этого	1	1
202	созерцающий становится эстетическим субъектом	1	1
203	способа высказывания смена субъекта	1	1
204	а в то же	2	1
205	соединении с художественной идеологемой	1	1
206	субъект и объект эстетического	1	1
207	предмет созерцания оказывается эстетическим	1	1
208	ролевому сверх-я сверхличная заданность	1	1
209	на отдельные слова не	1	1
210	в событии художественного творчества	1	1
211	со-бытийному я другого межличностная	1	1
212	или иное логическое отношение	1	1
213	строки дж донна ставшие	1	1
214	не только мы родственные	1	1
215	обобщения могущие иметь место	1	1
216	владеет сотворивший ее художник	1	1
217	внехудожественной действительности приобщение к	1	1
218	существования предметом такого знания	1	1
219	знания является специфическая целостность	1	1
220	я есть точка пересечения	1	1
221	и сочетаться подобно кубикам	1	1
222	какое-то утверждение о жизни	1	1
223	акта в отличие от	1	1
224	химическом соединении с художественной	1	1
225	своему собственному я самоопределение	1	1
226	и объект эстетического отношения	1	1
227	документ но прежде всего	1	1
228	полноту и неизбыточность явлений	1	1
229	фундаментальных отношений личности к	1	1
230	цельность как бы личность	1	1
231	люди такие и что	1	1
232	между тем художественная реальность	1	1
233	форма целостности доступной человеческому	1	1
234	универсально родственно всем любая	1	1
235	поведения в принципе недоступна	1	1
236	неспецифичны собственно же художественное	1	1
237	потому что из нас	1	1
238	внутреннее присутствие во внешней	1	1
239	деятельности созерцания направленной на	1	1
240	уникально и одновременно универсально	1	1
241	в той или иной	3	1
242	обогащает наш духовный опыт	1	1
243	всей своей полноте и	1	1
244	случае не следует смешивать	1	1
245	присутствие во внешней реальности	1	1
246	субъектом только перед лицом	1	1
247	же время узкое и	1	1
248	в конечном счете искусство	1	1
249	логическое отношение между ними	1	1
250	в литературе нового времени	1	1
251	трагическое есть рассказ о	1	1
252	жизни однако все они	1	1
253	рода обогащает наш духовный	1	1
254	всем знакомее и роднее	1	1
255	одновременно универсально родственно всем	1	1
256	обыденной внехудожественной действительности приобщение	1	1
257	как ценностного центра этого	1	1
258	запись документ но прежде	1	1
259	содержания лишь в химическом	1	1
260	художественном произведении чище и	1	1
261	ставшие общеизвестными после романа	1	1
262	я ядра личности а	1	1
263	в том числе и	1	1
264	не только такие специфические	1	1
265	по шеллингу чем произведение	1	1
266	поверхностные психологические социальные политические	1	1
267	целостности доступной человеческому восприятию	1	1
268	событие индивидуальный характер поступок	1	1
269	души личности более того	1	1
270	разнообразные в частности научные	1	1
271	эстетическим субъектом только перед	1	1
272	что ж результат тот	1	1
273	в коем случае не	2	1
274	иностранцы узнают себя свою	1	1
275	иное логическое отношение между	1	1
276	исходном значении этого слова	1	1
277	состав художественного содержания лишь	1	1
278	двумя соседними сегментами субъектной	1	1
279	восприятия все прочие обобщения	1	1
280	и трагическое есть рассказ	1	1
281	фиеста можно сказать не	1	1
282	только целостность тела вещи	1	1
283	перефразируя строки дж донна	1	1
284	тем объектом эстетического созерцания	1	1
285	созерцания оказывается эстетическим объектом	1	1
286	но иностранцы узнают себя	1	1
287	но и души личности	1	1
288	логическому познанию тайна внутреннего	1	1
289	полюсами предмет созерцания оказывается	1	1
290	между двумя соседними сегментами	1	1
291	цитатного типа как письмо	1	1
292	вследствие этого словами гегеля	1	1
293	душу чем глубже зачерпнуть	1	1
294	меру обобщения личностного опыта	1	1
295	между ними могут мыслиться	1	1
296	о мире и жизни	1	1
297	созерцания может выступать и	1	1
298	слова не разложимое а	1	1
299	воображаемого мира вокруг я	1	1
300	психологические социальные политические входят	1	1
301	социальные политические входят в	1	1
302	искусство в том числе	1	1
303	отношений личности к своему	1	1
304	я есть высшая форма	1	1
305	чем это возможно в	1	1
306	художественные тексты способны запечатлевать	1	1
307	это еще одна вымышленная	1	1
308	собственно же художественное знание	1	1
309	всякое я уникально и	1	1
310	обладают некое событие индивидуальный	1	1
311	субъект и то или	1	1
312	последовательного наращивания текста наиболее	1	1
313	ее оболочек психологии характера	1	1
314	коем случае не следует	1	1
315	в своих героях воображая	1	1
316	любая личность является таким	1	1
317	к ролевому сверх-я сверхличная	1	1
318	собственно говоря и состоит	2	1
319	наоборот созерцающий становится эстетическим	1	1
320	все прочие обобщения могущие	1	1
321	глубже зачерпнуть тем общее	1	1
322	карнавал переживаемый в одиночку	1	1
323	и души личности более	1	1
324	нельзя не сделав хуже	1	1
325	не только целостность тела	1	1
326	наиболее очевидная граница между	1	1
327	рассказ о счастье существования	1	1
328	такие и что ж	1	1
329	так и не наступает	1	1
330	же художественное знание по	1	1
331	счастье существования предметом такого	1	1
332	в присутствии эстетического субъекта	1	1
333	и одновременно универсально родственно	1	1
334	это какое-то утверждение о	1	1
335	целостность тела вещи но	1	1
336	то субъект и объект	1	1
337	внутреннего личностного присутствия во	1	1
338	не разложимое а в	1	1
339	о счастье существования предметом	1	1
340	и к жизненно смежному	1	1
341	объект логический субъект и	1	1
342	что достоевский описывал себя	1	1
343	художественного восприятия все прочие	1	1
344	есть рассказ о счастье	1	1
345	неизбыточность явлений между тем	1	1
346	субъективную предпосылку эстетического отношения	1	1
347	но прежде всего основные	1	1
348	самые разнообразные в частности	1	1
349	иметь место в произведении	1	1
350	никакому логическому познанию тайна	1	1
351	что из нас самих	1	1
352	только мы родственные ему	1	1
353	универсальнее вы говорите писал	1	1
354	том числе и трагическое	1	1
355	политические входят в состав	1	1
356	произведении искусства но факультативные	1	1
357	стержень художественного восприятия все	1	1
358	художественного содержания лишь в	1	1
359	всем потому что из	1	1
360	тела вещи но и	1	1
361	и нераздельными его полюсами	1	1
362	в произведении искусства но	1	1
363	словами гегеля духовная ценность	1	1
364	себя в своих героях	1	1
365	характера социального поведения в	1	1
366	приобщение к знанию такого	1	1
367	самоопределение к ролевому сверх-я	1	1
368	уплотнение воображаемого мира вокруг	1	1
369	место в произведении искусства	1	1
370	все люди такие и	1	1
371	оболочек психологии характера социального	1	1
372	изначально владеет сотворивший ее	1	1
373	не было и не	1	1
374	в состав художественного содержания	1	1
375	родственные ему люди но	1	1
376	тексты способны запечатлевать самые	1	1
377	внутреннего я ядра личности	1	1
378	точка пересечения трех фундаментальных	1	1
379	о жизни по всеохватывающей	1	1
380	что даже в этих	1	1
381	логический субъект и то	1	1
382	то же время узкое	1	1
383	ценностного центра этого мира	1	1
384	то же время они	1	1
385	преимуществу внешнюю полноту и	1	1
386	возможно в обыденной внехудожественной	1	1
387	результат тот что даже	1	1
388	того личность как внутреннее	1	1
389	себя свою душу чем	1	1
390	в химическом соединении с	1	1
391	чище и прозрачнее чем	1	1
392	в таком случае это	1	1
393	действительности приобщение к знанию	1	1
394	наращивания текста наиболее очевидная	1	1
395	в этих исключительных лицах	1	1
396	и жизни однако все	1	1
397	дает ему известную цельность	1	1
398	личность является таким я-в-мире	1	1
399	типа как письмо дневниковая	1	1
400	предельную меру обобщения личностного	1	1
401	имеем в виду не	1	1
402	все они для искусства	1	1
403	лишь в химическом соединении	1	1
404	более того личность как	1	1
405	а не ее оболочек	1	1
406	шеллингу чем произведение оригинальнее	1	1
407	это интересно всем потому	1	1
408	прибавить ни убавить ни	1	1
409	к своему собственному я	1	1
410	ни прибавить ни убавить	1	1
411	духовный опыт внутреннего личностного	1	1
412	жизни по всеохватывающей своей	1	1
413	социального поведения в принципе	1	1
414	его полюсами предмет созерцания	1	1
415	героя как ценностного центра	1	1
