1	в то же время	4	2
2	бы то ни было	2	2
3	о которой мы говорили	1	2
4	до сих пор не	1	2
5	в более позднее время	1	1
6	в самом деле ведь	1	1
7	которой мы говорили выше	1	1
8	что в данном случае	1	1
9	нет и не может	1	1
10	только с точки зрения	1	1
11	потому не может служить	1	1
12	но мы знаем что	2	1
13	одной и той же	3	1
14	в целом ряде других	1	1
15	в основе их лежит	1	1
16	с точки зрения настоящего	1	1
17	то направление в котором	1	1
18	и не может быть	2	1
19	в самом деле если	1	1
20	а может быть и	1	1
