1	так же как и	1	4
2	заключается в том что	1	4
3	в то время как	3	4
4	все более и более	1	2
5	одно и то же	4	2
6	между тем и другим	1	2
7	то время как в	1	2
8	и с точки зрения	1	1
9	и в то же	1	1
10	точно так же как	1	1
11	это как мы уже	1	1
12	приводит к тому что	1	1
13	и то же время	1	1
14	в одно и то	1	1
15	о том что в	1	1
16	бы и не быть	1	1
17	с одной стороны и	1	1
18	существу с точки зрения	1	1
19	или по крайней мере	2	1
20	в то же время	3	1
21	говорить о том что	1	1
22	это одно и то	1	1
23	в том что он	1	1
