1	в то же время	5	5
2	одно и то же	1	3
3	не следует смешивать с	1	3
4	имеем в виду не	1	3
5	в той или иной	1	2
6	приводит к тому что	1	2
7	духовной жизни личности и	1	1
8	с этой точки зрения	1	1
9	и в то же	3	1
10	в том или ином	1	1
11	есть в конечном счете	1	1
12	том или ином отношении	1	1
13	как это происходит в	1	1
14	одном и том же	2	1
15	той или иной мере	1	1
16	в одном и том	1	1
17	следует иметь в виду	1	1
18	и по отношению к	1	1
19	в том отношении что	2	1
20	как один из видов	1	1
21	не может быть и	1	1
22	в том числе и	2	1
23	мы имеем дело с	1	1
