1	в такой же мере	1	3
2	может быть сведено к	2	2
3	одно и то же	1	2
4	одной и той же	1	2
5	в основе которого лежит	1	2
6	с этой точки зрения	1	1
7	же мере как и	1	1
8	в отличие от элементов	1	1
9	в собственном смысле слова	1	1
10	и та и другая	1	1
11	истинном значении этого слова	1	1
12	том виде в каком	1	1
13	такой же мере как	1	1
14	в то же самое	2	1
15	в то же время	6	1
16	для того чтобы быть	1	1
17	то же самое время	2	1
18	во всех своих частях	1	1
19	из того что в	2	1
20	в том виде в	1	1
21	в том что он	2	1
22	так как если бы	1	1
23	или во всяком случае	1	1
24	в том числе и	1	1
