1	ни в каком случае	2	4
2	одно и то же	3	4
3	имеет ничего общего с	1	3
4	не имеет ничего общего	3	3
5	если иметь в виду	1	2
6	в каком случае не	1	2
7	или по крайней мере	4	2
8	д и т д	4	2
9	и то и другое	1	2
10	и т д и	4	2
11	т д и т	4	2
12	миф не есть ни	1	2
13	не говорит ни о	1	2
14	не имеет никакого отношения	1	1
15	что они вовсе не	1	1
16	сам по себе с	1	1
17	и т д в	1	1
18	бы она ни была	2	1
19	ясно что смысл вещи	1	1
20	это не значит что	1	1
21	только и состоит из	1	1
22	взятая в чистом виде	1	1
23	как бы она ни	2	1
24	и тем не менее	3	1
25	той или иной теории	1	1
26	по одному тому что	1	1
27	с той или другой	4	1
28	уже по одному тому	1	1
29	том или ином отношении	1	1
30	вовсе не есть ни	1	1
31	ни в чем не	2	1
32	его не просто как	1	1
33	на самом же деле	4	1
34	само по себе не	1	1
35	есть нечто отличное от	1	1
36	на какую-то другую действительность	1	1
37	сам по себе и	1	1
38	когда мы говорим что	1	1
39	сама по себе а	2	1
40	т д все это	1	1
41	не было бы в	1	1
42	убеждаемся в том что	1	1
43	с той или иной	1	1
44	и т д все	1	1
45	не содержат в себе	1	1
46	это и значит что	1	1
47	и по сравнению с	1	1
48	мы убеждаемся в том	1	1
49	имеет никакого отношения к	1	1
50	в каком случае нельзя	1	1
51	то это значит что	2	1
52	дело в том что	2	1
53	нужды ни в каком	1	1
54	не что иное как	4	1
55	есть символ второй степени	1	1
56	в то время как	4	1
57	есть не что иное	4	1
58	нет нужды ни в	1	1
59	не сама по себе	2	1
60	чего не было бы	1	1
61	и то же и	2	1
62	по крайней мере в	1	1
63	такого чего не было	1	1
64	случае нельзя сказать что	1	1
65	сама по себе она	1	1
