N	4gram	Tiupa_Narr_1	DiskursI
401	на свой опыт жизни	1	1
402	же сказания или притчи	1	1
403	этом и сам текст	1	1
404	включая разные формы скрытой	1	1
405	окажется неадекватным субъект объект	1	1
406	состоит в придании истории	1	1
407	становления и развития самоопределяющегося	1	1
408	быть субъектом ролевого действия	1	1
409	существованию вследствие которого он	1	1
410	к самому герою жизнеописания	1	1
411	в первую очередь по	1	1
412	экзистенциальный опыт присутствия в	1	1
413	себя в другом и	1	1
414	первую очередь по отношению	1	1
415	дает позвоночника роману человек	1	1
416	к своему герою определяемое	1	1
417	совершенно иной конкретной ценностно-смысловой	1	1
418	дискурса принципиальное различие между	1	1
419	и не быть субъектом	1	1
420	напряжении событийного ряда возбуждающем	1	1
421	беседы автора с читателем	1	1
422	преодолевая их внутреннюю обособленность	1	1
423	была впервые освоена в	1	1
424	свой опыт жизни а	1	1
425	излагаемой жизни как исполненной	1	1
426	отношению к самому герою	1	1
427	к позиции изобразителя жизни	1	1
428	рассеянной чужой речи и	1	1
429	полноценная биография возможна только	1	1
430	ошибка оговорка где слово	1	1
431	нормативное самоотождествление с человеком	1	1
432	которыми устанавливаются отношения ценностно-смысловой	1	1
433	авторитетное слово там же	1	1
434	мы имеем дело не	1	1
435	примеряя ее содержание к	1	1
436	ни притча не знают	1	1
437	как бы непосредственного присутствия	1	1
438	включает в себя и	1	1
439	языка и возможность иной	1	1
440	к реальному человеческому существованию	1	1
441	анекдот ни притча не	1	1
442	границами между вещами и	1	1
443	сводится к этим моментам	1	1
444	чувства юмора умения отрешиться	1	1
445	сам текст анекдота выбор	1	1
446	неадекватным субъект объект и	1	1
447	необходимый фон романного видения	1	1
448	бы непосредственного присутствия рассказчика	1	1
449	иных пространственно-временных масштабов и	1	1
450	недопустимая в сказании или	1	1
451	ними здесь невозможно притчевое	1	1
452	вполне самобытно но и	1	1
453	иной конкретной ценностно-смысловой картины	1	1
454	чего не требует анекдот	1	1
455	слова манифестирующего двоякий жизненный	1	1
456	другого в себе ему	1	1
457	читателем к иллюзии живого	1	1
458	может быть сведена к	1	1
459	проектировать свою жизненную позицию	1	1
460	того требует авторитетное слово	1	1
461	другом и другого в	1	1
462	анекдот но без благоговейного	1	1
463	опыт чужой жизненной позиции	1	1
464	оговорка где слово деритуализовано	1	1
465	обладать собственным смыслом ни	1	1
466	выводится в просторную сферу	1	1
