N	4gram	Bakhtin_Pr_2	Problemy
446	рады больше дескать спокойствия	1	1
447	изъяснения но и представляя	1	1
448	само по себе но	1	1
449	плане в то время	1	1
450	сознаний мир сопряженных смысловых	1	1
451	вечной человеческой природой самосохранением	1	1
452	человеке для него мысль	1	1
453	представителями биографического романа зато	1	1
454	народу новейшую философию среды	1	1
455	вывод превращающие свой материал	1	1
456	выше их имеет закон	1	1
457	сюжет в этом смысле	1	1
458	достоевский не умеет и	1	1
459	он этих даров пока	1	1
460	вместе с достоевским григорович	1	1
461	умеет и не хочет	1	1
462	не был использован достоевским	1	1
463	ограничил бы авантюрные возможности	1	1
464	черта творчества достоевского стремление	1	1
465	недоверие к убеждениям и	1	1
466	постановляется на пьедестал будущий	1	1
467	всякой уже наличной действительности	1	1
468	то что есть герой	1	1
469	а как отца с	1	1
470	по романтическому принципу возвышенное	1	1
471	сюжетом же завершаются их	1	1
472	приключений который не был	1	1
473	достоевского в своих письмах	1	1
474	а за всеми вместо	1	1
475	социальные биографические он развивается	1	1
476	романа вводя трущобы каторги	1	1
477	трущобы каторги и больницы	1	1
478	ее предметные вершки достоевский	1	1
479	черту мелодрамы скитания аристократов	1	1
480	того важная что стоило	1	1
481	не обращался начинавший вместе	1	1
482	где же им до	1	1
483	наклонностям? что если именно	1	1
484	авантюрного романа вводя трущобы	1	1
485	говорит гроссман единственный раз	1	1
486	русский народ? позвольте слышится	1	1
487	две стороны по достоевскому	1	1
488	с авантюрным героем все	1	1
489	нигде не доказывает своих	1	1
490	в письме к страхову	1	1
491	его материал развертывается перед	1	1
492	все сознало если оно	1	1
493	свой материал в объект	1	1
494	жизненному сюжету жажда воплощения	1	1
495	и романа бульварного его	1	1
496	этом смысле не воплощен	1	1
497	и распределено все то	1	1
498	такого идеологического подхода перед	1	1
499	установок среди них он	1	1
500	судящего я к миру	1	1
501	на материале конкретных жизненно-бытовых	1	1
502	в объект невозможны в	1	1
503	созидаются сюжетом и сюжетом	1	1
504	чужим словам о нем	1	1
505	его придавили но ведь	1	1
506	людьми вполне понятно что	1	1
507	благоприятные условия для этого	1	1
508	а вы этому как	1	1
509	отца с сыном мужа	1	1
510	сюжет ограничил бы авантюрные	1	1
511	своих письмах он часто	1	1
512	обычная идеологическая установка видит	1	1
513	образов и человеческих отношений	1	1
514	зрения всякой уже наличной	1	1
515	положение так аристократ бульварного	1	1
516	как воплощенный и строго	1	1
517	с человеком а как	1	1
518	однако почти не обращался	1	1
519	какие функции он несет	1	1
520	с вами живая жизнь	1	1
521	завершающую жизненную форму а	1	1
522	субстанция а чистая функция	1	1
523	он не устанавливает авантюрный	1	1
524	пишет майкову идея соблазнила	1	1
525	с другом лишь на	1	1
526	достоевского имеется одно очень	1	1
527	человек авантюрного сюжета так	1	1
528	рассказ а этот материал	1	1
529	каторги и больницы действительно	1	1
530	быть ощущает что столько	1	1
531	соперника с соперником любящего	1	1
532	и товарищеское братание их	1	1
533	я к миру в	1	1
534	всех фактов как бы	1	1
535	трафаретами этого литературного жанра	1	1
536	и есть наилучший материал	1	1
537	спокойно мог пользоваться самыми	1	1
538	с гротеском и незаметным	1	1
539	идиоте он говорит в	1	1
540	но не нравственность нравственный	1	1
541	сверх того что и	1	1
542	сюжет сделаны из одного	1	1
543	я ее ужасно но	1	1
544	русский язык богат но	1	1
545	сознания достоевский в своем	1	1
546	подчиняется земной аксиоме земному	1	1
547	повествователями нет кажется ни	1	1
548	верность своим убеждениям и	1	1
549	этих даров пока следует	1	1
550	пролетарием благополучного мещанина с	1	1
551	прямо обвинили их в	1	1
552	даже трафаретами этого литературного	1	1
553	аристократом социально-семейного романа аристократ	1	1
554	или сословия своего семейного	1	1
555	в плане жития великого	1	1
556	последним идеологическим критерием для	1	1
557	развитие ответа ну вы	1	1
558	что если именно он-то	1	1
559	то стало быть это	1	1
560	всего того что могло	1	1
561	раскрыться и завершиться только	1	1
562	земной аксиоме земному закону	1	1
563	пьедестал будущий человек мы	1	1
564	у достоевского нет объективного	1	1
565	вы бы уж прямо	1	1
566	эскизными образцами для построения	1	1
567	своем художественном творчестве не	1	1
568	безнравственный христос ошибался доказано	1	1
569	себе вопрос верны ли	1	1
570	сюжету жажда воплощения мечтателя	1	1
571	все может случиться и	1	1
572	другими героями он не	1	1
573	в образе идеального человека	1	1
574	повседневности слить воедино по	1	1
575	нравственность верностью своим убеждениям	1	1
576	или темперамента такой определенный	1	1
577	романа приключений не раз	1	1
578	его жизни должно быть	1	1
579	романа ничего общего не	1	1
580	размещены сюжетом и могут	1	1
581	пойдет рассказ а этот	1	1
582	их и обратно их	1	1
583	исключительность в самую гущу	1	1
584	в человеке для него	1	1
585	единою вещью он соприкасается	1	1
586	залетела? ведь эти двенадцать	1	1
587	растянуто и не удалось	1	1
588	важная что стоило начинать	1	1
589	связей сюжет здесь никогда	1	1
590	в их духе и	1	1
591	всех сюжетных связей случайность	1	1
592	преступлений и массовых катастроф	1	1
593	через лабиринт голосов полуголосов	1	1
594	мы можем сказать что	2	1
595	для этого но тем	1	1
596	князю сокольскому и даже	1	1
597	он не только может	1	1
598	чужды его мышлению он	1	1
599	верностью своим убеждениям надо	1	1
600	вот на хохочет язвительный	1	1
601	опорою для автора многообразнейший	1	1
602	понятно что ни идеологический	1	1
603	в единственном а во	1	1
604	тех событий участниками которых	1	1
605	осознания и отчетливого выражения	1	1
606	важно не христианское исповедание	1	1
607	достоевский мог в чем-нибудь	1	1
608	в воздухе в идее	1	1
609	одного атрибута старого романа	1	1
610	его объективный мир должны	1	1
611	жизни человек в конкретном	1	1
612	слияние с ним а	1	1
613	связей какие могут завязать	1	1
614	введением авантюрного мира во-первых	1	1
615	их характером ни тем	1	1
616	ее предметный смысл ее	1	1
617	кто он у него	1	1
618	лишь реалист в высшем	1	1
619	смысле не воплощен и	1	1
620	объектов освещенный и упорядоченный	1	1
621	среды навязываете это как	1	1
622	нам важно не христианское	1	1
623	а именно верность авторитетному	1	1
624	он тоже не субстанция	1	1
625	его объект даны здесь	1	1
626	жаждой обладания чувственной любовью	1	1
627	стала проблема взаимоотношений этих	1	1
628	у меня христос спрашиваю	1	1
629	с героем не как	1	1
630	мысли ее предметный смысл	1	1
631	не согласиться с гроссманом	1	1
632	с западно-европейскими представителями биографического	1	1
633	материале других отвлеченных положений	1	1
634	наилучший материал в европе	1	1
635	пойдет рассказ всех фактов	1	1
636	другого истинного человека и	1	1
637	для осуществления его художественного	1	1
638	отношения сознающего и судящего	1	1
639	именно одежда облегающая героя	1	1
640	кроме одного социального благообразия	1	1
641	и сценических местах как	1	1
642	теорий образов и человеческих	1	1
643	о смирении народном пред	1	1
644	слышится мне чей-то язвительный	1	1
645	и к их обычной	1	1
646	т.п семейные жизненно-фабулические и	1	1
647	он не есть и	1	1
648	придавили но ведь он	1	1
649	он воспринимает не как	1	1
650	вечный и себе равный	1	1
651	связывает героя с героем	1	1
652	не был художественной самоцелью	1	1
653	общего не имеет с	1	1
654	установка по отношению к	1	1
655	и опорою для идеи	1	1
656	в загадке но чтоб	1	1
657	не как свою истинную	1	1
658	носитель собственной идеи не	1	1
659	лабиринт философских теорий образов	1	1
660	идеального образа как поступил	1	1
661	его творчества стала проблема	1	1
662	и главное не в	1	1
663	образ человека как установка	1	1
664	художественно и сжато первая	1	1
665	пьедестал будущий человек владычествующая	1	1
666	ее возможность должна быть	1	1
667	и тех событий участниками	1	1
668	великого грешника есть следующее	1	1
669	ставрогина она в равной	1	1
670	с достоевским григорович и	1	1
671	герой и какое место	1	1
672	он занимает в жизни	1	1
673	и оскорбленным которая чувствуется	1	1
674	достоевский однако почти не	1	1
675	определенной конкретной почве их	1	1
676	классы семейные отношения только	1	1
677	теоретическом смысле этого слова	1	1
678	опорою для идеи автор	1	1
679	втиснуть мысли художественно и	1	1
680	черта не одного только	1	1
681	неподчинении человека общему природному	1	1
682	между характером героя и	1	1
683	духе и в их	1	1
684	них сюжетность социально-психологического бытового	1	1
685	не менее и здесь	1	1
686	основою всех сюжетных связей	1	1
687	грешника есть следующее очень	1	1
688	не за роман а	1	1
689	их с общественными подонками	1	1
690	образе идеального человека или	1	1
691	достоевского дан в освещении	1	1
692	идея соблазнила меня и	1	1
693	уж конечно почище догадки	1	1
694	честность русский язык богат	1	1
695	оценки сознания достоевский в	1	1
696	бы авантюрные возможности с	1	1
697	именно верность авторитетному образу	1	1
698	вопреки им авантюрное положение	1	1
699	что идея является обычным	1	1
700	героев достоевского это черта	1	1
701	и жаждут воплотиться приобщиться	1	1
702	и среди них строит	1	1
703	это лишь честность русский	1	1
704	сжигание еретиков есть поступок	1	1
705	сходство но оно достаточно	1	1
706	зрения это отчасти славянофильский	1	1
707	рожденного от идеи человека	1	1
708	никаких внесюжетных связей с	1	1
709	тон автора в плане	1	1
710	наконец в этом сказалась	1	1
711	и князю валковскому и	1	1
712	тут сверх всего этого	1	1
713	построения его интриг он	1	1
714	собою а за своими	1	1
715	как завершающую жизненную форму	1	1
716	нельзя сказать кто он	1	1
717	слушать испытывать установки одни	1	1
718	те живые формы его	1	1
719	нет кажется ни одного	1	1
720	положение в котором оказался	1	1
721	не умеет и не	1	1
722	и неожиданных состояний мы	1	1
723	и могут существенно сойтись	1	1
724	автор оказывается перед героем	1	1
725	в разгаре спешной работы	1	1
726	любовью определяют авантюрный сюжет	1	1
727	сплошь из мужиков сидят	1	1
728	бытового семейного и биографического	1	1
729	материал в объект невозможны	1	1
730	если именно он-то и	1	1
731	а за своими героями	1	1
732	на чужой голос чужое	1	1
733	автора многообразнейший мир вещей	1	1
734	то время как обычная	1	1
735	как установка среди других	1	1
736	должна быть перед глазами	1	1
737	своего возраста своих жизненно-биографических	1	1
738	и положений в конце	1	1
739	мечтателя рожденного от идеи	1	1
740	которым достоевский однако почти	1	1
741	сходство и про авантюрного	1	1
742	преступления убегает от врагов	1	1
743	себя мысль действительно утешительная	1	1
744	может быть ощущает что	1	1
745	себе никогда не была	1	1
746	нечего дорожить но и	1	1
747	целом его художественного замысла?	1	1
748	опять-таки русский народ русский	1	1
749	установку преступника адвоката присяжного	1	1
750	воспроизвел говорит гроссман единственный	1	1
751	расположении материала подбором того	1	1
752	которая чувствуется за всеми	1	1
753	аристократ бульварного романа ничего	1	1
754	вы говорите что нравственно	1	1
755	будто и рады больше	1	1
756	укладывается в одно это	1	1
757	и героем достоевского имеется	1	1
758	социально-семейного романа аристократ бульварного	1	1
759	подчеркивает исключительную важность для	1	1
760	чужих слов чужих жестов	1	1
761	того что и получил-то	1	1
762	одна христос но тут	1	1
763	герой приобщается сюжету как	1	1
764	конкретном и непроницаемом облачении	1	1
765	и обратно их тело	1	1
766	сколько-нибудь существенных внесюжетных связей	1	1
767	сюжет не может поэтому	1	1
768	захватывающий повествовательный интерес облегчавший	1	1
769	только может быть ощущает	1	1
770	и среди них беспрерывно	1	1
771	быть последнею связью в	1	1
772	и сюжетом же завершаются	1	1
773	голоса чужие точки зрения	1	1
774	ни с единою вещью	1	1
775	литературного жанра в разгаре	1	1
776	строит свою установку конечно	1	1
777	предпочитает остаться с ошибкой	1	1
778	смертный грех почитает в	1	1
779	он пользовался даже трафаретами	1	1
780	идеологическим критерием для достоевского	1	1
781	ходячими типами авантюрных фабул	1	1
782	никогда не может стать	1	1
783	своему по своим положим	1	1
784	самую гущу повседневности слить	1	1
785	кажется народу новейшую философию	1	1
786	установки одни сочетать другие	1	1
787	на полуголосах и на	1	1
788	мужиков сидят и каждый	1	1
789	местах как бы вовсе	1	1
790	только ставрогина она в	1	1
791	и мир как его	1	1
792	установки и среди них	1	1
793	сухость рассказа иногда до	1	1
794	и не может быть	1	1
795	выходит из них выше	1	1
796	но откудова же вы	1	1
797	завершиться только в сюжете	1	1
798	от его живых уст	1	1
799	говорите что нравственно лишь	1	1
800	и не объяснять словами	1	1
801	поэтому быть последнею связью	1	1
802	а в идеальном авторитетном	1	1
803	иной раз сплошь из	1	1
804	монологической функции искание истины	1	1
805	невозможны в этом мире	1	1
806	так значит сжигание еретиков	1	1
807	это положение в котором	1	1
808	герои размещены сюжетом и	1	1
809	и князю сокольскому и	1	1
810	функции он несет в	1	1
811	наш народ особенно наклонен	1	1
812	развертывается не мир объектов	1	1
813	это жгучее чувство говорит	1	1
814	всех разновидностей оставил глубокий	1	1
815	красный цвет сожигающего еретиков	1	1
816	границ фантастического нельзя не	1	1
817	быть это мое я	1	1
818	образы и явления обыденной	1	1
819	миру униженных и оскорбленных	1	1
820	это очень внешнее и	1	1
821	не объяснять словами всю	1	1
822	они могут стать не	1	1
823	иногда до жиль-блаза на	1	1
824	не за одним а	1	1
825	жизни должно быть глубокое	1	1
826	авантюрным героем все может	1	1
827	подбором того о чем	1	1
828	не только может быть	1	1
829	стою о бесах он	1	1
830	слово и ее возможность	1	1
831	не одного только ставрогина	1	1
832	с ошибкой но со	1	1
833	и не предопределен своим	1	1
834	повседневным если авторы авантюрного	1	1
835	страхову в романе много	1	1
836	мелодрамы скитания аристократов по	1	1
837	что стоило начинать даже	1	1
838	по себе лишена определяющего	1	1
839	жестов он нигде не	1	1
840	одно очень существенное для	1	1
841	авантюрный герой так же	1	1
842	многообразнейший мир вещей и	1	1
843	мысли а от установки	1	1
844	ее в загадке но	1	1
845	одном романе во-вторых в	1	1
846	сойтись друг с другом	1	1
847	установок путь его лежит	1	1
848	человеческую установку преступника адвоката	1	1
849	тоне автор как носитель	1	1
850	гротеском и незаметным претворением	1	1
851	образом как и герой	1	1
852	статьи достоевского всюду его	1	1
853	ничего общего не имеет	1	1
854	загадке но чтоб читатель	1	1
855	поэтому менее всего достоевский	1	1
856	а как положение так	1	1
857	одним а за всеми	1	1
858	могут стать не предопределен	1	1
859	чтоб читатель всегда видел	1	1
860	эта идеальная установка истинное	1	1
861	облегающая героя одежда которую	1	1
862	него нет твердых социально-типических	1	1
863	социально-классовые отношения являются твердою	1	1
864	быть перед глазами но	1	1
865	предметный смысл ее предметные	1	1
866	одежда облегающая героя одежда	1	1
867	слово среди других слов	1	1
868	кавелину достоевский в своей	1	1
869	другом лишь на определенной	1	1
870	объект даны здесь не	1	1
871	сюжете авантюрный сюжет напротив	1	1
872	формулы и категории а	1	1
873	бы уж прямо обвинили	1	1
874	был использован достоевским помимо	1	1
875	и чувствует сверх того	1	1
876	он всем может стать	1	1
877	если авторы авантюрного романа	1	1
878	не могут заключать между	1	1
879	и человеческих отношений заключенных	1	1
880	проверка же их одна	1	1
881	и фельетонными повествователями нет	1	1
882	истины не как вывода	1	1
883	он говорит в письме	1	1
884	по себе никогда не	1	1
885	исключает из своей жизни	1	1
886	я останусь с ошибкой	1	1
887	перед героем перед его	1	1
888	житие вещь до того	1	1
889	он оставил не за	1	1
