N	4gram	Tiupa_Hudo_2	Narrotol
1	состоит в том что	2	4
2	в то же время	4	3
3	мы имеем дело с	1	2
4	к тому что он	2	2
5	бы с такою радостью	2	2
6	ушел бы с такою	2	2
7	к тому же в	1	2
8	точно так же как	1	2
9	которому все не ндравится	1	1
10	к тому характеру весьма	1	1
11	архиерею с сисоем легко	1	1
12	фразой повествователя завершающего разговор	1	1
13	хотелось одного поскорее бы	1	1
14	скованности псевдоличным существованием вслед	1	1
15	вовлекается в это движение	1	1
16	екатерина ивановна возвращается домой	1	1
17	что можно сказать про	1	1
18	их одиннадцать душ и	1	1
19	я беру именно то	1	1
20	катиным видением мира и	1	1
21	пережил их одиннадцать душ	1	1
22	и он свободен теперь	1	1
23	между настоящим временем и	1	1
24	за собой и читателя	1	1
25	на веселую речь марии	1	1
26	слова рассказчика за рамки	1	1
27	резонанс возникающий между катиным	1	1
28	реализовать внутренний потенциал ее	1	1
29	словно концентрируется в глазах	1	1
30	в ее положении какой	1	1
31	и уже начиналась новая	1	1
32	трудно было понять [...]	1	1
33	которой он мечтал каждый	1	1
34	отчужденно как о некой	1	1
35	[...] а потом когда	1	1
36	герой пытается выстроить в	1	1
37	уход слова рассказчика за	1	1
38	повествовательной функции ушел бы	1	1
39	за человек в разговоре	1	1
40	на свой пустой двор	1	1
41	смерть постижима лишь для	1	1
42	пока еще лишена ролевой	1	1
43	самую суть проблемной ситуации	1	1
44	время когда его постригли	1	1
45	давно стерлось в памяти	1	1
46	известном смысле можно сказать	1	1
47	люди с тайной и	1	1
48	уменьшаются сморщиваясь и лишь	1	1
49	библейская аллюзия согласно евангельской	1	1
50	они сердитые выпуклые как	1	1
51	же пока еще лишена	1	1
52	большие глаза марии тимофеевна	1	1
53	верю ли я лично	1	1
54	верует ли в бога	1	1
55	жизнь чистая благородная теплая	1	1
56	что я сам создал	1	1
57	а между тем ей	1	1
58	он свободен теперь как	1	1
59	увлечение оленьки сменяется другим	1	1
60	что человек есть творец	1	1
61	жизни других эту тайну	1	1
62	старцева перестало беспокойно биться	1	1
63	на него приходится искать	1	1
64	не видит внутренним духовным	1	1
65	во сне свой пустой	1	1
66	то и в жизни	1	1
67	том счастье какого никогда	1	1
68	слита с радостью бытия	1	1
69	существованием вслед за этим	1	1
70	стоит читателю задать себе	1	1
71	дядечка и голубчик приведя	1	1
72	володя решил заговорить желая	1	1
73	всю свою жизнь находился	1	1
74	счастья и теперь я	1	1
75	актуальна в этом детском	1	1
76	с нею впервые будто	1	1
77	координату чеховского антииерархического мира	1	1
78	я ей неизменно хотелось	1	1
79	прочитано как символ бессмертия	1	1
80	на пороге его смерти	1	1
81	девочки неуместно произнесенную за	1	1
82	свете став женой пустовалова	1	1
83	ее подавленного я ей	1	1
84	будущего она не могла	1	1
85	выпуклые как у рака	1	1
86	во взгляде только по	1	1
87	ему становится внятной и	1	1
88	одинокого накопительства то и	1	1
89	голосом отвечал ну их	1	1
90	характерности ее индивидуальность непосредственно	1	1
91	сокровенную личность главного героя	1	1
92	какой бы это был	1	1
93	себе самом верю ли	1	1
94	и опять она думала	1	1
95	уже давно стерлось в	1	1
96	которая не в ладу	1	1
97	билось сердце сердцебиение оказывается	1	1
98	видит внутренним духовным личностным	1	1
99	да катя не понимают	1	1
100	прошедшим оставляет место для	1	1
101	в то что человек	1	1
102	в чужой дом назначаемый	1	1
103	самое важное и нужное	1	1
104	не наделен личной тайной	1	1
105	знающего личной тайны в	1	1
106	ритмическая тенденция ширящегося разрастающегося	1	1
107	его внутренней заданности характер	1	1
108	возникающий между катиным видением	1	1
109	в самом деле не	1	1
110	биться сердце когда же	1	1
111	она мельком бросила выходя	1	1
112	мира и таящимся в	1	1
113	весело светилось [...] в	1	1
114	в рассказе на подводе	1	1
115	дьяконицей чем матерью а	1	1
116	за пределы своего внешнего	1	1
117	по романам и о	1	1
118	безучастно на свой пустой	1	1
119	о своем личном прошлом	1	1
120	по необыкновенно добрым глазам	1	1
121	же люди что были	1	1
122	архиереях и пережил их	1	1
123	делах о здешних порядках	1	1
124	двор [...] а потом	1	1
125	дном возникает библейская аллюзия	1	1
126	покоем и личным счастьем	1	1
127	сисой олицетворяет ту безликую	1	1
128	речь марии тимофеевны никогда	1	1
129	а для личности в	1	1
130	будто он прямо родился	1	1
131	его сморщенное лицо и	1	1
132	внешнего инобытия не в	1	1
133	человеческой мысли о детях	1	1
134	не актуальна в этом	1	1
135	но чего не видит	1	1
136	знакомимся с нею впервые	1	1
137	зрелого чеховского творчества футлярный	1	1
138	ночь шла спать и	1	1
139	верили несогласованность между настоящим	1	1
140	большими только увидев его	1	1
141	без церемонии не обращая	1	1
142	персонаж рассказа который не	1	1
143	него приходится искать в	1	1
144	поэтическую любовь которая была	1	1
145	похоже было как будто	1	1
146	кати нос был вздернутый	1	1
147	не мигая глядела на	1	1
148	о делах о здешних	1	1
149	картину того на что	1	1
150	театрах этих что хорошего?	1	1
151	тимофеевны никогда не смеющийся	1	1
152	словно мы знакомимся с	1	1
153	героини не пробудившихся от	1	1
154	ценностную координату чеховского антииерархического	1	1
155	страдает и сам преосвященный	1	1
156	в кругу монастырского быта	1	1
157	может быть прочитано как	1	1
158	за рамки своей повествовательной	1	1
159	есть сосредоточенное нравственное усилие	1	1
160	больной в темной комнате	1	1
161	с тайной и люди	1	1
162	ощутить живую сокровенную личность	1	1
163	о том счастье какого	1	1
164	происходит смерть постижима лишь	1	1
165	особенный мир где в	1	1
166	смирно другую реплику девочки	1	1
167	персонажей зрелого чеховского творчества	1	1
168	катя напоминает мальчика павлушу	1	1
169	и среди мыслей и	1	1
170	лишена ролевой характерности ее	1	1
171	начинала рассказывать говорила и	1	1
172	тимофеевна забывает что перед	1	1
173	томящая его любовь ему	1	1
174	такая же пустота как	1	1
175	как-то реализовать внутренний потенциал	1	1
176	рассказа приобретает характер интерсубъективной	1	1
177	было видно что у	1	1
178	самым личная память читателя	1	1
179	на что учительница смотрит	1	1
180	глядела на него весело	1	1
181	это был тяжелый вздорный	1	1
182	иссякла и уже начиналась	1	1
183	васильевны к тому характеру	1	1
184	постольку поскольку их связывает	1	1
185	которое могло бы как-то	1	1
186	другую реплику девочки неуместно	1	1
187	чего не видит внутренним	1	1
188	тому же в аспекте	1	1
189	поскольку их связывает внешнеролевой	1	1
190	ндравится сисой олицетворяет ту	1	1
191	принимает участия в общем	1	1
192	на него с изумлением	1	1
193	о красивых глазах о	1	1
194	мальчика павлушу которого в	1	1
195	когда же екатерина ивановна	1	1
196	недели богослужения рядом деталей	1	1
197	тотчас после заученного обращения	1	1
198	своих учениках об экзамене	1	1
199	утра выехали из города	1	1
200	же екатерина ивановна возвращается	1	1
201	в жизни других эту	1	1
202	между тем ей хотелось	1	1
203	и видела во сне	1	1
204	реальности межличностного контакта в	1	1
205	содержит полноударных слов вторая	1	1
206	строю мыслей героини не	1	1
207	несогласованность между настоящим временем	1	1
208	это была мать глаза	1	1
209	только сам умирающий преосвященный	1	1
210	интерсубъективной духовной реальности межличностного	1	1
211	чему способствует помимо нагнетания	1	1
212	силу повествования первая фраза	1	1
213	выговорить ни слова мать	1	1
214	в непосредственности ее я	1	1
215	речи повествователя может быть	1	1
216	перестало беспокойно биться сердце	1	1
217	новая нервная сознательная жизнь	1	1
218	был вздернутый глаза хитрые	1	1
219	подлецы подумал никитин и	1	1
220	может выговорить ни слова	1	1
221	легко но по разным	1	1
222	в относительно раннем рассказе	1	1
223	радостью бытия именно на	1	1
224	память читателя оказывается противопоставленной	1	1
225	наступала ночь шла спать	1	1
226	ней в других на	1	1
227	межличностного контакта в то	1	1
228	чашку с уксусом для	1	1
229	единственной кто видит в	1	1
230	говорит в театрах этих	1	1
231	держат себя вольно в	1	1
232	тайна личного бытия на	1	1
233	жизнь которая не в	1	1
234	видела во сне свой	1	1
235	несмотря на свой тихий	1	1
236	смерть никогда не актуальна	1	1
237	характеристике персонажей произведения у	1	1
238	же будут каждый год	1	1
239	не в ладу с	1	1
240	теперь я беру именно	1	1
241	как бы желая разгадать	1	1
242	личного бытия на кладбище	1	1
243	радостью но героиня не	1	1
244	об училищном совете а	1	1
245	не думал он об	1	1
246	другая странность состоит в	1	1
247	его матери мария наконец	1	1
248	старуха которая живет теперь	1	1
249	футлярный характер беликова не	1	1
250	безликостью вполне отвечает строю	1	1
251	перед нами одно из	1	1
252	и катю непонимание смерти	1	1
253	тайной и люди без	1	1
254	напоминает мальчика павлушу которого	1	1
255	вздернутый глаза хитрые личность	1	1
256	преосвященный да катя не	1	1
257	ними ему легко но	1	1
258	необыкновенно добрым глазам робкому	1	1
259	бы вместил в себя	1	1
260	разговоре с ним девочка	1	1
261	вместил в себя ту	1	1
262	художественной сверхзадачи чехова которая	1	1
263	и ей не все	1	1
264	после заученного обращения ваше	1	1
265	доля великой нравственной истины	1	1
266	повторяет рассмеявшись так брат	1	1
267	в себе но и	1	1
268	лицо и все его	1	1
269	постригли похоже было как	1	1
270	первый раз в жизни	1	1
271	ли я лично в	1	1
272	заученного обращения ваше преосвященство	1	1
273	высокая колокольня вся залитая	1	1
274	тем самым личная память	1	1
275	движение которое могло бы	1	1
276	присутствует доля великой нравственной	1	1
277	полноударных слов вторая третья	1	1
278	ей хотелось думать о	1	1
279	читателя чему способствует помимо	1	1
280	без тайны так и	1	1
281	не случайно в ответ	1	1
282	свою жизнь находился при	1	1
283	любила своего папашу который	1	1
284	бы желая разгадать что	1	1
285	среди мыслей и в	1	1
286	в театрах этих что	1	1
287	внутренним духовным личностным зрением	1	1
288	он первый раз в	1	1
289	к той или иной	1	1
290	было понять [...] любит	1	1
291	сознательная жизнь которая не	1	1
292	ну их где уж	1	1
293	замигал глазами и опять	1	1
294	будущем ждал архиерейский сан	1	1
295	и читатель вместе со	1	1
296	доносившиеся из сада тиволи	1	1
297	чайную чашку с уксусом	1	1
298	только в магнитном поле	1	1
299	в душе преосвященного петра	1	1
300	архиерей долго не может	1	1
301	вместе со всеми уже	1	1
302	в памяти время когда	1	1
303	личностному сближению девочка же	1	1
304	в театре самое замечательное	1	1
305	сморщиваясь и лишь глаза	1	1
306	детей которые глядят на	1	1
307	самом верю ли я	1	1
308	порывает с действительной жизнью	1	1
309	роль в характеристике персонажей	1	1
310	но по разным причинам	1	1
311	сердце у нее была	1	1
312	и пережил их одиннадцать	1	1
313	на свой тихий скромный	1	1
314	на свете став женой	1	1
315	могиле чувствуется присутствие тайны	1	1
316	потом когда наступала ночь	1	1
317	этим рассказчик разворачивает картину	1	1
318	после себя пепел одинокого	1	1
319	глядела она безучастно на	1	1
320	догадаться что это была	1	1
321	детским началом позволяет ощутить	1	1
322	рассказчик разворачивает картину того	1	1
323	и таящимся в душе	1	1
324	и все что можно	1	1
325	столь важный для подтекстовой	1	1
326	его любовь ему становится	1	1
327	ответ на веселую речь	1	1
328	ширящегося разрастающегося набирающего силу	1	1
329	счастье какого никогда не	1	1
330	и откуда они все	1	1
331	голубчик приведя в такое	1	1
332	видением мира и таящимся	1	1
333	марьи васильевны к тому	1	1
334	ему легко но по	1	1
335	ее я смерть никогда	1	1
336	столом архиерей и сам	1	1
337	кукине видевшая в театре	1	1
338	быть прочитано как символ	1	1
339	катя не мигая глядела	1	1
340	случайно в ответ на	1	1
341	внешнеролевой контакт поговорить с	1	1
342	новые какие-то особенные мысли	1	1
343	оставляя после себя пепел	1	1
344	с радостью бытия именно	1	1
345	и дело не только	1	1
346	отвечал ну их где	1	1
347	кладбище он первый раз	1	1
348	говорила и ей не	1	1
349	непонимание смерти только сам	1	1
350	с ним было легко	1	1
351	тайны в себе но	1	1
352	озабоченному взгляду который она	1	1
353	мы знакомимся с нею	1	1
354	которые глядят на него	1	1
355	жизнь есть сосредоточенное нравственное	1	1
356	не обращая внимания на	1	1
357	где в каждой могиле	1	1
358	сближению девочка же пока	1	1
359	других на противоположном безумие	1	1
360	непосредственностью катя напоминает мальчика	1	1
361	ей неизменно хотелось одного	1	1
362	другого будущего она не	1	1
363	о здешних порядках тогда	1	1
364	губой замигал глазами и	1	1
365	предоставленной самой себе не	1	1
366	возникает библейская аллюзия согласно	1	1
367	темной комнате в кресле	1	1
368	разрастающегося набирающего силу повествования	1	1
369	люди что были тогда	1	1
370	настолько что порывает с	1	1
371	и потому-то с ним	1	1
372	адекватные его внутренней заданности	1	1
373	сне свой пустой двор	1	1
374	о своих учениках об	1	1
375	временем и прошедшим оставляет	1	1
376	соборной человеческой мысли о	1	1
377	он мечтал каждый вечер	1	1
378	из сада тиволи казались	1	1
379	и лишь глаза становятся	1	1
380	начинается так у старцева	1	1
381	беликова не только не	1	1
382	самой себе не отыскивается	1	1
383	мечтал каждый вечер ложась	1	1
384	глазам робкому озабоченному взгляду	1	1
385	этом детском непонимании присутствует	1	1
386	рассказывать говорила и ей	1	1
387	не ндравится сисой олицетворяет	1	1
388	как у рака у	1	1
389	между уйти бы и	1	1
390	только увидев его сморщенное	1	1
391	ей не все верили	1	1
392	непонятно почему он монах	1	1
393	увлекает за собой и	1	1
394	в этих и иных	1	1
395	человека держат себя вольно	1	1
396	что порывает с действительной	1	1
397	нравственной истины о неуничтожимости	1	1
398	истины о неуничтожимости личности	1	1
399	способствует помимо нагнетания эпитетов	1	1
400	напряжение между уйти бы	1	1
401	ее прошлое ее настоящее	1	1
402	позднее охотно повторяет рассмеявшись	1	1
403	колокольня вся залитая светом	1	1
404	тайны когда же огонек	1	1
405	изумлением и страхом тычет	1	1
406	которым можно было бы	1	1
407	деталей именем его матери	1	1
408	свободен теперь как птица	1	1
409	герою архиерею с сисоем	1	1
410	я верю в то	1	1
411	употребления настоящего времени в	1	1
412	восьмилетняя катя и семидесятилетний	1	1
413	об этом и уже	1	1
414	быта от которого сисой	1	1
415	понимают что с ним	1	1
416	дело не только в	2	1
417	непонимании присутствует доля великой	1	1
418	пытается выстроить в своем	1	1
419	в рыжих волосах кати	1	1
420	верю в то что	1	1
421	вот и все что	1	1
422	на противоположном безумие коврина	1	1
423	фразой тут было ее	1	1
424	больше дьяконицей чем матерью	2	1
425	порядках тогда как в	1	1
426	то время как личностная	1	1
427	специально оговаривается словно мы	1	1
428	личность духовно прорывается за	1	1
429	у каких-то людей есть	1	1
430	жесте а во взгляде	1	1
431	и ответ на него	1	1
432	завершающего разговор о герое	1	1
433	человек в разговоре с	1	1
434	два человека держат себя	1	1
435	лицо и большие глаза	1	1
436	тычет во все двери	1	1
437	учениках об экзамене о	1	1
438	опять она думала о	1	1
439	было непонятно почему он	1	1
440	на нее обращен столь	1	1
441	информативной безликостью вполне отвечает	1	1
442	полная любви ласк веселья	1	1
443	пора к страстям господним	1	1
444	понятно в ее жизни	1	1
445	когда наступала ночь шла	1	1
446	умирающий преосвященный да катя	1	1
447	личная память читателя оказывается	1	1
448	приносит преосвященному чайную чашку	1	1
449	своего внешнего инобытия не	1	1
450	ним девочка тотчас после	1	1
451	самостоятельного отношения к себе	1	1
452	для натирания типично чеховская	1	1
453	не могло быть тайн	1	1
454	лишь глаза становятся большими	1	1
455	патетический уход слова рассказчика	1	1
456	каждый вечер ложась спать	1	1
457	героя живущего как раз	1	1
458	можно сказать про него	1	1
459	рядом деталей именем его	1	1
460	неуместностью в кругу монастырского	1	1
461	огонек личной тайны в	1	1
462	глядела на своего дядю	1	1
463	тимофеевна чувствовала себя больше	1	1
464	из комнаты можно было	1	1
465	в половине десятого утра	1	1
