1	в то же время	1	3
2	точно так же как	1	2
3	с этой точки зрения	1	2
4	ответ на этот вопрос	2	1
5	о том что в	1	1
6	потому что он не	1	1
7	если бы речь шла	1	1
8	приводит к тому что	1	1
9	речи с другой стороны	1	1
10	только для того чтобы	1	1
11	дело в том что	1	1
12	в то время как	4	1
13	находит свое выражение в	1	1
14	все более и более	2	1
15	в том что мы	1	1
16	заключается в том что	4	1
17	одной и той же	2	1
18	и пр и пр	1	1
19	одном и том же	1	1
20	и с другой стороны	1	1
21	не оставляет сомнений в	1	1
22	в одном и том	1	1
23	ничего принципиально нового в	1	1
24	которые хотя и не	1	1
25	но для того чтобы	1	1
