1	в то же время	7	5
2	в ее целом и	1	2
3	в следующей главе глава	1	2
4	один и тот же	1	2
5	в первый период развития	1	2
6	мы можем сказать что	1	2
7	мы увидим что в	1	1
8	начала и до конца	1	1
9	так и со стороны	2	1
10	в самом деле ведь	1	1
11	жизни данной социальной группы	1	1
12	и тем не менее	1	1
13	в одной из своих	1	1
14	нет и не может	2	1
15	сводится к тому чтобы	1	1
16	в настоящее время в	1	1
17	можно сделать вывод что	1	1
18	ведь мы уже знаем	1	1
19	в жизни и в	1	1
20	дело в том что	1	1
21	и не может быть	3	1
22	и не нуждается ни	2	1
23	и т д таким	1	1
24	не нуждается ни в	2	1
25	нуждается ни в каких	1	1
26	в процессе общения между	1	1
27	и в данном случае	1	1
28	что в данном случае	1	1
29	одной и той же	1	1
30	быть положен в основу	1	1
31	говорит о том что	1	1
32	и по отношению к	1	1
33	как по отношению к	1	1
34	во всяком случае в	2	1
35	т д таким образом	1	1
36	в самом деле что	1	1
37	в зависимости от того	1	1
