1	не трудно видеть что	1	5
2	в то же время	2	5
3	той мере в какой	5	4
4	не что иное как	1	4
5	в той мере в	5	4
6	и в самом деле	2	3
7	заключается в том что	2	2
8	одного и того же	2	2
9	состоит в том что	3	2
10	и т д все	1	2
11	только в применении к	1	2
12	с этой точки зрения	1	1
13	только в том чтобы	2	1
14	лингвисту во всяком случае	1	1
15	и т д словом	1	1
16	сводится лишь к тому	1	1
17	но с другой стороны	1	1
18	и не потому что	1	1
19	история литературы история искусств	1	1
20	вовсе не в том	1	1
21	в собственном смысле слова	1	1
22	трудно видеть что это	1	1
23	на почву культурной истории	1	1
24	можно было бы назвать	1	1
25	если можно говорить о	1	1
26	ответить на этот вопрос	1	1
27	одно и то же	1	1
28	в том-то и дело	1	1
29	т д все это	1	1
30	для того чтобы можно	1	1
31	и т д и	2	1
32	того чтобы можно было	1	1
33	для того чтобы быть	2	1
34	но во всяком случае	1	1
35	широком смысле этого термина	1	1
36	в том что не	1	1
37	уже само по себе	1	1
38	мы имеем в виду	1	1
39	в том чтобы выяснить	1	1
40	но в том-то и	1	1
41	но дело не в	1	1
42	что история языка в	1	1
43	точно так же как	1	1
44	в тех или иных	1	1
45	хотя бы и не	1	1
46	даже и тогда когда	1	1
47	его грамматическую систему и	1	1
48	том-то и дело что	1	1
49	по отношению к собственно	1	1
50	видеть что это есть	1	1
