1	дело в том что	1	4
2	бы то ни было	1	3
3	одно и то же	2	2
4	какая бы то ни	1	1
5	каковы бы они ни	1	1
6	на самом же деле	1	1
7	и с другой стороны	1	1
8	в какой степени не	1	1
9	каково бы оно ни	1	1
10	бы они ни были	1	1
11	не может находиться в	1	1
12	мы имеем в виду	1	1
13	имеем в виду не	1	1
14	в то время как	2	1
15	ни в какой степени	1	1
16	находит свое выражение в	1	1
17	но в то же	4	1
18	но и в истории	1	1
19	бы оно ни было	1	1
20	в то же время	12	1
21	быть более или менее	1	1
22	а между тем это	1	1
23	как мы уже сказали	2	1
