N	4gram	Tiupa_Narr_2	Hudozhes
1	в то же время	3	8
2	в бытовой уклад национально-исторической	1	2
3	бытовой уклад национально-исторической жизни	1	2
4	к тому что он	2	2
5	невежеству и недовольству жизнью	1	1
6	реализме стойко уверовавших в	1	1
7	включить мысли и воображения	1	1
8	тем не менее едва	1	1
9	здоровые сытые красивые люди	1	1
10	активность способна оказаться футляром	1	1
11	характера переменчиво выявляются в	1	1
12	персонажа прочно соединяется с	1	1
13	к окружающим ее лицам	1	1
14	этого внимания к чужому	1	1
15	литературе представляют собой понятия	1	1
16	этого характера переменчиво выявляются	1	1
17	поэтому же она терпит	1	1
18	отступает от лессинговой аксиомы	1	1
19	людей а не каждому	1	1
20	утихло отыскал свою вешалку	1	1
21	не факты осуществляются благодаря	1	1
22	человека ее личностная неполноценность	1	1
23	связи если бесхарактерные послушные	1	1
24	не я сам а	1	1
25	организовал систему персонажей иначе	1	1
26	нежности тишины и довольства	1	1
27	встречаемся в рассказе с	1	1
28	порой и возмущена ничто	1	1
29	класса а как к	1	1
30	мысль иначе движется нежели	1	1
31	культуры идеологии класса а	1	1
32	подлинным художником хотя и	1	1
33	читателя в самую суть	1	1
34	дамы с собачкой не	1	1
35	к себе и своей	1	1
36	умершая от родов анна	1	1
37	он уже смеялся над	1	1
38	с подлинным художником хотя	1	1
39	ли найдется хоть один	1	1
40	так или иначе вписанный	1	1
41	несомненно есть здоровые гуманистические	1	1
42	масштабе практический же итог	1	1
43	в обычно понималось воспроизведение	1	1
44	к обретенной социальной устроенности	1	1
45	прозрение которым он однако	1	1
46	и своего умения скрывать	1	1
47	своей противоречивой автономии под	1	1
48	личность в плане как	1	1
49	случайна ее манера разговаривать	1	1
50	обеспеченности к тому что	1	1
51	на реализме стойко уверовавших	1	1
52	должен обратиться к себе	1	1
53	увидеть в себе другого	1	1
54	внешней активностью делая окружающих	1	1
55	же обоснованы но изнутри	1	1
56	к чужому я поэтому	1	1
57	как показывает в я	1	1
58	реализм xix в направил	1	1
59	того современной писателю критике	1	1
60	представителю чего-то общего культуры	1	1
61	причина этого как раз	1	1
62	начале рассказа затем к	1	1
63	эпохи просматривался историзм ее	1	1
64	пустяках при этом вопреки	1	1
65	нее личность же индивидуальная	1	1
66	том смысле как мы	1	1
67	своего счастья преодолевший сиротство	1	1
68	не отгороженная от другой	1	1
69	в приданое к тому	1	1
70	о герое определяло его	1	1
71	м пришвин это не	1	1
72	вещах вплоть до повторений	1	1
73	мисюсь личностны а деловитость	1	1
74	и полюбить то говорит	1	1
75	учитель словесности интересен не	1	1
76	так создавался литературный тип	1	1
77	вписанный в нее личность	1	1
78	у кого до чехова	1	1
79	но он чрезмерно демонстративен	1	1
80	его характер так создавался	1	1
81	себе другого для других	1	1
82	индивидуальная форма общечеловеческого которое	1	1
83	урок полемически соотнесенную с	1	1
84	[...] сказал я о	1	1
85	зовут лишь то что	1	1
86	виднейших представителей решительно отказывается	1	1
87	необходимо отнестись к другому	1	1
88	сиротство бедность несчастное детство	1	1
89	только пример из народной	1	1
90	считалось высшим достижением если	1	1
91	не случайна ее манера	1	1
92	влюбленности в начале рассказа	1	1
93	собственной характерности к робости	1	1
94	она обладает определенной социально-психологической	1	1
95	с с аверинцева характер	1	1
96	характер этот не может	1	1
97	оказаться футляром личности старшая	1	1
98	свой характер приходится к	1	1
99	молодежи и т п	1	1
100	мы судим по ее	1	1
101	всего его ролевую характерность	1	1
102	человеческое я ослабляет его	1	1
103	мотивированным обстоятельствами угадывалась личность	1	1
104	рассказа женитьба никитина в	1	1
105	преодолевший сиротство бедность несчастное	1	1
106	утопически-нигилистических убеждениях а в	1	1
107	ролевой типажный психологический облик	1	1
108	и т п все	1	1
109	воображения читателя в самую	1	1
110	как возможность неадаптивного пути	1	1
111	просматривался историзм ее характера	1	1
112	тождественные о личности мы	1	1
113	постичь чужую личность необходимо	1	1
114	к себе самому отнестись	1	1
115	к иной жизни иной	1	1
116	стараясь уловить свою главную	1	1
117	бытию характер здесь всего	1	1
118	симптом эпохи просматривался историзм	1	1
119	уже смеялся над своею	1	1
120	к робости неловкости моложавости	1	1
121	только у людей положительных	1	1
122	собой то полон нежности	1	1
123	личности увиденной как симптом	1	1
124	крылова жестко очерченный характер	1	1
125	только субъективно только в	1	1
126	так и психологическом есть	1	1
127	действующие лица тип в	1	1
128	чехов наследует это открытие	1	1
129	другого для других характер	1	1
130	полон нежности тишины и	1	1
131	единичность но одновременно и	1	1
132	только стать земцем в	1	1
133	эпически увидеть в себе	1	1
134	а волынский разве действующие	1	1
135	не срастаясь с внутренним	1	1
136	благодаря характеру никитина а	1	1
137	резко нарушил завоеванное реалистическим	1	1
138	относится и к себе	1	1
139	качеств так и своего	1	1
140	национально-исторической жизни характеры действующих	1	1
141	открытие классического реализма однако	1	1
142	оставляя их открытыми для	1	1
143	художественную задачу лидия волчанинова	1	1
144	романтику чехов тем не	1	1
145	своего я к модификациям	1	1
146	этом наивном гимне праздности	1	1
147	на холст живописца достаточно	1	1
148	и прочих вещах вплоть	1	1
149	и по глазам ее	1	1
150	иного раздраженного критика посещало	1	1
151	навсегда социальная адаптация характера	1	1
152	т п не случайна	1	1
153	встречи с кисочкой как	1	1
154	бы в приданое к	1	1
155	в самом деле не	1	1
156	чехова даже общественная активность	1	1
157	стоял так остро вопрос	1	1
158	влажный от росы весь	1	1
159	называл себя бабой но	1	1
160	внешних обстоятельств жизни и	1	1
161	внешним обстоятельствам и нормам	1	1
162	факты осуществляются благодаря характеру	1	1
163	всемирно-историческом масштабе практический же	1	1
164	своею нервностью и называл	1	1
165	своих качеств так и	1	1
166	к другому человеку и	1	1
167	достижением если решительно все	1	1
168	такой девушки можно не	1	1
169	заемности чехов акцентирует этот	1	1
170	по мнению б м	1	1
171	кажется счастливым когда около	1	1
172	свою главную мысль то	1	1
173	этих полярностей чтобы за	1	1
174	обособляя человеческое я ослабляет	1	1
175	мотивы в частности бездеятельность	1	1
176	то а не другое	1	1
177	собой понятия смежные но	1	1
178	поражение в глазах автора	1	1
179	в литературе личности наиболее	1	1
180	реалисты изображали своих героев	1	1
181	определяло его характер так	1	1
182	иначе вписанный в нее	1	1
183	со стороны характера персонажа	1	1
184	в начале рассказа затем	1	1
185	настроениях чеховских героев сказал	1	1
186	прислушался потом когда все	1	1
187	обстоятельств жизни и так	1	1
188	народной жизни лишена этого	1	1
189	активная деятельная характер ее	1	1
190	моральное поражение в глазах	1	1
191	личностность человека есть его	1	1
192	социальная адаптация характера и	1	1
193	под утро он уже	1	1
194	не относясь при этом	1	1
195	бы крайне упростил и	1	1
196	интересен не своим вполне	1	1
197	он бы крайне упростил	1	1
198	читатель относится к герою	1	1
199	н учить это действительно	1	1
200	можно догадаться творческий кризис	1	1
201	басни крылова жестко очерченный	1	1
202	не глядя на собеседника	1	1
203	если бы чехов организовал	1	1
204	характер обособляя человеческое я	1	1
205	своей встречи с кисочкой	1	1
206	историю своей встречи с	1	1
207	легко одерживает практическую победу	1	1
208	[...] только характеры священны	1	1
209	читавший гамбургской драматургии никитин	1	1
210	или иного раздраженного критика	1	1
211	сохраните черты характера среди	1	1
212	которым он однако не	1	1
213	и так или иначе	1	1
214	когда все утихло отыскал	1	1
215	героев воспитанных на реализме	1	1
216	и адаптация суть неотождествимые	1	1
217	самоактуализация составляет духовное содержание	1	1
218	явно душевные переживания героя	1	1
219	м м пришвин это	1	1
220	его жизни так центральное	1	1
221	заурядным характером но личностным	1	1
222	а деловитость серьезность непоколебимая	1	1
223	вешалку и ушел из	1	1
224	все что сообщалось о	1	1
225	любви испытываемого художником это	1	1
226	ногах только у людей	1	1
227	и воображения читателя в	1	1
228	решительно отказывается от классической	1	1
229	автора и читателя в	1	1
230	пахнет резедой и олеандром	1	1
231	себе лирически узнавая себя	1	1
232	его рассуждений совершенно неудовлетворителен	1	1
233	жизнью к социальной типажности	1	1
234	мыслима только субъективно только	1	1
235	систему персонажей иначе как	1	1
236	менее едва ли найдется	1	1
237	историческом так и психологическом	1	1
238	легко представить себе перенесенным	1	1
239	характер это социальная обособленность	1	1
240	бывала озадачена а порой	1	1
241	к созерцательности и внешней	1	1
242	главную мысль то испытывает	1	1
243	понимать этот литературный термин?	1	1
244	было ясно что покой	1	1
245	устроенности обеспеченности к тому	1	1
246	сияет от солнца и	1	1
247	наивном гимне праздности который	1	1
248	чувства любви испытываемого художником	1	1
249	как раз в том	1	1
250	я ослабляет его межличностные	1	1
251	классического реализма однако чехов	1	1
252	и того и другого	1	1
253	чрезмерно демонстративен что создает	1	1
254	внутреннему бытию характер здесь	1	1
255	правота в споре несомненно	1	1
256	заставляют поэта избрать предпочтительнее	1	1
257	лишены в глазах автора	1	1
258	родов анна только пример	1	1
259	приданое к тому что	1	1
260	солнца и кажется счастливым	1	1
261	характеру она обладает определенной	1	1
262	личность чтобы в личности	1	1
263	утро он уже смеялся	1	1
264	первые русские реалисты изображали	1	1
265	с одной стороны и	1	1
266	футляром личности старшая из	1	1
267	внешнее по преимуществу ложное	1	1
268	полярностей чтобы за характером	1	1
269	действующих лиц у чехова	1	1
270	никитина в последнем разговоре	1	1
271	есть продукт ответственной самоактуализации	1	1
272	осуществляются благодаря характеру никитина	1	1
273	жизни характеры действующих лиц	1	1
274	при этом вопреки лессингу	1	1
275	однако не умел воспользоваться	1	1
276	личности к внешним обстоятельствам	1	1
277	я наблюдаемое и описываемое	1	1
278	его утопически-нигилистических убеждениях а	1	1
279	но для него уже	1	1
280	о способах благодаря которым	1	1
281	сознательного самоопределения выбора жизненной	1	1
282	лидой не в его	1	1
283	я сам а явление	1	1
284	жизни так центральное событие	1	1
285	при этом всерьез к	1	1
286	самой лиде художник ценит	1	1
287	другому человеку и к	1	1
288	жизни есть бескорыстная самоактуализация	1	1
289	своей определенности личность внутренняя	1	1
290	эти не демонстрируемые явно	1	1
291	отношением изнутри своего я	1	1
292	в самую суть проблемной	1	1
293	вопреки этой своей определенности	1	1
294	отнестись к другому как	1	1
295	затем к обретенной социальной	1	1
296	резедой и олеандром молодежь	1	1
297	девушки можно не только	1	1
298	характеру никитина а стороны	1	1
299	олеандром молодежь только что	1	1
300	конечном счете характер это	1	1
301	в саду и когда	1	1
302	преимущество художника перед лидой	1	1
303	пример из народной жизни	1	1
304	как человека ее личностная	1	1
305	деятельная характер ее результат	1	1
306	полюбить только земца [...]	1	1
307	характер же формируется в	1	1
308	отдельные особи в кривенко	1	1
309	воле лиды мать и	1	1
310	характера великое открытие классического	1	1
311	инвективах против теории малых	1	1
312	а не другое событие	1	1
313	праздности который так легко	1	1
314	движется нежели у его	1	1
315	характерного и личного в	1	1
316	было видно что она	1	1
317	и причина этого как	1	1
318	неловкости моложавости влюбленности в	1	1
319	между тем не читавший	1	1
320	праздности например когда зеленый	1	1
321	своих виднейших представителей решительно	1	1
322	узнавая себя в другом	1	1
323	не демонстрируемые явно душевные	1	1
324	обликом с социальным футляром	1	1
325	я характер же формируется	1	1
326	ее поступке обнаруживается ущербность	1	1
327	покоряющуюся ей мисюсь но	1	1
328	характер внешняя сторона личности	2	1
329	всякий раз вглядывается в	1	1
330	его внешним обликом с	1	1
331	лица тип в том	1	1
332	[...] то что изображает	1	1
333	чтобы вся жизнь была	1	1
334	калоши [...] бывают на	1	1
335	не стоял так остро	1	1
336	смысла жизни есть бескорыстная	1	1
337	у его предшественников [...]	1	1
338	же зовут лишь то	1	1
339	своей чисто внешней активностью	1	1
340	лессингу не факты осуществляются	1	1
341	лицам самоактуализация и адаптация	1	1
342	не каждому характерное в	1	1
343	лиды резко характерны но	1	1
344	самую суть проблемной ситуации	1	1
345	характера тогда как характер	1	1
346	социальной позиции характер этот	1	1
347	но не тождественные о	1	1
348	поэта избрать предпочтительнее то	1	1
349	единство характерного и личного	1	1
350	а порой и возмущена	1	1
351	который так легко представить	1	1
352	решительно все что сообщалось	1	1
353	качестве некоторого я субъекта	1	1
354	окружающих зрителями собственного якобы	1	1
355	воспитанных на реализме стойко	1	1
356	романом единство характерного и	1	1
357	внутренняя сторона характера тогда	1	1
358	это не я сам	1	1
359	порой поступает мыслит чувствует	1	1
360	ананьев рассказывает историю своей	1	1
361	пришвин это не я	1	1
362	нарушил завоеванное реалистическим романом	1	1
363	преимуществу ложное искаженное инобытие	1	1
364	монады равного себе характера	1	1
365	не менее едва ли	1	1
366	исключает ролевые отношения между	1	1
367	к социально-ролевым формам человеческих	1	1
368	литературе личности наиболее характерной	1	1
369	и быть может во	1	1
370	зеленый сад еще влажный	1	1
371	которым факты осуществились заставляют	1	1
372	отгороженная от другой личности	1	1
373	социальной устроенности обеспеченности к	1	1
374	для него уже было	1	1
375	живет этой своей чисто	1	1
376	лиды отрицать больницы и	1	1
377	разве действующие лица тип	1	1
378	на стороне лиды отрицать	1	1
379	ясно что покой потерян	1	1
380	этой своей определенности личность	1	1
381	знаешь что все эти	1	1
382	то томится недовольством собой	1	1
383	не только стать земцем	1	1
384	замечает в.я линков обобщающая	1	1
385	в частности бездеятельность исключает	1	1
386	панихида например мы узнаем	1	1
387	есть личность понятая объективно	1	1
388	сценки импрессионистов несомненно есть	1	1
389	с этой точки зрения	1	1
390	м мейлаха не стоял	1	1
391	сопряжена с совершенно иной	1	1
392	бедность несчастное детство тоскливую	1	1
393	с машей предстает простым	1	1
394	детерминизма обстоятельств не впадая	1	1
395	русские реалисты изображали своих	1	1
396	от калош превращается в	1	1
397	характерность видя в нем	1	1
398	социально-ролевым формам человеческих отношений	1	1
399	наиболее характерной дли данного	1	1
400	категории людей а не	1	1
401	достаточно сильна поскольку она	1	1
402	чтобы в личности увиденной	1	1
403	речи у волчаниновых и	1	1
404	если решительно все что	1	1
405	лида говорит о земских	1	1
406	молодежь только что вернулась	1	1
407	что он творец своего	1	1
408	фразы из басни крылова	1	1
409	в этом наивном гимне	1	1
410	кого до чехова по	1	1
411	другом и напротив чтобы	1	1
412	обладает определенной социально-психологической характерностью	1	1
413	сама трезво осознает реальные	1	1
414	плане как историческом так	1	1
415	уклад национально-исторической жизни характеры	1	1
416	и пьет чай в	1	1
417	как этих своих качеств	1	1
418	и внешней праздности например	1	1
419	отношений лида может полюбить	1	1
420	самоактуализация и адаптация суть	1	1
421	лишена этого внимания к	1	1
422	этого как раз в	1	1
423	классической монады равного себе	1	1
424	когда знаешь что все	1	1
425	уловить свою главную мысль	1	1
426	[...] бывают на ногах	1	1
427	их внутреннему бытию характер	1	1
428	по его словам а	1	1
