1	бы то ни было	1	8
2	и не может быть	2	4
3	в то же время	8	3
4	в процессе социального общения	1	3
5	в связи с этим	2	3
6	идеалистическая философия культуры и	1	2
7	какого бы то ни	1	2
8	нет и не может	2	2
9	но в то же	2	2
10	и пр и пр	2	2
11	на самом же деле	1	2
12	в том числе и	1	2
13	не может быть и	1	2
14	все более и более	2	1
15	в точном смысле этого	1	1
16	только в процессе социального	1	1
17	упускается из виду что	1	1
18	наука до сих пор	1	1
19	наука об идеологиях и	1	1
20	науки об идеологиях и	1	1
21	и с точки зрения	1	1
22	разобранные нами в предыдущей	1	1
23	нами в предыдущей главе	1	1
24	с этой точки зрения	1	1
25	не выходит за пределы	1	1
26	та среда в которой	1	1
27	как и все остальные	1	1
28	в нашу задачу не	1	1
29	глава первая наука об	1	1
30	в каждую данную эпоху	1	1
31	в единстве социальной жизни	4	1
32	с точки зрения самого	1	1
33	если дело идет о	1	1
34	до настоящего времени не	1	1
35	сменяют друг друга не	1	1
36	нашу задачу не входит	1	1
37	не может быть уже	1	1
38	друг друга не по	1	1
39	с точки зрения ее	1	1
40	первая наука об идеологиях	1	1
41	и до настоящего времени	1	1
42	необходимо прежде всего определить	1	1
43	то ни было идеологического	1	1
44	в целом ряде существенных	1	1
45	точном смысле этого слова	1	1
46	как данная единичная вещь	1	1
