1	в то же время	7	5
2	той мере в какой	1	4
3	в той мере в	1	4
4	и тем не менее	1	3
5	одной и той же	1	2
6	одного и того же	1	2
7	дело в том что	1	2
8	с этой точки зрения	1	1
9	какой бы то ни	1	1
10	в том или ином	1	1
11	в собственном смысле слова	1	1
12	вовсе не вытекает из	1	1
13	бы то ни было	4	1
14	хорошем смысле этого слова	1	1
15	мы имеем в виду	1	1
16	так а не иначе	1	1
17	одно из необходимых условий	1	1
18	т д таким образом	1	1
19	в хорошем смысле этого	1	1
20	и т д таким	1	1
21	предполагает ту или иную	1	1
22	в зависимости от того	1	1
