1	дело в том что	2	4
2	и в этом смысле	1	3
3	еще и потому что	1	2
4	во что бы то	1	2
5	что бы то ни	1	2
6	в то же время	1	2
7	также и то что	2	2
8	а с другой стороны	3	2
9	свидетельствует о том что	1	2
10	и вместе с тем	1	2
11	в то время как	3	2
12	бы то ни стало	1	2
13	с этой точки зрения	1	1
14	же в конце концов	1	1
15	и в том числе	1	1
16	с начала до конца	1	1
17	указать хотя бы на	1	1
18	с такой точки зрения	1	1
19	и то и другое	1	1
20	в том что и	1	1
21	бы то ни было	1	1
22	достаточно указать хотя бы	1	1
23	нам представляется что здесь	1	1
24	в том что он	1	1
25	мы должны сказать что	1	1
26	означает не что иное	1	1
27	не что иное как	3	1
28	этому поводу необходимо сказать	1	1
29	поводу необходимо сказать что	1	1
30	стоит на точке зрения	1	1
31	в результате чего вся	1	1
32	по этому поводу необходимо	1	1
