N	4gram	Bakhtin_Pr_2	Problemy
1	в то же время	3	5
2	в той или иной	2	3
3	но в то же	3	3
4	мы уже говорили что	1	2
5	в своей записной книжке	1	2
6	с другой стороны и	1	2
7	на пьедестал будущий человек	2	2
8	беспрерывно постановляется на вид	1	2
9	сделаны из одного куска	2	2
10	достоевский в своей записной	1	2
11	в то время как	1	2
12	наименее благоприятные условия для	1	1
13	романа аристократ бульварного романа	1	1
14	облачении своего класса или	1	1
15	их тоне автор как	1	1
16	мир вещей и вещных	1	1
17	являются твердою всеопределяющею основою	1	1
18	героя с героем не	1	1
19	в освещении героев в	1	1
20	он часто подчеркивает исключительную	1	1
21	и идеал есть у	1	1
22	своей записной книжке набрасывает	1	1
23	уж прямо обвинили их	1	1
24	самого сюжета он пуст	1	1
25	с точки зрения всякой	1	1
26	догадка о смирении народном	1	1
27	и не ограничен ни	1	1
28	же миру униженных и	1	1
29	униженных и оскорбленных следуя	1	1
30	как помещика с крестьянином	1	1
31	соприкасается только с людьми	1	1
32	не может проявиться достаточно	1	1
33	во всей истории классического	1	1
34	носятся в воздухе в	1	1
35	своих жизненно-биографических целей его	1	1
36	в этом сказалась исконная	1	1
37	христом чем с вами	1	1
38	герой ничего не исключает	1	1
39	героев между ними и	1	1
40	человека в ответ кавелину	1	1
41	убеждениям и к их	1	1
42	если оно это все	1	1
43	глубоко человечен все социальные	1	1
44	стало быть это мое	1	1
45	что он не есть	1	1
46	надо гармонию сухость рассказа	1	1
47	и не верность самих	1	1
48	я про себя мысль	1	1
49	всеопределяющею основою всех сюжетных	1	1
50	соблазнила меня и полюбил	1	1
51	которых они могут стать	1	1
52	между собой никаких сколько-нибудь	1	1
53	завершен и не предопределен	1	1
54	и их сознания как	1	1
55	о бесах он пишет	1	1
56	творчестве не сделал однако	1	1
57	своего класса или сословия	1	1
58	менее и здесь достоевский	1	1
59	не могу признать нравственным	1	1
60	признать нравственным человеком ибо	1	1
61	что житие вещь до	1	1
62	только положения в которых	1	1
63	мир сопряженных смысловых человеческих	1	1
64	устанавливает авантюрный сюжет не	1	1
65	существенных внесюжетных связей сюжет	1	1
66	с гротеском исключительного с	1	1
67	с внутренними убеждениями это	1	1
68	не верность своим убеждениям	1	1
69	жажда воплощения мечтателя рожденного	1	1
70	сознание он оставил не	1	1
71	ним как ряд человеческих	1	1
72	по достоевскому даже в	1	1
73	что может служить непосредственным	1	1
74	по крайней мере не	1	1
75	более того и всякую	1	1
76	его мышлению он предпочитает	1	1
77	я выше всего этого	1	1
78	себе но те живые	1	1
79	но в таком случае	1	1
80	неожиданных состояний мы находим	1	1
81	них строит свою установку	1	1
82	жизненную воплощенность героя между	1	1
83	положения раскрывающие и провоцирующие	1	1
84	не сочетает мыслей по	1	1
85	опирается не на то	1	1
86	завязать герои и тех	1	1
87	нет твердых социально-типических и	1	1
88	на социальную и характерологическую	1	1
89	тщетно мечтают и жаждут	1	1
90	вопрос верны ли мои	1	1
91	основном идеалистической оценки сознания	1	1
92	в одной плоскости с	3	1
93	воспринимает не как свою	1	1
94	беспрерывно возбуждать в себе	1	1
95	выражением и опорою для	1	1
96	двенадцать присяжных иной раз	1	1
97	лейтмотив ни идеологический вывод	1	1
98	материале конкретных жизненно-бытовых сцен	1	1
99	дар но и чувствует	1	1
100	биографического романа связывает героя	1	1
101	землю и ее аксиому	1	1
102	внесюжетных связей с другими	1	1
103	же она к нему	1	1
104	слово в образе идеального	1	1
105	как человек стреляет совершает	1	1
106	полученною даром и дарованною	1	1
107	так сказать телесный и	1	1
108	достоевского однако нам кажется	1	1
109	представляя сценами тут надо	1	1
110	конечно в публицистических статьях	1	1
111	в одном романе во-вторых	1	1
112	что сама по себе	1	1
113	конце концов имеющих последнею	1	1
114	воедино по романтическому принципу	1	1
115	чем-нибудь следовать и в	1	1
116	учению о среде даже	1	1
117	сближаться с тургеневым толстым	1	1
118	публицистические статьи достоевского всюду	1	1
119	все то в произведении	1	1
120	лишь честность русский язык	1	1
121	каждый из них за	1	1
122	дан в освещении героев	1	1
123	это красный цвет сожигающего	1	1
124	жития чтоб видна была	1	1
125	плане жития великого грешника	1	1
126	но и романа бульварного	1	1
127	недостойному уж конечно почище	1	1
128	не скупясь на изъяснения	1	1
129	не есть и что	1	1
130	гроссманом что все указанные	1	1
131	формулы и категории чужды	1	1
132	круг тех связей какие	1	1
133	он у него нет	1	1
134	и от автора но	1	1
135	за ним недоверие к	1	1
136	авантюрному материалу в романе	1	1
137	сюжет правда этот вечный	1	1
138	мысли художественно и сжато	1	1
139	в строгих рамках этих	1	1
140	тоже не субстанция а	1	1
141	в идеальном авторитетном образе	1	1
142	авантюрного сюжета введением авантюрного	1	1
143	неожиданно авантюрный сюжет не	1	1
144	лет тоже подбором того	1	1
145	общественными подонками среди героев	1	1
146	соблазнялся ходячими типами авантюрных	1	1
147	романа приключений который не	1	1
148	удалось я не за	1	1
149	монологическим принципом видения и	1	1
150	нему не слияние с	1	1
151	и упорядоченный его монологическою	1	1
152	со христом чем с	1	1
153	сознания как людей не	1	1
154	для построения его интриг	1	1
155	большей или меньшей степени	1	1
156	его чужой для автора	1	1
157	и себе равный человек	1	1
158	беспрерывно выставляется что-то и	1	1
159	мир объектов освещенный и	1	1
160	как сюжет он является	1	1
161	интриг он пользовался даже	1	1
162	им авантюрное положение такое	1	1
163	романе много написано наскоро	1	1
164	между ними и распределено	1	1
165	ему разрешение идеологических исканий	1	1
166	здесь типичнейшую черту мелодрамы	1	1
167	об чем пойдет рассказ	1	1
168	из одного куска герои	1	1
169	письмах он часто подчеркивает	1	1
170	с единою вещью он	1	1
171	собственной идеи не соприкасается	1	1
172	всего этого говорилось о	1	1
173	истинного человека и его	1	1
174	меня и полюбил я	1	1
175	сюжет здесь никогда не	1	1
176	ощущает что столько власти	1	1
177	достигался захватывающий повествовательный интерес	1	1
178	сторону над всем этим	1	1
179	бульварными романистами и фельетонными	1	1
180	массовых катастроф титулов и	1	1
181	идеологического подхода перед достоевским	1	1
182	в теоретическом смысле этого	1	1
183	пост оскоромиться вы бы	1	1
184	прежде всего видит ее	1	1
185	автора в плане жития	1	1
186	отношения являются твердою всеопределяющею	1	1
187	поэтому достоевский спокойно мог	1	1
188	чего понадобился достоевскому авантюрный	1	1
189	всеми вместо отношения сознающего	1	1
190	много написано наскоро много	1	1
191	мы находим здесь типичнейшую	1	1
192	в самом деле в	1	1
193	мере не укладывается в	1	1
194	пропагаторов? язвительный голос хохочет	1	1
195	напротив что безнравственно поступать	1	1
196	и беспрерывно постановляется на	1	1
197	признаю ваш тезис что	1	1
198	громче но как-то выделанно	1	1
199	есть поступок безнравственный христос	1	1
200	смысл ее предметные вершки	1	1
201	всеосвещающую изображенный мир функцию	1	1
202	он развивается вопреки им	1	1
203	сплетения возвышенного с гротеском	1	1
204	героем не как человека	1	1
205	не как вывода своего	1	1
206	от идеи человека из	1	1
207	из которых слагался бы	1	1
208	прокурора развитие ответа ну	1	1
209	строго локализованный в жизни	1	1
210	организовать и подчинить его	1	1
211	стоит он этих даров	1	1
212	материалу в романе достоевского	1	1
213	эти двенадцать присяжных иной	1	1
214	людей не могут заключать	1	1
215	от вас улетела остались	1	1
216	у него не может	1	1
217	и всякую устойчивую социальную	1	1
218	сами герои тщетно мечтают	1	1
219	всякий человек как человек	1	1
220	занимательность сама по себе	1	1
221	постановляется на вид и	1	1
222	видит ее корешки в	1	1
223	и подчинить его именно	1	1
224	угодно авантюрный сюжет опирается	1	1
225	самыми крайними и последовательными	1	1
226	этой в основном идеалистической	1	1
227	строится на полуголосах и	1	1
228	я между собою глава	1	1
229	его вечной человеческой природой	1	1
230	вне самого сюжета он	1	1
231	убеждений отвлеченно взятых а	1	1
232	выше всего этого по	1	1
233	герой так же не	1	1
234	не мир объектов освещенный	1	1
235	к убеждениям и к	1	1
236	а во множественном числе	1	1
237	такое положение в котором	1	1
238	отвлеченных положений не сочетает	1	1
239	идея жития чтоб видна	1	1
240	сюжетность социально-психологического бытового семейного	1	1
241	обращался начинавший вместе с	1	1
242	как и герой достоевского	1	1
243	лишь на определенной конкретной	1	1
244	бы вовсе этим нечего	1	1
245	но и выходит из	1	1
246	жиль-блаза на эффектных и	1	1
247	достоевскому авантюрный мир? какие	1	1
248	авторитетному образу человека в	1	1
249	достоевского это черта не	1	1
250	жизненно-биографических целей его человечность	1	1
251	в чем-либо существенно сближаться	1	1
252	степени свойственна и князю	1	1
253	глазами но не должна	1	1
254	жизни а скорее на	1	1
255	перед достоевским были образцы	1	1
256	но тем не менее	1	1
257	только благородного авантюрного романа	1	1
258	атрибута старого романа приключений	1	1
259	опровергнете в этих мыслях	1	1
260	участниками которых они могут	1	1
261	твердою всеопределяющею основою всех	1	1
262	возраста своих жизненно-биографических целей	1	1
263	голос являлся последним идеологическим	1	1
264	если наш народ особенно	1	1
265	слагался бы устойчивый образ	1	1
266	развитие темы строится на	1	1
267	не от мысли к	1	1
268	истинную мысль а как	1	1
269	что не стоит он	1	1
270	героя нельзя сказать кто	1	1
271	не воплощен и не	1	1
272	деклассированным бродягой и т.п	1	1
273	оскорбленным которая чувствуется за	1	1
274	и вещных отношений входящий	1	1
275	в публицистических статьях эта	1	1
276	титулов и неожиданных состояний	1	1
277	всегда видел что идея	1	1
278	очутиться всякий человек как	1	1
279	корешки в человеке для	1	1
280	литературы традиционные узоры европейского	1	1
281	может быть нормального биографического	1	1
282	были бы воплощены поэтому	1	1
283	по отношению к нему	1	1
284	друг с другом лишь	1	1
285	и слушать испытывать установки	1	1
286	возможности с авантюрным героем	1	1
287	связей случайность здесь исключена	1	1
288	объяснять словами всю владычествующую	1	1
289	с общественными подонками среди	1	1
290	подошли к тому же	1	1
291	аристократ бульварного романа это	1	1
292	не только благородного авантюрного	1	1
293	западно-европейскими представителями биографического романа	1	1
294	или как помещика с	1	1
295	и в их тоне	1	1
296	высшем смысле т.е изображаю	1	1
297	здесь не в единственном	1	1
298	почти не обращался начинавший	1	1
299	в костюме аристократа как	1	1
300	непосредственным выражением и опорою	1	1
301	образ человека и его	1	1
302	валковскому и князю сокольскому	1	1
303	героя а не как	1	1
304	сожигающего еретиков я не	1	1
305	категории чужды его мышлению	1	1
306	достоевского не был художественной	1	1
307	рамках этих отношений герои	1	1
308	авантюрный сюжет напротив именно	1	1
309	в том числе и	2	1
310	для него значит вопрошать	1	1
311	может очутиться вечный и	1	1
312	помимо таинственных преступлений и	1	1
313	другой голос вот говорят	1	1
314	определенный образ отяжелил бы	1	1
315	воплощения мечтателя рожденного от	1	1
316	действительности до границ фантастического	1	1
317	или этот высший голос	1	1
318	типичные фабулы авантюрной литературы	1	1
319	не должна окрашивать произведения	1	1
320	утешительная а догадка о	1	1
321	скатились и его придавили	1	1
322	осуществления его художественного замысла	1	1
323	на изъяснения но и	1	1
324	быть глубокое органическое единство	1	1
325	его чистым голосом у	1	1
326	полуголосов чужих слов чужих	1	1
327	князю валковскому и князю	1	1
328	авантюрный мир? какие функции	1	1
329	классического русского романа типичные	1	1
330	вполне понятно что ни	1	1
331	начинать даже с ребяческих	1	1
332	и окружающий его объективный	1	1
333	эффектных и сценических местах	1	1
334	не опирается на наличные	1	1
335	наскоро много растянуто и	1	1
336	получил как дар но	1	1
337	мысль пробирается через лабиринт	1	1
338	таинственных преступлений и массовых	1	1
339	предметному принципу но сопоставляет	1	1
340	принципу возвышенное с гротеском	1	1
341	и строго локализованный в	1	1
342	в расположении материала подбором	1	1
343	но как-то выделанно дальнейшее	1	1
344	предрешено и неожиданно авантюрный	1	1
345	отношений заключенных в одном	1	1
346	идеалистической оценки сознания достоевский	1	1
347	романа поэтому менее всего	1	1
348	смысле этого слова без	1	1
349	тело и душа могут	1	1
350	может служить непосредственным выражением	1	1
351	из них выше их	1	1
352	личный идеологический тон автора	1	1
353	собой никаких сколько-нибудь существенных	1	1
354	идеальная установка истинное слово	1	1
355	судящее я и мир	1	1
356	на сюжетные отношения она	1	1
357	идеального человека или в	1	1
358	в котором оказался человек	1	1
359	функцию но должна входить	1	1
360	положения семейные социальные биографические	1	1
361	его лежит не от	1	1
362	быть сделаны из одного	1	1
363	биографический роман герой и	1	1
364	друга весь его материал	1	1
365	и скажу напротив что	1	1
366	язвительный голос вы кажется	1	1
367	герой и сюжет сделаны	1	1
368	класса или сословия своего	1	1
369	мое я которое все	1	1
370	к страхову в романе	1	1
371	типами авантюрных фабул захватанных	1	1
372	роман герой и окружающий	1	1
373	претворением довести образы и	1	1
374	чужой для автора голос	1	1
375	герой не видит и	1	1
376	жизнь от вас улетела	1	1
377	над всем этим судит	1	1
378	человека из подполья и	1	1
379	авторитетнейшую установку и ее	1	1
380	только их одежда это	1	1
381	зиждется биографический роман герой	1	1
382	только в строгих рамках	1	1
383	же завершаются их самосознания	1	1
384	на вид и на	1	1
385	философия а вера а	1	1
386	не субстанция а чистая	1	1
387	увенчать мир голосов организовать	1	1
388	характером героя и сюжетом	1	1
389	с аристократом социально-семейного романа	1	1
390	становится как бы в	1	1
391	доказывает своих положений на	1	1
392	самим сюжетом сюжет не	1	1
393	этого но тем не	1	1
394	раз во всей истории	1	1
395	любящего с любимой или	1	1
396	установку и ее он	1	1
397	про авантюрного героя нельзя	1	1
398	влияния на сюжетные отношения	1	1
399	написано наскоро много растянуто	1	1
400	раз послужили достоевскому эскизными	1	1
401	тон втиснуть мысли художественно	1	1
402	авантюрного сюжета так сказать	1	1
403	он пуст и следовательно	1	1
404	и всегда оставлять ее	1	1
405	и его чужой для	1	1
406	власти он получил как	1	1
407	русского романа типичные фабулы	1	1
408	не на то что	1	1
409	всем может стать он	1	1
410	связей с другими героями	1	1
411	биографического романа зато авантюрный	1	1
412	оставил глубокий след в	1	1
413	бы устойчивый образ его	1	1
414	романа это положение в	1	1
415	с другими героями он	1	1
416	нравственность нравственный образец и	1	1
417	в мысли ее предметный	1	1
418	почитает в пост оскоромиться	1	1
419	уже говорили что идея	1	1
420	благочестива что житие вещь	1	1
421	чувствует сверх того что	1	1
422	в котором они действительно	1	1
423	в котором может очутиться	1	1
424	человека или в образе	1	1
425	но чтоб читатель всегда	1	1
426	как бы беспрерывно выставляется	1	1
427	не доказывает своих положений	1	1
428	наклонен к учению о	1	1
429	а догадка о смирении	1	1
430	но оно достаточно чтобы	1	1
431	сюжет не опирается на	1	1
432	действует в костюме аристократа	1	1
433	и биографические социально-сословные социально-классовые	1	1
434	нищих и спасенных подкидышей	1	1
435	что ни идеологический лейтмотив	1	1
436	локализацию авантюрный сюжет использует	1	1
437	к которым достоевский однако	1	1
438	о среде даже по	1	1
439	стать опорою для автора	1	1
440	живая жизнь от вас	1	1
441	завершаются их самосознания и	1	1
442	но для чего понадобился	1	1
443	вопрошание идеального образа как	1	1
444	идея эта благочестива что	1	1
445	учреждения установления сословия классы	1	1
