1	бы то ни было	1	4
2	на самом же деле	2	3
3	в той или иной	7	3
4	ни в коем случае	3	2
5	в какой мере не	4	1
6	каких бы то ни	1	1
7	дело в том что	1	1
8	случае нельзя путать с	1	1
9	не говоря уже о	1	1
10	же в таком случае	1	1
11	не может обойтись без	2	1
12	как мы только что	1	1
13	здесь одно и то	1	1
14	сам по себе а	1	1
15	не сам по себе	2	1
16	коем случае нельзя путать	1	1
17	в жизни и в	1	1
18	в связи с той	1	1
19	свидетельствует о том что	1	1
20	в коем случае нельзя	1	1
21	не что иное как	2	1
22	в последнее время в	1	1
23	какой мере не является	1	1
24	тем не менее в	1	1
25	в коем случае не	1	1
26	в том числе и	1	1
27	чем же в таком	1	1
28	ни в какой мере	4	1
