1	в том отношении что	1	2
2	заключается в том что	13	2
3	в том что в	1	2
4	на то что в	1	2
5	одним и тем же	3	2
6	в том что здесь	1	2
7	в том числе и	2	2
8	отделены друг от друга	1	1
9	не отделены друг от	1	1
10	в том смысле что	1	1
11	так же как и	4	1
12	с нашей точки зрения	2	1
13	в этой области это	1	1
14	бы они ни были	1	1
15	том смысле как мы	1	1
16	обратил внимание на то	1	1
17	внимание на то что	1	1
18	настоящем смысле этого слова	1	1
19	не говоря уже о	1	1
20	в настоящем смысле этого	1	1
21	что с точки зрения	1	1
22	ответа на вопрос о	1	1
23	только в том что	2	1
24	на вопрос о том	1	1
25	той и другой стороны	1	1
26	в том что он	1	1
27	одних и тех же	1	1
28	не может не быть	1	1
29	в то время как	1	1
30	невозможные с точки зрения	1	1
31	нас нет никаких оснований	1	1
32	и на этот раз	1	1
33	мы имеем дело с	1	1
34	у нас нет никаких	1	1
35	в том смысле как	1	1
36	с точки зрения задач	1	1
