1	на вопрос о том	2	4
2	и в самом деле	1	3
3	с одной стороны и	2	3
4	заключается в том что	4	2
5	то же самое что	2	2
6	состоит в том что	3	2
7	дело в том что	1	2
8	к действительности а именно	1	1
9	заключается вовсе не в	1	1
10	ответ на этот вопрос	1	1
11	в собственном смысле слова	3	1
12	именно в этом пункте	1	1
13	в том что такое	1	1
14	в том что в	1	1
15	ответить на этот вопрос	1	1
16	в течение многих лет	1	1
17	только в том что	1	1
18	заключается в том чтобы	3	1
19	бы то ни было	1	1
20	в связи с этим	1	1
21	мы имеем в виду	1	1
22	представление о том что	1	1
23	сомнений в том что	1	1
24	приходит к выводу что	1	1
25	смысле этого слова как	1	1
26	в зависимости от того	1	1
27	собственном смысле слова в	1	1
