1	в то же время	6	3
2	и тем не менее	3	2
3	состоит в том что	2	2
4	заключается в том что	2	2
5	и в этом смысле	1	2
6	и в конце концов	1	1
7	то же самое и	1	1
8	это сказалось в том	1	1
9	в том что такое	1	1
10	не говоря уже о	1	1
11	если принять во внимание	1	1
12	по тем или иным	2	1
13	и в самом деле	3	1
14	в том что не	1	1
15	том виде в каком	1	1
16	в связи с этим	1	1
17	в том отношении что	3	1
18	одной и той же	2	1
19	второй половины xviii в	1	1
20	с этой точки зрения	1	1
21	тем или иным признакам	1	1
22	нельзя не признать очень	2	1
23	в той или иной	1	1
24	в собственном смысле этого	1	1
25	в первом из этих	1	1
26	сказалось в том что	1	1
27	в том виде в	1	1
28	отчет в том что	1	1
29	том смысле в каком	1	1
30	на вопрос о том	2	1
31	с тем что в	1	1
32	и это сказалось в	1	1
