1	с этой точки зрения	1	3
2	и т д в	2	2
3	но в том-то и	1	2
4	то же самое и	1	1
5	только в том чтобы	1	1
6	точно так же как	1	1
7	состоит в том что	2	1
8	как мы уже знаем	2	1
9	в том-то и дело	1	1
10	не только в том	1	1
11	ответ на этот вопрос	2	1
12	дело не только в	1	1
13	но дело не только	1	1
14	и т д и	1	1
15	бы то ни было	1	1
16	о том что такое	5	1
17	на вопрос о том	2	1
18	ответ на вопрос что	1	1
19	а в том чтобы	1	1
20	приводят к тому что	1	1
21	и т д эти	1	1
22	но с другой стороны	1	1
23	том-то и дело что	1	1
24	и т д но	5	1
