N	4gram	Bakhtin_Pr_2	Problemy
890	нет ну так значит	1	1
891	мое я выше всего	1	1
892	узоры европейского романа приключений	1	1
893	у него нет твердых	1	1
894	что если наш народ	1	1
895	перед достоевским развертывается не	1	1
896	не предопределен своим образом	1	1
897	идея является обычным монологическим	1	1
898	не стоит он этих	1	1
899	распределено все то в	1	1
900	публицистических статьях эта формообразующая	1	1
901	не ограничен ни их	1	1
902	во-первых достигался захватывающий повествовательный	1	1
903	трущобам и товарищеское братание	1	1
904	человека и его чужой	1	1
905	ни одного атрибута старого	1	1
906	испытывать установки одни сочетать	1	1
907	воплощены поэтому достоевский спокойно	1	1
908	всего видит ее корешки	1	1
909	всегда оставлять ее в	1	1
910	подхода перед достоевским развертывается	1	1
911	вами живая жизнь от	1	1
912	русский народ русский народ?	1	1
913	оказывается перед героем перед	1	1
914	толстым с западно-европейскими представителями	1	1
915	поверю и скажу напротив	1	1
916	сюжета и сами герои	1	1
917	среды быта природы вещей	1	1
918	этом мире субъектов одному	1	1
919	свою истинную мысль а	1	1
920	ограничен ни их характером	1	1
921	сама по себе никогда	1	1
922	за одним а за	1	1
923	обвинили их в социальных	1	1
924	произведении всеосвещающую изображенный мир	1	1
925	уж ничем меня не	1	1
926	не соприкасается непосредственно ни	1	1
927	записной книжке набрасывает недостаточно	1	1
928	кажется что этим дело	1	1
929	хочет отрешать мысль от	1	1
930	природой самосохранением жаждой победы	1	1
931	совсем иным образцам указанные	1	1
932	как бы вовсе этим	1	1
933	выборе и в расположении	1	1
934	мире достоевского но как	1	1
935	установки к установке мыслить	1	1
936	сценических местах как бы	1	1
937	идею мою стою о	1	1
938	автора голос являлся последним	1	1
939	ним а следование за	1	1
940	мысль действительно утешительная а	1	1
941	убегает от врагов преодолевает	1	1
942	след в его творчестве	1	1
943	героем перед его чистым	1	1
944	сцен и положений в	1	1
945	всего достоевский мог в	1	1
946	он предпочитает остаться с	1	1
947	очутиться вечный и себе	1	1
948	то в произведении что	1	1
949	неотделимы друг от друга	1	1
950	был художественной самоцелью и	1	1
951	книжке набрасывает недостаточно определять	1	1
952	в большинстве случаев в	1	1
953	в них сюжетность социально-психологического	1	1
954	голос должен увенчать мир	1	1
955	они действительно были бы	1	1
956	воплотиться у него не	1	1
957	философию среды навязываете это	1	1
958	позвольте слышится мне другой	1	1
959	роман всех разновидностей оставил	1	1
960	роман вот беда но	1	1
961	обычной монологической функции искание	1	1
962	в сюжете авантюрный сюжет	1	1
963	является обычным монологическим принципом	1	1
964	несет в целом его	1	1
965	лень вы говорите что	1	1
966	может проявиться достаточно глубоко	1	1
967	себе лишена определяющего влияния	1	1
968	для иных пропагаторов? язвительный	1	1
969	но те живые формы	1	1
970	достоевский спокойно мог пользоваться	1	1
971	в абстракции неотделимы друг	1	1
972	человека и его слово	1	1
973	что есть герой и	1	1
974	конкретных жизненно-бытовых сцен и	1	1
975	традиционные узоры европейского романа	1	1
976	эти две стороны по	1	1
977	идеи об идиоте он	1	1
978	чем пойдет рассказ всех	1	1
979	дальнейшее развитие темы строится	1	1
980	как другого истинного человека	1	1
981	почище догадки о желании	1	1
982	условия для этого но	1	1
983	достоевского правда это очень	1	1
984	установка на чужой голос	1	1
985	ищет высшую авторитетнейшую установку	1	1
986	искание истины не как	1	1
987	пред властью полученною даром	1	1
988	занимает в жизни а	1	1
989	даже с ребяческих лет	1	1
990	контексте собственного сознания а	1	1
991	него как образ человека	1	1
992	время как обычная идеологическая	1	1
993	вам прямо не поверю	1	1
994	но сжато не скупясь	1	1
995	истории классического русского романа	1	1
996	темы строится на полуголосах	1	1
997	слов эта идеальная установка	1	1
998	принципом видения и понимания	1	1
999	входить в него как	1	1
1000	то что он не	1	1
1001	вовсе этим нечего дорожить	1	1
1002	целью охарактеризовать какую-нибудь человеческую	1	1
1003	никаких сколько-нибудь существенных внесюжетных	1	1
1004	и душа могут существенно	1	1
1005	она к нему залетела?	1	1
1006	на то что есть	1	1
1007	сказать телесный и телесно-душевный	1	1
1008	спасенных подкидышей наконец в	1	1
1009	безнравственно поступать по своим	1	1
1010	построения романа формальное сходство	1	1
1011	в романе достоевского однако	1	1
1012	сжато не скупясь на	1	1
1013	формальное сходство и про	1	1
1014	материалом для осуществления его	1	1
1015	действительности не предрешено и	1	1
1016	романа связывает героя с	1	1
1017	торжества жаждой обладания чувственной	1	1
1018	слить воедино по романтическому	1	1
1019	обладания чувственной любовью определяют	1	1
1020	но ведь опять-таки русский	1	1
1021	таком случае это я	1	1
1022	интерес облегчавший читателю трудный	1	1
1023	биографические социально-сословные социально-классовые отношения	1	1
1024	может случиться и он	1	1
1025	подполья и героя случайного	1	1
1026	словами всю владычествующую идею	1	1
1027	майкову идея соблазнила меня	1	1
1028	новейшую философию среды навязываете	1	1
1029	оскорбленных следуя совсем иным	1	1
1030	разгаре спешной работы он	1	1
1031	и владычествующая идея жития	1	1
1032	беда но функция владычествующей	1	1
1033	бульварного романа это положение	1	1
1034	костюме аристократа как человек	1	1
1035	мог пользоваться самыми крайними	1	1
1036	нам кажется что этим	1	1
1037	убеждения? проверка же их	1	1
1038	пользовался даже трафаретами этого	1	1
1039	романном мире достоевского но	1	1
1040	равный человек задачи продиктованные	1	1
1041	победы и торжества жаждой	1	1
1042	идеологический лейтмотив ни идеологический	1	1
1043	как ряд человеческих установок	1	1
1044	основное и главное не	1	1
1045	в европе для иных	1	1
1046	оказался человек человек действует	1	1
1047	положение в котором может	1	1
1048	пользоваться самыми крайними и	1	1
1049	он может менять сколько	1	1
1050	раз сплошь из мужиков	1	1
1051	не может поэтому быть	1	1
1052	задумываюсь я но ведь	1	1
1053	предопределен своим образом как	1	1
1054	и в том и	1	1
1055	по предметному принципу но	1	1
1056	вводя трущобы каторги и	1	1
1057	что-то и беспрерывно постановляется	1	1
1058	это тело и душа	1	1
1059	откудова же вы это	1	1
1060	авантюрного романа но и	1	1
1061	их обычной монологической функции	1	1
1062	формообразующая особенность идеологии достоевского	1	1
1063	братание их с общественными	1	1
1064	стать не предопределен и	1	1
1065	того об чем пойдет	1	1
1066	судит и сознает его	1	1
1067	спешной работы он соблазнялся	1	1
1068	социальному роману то перед	1	1
1069	куска герои как герои	1	1
1070	ну так значит сжигание	1	1
1071	бы беспрерывно выставляется что-то	1	1
1072	человек мы уже говорили	1	1
1073	ребяческих лет тоже подбором	1	1
1074	к мысли а от	1	1
1075	идеологии достоевского не может	1	1
1076	полюбил я ее ужасно	1	1
1077	будущий человек владычествующая идея	1	1
1078	в своих письмах он	1	1
1079	все глубины души человеческой	2	1
1080	надо еще беспрерывно возбуждать	1	1
1081	семейные жизненно-фабулические и биографические	1	1
1082	ибо такой сюжет всецело	1	1
1083	не предопределен и не	1	1
1084	ибо не признаю ваш	1	1
1085	своим убеждениям и не	1	1
1086	скажу напротив что безнравственно	1	1
1087	не в монологическом контексте	1	1
1088	произведения как личный идеологический	1	1
1089	и не удалось но	1	1
1090	с точки зрения своей	1	1
1091	превращающие свой материал в	1	1
1092	значит сжигание еретиков есть	1	1
1093	видения и понимания мира	1	1
1094	человек в конкретном и	1	1
1095	и его придавили но	1	1
1096	человек как человек более	1	1
1097	мира во-первых достигался захватывающий	1	1
1098	хохочет язвительный голос а	1	1
1099	от человека от его	1	1
1100	произведении что может служить	1	1
1101	и в чем-либо существенно	1	1
1102	и явления обыденной действительности	1	1
1103	осчастливленных нищих и спасенных	1	1
1104	о себе самом с	1	1
1105	но не должна окрашивать	1	1
1106	романтический принцип сплетения возвышенного	1	1
1107	к нему залетела? ведь	1	1
1108	народ? позвольте слышится мне	1	1
1109	а следование за ним	1	1
1110	как вывода своего сознания	1	1
1111	фактов как бы беспрерывно	1	1
1112	как обычная идеологическая установка	1	1
1113	центре его творчества стала	1	1
1114	гармонию сухость рассказа иногда	1	1
1115	в социальных тенденциях конечно	1	1
1116	послужили достоевскому эскизными образцами	1	1
1117	установку конечно в публицистических	1	1
1118	достоевского не может проявиться	1	1
1119	народ русский народ? позвольте	1	1
1120	авантюрного героя нельзя сказать	1	1
1121	нравственным человеком ибо не	1	1
1122	что дары-то с горы	1	1
1123	менее всего достоевский мог	1	1
1124	работы он соблазнялся ходячими	1	1
1125	героями и не за	1	1
1126	случиться и он всем	1	1
1127	в художественном мире достоевского	2	1
1128	не в единственном а	1	1
1129	прямо не поверю и	1	1
1130	вопрошать и слушать испытывать	1	1
1131	не имеет с аристократом	1	1
1132	их одна христос но	1	1
1133	к униженным и оскорбленным	1	1
1134	место он занимает в	1	1
1135	образцы подлинного социального романа	1	1
1136	но должна входить в	1	1
1137	непосредственно ни с единою	1	1
1138	но и чувствует сверх	1	1
1139	и неожиданно авантюрный сюжет	1	1
1140	начинавший вместе с достоевским	1	1
1141	правда это очень внешнее	1	1
1142	голос вот говорят что	1	1
1143	но сопоставляет установки и	1	1
1144	своим положим хоть славянским	1	1
1145	высший голос должен увенчать	1	1
1146	тезис что нравственность есть	1	1
1147	себе равный человек задачи	1	1
1148	и героя случайного семейства	1	1
1149	внутренне-диалогическая установка по отношению	1	1
1150	есть наилучший материал в	1	1
1151	вечный человек авантюрного сюжета	1	1
1152	не верность самих убеждений	1	1
1153	сознания а в идеальном	1	1
1154	из подполья и героя	1	1
1155	не как человека с	1	1
1156	и его слово в	1	1
1157	доказано это жгучее чувство	1	1
1158	ни тем социальным миром	1	1
1159	вот беда но функция	1	1
1160	сюжетные отношения она может	1	1
1161	и эти две стороны	1	1
1162	возбуждать в себе вопрос	1	1
1163	и ее возможность должна	1	1
1164	человеческих установок среди них	1	1
1165	сюжету как воплощенный и	1	1
1166	подбором того об чем	1	1
1167	стороны по достоевскому даже	1	1
1168	этим дело далеко не	1	1
1169	а что если наш	1	1
1170	бы воплощены поэтому достоевский	1	1
1171	героем достоевского имеется одно	1	1
1172	этот материал чужие голоса	1	1
1173	т.е изображаю все глубины	1	1
1174	на наличные и устойчивые	1	1
1175	вещных отношений входящий в	1	1
1176	не признаю ваш тезис	1	1
1177	в одно это а	1	1
1178	образцами для построения его	1	1
1179	нормального биографического сюжета и	1	1
1180	понадобился достоевскому авантюрный мир?	1	1
1181	ничего не исключает из	1	1
1182	среди них беспрерывно постановляется	1	1
1183	достоевского не верность своим	1	1
1184	изображаю все глубины души	1	1
1185	этим нечего дорожить но	1	1
1186	были образцы подлинного социального	1	1
1187	и дарованною пока недостойному	1	1
1188	человек задачи продиктованные его	1	1
1189	авантюрного мира во-первых достигался	1	1
1190	с женой соперника с	1	1
1191	освещенный и упорядоченный его	1	1
1192	и представляя сценами тут	1	1
1193	сверх всего этого говорилось	1	1
1194	врагов преодолевает препятствия и	1	1
1195	сознания вообще не в	1	1
1196	верны ли мои убеждения?	1	1
1197	его характера типа или	1	1
1198	голосом у достоевского нет	1	1
1199	опирается на наличные и	1	1
1200	как герои порождаются самим	1	1
1201	идеологическая установка видит в	1	1
1202	как человека с человеком	1	1
1203	он ищет высшую авторитетнейшую	1	1
1204	письме к страхову в	1	1
1205	и устойчивые положения семейные	1	1
1206	напротив именно одежда облегающая	1	1
1207	положение такое положение в	1	1
1208	взаимоотношения созидаются сюжетом и	1	1
1209	вершки достоевский прежде всего	1	1
1210	и биографического романа связывает	1	1
1211	мои убеждения? проверка же	1	1
1212	такой сюжет всецело опирается	1	1
1213	не философия а вера	1	1
1214	он нигде не доказывает	1	1
1215	достоевского стремление внести исключительность	1	1
1216	к тому же миру	1	1
1217	не должна нести в	1	1
1218	друг от друга весь	1	1
1219	герои как герои порождаются	1	1
1220	славянофильский голос рассуждаю я	1	1
1221	жизненным местом что сама	1	1
1222	с повседневным если авторы	1	1
1223	мире субъектов одному из	1	1
1224	есть согласие с внутренними	1	1
1225	предопределен и не ограничен	1	1
1226	хотя и не объяснять	1	1
1227	типа или темперамента такой	1	1
1228	человеческих отношений заключенных в	1	1
1229	этого литературного жанра в	1	1
1230	жизни кроме одного социального	1	1
1231	семейного положения своего возраста	1	1
1232	развертывается перед ним как	1	1
1233	и торжества жаждой обладания	1	1
1234	одежда это тело и	1	1
1235	и следовательно никаких внесюжетных	1	1
1236	даны здесь не в	1	1
1237	художественном творчестве не сделал	1	1
1238	и категории а вы	1	1
1239	мысли к мысли а	1	1
1240	в центре его творчества	1	1
1241	социальным миром в котором	1	1
1242	вас улетела остались одни	1	1
1243	одежда которую он может	1	1
1244	так аристократ бульварного романа	1	1
1245	и сознает его но	1	1
1246	здесь исключена герой приобщается	1	1
1247	слова в произведениях достоевского	1	1
1248	искру симпатии к униженным	1	1
1249	этих отношений герои размещены	1	1
1250	и непроницаемом облачении своего	1	1
1251	в этом смысле не	1	1
1252	жаждой победы и торжества	1	1
1253	которую он может менять	1	1
1254	образ или этот высший	1	1
1255	сюжетом и могут существенно	1	1
1256	материал развертывается перед ним	1	1
1257	романа зато авантюрный роман	1	1
1258	тому же миру униженных	1	1
1259	чувственной любовью определяют авантюрный	1	1
1260	с ошибкой со христом	1	1
1261	уже наличной действительности не	1	1
1262	авантюрной литературы традиционные узоры	1	1
1263	его мысль пробирается через	1	1
1264	романе достоевского однако нам	1	1
1265	которые здесь достигают своего	1	1
1266	не как завершающую жизненную	1	1
1267	окрашивать произведения как личный	1	1
1268	с соперником любящего с	1	1
1269	тургеневым толстым с западно-европейскими	1	1
1270	сословия своего семейного положения	1	1
1271	социальных тенденциях конечно конечно	1	1
1272	славянским наклонностям? что если	1	1
1273	всю владычествующую идею и	1	1
1274	их духе и в	1	1
1275	без истины в теоретическом	1	1
1276	сюжетом и сюжетом же	1	1
1277	указанные гроссманом функции побочные	1	1
1278	существенно сближаться с тургеневым	1	1
1279	указанные им функции действительно	1	1
1280	между собою глава четвертая	1	1
1281	устойчивые положения семейные социальные	1	1
1282	с ним а следование	1	1
1283	не исключает из своей	1	1
1284	из своих корреспондентов достоевский	1	1
1285	мечтают и жаждут воплотиться	1	1
1286	вы этому как будто	1	1
1287	я не за роман	1	1
1288	трудный путь через лабиринт	1	1
1289	а скорее на то	1	1
1290	находим здесь типичнейшую черту	1	1
1291	глубокий след в его	1	1
1292	для чего понадобился достоевскому	1	1
1293	достоевского всюду его мысль	1	1
1294	из этой в основном	1	1
1295	богат но не нравственность	1	1
1296	не опровергнете в этих	1	1
1297	положений не сочетает мыслей	1	1
1298	мысль двустороння и эти	1	1
1299	сюжет всецело опирается на	1	1
1300	он-то и есть наилучший	1	1
1301	творчества достоевского стремление внести	1	1
1302	следует развитие этой точки	1	1
1303	мужа с женой соперника	1	1
1304	а чистая функция приключений	1	1
1305	же не завершен и	1	1
1306	здесь никогда не может	1	1
1307	функции действительно присущи авантюрному	1	1
1308	бытового биографического к которым	1	1
1309	бы авантюрный сюжет ограничил	1	1
1310	монологическою мыслью но мир	1	1
1311	романтическому принципу возвышенное с	1	1
1312	может воплотиться у него	1	1
1313	пишет прибавьте тут сверх	1	1
1314	проблема взаимоотношений этих сознающих	1	1
1315	своим образом как и	1	1
1316	с сыном мужа с	1	1
1317	путь его лежит не	1	1
1318	бесах он пишет майкову	1	1
