5352	на первый взгляд наиболее	1	1
5353	звучит как бы рядом	1	1
5354	подполья нам буквально нечего	1	1
5355	оформления только в свете	1	1
5356	негоголевского материала почти не	1	1
5357	особым образом сочетается с	1	1
5358	и совершенной независимостью от	1	1
5359	гегелевский дух и церковь	1	1
5360	романа и вызывает на	1	1
5361	всяком романе не лейтмотив	1	1
5362	сложившиеся формы европейского в	1	1
5363	отношении к другому сознанию	1	1
5364	многопланность романа достоевского со	1	1
5365	чистой функцией осознания им	1	1
5366	наоборот все в нем	1	1
5367	он старается предвосхитить возможное	1	1
5368	случае они могли бы	1	1
5369	самосознания в монологическом замысле	1	1
5370	прагматически разъединенных элементов сюжетов	1	1
5371	на ряд самостоятельных и	1	1
5372	плоскости романа непосредственно в	1	1
5373	в творческий замысел художника	1	1
5374	достоевского та правда к	1	1
5375	его мир поэтому и	1	1
5376	осведомление должна быть по-новому	1	1
5377	перестать быть самим собою	1	1
5378	в объективности творчеству других	1	1
5379	и не может сосредоточиться	1	1
5380	и вера и ведут	1	1
5381	мистике сколько в создании	1	1
5382	антиномии вместо взаимодействия нескольких	1	1
5383	и человек из подполья	2	1
5384	же некоторую равную ценность	1	1
5385	перед нами не произведение	1	1
5386	мысль он умел найти	1	1
5387	эти связи предполагают объектность	1	1
5388	становление духа ибо путь	1	1
5389	культивировал и вознес на	1	1
5390	другом как этапы становления	1	1
5391	психопатологическое определение его внутреннего	1	1
5392	потому дает ценный материал	1	1
5393	героев и самого автора	1	1
5394	лишь объект ее введение	1	1
5395	монологический роман в своей	1	1
5396	в творчестве достоевского но	1	1
5397	рядом с его точкой	1	1
5398	единству изображаемого события мысль	1	1
5399	таких героев как соня	1	1
5400	в этом смысле глубоко	1	1
5401	в человеческом я закон	1	1
5402	а как он осознает	1	1
5403	героя уже само по	1	1
5404	многоголосость эпохи достоевского положение	1	1
5405	особенность проявилась в эсхатологизме	1	1
5406	ничего не объясняющим в	1	1
5407	романа в его целом	1	1
5408	он сам для себя	1	1
5409	в своем существе непонятым	1	1
5410	стремится воспринять как разные	1	1
5411	действительность второго порядка доминанта	1	1
5412	духа действительно отвечающий гегелианской	1	1
5413	свободы царство вечной радости	1	1
5414	симпатиями и оценками провозглашает	1	1
5415	вышло бы несколько шершавее	1	1
5416	не выражают диалектического становления	1	1
5417	статья аскольдова психология характеров	1	1
5418	раздвоение там где видели	1	1
5419	сосуществование и взаимодействие духовного	1	1
5420	теории искусства его задача	1	1
5421	в какой бы форме	1	1
5422	стенографе после которого я	1	1
5423	до последней черты свое	1	1
5424	его художественного видения наконец	1	1
5425	форма ее разрешения поэтому	1	1
5426	предстать эта форма философствования	1	1
5427	или мистической розы души	1	1
5428	только он сумел поставить	1	1
5429	что он ищет непосредственного	1	1
5430	зрения толстого и его	1	1
5431	ничего не вспоминают у	1	1
5432	разнороднейший материал достоевского был	1	1
5433	многих сознаний не сливающихся	1	1
5434	одно качество он вскрывал	1	1
5435	критическая литература о достоевском	1	1
5436	и оформляя это многообразие	1	1
5437	процессе напряженнейшего взаимодействия с	1	1
5438	взаимоотношения с другими личностями	1	1
5439	которые были бы ничьими	1	1
5440	в музыке так и	1	1
5441	земля третье понятие земля	1	1
5442	каждом явлении настоящего увидеть	1	1
5443	радости и веселья таковы	1	1
5444	него в одной экстенсивной	1	1
5445	видим мы его слышим	1	1
5446	построение романа выходит за	1	1
5447	над личным стилем и	1	1
5448	вечность где есть нераскаянные	1	1
5449	их сложными и мучительными	1	1
5450	все вещное и объектное	1	1
5451	ибо путь его творчества	1	1
5452	это действующими лицами благодаря	1	1
5453	я озаглавил его фантастическим	1	1
5454	мировоззрения автора с точки	1	1
5455	противоположности он бросает решительный	1	1
5456	причастен этой противоречивой многопланности	1	1
5457	как вечная гармония неслиянных	1	1
5458	она не удалась автору	1	1
5459	в человеке а говоря	1	1
5460	на немногих именно на	1	1
5461	который взрастил господь взяв	1	1
5462	сдержанные как верфель создают	1	1
5463	конца объектом другого это	1	1
5464	друга понятий суждений и	1	1
5465	в твердый социально-характерологический облик	1	1
5466	сама эпоха сделала возможным	1	1
5467	настоящем и в этом	1	1
5468	переносит доминанту этого мира	1	1
5469	становящемуся ряду но развертывались	1	1
5470	как существенный момент самой	1	1
5471	идет нужно сказать что	1	1
5472	встали при выходе за	1	1
5473	следовательно теми элементами из	1	1
5474	монолитной"? такой роман как	1	1
5475	среда здесь господствует механическая	1	1
5476	какую-то иную связь по	1	1
5477	как не находим более	1	1
5478	идее он беззащитен перед	1	1
5479	входила в творческий замысел	1	1
5480	дает созерцающему опоры для	1	1
5481	и рассчитанный план целого	1	1
5482	пафосу его героев и	1	1
5483	у достоевского становится объектом	1	1
5484	правильно оценить двойника самосознание	1	1
5485	казни употребил почти такой	1	1
5486	самого достоевского точнее его	1	1
5487	которые он делает в	1	1
5488	форме сбивчивой то он	1	1
5489	и почтительно склоняясь перед	1	1
5490	центральным объектом для других	1	1
5491	работы сырые клочья будничной	1	1
5492	отношению к себе самому	1	1
5493	полифонии данте а не	1	1
5494	довлеет своему моменту что	1	1
5495	картина для него таким	1	1
5496	превращается в плохое философское	1	1
5497	его комизм и его	1	1
5498	героя каузальными и генетическими	1	1
5499	все твердое и неизменное	1	1
5500	по отношению к автору	1	1
5501	выводам и энгельгардта основной	1	1
5502	но у достоевского они	1	1
5503	и тонкости провоцирующих художественных	1	1
5504	и воспринял девушкина белинский	1	1
5505	основе трагической катастрофы у	1	1
5506	особенностей его героев и	1	1
5507	самостоятельным ибо все то	1	1
5508	выйти за их пределы	1	1
5509	достоевского романы его как	1	1
5510	то для него не	1	1
5511	так же доминантой при	1	1
5512	бы авторский мир совпадал	1	1
5513	противостояния чисто монологическая подлинная	1	1
5514	синтезом снимающим предшествующие звенья	1	1
5515	обходит отвечая в сущности	1	1
5516	перерождение остаются у толстого	1	1
5517	притом не только к	1	1
5518	и сам был уверен	1	1
5519	художественное видение оказывается уже	1	1
5520	общества но это не	1	1
5521	позже что довлеет своему	1	1
5522	совершенной независимостью от внешней	1	1
5523	другими сознаниями то оно	1	1
5524	не согласиться с этим	1	1
5525	подлинно драматический диалог может	1	1
5526	и спокойно созерцающего монологического	1	1
5527	действительности лишенные прагматических связей	1	1
5528	сознаний в этом смысле	1	1
5529	рядом с его кругозором	1	1
5530	исключительное значение диалога в	1	1
5531	этических утверждений которые не	1	1
5532	своего творчества достоевский изображает	1	1
5533	ввести это слово в	1	1
5534	как позицию личности поэтому	1	1
5535	не созерцает не изображает	1	1
5536	посвящена герою герой интересует	1	1
5537	нет в формальной полифонии	1	1
5538	настоящим и переживается ими	1	1
5539	голос самого автора в	1	1
5540	не перестало быть настоящим	1	1
5541	на показ на позор	1	1
5542	понятой или недооцененной в	1	1
5543	прием и хоть и	1	1
5544	тех противоречиях в которых	1	1
5545	управляющей сознанием и жизнью	1	1
5546	лишь в плоскости сосуществования	1	1
5547	слова сами по себе	1	1
5548	как художник подымается до	1	1
5549	полифонии именно в том	1	1
5550	наконец и это главное	1	1
5551	завершающим авторским определениям это	1	1
5552	бы записанное и есть	1	1
5553	независимостью от внешней среды	1	1
5554	на позор на рынок	1	1
5555	его он превратил в	1	1
5556	термин идеологический роман представляется	1	1
5557	он переносит свои объяснения	1	1
5558	за собою употребляя для	1	1
5559	генетическими факторами не могут	1	1
5560	собирает мысли в точку	1	1
5561	него как в идейном	1	1
5562	своей индивидуальности и не	1	1
5563	в гуманном направлении укладываясь	1	1
5564	монологического канона построения романа	1	1
5565	он не знал бы	1	1
5566	делал только из лени	1	1
5567	не мир достоевского последнее	1	1
5568	и праведники или может	1	1
5569	авторской точки зрения монологически	1	1
5570	на ряд ценнейших наблюдений	1	1
5571	достоевский в авторском предисловии	1	1
5572	его романах поразительная внутренняя	1	1
5573	в один миг не	1	1
5574	на кажущуюся последовательность речи	1	1
5575	если бы эти клоки	1	1
5576	обычно служат предметом изображения	1	1
5577	лирическому принципу необходимо заметить	1	1
5578	его внешний мир и	1	1
5579	романах достоевского вот как	1	1
5580	своего приема мир толстого	1	1
5581	связей нашего опыта роман	1	1
5582	во все зеркала чужих	1	1
5583	строит героя не из	1	1
5584	романе достоевского нарушено но	1	1
5585	и веселья таковы по	1	1
5586	принципы сочетания голосов вовсе	1	1
5587	одном миге возможно большее	1	1
5588	идей в себе в	1	1
5589	кругозорами сочетаются в высшее	1	1
5590	вы только колеблетесь потому	1	1
5591	вообще нет становления нет	1	1
5592	оно может быть перенесено	1	1
5593	унизительно может быть скажете	1	1
5594	и оценкам объективируя и	1	1
5595	плане художественного творчества если	1	1
5596	господь взяв семена из	1	1
5597	мысли и сердца тут	1	1
5598	ведь если бы действительно	1	1
5599	идеологическое взаимное игнорирование друг	1	1
5600	этих идеологических голосов для	1	1
5601	о себе самом во	1	1
5602	прибегать или к антиномике	1	1
5603	что было дано в	1	1
5604	него уже и нет	1	1
5605	бы оправдывают все эти	1	1
5606	его главам своеобразно сочетается	1	1
5607	по отношению к сознанию	1	1
5608	с полноценными же голосами	1	1
5609	многопланность и полифоничность мистерии	1	1
5610	все это действующими лицами	1	1
5611	героями так и объектно	1	1
5612	многообразия а не этапы	1	1
5613	пустое единство индивидуального волевого	1	1
5614	конструкции в нарушении единой	1	1
5615	господствует механическая необходимость здесь	1	1
5616	искать для автора какую-то	1	1
5617	процесс самосознания переводятся из	1	1
5618	несмотря на свою философскую	1	1
5619	же голосами других героев	1	1
5620	бы плохим бесстильным художником	1	1
5621	последней основе всегда одноакцентный	1	1
5622	в романе драматическому принципу	1	1
5623	последние же скрепы созидающие	1	1
5624	смысловой материал и материал	1	1
5625	иметь в себе хоть	1	1
5626	нерастворимая в ней о	1	1
5627	и излагается взволнованным человеческим	1	1
5628	сказали монологично роман достоевского	1	1
5629	его замкнутость в своем	1	1
5630	историческая картина для него	1	1
5631	и работник для толстого	1	1
5632	полноценных сознаний в первом	1	1
5633	для создания твердого и	1	1
5634	случае не сосредоточены просто	1	1
5635	обычного монологического единства подобно	1	1
5636	по иванову должны разрешить	1	1
5637	преодолеть свой этический солипсизм	1	1
5638	слово о себе слово	1	1
5639	понимать все голоса сразу	1	1
5640	стало стремится сохранить за	1	1
5641	месте и в одно	1	1
5642	самого автора вылущивались идеологические	1	1
5643	целое романа настоящая глава	1	1
5644	один миг не совпадает	1	1
5645	в момент его самосознания	1	1
5646	подлиннейшим выражением духа капитализма	1	1
5647	поверхностно-композиционном авторском слове и	1	1
5648	смысле глубоко объективны и	1	1
5649	хоть и не вывел	1	1
5650	особенность творчества достоевского как	1	1
5651	от земли интеллигент-разночинец представитель	1	1
5652	образом объективные противоречия эпохи	1	1
5653	и ценностно противоречив противоречивые	1	1
5654	но конечно эта особенность	1	1
5655	доминанта в построении образов	1	1
5656	у достоевского как формы	1	1
5657	за пределы объективно наличного	1	1
5658	человека логический ряд приобщается	1	1
5659	свободе относительной конечно и	1	1
5660	или даже психопатологическое определение	1	1
5661	одна из идей героев	1	1
5662	воззрения пытаются доразвить до	1	1
5663	кажутся нам те выводы	1	1
5664	его величайшею силой но	1	1
5665	органически тяготеет к становящемуся	1	1
5666	сделан из одного куска	1	1
5667	выражением духа капитализма те	1	1
5668	нем наличность и другого	1	1
5669	как другой субъект ты	1	1
5670	самосознания даже самую наружность	1	1
5671	непременно входят в один	1	1
5672	ослабленный до простой формы	1	1
5673	мы превращаем в термин	1	1
5674	не предопределен он мыслится	1	1
5675	то что выполнял автор	1	1
5676	кругозора то перед нами	1	1
5677	представляет основную тему творчества	1	1
5678	клялся любить алеша карамазов	1	1
5679	родственность конструктивных элементов данного	1	1
5680	самого героя и здесь	1	1
5681	звенья сложного философского построения	1	1
5682	находятся у него в	1	1
5683	искусства его задача преодолеть	1	1
5684	задача объединения несовместимого не	1	1
5685	основные темы романов достоевского	1	1
5686	неискупленный грех преступление непрощенная	1	1
5687	здесь же нам важен	1	1
5688	каждом слове его творений	1	1
5689	совершенно новое видение и	1	1
5690	сад который взрастил господь	1	1
5691	сценой гротеском или даже	1	1
5692	приводились в движение по	1	1
5693	только методологическою беспомощностью критической	1	1
5694	допускалось в искусстве виктор	1	1
5695	развивается не становится и	1	1
5696	эпитет жестокий талант данный	1	1
5697	объекта авторского вывода именно	1	1
5698	гоголевский мир мир шинели	1	1
5699	объяснений из прошлого из	1	1
5700	повествований и боговдохновенные страницы	1	1
5701	ни героев отрицательных ни	1	1
5702	фигурируют и философские воззрения	1	1
5703	него или пробным камнем	1	1
5704	и работник самосознание и	1	1
5705	полифонии характерно понимание гроссманом	1	1
5706	вопреки прагматическому правдоподобию как	1	1
5707	голосе он умел слышать	1	1
5708	из аспектов действительности то	1	1
5709	не завершают его именно	1	1
5710	отлично знает сам и	1	1
5711	что основное у достоевского	1	1
5712	этим образом даже там	1	1
5713	своем творчестве этот опыт	1	1
5714	укоренен в бытии и	1	1
5715	и оценками провозглашает одно	1	1
5716	себе он представляет в	1	1
5717	структуре романа по отношению	1	1
5718	и особым образом сочетается	1	1
5719	была слишком непосредственным идеологическим	1	1
5720	в романе обычного типа	1	1
5721	и тайне мира должна	1	1
5722	байрона например сознание героя	1	1
5723	глубоко чуждых материалов единое	1	1
5724	сказать что из каждого	1	1
5725	познавательно делает следовательно и	1	1
5726	процессе этого критического анализа	1	1
5727	смотрится как бы во	1	1
5728	слишком узкие возможности достоевский	1	1
5729	об идее подобно тому	1	1
5730	функции эпитет жестокий талант	1	1
5731	истолковывает как философско-монологическую волю	1	1
5732	как можно больше тем	1	1
5733	мы видим не кто	1	1
5734	зависимости от того в	1	1
5735	для литературоведа и только	1	1
5736	версилова к ахмаковой символ	1	1
5737	устойчивый авторский кругозор самосознание	1	1
5738	а как материал его	1	1
5739	принципу построены как бы	1	1
5740	предполагающей единство и во	1	1
5741	этих социальных сфер в	1	1
5742	как факт личной жизни	1	1
5743	его нейтральным образом как	1	1
5744	отказывается от всех этих	1	1
5745	за ним стенограф то	1	1
5746	у достоевского никогда не	1	1
5747	автора как предмет видения	1	1
5748	же идеями-героинями как и	1	1
5749	образом монологизует художественный мир	1	1
5750	бедного чиновника которую изображал	1	1
5751	уподоблен художественному целому в	1	1
5752	чтобы его услышать и	1	1
5753	получается или нарочитый и	1	1
5754	занимает громадное место в	1	1
5755	внутренне осмыслены в своей	1	1
5756	гармония неслиянных голосов или	1	1
5757	притом пределами повести но	1	1
5758	частушка рядом с шиллеровским	1	1
5759	ни одной черточки героя	1	1
5760	исключительной важности высказанных здесь	1	1
5761	например в девушкине или	1	1
5762	своего самосознания чтобы в	1	1
5763	глубочайшей сущности энгельгардт недооценивает	1	1
5764	целесообразной активности в романе	1	1
5765	только материал у него	1	1
5766	для него была именно	1	1
