1	в то же время	8	6
2	не что иное как	1	4
3	и не может быть	1	4
4	бы то ни было	4	3
5	в той или иной	3	3
6	в том что он	2	2
7	ни в коем случае	2	2
8	одного и того же	4	2
9	какой бы то ни	2	2
10	но в то же	5	2
11	в коем случае не	1	2
12	одно и то же	3	1
13	не говоря уже о	1	1
14	не может быть сведена	1	1
15	в свою очередь оказывает	1	1
16	то же время они	1	1
17	не сам по себе	1	1
18	так как если бы	2	1
19	не может быть ничего	1	1
20	не сами по себе	1	1
21	речь идет об одном	1	1
22	в таком случае это	2	1
23	той или иной форме	1	1
24	в собственном смысле слова	2	1
25	бы оно ни было	1	1
26	может быть сведена к	1	1
27	с той или иной	1	1
28	на самом же деле	3	1
29	в том числе и	1	1
30	в самом деле как	1	1
