N	4gram	Tiupa_Narr_2	Hudozhes
857	акцентирует этот момент назойливой	1	1
858	личности явно диссонируют такова	1	1
859	за приятной улыбкой и	1	1
860	то что свойственно определенной	1	1
861	конструированием своего я напротив	1	1
862	специфически человеческий способ существования	1	1
863	объективно существующего другого человека	1	1
864	несомненно на стороне лиды	1	1
865	момент назойливой повторяемостью того	1	1
866	спасаем человечества и быть	1	1
867	чеховских героев сказал что	1	1
868	узнаем что громадные неуклюжие	1	1
869	способах благодаря которым можно	1	1
870	тем обесценил свою художественную	1	1
871	лида может полюбить только	1	1
872	что вернулась из церкви	1	1
873	не будут делать то	1	1
874	едва ли найдется хоть	1	1
875	обобщающая мысль иначе движется	1	1
876	а как к единичному	1	1
877	и школы легче чем	1	1
878	модификациям собственной характерности к	1	1
879	формируется в ходе социальной	1	1
880	в системе внешних обстоятельств	1	1
881	дли данного общества данного	1	1
882	предшественников [...] то что	1	1
883	жизнь которая не в	1	1
884	т п все эти	1	1
885	чехов рисует героев воспитанных	1	1
886	же индивидуальная форма общечеловеческого	1	1
887	понималось воспроизведение в литературе	1	1
888	в его утопически-нигилистических убеждениях	1	1
889	рассказа затем к обретенной	1	1
890	полемически соотнесенную с соломоновой	1	1
891	непоколебимая правильность лиды резко	1	1
892	мезонином где конкретно-историческая проблематика	1	1
893	создавался литературный тип под	1	1
894	персонажей иначе как хотелось	1	1
895	личности внешним конструированием своего	1	1
896	формам человеческих отношений лида	1	1
897	свои речи у волчаниновых	1	1
898	иначе движется нежели у	1	1
899	характер есть личность понятая	1	1
900	что у нее тревожно	1	1
901	было бы включить мысли	1	1
902	облик сформировавшийся в системе	1	1
903	и когда все так	1	1
904	задачу лидия волчанинова натура	1	1
905	и довольства собою довольства	1	1
906	мы делаем то что	1	1
907	социальным футляром личности в	1	1
908	кривенко иной раз того	1	1
909	от лессинговой аксиомы характерологичности	1	1
910	ложное искаженное инобытие личности	1	1
911	этой своей чисто внешней	1	1
912	отрицать больницы и школы	1	1
913	и разговорами о пустяках	1	1
914	церкви и пьет чай	1	1
915	умения скрывать их за	1	1
916	а липовский о настроениях	1	1
917	в качестве функции внешних	1	1
918	мироотношение одушевленное исканием смысла	1	1
919	земских делах и прочих	1	1
920	можем тем не менее	1	1
921	но напротив все отчетливее	1	1
922	лиде художник ценит скрытую	1	1
923	с мезонином где конкретно-историческая	1	1
924	лишь то что свойственно	1	1
925	это действительно так художник	1	1
926	относится к герою нс	1	1
927	личности наиболее характерной дли	1	1
928	из сестер волчаниновых упоенно	1	1
929	характеров самоактуализация составляет духовное	1	1
930	стороне лиды и причина	1	1
931	иной жизни иной личности	1	1
932	никитин учитель словесности интересен	1	1
933	своего я напротив всякий	1	1
934	но при этом читатель	1	1
935	бабой но для него	1	1
936	событие [...] только характеры	1	1
937	всего лишь внешнее по	1	1
938	дома пахнет резедой и	1	1
939	на то чтобы обрести	1	1
940	как симптом эпохи просматривался	1	1
941	определению с с аверинцева	1	1
942	остро вопрос о способах	1	1
943	для межличностных контактов в	1	1
944	отчужденно дистанцированно как первые	1	1
945	открытие весьма отчужденно дистанцированно	1	1
946	ее характеру она обладает	1	1
947	она сама трезво осознает	1	1
948	встреча с другим я	1	1
949	избрать предпочтительнее то а	1	1
950	его межличностные связи если	1	1
951	уникальному объединяющимся в личностном	1	1
952	перед лидой не в	1	1
953	другой личности внешним конструированием	1	1
954	в нем пейзажиста земца	1	1
955	практический же итог его	1	1
956	на стороне лиды и	1	1
957	а не каждому характерное	1	1
958	только характеры священны для	1	1
959	ошибаемся но мы делаем	1	1
960	а явление людям меня	1	1
961	литературный тип под которым	1	1
962	душевные переживания героя внутренние	1	1
963	автономии под утро он	1	1
964	ее характером личность не	1	1
965	мило одеты и веселы	1	1
966	обретенной социальной устроенности обеспеченности	1	1
967	по определению с с	1	1
968	термин? нет это отдельные	1	1
969	это открытие весьма отчужденно	1	1
970	мотивировано а волынский разве	1	1
971	социальная обособленность человека его	1	1
972	xx века в лице	1	1
973	как он относится и	1	1
974	же формируется в ходе	1	1
975	как правило неадекватны их	1	1
976	герое определяло его характер	1	1
977	этом всерьез к социально-ролевым	1	1
978	в конечном счете характер	1	1
979	смежные но не тождественные	1	1
980	у людей положительных рассудительных	1	1
981	я поэтому обладательница сильного	1	1
982	стороне лиды отрицать больницы	1	1
983	здесь не в том	1	1
984	самом деле не была	1	1
985	чехов решительно отступает от	1	1
986	из церкви и пьет	1	1
987	пытаясь постичь чужую личность	1	1
988	в ладу с покоем	1	1
989	этот литературный термин? нет	1	1
990	ответственной самоактуализации человеческого я	1	1
991	сказал что они более	1	1
992	способна оказаться футляром личности	1	1
993	рассказе с подлинным художником	1	1
994	руки правда мы не	1	1
995	современной писателю критике он	1	1
996	противоречиво сопряжена с совершенно	1	1
997	против теории малых дел	1	1
998	тому что он вовсе	1	1
999	нежели у его предшественников	1	1
1000	интерес к иной жизни	1	1
1001	во многом ошибаемся но	1	1
1002	характерности к робости неловкости	1	1
1003	угадывалась личность чтобы в	1	1
1004	одерживает практическую победу удаляя	1	1
1005	в себе другого для	1	1
1006	в ее поступке обнаруживается	1	1
1007	мнению б м мейлаха	1	1
1008	лиды уязвима но достаточно	1	1
1009	разговорами о пустяках при	1	1
1010	чуткий читатель чьи симпатии	1	1
1011	относясь при этом всерьез	1	1
1012	волчанинова натура активная деятельная	1	1
1013	не мотивировано а волынский	1	1
1014	характеры священны для него	1	1
1015	может полюбить только земца	1	1
1016	ценит скрытую ее характером	1	1
1017	сторона характера тогда как	1	1
1018	романе считалось высшим достижением	1	1
1019	не тождественные о личности	1	1
1020	и уникальному объединяющимся в	1	1
1021	личности лида для которой	1	1
1022	тому что счастье [...]	1	1
1023	в глазах автора личностности	1	1
1024	манера разговаривать не глядя	1	1
1025	но одновременно и всеобщность	1	1
1026	то испытывает чувство стыда	1	1
1027	личностности если бы чехов	1	1
1028	для других демонстративно не	1	1
1029	к жизни в целом	1	1
1030	немного прислушался потом когда	1	1
1031	вещь личность же мыслима	1	1
1032	рассказывает историю своей встречи	1	1
1033	нервностью и называл себя	1	1
1034	неадекватности искусственности заемности чехов	1	1
1035	явление людям меня самого	1	1
1036	так легко представить себе	1	1
1037	характер ее результат сознательного	1	1
1038	прав так сказать утопически	1	1
1039	мысли и воображения читателя	1	1
1040	их за приятной улыбкой	1	1
1041	возмущена ничто не объяснено	1	1
1042	зрителями собственного якобы самобытного	1	1
1043	не в ладу с	1	1
1044	иной раз того или	1	1
1045	но изнутри личности самого	1	1
1046	показывает в я линков	1	1
1047	себя бабой но для	1	1
1048	сформировавшийся в системе внешних	1	1
1049	человека есть его единичность	1	1
1050	постоял немного прислушался потом	1	1
1051	в качестве некоторого я	1	1
1052	вступает в противоречие с	1	1
1053	к себе лирически узнавая	1	1
1054	правильность лиды резко характерны	1	1
1055	поступке обнаруживается ущербность земской	1	1
1056	другое событие [...] только	1	1
1057	больницы и школы легче	1	1
1058	не в его утопически-нигилистических	1	1
1059	все эти здоровые сытые	1	1
1060	уже было ясно что	1	1
1061	внешним обликом с социальным	1	1
1062	мы привыкли понимать этот	1	1
1063	ролевые отношения между людьми	1	1
1064	в своих инвективах против	1	1
1065	человеку и к жизни	1	1
1066	служения ближним нельзя сидеть	1	1
1067	человеке прежде всего его	1	1
1068	приходится к себе самому	1	1
1069	и напротив чтобы осмыслить	1	1
1070	п все эти не	1	1
1071	хочется чтобы вся жизнь	1	1
1072	того или иного раздраженного	1	1
1073	столь легко одерживает практическую	1	1
1074	жизни и так или	1	1
1075	так и уникальному объединяющимся	1	1
1076	деловитость серьезность непоколебимая правильность	1	1
1077	он творец своего счастья	1	1
1078	собеседника преимущество художника перед	1	1
1079	я героя характер чеховского	1	1
1080	судим по ее характеру	1	1
1081	собственно художественной персонологической проблематикой	1	1
1082	характера среди любых событий	1	1
1083	жизнь была такою в	1	1
1084	чего-то общего культуры идеологии	1	1
1085	под которым в xix	1	1
1086	здоровые гуманистические мотивы в	1	1
1087	ущербность земской деятельницы как	1	1
1088	равной степени противостоит как	1	1
1089	в дотолстовском романе считалось	1	1
1090	мы узнаем что громадные	1	1
1091	и нормам к окружающим	1	1
1092	окружающим ее лицам самоактуализация	1	1
1093	делах и прочих вещах	1	1
1094	нормам к окружающим ее	1	1
1095	ради такой девушки можно	1	1
1096	это диалогически-личностная встреча с	1	1
1097	даром как бы в	1	1
1098	нервная сознательная жизнь которая	1	1
1099	эстетически чуткий читатель чьи	1	1
1100	когда зеленый сад еще	1	1
1101	вопрос о способах благодаря	1	1
1102	крайне упростил и тем	1	1
1103	автора личностности если бы	1	1
1104	своих героев романтиками так	1	1
1105	психологическом есть продукт ответственной	1	1
1106	громадные неуклюжие калоши [...]	1	1
1107	как вещь личность же	1	1
1108	художника и мисюсь личностны	1	1
1109	характер приходится к себе	1	1
1110	каждому характерное в равной	1	1
1111	земца представителя молодежи и	1	1
1112	спора рассказчика-художника с лидой	1	1
1113	его ролевой типажный психологический	1	1
1114	достаточно вспомнить некоторые жанровые	1	1
1115	что она в самом	1	1
1116	лице своих виднейших представителей	1	1
1117	вернулась из церкви и	1	1
1118	хотелось того современной писателю	1	1
1119	которым в xix в	1	1
1120	благодаря которым можно было	1	1
1121	напротив все отчетливее кристаллизуется	1	1
1122	лиц у чехова как	1	1
1123	что сумел увлечься и	1	1
1124	правда мы не спасаем	1	1
1125	инобытие личности для других	1	1
1126	томится недовольством собой то	1	1
1127	того что лида говорит	1	1
1128	о настроениях чеховских героев	1	1
1129	пьет чай в саду	1	1
1130	ходе социальной адаптации личности	1	1
1131	бесхарактерные послушные воле лиды	1	1
1132	в.я линков обобщающая мысль	1	1
1133	людей положительных рассудительных и	1	1
1134	сложа руки правда мы	1	1
1135	до повторений диктуемой ею	1	1
1136	человеческий способ существования характерным	1	1
1137	неадекватны их внутреннему бытию	1	1
1138	в xix в обычно	1	1
1139	при этом читатель относится	1	1
1140	личность же мыслима только	1	1
1141	этот не может не	1	1
1142	на ногах только у	1	1
1143	совершенно иной собственно художественной	1	1
1144	бы включить мысли и	1	1
1145	положительных рассудительных и религиозно-убежденных	1	1
1146	п не случайна ее	1	1
1147	жизни вместо того чтобы	1	1
1148	нет это отдельные особи	1	1
1149	резко характерны но лишены	1	1
1150	особи в кривенко иной	1	1
1151	с его внешним обликом	1	1
1152	собеседника мисюсь не отгороженная	1	1
1153	другому как к себе	1	1
1154	объективно чужое я наблюдаемое	1	1
1155	этом вопреки лессингу не	1	1
1156	простым следствием частых посещений	1	1
1157	есть его единичность но	1	1
1158	художник же в своих	1	1
1159	покоем и личным счастьем	1	1
1160	люди весь длинный день	1	1
1161	одновременно и всеобщность поскольку	1	1
1162	сознательная жизнь которая не	1	1
1163	личностную самоактуализацию как возможность	1	1
1164	него уже было ясно	1	1
1165	по ее характеру она	1	1
1166	масштабы своего служения ближним	1	1
1167	xix в направил свои	1	1
1168	среди других характеров самоактуализация	1	1
1169	земской деятельницы как человека	1	1
1170	степени противостоит как универсальному	1	1
1171	затаенной неадекватности искусственности заемности	1	1
1172	можно не только стать	1	1
1173	мысль то испытывает чувство	1	1
1174	личностью это специфически человеческий	1	1
1175	внутренним я героя характер	1	1
1176	общества данного социально-бытового уклада	1	1
1177	счастья преодолевший сиротство бедность	1	1
1178	чехов акцентирует этот момент	1	1
1179	самоопределения выбора жизненной программы	1	1
1180	самоактуализации человеческого я характер	1	1
1181	характером мотивированным обстоятельствами угадывалась	1	1
1182	проблематика идейного спора рассказчика-художника	1	1
1183	в нее личность же	1	1
1184	в споре несомненно на	1	1
1185	в личности увиденной как	1	1
1186	самоопределения пытаясь постичь чужую	1	1
1187	одеты и веселы и	1	1
1188	сообщалось о герое определяло	1	1
1189	детство тоскливую юность далее	1	1
1190	симпатии оказались бы на	1	1
1191	хоть один эстетически чуткий	1	1
1192	в ходе социальной адаптации	1	1
1193	словесности интересен не своим	1	1
1194	реалистически добротно вписанные в	1	1
1195	уязвима но достаточно сильна	1	1
1196	лечить н учить это	1	1
1197	и своей собственной жизни	1	1
1198	обстоятельств не впадая в	1	1
1199	наследует это открытие весьма	1	1
1200	тип в том смысле	1	1
1201	типажный психологический облик сформировавшийся	1	1
1202	скрытую ее характером личность	1	1
1203	от росы весь сияет	1	1
1204	и психологическом есть продукт	1	1
1205	внешним инобытием среди других	1	1
1206	вглядывается в лицо собеседника	1	1
1207	своего служения ближним нельзя	1	1
1208	все утихло отыскал свою	1	1
1209	добротно вписанные в бытовой	1	1
1210	меня самого личность в	1	1
1211	кризис все его мироотношение	1	1
1212	удаляя покоряющуюся ей мисюсь	1	1
1213	как универсальному так и	1	1
1214	и всеобщность поскольку быть	1	1
1215	легче чем лечить н	1	1
1216	реабилитирует личностную самоактуализацию как	1	1
1217	так художник же в	1	1
1218	конкретно-историческая проблематика идейного спора	1	1
1219	себя в другом и	1	1
1220	озадачена а порой и	1	1
1221	и к себе самому	1	1
1222	представить себе перенесенным на	1	1
1223	возможность неадаптивного пути самоопределения	1	1
1224	оказались бы на стороне	1	1
1225	сидеть сложа руки правда	1	1
1226	уважения но он чрезмерно	1	1
1227	определенности личность внутренняя сторона	1	1
1228	результат сознательного самоопределения выбора	1	1
1229	а чиновник бездарный и	1	1
1230	довольства собою довольства что	1	1
1231	тогда как характер внешняя	1	1
1232	в силу детерминизма обстоятельств	1	1
1233	а стороны этого характера	1	1
1234	всерьез к социально-ролевым формам	1	1
1235	форма общечеловеческого которое отнюдь	1	1
1236	противоречивой автономии под утро	1	1
1237	мы не спасаем человечества	1	1
1238	разговаривать не глядя на	1	1
1239	говорит о земских делах	1	1
1240	лиды мать и мисюсь	1	1
1241	характер и личность не	1	1
1242	характерное в равной степени	1	1
1243	обладательница сильного характера столь	1	1
1244	иначе как хотелось того	1	1
1245	послушные воле лиды мать	1	1
1246	как к представителю чего-то	1	1
1247	стороны этого характера переменчиво	1	1
1248	чужому я поэтому обладательница	1	1
1249	свою вешалку и ушел	1	1
1250	вовсе не педагог а	1	1
1251	для которой умершая от	1	1
1252	из басни крылова жестко	1	1
1253	рассказчике дома с мезонином	1	1
1254	усилия на то чтобы	1	1
1255	победу удаляя покоряющуюся ей	1	1
1256	определенной категории людей а	1	1
1257	деле не была счастлива	1	1
1258	повторений диктуемой ею фразы	1	1
1259	последнем разговоре с машей	1	1
1260	и личного в литературном	1	1
1261	искусственности заемности чехов акцентирует	1	1
1262	же мыслима только субъективно	1	1
1263	как можно догадаться творческий	1	1
1264	не своим вполне заурядным	1	1
1265	напротив чтобы осмыслить свой	1	1
1266	не со стороны характера	1	1
1267	где конкретно-историческая проблематика идейного	1	1
1268	к другому как к	1	1
1269	но личностным отношением изнутри	1	1
1270	не только не растворяется	1	1
1271	гимне праздности который так	1	1
1272	о земских делах и	1	1
1273	как первые русские реалисты	1	1
