1	заключается в том что	1	7
2	в том случае если	1	4
3	одной и той же	1	4
4	то же самое что	1	2
5	все более и более	2	2
6	в то же время	3	2
7	одна и та же	1	1
8	тех пор пока мы	1	1
9	в том смысле что	1	1
10	сами нуждаются в объяснении	1	1
11	в нем так же	1	1
12	если бы не было	2	1
13	и т п хотя	1	1
14	как и в первом	1	1
15	и не может быть	1	1
16	не что иное как	2	1
17	вместе с тем и	2	1
18	это похоже на то	1	1
19	один и тот же	2	1
20	есть не что иное	1	1
21	ту же роль что	1	1
22	и в том что	1	1
23	до тех пор пока	2	1
24	так же ошибочно как	1	1
25	одного и того же	1	1
26	для того чтобы при	1	1
27	не имеет никакого значения	1	1
28	заключенный в ней образ	1	1
29	в силу того что	1	1
30	но и в том	1	1
31	что же касается до	1	1
