1	и в самом деле	3	9
2	заключается в том что	2	4
3	одно и то же	1	2
4	в данном случае и	1	1
5	с этой точки зрения	1	1
6	заключается вовсе не в	1	1
7	то для того чтобы	1	1
8	была с самого начала	1	1
9	вовсе не в том	1	1
10	из него следует что	1	1
11	как если бы оно	1	1
12	одной и той же	2	1
13	заключается в том чтобы	1	1
14	о том что такое	5	1
15	того что в ней	1	1
16	состоит в том что	2	1
17	не вытекает из самого	1	1
18	в самом деле даже	1	1
19	и в этом отношении	1	1
20	ничего не может быть	1	1
21	для того чтобы эта	1	1
