1	в то же время	9	4
2	и в то же	2	2
3	и в этом смысле	2	2
4	как более или менее	1	2
5	что же это за	1	1
6	он есть т е	1	1
7	но в то же	5	1
8	по себе не имеет	1	1
9	и есть то что	1	1
10	само по себе не	1	1
11	в конце концов не	1	1
12	само по себе достаточно	1	1
13	и в этом отношении	2	1
14	так всегда и бывает	1	1
15	а в том что	1	1
16	если бы это было	1	1
17	дело в том что	1	1
18	в то время как	1	1
19	это было так то	1	1
20	бы это было так	1	1
21	можно было бы дать	1	1
22	лишь с точки зрения	1	1
