1	в то же время	12	5
2	отношение к себе самому	1	3
3	в большей или меньшей	1	2
4	большей или меньшей степени	1	2
5	и в то же	5	2
6	до сих пор еще	1	2
7	как мы уже говорили	1	2
8	обращены к себе самому	1	1
9	все более и более	1	1
10	той или иной форме	1	1
11	но тем не менее	1	1
12	может быть даже и	1	1
13	один и тот же	1	1
14	в той или иной	2	1
15	всех знает что он	1	1
16	к себе самому и	4	1
17	ипполита мое необходимое объяснение	1	1
18	для всех героев достоевского	1	1
19	но в то же	3	1
20	бы он ни был	3	1
21	в записках из подполья	2	1
22	произведений записки из подполья	1	1
23	в этом отношении очень	1	1
24	смысле можно сказать что	1	1
25	на самом же деле	1	1
26	о том что все	1	1
27	том что все позволено	1	1
28	мы можем сказать что	1	1
29	достоевского особенно в его	1	1
30	во всей своей полноте	1	1
31	легенда о великом инквизиторе	1	1
32	этом смысле можно сказать	1	1
33	лучше всех знает что	1	1
34	характерна для достоевского и	1	1
35	и на протяжении всего	1	1
36	то же время как	1	1
37	в этом смысле можно	1	1
38	с самим собою и	3	1
39	к себе самому к	1	1
40	или во всяком случае	1	1
41	нас прежде всего поражает	1	1
42	мы остановимся только на	1	1
43	не чем иным как	1	1
44	с самим собою в	1	1
45	исповедь ипполита мое необходимое	1	1
