1	во времени и пространстве	1	4
2	обращает на себя внимание	3	3
3	в то же время	2	3
4	в том или ином	2	2
5	состоит в том что	4	2
6	не что иное как	1	2
7	мы имеем дело не	1	1
8	с этой точки зрения	1	1
9	есть не что иное	1	1
10	в частности писал что	1	1
11	том что случилось однажды	1	1
12	высказывания в том или	1	1
13	имеем дело не с	1	1
14	но о том что	1	1
15	субъект объект и адресат	1	1
16	о том что случилось	1	1
17	в недискурсивных формах внутренней	1	1
18	в литературе нового времени	1	1
19	мира вокруг я героя	1	1
20	на себя внимание и	1	1
21	организации кадров внутреннего зрения	1	1
22	что вообще характерно для	1	1
23	своего рода ключ к	1	1
24	не о том что	1	1
25	единственный в тексте случай	1	1
26	в организации кадров внутреннего	1	1
27	в самом деле не	1	1
28	на себя внимание что	1	1
29	как уже говорилось выше	1	1
30	мы имеем дело с	1	1
31	недискурсивных формах внутренней речи	1	1
32	к тому же в	1	1
