1	в то же время	6	6
2	но в то же	3	4
3	в той или иной	1	2
4	в большей или меньшей	1	2
5	одной и той же	2	2
6	большей или меньшей степени	1	2
7	как она отразилась в	1	1
8	есть не что иное	2	1
9	может быть и не	1	1
10	какой бы то ни	1	1
11	хотя бы и не	1	1
12	имеет дело не с	1	1
13	не может быть в	1	1
14	бы то ни было	1	1
15	заключается в том чтобы	1	1
16	и прямо заявляет что	1	1
17	в связи с этим	1	1
18	именно для того чтобы	1	1
19	дело в том что	2	1
20	не что иное как	4	1
21	мы имеем в виду	1	1
22	той или иной степени	1	1
23	и прежде всего в	1	1
