1	с этой точки зрения	4	3
2	в тех случаях когда	1	3
3	таким образом мы видим	1	2
4	образом мы видим что	1	2
5	в то время как	4	2
6	состоит в том что	3	1
7	один и тот же	3	1
8	так же как и	1	1
9	ответ на этот вопрос	2	1
10	совершенно то же что	1	1
11	это означало бы что	1	1
12	что они имеют в	1	1
13	на вопрос о том	2	1
14	это один и тот	1	1
15	мы видим таким образом	1	1
16	совершенно так же как	1	1
17	на вопрос почему в	1	1
18	видим таким образом что	1	1
19	и тем более не	1	1
20	ответить на вопрос почему	1	1
