1	одно и то же	3	3
2	на самом же деле	1	3
3	в неразрывной связи с	1	2
4	с одной стороны и	3	2
5	и то же слово	1	2
6	с точки зрения самого	2	2
7	в том что он	2	2
8	одним и тем же	2	2
9	для того чтобы понять	1	2
10	в какой мере не	2	1
11	речи в этом случае	1	1
12	что он как и	1	1
13	с самого начала не	1	1
14	несмотря на то что	1	1
15	здесь как и везде	1	1
16	самом же деле это	1	1
17	приводит к тому что	2	1
18	для того чтобы изучить	1	1
19	как мы видели не	1	1
20	неизбежно приводит к тому	1	1
21	с точки зрения языка	1	1
22	и в соответствии с	1	1
23	внутренней и внешней речи	1	1
24	и не может быть	1	1
25	не что иное как	1	1
26	в последнее время в	1	1
27	только по отношению к	1	1
28	в свою очередь является	1	1
29	в том что это	1	1
30	но для того чтобы	1	1
31	то же самое что	2	1
32	в том числе и	1	1
33	ни в какой мере	2	1
