1	в то же время	7	7
2	и в то же	2	2
3	одной и той же	1	2
4	может быть понято и	1	2
5	в зависимости от того	1	2
6	вместе с тем и	1	2
7	в виду прежде всего	1	1
8	не может быть понято	3	1
9	в собственном смысле слова	1	1
10	нет и не может	2	1
11	то же самое и	1	1
12	одного и того же	1	1
13	то или иное место	1	1
14	в той же мере	1	1
15	того социального коллектива в	1	1
16	в жизни и в	1	1
17	о котором мы говорили	1	1
18	с нашей точки зрения	1	1
19	и в жизни и	1	1
20	к одной и той	1	1
21	так а не иначе	1	1
22	и не может быть	3	1
23	одни и те же	3	1
24	социального коллектива в котором	1	1
25	иметь в виду что	1	1
