395	позиций может быть актуализировано	1	1
396	дело не в самом	1	1
397	устанавливает задаваемый читателю ракурс	1	1
398	определенных языковых стилей социальных	1	1
399	входит лишь поименованное в	1	1
400	находится или движется один	1	1
401	кадры читательского восприятия в	1	1
402	в своем составе столько	1	1
403	речевую генерализацию текста поскольку	1	1
404	читателем в ходе чтения	1	1
405	является фундаментом всей субъектной	1	1
406	единства фразы устанавливает задаваемый	1	1
407	диалогическим углом по отношению	1	1
408	в кадры повествования а	1	1
409	характеризует говорящего иначе говоря	1	1
410	вследствие этой соотносительности стилистико-речевую	1	1
411	измеряемой числом слогов между	1	1
412	в самом наличии определенных	1	1
413	дневного ночного мгновенного вечного	1	1
414	читательского внутреннего исполнения как	1	1
415	соотносительности слов избранных для	1	1
416	ту форму в которую	1	1
417	ряду образующие ритмические зачины	1	1
418	менее насыщенный деталями кадр	1	1
419	исполнения как упорядоченная последовательность	1	1
420	под определенным диалогическим углом	1	1
421	значимостей являются наиболее генерализованные	1	1
422	этой соотносительности стилистико-речевую определенность	1	1
423	художественных значимостей являются наиболее	1	1
424	героя как ценностного центра	1	1
425	и взаимодействиях с объектной	1	1
426	и в пределах тех	1	1
427	напряжение речевых движений текста	1	1
428	эффект распределенности текста между	1	1
429	так же точно и	1	1
430	правого далекого близкого замкнутого	1	1
431	исходном своем значении греческое	1	1
432	кадр внутреннего зрения герои	1	1
433	отношении художественному восприятию задана	1	1
434	субсистемы художественных значимостей являются	1	1
435	как уже говорилось выше	1	1
436	текста так и не	1	1
437	текстовых показателей а выбор	1	1
438	место слияние пространственных и	1	1
439	я героя как ценностного	1	1
440	мы имеем дело с	1	1
441	и заключительные в ритмическом	1	1
442	ибо и в пределах	1	1
443	речевыми характеристиками глоссами как	1	1
444	и меньше и больше	1	1
445	нуждается в своего рода	1	1
446	литературного произведения в ее	1	1
447	и т.п крайними пределами	1	1
448	неологизмы и т.п глоссализация	1	1
449	иного рода стилистике здесь	1	1
450	паузами как чередование напряжений	1	1
451	вводятся автором в кадры	1	1
452	взаимоналожениях и взаимодействиях с	1	1
453	ходе чтения в кадры	1	1
454	в тексте а не	1	1
455	т.п крайними пределами этой	1	1
456	сопоставлены или противопоставлены в	1	1
457	его конструктивные членения и	1	1
458	глоссой нейтральной в стилистическом	1	1
459	прочие его конструктивные членения	1	1
460	обозначения объектных деталей а	1	1
461	все что может или	1	1
