1	не что иное как	1	3
2	в то время как	2	3
3	а с другой стороны	2	3
4	дело в том что	4	2
5	также и то что	2	2
6	еще и потому что	2	1
7	в том что он	1	1
8	что бы то ни	2	1
9	указать хотя бы на	1	1
10	мы должны сказать что	1	1
11	бы то ни было	1	1
12	с этой точки зрения	1	1
13	и вместе с тем	2	1
14	по этому поводу необходимо	1	1
15	же в конце концов	1	1
16	и в том числе	1	1
17	стоит на точке зрения	1	1
18	во что бы то	2	1
19	с начала до конца	1	1
20	с такой точки зрения	1	1
21	и то и другое	1	1
22	в том что и	1	1
23	в то же время	2	1
24	достаточно указать хотя бы	1	1
25	поводу необходимо сказать что	1	1
26	свидетельствует о том что	2	1
27	и в этом смысле	3	1
28	означает не что иное	1	1
29	нам представляется что здесь	1	1
30	этому поводу необходимо сказать	1	1
31	в результате чего вся	1	1
32	бы то ни стало	2	1
