8238	о своем мире следовательно	1	1
8239	личности в жизни является	1	1
8240	страницы священных книг расплавятся	1	1
8241	работник для толстого не	1	1
8242	ее введение рассказчика также	1	1
8243	концу даже тон рассказа	1	1
8244	ложь разумеется все эти	1	1
8245	самосознание как действительность второго	1	1
8246	самосознание героя только момент	1	1
8247	вследствие этого ничто не	1	1
8248	мира каждое переживание и	1	1
8249	действительности вовсе не непосредственно	1	1
8250	день приговоренного к смертной	1	1
8251	о мире так же	1	1
8252	героев и не раскрывает	1	1
8253	поэтому ни проблемы сочетания	1	1
8254	новое отношение к своему	1	1
8255	их живого сосуществования и	1	1
8256	пародией уличной сценой гротеском	1	1
8257	лишь один объективный мир	1	1
8258	устойчивую позицию вовне устойчивый	1	1
8259	расцвесть множественность неслиянных сознаний	1	1
8260	тех или иных из	1	1
8261	разъединенных элементов сюжетов является	1	1
8262	такого героя который был	1	1
8263	рода основное событие раскрываемое	1	1
8264	подлинно реалистическое видение мира	1	1
8265	тенденцию будущего вследствие этого	1	1
8266	созвучии напоминают голосоведение романа	1	1
8267	этой оценки и старается	1	1
8268	плоскость романа и вызывает	1	1
8269	в отношении к прошлому	1	1
8270	его любимых героев не	1	1
8271	собственного непосредственно значащего слова	1	1
8272	воли является здесь естественным	1	1
8273	единства как в музыке	1	1
8274	сказать что достоевский в	1	1
8275	важно лишь ориентировать наш	1	1
8276	формулированное авторское мировоззрение и	1	1
8277	рассчитанный план целого относительная	1	1
8278	пафоса личности в жизни	1	1
8279	стиля и тона это	1	1
8280	введением рассказчика построением романа	1	1
8281	типичность его habitus его	1	1
8282	за их пределы и	1	1
8283	простой мотивировки введения исповеди?	1	1
8284	а всею совокупностью особых	1	1
8285	по аскольдову отличается от	1	1
8286	драматический диалог в драме	1	1
8287	становлении духа проходящем через	1	1
8288	бедного человека в гуманном	1	1
8289	начинается там где делаются	1	1
8290	комизм и его трагизм	1	1
8291	тургенева отсюда вытекает жанровое	1	1
8292	определение постановки идеи в	1	1
8293	и все записать за	1	1
8294	в девушкине или голядкине	1	1
8295	мистериями мистерия действительно многопланна	1	1
8296	в себя как свой	1	1
8297	к той же основной	1	1
8298	литература о достоевском до	1	1
8299	а только трусливое нахальство	1	1
8300	в самой изображаемой действительности	1	1
8301	и взаимного проникновения капитализм	1	1
8302	взаимодействие духовного многообразия а	1	1
8303	или антиномический ряд лишь	1	1
8304	доминанту изображения с жизненно-характерологической	1	1
8305	любовь ненависть версилова к	1	1
8306	все же что мы	1	1
8307	преступление в романах достоевского	1	1
8308	личность не делая ее	1	1
8309	переходил из одного в	1	1
8310	понятий суждений и оценок	1	1
8311	был уверен вопрос кто	1	1
8312	упорнейшее стремление его видеть	1	1
8313	тому как доминантой художественного	1	1
8314	первый взгляд наиболее формальное	1	1
8315	цельный образ дать художественный	1	1
8316	убедимся далее что вся	1	1
8317	и ивана благодаря этой	1	1
8318	решенная романом художественная задача	1	1
8319	к другу представляют по	1	1
8320	если бы авторский мир	1	1
8321	достоевском создается впечатление что	1	1
8322	не усиливать смысловой весомости	1	1
8323	ним и во что	1	1
8324	он бросает решительный вызов	1	1
8325	не стыдно и это	1	1
8326	художественные проблемы или вовсе	1	1
8327	объединения и примирения заключенных	1	1
8328	всепоглощающему сознанию героя автор	1	1
8329	и иван карамазов поэтому-то	1	1
8330	каждом отдельном романе планы	1	1
8331	со своей карикатурой иван	1	1
8332	героев чтобы объективно воспринять	1	1
8333	видения и построения переместилась	1	1
8334	сряду к этим вашим	1	1
8335	основанный не на познании	1	1
8336	волевого акта телеологическое соподчинение	1	1
8337	принципах связи образующих целое	1	1
8338	сливается с голосами тех	1	1
8339	или трансфинитных величин эта	1	1
8340	с немецкими экспрессионистами с	1	1
8341	достоевского и монологически воспринятого	1	1
8342	жизни и сами разрешаете	1	1
8343	все что казалось простым	1	1
8344	процессе постепенного наступления капитализма	1	1
8345	не разрушая и ткани	1	1
8346	плоскости однако в этой	1	1
8347	как бы предопределяет героя	1	1
8348	поочередно господствовать и отражать	1	1
8349	установки достоевского что позволяет	1	1
8350	надкругозорном единстве ибо драматическое	1	1
8351	мере для него самого	1	1
8352	многих воль воля к	1	1
8353	деле взаимоотношения миров или	1	1
8354	все рядом и одновременно	1	1
8355	всего во внешнее столкновение	1	1
8356	и несет по отношению	1	1
8357	мире построение этого мира	1	1
8358	он превратил в материал	1	1
8359	мировоззрения эта особенность проявилась	1	1
8360	построение этого мира с	1	1
8361	его самосознание живет своей	1	1
8362	смердяков раскольников и свидригайлов	1	1
8363	найти так называемого объективного	1	1
8364	чистого сердца полного правильного	1	1
8365	связать и разрешить ее	1	1
8366	и противоречивость как существенный	1	1
8367	слово героя заключено в	1	1
8368	образ героя а именно	1	1
8369	сказать но из боязни	1	1
8370	его тенденции приближать концы	1	1
8371	в своей последней основе	1	1
8372	сколько в вас назойливости	1	1
8373	категории сосуществования он умел	1	1
8374	конечно художественного единства нового	1	1
8375	каждого противоречия внутри одного	1	1
8376	одним из миров входящих	1	1
8377	героя его замкнутость в	1	1
8378	сознанием и жизнью героя	1	1
8379	монологический в свете нашего	1	1
8380	сливаясь а сочетаясь статическую	1	1
8381	мир герой каждому герою	1	1
8382	то что делало его	1	1
8383	предположение о записавшем все	1	1
8384	он действительно уясняет себе	1	1
8385	его образа оно вбирает	1	1
8386	своим художественным симпатиям и	1	1
8387	и созерцающего участником роман	1	1
8388	клочки действительности доводя эмпиризм	1	1
8389	мире следовательно теми элементами	1	1
8390	ибо действительно слишком различен	1	1
8391	содержании романа и притом	1	1
8392	то здесь с достоевским	1	1
8393	его собственными словами человека	1	1
8394	ни одна из идей	1	1
8395	показательны поздние произведения смерть	1	1
8396	весьма важное положение злодей	1	1
8397	другого человека из тени	1	1
8398	осуществляется эта полнота художественной	1	1
8399	не как завершающая его	1	1
8400	правильно понял что основное	1	1
8401	художника не только объекты	1	1
8402	атмосферы вокруг героя которая	1	1
8403	свой но даже в	1	1
8404	репликами и это не	1	1
8405	ряда неизбежно оказалось бы	1	1
8406	поверхностно путь философской монологизации	1	1
8407	бы сказать так художественная	1	1
8408	раскаявшиеся осужденные и спасенные	1	1
8409	достоевскому все одновременно все	1	1
8410	рупором для его голоса	1	1
8411	себя наше художественное видение	1	1
8412	односоставного мира концепция драматического	1	1
8413	новую художественную форму к	1	1
8414	обычно самосознание героя является	1	1
8415	человека можно сказать что	1	1
8416	элемент действительности внешнего мира	1	1
8417	разноценных и глубоко чуждых	1	1
8418	исповеди с уголовными приключениями	1	1
8419	по-новому между тем как	1	1
8420	замысле художника не только	1	1
8421	это самосознание раскрыться спонтанно	1	1
8422	не строится ни один	1	1
8423	не другой кругозор в	1	1
8424	автора находит очень ясное	1	1
8425	анализом чисто характерологических особенностей	1	1
8426	материал его самосознания в	1	1
8427	является та точка зрения	1	1
8428	акцент лежащий на этих	1	1
8429	своей всенивелирующей тенденции не	1	1
8430	сосредоточена в чистой функции	1	1
8431	мировоззрении и в нем	1	1
8432	роман иерархический акцент лежащий	1	1
8433	аналогию с полифонией и	1	1
8434	нет этих черт нет	1	1
8435	достоевского нащупал вячеслав иванов	1	1
8436	себе хоть одно свойство	1	1
8437	разрезе данного мгновения и	1	1
8438	пушкиным в твердом монологическом	1	1
8439	которые были бы нейтральны	1	1
8440	его социологическая и характерологическая	1	1
8441	быть глубоко различен в	1	1
8442	капиталиста капитализм столкнул и	1	1
8443	достоевского в процессе такой	1	1
8444	художественный замысел а не	1	1
8445	действительно идеи в каждом	1	1
8446	воле в результате роман	1	1
8447	подходит к конкретному материалу	1	1
8448	действительностью героя а перед	1	1
8449	результате обзора его обширной	1	1
8450	он нам всеми своими	1	1
8451	предположить какую-то иную связь	1	1
8452	в авторском замысле они	1	1
8453	он видел и мыслил	1	1
8454	лицами благодаря этому возникает	1	1
8455	но благодаря этому все	1	1
8456	и наиболее внешнее обнаружение	1	1
8457	авторского изображения и не	1	1
8458	могут вложить акцента собственного	1	1
8459	и романа слишком различны	1	1
8460	точка зрения как взгляд	1	1
8461	прежде всего свобода и	1	1
8462	будто и положительное в	1	1
8463	быть по-новому ориентирована по	1	1
8464	бы и сам был	1	1
8465	частушки сочетается с миром	1	1
8466	наконец он просто заглушается	1	1
8467	важное будь личностью говорит	1	1
8468	иррациональных или трансфинитных величин	1	1
8469	достоевского направлена на раскрытие	1	1
8470	из подполья нам буквально	1	1
8471	можно найти только у	1	1
8472	типа и действительно неоднократно	1	1
8473	индивидуальном и социальном сознании	1	1
8474	обычно служит автору для	1	1
8475	образ чужой личности если	1	1
8476	миром шиллеровского дифирамба кругозор	1	1
8477	диалогического разрыва для третьего	1	1
8478	и характерологическая типичность его	1	1
8479	автора и как вывод	1	1
8480	сознанию то задача объединения	1	1
8481	авторской позиции и нисколько	1	1
8482	властью ибо не укоренен	1	1
8483	весьма второстепенную роль существеннее	1	1
8484	свободе и самостоятельности героя	1	1
8485	себя и обвиняет ее	1	1
8486	одновременно сил правда видения	1	1
8487	кроткой теперь о самом	1	1
8488	возвышает его ум и	1	1
8489	точку зрения третьего но	1	1
8490	первый этический тезис достоевского	1	1
8491	обращаться к фактам субъективного	1	1
8492	таков привело бы к	1	1
8493	уважал уважал бы именно	1	1
8494	дурная субъективная противоречивость нет	1	1
8495	говорит он нам всеми	1	1
8496	самого творческого замысла к	1	1
8497	присущий ему полемизм не	1	1
8498	драматическое целое в этом	1	1
8499	действительность становится элементом его	1	1
8500	и оценивающая позиция человека	1	1
8501	в нем мы замечаем	1	1
8502	то же что имеет	1	1
8503	точке зрения на него	1	1
8504	произведения достоевского в этом	1	1
8505	изображал гоголь достоевский заставляет	1	1
8506	зрения теперь мы должны	1	1
8507	что дело идет не	1	1
8508	миры еще не утратили	1	1
8509	закономерных связей нашего опыта	1	1
8510	многоголосости он переносит свои	1	1
8511	создания твердого и устойчивого	1	1
8512	разнороднейший материал достоевского принимает	1	1
8513	от автора уже в	1	1
8514	даже самая его наружность	1	1
8515	читать гоголевскую шинель и	1	1
8516	ни один элемент произведения	1	1
8517	него действительно становится живым	1	1
8518	элементами из которых слагается	1	1
8519	героя авторском мире построение	1	1
8520	эту метафору мы превращаем	1	1
8521	человека до его смерти	1	1
8522	как согласные но не	1	1
8523	входящий в лабиринт полифонического	1	1
8524	не действительность героя а	1	1
8525	так остро и наглядно	1	1
8526	в событийные взаимоотношения друг	1	1
8527	тем как образ единого	1	1
8528	является чистейшим и подлиннейшим	1	1
8529	взаимного проникновения капитализм уничтожил	1	1
8530	вести записки не только	1	1
8531	своей незавершенностью своей незакрытостью	1	1
8532	мире он перенес автора	1	1
8533	определений героя в кругозор	1	1
8534	к прошлому и будущему	1	1
8535	этом не слабость автора	1	1
8536	поставим вопрос о тех	1	1
8537	что основная ошибка была	1	1
8538	образу героя как одна	1	1
8539	из участников в пределах	1	1
8540	этой действительности так гоголевский	1	1
8541	проявиться особенно резко а	1	1
8542	о противоречивом становлении человеческого	1	1
8543	созерцающего участником роман не	1	1
8544	и не управляют событийными	1	1
8545	он умел ее объективно-художественно	1	1
8546	ни было попытки объединения	1	1
8547	сочетаются по лирическому принципу	1	1
8548	располагались в динамический диалектический	1	1
8549	ее насквозь единству личного	1	1
8550	их уже в настоящем	1	1
8551	бытие устойчивое и твердое	1	1
8552	действительности так гоголевский герой	1	1
8553	сочетанию многих воль воля	1	1
8554	головами вы жаждете жизни	1	1
8555	рассказа не снижая рассказа	1	1
8556	толстого и его слово	1	1
8557	на столе жена самоубийца	1	1
8558	не снижая рассказа до	1	1
8559	достоевского такое уподобление если	1	1
8560	последовательность и цельность его	1	1
8561	плане современности и это	1	1
8562	не только характерологическая черта	1	1
8563	доминантой художественного изображения героя	1	1
8564	форм их живого сосуществования	1	1
8565	через это воплощенное конкретное	1	1
8566	которых может протекать действие	1	1
8567	настоящая глава посвящена герою	1	1
8568	чтобы преодолеть свой этический	1	1
8569	начала все предрешено закрыто	1	1
8570	доминанта его образа сливаются	1	1
8571	о себе самом не	1	1
8572	его видения и понимания	1	1
8573	сквозь все перипетии авантюрного	1	1
8574	в тех противоречиях в	1	1
8575	для этого самораскрытия героя	1	1
8576	собою рассказывает дело уясняет	1	1
8577	и мира и вот	1	1
8578	где рядом и друг	1	1
8579	слова самосознания доходящего до	1	1
8580	и идеологические которые сталкиваются	1	1
8581	отношению к этому новому	1	1
8582	деле несовместимейшие элементы материала	1	1
8583	событийные взаимоотношения друг с	1	1
8584	глубине заданием построить полифонический	1	1
8585	дальше провоцирования истерик и	1	1
8586	о нем перебивая свою	1	1
8587	осознания кажется что каждый	1	1
8588	о нем в оболочке	1	1
8589	построения романа впервые введенных	1	1
8590	не нашла иного пути	1	1
8591	лабиринт полифонического романа не	1	1
8592	мира но у достоевского	1	1
8593	и оторвавшейся пуговицей которое	1	1
8594	духа достигшего состояния истинной	1	1
8595	пристрастии достоевского к массовым	1	1
8596	как обычное авторское слово	1	1
8597	и художественной характеристики ведь	1	1
8598	авторском мире построение этого	1	1
8599	достоевского к изображаемому сознанию	1	1
8600	хотите что-то сказать но	1	1
8601	и потому она полна	1	1
8602	были бы построены в	1	1
8603	связал свою мысль с	1	1
8604	оформления в аспекте данной	1	1
8605	существа проблемы их подлинный	1	1
8606	то оно и не	1	1
8607	слово его о себе	1	1
8608	чем является он сам	1	1
8609	форме развертывания материала в	1	1
8610	в этой форме в	1	1
8611	потому что он сам	1	1
8612	время не разрушая и	1	1
8613	он становится человеком идеи	1	1
8614	приемах толстой например спокойно	1	1
8615	признака ни одной черточки	1	1
8616	автора таков типичный путь	1	1
8617	устойчивой опоры вне диалогического	1	1
8618	перенес свое объяснение этого	1	1
8619	в посторонние разъяснения тут	1	1
8620	данное ивановым основное определение	1	1
8621	героя и его голоса	1	1
8622	драматической и всякой диалогизации	1	1
8623	социальной атмосферы вокруг героя	1	1
8624	этого содержательно одинакового материала	1	1
8625	достоевского в процессе этого	1	1
8626	новой формы нового типа	1	1
8627	знает все возможные преломления	1	1
8628	очень своеобразный его героиней	1	1
8629	этот разнороднейший материал достоевского	1	1
8630	разрешить герои достоевского чтобы	1	1
8631	но не допусти он	1	1
8632	даже внутренние противоречия и	1	1
8633	преобладание в его мировоззрении	1	1
8634	заучилось и литературную форму	1	1
8635	здесь обычными характеристическими и	1	1
8636	земля которая от детей	1	1
8637	к чужому сознанию так	1	1
8638	форма а как материал	1	1
8639	место в творчестве достоевского	1	1
8640	и есть та задача	1	1
8641	самого мелкого тщеславия несете	1	1
8642	идеях не превращает романа	1	1
8643	изображения такими же идеями-героинями	1	1
8644	литературных произведений но этого	1	1
8645	наивная точка зрения толстого	1	1
8646	себя этим он буквально	1	1
