1	и не может быть	1	4
2	один и тот же	1	3
3	в то же время	6	3
4	но в то же	3	2
5	одной и той же	1	2
6	на самом же деле	1	2
7	свое яркое выражение в	1	1
8	одна и та же	1	1
9	в тесной связи с	1	1
10	все более и более	1	1
11	в этом случае происходит	1	1
12	что один и тот	1	1
13	в большей или меньшей	3	1
14	или во всяком случае	1	1
15	нашло свое яркое выражение	1	1
16	выходит далеко за пределы	1	1
17	и как мы видели	1	1
18	находит свое выражение в	1	1
19	лишь в меру своей	1	1
20	не может быть ничего	1	1
21	более и более суживается	1	1
22	можно сказать что вся	1	1
