1	то это значит что	1	4
2	и в то же	1	2
3	во что бы то	1	2
4	что бы то ни	1	2
5	в то же время	3	2
6	на самом же деле	1	2
7	и вместе с тем	1	2
8	в то время как	3	2
9	бы то ни стало	1	2
10	с одной стороны и	1	2
11	не содержит в себе	1	1
12	иметь в виду что	2	1
13	в каком смысле не	1	1
14	так же как и	1	1
15	заключается в том что	1	1
16	одно и то же	4	1
17	и то и другое	1	1
18	ни в каком смысле	1	1
19	мы уже знаем что	1	1
20	в том что он	1	1
21	не что иное как	3	1
22	в том смысле как	1	1
23	мы уже не говорим	1	1
24	да и то не	1	1
