2492	слепое сосуществование и их	1	1
2493	было бы сказать так	1	1
2494	человек из подполья и	1	1
2495	до самого последнего времени	1	1
2496	слова не существенно и	1	1
2497	целом тоже не может	1	1
2498	на себе и на	1	1
2499	выработанного веками но они	1	1
2500	это органическая система развивающегося	1	1
2501	вот он и говорит	1	1
2502	понимаем выбор таким образом	1	1
2503	к явлениям европейского романа	1	1
2504	все то во что	1	1
2505	объяснены и показаны на	1	1
2506	чиновника девушкин голядкин даже	1	1
2507	прагматизма выхватывая клочки действительности	1	1
2508	преступление непрощенная обида только	1	1
2509	в кругозоре же автора	1	1
2510	обычный монологический роман в	1	1
2511	вызывает свидетелей доминанта самосознания	1	1
2512	нам правильным и уже	1	1
2513	или дается осведомление должна	1	1
2514	самой проблемы ему не	1	1
2515	произведения не нарушая конечно	1	1
2516	романа как динамическое единство	1	1
2517	массовым сценам в его	1	1
2518	как бы в маленьком	1	1
2519	они осуществляют эту функцию	1	1
2520	котором несколько полноправных участников	1	1
2521	акценты скрещиваются в каждом	1	1
2522	даже сугубо монологически хотя	1	1
2523	как их неумолчный и	1	1
2524	автора в романе обычного	1	1
2525	и незыблемой монологической оправой	1	1
2526	эмоционально-волевому акцентному единству как	1	1
2527	важности в творчестве толстого	1	1
2528	вовсе не даны как	1	1
2529	единство анализируя этот роман	1	1
2530	свете единого авторского сознания	1	1
2531	провоцирующий фактор мы убедимся	1	1
2532	тезы антитезы и синтеза	1	1
2533	достоевский прежде всего создатель	1	1
2534	они нуждаются в монолитнейшем	1	1
2535	а в нескольких полных	1	1
2536	жизненная постановка религиозно-этической проблемы	1	1
2537	из него как в	1	1
2538	к художественному ключу романов	1	1
2539	иова откровение св иоанна	1	1
2540	достоевского но художественный образ	1	1
2541	каким-то лирическим единством упрощенно-монологического	1	1
2542	новых принципах связи образующих	1	1
2543	уличной сценой гротеском или	1	1
2544	системно-монологическую хотя бы и	1	1
2545	его романов его героем	1	1
2546	того она более соответствует	1	1
2547	все подчиняя своему единству	1	1
2548	философского замысла как бы	1	1
2549	не нарушая при этом	1	1
2550	это и есть та	1	1
2551	факторами не могут нести	1	1
2552	его величайшая сила этим	1	1
2553	спорящих голоса в каждом	1	1
2554	как полноправного субъекта а	1	1
2555	философском романе а предмет	1	1
2556	как мы сказали монологично	1	1
2557	обычным каноном в соединении	1	1
2558	аскольдов правильно понял что	1	1
2559	и монолитной"? такой роман	1	1
2560	авторского сознания мира кроме	1	1
2561	для автора какую-то внекругозорную	1	1
2562	их воззрения пытаются доразвить	1	1
2563	проблемы наказание это форма	1	1
2564	и отражать разнообразные оттенки	1	1
2565	этом мгновении раскрывшегося многообразия	1	1
2566	земля в зависимости от	1	1
2567	образной аналогии не больше	1	1
2568	достоевского также ограничивается анализом	1	1
2569	себе самом как пашквиль	1	1
2570	единство философского замысла как	1	1
2571	себя сам со всех	1	1
2572	сравнение романа достоевского с	1	1
2573	сосуществования возможность быть рядом	1	1
2574	философской монологизации его творчества	1	1
2575	говорит энгельгардт изображал жизнь	1	1
2576	не сливающиеся или как	1	1
2577	дано и последнее слово	1	1
2578	кругозоре может быть это	1	1
2579	мировоззрения самого достоевского то	1	1
2580	на языке особой разновидности	1	1
2581	слову о себе смотрится	1	1
2582	она героиня его романов	1	1
2583	сведения роман подросток оказывается	1	1
2584	однородность и родственность конструктивных	1	1
2585	на свои составные несхожие	1	1
2586	попытки объединения и примирения	1	1
2587	раскольников и свидригайлов и	1	1
2588	но самое поразительное то	1	1
2589	самом и о своем	3	1
2590	мы должны перейти к	1	1
2591	доминантой образной характеристики героя	1	1
2592	у данте и позволила	1	1
2593	зрения которого он понимает	1	1
2594	в единство некоторого события	1	1
2595	владеющими ими идеями многопланность	1	1
2596	метафизических и этических утверждений	1	1
2597	будущего вследствие этого ничто	1	1
2598	творчества? нам кажется что	1	1
2599	правда но в вас	1	1
2600	но пугает потому что	1	1
2601	романа непосредственно в плоскость	1	1
2602	полифоническом романе достоевского дело	1	1
2603	точки зрения художественного построения	1	1
2604	же романа достоевского над	1	1
2605	воплощению этой вечно слагающейся	1	1
2606	и упорно и мучительно	1	1
2607	и хоть и не	1	1
2608	автора какую-то внекругозорную фантастическую	1	1
2609	и он остается в	1	1
2610	их сам выдумал ведь	1	1
2611	работе роман достоевского подросток	1	1
2612	автора но как в	1	1
2613	направлена на раскрытие и	1	1
2614	в данном случае двойственности	1	1
2615	его видеть все как	1	1
2616	достоевского слышать и понимать	1	1
2617	сознаний не сливающихся в	1	1
2618	величайшею силой но и	1	1
2619	соприкосновения и взаимного проникновения	1	1
2620	из идей героев ни	1	1
2621	рассказывает дело уясняет себе	1	1
2622	достоевского принимает глубокий отпечаток	1	1
2623	черт слагающихся в твердый	1	1
2624	в речах хромоножки в	1	1
2625	веря что в разгаре	1	1
2626	тоже из подполья я	1	1
2627	перед нами раскинутся неподвижно	1	1
2628	социальный и политический вопрос	1	1
2629	творчество несмотря на присущий	1	1
2630	опирающееся на единство мира	1	1
2631	ивана карамазова великого инквизитора	1	1
2632	грех преступление непрощенная обида	1	1
2633	для третьих наконец он	1	1
2634	каноном в соединении разнороднейших	1	1
2635	какому-то судье да так	1	1
2636	или как будущее или	1	1
2637	может быть уподоблен художественному	1	1
2638	и смысловой многоголосости он	1	1
2639	качественное многообразие отсюда же	1	1
2640	они могли бы как	1	1
2641	лирически или познавательно делает	1	1
2642	сам сознает их он	1	1
2643	оформленные владеющими ими идеями	1	1
2644	человека а следовательно и	1	1
2645	сюжетно-прагматический ряд и личный	1	1
2646	отношении к прошлому и	1	1
2647	подполья не только растворяет	1	1
2648	полифонический роман достоевский был	1	1
2649	музыке пять голосов фуги	1	1
2650	надсловесное надголосое надакцентное единство	1	1
2651	объект ее введение рассказчика	1	1
2652	построения романа мир достоевского	1	1
2653	его произведений первый этический	1	1
2654	несовместимого не была бы	1	1
2655	не управляют событийными взаимоотношениями	1	1
2656	и нерешенностью и это	1	1
2657	романа вместо события взаимодействия	1	1
2658	форме дает как бы	1	1
2659	не то чем его	1	1
2660	культурной традиции он становится	1	1
2661	существу независима от того	1	1
2662	в процессе такой ориентации	1	1
2663	к этим вашим словам	1	1
2664	жизнь духа достигшего состояния	1	1
2665	именно слово героя о	1	1
2666	современности в разрезе одного	1	1
2667	тут и глубокое чувство	1	1
2668	аскольдова психология характеров у	1	1
2669	достоевского соединение чужероднейших и	1	1
2670	развертывается многообразнейший и противоречивейший	1	1
2671	не множественность равноправных сознаний	1	1
2672	многопланности и многоголосости полифонического	1	1
2673	его глубокое и тонкое	1	1
2674	духовным уровнем его любимых	1	1
2675	слово героя поэтому вовсе	1	1
2676	конечно процесс рассказа продолжается	1	1
2677	слышать два спорящих голоса	1	1
2678	сущность становящейся социальной жизни	1	1
2679	само художественное творчество достоевского	1	1
2680	автор выполняет теперь герой	1	1
2681	таким образом вячеслав иванов	1	1
2682	относительно свободным и самостоятельным	1	1
2683	два спорящих голоса в	1	1
2684	оценкам объективируя и опредмечивая	1	1
2685	но именно в драме	1	1
2686	вовсе не становятся принципами	1	1
2687	как самосознание действительно изображается	1	1
2688	ибо ее он считал	1	1
2689	начала единства как в	1	1
2690	что и нами употребляемое	1	1
2691	единознающего монологизма авторской позиции	1	1
2692	голоса в каждом выражении	1	1
2693	сентиментальному психологическому или историческому	1	1
2694	противоречием в мировоззрении достоевского	1	1
2695	связи планов романа их	1	1
2696	куска обточенной и монолитной"?	1	1
2697	и других они вовсе	1	1
2698	могут завершить и закрыть	1	1
2699	капитализм наступил почти катастрофически	1	1
2700	он они образуют единый	1	1
2701	объектность опредмеченность героев в	1	1
2702	лишь одним из решений	1	1
2703	явления в мышлении достоевского	1	1
2704	органического единства материала требуемого	1	1
2705	и обливая своими слезами	1	1
2706	к какому-то судье да	1	1
2707	и религиозном в его	1	1
2708	достоевского играет второстепенную роль	1	1
2709	вырывает все это из	1	1
2710	но не для самого	1	1
2711	человеческое сознание в своей	1	1
2712	пределах романа миры героев	1	1
2713	и сплел эти миры	1	1
2714	монологического сознания должна была	1	1
2715	романы достоевского последнего периода	1	1
2716	новой мистерии вот какие	1	1
2717	на себя самого как	1	1
2718	но заставить это самосознание	1	1
2719	идей героев ни героев	1	1
2720	содержания как одновременные и	1	1
2721	другие сознания но как	1	1
2722	в этом отношении не	1	1
2723	из каждого противоречия внутри	1	1
2724	монологически провозглашал ценность личности	1	1
2725	каусу не сосредоточивал на	1	1
2726	что должно быть раскрыто	1	1
2727	направлением и был тенденциозным	1	1
2728	что обычно служит автору	1	1
2729	в пределы одного сознания	2	1
2730	и самая установка рассказа	1	1
2731	тяготеет к становящемуся ряду	1	1
2732	самостоятельных и противоречащих друг	1	1
2733	драму в фабулу бульварного	1	1
2734	не застывающей философии перед	1	1
2735	рядом в плоскости сосуществования	1	1
2736	же время ничего не	1	1
2737	творчества достоевского романы его	1	1
2738	самовысказывания чтобы убедиться в	1	1
2739	дана как объективный факт	1	1
2740	уголовными приключениями включить религиозную	1	1
2741	и самосознания в конце	1	1
2742	непрощенная обида только такие	1	1
2743	бедного чиновника девушкин голядкин	1	1
2744	очерк и даже не	1	1
2745	достоевского осуществляется тот же	1	1
2746	не друг за другом	1	1
2747	ни природы но есть	1	1
2748	и речах странника макара	1	1
2749	все новые и новые	1	1
2750	больше лиц и как	1	1
2751	позиций и на крайнюю	1	1
2752	трудность создать из разнородных	1	1
2753	был бы философский роман	1	1
2754	романа эти куски довлеют	1	1
2755	касается вихревого движения то	1	1
2756	утверждение поэтому-то все большие	1	1
2757	диалектическому методу перед нами	1	1
2758	целым впервые основную структурную	1	1
2759	художника другие не поддавшиеся	1	1
2760	под собою почву хотя	1	1
2761	до него и другие	1	1
2762	роман достоевского диалогичен он	1	1
2763	романов достоевского подходит к	1	1
2764	нем организуя и оформляя	1	1
2765	то таким является церковь	1	1
2766	в начале пути при	1	1
2767	как пристрастные так и	1	1
2768	на которой вырос полифонический	1	1
2769	не укоренен в бытии	1	1
2770	отъединенное идеалистическое сознание и	1	1
2771	всею ясностью в каждом	1	1
2772	ведет к более обобщенному	1	1
2773	единства романа достоевского и	1	1
2774	сочетание нескольких индивидуальных воль	1	1
2775	становится в нем идеей-силой	1	1
2776	тезиса на относительной свободе	1	1
2777	отдельных сознаний и не	1	1
2778	одного или другого сознания	1	1
2779	герой интересует достоевского как	1	1
2780	распределение этого содержательно одинакового	1	1
2781	и уяснение этого слова	1	1
2782	создать из разнородных разноценных	1	1
2783	и его глубокая тяга	1	1
2784	слово симеона нового богослова	1	1
2785	даже не обзор нам	1	1
2786	достоевского они действительно несут	1	1
2787	но это не значит	1	1
2788	уже сам его типичность	1	1
2789	акцент по сравнению с	1	1
2790	кауса в том что	1	1
2791	одном кругозоре а в	1	1
2792	завершающая его форма а	1	1
2793	постепенного становления человеческого духа	1	1
2794	романа он создал существенно	1	1
2795	он живет идея и	1	1
2796	как философско-монологическую волю превращая	1	1
2797	именно в драме она	1	1
2798	карамазов все вся природа	1	1
2799	основной принцип его романической	1	1
2800	достоевского он определяет как	1	1
2801	категорией художественного видения достоевского	1	1
2802	места в этом не	1	1
2803	мы остановимся лишь на	1	1
2804	достоевского энгельгардт также располагает	1	1
2805	драматическое действие опирающееся на	1	1
2806	в одной плоскости как	1	1
2807	авторитетных идеологических позиций и	1	1
2808	идеи идея же становится	1	1
2809	по отношению к нему	1	1
2810	ввиду исключительной важности высказанных	1	1
2811	определяются тем новым художественным	1	1
2812	художественную архитектонику произведений достоевского	1	1
2813	о себе самом как	1	1
2814	есть если бы гроссман	1	1
2815	самая функция этого самосознания	1	1
2816	к себе самому и	1	1
2817	как предмет изображения занимает	1	1
2818	канону теории искусства его	1	1
2819	произведений первый этический тезис	1	1
2820	таким образом началом художественного	1	1
2821	этом социальном мире планы	1	1
2822	какую-то внекругозорную фантастическую точку	1	1
2823	образом ничего не объясняющим	1	1
2824	продуктом внешних условий второй	1	1
2825	слова до простой ремарки	1	1
2826	едином кругозоре автора режиссера	1	1
2827	тщательно сформулировать эти возможные	1	1
2828	голос рядом с авторским	1	1
2829	конца художественной воли достоевского	1	1
2830	и внутренне осмыслены в	1	1
2831	системно-монологическое целое игнорируя существенную	1	1
2832	философские романы во вкусе	1	1
2833	элементом его самосознания автор	1	1
2834	необходимость здесь нет свободы	1	1
2835	план почва это органическая	1	1
2836	энгельгардт различает три плана	1	1
2837	диалог может играть лишь	1	1
2838	не возникает поэтому ни	1	1
2839	объект завершающего художественного видения	1	1
2840	высеченной из одного куска	1	1
2841	трех планов основные темы	1	1
2842	как достоевский в минуту	1	1
2843	так же закончен и	1	1
2844	романе дано не снятое	1	1
2845	становления единого духа поэтому	1	1
2846	миры героев вступают в	1	1
2847	единой и цельной ткани	1	1
2848	образ органически чужд достоевскому	1	1
2849	достоевский произвел как бы	1	1
2850	не только к идеям	1	1
2851	не исчерпывается здесь обычными	1	1
2852	предварительно дело в том	1	1
2853	изображается автором как свободный	1	1
2854	быть скажете вы мне	1	1
2855	опредмечивается не закрывается не	1	1
2856	роман в своей последней	1	1
2857	ты еси утверждение и	1	1
2858	целом ряде философских выступлений	1	1
2859	самосознание герой расина неподвижная	1	1
2860	и не могущего воплотиться	1	1
2861	нескольких индивидуальных воль совершается	1	1
2862	представляет ее как личность	1	1
2863	последовательно на трех моментах	1	1
2864	в структуре произведения оно	1	1
2865	достоевского зачастую приводит к	1	1
2866	философствования в которой каждое	1	1
2867	неправдоподобность предположив что приговоренный	1	1
2868	романа достоевского и в	1	1
2869	сообщает тон тем или	1	1
2870	рядами между тем как	1	1
2871	материал его самосознания недаром	1	1
2872	сценам в его стремлении	1	1
2873	романов достоевского не множество	1	1
2874	самой структуре романа по	1	1
2875	как разные этапы некоторого	1	1
2876	он есть а как	1	1
2877	становящегося мира и нашел	1	1
2878	при том условии следовательно	1	1
2879	предметом же авторского видения	1	1
2880	романа миры героев вступают	1	1
2881	следовательно лишь чисто тематическое	1	1
2882	видение и изображение внутреннего	1	1
2883	разрешить во всей его	1	1
2884	и в вечность ибо	1	1
2885	одно время часто вопреки	1	1
2886	и в частности на	1	1
2887	двусмысленность и многосмысленность каждого	1	1
2888	его душевный облик и	1	1
2889	драме эта монологическая оправа	1	1
2890	тезис прежде чем развивать	1	1
2891	мировоззрения достоевского и монологически	1	1
2892	и переживается ими как	1	1
2893	другого сознания если бы	1	1
2894	что в самом произведении	1	1
2895	полифония в этом смысле	1	1
2896	которые встают когда построение	1	1
2897	на эмпирическом материале конкретных	1	1
2898	действительности внешнего мира каждое	1	1
2899	бродера христиансена он понимает	1	1
2900	качество он вскрывал в	1	1
