1	в том числе и	1	10
2	в то же время	8	5
3	все более и более	2	1
4	той или иной форме	1	1
5	но тем не менее	1	1
6	и неотделим от него	1	1
7	наметить лишь основные линии	1	1
8	в той или иной	3	1
9	но в то же	5	1
10	на самом же деле	3	1
11	мы можем сказать что	1	1
12	в большинстве случаев мы	1	1
13	можно сказать что не	1	1
14	с нашей точки зрения	2	1
15	мы можем прямо сказать	1	1
16	не что иное как	1	1
17	позиции по отношению к	1	1
18	ни на один миг	1	1
19	и не может быть	1	1
20	а через нее и	1	1
21	а может быть и	1	1
22	в более или менее	1	1
