1	в то же время	12	7
2	на мир и на	1	3
3	и в то же	5	3
4	является лишь одним из	1	2
5	не значит конечно что	1	2
6	но в то же	4	2
7	бы то ни было	1	2
8	точка зрения на мир	1	2
9	это не значит конечно	1	2
10	из одного в другой	2	1
11	но с другой стороны	1	1
12	с этой точки зрения	1	1
13	точками зрения на мир	1	1
14	точки зрения на мир	2	1
15	бы оно ни было	1	1
16	в истории европейского романа	1	1
17	зрения на мир и	1	1
18	с точки зрения которого	1	1
19	мир и на события	1	1
20	и не могут быть	1	1
21	дело в том что	1	1
22	переходил из одного в	1	1
23	в то время как	2	1
24	в одной плоскости с	1	1
25	можно прямо сказать что	1	1
