1	во всяком случае не	1	3
2	с этой точки зрения	1	2
3	точно так же как	1	2
4	в то же время	6	2
5	бы то ни было	1	2
6	в том виде в	1	2
7	но вместе с тем	1	2
8	и для того чтобы	1	2
9	тем не менее совершенно	1	1
10	и потому что даже	1	1
11	еще и потому что	1	1
12	в том или ином	1	1
13	котором здесь идет речь	1	1
14	в широком смысле этого	1	1
15	о котором здесь идет	1	1
16	но в то же	3	1
17	невозможно но все же	1	1
18	одного и того же	1	1
19	одном и том же	1	1
20	состоит в том что	2	1
21	с течением времени в	1	1
22	том виде в каком	1	1
23	мы имеем в виду	1	1
24	и в этом отношении	1	1
25	в одном и том	1	1
26	виде в каком он	1	1
27	с тем что в	1	1
28	можно сказать что в	1	1
