N	4gram	Tiupa_Hudo_1	Narrotol
1	в том числе и	1	4
2	в то же время	5	3
3	бы то ни было	1	3
4	не что иное как	1	2
5	в той или иной	2	2
6	по отношению к которому	1	2
7	в том или ином	1	2
8	точно так же как	1	2
9	состоит в том что	4	2
10	формы построения речевого целого	1	1
11	морализаторскую премудрость притчевого назидания	1	1
12	высказывания и в форме	1	1
13	факультативны он и подобен	1	1
14	полнотой референтная компетенция биографического	1	1
15	две другие компетенции суть	1	1
16	предстают перед нами не	1	1
17	этического выбора или субъектом	1	1
18	о происшествиях неофициальной жизни	1	1
19	а по своей природе	1	1
20	с его уникальным жизненным	1	1
21	другие компетенции суть референтная	1	1
22	но обязательно курьезное любопытное	1	1
23	явлений группирующихся вокруг него	1	1
24	жития ибо жизнь личности	1	1
25	форме определенной жанровой схемы	1	1
26	всегда имплицитно присутствующего в	1	1
27	она названа маской в.т	1	1
28	даль и сближение но	1	1
29	и свершают картина мира	1	1
30	анекдот же в исконном	1	1
31	заинтересовывать судьбой отдельных лиц	1	1
32	кощунственное вырастающая из анекдота	1	1
33	вырастающая из анекдота новелла	1	1
34	предназначения когда персонажи не	1	1
35	мира где персонажем в	1	1
36	как неизбежная для производящего	1	1
37	любопытное занимательное неожиданное маловероятное	1	1
38	наблюдения именно таковы герои	1	1
39	которое гегель именовал веком	1	1
40	художественной литературы анекдот же	1	1
41	все их поступки в	1	1
42	неожиданное маловероятное беспрецедентное анекдотическим	1	1
43	ролевого действия или субъектом	1	1
44	формы высказывания как целого	1	1
45	гегель именовал веком героев	1	1
46	есть реализация такого выбора	1	1
47	и подобен новеллистическому герою	1	1
48	в окказионально-авантюрном мире поведение	1	1
49	выше она названа маской	1	1
50	контексте знаменует не фатальный	1	1
51	искусство заинтересовывать судьбой отдельных	1	1
52	жизнь глазами анекдота это	1	1
53	субъекта и формы высказывания	1	1
54	персонажем в акте выбора	1	1
55	никакого миропорядка жизнь глазами	1	1
56	аверинцева предстают перед нами	1	1
57	полноценная биография возможна только	1	1
58	жанр сказания исторически восходит	1	1
59	тому архаичному состоянию общественных	1	1
60	стечение обстоятельств столкновение индивидуальных	1	1
61	анекдота это игра случая	1	1
62	фольклора являет собой лишь	1	1
63	лишь орудие мирового становления	1	1
64	собственно и составляющий морализаторскую	1	1
65	дискредитирующе глупое или попросту	1	1
66	мире необходимости ни в	1	1
67	собой исторически продуктивный тип	1	1
68	бы стержнем целой системы	1	1
69	жанра представляют собой традиционные	1	1
70	я героя система обстоятельств	1	1
71	рок и не окказиональный	1	1
72	герой жизнеописания может как	1	1
73	поэтому форма авторства выше	1	1
74	здесь сводится к реализации	1	1
75	вокруг него романным жизнеописанием	1	1
76	поступки в притче есть	1	1
77	напротив предполагает как раз	1	1
78	словесное кощунство и непристойность	1	1
79	преемственно воспроизводимой в культуре	1	1
80	ни в мире императивной	1	1
81	фатальную или же императивную	1	1
82	именно таковы герои сказания	1	1
83	потому нейтральное к языку	1	1
84	жизни то есть субъектом	1	1
85	старого европейского романа является	1	1
86	не есть биография и	1	1
87	текст речевая маска есть	1	1
88	связь со смертью герой	1	1
89	н.д тамарченко историческое становление	1	1
90	просторную сферу исторического бытия	1	1
91	героя тогда как ни	1	1
92	субъекта и адресата высказывания	1	1
93	может как быть так	1	1
94	пушкиным или вяземским не	1	1
95	компетенцией анекдотического персонажа оказывается	1	1
96	актанте лишь орудие мирового	1	1
97	иисусовой притче о блудном	1	1
98	самобытного смысла развертывающейся жизни	1	1
99	столько нарушителем некоторых норм	1	1
100	о блудном сыне это	1	1
101	и в форме индивидуального	1	1
102	системы явлений группирующихся вокруг	1	1
103	вокруг я героя система	1	1
104	смыслом ни в мире	1	1
105	ни в мире случайности	1	1
106	не могли бы быть	1	1
107	случайностная релятивистская казусная картина	1	1
108	субъектом самоопределения на чем	1	1
109	герое и через героя	1	1
110	столкновение индивидуальных инициатив бытийной	1	1
111	в притче есть реализация	1	1
112	все эти бытийные компетенции	1	1
113	миропорядка жизнь глазами анекдота	1	1
114	сводится к реализации некоторой	1	1
115	перед ним определенные задания	1	1
116	карнавальной непредвиденностью и недостоверностью	1	1
117	определенной жанровой схемы и	1	1
118	предносится целое нашего высказывания	1	1
119	где персонажем в акте	1	1
120	перед нами не как	1	1
121	моделируемая притчей напротив предполагает	1	1
122	возможна только в вероятностном	1	1
123	необходимости известного предназначения когда	1	1
124	необыкновенностью и существенно разнится	1	1
125	как формулирует н.д тамарченко	1	1
126	сказание давшее литературе героический	1	1
127	императивной нормы ни в	1	1
128	жизнь писал он еще	1	1
129	и через героя тогда	1	1
130	не может обладать собственным	1	1
131	авторства выше она названа	1	1
132	как центрированная вокруг я	1	1
133	система обстоятельств личностного присутствия	1	1
134	где образ становящегося человека	1	1
135	сообщает нечто смешное но	1	1
136	представляет собой исторически продуктивный	1	1
137	мире поведение остроумно находчивое	1	1
138	и в то же	1	1
139	случайности полноценная биография возможна	1	1
140	инициативного самообнаружения все эти	1	1
141	притче он статичен в	1	1
142	биография возможна только в	1	1
143	смеховой жанр городского фольклора	1	1
144	ритуальность заданность человеческих отношений	1	1
145	кощунство и непристойность необыкновенное	1	1
146	развития самоопределяющегося субъекта жизни	1	1
147	форма романа неканонического жития	1	1
148	компетенция жанра при несоответствии	1	1
149	усматривает во внутренне статичном	1	1
150	как быть так и	1	1
151	дискурса претерпевшего к тому	1	1
152	той или иной преемственно	1	1
153	первоначально предполагает по бахтину	1	1
154	раз ответственность свободного выбора	1	1
155	анекдотического персонажа оказывается самообнаружение	1	1
156	конкретной ценностно-смысловой картины мира	1	1
157	не дает позвоночника роману	1	1
158	а вероятностный опыт частного	1	1
159	человеческих отношений анекдот не	1	1
160	мысли с.с аверинцева предстают	1	1
161	в исконном значении этого	1	1
162	заданность человеческих отношений анекдот	1	1
163	выбора осуществляется или преступается	1	1
164	бахтину нарушение табу дозволенное	1	1
165	субъектом этического выбора или	1	1
166	предполагает по бахтину нарушение	1	1
167	субъектом ролевого действия или	1	1
168	компетенции для него возможны	1	1
169	форма авторства выше она	1	1
170	оказывается самообнаружение его характера	1	1
171	форма авторства как неизбежная	1	1
172	иной преемственно воспроизводимой в	1	1
173	схемы и в форме	1	1
174	статичном актанте лишь орудие	1	1
175	персонажи не выбирают а	1	1
176	из модификаций анекдотического дискурса	1	1
177	со стороны художественной литературы	1	1
178	где иллюстрировалась общая идея	1	1
179	как раз ответственность свободного	1	1
180	это фатально непреложный и	1	1
181	он еще не есть	1	1
182	лиц слово судьба в	1	1
183	романа является как бы	1	1
184	а некий нравственный закон	1	1
185	подобен новеллистическому герою своей	1	1
186	той или иной форме	1	1
187	нам всегда предносится целое	1	1
188	слово судьба в данном	1	1
189	картина мира которая своей	1	1
190	повествованием творится окказиональная случайностная	1	1
191	опыт частного существования мандельштам	1	1
192	природе суть то что	1	1
193	еще не есть биография	1	1
194	своей необыкновенностью и существенно	1	1
195	выбора или субъектом инициативного	1	1
196	в просторную сферу исторического	1	1
197	продуктивный тип высказывания реализующий	1	1
198	одна ночь и пр	1	1
199	извращает осмеивает всякую фатальную	1	1
200	непредвиденностью и недостоверностью отвергает	1	1
201	двух сыновей в иисусовой	1	1
202	нормы ни в мире	1	1
203	смертью герой жизнеописания может	1	1
204	с максимальной полнотой референтная	1	1
205	мандельштам справедливо противопоставлял житиям	1	1
206	знают становления мира в	1	1
207	тексте но всегда имплицитно	1	1
208	самообнаружение его характера инициативно-авантюрное	1	1
209	становления мира в притче	1	1
210	в нем определенные возможности	1	1
211	справедливо противопоставлял житиям святых	1	1
212	и сближение но не	1	1
213	героя и картины мира	1	1
214	не окказиональный жребий а	1	1
215	или субъектом инициативного самообнаружения	1	1
216	здесь действующие лица по	1	1
217	житиям святых где иллюстрировалась	1	1
218	мире случайности полноценная биография	1	1
219	отдельных лиц слово судьба	1	1
220	в мире необходимости ни	1	1
221	но всегда имплицитно присутствующего	1	1
222	поведение остроумно находчивое или	1	1
223	игра случая непредсказуемое стечение	1	1
224	общественных отношений которое гегель	1	1
225	когда персонажи не выбирают	1	1
226	персонажа оказывается самообнаружение его	1	1
227	в классическом романе реалистической	1	1
228	и где демонстрируется как	1	1
229	бытийной компетенцией анекдотического персонажа	1	1
230	неизбежная для производящего текст	1	1
231	или напротив дискредитирующе глупое	1	1
232	знаменует не фатальный рок	1	1
233	биографического дискурса проявляет себя	1	1
234	в жизнепроцессе бытия это	1	1
235	с.с аверинцева предстают перед	1	1
236	своей природе суть то	1	1
237	исторически восходит к тому	1	1
238	мира вокруг я героя	1	1
239	обратное влияние со стороны	1	1
240	целью и ситуацией высказывания	1	1
241	известного предназначения когда персонажи	1	1
242	таковы например слухи о	1	1
243	жанр посрамляющий умершее солнце	1	1
244	в форме индивидуального речевого	1	1
245	внутренне статичном актанте лишь	1	1
246	в данном контексте знаменует	1	1
247	окказиональная случайностная релятивистская казусная	1	1
248	глазами анекдота это игра	1	1
249	эти бытийные компетенции для	1	1
250	это императивная картина мира	1	1
251	ночь и пр связь	1	1
252	не столько нарушителем некоторых	1	1
253	реалистической парадигмы где образ	1	1
254	в вероятностном и многосмысленном	1	1
255	героя система обстоятельств личностного	1	1
256	позвоночника роману человек действующий	1	1
257	его уникальным жизненным опытом	1	1
258	данном контексте знаменует не	1	1
259	жанр в свою очередь	1	1
260	субъекты этического выбора все	1	1
261	современный сугубо смеховой жанр	1	1
262	картина мира как центрированная	1	1
263	святых где иллюстрировалась общая	1	1
264	курьезное любопытное занимательное неожиданное	1	1
265	мире императивной нормы ни	1	1
266	бытийные компетенции для него	1	1
267	эксплицированного в тексте но	1	1
268	такого выбора не всегда	1	1
269	стержнем целой системы явлений	1	1
270	не было и не	1	1
271	всякую фатальную или же	1	1
272	собой традиционные для него	1	1
273	реализующий некоторую коммуникативную стратегию	1	1
274	классическом романе реалистической парадигмы	1	1
275	жанр представляет собой исторически	1	1
276	табу дозволенное посрамление словесное	1	1
277	глупое или попросту чудаковатое	1	1
278	присутствия в жизнепроцессе бытия	1	1
279	как опыт становления и	1	1
280	референтная компетенция биографического дискурса	1	1
281	традиционные для него концепты	1	1
282	сугубо смеховой жанр городского	1	1
283	ни в мире необходимости	1	1
284	отношений анекдот не признает	1	1
285	героический эпос усматривает во	1	1
286	центрированная вокруг я героя	1	1
287	предметом целью и ситуацией	1	1
288	значении этого слова таковы	1	1
289	всегда предносится целое нашего	1	1
290	личностного присутствия в жизнепроцессе	1	1
291	на чем и основана	1	1
292	умершее солнце тысяча и	1	1
293	образ становящегося человека с	1	1
294	жанра высказывания жанр в	1	1
295	есть нарушение запрета есть	1	1
296	мира в герое и	1	1
297	он статичен в анекдоте	1	1
298	нарушение табу дозволенное посрамление	1	1
299	дозволенное посрамление словесное кощунство	1	1
300	анекдоте хаотичен а сказание	1	1
301	или анекдота но как	1	1
302	окказионально-авантюрном мире поведение остроумно	1	1
303	тому же обратное влияние	1	1
304	жизнь личности в противоположность	1	1
305	блудном сыне это императивная	1	1
306	не знают становления мира	1	1
307	в иисусовой притче о	1	1
308	реализации некоторой необходимости известного	1	1
309	во внутренне статичном актанте	1	1
310	новелла первоначально предполагает по	1	1
311	речевая маска есть креативная	1	1
312	и реализатором самобытного смысла	1	1
313	сферу исторического бытия и	1	1
314	опыт становления и развития	1	1
315	следует иметь в виду	1	1
316	очередь определяется предметом целью	1	1
317	целое нашего высказывания и	1	1
318	человек действующий во времени	1	1
319	задания реализуют в нем	1	1
320	присутствия в мире на	1	1
321	архаичному состоянию общественных отношений	1	1
322	речевого замысла поэтому форма	1	1
323	качестве бытийной компетенции персонажа	1	1
324	тамарченко историческое становление мира	1	1
325	предполагает как раз ответственность	1	1
326	для производящего текст речевая	1	1
327	необходимости ни в мире	1	1
328	когда мы строим свою	1	1
329	попросту чудаковатое дурацкое нередко	1	1
330	бытия и где демонстрируется	1	1
331	романе реалистической парадигмы где	1	1
332	есть субъектом самоопределения на	1	1
333	есть профанация священного новелла	1	1
334	сближение но не слияние	2	1
335	бытийная компетенция героического актанта	1	1
336	разнится от него выступая	1	1
337	кто говорит и как	1	1
338	к тому же обратное	1	1
339	то что они хотят	1	1
340	для него концепты героя	1	1
341	говорит и кому говорят	1	1
342	является возможность совершенно иной	1	1
343	и составляющий морализаторскую премудрость	1	1
344	действующий во времени старого	1	1
345	профанация священного новелла ночной	1	1
346	человека с его уникальным	1	1
347	иной жизни и совершенно	1	1
348	находчивое или напротив дискредитирующе	1	1
349	авторства как неизбежная для	1	1
350	притча не знают становления	1	1
351	со смертью герой жизнеописания	1	1
352	где демонстрируется как формулирует	1	1
353	индивидуальных инициатив бытийной компетенцией	1	1
354	и развития самоопределяющегося субъекта	1	1
355	хотят и свершают картина	1	1
356	ни анекдот ни притча	1	1
357	городского фольклора являет собой	1	1
358	целой системы явлений группирующихся	1	1
359	креативная компетенция жанра при	1	1
360	общества фиксировавшиеся пушкиным или	1	1
361	тип высказывания реализующий некоторую	1	1
362	притчей напротив предполагает как	1	1
363	притчи человеческая жизнь писал	1	1
364	существования мандельштам справедливо противопоставлял	1	1
365	исконном значении этого слова	1	1
366	ценностно-смысловой картины мира с	1	1
367	судьбы а некий нравственный	1	1
368	но как субъекты этического	1	1
369	не предначертанность судьбы а	1	1
370	объединяющая субъекта и адресата	1	1
371	романа неканонического жития ибо	1	1
372	ситуацией высказывания > кто	1	1
373	пр связь со смертью	1	1
374	ставят перед ним определенные	1	1
375	но факультативны он и	1	1
376	посрамление словесное кощунство и	1	1
377	это игра случая непредсказуемое	1	1
378	преодолеваемая даль и сближение	1	1
379	неканонического жития ибо жизнь	1	1
380	анекдота но как субъекты	1	1
381	роману человек действующий во	1	1
382	условием коммуникативной стратегии жизнеописания	1	1
383	возможны но факультативны он	1	1
384	одну из модификаций анекдотического	1	1
385	внеязыковое и потому нейтральное	1	1
386	ответственность свободного выбора в	1	1
387	той мере в какой	1	1
388	высказывания реализующий некоторую коммуникативную	1	1
389	их поступки в притче	1	1
390	вероятностный опыт частного существования	1	1
