1	не что иное как	3	7
2	д и т д	2	5
3	и т д и	2	5
4	т д и т	2	5
5	есть не что иное	2	5
6	одно и то же	4	4
7	можно ли сказать что	1	3
8	не потому что они	1	2
9	это значит что я	1	2
10	то это значит что	1	2
11	в той или другой	2	2
12	не есть она сама	1	2
13	от всего прочего и	1	1
14	ни на что не	1	1
15	можно только тогда когда	1	1
16	все новые и новые	1	1
17	тут не может быть	1	1
18	ту или иную вещь	1	1
19	так как будто бы	2	1
20	т е в конце	1	1
21	заключается в том что	1	1
22	т д все это	1	1
23	не есть ли он	1	1
24	и то и другое	1	1
25	бы меня ни убеждали	1	1
26	на самом же деле	1	1
27	до сих пор мы	1	1
28	потому что они –	1	1
29	е в конце концов	1	1
30	с какой стороны не	1	1
31	во всяком случае есть	1	1
32	не содержит в себе	1	1
33	и т д все	1	1
34	е более или менее	1	1
35	т е более или	1	1
36	есть не больше как	1	1
37	это не значит что	2	1
38	т е прежде всего	1	1
39	меня ни убеждали что	1	1
40	в том смысле что	3	1
41	в то время как	3	1
42	по крайней мере три	1	1
43	ни с чем не	1	1
44	с одной стороны и	1	1
45	той или другой форме	1	1
46	по крайней мере в	2	1
47	ни с какой стороны	1	1
