1	и тем не менее	1	3
2	ни в коем случае	2	3
3	ни в каком случае	1	3
4	есть не что иное	5	2
5	или по крайней мере	3	2
6	в каком смысле не	1	2
7	на самом же деле	1	2
8	ни в каком смысле	1	2
9	не имеет ничего общего	2	2
10	не что иное как	8	2
11	а это значит что	1	2
12	д и т д	2	1
13	т д и т	2	1
14	с этой точки зрения	2	1
15	и в то же	2	1
16	различить и противопоставить все	1	1
17	не говоря уже о	3	1
18	и есть не что	1	1
19	в этом смысле есть	1	1
20	вовсе не думает что	1	1
21	это значит что и	1	1
22	и т д и	3	1
23	ни в чем не	1	1
24	заключается не в том	1	1
25	ничего не говорит о	2	1
26	мы должны сказать что	1	1
27	дело в том что	1	1
28	случае не есть ни	1	1
29	в том что они	1	1
30	в коем случае не	2	1
31	смысле есть не что	1	1
32	что в данном случае	1	1
33	и ни в каком	1	1
34	имеет ничего общего с	2	1
35	этом смысле есть не	1	1
