1	не что иное как	2	8
2	есть не что иное	2	5
3	или по крайней мере	1	3
4	не говоря уже о	1	3
5	и т д и	4	3
6	д и т д	2	2
7	и в то же	1	2
8	имеет ничего общего с	1	2
9	но в то же	1	2
10	т д и т	3	2
11	не имеет ничего общего	2	2
12	и т д все	1	2
13	ничего не говорит о	1	2
14	с тем или другим	1	1
15	и тем не менее	8	1
16	в этом смысле есть	1	1
17	только тогда когда есть	1	1
18	т д все это	1	1
19	на самом же деле	1	1
20	в виду и весь	1	1
21	в связи с этим	1	1
22	перед нами не просто	1	1
23	ни в каком случае	3	1
24	она не есть ни	1	1
25	мы должны сказать что	1	1
26	дело в том что	3	1
27	всегда так или иначе	1	1
28	ни на что другое	1	1
29	иметь в виду и	1	1
30	свой смысл и свое	1	1
31	в себе не содержит	2	1
