1	в то же время	6	6
2	не что иное как	4	4
3	бы то ни было	1	3
4	состоит в том что	2	3
5	есть не что иное	2	3
6	в той или иной	1	3
7	мы имеем дело с	1	3
8	одного и того же	1	2
9	не остается ничего иного	1	2
10	какой бы то ни	1	2
11	в том или ином	1	2
12	но в то же	3	2
13	остается ничего иного как	1	2
14	той мере в какой	5	2
15	в той мере в	5	2
16	одно и то же	1	1
17	внешнего по отношению к	1	1
18	не говоря уже о	1	1
19	не только в том	1	1
20	для того чтобы быть	1	1
21	не может быть определено	1	1
22	том виде в каком	1	1
23	в принципе не может	1	1
24	не сам по себе	1	1
25	так как если бы	1	1
26	лишь в том что	1	1
27	с этой точки зрения	1	1
28	принципе не может быть	1	1
29	дело не только в	1	1
30	в собственном смысле слова	1	1
31	в большей или меньшей	1	1
32	в широком смысле этого	1	1
33	до тех пор пока	1	1
34	одной и той же	2	1
35	в том виде в	1	1
36	мы имеем в виду	1	1
37	он в то же	1	1
38	большей или меньшей степени	1	1
39	в самом деле как	1	1
40	собой не что иное	1	1
