1	в то же время	6	4
2	обращает на себя внимание	1	3
3	одно и то же	2	2
4	дело в том что	1	2
5	состоит в том что	3	2
6	в войне и мире	2	2
7	мы имеем дело с	1	2
8	барышня с кротким мягким	1	1
9	кротким мягким взглядом очень	1	1
10	живет в готовом стабильно	1	1
11	на мягкую белую шею	1	1
12	что может или пожелает	1	1
13	тихая добродушная жалостливая барышня	1	1
14	задаваемый читателю ракурс видения	1	1
15	автором в кадры повествования	1	1
16	строго отграниченная система смыслов	1	1
17	еще и потому что	1	1
18	как раз в том	1	1
19	времени в поле зрения	1	1
20	а в то же	1	1
21	читателя находится или движется	1	1
22	кадра входит лишь поименованное	1	1
23	а не все что	1	1
24	каждый малый отрезок времени	1	1
25	было и не могло	1	1
26	даже самая тривиальная в	1	1
27	кадрового единства фразы устанавливает	1	1
28	восприятие определений таков что	1	1
29	это была тихая добродушная	1	1
30	место лишь в самом	1	1
31	последовательно вводятся автором в	1	1
32	тексте а не все	1	1
33	читателю ракурс видения в	1	1
34	казалось бы место лишь	1	1
35	бы то ни было	1	1
36	поле зрения читателя находится	1	1
37	бы место лишь в	1	1
38	вдруг заслоняется крупным планом	1	1
39	раз в том что	1	1
40	деталей в пределах кадрового	1	1
41	белую шею с темной	1	1
42	насыщенный деталями кадр внутреннего	1	1
43	или пожелает представить себе	1	1
44	то же время они	1	1
45	малый отрезок времени в	1	1
46	была тихая добродушная жалостливая	1	1
47	восприятия в каждый малый	1	1
48	деталями кадр внутреннего зрения	1	1
49	ощущаться завершенная и строго	1	1
50	заслоняется крупным планом заключительного	1	1
51	с кротким мягким взглядом	1	1
52	здоровая порядок фокусирующих восприятие	1	1
53	у себя в комнате	1	1
54	жалостливая барышня с кротким	1	1
55	полные розовые щеки на	1	1
56	в пределах кадрового единства	1	1
57	что душевная характеристика душечки	1	1
58	отрезок времени в поле	1	1
59	готовом стабильно дифференцированном и	1	1
60	входит лишь поименованное в	1	1
61	щеки на мягкую белую	1	1
62	единства фразы устанавливает задаваемый	1	1
63	и строго отграниченная система	1	1
64	оно живет в готовом	1	1
65	находится или движется один	1	1
66	не было и не	1	1
67	самая тривиальная в общеязыковом	1	1
68	читаем это была тихая	1	1
69	душевная характеристика душечки постепенно	1	1
70	и не могло быть	2	1
71	розовые щеки на мягкую	1	1
72	мягкую белую шею с	1	1
73	завершенная и строго отграниченная	1	1
74	и в то же	1	1
75	таков что душевная характеристика	1	1
76	состав такого кадра входит	1	1
77	мягким взглядом очень здоровая	1	1
78	в той или иной	1	1
79	движется один отдельный кадр	1	1
80	в каждый малый отрезок	1	1
81	в готовом стабильно дифференцированном	1	1
82	очень здоровая порядок фокусирующих	1	1
83	добродушная жалостливая барышня с	1	1
84	души вдруг заслоняется крупным	1	1
85	фокусирующих восприятие определений таков	1	1
86	дифференцированном и оцененном мире	1	1
87	в нем звучит один	1	1
88	кадры повествования а читателем	1	1
89	в том случае если	1	1
90	в кадры читательского восприятия	1	1
91	определений таков что душевная	1	1
92	характеристика душечки постепенно углубляемая	1	1
93	такого кадра входит лишь	1	1
94	свою очередь членится на	1	1
95	порядок фокусирующих восприятие определений	1	1
96	поименованное в тексте а	1	1
97	лишь поименованное в тексте	1	1
98	в самом начале этой	1	1
99	на ее полные розовые	1	1
100	одного и того же	2	1
101	кадры читательского восприятия в	1	1
102	пределах кадрового единства фразы	1	1
103	в смерти чиновника или	1	1
104	самом начале этой цепочки	1	1
105	фразы устанавливает задаваемый читателю	1	1
106	может или пожелает представить	1	1
107	во втором эпизоде в	1	1
108	все что может или	1	1
109	ее полные розовые щеки	1	1
110	в свою очередь членится	1	1
111	читательского восприятия в каждый	1	1
112	нем звучит один голос	1	1
113	стабильно дифференцированном и оцененном	1	1
114	в поле зрения читателя	1	1
115	войне и мире толстого	1	1
116	не все что может	1	1
117	взглядом очень здоровая порядок	1	1
118	лишь в самом начале	2	1
119	глядя на ее полные	1	1
120	состоит как раз в	1	1
121	или движется один отдельный	1	1
122	слова в соответствии с	1	1
123	устанавливает задаваемый читателю ракурс	1	1
124	в тексте а не	1	1
125	в кадры повествования а	1	1
126	в организации кадров внутреннего	1	1
127	зрения читателя находится или	1	1
128	может ощущаться завершенная и	1	1
129	тривиальная в общеязыковом отношении	1	1
130	в том числе и	1	1
131	организации кадров внутреннего зрения	1	1
132	текста так и не	1	1
133	вводятся автором в кадры	1	1
134	в соответствии с его	1	1
