1	одним и тем же	3	2
2	один и тот же	1	1
3	в том или ином	1	1
4	в собственном смысле слова	1	1
5	что они находятся в	1	1
6	обстоит дело и в	1	1
7	одной и той же	2	1
8	из ложного предположения что	1	1
9	исходили из ложного предположения	1	1
10	так же обстоит дело	2	1
11	одного и того же	2	1
12	с этой точки зрения	1	1
13	которые сами по себе	1	1
14	в каждый данный момент	1	1
15	в зависимости от того	2	1
16	дело в том что	1	1
17	о котором мы говорили	2	1
18	же обстоит дело и	2	1
19	мы уже указывали на	1	1
