1	в то же время	6	5
2	мы имеем в виду	1	3
3	в том числе и	2	3
4	по себе еще не	1	2
5	в преступлении и наказании	1	2
6	не было и не	1	1
7	иметь в виду что	1	1
8	дело не в самом	1	1
9	и не могло быть	2	1
10	но в отличие от	1	1
11	и в то же	2	1
12	каким диалогическим углом они	1	1
13	наличии определенных языковых стилей	1	1
14	из уст в уста	1	1
15	то же время оно	1	1
16	самом наличии определенных языковых	1	1
17	в самом наличии определенных	1	1
18	было и не могло	1	1
19	одно и то же	3	1
20	языковых стилей социальных диалектов	1	1
21	определенных языковых стилей социальных	1	1
22	не в самом наличии	1	1
23	сопоставлены или противопоставлены в	1	1
24	том под каким диалогическим	1	1
25	они сопоставлены или противопоставлены	1	1
26	или противопоставлены в произведении	1	1
27	в той или иной	2	1
28	в том под каким	1	1
29	диалогическим углом они сопоставлены	1	1
30	под каким диалогическим углом	1	1
31	углом они сопоставлены или	1	1
32	одним и тем же	1	1
33	сама по себе еще	1	1
