841	образы не имеющие на	1	1
842	зрения каждого из этих	1	1
843	не совсем уместные в	1	1
844	пребывание зародыша в материнском	1	1
845	зарывание в землю мать-земля	1	1
846	эдипов комплекс и наконец	1	1
847	возвращению назад в этот	1	1
848	такое пещера в которую	1	1
849	аффекты и познание ощущения	1	1
850	ко дню его рождения	1	1
851	инцестуозных желаний чувств и	1	1
852	как ее эстетическая замена	1	1
853	бы социализировать грех в	1	1
854	остальной мир для них	1	1
855	основной фонд бессознательного составляют	1	1
856	объектов на другие безразличные	1	1
857	навыки работы и мышления	1	1
858	ребенок редко желает чего-нибудь	1	1
859	надо только не дать	1	1
860	время сна есть частичное	1	1
861	случайным явлением никак нельзя	1	1
862	вполне легальную корректную приемлемую	1	1
863	образование которое выдержит двойное	1	1
864	оно есть там бесспорно	1	1
865	наслаждения с его все	1	1
866	а иногда и первую	1	1
867	безразличные подробности сна превращением	1	1
868	сновидении фрейд различает два	1	1
869	границе систем бессознательного и	1	1
870	и брейер пользовались гипнозом	1	1
871	но наилучшим суррогатом рая	1	1
872	с точки зрения каждого	1	1
873	замена что такое непристойность?	1	1
874	происходит психический отбор и	1	1
875	воссоздаем положение зародыша организм	1	1
876	особенностями гениталии половые органы	1	1
877	разбираемого сна надо дать	1	1
878	связан принципом реальности и	1	1
879	образы явного сновидения оказываются	1	1
880	с точки зрения сознания	2	1
881	постель заставляет быть самостоятельным	1	1
882	ребенок тянется в постель	1	1
883	то душевное образование которое	1	1
884	рта при сосании anus	1	1
885	только одна из систем	1	1
886	вся жизнь человека и	1	1
887	в постель к матери	1	1
888	рождения становится первым вытесненным	1	1
889	освобождение под прикрытием художественной	1	1
890	под ним фрейд понимает	1	1
891	какой-то внутренний протест против	1	1
892	или осязания облачившись в	1	1
893	его сектантской но в	1	1
894	остроты непристойность еще более	1	1
895	остается и позиция фрейда	1	1
896	что мог бы сделать	1	1
897	аффектов в свою противоположность	1	1
898	волю желания стремления чувство	1	1
899	смешанный введением ряда посредствующих	1	1
900	сексуальные остроты родились из	1	1
901	хотя бы ценою жизни	1	1
902	превращением аффектов в свою	1	1
903	его галлюцинаторным удовлетворением желаний	1	1
904	сколько-нибудь точно и подробно	1	1
905	имеющие на первый взгляд	1	1
906	в свои построения все	1	1
907	яркой и меткой терминологией	1	1
908	возврат в материнское лоно	2	1
909	и ее возможного влияния	1	1
910	образы художественного творчества философские	1	1
911	политические идеи т.е вся	1	1
912	весь остальной мир для	1	1
913	пользовались гипнозом полным или	1	1
914	тела и с ними	1	1
915	т.е как истолковать сновидение?	1	1
916	зародыша в материнском чреве	1	1
917	рождения больной должен освободиться	1	1
918	применил метод толкования снов	1	1
919	не дать себя обмануть	1	1
920	сила сопротивления компромиссные образования	1	1
921	анализу некоторых образований сознания	1	1
922	бессознательного это вытеснение работающее	1	1
923	как проникнуть к этим	1	1
924	замкнулась в себя и	1	1
925	бы воображаемое она хочет	1	1
926	по ранку не чем	1	1
927	это первичное событие эдипова	1	1
928	служат отдушинами для вытесненных	1	1
929	т.е воссоздаем положение зародыша	1	1
930	говорить о том что	1	1
931	мы живем в мире	1	1
932	мы можем сказать что	3	1
933	объективных методов так называемого	1	1
934	аффектов с их действительных	1	1
935	сна превратив его в	1	1
936	дать выход вытесненным инфантильным	1	1
937	ее случайным явлением никак	1	1
938	избыть ужас рождения человек	1	1
939	его собственный организм все	1	1
940	с ужасом рождается и	1	1
941	очень сложны определяющая их	1	1
942	случае не может быть	1	1
943	скрытым мыслям т.е как	1	1
944	те же законы которые	1	1
945	дружной травле всего ученого	1	1
946	бессознательному и им управляется	1	1
947	эти компромиссы сознания с	1	1
948	человека совершается механически без	1	1
949	минимума общего языка который	1	1
950	этих внутренних соматических раздражений	1	1
951	союзника и этим как	1	1
952	выдержит двойное испытание с	1	1
953	к сожалению ни фрейд	1	1
954	его в постель заставляет	1	1
955	перевеса одной над другой	1	1
956	в конечном счете этому	1	1
957	и недозволенного она управляется	1	1
958	внутренних соматических раздражений фрейд	1	1
959	трупы также знаменует наиболее	1	1
960	рождения и ее возможного	1	1
961	компромиссный продукт борьбы сил	1	1
962	общепринятым разделение душевных явлений	1	1
963	страхе в неврозах и	1	1
964	для культурного сознания хорошая	1	1
965	человеку инфантильное самодовление таким	1	1
966	и им управляется его	1	1
967	принципом реальности и культурой	1	1
968	себе даже труда дифференцировать	1	1
969	детской психике с ее	1	1
970	достигнутого в этой борьбе	1	1
971	им управляется его нужды	1	1
972	как с вытесненным представлением	1	1
973	освобождение от реальности возврат	1	1
974	управляется только одним принципом	1	1
975	внутри организма показатель достигнутого	1	1
976	жизни человека культура и	1	1
977	личности наша психика не	1	1
978	мы имеем в виду	1	1
979	приток которых продолжается на	1	1
980	очищенном виде оно не	1	1
981	и этим как бы	1	1
982	культурного сознания хорошая шутка	1	1
983	повторить и об его	1	1
984	именно нормальный половой акт	1	1
985	социализировать грех в агрессивных	1	1
986	можно добраться до вытесненного	1	1
987	проникнуть к этим скрытым	1	1
988	части находится только больной	1	1
989	давлением принципа реальности это	1	1
990	и искусно замаскированные образами	1	1
991	отношения к разбираемому сновидению	1	1
992	замещающих представлений тот же	1	1
993	начали цитировать еще шопенгауэра	1	1
994	пользуется этой привилегией для	1	1
995	убеждены но так ли	1	1
996	влечения т.е до скрытого	1	1
997	от реальности возврат в	1	1
998	конечно с точки зрения	1	1
999	когда сопротивление во всех	1	1
1000	быть не может наконец	1	1
1001	своим врагам ребенок редко	1	1
1002	это достигается слиянием нескольких	1	1
1003	и не нуждается в	1	1
1004	одним принципом принципом наслаждения	1	1
1005	суррогат сексуального действия полового	1	1
1006	на два потока на	1	1
1007	и считается самым ортодоксальным	1	1
1008	рождения воспроизводится в болезненных	1	1
1009	кабинет в освещенной части	1	1
1010	ведает вытеснением особая психическая	1	1
1011	в этой борьбе равновесия	1	1
1012	нескольких образов в один	1	1
1013	в постель заставляет быть	1	1
1014	не знает различения возможного	1	1
1015	всей последующей жизни но	1	1
1016	еще более маскирует свою	1	1
1017	в знаменитом споре волновавшем	1	1
1018	отказ от удовлетворения всех	1	1
1019	общем можно сказать что	1	1
1020	вытесненного влечения очень сложны	1	1
1021	в полумраке изображает для	1	1
1022	законы образования замещающих представлений	1	1
1023	к матери и связанная	1	1
1024	те же определения этих	1	1
1025	таким образом обусловлено как	1	1
1026	эротического и часто инфантильно-эротического	1	1
1027	женщину на ее присутствие	1	1
1028	ранку не чем иным	1	1
1029	ницше весь остальной мир	1	1
1030	полное органическое единство с	1	1
1031	душевных явлений на волю	1	1
1032	всего ученого мира замкнулась	1	1
1033	и часто инфантильно-эротического образы	1	1
1034	гениталиям пробуждающие в ребенке	1	1
1035	его времени и как	1	1
1036	прямо противоположных по смыслу	1	1
1037	явно выдают черты своего	1	1
1038	uterus и пути в	1	1
1039	позволено и с его	1	1
1040	этой работе совершенно субъективны	1	1
1041	к отцу так называемый	1	1
1042	фрейдизм перенес в свои	1	1
1043	агрессивным сексуальные остроты родились	1	1
1044	удовлетворения непристойность рассчитана на	1	1
1045	и беспрепятственно рождаются такие	1	1
1046	стали классическими и образцовыми	1	1
1047	но и подкупить этого	1	1
1048	снова тянется к матери	1	1
1049	психического избыть ужас рождения	1	1
1050	самодовление таким образом и	1	1
1051	притом он сохраняет те	1	1
1052	скрытого содержания сна это	1	1
1053	их действительных объектов на	1	1
1054	сосании anus или анальная	1	1
1055	замены образов словесной двусмысленности	1	1
1056	голос отца с его	1	1
1057	давление реальности и культуры	1	1
1058	различает два момента явное	1	1
1059	присуще ребенку с самого	1	1
1060	голод присуще ребенку с	1	1
1061	в замену в суррогат	1	1
1062	жизни человека имеет по	1	1
1063	человека все творчество таким	1	1
1064	значения из одного плана	1	1
1065	накопления громадного запаса самых	1	1
1066	свою концепцию психического всей	1	1
1067	все эти психические элементы	1	1
1068	травмы рождения и ее	1	1
1069	наименее понятен ребенку именно	1	1
1070	нитями с другими моментами	1	1
1071	этой же тяги к	1	1
1072	и золотого века в	1	1
1073	от серьезности жизни и	1	1
1074	себя и ссылаются только	1	1
1075	всего фрейдизм догматически усвоил	1	1
1076	на первый взгляд никакого	1	1
1077	мышления не совсем уместные	1	1
1078	дать полную свободу своей	1	1
1079	жизни и дать выход	1	1
1080	психоанализа от остальной психологии	1	1
1081	травму рождения больной должен	1	1
1082	ее присутствие хотя бы	1	1
1083	заставляет быть самостоятельным обходиться	1	1
1084	эта сила тормозит и	1	1
1085	перенесения для психотерапевтической практики	1	1
1086	полость рта при сосании	1	1
1087	человек разыгрывает все снова	1	1
1088	теперь нашу работу она	1	1
1089	одеялом поджимаем ноги сгибаем	1	1
1090	человека конечно в смысле	1	1
1091	прямого объекта на другой	1	1
1092	себя и усвоила несколько	1	1
1093	своего происхождения из этой	1	1
1094	страсть и духовную привязанность	1	1
1095	мог бы сделать организм	1	1
1096	родились из непристойности как	1	1
1097	мысли и образы по-видимому	1	1
1098	все влечения фрейд разделяет	1	1
1099	матери не позволяет брать	1	1
1100	то нам кажется что	1	1
1101	что между ними уже	1	1
1102	общем яркой и меткой	1	1
1103	и любой участок тела	1	1
1104	приступая к такой работе	1	1
1105	и сознательного для психоанализа	1	1
1106	которой можно добраться до	1	1
1107	той или иной эрогенной	1	1
1108	пытается дать объективного физиологического	1	1
1109	сила тормозит и теперь	1	1
1110	в систему бессознательного группа	1	1
1111	в мифах и сагах	1	1
1112	к эстетическим явлениям шутки	1	1
1113	позиция фрейда в знаменитом	1	1
1114	выход вытесненным инфантильным влечениям	1	1
1115	дифференцировать эту остальную психологию	1	1
1116	может соединиться с любым	1	1
1117	границы этих двух групп	1	1
1118	свободно играющий во внешнем	1	1
1119	компромиссы сознания с бессознательным	1	1
1120	знаменует преодоление травмы греки	1	1
1121	перенесением эмоций и аффектов	1	1
1122	сна надо дать полную	1	1
1123	раздражениями организма внутренние раздражения	1	1
1124	влечениям сексуальным или агрессивным	1	1
1125	очень важный момент в	1	1
1126	введением ряда посредствующих образов	1	1
1127	анализа травмы рождения и	1	1
1128	зародыша организм замыкается от	1	1
1129	та сила которая в	1	1
1130	психологическими направлениями и методами	1	1
1131	цензура лежит на границе	1	1
1132	достигается слиянием нескольких образов	1	1
1133	желания или во всяком	1	1
1134	в проявлении своего исконного	1	1
1135	корректную приемлемую для сознания	1	1
1136	полумраке изображает для больного	1	1
1137	форму это достигается слиянием	1	1
1138	душевное образование которое выдержит	1	1
1139	на границе систем бессознательного	1	1
1140	и психике половое созревание	1	1
1141	имеющие отношения к сновидению	1	1
1142	знаем закрыт прямой доступ	1	1
1143	этому бессознательному и им	1	1
1144	лежит смутная бессознательная память	1	1
1145	со стороны формы так	1	1
1146	сожалению ни фрейд ни	1	1
1147	отдушина для подавленных энергий	1	1
1148	идущее от тетенса и	1	1
1149	др к функциональной психологии	1	1
1150	сказать что главную массу	1	1
1151	которые переносится бессознательное отношение	1	1
1152	успешно конкурируют другие зоны	1	1
1153	симптомов прежде всего к	1	1
1154	не соединимых на одном	1	1
1155	есть и начало человеческой	1	1
1156	сгибаем шею т.е воссоздаем	1	1
1157	итак фрейд ни разу	1	1
1158	сознание потому-то и мобилизована	1	1
1159	организма под давлением принципа	1	1
1160	выдают положение зародыша только	1	1
1161	в душе человека как	1	1
1162	влечения очень сложны определяющая	1	1
1163	травматическое отделение от матери	1	1
1164	рассчитана на женщину на	1	1
1165	сексуальным или агрессивным сексуальные	1	1
1166	шею т.е воссоздаем положение	1	1
1167	идеи т.е вся область	1	1
1168	эротического влечения человека конечно	1	1
1169	оно рождается вместе с	1	1
1170	наконец мы критикуем приходящие	1	1
1171	сейчас же заметим что	1	1
1172	истории детской сексуальной жизни	1	1
1173	общего не может быть	1	1
1174	имен обмолвки описки и	1	1
1175	которую забивался первобытный человек?	1	1
1176	современной им психологии и	1	1
1177	сознания с бессознательным дозволенного	1	1
1178	меньшие группы вытесненных психических	1	1
1179	жажда возврата и этот	1	1
1180	приводит к роковому разделению	1	1
1181	находит себе освобождение под	1	1
1182	позволяет брать его в	1	1
1183	более маскирует свою тенденцию	1	1
1184	в себя и усвоила	1	1
1185	и отцовскому авторитету эдипов	1	1
1186	действительных объектов на другие	1	1
1187	смутная бессознательная память о	1	1
1188	скрытые мысли сна latente	1	1
1189	только частичной компенсацией потерянного	1	1
1190	причина легкого и быстрого	1	1
1191	подробности сна превращением аффектов	1	1
1192	фрейдисты никогда не попытались	1	1
1193	цензурой цензура лежит на	1	1
1194	жизнь человека и все	1	1
1195	слов замены образов словесной	1	1
1196	символичны мы живем в	1	1
1197	роковую роль в развитии	1	1
1198	конечном счете этому бессознательному	1	1
1199	следующему первым объектом эротического	1	1
1200	бессознательное отношение к отцу	1	1
1201	поджимаем ноги сгибаем шею	1	1
1202	психического всей остальной психологии	1	1
1203	без всякого участия сознания	1	1
1204	поверхностным головным не захватывающим	1	1
1205	перенося на них свои	1	1
1206	сексуализуя каждый акт ее	1	1
1207	мы укутываемся одеялом поджимаем	1	1
1208	сознание свободные мысли и	1	1
1209	классическими и образцовыми для	1	1
1210	обычно из безразличных впечатлений	1	1
1211	методы ранка в этой	1	1
1212	в детском страхе в	1	1
1213	в этих влечениях маленького	1	1
1214	рождение инцестуозных желаний чувств	1	1
1215	легальную корректную приемлемую для	1	1
1216	ужасом рождается и тяга	1	1
1217	только уже войдя в	1	1
1218	сновидения мифы образы художественного	1	1
1219	заднепроходное отверстие при выделении	1	1
1220	участок тела может стать	1	1
1221	и теперь нашу работу	1	1
1222	влечения человека конечно в	1	1
1223	жизни человека совершается механически	1	1
1224	критикуем приходящие нам в	1	1
1225	форме когда сопротивление во	1	1
1226	этим как бы социализировать	1	1
1227	только обойти запрет но	1	1
1228	мессер и др к	1	1
1229	ужас рождения человек не	1	1
1230	слиянием нескольких образов в	1	1
1231	и философов о психофизическом	1	1
1232	большой недостаток фрейдизма психоаналитическая	1	1
1233	входит в высшую систему	1	1
1234	языка который необходим для	1	1
1235	со всяким уважением со	1	1
1236	к такой работе мы	1	1
1237	образов перенесением эмоций и	1	1
1238	внутренними раздражениями организма внутренние	1	1
1239	изживанием и преодолением на	1	1
1240	психоаналитических сеансов и таким	1	1
1241	во всей последующей жизни	1	1
1242	сложны определяющая их цель	1	1
1243	и вредного дозволенного и	1	1
1244	с наличным во сне	1	1
1245	материнского лона переживает страшное	1	1
1246	и начало человеческой психики	1	1
1247	не имеющие отношения к	1	1
1248	остроты родились из непристойности	1	1
1249	влечение стремящееся пробиться в	1	1
1250	все новых и новых	1	1
1251	несколько сектантские навыки работы	1	1
1252	сознания любовь к матери	1	1
1253	тенденцию делает ее приемлемее	1	1
1254	и позиция фрейда в	1	1
1255	имеют эти замещающие образы	1	1
1256	оказываются звеньями той цепи	1	1
