1	в то же время	12	5
2	в той или иной	9	3
3	но в то же	4	3
4	о том же предмете	1	2
5	одно и то же	2	2
6	сих пор совершенно не	1	2
7	оглядки на чужое слово	1	2
8	направленное на свой предмет	1	2
9	до сих пор совершенно	1	2
10	в то время как	2	2
11	на свой предмет слово	1	2
12	быть более или менее	1	2
13	не лежит в одной	1	1
14	дело далеко не исчерпывается	1	1
15	на ту же тему	2	1
16	происходит преломление авторских интенций	1	1
17	слово в то же	1	1
18	с прямым авторским словом	1	1
19	в большей или меньшей	3	1
20	в монологический контекст данного	1	1
21	в пределах того же	4	1
22	рядом друг с другом	1	1
23	и т п так	1	1
24	с чужим словом в	3	1
25	никогда не может быть	1	1
26	и в другом случае	2	1
27	слово во всех его	1	1
28	в нем новые стороны	1	1
29	бы то ни было	1	1
30	как нейтральное слово языка	1	1
31	в том и в	2	1
32	в одной плоскости с	1	1
33	и всякое иное слово	1	1
34	и не может не	1	1
35	в прямой авторской речи	1	1
36	и в том и	2	1
37	лежит в одной плоскости	1	1
38	точек зрения и оценок	1	1
39	каковы бы ни были	1	1
40	с чужим словом и	1	1
41	дело в том что	1	1
42	том и в другом	2	1
43	той или иной степени	9	1
44	и т п в	1	1
45	большей или меньшей степени	3	1
46	прямое авторское слово в	1	1
47	и то же слово	2	1
