1	состоит в том что	1	3
2	в том что он	1	3
3	в тех случаях когда	1	2
4	в том что оно	1	2
5	о котором идет речь	5	2
6	заключается в том что	3	2
7	в то же время	2	2
8	для того чтобы быть	2	2
9	одного и того же	3	2
10	а в том что	1	2
11	на то обстоятельство что	1	2
12	и с точки зрения	1	1
13	есть ничто иное как	1	1
14	в самом широком смысле	1	1
15	стоит в связи с	1	1
16	одно и то же	1	1
17	в зависимости от среды	1	1
18	не в том что	1	1
19	не трудно видеть что	1	1
20	о том что он	1	1
21	в том случае если	4	1
22	котором идет речь в	1	1
23	но с другой стороны	1	1
24	что же касается до	2	1
25	только в том случае	1	1
26	ни то ни другое	1	1
