N	4gram	Tiupa_Narr_2	Hudozhes
1274	жестко очерченный характер обособляя	1	1
1275	как хотелось того современной	1	1
1276	в рассказе с подлинным	1	1
1277	характер чеховского персонажа прочно	1	1
1278	упоенно живет этой своей	1	1
1279	убеждениях а в том	1	1
1280	отказывается от классической монады	1	1
1281	испытывает чувство стыда за	1	1
1282	к внешним обстоятельствам и	1	1
1283	липовский о настроениях чеховских	1	1
1284	героя характер чеховского персонажа	1	1
1285	представителей решительно отказывается от	1	1
1286	составляет духовное содержание чувства	1	1
1287	критика посещало подлинное прозрение	1	1
1288	в лицо собеседника преимущество	1	1
1289	своему невежеству и недовольству	1	1
1290	чисто внешней активностью делая	1	1
1291	часто бывала озадачена а	1	1
1292	содержание чувства любви испытываемого	1	1
1293	вероятно навсегда социальная адаптация	1	1
1294	посещало подлинное прозрение которым	1	1
1295	из народной жизни лишена	1	1
1296	позиции характер этот не	1	1
1297	как к себе лирически	1	1
1298	которая не в ладу	1	1
1299	универсальному так и уникальному	1	1
1300	или иначе вписанный в	1	1
1301	своему искусно сохраните черты	1	1
1302	и тем обесценил свою	1	1
1303	личности старшая из сестер	1	1
1304	художником хотя и переживающим	1	1
1305	характеры действующих лиц у	1	1
1306	характерным же зовут лишь	1	1
1307	всеобщность поскольку быть личностью	1	1
1308	неотождествимые аспекты нашего самоопределения	1	1
1309	так а липовский о	1	1
1310	однако чехов наследует это	1	1
1311	когда около дома пахнет	1	1
1312	поэтому обладательница сильного характера	1	1
1313	о ради такой девушки	1	1
1314	линков обобщающая мысль иначе	1	1
1315	сам а явление людям	1	1
1316	ощущение его неорганичности затаенной	1	1
1317	о личности мы судим	1	1
1318	воспользоваться так а липовский	1	1
1319	что он вовсе не	1	1
1320	пейзажиста земца представителя молодежи	1	1
1321	импрессионистов несомненно есть здоровые	1	1
1322	отыскал свою вешалку и	1	1
1323	диалогически-личностная встреча с другим	1	1
1324	учить это действительно так	1	1
1325	мыслит чувствует и вопреки	1	1
1326	один эстетически чуткий читатель	1	1
1327	обстоятельствам и нормам к	1	1
1328	чеховского персонажа прочно соединяется	1	1
1329	свои усилия на то	1	1
1330	вплоть до повторений диктуемой	1	1
1331	от классической монады равного	1	1
1332	ее было видно что	1	1
1333	недовольству жизнью к социальной	1	1
1334	повторяемостью того что лида	1	1
1335	в другом и напротив	1	1
1336	психологический облик сформировавшийся в	1	1
1337	никитина а стороны этого	1	1
1338	лиды и причина этого	1	1
1339	лирически узнавая себя в	1	1
1340	черты характера среди любых	1	1
1341	свою художественную задачу лидия	1	1
1342	его мироотношение одушевленное исканием	1	1
1343	характером личность не относясь	1	1
1344	что сообщалось о герое	1	1
1345	волчаниновых упоенно живет этой	1	1
1346	потерян вероятно навсегда социальная	1	1
1347	правило неадекватны их внутреннему	1	1
1348	вполне заурядным характером но	1	1
1349	разговоре с машей предстает	1	1
1350	но порой поступает мыслит	1	1
1351	в направил свои усилия	1	1
1352	позиция лиды уязвима но	1	1
1353	человека его ролевой типажный	1	1
1354	личность не относясь при	1	1
1355	весьма отчужденно дистанцированно как	1	1
1356	но достаточно сильна поскольку	1	1
1357	обособленность человека его ролевой	1	1
1358	и описываемое как вещь	1	1
1359	личность понятая объективно чужое	1	1
1360	великое открытие классического реализма	1	1
1361	увиденной как симптом эпохи	1	1
1362	неорганичности затаенной неадекватности искусственности	1	1
1363	это не случай по	1	1
1364	к тому что счастье	1	1
1365	есть на самом деле	1	1
1366	диктуемой ею фразы из	1	1
1367	была такою в этом	1	1
1368	чтобы осмыслить свой характер	1	1
1369	читателя в ее поступке	1	1
1370	других характеров самоактуализация составляет	1	1
1371	во всемирно-историческом масштабе практический	1	1
1372	xix в обычно понималось	1	1
1373	высшим достижением если решительно	1	1
1374	нельзя сидеть сложа руки	1	1
1375	критике он бы крайне	1	1
1376	вспомнить некоторые жанровые сценки	1	1
1377	века в лице своих	1	1
1378	выбора жизненной программы социальной	1	1
1379	характерны но лишены в	1	1
1380	осмыслить свой характер приходится	1	1
1381	прочно соединяется с его	1	1
1382	старшая из сестер волчаниновых	1	1
1383	межличностных контактов в самой	1	1
1384	каждого человека но при	1	1
1385	может во многом ошибаемся	1	1
1386	длинный день ничего не	1	1
1387	герою нс как к	1	1
1388	в последнем разговоре с	1	1
1389	натура активная деятельная характер	1	1
1390	вся жизнь была такою	1	1
1391	изнутри своего я к	1	1
1392	как историческом так и	1	1
1393	бездеятельность исключает ролевые отношения	1	1
1394	если бесхарактерные послушные воле	1	1
1395	ни у кого до	1	1
1396	раз вглядывается в лицо	1	1
1397	рассказе панихида например мы	1	1
1398	понятия смежные но не	1	1
1399	жанровые сценки импрессионистов несомненно	1	1
1400	состоит в том что	4	1
1401	и называл себя бабой	1	1
1402	этих своих качеств так	1	1
1403	соотнесенную с соломоновой суетой	1	1
1404	гуров постоял немного прислушался	1	1
1405	чем лечить н учить	1	1
1406	способ существования характерным же	1	1
1407	живописца достаточно вспомнить некоторые	1	1
1408	и вопреки этой своей	1	1
1409	делая окружающих зрителями собственного	1	1
1410	делать то хочется чтобы	1	1
1411	неуклюжие калоши [...] бывают	1	1
1412	себе перенесенным на холст	1	1
1413	так остро вопрос о	1	1
1414	то полон нежности тишины	1	1
1415	сильна поскольку она сама	1	1
1416	этот момент назойливой повторяемостью	1	1
1417	частности бездеятельность исключает ролевые	1	1
1418	других демонстративно не срастаясь	1	1
1419	своих инвективах против теории	1	1
1420	чьи симпатии оказались бы	1	1
1421	довольства что сумел увлечься	1	1
1422	одушевленное исканием смысла жизни	1	1
1423	ее лицам самоактуализация и	1	1
1424	некоторого я субъекта самоопределения	1	1
1425	и олеандром молодежь только	1	1
1426	у волчаниновых и т	1	1
1427	жизненной программы социальной позиции	1	1
1428	и личность не только	1	1
1429	многом ошибаемся но мы	1	1
1430	продукт ответственной самоактуализации человеческого	1	1
1431	лицо собеседника преимущество художника	1	1
1432	тишины и довольства собою	1	1
1433	он чрезмерно демонстративен что	1	1
