1	заключается в том что	2	2
2	в то же время	4	2
3	до сих пор не	1	2
4	но с другой стороны	2	1
5	именно в том что	1	1
6	не может не быть	1	1
7	только в том случае	1	1
8	не говоря уже о	1	1
9	встать на точку зрения	1	1
10	только с точки зрения	1	1
11	также и то что	1	1
12	не потому чтобы я	1	1
13	не трудно видеть что	1	1
14	в том что он	1	1
15	и в голову не	1	1
16	и в том и	1	1
17	дело в том что	4	1
18	указание на то что	1	1
19	одно из двух или	1	1
20	в то время как	1	1
21	мысль о том что	1	1
22	в том и другом	1	1
23	тем более что он	1	1
24	а на самом деле	1	1
25	в том числе и	2	1
26	уже о том что	1	1
27	в целом ряде случаев	1	1
28	в этой области не	1	1
