422	различные формы то нам	1	1
423	широко пользуется этой привилегией	1	1
424	даже труда дифференцировать эту	1	1
425	в этой работе совершенно	1	1
426	и наконец враждебность ко	1	1
427	дать объективного физиологического анализа	1	1
428	их лежит смутная бессознательная	1	1
429	такие представления чувства и	1	1
430	света сознания и искусно	1	1
431	вытесненному влечению законы образования	1	1
432	есть суррогат их видения	1	1
433	рождения человека все творчество	1	1
434	только одним принципом принципом	1	1
435	воспроизводит травму рождения больной	1	1
436	систему бессознательного это вытеснение	1	1
437	на врача во время	1	1
438	есть та сила которая	1	1
439	разрешили загадку сфинкса которая	1	1
440	момент в психоаналитической теории	1	1
441	внешний мир в замену	1	1
442	замещающий так влечение к	1	1
443	фрейда в знаменитом споре	1	1
444	и ссылаются только друг	1	1
445	ними представлений и чувств	1	1
446	и образы по-видимому случайные	1	1
447	запас чувств и желаний	1	1
448	деятельность приводится в движение	1	1
449	они обвиняют ее в	1	1
450	продолжение рода хотя бы	1	1
451	которых продолжается на протяжении	1	1
452	по которой можно добраться	1	1
453	на ее присутствие хотя	1	1
454	золотого века в мифах	1	1
455	впечатлений ближайшего дня которые	1	1
456	приходящие нам в голову	1	1
457	выяснить сколько-нибудь точно и	1	1
458	одна на другую и	1	1
459	эдипова комплекса перенося на	1	1
460	всех его многообразных проявлениях	1	1
461	в детской психике с	1	1
462	получает возможность войти в	1	1
463	позволяют частично изживать бессознательное	1	1
464	точку зрения легального сознания	1	1
465	с бессознательным дозволенного с	1	1
466	между организмом и внешней	1	1
467	так влечение к матери	1	1
468	фрейда об эрогенных зонах	1	1
469	другими психологическими направлениями и	1	1
470	вытесненных влечений позволяют частично	1	1
471	всякому закону установлению государству	1	1
472	частичное повторение внутриутробного положения	1	1
473	в ней методам это	1	1
474	и благодаря канту ставшее	1	1
475	формы то нам кажется	1	1
476	анализу все эти компромиссные	1	1
477	один смешанный введением ряда	1	1
478	врагам ребенок редко желает	1	1
479	самого начала повернулся спиной	1	1
480	с ее все позволено	1	1
481	старой психологии что ими	1	1
482	явные образы сновидения и	1	1
483	непристойность еще более маскирует	1	1
484	быстрого забвения снов и	1	1
485	источник т.е рождаются в	1	1
486	различия действительного и недействительного	1	1
487	отдушинами для вытесненных влечений	1	1
488	зона заднепроходное отверстие при	1	1
489	удовлетворением т.е между организмом	1	1
490	не может во всей	1	1
491	не интересует химизм этих	1	1
492	т.е и она служит	1	1
493	чувств и представлений при	1	1
494	как совокупность усилий превратить	1	1
495	память о действительно бывшем	1	1
496	был связан принципом реальности	1	1
497	отношение к отцу и	1	1
498	закрыт прямой доступ в	1	1
499	события взрослой жизни заимствуют	1	1
500	в общем яркой и	1	1
501	связанных как с вытесненным	1	1
502	и порочностью в детской	1	1
503	остротах находит себе освобождение	1	1
504	дальнейших ступеней развития к	1	1
505	телами недвусмысленно выдают положение	1	1
506	это содержание оказывается замаскированным	1	1
507	и практикующимся в ней	1	1
508	недвусмысленно выдают положение зародыша	1	1
509	и представлений при этом	1	1
510	рождение человека в мир	1	1
511	объекте в другом человеке	1	1
512	или анальная зона заднепроходное	1	1
513	замену в суррогат ersatzbildung	1	1
514	форму остроты непристойность еще	1	1
515	к отцу и отцовскому	1	1
516	от накопившихся в глубине	1	1
517	явным введением прямо противоположных	1	1
518	рождения в мир но	1	1
519	с самого начала повернулся	1	1
520	два момента явное содержание	1	1
521	событие жизни человека имеет	1	1
522	об его зрелом методе	1	1
523	нам в голову мысли	1	1
524	во всяком случае не	1	1
525	к роковому разделению единого	1	1
526	запрет но и подкупить	1	1
527	когда давление реальности и	1	1
528	к новым попыткам объективных	1	1
529	ним фрейд понимает бессознательное	1	1
530	счете этому бессознательному и	1	1
531	и только то душевное	1	1
532	сопротивление нашего сознания рождается	1	1
533	еще шопенгауэра и ницше	1	1
534	организма показатель достигнутого в	1	1
535	психических образований приток которых	1	1
536	представлений тот же механизм	1	1
537	интересует химизм этих зон	1	1
538	все события взрослой жизни	1	1
539	делает ее приемлемее для	1	1
540	фрейд образно называет цензурой	1	1
541	продолжающий его собственный организм	1	1
542	к внутриутробной жизни однажды	1	1
543	себе освобождение под прикрытием	1	1
544	снова разыгрываем это состояние	1	1
545	свою психическую силу от	1	1
546	друг на друга в	1	1
547	их скрюченными сидячими телами	1	1
548	рождения рождение человека в	1	1
549	техника символичны мы живем	1	1
550	ее эстетическая замена что	1	1
551	виде оно не регистрирует	1	1
552	перенесения значения из одного	1	1
553	из того же источника	1	1
554	неприятные последствия такие желания	1	1
555	познание ощущения представления мысли	1	1
556	его сводится к следующему	1	1
557	работе мы сейчас же	1	1
558	но мы знаем что	2	1
559	философов о психофизическом параллелизме	1	1
560	той цепи по которой	1	1
561	боящиеся света сознания и	1	1
562	так и с наличным	1	1
563	сновидения оказываются замещающими представлениями	1	1
564	traumgedanken боящиеся света сознания	1	1
565	даже того минимума общего	1	1
566	и познание ощущения представления	1	1
567	усвоил старое идущее от	1	1
568	ни фрейд ни фрейдисты	1	1
569	ребенку с самого начала	1	1
570	ребенок еще не знает	1	1
571	захватывающим самых глубин организма	1	1
572	чувства и желания которые	1	1
573	рассеяно по всему телу	1	1
574	сна стали классическими и	1	1
575	каждый акт ее ухода	1	1
576	с их скрюченными сидячими	1	1
577	содержания актом рождения в	1	1
578	цели и по соматическому	1	1
579	комплекс и наконец враждебность	1	1
580	и подробно свое отношение	1	1
581	приемлемую для сознания форму	1	1
582	затем беспощадному вытеснению в	1	1
583	мир в замену в	1	1
584	и усвоила несколько сектантские	1	1
585	вытесненным представлением так и	1	1
586	одною из эрогенных зон	1	1
587	со своего прямого объекта	1	1
588	отбор и только то	1	1
589	накопляет громадный запас чувств	1	1
590	только себя и ссылаются	1	1
591	первый объект юношеской любви	1	1
592	образно называет цензурой цензура	1	1
593	самые нелепые мысли и	1	1
594	стремимся сохранить и выдержать	1	1
595	гроба наконец связанные с	1	1
596	символов замещающих объекты вытесненного	1	1
597	положение зародыша организм замыкается	1	1
598	отношение к вытесненному влечению	1	1
599	удовлетворения всех влечений и	1	1
600	силу от этого первого	1	1
601	за отказ от удовлетворения	1	1
602	представительства этих внутренних соматических	1	1
603	нуждается в слушателе цель	1	1
604	остальной психологии действительно настолько	1	1
605	замещающих объекты вытесненного влечения	1	1
606	прием соблазна называние непристойных	1	1
607	науке фрейд и его	1	1
608	и первую эрекцию ребенок	1	1
609	ссылаются только друг на	1	1
610	конечно в смысле инфантильной	1	1
611	своего исконного органического самодовления	1	1
612	из материнского лона переживает	1	1
613	сохранить и выдержать точку	1	1
614	этом убеждены но так	1	1
615	влечение в единственно допустимой	1	1
616	противопоставляют свою концепцию психического	1	1
617	одного плана в другой	1	1
618	его все позволено и	1	1
619	во всяком случае имеют	1	1
620	желания должны быть подавлены	1	1
621	продукт борьбы сил внутри	1	1
622	превратив его в явные	1	1
623	с вытесненным представлением а	1	1
624	сеансов и таким путем	1	1
625	она служит в конечном	1	1
626	гениталии половые органы еще	1	1
627	материнском чреве носит либидинозный	1	1
628	от матери разрыва единства	1	1
629	в которую забивался первобытный	1	1
630	компромиссное частичное освобождение от	1	1
631	травма рождения воспроизводится в	1	1
632	с ними разнообразных чувств	1	1
633	и преодолением на различных	1	1
634	путем слияния представлений и	1	1
635	новых вытеснений но в	1	1
636	вытесненным представлением а с	1	1
637	прежде всего фрейдизм догматически	1	1
638	последующей жизни но вместе	1	1
639	бывает похож на мать	1	1
640	не может наконец мы	1	1
641	образов в один смешанный	1	1
642	на друга в более	1	1
643	эмоции аффекты и познание	1	1
644	возврат в инфантильный рай	1	1
645	в один смешанный введением	1	1
646	сначала дружной травле всего	1	1
647	последствия такие желания должны	1	1
648	характер и собственно с	1	1
649	попытались выяснить сколько-нибудь точно	1	1
650	браку на которые переносится	1	1
651	в материнском чреве носит	1	1
652	осязания облачившись в форму	1	1
653	где оно есть там	1	1
654	предоставлен чистому принципу наслаждения	1	1
655	компенсация за отказ от	1	1
656	быть ничего общего не	1	1
657	искусно замаскированные образами явного	1	1
658	и быть не может	1	1
659	истолковывающему анализу некоторых образований	1	1
660	т.е между организмом и	1	1
661	бы то ни было	2	1
662	соперником в этих влечениях	1	1
663	этом неизбежны прикосновения к	1	1
664	содержание оказывается замаскированным исполнением	1	1
665	органы еще не стали	1	1
666	бессознательная память о действительно	1	1
667	половой голод присуще ребенку	1	1
668	образы по-видимому случайные и	1	1
669	готовом очищенном виде оно	1	1
670	сна есть частичное повторение	1	1
671	их видения показывания или	1	1
672	все позволено и с	1	1
673	метод толкования снов и	1	1
674	управляют те же законы	1	1
675	травмы есть и начало	1	1
676	является его мать отношения	1	1
677	и есть та сила	1	1
678	ноги сгибаем шею т.е	1	1
679	жизни заимствуют свою психическую	1	1
680	это? увы на самом	1	1
681	сжигать трупы также знаменует	1	1
682	они служат отдушинами для	1	1
683	конец лечения воспроизводит травму	1	1
684	воображаемое она хочет приобщить	1	1
685	влечений позволяют частично изживать	1	1
686	чувства к матери и	1	1
687	во время сна есть	1	1
688	статуи с их скрюченными	1	1
689	невыясненной остается и позиция	1	1
690	основе их лежит смутная	1	1
691	фрейд понимает бессознательное перемещение	1	1
692	возможного влияния на последующую	1	1
693	чреве носит либидинозный характер	1	1
694	полагают что они совершили	1	1
695	преодолением на различных путях	1	1
696	инфантильное самодовление таким образом	1	1
697	считается самым ортодоксальным фрейдистом	1	1
698	ее подавленных энергий творчество	1	1
699	никогда не попытались выяснить	1	1
700	разыгрываем возврат в материнское	1	1
701	мать-земля сидячее положение покойника	1	1
702	формы погребения зарывание в	1	1
703	в систему бессознательного это	1	1
704	образ матери может сыграть	1	1
705	наша психика не знает	1	1
706	в пережитый рай внутриутробного	1	1
707	группы вытесненных психических образований	1	1
708	психологии что ими заложено	1	1
709	быть даже того минимума	1	1
710	с его галлюцинаторным удовлетворением	1	1
711	матери сексуализуя каждый акт	1	1
712	сновидения взятые обычно из	1	1
713	жизни но вместе с	1	1
714	предсознательное у порога которого	1	1
715	его ученики по-видимому в	1	1
716	она встречает сильное сопротивление	1	1
717	сознания рождается какой-то внутренний	1	1
718	отцу и отцовскому авторитету	1	1
719	физиологического анализа травмы рождения	1	1
720	организма влечет его к	1	1
721	организм если бы он	1	1
722	является по ранку не	1	1
723	сексуальное влечение характеризуется следующими	1	1
724	не пытается дать объективного	1	1
725	объекты вытесненного влечения очень	1	1
726	различения возможного и невозможного	1	1
727	только одною из эрогенных	1	1
728	возможного и невозможного полезного	1	1
729	иногда и первую эрекцию	1	1
730	называет цензурой цензура лежит	1	1
731	к матери сексуализуя каждый	1	1
732	не позволяет брать его	1	1
733	что они совершили коренную	1	1
734	присутствие хотя бы воображаемое	1	1
735	какую-нибудь хотя бы отдаленную	1	1
736	важный показатель где оно	1	1
737	него что такое пещера	1	1
738	объектом эротического влечения человека	1	1
739	в болезненных симптомах в	1	1
740	отто ранка даже пребывание	1	1
741	более позднее время начали	1	1
742	попыткам объективных методов так	1	1
743	должен освободиться от врача	1	1
744	все творчество таким образом	1	1
745	авторитету эдипов комплекс и	1	1
746	на которые переносится бессознательное	1	1
747	сопротивления компромиссные образования т.е	1	1
748	обмолвки описки и пр	1	1
749	введением прямо противоположных по	1	1
750	от аффектов страха и	1	1
751	и быстрого забвения снов	1	1
752	иным как изживанием и	1	1
753	принцип наслаждения с его	1	1
754	какие были в ходу	1	1
755	самым важным событием этой	1	1
756	фрейд ни фрейдисты никогда	1	1
757	полового удовлетворения непристойность рассчитана	1	1
758	не был связан принципом	1	1
759	тянется к матери сексуализуя	1	1
760	все характеристики рая и	1	1
761	при этом неизбежны прикосновения	1	1
762	в инфантильный рай с	1	1
763	сила которая в качестве	1	1
764	не стали организующим соматическим	1	1
765	вся культура и техника	1	1
766	эмоций и аффектов с	1	1
767	рассеяно по всему организму	1	1
768	психического и сознательного для	1	1
769	ведет непрерывную только иногда	1	1
770	на чувственную страсть и	1	1
771	отдаленную связь с вытесненным	1	1
772	нераздельному господству принципа наслаждения	1	1
773	образы сновидения взятые обычно	1	1
774	и входит в высшую	1	1
775	труда дифференцировать эту остальную	1	1
776	т.е явные образы сновидения	1	1
777	связанных с ними представлений	1	1
778	время начали цитировать еще	1	1
779	матери разрыва единства с	1	1
780	ясным какой громадный запас	1	1
781	отношение к интроспективному методу	1	1
782	рая и золотого века	1	1
783	пережитый рай внутриутробного состояния	1	1
784	и она служит в	1	1
785	культурное творчество является по	1	1
786	ее в одном в	1	1
787	в основе их лежит	1	1
788	был предоставлен чистому принципу	1	1
789	явного сновидения оказываются замещающими	1	1
790	мира замкнулась в себя	1	1
791	и собственно с акта	1	1
792	в этом убеждены но	1	1
793	звеньями той цепи по	1	1
794	связь с вытесненным представлением	1	1
795	комплекса перенося на них	1	1
796	может наконец мы критикуем	1	1
797	же тяги к внутриутробной	1	1
798	сил внутри организма показатель	1	1
799	зрения дальнейших ступеней развития	1	1
800	государству браку на которые	1	1
801	стороны формы так и	1	1
802	же заметим что она	1	1
803	образования т.е явные образы	1	1
804	процессом и органическим ощущением	1	1
805	принципа наслаждения присоединяется на	1	1
806	интерпретирующему истолковывающему анализу некоторых	1	1
807	лечения воспроизводит травму рождения	1	1
808	для накопления громадного запаса	1	1
809	головным не захватывающим самых	1	1
810	anus или анальная зона	1	1
811	образов разбираемого сна надо	1	1
812	представления чувства и желания	1	1
813	фрейд и брейер пользовались	1	1
814	или перевеса одной над	1	1
815	или агрессивным сексуальные остроты	1	1
816	самосохранение индивида эти две	1	1
817	фрейд ни разу не	1	1
818	ужас рождения древнейшие формы	1	1
819	брейер пользовались гипнозом полным	1	1
820	его мать отношения ребенка	1	1
821	к следующему первым объектом	1	1
822	связанных с ними разнообразных	1	1
823	смехом создать в смеющемся	1	1
824	вместе с ужасом рождается	1	1
825	там бесспорно есть и	1	1
826	проявлении своего исконного органического	1	1
827	свете сознания представляются чем-то	1	1
828	внешних раздражений и влияний	1	1
829	компромиссные образования т.е явные	1	1
830	чтобы пробиться к скрытым	1	1
831	психическом к сожалению ни	1	1
832	острот управляют те же	1	1
833	к сексуальному возбуждению это	1	1
834	uterus матери конец лечения	1	1
835	увы не давая себе	1	1
836	только не дать себя	1	1
837	смыслу образов перенесением эмоций	1	1
838	организма он ищет только	1	1
839	событие эдипова комплекса перенося	1	1
840	встречает сильное сопротивление нашего	1	1
