1	в то же время	8	4
2	не может претендовать на	1	3
3	с одной стороны и	1	2
4	анекдотического и притчевого начал	2	2
5	состоит в том что	1	2
6	молчаливой степи и вековых	1	1
7	внушить ему интеллектуальную тревогу	1	1
8	на облако саур-могила с	1	1
9	и видно что на	1	1
10	курганов есть другая жизнь	1	1
11	бахмут шел а с	1	1
12	замечали друг друга и	1	1
13	собственной жизнью даже позы	1	1
14	авантюрностью кладоискательских анекдотов но	1	1
15	ковыли дудачьи гнезда были	1	1
16	гусиная лапка расходится на	1	1
17	клады гнезда дроф эта	1	1
18	человеческого счастья именно ему	1	1
19	вековых курганов есть другая	1	1
20	даже позы в которых	1	1
21	нет дела до зарытого	1	1
22	анекдот конденсируется в остроту	1	1
23	было ему не нужно	1	1
24	есауловки на городище и	1	1
25	ему приходит в голову	1	1
26	фантастикой и авантюрностью кладоискательских	1	1
27	вот как старик начинает	1	1
28	видно что на этом	1	1
29	поры как царя александра	1	1
30	небо видны барские усадьбы	1	1
31	облако саур-могила с остроконечной	1	1
32	нужно и непонятно а	1	1
33	места где клады есть	1	1
34	степи и вековых курганов	1	1
35	как царя александра что	1	1
36	лежит на спине и	1	1
37	о широкой степи и	1	1
38	удача либо неудача и	1	1
39	в камне свистеть начнет	1	1
40	всего в том что	1	1
41	спине и глядит в	1	1
42	превратны человеческие судьбы то	1	1
43	счастья именно ему приходит	1	1
44	и точность словесного выражения	1	1
45	человека внушить ему интеллектуальную	1	1
46	универсальности видение жизни иной	1	1
47	в образе мыслящих овец	1	1
48	мы вместе ходили покойника	1	1
49	безграничной степи ни в	1	1
50	вместе ходили покойника царя	1	1
51	событиями но превратны человеческие	1	1
52	длительные тягучие вызываемые представлениями	1	1
53	счастье которое было ему	1	1
54	но уже следующей фразой	1	1
55	земное счастье людям которые	1	1
56	усадьбы хутора немцев и	1	1
57	их мысли длительные тягучие	1	1
58	с остроконечной верхушкой с	1	1
59	встречать а тогда большой	1	1
60	в крепости [...] под	1	1
61	что ни шаг то	1	1
62	железных дорог всеобъемлющий взгляд	1	1
63	которых читатель застает героев	1	1
64	той самой земле где	1	1
65	самой земле где схоронены	1	1
66	чем не было видно	1	1
67	земле где схоронены клады	1	1
68	далекая похожая на облако	1	1
69	и полное равнодушие к	1	1
70	всеобъемлемости и универсальности видение	1	1
71	и авантюрностью кладоискательских анекдотов	1	1
72	в чем не было	1	1
73	немцев и молокан деревни	1	1
74	жизнь которой нет дела	1	1
75	хутора немцев и молокан	1	1
76	счастье людям которые каждый	1	1
77	и того и другого	1	1
78	свистеть начнет вот как	1	1
79	и молокан деревни а	1	1
80	людям которые каждый день	1	1
81	французов гнал до парижа	1	1
82	ни в чем не	1	1
83	притчевого мировидения но уже	1	1
84	сказочность человеческого счастья именно	1	1
85	где клады есть в	1	1
86	а фантастичность и сказочность	1	1
87	детали к рассказу о	1	1
88	мыслящих овец их мысли	1	1
89	в паремию пословично-афористическую сентенцию	1	1
90	в ленивом полете этих	1	1
91	или где балка как	1	1
92	в безграничной степи ни	1	1
93	никакого отношения но из	1	1
94	подводах в москву везли	1	1
95	есть другая жизнь которой	1	1
96	до зарытого счастья и	1	1
97	своей собственной жизнью даже	1	1
98	[...] под тремя камнями	1	1
99	увидит даже город и	1	1
100	под тремя камнями или	1	1
101	о днях и ночах	1	1
102	перед наивной фантастикой и	1	1
103	были что ни шаг	1	1
104	только о широкой степи	1	1
105	ему не нужно и	1	1
106	жизнью даже позы в	1	1
107	пыльному подорожнику к той	1	1
108	остроконечной верхушкой с этой	1	1
109	вечности на низменное многообразие	1	1
110	но превратны человеческие судьбы	1	1
111	которое повторяется аккуратно каждые	1	1
112	свете кроме молчаливой степи	1	1
113	них жил своей собственной	1	1
114	наивной фантастикой и авантюрностью	1	1
115	ровная и безграничная как	1	1
116	рассказу о колдуне не	1	1
117	каждые сутки ни в	1	1
118	и универсальности видение жизни	1	1
119	аккуратно каждые сутки ни	1	1
120	друга и каждый из	1	1
121	с есауловки на городище	1	1
122	кульминация притчевого мировидения но	1	1
123	кульминация срывается только отсюда	1	1
124	где балка как гусиная	1	1
125	с этой вершины видна	1	1
126	степи и небе о	1	1
127	на подводах в москву	1	1
128	а с есауловки на	1	1
129	и угнетали их самих	1	1
130	сутки ни в безграничной	1	1
131	неподвижности и беззвучии чувствовались	1	1
132	камне свистеть начнет вот	1	1
133	большой шлях не на	1	1
134	к рассказу о колдуне	1	1
135	на бахмут шел а	1	1
136	диаметрально противоположные ориентации человека	1	1
137	на городище и там	1	1
138	пастух санька лежит на	1	1
139	а притча в паремию	1	1
140	городище и там где	1	1
141	а тогда большой шлях	1	1
142	сила так и в	1	1
143	произвол захочет нечистая сила	1	1
144	из них складывается мозаичная	1	1
145	взгляд с позиции возвышенного	1	1
146	себя в другом и	1	1
147	которое было ему не	1	1
148	на три балочки и	1	1
149	не имеют никакого отношения	1	1
150	равнина такая же ровная	1	1
151	мысль человека внушить ему	1	1
152	я его годов шестьдесят	1	1
153	из таганрога на подводах	1	1
154	богаты событиями но превратны	1	1
155	деревни а дальнозоркий калмык	1	1
156	в такой же мере	2	1
157	ни в утре которое	1	1
158	в москву везли мы	1	1
159	чему сдалось земное счастье	1	1
160	барские усадьбы хутора немцев	1	1
161	калмык увидит даже город	1	1
162	уже не замечали друг	1	1
163	как небо видны барские	1	1
164	ни в ленивом полете	1	1
165	дорог всеобъемлющий взгляд с	1	1
166	на низменное многообразие человеческой	1	1
167	и непонятно а фантастичность	1	1
168	зарытого счастья и овечьих	1	1
169	прежде всего в том	1	1
170	в которых читатель застает	1	1
171	ни шаг то гнездо	1	1
172	представлениями только о широкой	1	1
173	которой нет дела до	1	1
174	птиц ни в утре	1	1
175	этом свете кроме молчаливой	1	1
176	теперь ковыли дудачьи гнезда	1	1
177	мира полемически противостоит инертно	1	1
178	ночах вероятно поражали и	1	1
179	есть в крепости [...]	1	1
180	и поезда железных дорог	1	1
181	там где теперь ковыли	1	1
182	угнетали их самих до	1	1
183	необходимость решения вопроса жизни	1	1
184	и ночах вероятно поражали	1	1
185	что на этом свете	1	1
186	позы в которых читатель	1	1
187	покойника царя встречать а	1	1
188	жизни иной картины мира	1	1
189	саур-могила с остроконечной верхушкой	1	1
190	дудачьи гнезда были что	1	1
191	каждый из них жил	1	1
192	уже следующей фразой почти	1	1
193	динамичная чреватая анекдотическими ситуациями	1	1
194	образе мыслящих овец их	1	1
195	и в то же	1	1
196	как гусиная лапка расходится	1	1
197	начнет вот как старик	1	1
198	широкой степи и небе	1	1
199	здесь царят удача либо	1	1
200	другая жизнь которой нет	1	1
201	достигнутая кульминация срывается только	1	1
202	шестьдесят знаю с той	1	1
203	и произвол захочет нечистая	1	1
204	город и поезда железных	1	1
205	однообразия вечности на низменное	1	1
206	царя александра что французов	1	1
207	и там где теперь	1	1
208	ходили покойника царя встречать	1	1
209	полете этих долговечных птиц	1	1
210	тягучие вызываемые представлениями только	1	1
211	овец их мысли длительные	1	1
212	степи ни в чем	1	1
213	возвышенного однообразия вечности на	1	1
214	которые каждый день могут	1	1
215	знаю с той поры	1	1
216	картина мира полемически противостоит	1	1
217	не замечали друг друга	1	1
218	камнями или где балка	1	1
219	вероятно поражали и угнетали	1	1
220	на спине и глядит	1	1
221	и небе о днях	1	1
222	годов шестьдесят знаю с	1	1
223	лапка расходится на три	1	1
224	колдуне не имеют никакого	1	1
225	с той поры как	1	1
226	дела до зарытого счастья	1	1
227	поражали и угнетали их	1	1
228	видение жизни иной картины	1	1
229	повторяется аккуратно каждые сутки	1	1
230	гнезда были что ни	1	1
231	тогда большой шлях не	1	1
232	века и полное равнодушие	1	1
233	и вековых курганов есть	1	1
234	почти достигнутая кульминация срывается	1	1
235	всеобъемлющий взгляд с позиции	1	1
236	поезда железных дорог всеобъемлющий	1	1
237	счастья и овечьих мыслей	1	1
238	ему интеллектуальную тревогу за	1	1
239	чувствовались века и полное	1	1
240	и каждый из них	1	1
241	москву везли мы вместе	1	1
242	о колдуне не имеют	1	1
243	позиции возвышенного однообразия вечности	1	1
244	долговечных птиц ни в	1	1
245	чьей неподвижности и беззвучии	1	1
246	нечистая сила так и	1	1
247	интеллектуальную тревогу за необходимость	1	1
248	этих долговечных птиц ни	1	1
249	сдалось земное счастье людям	1	1
250	притчевое по своей всеобъемлемости	1	1
251	лицо обращено к пыльному	1	1
252	даже город и поезда	1	1
253	только отсюда и видно	1	1
254	его годов шестьдесят знаю	1	1
255	тремя камнями или где	1	1
256	шел а с есауловки	1	1
257	и беззвучии чувствовались века	1	1
258	жменю я его годов	1	1
259	эта динамичная чреватая анекдотическими	1	1
260	либо неудача и произвол	1	1
261	следующей фразой почти достигнутая	1	1
262	не нужно и непонятно	1	1
263	везли мы вместе ходили	1	1
264	на этом свете кроме	1	1
265	санька лежит на спине	1	1
266	центром притчевой картины мира	1	1
267	шаг то гнездо дудачье	1	1
268	знать притчевое по своей	1	1
269	не было видно смысла	1	1
270	и сказочность человеческого счастья	1	1
271	низменное многообразие человеческой жизни	1	1
272	таганрога на подводах в	1	1
273	к пыльному подорожнику к	1	1
274	молокан деревни а дальнозоркий	1	1
275	параллель в образе мыслящих	1	1
276	царя встречать а тогда	1	1
277	имеют никакого отношения но	1	1
278	и глядит в небо	1	1
279	в чьей неподвижности и	1	1
280	видна равнина такая же	1	1
281	отсюда и видно что	1	1
282	в утре которое повторяется	1	1
283	из них жил своей	1	1
284	своей всеобъемлемости и универсальности	1	1
285	обращено к пыльному подорожнику	1	1
286	к чему сдалось земное	1	1
287	небе о днях и	1	1
288	дальнозоркий калмык увидит даже	1	1
289	тревогу за необходимость решения	1	1
290	подорожнику к той самой	1	1
291	днях и ночах вероятно	1	1
292	гнезда дроф эта динамичная	1	1
293	царят удача либо неудача	1	1
294	фантастичность и сказочность человеческого	1	1
295	жил своей собственной жизнью	1	1
296	верхушкой с этой вершины	1	1
297	похожая на облако саур-могила	1	1
298	расходится на три балочки	1	1
299	мысли длительные тягучие вызываемые	1	1
300	видны барские усадьбы хутора	1	1
301	мировидения но уже следующей	1	1
302	беззвучии чувствовались века и	1	1
303	есть по сути дела	1	1
304	же ровная и безграничная	1	1
305	и безграничная как небо	1	1
306	шлях не на бахмут	1	1
307	а дальнозоркий калмык увидит	1	1
308	фразой почти достигнутая кульминация	1	1
309	что французов гнал из	1	1
310	безграничная как небо видны	1	1
311	и в камне свистеть	1	1
312	вершины видна равнина такая	1	1
313	полемически противостоит инертно закономерной	1	1
314	как старик начинает свой	1	1
315	но из них складывается	1	1
316	за необходимость решения вопроса	1	1
317	так и в камне	1	1
318	одних и тех же	1	1
319	друг друга и каждый	1	1
320	с позиции возвышенного однообразия	1	1
321	той поры как царя	1	1
322	активизировать мысль человека внушить	1	1
323	непонятно а фантастичность и	1	1
324	именно ему приходит в	1	1
325	полное равнодушие к человеку	1	1
326	неудача и произвол захочет	1	1
327	дроф эта динамичная чреватая	1	1
328	по своей всеобъемлемости и	1	1
329	такая же ровная и	1	1
330	лежит на животе его	1	1
331	александра что французов гнал	1	1
332	клады есть в крепости	1	1
333	пародийную параллель в образе	1	1
334	к той самой земле	1	1
335	французов гнал из таганрога	1	1
336	ни в безграничной степи	1	1
337	ленивом полете этих долговечных	1	1
338	я такой же как	1	1
339	их самих до бесчувствия	1	1
340	балка как гусиная лапка	1	1
341	вызываемые представлениями только о	1	1
342	противоположные ориентации человека в	1	1
343	этой вершины видна равнина	1	1
344	утре которое повторяется аккуратно	1	1
345	притча в паремию пословично-афористическую	1	1
346	кроме молчаливой степи и	1	1
347	гнал из таганрога на	1	1
348	где теперь ковыли дудачьи	1	1
349	крепости [...] под тремя	1	1
350	срывается только отсюда и	1	1
351	не на бахмут шел	1	1
352	захочет нечистая сила так	1	1
353	отношения но из них	1	1
