1	в то же время	1	8
2	все более и более	1	2
3	ни на кого не	1	2
4	чтобы убедиться в этом	1	2
5	нет и не может	1	2
6	но в то же	1	2
7	и пр и пр	1	2
8	как бы ни были	1	2
9	и не может быть	1	2
10	очень большое место в	1	1
11	и в том что	2	1
12	и до сих пор	1	1
13	в применении к литературе	1	1
14	сводится к тому чтобы	1	1
15	вполне понятно что при	1	1
16	с точки зрения этих	1	1
17	на самом же деле	3	1
18	до сих пор недостаточно	1	1
19	и ни на кого	1	1
20	и до настоящего времени	1	1
21	убедиться в этом достаточно	1	1
22	в том числе и	7	1
23	нужно сказать что и	1	1
