1	и т д и	1	6
2	не что иное как	2	6
3	д и т д	1	5
4	т д и т	1	5
5	в то время как	2	4
6	есть не что иное	2	3
7	по крайней мере в	1	3
8	то это значит что	1	3
9	ни в каком смысле	2	3
10	это значит что мы	1	3
11	ни в коем случае	3	3
12	в коем случае не	1	3
13	с этой точки зрения	1	2
14	и тем не менее	3	2
15	не говоря уже о	1	2
16	ничего не говорит о	1	2
17	если иметь в виду	1	2
18	только на то что	1	2
19	и в то же	1	1
20	в том смысле что	1	1
21	необходимо категорически утверждать что	1	1
22	или по крайней мере	2	1
23	это не значит что	1	1
24	в каком смысле не	2	1
25	так же как и	1	1
26	мы вовсе не имеем	1	1
27	не содержит в себе	1	1
28	уж во всяком случае	2	1
29	т е есть ничто	1	1
30	и уж тем более	1	1
31	и у меня в	1	1
32	не тем что оно	1	1
33	бы то ни было	1	1
34	мы имеем в виду	1	1
35	при помощи того или	1	1
36	это значит что его	1	1
37	тем не менее в	1	1
38	а это значит что	2	1
39	даже и не просто	1	1
40	несмотря ни на какую	1	1
41	не чем иным как	2	1
42	помощи того или иного	1	1
