1	одного и того же	1	6
2	в то время как	4	3
3	или по крайней мере	4	2
4	одно и то же	3	2
5	и то и другое	1	1
6	в том смысле что	3	1
7	с тем что мы	1	1
8	и т д и	4	1
9	дело в том что	2	1
10	само по себе не	1	1
11	даже и в таком	1	1
12	может быть не только	1	1
13	бы то ни было	3	1
14	не имеет ничего общего	3	1
15	тем не менее в	1	1
16	и т д можно	1	1
17	и как бы ни	1	1
18	бы она ни была	2	1
19	как бы она ни	2	1
20	имеет ничего общего с	1	1
21	и в таком случае	1	1
22	указывает нам на то	1	1
23	в том что он	1	1
24	мы до сих пор	1	1
