1	той мере в какой	2	4
2	не что иное как	1	4
3	в той мере в	2	4
4	с одной стороны и	3	3
5	только после того как	1	2
6	есть не что иное	1	2
7	заключается в том что	4	2
8	одной и той же	2	2
9	то же самое что	2	2
10	состоит в том что	3	2
11	для того чтобы понять	1	2
12	с этой точки зрения	4	1
13	совершенно то же самое	1	1
14	потому что в этом	1	1
15	о чем говорится в	3	1
16	в собственном смысле этого	3	1
17	ясность в этот вопрос	1	1
18	прийти к выводу что	1	1
19	в том что в	1	1
20	одно и то же	3	1
21	до тех пор пока	1	1
22	только в том что	1	1
23	именно в этом смысле	1	1
24	представляет собой движение от	1	1
25	одном и том же	1	1
26	в лучшем случае она	1	1
27	не может быть никакой	1	1
28	приводят к тому что	1	1
29	для того чтобы сделать	2	1
30	представление о том что	2	1
31	того что представляет собой	1	1
32	но вместе с тем	1	1
33	возможно только потому что	1	1
34	по отношению к отдельным	1	1
35	точно так же как	2	1
36	в том что если	1	1
37	сомнений в том что	1	1
38	находящим свое выражение в	1	1
39	все же в них	1	1
40	же самое что и	1	1
41	в гораздо большей мере	1	1
42	собственном смысле этого слова	3	1
