1	до тех пор пока	1	2
2	одной и той же	2	2
3	то же самое что	2	2
4	ни одно из этих	1	2
5	друг с другом и	1	2
6	в то время как	2	2
7	заключается в том что	4	2
8	совершенно невозможно потому что	1	1
9	у нас на глазах	1	1
10	с этой точки зрения	4	1
11	при помощи одних только	1	1
12	так же как и	1	1
13	мы вправе сделать вывод	1	1
14	точно так же как	2	1
15	суть дела заключается в	1	1
16	ни в какой мере	2	1
17	если мы обратимся к	1	1
18	в том что он	2	1
19	как и всякий другой	1	1
20	не станем останавливаться на	1	1
21	сомнения в том что	1	1
22	для того чтобы сделать	2	1
23	до сих пор в	1	1
24	в том и другом	2	1
25	как мы уже говорили	1	1
26	мы не станем останавливаться	1	1
27	и вместе с тем	2	1
28	не что иное как	1	1
29	в том что они	1	1
30	том что он не	1	1
31	в самом деле если	1	1
32	в одной и той	1	1
33	привело к тому что	1	1
