1	заключается в том что	4	6
2	так же как и	1	4
3	в то время как	1	4
4	одного и того же	2	4
5	мы могли бы сказать	2	3
6	могли бы сказать что	2	3
7	состоит в том что	2	3
8	с этой точки зрения	1	2
9	в собственном смысле слова	1	2
10	одной и той же	2	2
11	в силу того что	1	2
12	в том виде как	1	2
13	согласны в том что	1	2
14	из того что мы	1	1
15	по своему психологическому значению	1	1
16	том виде как она	1	1
17	не в состоянии объяснить	2	1
18	тот факт что в	1	1
19	что в основе его	1	1
20	что обе эти тенденции	1	1
21	с самого начала в	1	1
22	в состоянии объяснить нам	1	1
23	вперед по сравнению с	1	1
24	в том что в	1	1
25	только потому что оно	1	1
26	в совершенно ином виде	1	1
27	в том что с	1	1
28	можно было бы формулировать	1	1
29	заключается в том чтобы	1	1
30	с другой стороны он	1	1
31	вместе с тем мы	1	1
32	эта особенность состоит в	1	1
33	приводит к тому что	1	1
34	шаг вперед по сравнению	1	1
35	мы видим таким образом	1	1
36	вполне совпадает с тем	1	1
37	не что иное как	2	1
38	видим таким образом что	1	1
39	сам по себе как	1	1
40	с одной стороны он	1	1
41	если принять во внимание	1	1
42	в конце концов к	1	1
43	одним и тем же	3	1
44	это вполне совпадает с	1	1
45	указывает на то что	2	1
46	выступает на первый план	1	1
47	принять во внимание что	1	1
48	как раз обратным образом	1	1
49	противоречие заключается в том	1	1
50	особенность состоит в том	1	1
