1	в то же время	6	6
2	одного и того же	3	5
3	и в то же	2	4
4	одно и то же	3	3
5	в том числе и	2	2
6	но и прежде всего	1	1
7	осмысленном и конкретном целом	1	1
8	не было и не	1	1
9	место слияние пространственных и	1	1
10	человека с самим собою	1	1
11	и не могло быть	2	1
12	как раз в том	1	1
13	в той или иной	2	1
14	хронотопе имеет место слияние	1	1
15	было и не могло	1	1
16	имеет место слияние пространственных	1	1
17	то же время оно	1	1
18	слияние пространственных и временных	1	1
19	одном и том же	1	1
20	примет в осмысленном и	1	1
21	мы имеем в виду	1	1
22	пространственных и временных примет	1	1
23	в осмысленном и конкретном	1	1
24	в одном и том	1	1
25	и временных примет в	1	1
26	временных примет в осмысленном	1	1
27	включает в себя и	1	1
28	с самим собою в	1	1
