1	и тем не менее	1	3
2	в том случае когда	1	3
3	в самом деле ведь	1	1
4	что бы то ни	2	1
5	же при таких условиях	1	1
6	обращает на себя внимание	2	1
7	не принимая во внимание	1	1
8	сам по себе уже	1	1
9	не с точки зрения	1	1
10	на которых он мог	1	1
11	мы должны сказать что	1	1
12	и вместе с тем	2	1
13	с этой точки зрения	1	1
14	и в то же	2	1
15	только в том случае	3	1
16	во что бы то	2	1
17	эта заключается в том	1	1
18	заключается в том что	1	1
19	в то же время	2	1
20	не выходит за пределы	1	1
21	а с другой стороны	2	1
22	бы то ни стало	2	1
23	которых он мог бы	1	1
