1	в то же время	2	5
2	состоит в том что	4	4
3	одно и то же	1	3
4	приводит к тому что	1	2
5	барышня с кротким мягким	1	1
6	ритм является фундаментом всей	1	1
7	самая тривиальная в общеязыковом	1	1
8	анакрусы и ритмические концовки	1	1
9	стилистике здесь также может	1	1
10	средств осуществление которой определенным	1	1
11	более или менее насыщенный	1	1
12	читаем это была тихая	1	1
13	ритм представляет собой речевую	1	1
14	произведения обнаруживается еще один	1	1
15	к паузам ударения начальные	1	1
16	фраза текста даже самая	1	1
17	числом слогов между двумя	1	1
18	субъектной организации художественного произведения	2	1
19	мы имеем дело не	1	1
20	осмысленном и конкретном целом	1	1
21	глоссами как именовал аристотель	1	1
22	отрезок времени в поле	1	1
23	этой субсистемы художественных значимостей	1	1
24	при этом синтаксических конструкций	1	1
25	верха низа левого правого	1	1
26	душевная характеристика душечки постепенно	1	1
27	выбора лингвистических средств осуществление	1	1
28	внутреннего исполнения как упорядоченная	1	1
29	на мягкую белую шею	1	1
30	что может или пожелает	1	1
31	внешнего внутреннего центра периферии	1	1
32	на основе весьма простых	1	1
33	жалостливая барышня с кротким	1	1
34	тихая добродушная жалостливая барышня	1	1
35	момент нечто движущееся изменчивое	1	1
36	состоит в соотносительности слов	1	1
37	рода стилистике здесь также	1	1
38	задаваемый читателю ракурс видения	1	1
39	автором в кадры повествования	1	1
40	факторов художественного впечатления он	1	1
41	по отношению к иного	1	1
42	к иного рода стилистике	1	1
43	розовые щеки на мягкую	1	1
44	мягкую белую шею с	1	1
45	прозе ближайшие к паузам	1	1
46	говорящего иначе говоря помимо	1	1
47	тривиальная в общеязыковом отношении	1	1
48	ударения начальные и заключительные	1	1
49	с этой точки зрения	1	1
50	стилистико-речевую определенность собственный голос	1	1
51	как чередование напряжений и	1	1
52	таков что душевная характеристика	1	1
53	речевых движений текста наиболее	1	1
54	отношении ибо и в	1	1
55	объектных деталей а также	1	1
56	композиционных субъектов высказывания с	1	1
57	текста наиболее значимы при	1	1
58	организации художественного произведения обнаруживается	1	1
59	том под каким диалогическим	1	1
60	систему голосов нормативная литературная	1	1
61	кротким мягким взглядом очень	1	1
62	состав такого кадра входит	1	1
63	принципом упорядоченного движения бенвенист	1	1
64	фразы выбор синтаксической конструкции	1	1
65	синтаксических конструкций с субъектом	1	1
66	составе столько голосов сколько	1	1
67	есть не что иное	1	1
68	ударных слогов относительно длины	1	1
69	и больше нежели число	1	1
70	упорядоченного движения бенвенист ритм	1	1
71	читателя находится или движется	1	1
72	бенвенист ритм является фундаментом	1	1
73	характеристиками глоссами как именовал	1	1
74	в этих случаях оказывается	1	1
75	щеки на мягкую белую	1	1
76	мягким взглядом очень здоровая	1	1
77	облекается в данный момент	1	1
78	не тот кто говорит	1	1
79	в которую облекается в	1	1
80	ритмические зачины анакрусы и	1	1
81	и быстрых движений бенвенист	1	1
82	соотнесенности внешнего внутреннего центра	1	1
83	тексту слой факторов художественного	1	1
84	самом начале этой цепочки	1	1
85	каким диалогическим углом они	1	1
86	возможность выбора лингвистических средств	1	1
87	речи последний получает вследствие	1	1
88	в том или ином	2	1
89	даже самая тривиальная в	1	1
90	левого правого далекого близкого	1	1
91	наиболее значимы при этом	1	1
92	кадра входит лишь поименованное	1	1
93	как более или менее	1	1
94	м.м бахтин дело не	1	1
95	нормативов актуальных для данного	1	1
96	в ходе чтения в	1	1
97	в данный момент нечто	1	1
98	нормативная литературная речь выступая	1	1
99	плотность акцентуации количество ударных	1	1
100	наличии определенных языковых стилей	1	1
101	рядов измеряемой числом слогов	1	1
102	один равнопротяженный тексту слой	1	1
103	нечто движущееся изменчивое текучее	1	1
104	как это ни парадоксально	1	1
105	а не все что	1	1
106	последний получает вследствие этой	1	1
107	представляет собой речевую генерализацию	1	1
108	ритмические концовки клаузулы и	1	1
109	движется один отдельный кадр	1	1
110	генерализацию текста поскольку подводит	1	1
111	может быть актуализировано на	1	1
112	формирующие тем самым интонационные	1	1
113	он состоит в соотносительности	1	1
114	будучи принципом упорядоченного движения	1	1
115	каждый малый отрезок времени	1	1
116	и ритмические концовки клаузулы	1	1
117	периферии верха низа левого	1	1
118	внутреннего центра периферии верха	1	1
119	самом наличии определенных языковых	1	1
120	ритмика интонирует всю субъектную	1	1
121	ближайшие к паузам ударения	1	1
122	слов избранных для обозначения	1	1
123	тексте а не все	1	1
124	общеязыковом отношении художественному восприятию	1	1
125	представленных в тексте может	1	1
126	в ритмическом ряду образующие	1	1
127	очень здоровая порядок фокусирующих	1	1
128	движений текста наиболее значимы	1	1
129	подводит некий общий знаменатель	1	1
130	быстрых движений бенвенист ритм	1	1
131	имеет место слияние пространственных	1	1
132	добродушная жалостливая барышня с	1	1
133	клаузулы и формирующие тем	1	1
134	которую облекается в данный	1	1
135	ее взаимоналожениях и взаимодействиях	1	1
136	а выбор слова б	1	1
137	и спадов бенвенист ритм	1	1
138	кадрового единства фразы устанавливает	1	1
139	количество ударных слогов относительно	1	1
140	шею с темной родинкой	1	1
141	двумя паузами как чередование	1	1
142	литературная речь выступая под	1	1
143	художественного произведения обнаруживается еще	1	1
144	а в том под	1	1
145	в рамках одного текста	1	1
146	ряда тем выше напряжение	1	1
147	концовки клаузулы и формирующие	1	1
148	кадры повествования а читателем	1	1
149	поскольку подводит некий общий	1	1
150	текста между несколькими голосами	1	1
151	низа левого правого далекого	1	1
152	это была тихая добродушная	1	1
153	число композиционных субъектов высказывания	1	1
154	в кадры читательского восприятия	1	1
155	заключается в том что	1	1
156	восприятию задана как более	1	1
157	крайними пределами этой субсистемы	1	1
158	слой факторов художественного впечатления	1	1
159	т.п глоссализация текста делает	1	1
160	в общеязыковом отношении художественному	1	1
161	в каждый малый отрезок	1	1
162	глоссализации имеет в своем	1	1
163	определений таков что душевная	1	1
164	характеристика душечки постепенно углубляемая	1	1
165	интонирует всю субъектную организацию	1	1
166	лишь в самом начале	1	1
167	меньше и больше нежели	1	1
168	в ее взаимоналожениях и	1	1
169	под все прочие его	1	1
170	жизненных позиций может быть	1	1
171	конструкций с субъектом речи	1	1
172	слияние пространственных и временных	1	1
173	чем выше плотность акцентуации	1	1
174	такого кадра входит лишь	1	1
175	ценностного центра этого мира	1	1
176	звучания ритмика интонирует всю	1	1
177	слова б построение фразы	1	1
178	лингвистических средств осуществление которой	1	1
179	времени высказывания и соответственно	1	1
180	чтения в кадры читательского	1	1
181	последовательно вводятся автором в	1	1
182	весьма простых текстовых показателей	1	1
183	субъектную организацию литературного произведения	1	1
184	движения бенвенист ритм является	1	1
185	его читательского внутреннего исполнения	1	1
186	столько голосов сколько диалогически	1	1
187	построение фразы выбор синтаксической	1	1
188	упорядоченная последовательность медленных и	1	1
189	являются наиболее генерализованные кругозоры	1	1
190	распределенности текста между несколькими	1	1
191	социальных диалектов а в	1	1
192	длиной ритмических рядов измеряемой	1	1
193	тем самым интонационные оттенки	1	1
194	может приобретать статус самостоятельного	1	1
195	между двумя паузами как	1	1
196	диалектов а в том	1	1
197	вокруг я героя как	1	1
198	в осмысленном и конкретном	1	1
199	пожелает представить себе читатель	1	1
200	языковых стилей социальных диалектов	1	1
201	форму в которую облекается	1	1
202	поименованное в тексте а	1	1
203	или менее насыщенный деталями	1	1
204	архаизмы варваризмы неологизмы и	1	1
205	насыщенный деталями кадр внутреннего	1	1
206	читателю ракурс видения в	1	1
207	отношению к иного рода	1	1
208	лишь поименованное в тексте	1	1
209	пределах тех или иных	1	1
210	для обозначения объектных деталей	1	1
211	в самом начале этой	1	1
212	всю субъектную организацию литературного	1	1
213	пределами этой субсистемы художественных	1	1
214	поле зрения читателя находится	1	1
215	осуществление которой определенным образом	1	1
216	бы место лишь в	1	1
217	темной родинкой и т.д	1	1
218	показателей а выбор слова	1	1
219	делает его речевой строй	1	1
220	вдруг заслоняется крупным планом	1	1
221	голосов нормативная литературная речь	1	1
222	длины ритмического ряда тем	1	1
223	ритмическом ряду образующие ритмические	1	1
224	при этом особенно если	1	1
225	своем составе столько голосов	1	1
226	глоссализация текста делает его	1	1
227	в пределах тех или	1	1
228	пределах кадрового единства фразы	1	1
229	и формирующие тем самым	1	1
230	слогов относительно длины ритмического	1	1
231	ритмических рядов измеряемой числом	1	1
232	еще один равнопротяженный тексту	1	1
233	соотносительности стилистико-речевую определенность собственный	1	1
234	не в самом наличии	1	1
235	их создает эффект распределенности	1	1
236	примет в осмысленном и	1	1
237	тех или иных языковых	1	1
238	определенным образом характеризует говорящего	1	1
239	или иных языковых нормативов	1	1
240	с субъектом речи последний	1	1
241	субъектом речи последний получает	1	1
242	фундаментом всей субъектной организации	1	1
243	белую шею с темной	1	1
244	обнаруживается еще один равнопротяженный	1	1
245	бахтин дело не в	1	1
246	зрения читателя находится или	1	1
247	фразы устанавливает задаваемый читателю	1	1
248	значимы при этом особенно	1	1
249	которой определенным образом характеризует	1	1
250	создает эффект распределенности текста	1	1
251	тем выше напряжение речевых	1	1
252	души вдруг заслоняется крупным	1	1
253	имеется некоторая возможность выбора	1	1
254	несколькими голосами то ритм	1	1
255	казалось бы место лишь	1	1
256	б построение фразы выбор	1	1
257	напряжений и спадов бенвенист	1	1
258	может или пожелает представить	1	1
259	деталей а также употребленных	1	1
260	паузам ударения начальные и	1	1
261	или пожелает представить себе	1	1
262	организацию литературного произведения в	1	1
263	приобретать статус самостоятельного голоса	1	1
264	относительно длины ритмического ряда	1	1
265	стилей социальных диалектов а	1	1
266	зачины анакрусы и ритмические	1	1
267	соразмерных отрезков звучания ритмика	1	1
268	ритмического ряда тем выше	1	1
269	своего рода субъектной детализации	1	1
270	малый отрезок времени в	1	1
271	слогов между двумя паузами	3	1
272	ее полные розовые щеки	1	1
273	была тихая добродушная жалостливая	1	1
274	этом синтаксических конструкций с	1	1
275	впечатления он состоит в	1	1
276	обозначает ту форму в	1	1
277	центра периферии верха низа	1	1
278	времени в поле зрения	1	1
279	голосами то ритм представляет	1	1
280	в стилистическом отношении ибо	1	1
281	некоторая возможность выбора лингвистических	1	1
282	последовательность медленных и быстрых	1	1
283	как упорядоченная последовательность медленных	1	1
284	здесь также может приобретать	1	1
285	в соотносительности слов избранных	1	1
286	и слово литературной нормы	1	1
287	между несколькими голосами то	1	1
288	варваризмы неологизмы и т.п	1	1
289	основе весьма простых текстовых	1	1
290	как подчеркивал м.м бахтин	1	1
291	подчеркивал м.м бахтин дело	1	1
292	они сопоставлены или противопоставлены	1	1
293	или противопоставлены в произведении	1	1
294	углом они сопоставлены или	1	1
295	медленных и быстрых движений	1	1
296	особенно если говорить о	1	1
297	пространственных и временных примет	1	1
298	восприятия в каждый малый	1	1
299	говорить о прозе ближайшие	1	1
300	деталями кадр внутреннего зрения	1	1
301	иных языковых нормативов актуальных	1	1
302	языковых нормативов актуальных для	1	1
303	собой речевую генерализацию текста	1	1
304	в исходном своем значении	1	1
305	мира вокруг я героя	1	1
306	а читателем в ходе	1	1
307	определенным диалогическим углом по	1	1
308	самым интонационные оттенки ритма	1	1
309	на ее полные розовые	1	1
310	в субъектной организации художественного	1	1
311	углом по отношению к	1	1
312	повествования а читателем в	1	1
313	также употребленных при этом	1	1
314	если говорить о прозе	1	1
315	детализирует их создает эффект	1	1
316	все прочие его конструктивные	1	1
317	в рассказе чехова душечка	1	1
318	употребленных при этом синтаксических	1	1
319	простых текстовых показателей а	1	1
320	заслоняется крупным планом заключительного	1	1
321	текста даже самая тривиальная	1	1
322	в том под каким	1	1
323	и т.п глоссализация текста	1	1
324	число голосов представленных в	1	1
325	текста делает его речевой	1	1
326	всякая фраза текста даже	1	1
327	акцентуации количество ударных слогов	1	1
328	диалогическим углом они сопоставлены	1	1
329	место лишь в самом	1	1
330	стилистическом отношении ибо и	1	1
331	средней длине ритмического ряда	2	1
332	с темной родинкой и	1	1
333	художественному восприятию задана как	1	1
334	в поле зрения читателя	2	1
335	в своего рода субъектной	1	1
336	наше читательское внимание не	1	1
337	всегда имеется некоторая возможность	1	1
338	с кротким мягким взглядом	1	1
339	голосов представленных в тексте	1	1
340	отрезков звучания ритмика интонирует	1	1
341	той или иной эстетической	1	1
342	данный момент нечто движущееся	1	1
343	читательского восприятия в каждый	1	1
344	некую систему голосов нормативная	1	1
345	субъекта объекта и адресата	2	1
346	текста поскольку подводит некий	1	1
347	деталей в пределах кадрового	1	1
348	взаимодействиях с объектной организацией	1	1
349	креативного и рецептивного сознаний	1	1
350	художественного впечатления он состоит	1	1
351	чередование напряжений и спадов	1	1
352	образом характеризует говорящего иначе	1	1
353	а также употребленных при	1	1
354	выше напряжение речевых движений	1	1
355	заключительные в ритмическом ряду	1	1
356	не все что может	1	1
357	восприятие определений таков что	1	1
358	взглядом очень здоровая порядок	1	1
359	выше плотность акцентуации количество	1	1
360	не что иное как	1	1
361	речь выступая под определенным	1	1
362	нейтральной в стилистическом отношении	1	1
363	начальные и заключительные в	1	1
364	также может приобретать статус	1	1
365	под каким диалогическим углом	1	1
366	глядя на ее полные	1	1
367	выбор слова б построение	1	1
368	голосов сколько диалогически соотнесенных	1	1
369	в пределах кадрового единства	1	1
370	текста так же точно	1	1
371	имеет в своем составе	1	1
372	задана как более или	1	1
373	этом особенно если говорить	1	1
374	и временных примет в	1	1
375	далекого близкого замкнутого разомкнутого	1	1
376	полные розовые щеки на	1	1
377	или движется один отдельный	1	1
378	получает вследствие этой соотносительности	1	1
379	как ценностного центра этого	1	1
380	конструктивные членения и размежевания	1	1
381	образующие ритмические зачины анакрусы	1	1
382	субъектная организация литературного произведения	1	1
383	актуализировано на основе весьма	1	1
384	временных примет в осмысленном	1	1
385	равнопротяженный тексту слой факторов	1	1
386	что душевная характеристика душечки	1	1
387	то ритм представляет собой	1	1
388	своем значении греческое слово	1	1
389	длиной ритмического ряда и	1	1
390	о прозе ближайшие к	1	1
391	быть актуализировано на основе	1	1
392	избранных для обозначения объектных	1	1
393	выступая под определенным диалогическим	1	1
394	произведения в ее взаимоналожениях	1	1
