1	в то же время	7	7
2	какого бы то ни	1	2
3	бы то ни было	4	2
4	в том числе и	1	2
5	между людьми определенным образом	1	1
6	и восприятия во-вторых произведение	1	1
7	реального осуществления как исполняемое	1	1
8	окружающей его действительности в	1	1
9	людьми определенным образом организованными	1	1
10	входит в жизнь и	1	1
11	сторонами окружающей его действительности	1	1
12	определенное время в определенном	1	1
13	различными сторонами окружающей его	1	1
14	слышимое читаемое в определенное	1	1
15	в первом направлении ориентации	1	1
16	процессе своего реального осуществления	1	1
17	и соприкасается с различными	1	1
18	в жизнь и соприкасается	1	1
19	ориентации произведение входит в	1	1
20	так сказать изнутри своим	1	1
21	определенном месте при определенных	1	1
22	направлении ориентации произведение входит	1	1
23	в жизни так сказать	1	1
24	и в реальное время	1	1
25	во-первых на слушателей и	1	1
26	как исполняемое слышимое читаемое	1	1
27	реальное пространство и в	1	1
28	условия исполнения и восприятия	1	1
29	одних и тех же	1	1
30	на слушателей и воспринимающих	1	1
31	и на определенные условия	1	1
32	его действительности в процессе	1	1
33	изнутри своим тематическим содержанием	1	1
34	произведение ориентировано в жизни	1	1
35	ориентировано во-первых на слушателей	1	1
36	в определенном месте при	1	1
37	в определенное время в	1	1
38	в реальное пространство и	1	1
39	исполнения и восприятия во-вторых	1	1
40	соприкасается с различными сторонами	1	1
41	во-вторых произведение ориентировано в	1	1
42	с различными сторонами окружающей	1	1
43	с этой точки зрения	1	1
44	произведение входит в реальное	1	1
45	и тем не менее	1	1
46	воспринимающих и на определенные	1	1
47	ориентировано в жизни так	1	1
48	читаемое в определенное время	1	1
49	и воспринимающих и на	1	1
50	сказать изнутри своим тематическим	1	1
51	на определенные условия исполнения	1	1
52	жизнь и соприкасается с	1	1
53	восприятия во-вторых произведение ориентировано	1	1
54	действительности в процессе своего	1	1
55	месте при определенных обстоятельствах	1	1
56	в каждый данный момент	1	1
57	первом направлении ориентации произведение	1	1
58	время в определенном месте	1	1
59	исполняемое слышимое читаемое в	1	1
60	пространство и в реальное	1	1
61	определенные условия исполнения и	1	1
62	осуществления как исполняемое слышимое	1	1
63	расположено между людьми определенным	1	1
64	своего реального осуществления как	1	1
65	в процессе своего реального	1	1
66	жизни так сказать изнутри	1	1
67	входит в реальное пространство	1	1
68	слушателей и воспринимающих и	1	1
