1	состоит в том что	3	4
2	одно и то же	3	3
3	приводит к тому что	2	2
4	той мере в какой	2	1
5	с этой точки зрения	4	1
6	есть не что иное	1	1
7	природу каждой из них	1	1
8	не содержит в себе	1	1
9	точно так же как	2	1
10	состоит как раз в	1	1
11	заключается в том что	4	1
12	одном и том же	1	1
13	отличием внутренней речи от	1	1
14	во всей своей полноте	1	1
15	в том что он	2	1
16	не что иное как	1	1
17	в том что она	2	1
18	в том числе и	1	1
19	речи для себя и	2	1
20	том что он не	1	1
21	внутренней речи от внешней	1	1
22	в той мере в	2	1
