N	4gram	Tiupa_Hudo_2	Narrotol
466	тайны так и н	1	1
467	уже начиналась новая нервная	1	1
468	представляет собой один из	1	1
469	любит ли он кого-нибудь	1	1
470	задергал нижней губой замигал	1	1
471	это все те же	1	1
472	себе и к миру	1	1
473	и читателя чему способствует	1	1
474	ролевой характерности ее индивидуальность	1	1
475	мыслей и в сердце	1	1
476	в сердце у нее	1	1
477	заговорить желая улыбнуться он	1	1
478	которого архиерей долго не	1	1
479	личности марьи васильевны к	1	1
480	если бы она влюбилась	1	1
481	светилось [...] в рыжих	1	1
482	желая разгадать что это	1	1
483	с сисоем легко постольку	1	1
484	важный для подтекстовой символики	1	1
485	своей непосредственностью катя напоминает	1	1
486	ее положении какой бы	1	1
487	как будто он прямо	1	1
488	слушая его трудно было	1	1
489	бы как-то реализовать внутренний	1	1
490	подумал никитин и откуда	1	1
491	у рака у кати	1	1
492	ознаменовано фразой началось сердцебиение	1	1
493	все что можно сказать	1	1
494	рассказываемой жизни и субъективно-личностной	1	1
495	становятся большими только увидев	1	1
496	драматическое напряжение между уйти	1	1
497	каждой могиле чувствуется присутствие	1	1
498	и треск ракет доносившиеся	1	1
499	тенденция ширящегося разрастающегося набирающего	1	1
500	уж пронюхали подлецы подумал	1	1
501	самому было непонятно почему	1	1
502	глазах о любви о	1	1
503	мучает героя живущего как	1	1
504	никогда не актуальна в	1	1
505	и о которой он	1	1
506	комнаты можно было догадаться	1	1
507	видит в нем своего	1	1
508	потенциал ее подавленного я	1	1
509	с ним девочка тотчас	1	1
510	кто видит в герое	1	1
511	страстям господним обращенной к	1	1
512	беспокойно биться сердце когда	1	1
513	неодетых женщин и детей	1	1
514	взгляде только по необыкновенно	1	1
515	мысли о детях о	1	1
516	внутренний потенциал ее подавленного	1	1
517	нем своего страждущего сына	1	1
518	об экзамене о стороже	1	1
519	что перед нею архиерей	1	1
520	было догадаться что это	1	1
521	время смотрело весеннее солнышко	1	1
522	рамки своей повествовательной функции	1	1
523	слове и жесте а	1	1
524	теплая изящная полная любви	1	1
525	силу конформизма которая мучает	1	1
526	тем ей хотелось думать	1	1
527	она думала о своих	1	1
528	архиерей и видит в	1	1
529	читателя оказывается противопоставленной забвению	1	1
530	препятствует личностному сближению девочка	1	1
531	катю непонимание смерти только	1	1
532	для подтекстовой символики рассказа	1	1
533	марии тимофеевны никогда не	1	1
534	не вовлекается в это	1	1
535	личностности чеховского человека есть	1	1
536	она любила своего папашу	1	1
537	смотрело весеннее солнышко и	1	1
538	олицетворяет ту безликую силу	1	1
539	здешних порядках тогда как	1	1
540	тревожно билось сердце сердцебиение	1	1
541	обеда в окна со	1	1
542	двора все время смотрело	1	1
543	темные улицы одна за	1	1
544	н сухих формулирует главную	1	1
545	нижней губой замигал глазами	1	1
546	весеннее солнышко и весело	1	1
547	павлушу которого в будущем	1	1
548	контакт поговорить с ним	1	1
549	у читателя самостоятельного отношения	1	1
550	к ней в других	1	1
551	веселье радость в этих	1	1
552	входит без церемонии не	1	1
553	иных моментах рассказа приобретает	1	1
554	вслед за этим рассказчик	1	1
555	глагольных времен старуха которая	1	1
556	николаша говоришь мертвецов режет?	1	1
557	глаза марии тимофеевна забывает	1	1
558	умирающего неподвижного героя словно	1	1
559	произнесенную за столом архиерей	1	1
560	этом и уже давно	1	1
561	пепел одинокого накопительства то	1	1
562	провинциальной учительницы который она	1	1
563	казалось что это все	1	1
564	стерлось в памяти время	1	1
565	в любви начинается так	1	1
566	характер интерсубъективной духовной реальности	1	1
567	жизни видит особенный мир	1	1
568	жизнь находился при архиереях	1	1
569	вопроса а как же	1	1
570	овнешненность исчерпанность персонажа инерцией	1	1
571	его дядечка и голубчик	1	1
572	можно было догадаться что	1	1
573	контакта исключает не случайно	1	1
574	возможность такого контакта исключает	1	1
575	что это была мать	1	1
576	себе но и нетерпимого	1	1
577	на своего дядю преосвященного	1	1
578	повествование изначально пронизано скрытым	1	1
579	в ладу с покоем	1	1
580	ним происходит смерть постижима	1	1
581	нею впервые будто и	1	1
582	своей информативной безликостью вполне	1	1
583	как же обстоит дело	1	1
584	люди без тайны так	1	1
585	памятью о своем личном	1	1
586	данностью рассказываемой жизни и	1	1
587	торгам он входит без	1	1
588	позволяет ощутить живую сокровенную	1	1
589	нее обращен столь важный	1	1
590	те же будут каждый	1	1
591	приобретает характер интерсубъективной духовной	1	1
592	читателю задать себе подобный	1	1
593	обращенной к страдающему и	1	1
594	чеховского человека есть мера	1	1
595	филолог но служит в	1	1
596	прошлое ее настоящее и	1	1
597	есть мера напряжения между	1	1
598	фрагменте о марии тимофеевне	1	1
599	которая мучает героя живущего	1	1
600	они все те же	1	1
601	за этим рассказчик разворачивает	1	1
602	такою радостью но героиня	1	1
603	учительницы который она собой	1	1
604	объяснения в любви начинается	1	1
605	он прямо родился монахом	1	1
606	во время обеда в	1	1
607	нами одно из тончайших	1	1
608	о герое прежде чем	1	1
609	просто человека мария тимофеевна	1	1
610	девочка же пока еще	1	1
611	их где уж куда	1	1
612	с покоем и личным	1	1
613	в окна со двора	1	1
614	богослужения рядом деталей именем	1	1
615	те же люди что	1	1
616	и весело светилось [...]	1	1
617	ваше преосвященство называет его	1	1
618	ту безликую силу конформизма	1	1
619	и теперь я беру	1	1
620	ним было легко хотя	1	1
621	личности в непосредственности ее	1	1
622	в разговоре с ним	1	1
623	хотелось думать о красивых	1	1
624	после неудачного объяснения в	1	1
625	в глазах лицо и	1	1
626	на кладбище он первый	1	1
627	непосредственности ее я смерть	1	1
628	в других на противоположном	1	1
629	что у нее тревожно	1	1
630	символики рассказа свет во	1	1
631	нее была такая же	1	1
632	который не принимает участия	1	1
633	любви ласк веселья раздолья	1	1
634	личную тайну настолько что	1	1
635	бродят новые какие-то особенные	1	1
636	инобытия не в слове	1	1
637	которого в будущем ждал	1	1
638	этих и иных моментах	1	1
639	глаза становятся большими только	1	1
640	взгляду который она мельком	1	1
641	душ и потому-то с	1	1
642	видевшая в театре самое	1	1
643	ним о делах о	1	1
644	он монах да и	1	1
645	сисоя они сердитые выпуклые	1	1
646	в ответ сиди смирно	1	1
647	поэтому катя оказывается единственной	1	1
648	но и нетерпимого к	1	1
649	полная овнешненность исчерпанность персонажа	1	1
650	все его тело уменьшаются	1	1
651	неподвижного героя словно концентрируется	1	1
652	с доброй радостной улыбкой	1	1
653	не только не знающего	1	1
654	чье уединенное сознание углубляется	1	1
655	став женой пустовалова говорит	1	1
656	и уважать в чужой	1	1
657	себя ту чистую поэтическую	1	1
658	было как будто он	1	1
659	матерью а катя не	1	1
660	еще лишена ролевой характерности	1	1
661	уйти бы и доехать	1	1
662	знакома ему по романам	1	1
663	есть жизнь чистая благородная	1	1
664	себя больше дьяконицей чем	2	1
665	экзамене о стороже об	1	1
666	режет? смех веселье радость	1	1
667	думать о красивых глазах	1	1
668	весьма посредственной провинциальной учительницы	1	1
669	десятого утра выехали из	1	1
670	безликую силу конформизма которая	1	1
671	кричит в ответ сиди	1	1
672	теперь сидел больной в	1	1
673	случай употребления настоящего времени	1	1
674	о любви о том	1	1
675	что они все те	1	1
676	долго не может выговорить	1	1
677	беру именно то что	1	1
678	связывает внешнеролевой контакт поговорить	1	1
679	великой нравственной истины о	1	1
680	в речи повествователя может	1	1
681	откуда они все знают?	1	1
682	становится внятной и чужая	1	1
683	закончить рассказ вот и	1	1
684	он кого-нибудь или что-нибудь	1	1
685	настоящего времени в речи	1	1
686	только на пороге его	1	1
687	так у старцева перестало	1	1
688	чувствуется присутствие тайны когда	1	1
689	глазами и опять потянул	1	1
690	бросила выходя из комнаты	1	1
691	находился при архиереях и	1	1
692	неизменно хотелось одного поскорее	1	1
693	он задергал нижней губой	1	1
694	неудачного объяснения в любви	1	1
695	самое замечательное самое важное	1	1
696	о стороже об училищном	1	1
697	чем матерью а катя	1	1
698	ответ на него приходится	1	1
699	непосредственно личностна поэтому катя	1	1
700	и внешнюю стороны существования	1	1
701	была такая же пустота	1	1
702	и голубчик приведя в	1	1
703	есть творец своего счастья	1	1
704	чеховского творчества футлярный характер	1	1
705	который бы вместил в	1	1
706	но служит в банке	1	1
707	несомненно это был тяжелый	1	1
708	разным причинам сисой всю	1	1
709	ракет доносившиеся из сада	1	1
710	рассказа который не принимает	1	1
711	[...] любит ли он	1	1
712	рассказчика за рамки своей	1	1
713	и иных моментах рассказа	1	1
714	вполне отвечает строю мыслей	1	1
715	разума а для личности	1	1
716	творчества футлярный характер беликова	1	1
717	опять потянул руку к	1	1
718	повествователя может быть прочитано	1	1
719	сходилась начинала рассказывать говорила	1	1
720	учительница смотрит но чего	1	1
721	уж куда там глубоко	1	1
722	своего папашу который теперь	1	1
723	приведя в такое волнение	1	1
724	бы это был ужас	1	1
725	характер беликова не только	1	1
726	читатель вместе со всеми	1	1
727	мигая глядела на своего	1	1
728	никитин и откуда они	1	1
729	тогда в детстве и	1	1
730	то что человек есть	1	1
731	катя не понимают что	1	1
732	мария тимофеевна чувствовала себя	1	1
733	окна со двора все	1	1
734	было легко хотя несомненно	1	1
735	за столом архиерей и	1	1
736	его постригли похоже было	1	1
737	натирания типично чеховская бытовая	1	1
738	следов прежнего якобы настоящего	1	1
739	радость в этих и	1	1
740	повествователя завершающего разговор о	1	1
741	брат николаша говоришь мертвецов	1	1
742	нужное на свете став	1	1
743	мать же осмелится назвать	1	1
744	разворачивает картину того на	1	1
745	что это все те	1	1
746	в своем воображении внешность	1	1
747	такое волнение от которого	1	1
748	все не ндравится сисой	1	1
749	оговаривается словно мы знакомимся	1	1
750	и н сухих формулирует	1	1
751	время как личностная опустошенность	1	1
752	произведения у сисоя они	1	1
753	сердитые выпуклые как у	1	1
754	уже не вызывало никаких	1	1
755	и в жизни других	1	1
756	любовь которая была знакома	1	1
757	с такою радостью но	1	1
758	двойным дном возникает библейская	1	1
759	видит особенный мир где	1	1
760	с ним о делах	1	1
761	она не могла представить	1	1
762	к торгам он входит	1	1
763	выехали из города своей	1	1
764	внутреннюю и внешнюю стороны	1	1
765	была знакома ему по	1	1
766	тут было ее прошлое	1	1
767	шла спать и видела	1	1
768	были тогда в детстве	1	1
769	стороже об училищном совете	1	1
770	театре самое замечательное самое	1	1
771	по образованию филолог но	1	1
772	у нее тревожно билось	1	1
773	ни слова мать же	1	1
774	могло бы как-то реализовать	1	1
775	вызывало никаких мыслей в	1	1
776	якобы настоящего глубокого чувства	1	1
777	монах да и не	1	1
778	кресле и тяжело дышал	1	1
779	преосвященному чайную чашку с	1	1
780	именно то что я	1	1
781	читателя в самую суть	1	1
782	углубляется в личную тайну	1	1
783	в себя ту чистую	1	1
784	человек есть творец своего	1	1
785	девочка тотчас после заученного	1	1
786	называет его дядечка и	1	1
787	сидел больной в темной	1	1
788	странность состоит в явной	1	1
789	персонажей произведения у сисоя	1	1
790	угрюмо недовольным голосом отвечал	1	1
791	той от которой страдает	1	1
792	угасает оставляя после себя	1	1
793	и уже давно стерлось	1	1
794	чужой дом назначаемый к	1	1
795	живущего как раз памятью	1	1
796	это был ужас если	1	1
797	треск ракет доносившиеся из	1	1
798	выходила сходилась начинала рассказывать	1	1
799	душе преосвященного петра детским	1	1
800	чистая благородная теплая изящная	1	1
801	такого контакта исключает не	1	1
802	катя оказывается единственной кто	1	1
803	вольно в его присутствии	1	1
804	понять [...] любит ли	1	1
805	именем его матери мария	1	1
806	сухих формулирует главную ценностную	1	1
807	в ответ на веселую	1	1
808	церемонии не обращая внимания	1	1
809	или что-нибудь верует ли	1	1
810	личностная опустошенность отвердевшего характера	1	1
811	себя вольно в его	1	1
812	хитрые личность умирающего неподвижного	1	1
813	павла-петра только эти два	1	1
814	к страдающему и уже	1	1
815	во все двери палкой	1	1
816	пробуждении у читателя самостоятельного	1	1
817	в личную тайну настолько	1	1
818	музыки и треск ракет	1	1
819	нее тревожно билось сердце	1	1
820	глаза хитрые личность умирающего	1	1
821	который она собой являет	1	1
822	начиналась новая нервная сознательная	1	1
823	помимо нагнетания эпитетов венчающий	1	1
824	и прошедшим оставляет место	1	1
825	потянул руку к виску	1	1
826	ему по романам и	1	1
827	конформизма которая мучает героя	1	1
828	преосвященного петра детским началом	1	1
829	же осмелится назвать сына	1	1
830	концентрируется в глазах лицо	1	1
831	эти два человека держат	1	1
832	думала о своих учениках	1	1
833	что это за человек	1	1
834	свой тихий скромный нрав	1	1
835	личностна поэтому катя оказывается	1	1
836	любви о том счастье	1	1
837	между объективной данностью рассказываемой	1	1
838	которой страдает и сам	1	1
839	какого никогда не будет	1	1
840	задать себе подобный вопрос	1	1
841	не могла представить себе	1	1
842	веселую речь марии тимофеевны	1	1
843	уважать в чужой дом	1	1
844	в рассказе володя где	1	1
845	посредственной провинциальной учительницы который	1	1
846	отношения к себе и	1	1
847	реплику девочки неуместно произнесенную	1	1
848	нетерпимого к ней в	1	1
849	прежде чем закончить рассказ	1	1
850	легко постольку поскольку их	1	1
851	на неодетых женщин и	1	1
852	когда же огонек личной	1	1
853	заданности характер который бы	1	1
854	что-нибудь верует ли в	1	1
855	настоящее и другого будущего	1	1
856	прежнего якобы настоящего глубокого	1	1
857	творец своего счастья и	1	1
858	при кукине видевшая в	1	1
859	в то время как	1	1
860	впервые будто и читатель	1	1
861	только по необыкновенно добрым	1	1
862	раз памятью о своем	1	1
863	романам и о которой	1	1
864	сам умирающий преосвященный да	1	1
865	герое прежде чем закончить	1	1
866	в самую суть проблемной	1	1
867	разговор о герое прежде	1	1
868	у старцева перестало беспокойно	1	1
869	кругу монастырского быта от	1	1
870	не принимает участия в	1	1
871	в темной комнате в	1	1
872	сердце когда же екатерина	1	1
873	мучительно препятствует личностному сближению	1	1
874	глядят на него с	1	1
875	репликой лошади поданы пора	1	1
876	в этом детском непонимании	1	1
877	формулирует главную ценностную координату	1	1
878	добрым глазам робкому озабоченному	1	1
879	веселый красивый звон дорогих	1	1
880	мыслей в ее душе	1	1
881	видно что у нее	1	1
882	недовольным голосом отвечал ну	1	1
883	существования павла-петра только эти	1	1
884	нос был вздернутый глаза	1	1
885	страдающему и уже обреченному	1	1
886	бы доехать драматическое напряжение	1	1
887	солнышко и весело светилось	1	1
888	ладу с покоем и	1	1
889	для личности в непосредственности	1	1
890	уксусом для натирания типично	1	1
891	в каждой могиле чувствуется	1	1
892	был тяжелый вздорный человек	1	1
893	в жизни видит особенный	1	1
894	духовно прорывается за пределы	1	1
895	состоит в пробуждении у	1	1
896	и уже обреченному герою	1	1
897	свой пустой двор [...]	1	1
898	раз в жизни видит	1	1
899	с ними ему легко	1	1
900	сисой всю свою жизнь	1	1
901	пронюхали подлецы подумал никитин	1	1
902	же огонек личной тайны	1	1
903	живет теперь единственный в	1	1
904	символики это живет теперь	1	1
905	женой пустовалова говорит в	1	1
906	настоящим временем и прошедшим	1	1
907	и люди без тайны	1	1
908	не все верили несогласованность	1	1
909	он об этом и	1	1
910	в слове и жесте	1	1
911	из города своей информативной	1	1
912	тело уменьшаются сморщиваясь и	1	1
913	чувствовала себя больше дьяконицей	2	1
914	исключает не случайно в	1	1
915	индивидуальность непосредственно личностна поэтому	1	1
916	же пустота как на	1	1
917	пустота как на дворе	1	1
