1	в то же время	4	5
2	что в то время	1	3
3	одним и тем же	2	3
4	потому что он не	1	2
5	только в том что	1	2
6	в том что он	1	2
7	по отношению к своему	1	1
8	в том смысле что	1	1
9	с одной точки зрения	1	1
10	вовсе не в том	1	1
11	и та и другая	1	1
12	не говоря уже о	1	1
13	не только в том	1	1
14	и в самом деле	2	1
15	в то время как	1	1
16	и о том что	1	1
17	именно в том что	1	1
18	только в том случае	1	1
19	в том что этот	1	1
20	заключается именно в том	1	1
21	заключается в том что	2	1
22	в том что и	1	1
23	что он не знает	1	1
24	до сих пор еще	1	1
