1	бы то ни было	1	4
2	на самом же деле	1	3
3	как если бы он	1	3
4	в той или иной	1	3
5	все более и более	1	2
6	в собственном смысле слова	3	2
7	с одной стороны и	2	2
8	ни в коем случае	1	2
9	в том что он	1	2
10	прав в том что	2	2
11	его внутренней речи и	1	1
12	несмотря на то что	1	1
13	дело в том что	1	1
14	рядом друг с другом	1	1
15	никогда не может быть	1	1
16	в сущности ничего не	2	1
17	в тех областях где	1	1
18	в коем случае не	1	1
19	а в связи с	1	1
20	то же самое что	2	1
21	в том числе и	3	1
