1	одного и того же	3	2
2	один и тот же	3	2
3	письменной речи в письменной	1	1
4	в том смысле что	1	1
5	что для того чтобы	1	1
6	то же самое что	2	1
7	по отношению к синтаксису	1	1
8	что он в своем	1	1
9	и вместе с тем	1	1
10	той мере в какой	2	1
11	в тех случаях когда	1	1
12	с этой точки зрения	4	1
13	в собственном смысле слова	1	1
14	не то что он	1	1
15	по одному тому что	1	1
16	уже по одному тому	1	1
17	заключается в том что	4	1
18	одной и той же	1	1
19	а с другой стороны	1	1
20	но в той мере	1	1
21	в той мере в	3	1
