1	в то же время	10	3
2	то же самое нужно	1	2
3	и до сих пор	2	2
4	к другу и к	1	1
5	и вместе с тем	1	1
6	но если бы в	1	1
7	конечно не в том	1	1
8	дело в том что	2	1
9	в то время когда	1	1
10	как бы ни был	1	1
11	заключается в том что	1	1
12	мы можем судить о	1	1
13	в той же книге	3	1
14	самое нужно сказать и	1	1
15	же самое нужно сказать	1	1
16	друг к другу и	1	1
17	не в том что	1	1
18	нужно сказать и о	1	1
19	лишь один из моментов	1	1
20	судить о том что	1	1
21	в том числе и	2	1
22	можно сказать что в	1	1
