1	в то же время	2	4
2	одно и то же	1	4
3	имеет ничего общего с	2	3
4	не имеет ничего общего	2	3
5	если иметь в виду	1	2
6	и в то же	2	2
7	и в этом смысле	3	2
8	с одной стороны и	2	2
9	и то и другое	1	2
10	не с точки зрения	1	2
11	да и то не	1	2
12	ровно ничего не говорит	1	2
13	не имеет никакого отношения	1	1
14	и тем не менее	1	1
15	иметь в виду что	1	1
16	и ни в каком	1	1
17	на самом же деле	2	1
18	а содержит в себе	1	1
19	отчет в том что	1	1
20	мы уже знаем что	1	1
21	ни в каком смысле	1	1
22	никогда не был ни	1	1
23	имеет никакого отношения к	1	1
24	то это значит что	4	1
25	дело в том что	4	1
26	до сих пор не	1	1
27	так а не иначе	1	1
28	не что иное как	1	1
29	в то время как	2	1
