1	фрейд и его ученики	4	3
2	ни в чем не	2	3
3	на протяжении всей жизни	4	2
4	и пр и пр	1	2
5	испытание с точки зрения	2	2
6	сущность его сводится к	1	2
7	по аналогии с сознанием	1	2
8	с его все позволено	2	2
9	матери и к отцу	1	2
10	протяжении всей жизни человека	3	2
11	к матери и к	1	2
12	только в переводе на	1	2
13	аффектов страха и сострадания	1	1
14	и слов замены образов	1	1
15	с другими психологическими направлениями	1	1
16	бы отдаленную связь с	1	1
17	организм замыкается от всех	1	1
18	лежит на границе систем	1	1
19	с точки зрения обоих	1	1
20	духовную привязанность не соединимых	1	1
21	травле всего ученого мира	1	1
22	как бы социализировать грех	1	1
23	и желания которые на	1	1
24	влечений и желаний организма	1	1
25	мифы образы художественного творчества	1	1
26	потока на чувственную страсть	1	1
27	чем иным как изживанием	1	1
28	но вместе с ужасом	1	1
29	боль этой травмы есть	1	1
30	дать себя обмануть его	1	1
31	инфантильный период жизни когда	1	1
32	врачу полутемный кабинет в	1	1
33	бы ценою жизни индивида	1	1
34	безнравственных с точки зрения	1	1
35	не имеющие на первый	1	1
36	сознание или только получает	1	1
37	чувственную страсть и духовную	1	1
38	образования этих символов замещающих	1	1
39	нашего сознания рождается какой-то	1	1
40	мы раздеты мы укутываемся	1	1
41	рая наиболее полной компенсацией	1	1
42	воспроизводится в болезненных симптомах	1	1
43	подкупить смехом создать в	1	1
44	раздражений и влияний наконец	1	1
45	влечение к матери или	1	1
46	и потому причиняющим страдание	1	1
47	обойти запрет но и	1	1
48	в объекте в другом	1	1
49	стремящееся пробиться в сознание	1	1
50	и фрейдисты полагают что	1	1
51	важным событием этой вытесненной	1	1
52	и его ученики противопоставляют	1	1
53	вытесненного влечения т.е до	1	1
54	от всех внешних раздражений	1	1
55	на следующих ступенях развития	1	1
56	словесной двусмысленности перенесения значения	1	1
57	непристойности как ее эстетическая	1	1
58	господству принципа наслаждения присоединяется	1	1
59	всякого участия сознания сознание	1	1
60	сильное сопротивление нашего сознания	1	1
61	с их действительных объектов	1	1
62	убедиться надо только не	1	1
63	действия полового удовлетворения непристойность	1	1
64	некоторых образований сознания особого	1	1
65	страх рождения становится первым	1	1
66	они не выдуманы но	1	1
67	теперь мы должны перейти	1	1
68	рода хотя бы ценою	1	1
69	и дать выход вытесненным	1	1
70	стали организующим соматическим центром	1	1
71	усилий превратить внешний мир	1	1
72	энергий бессознательного т.е и	1	1
73	он не был связан	1	1
74	мы должны перейти к	1	1
75	обходиться без материнской помощи	1	1
76	отцовскому авторитету эдипов комплекс	1	1
77	знаменитом споре волновавшем его	1	1
78	показывания или осязания облачившись	1	1
79	но так ли это?	1	1
80	подразделить на две группы	1	1
81	сновидения и замещают это	1	1
82	больного прикрепляется к врачу	1	1
83	от того насколько ему	1	1
84	только получает возможность войти	1	1
85	для психоанализа же сознательное	1	1
86	тянется в постель к	1	1
87	взятые обычно из безразличных	1	1
88	заложено основание совершенно новой	1	1
89	надо дать полную свободу	1	1
90	и желаний организма под	1	1
91	мысли сна latente traumgedanken	1	1
92	освещенной части находится только	1	1
93	нелепые мысли и образы	1	1
94	если бы он был	1	1
95	легко убедиться надо только	1	1
96	не только обойти запрет	1	1
97	в сновидении фрейд различает	1	1
98	она управляется только одним	1	1
99	уместные в науке фрейд	1	1
100	архаические статуи с их	1	1
101	человек не может во	1	1
102	или только получает возможность	1	1
103	матери первый объект юношеской	1	1
104	есть там бесспорно есть	1	1
105	приводится в движение внешними	1	1
106	желаний чувств и представлений	2	1
107	свободно и беспрепятственно рождаются	1	1
108	на другие безразличные подробности	1	1
109	мысли притом он сохраняет	1	1
110	любимый ученик фрейда и	1	1
111	другому человеку инфантильное самодовление	1	1
112	какое-либо отношение к вытесненному	1	1
113	замаскированные образами явного содержания	1	1
114	материнское лоно мы раздеты	1	1
115	свою тенденцию делает ее	1	1
116	рождается какой-то внутренний протест	1	1
117	как некое чужеродное тело	1	1
118	жизни когда давление реальности	1	1
119	внутренний протест против предпринятого	1	1
120	легального путем слияния представлений	1	1
121	догматически усвоил старое идущее	1	1
122	связанные с погребением обряды	1	1
123	органическое единство с ее	1	1
124	и его ученики цитируют	1	1
125	два потока на чувственную	1	1
126	врача во время психоаналитических	1	1
127	двойное испытание с точки	2	1
128	с точки зрения дальнейших	1	1
129	зависит от того насколько	1	1
130	в переводе на язык	1	1
131	века в мифах и	1	1
132	выдержать точку зрения легального	1	1
133	беспрепятственно рождаются такие представления	1	1
134	влечениях маленького эдипа становится	1	1
135	нам кажется что явное	1	1
136	методов так называемого американского	1	1
137	желаний организма под давлением	1	1
138	сюда входит все что	1	1
139	забвение имен обмолвки описки	1	1
140	время психоаналитических сеансов и	1	1
141	того минимума общего языка	1	1
142	точки зрения дальнейших ступеней	1	1
143	органически влечет к инцесту	1	1
144	создать в смеющемся союзника	1	1
145	канту ставшее общепринятым разделение	1	1
146	первобытный человек? что такое	1	1
147	творчество является по ранку	1	1
148	мы сейчас же заметим	1	1
149	вытесненных психических образований приток	1	1
150	образов чувств и желаний	1	1
151	libido рассеяно по всему	1	1
152	глубине ее подавленных энергий	1	1
153	обвиняют ее в одном	1	1
154	суррогат ersatzbildung материнского лона	1	1
155	организмом и внешней реальностью	1	1
156	смерти ужас и боль	1	1
157	точки зрения психической динамики	1	1
158	нуждается в объекте в	1	1
159	нашу работу она же	1	1
160	психике с ее все	1	1
161	и боль этой травмы	1	1
162	никакого смысла в нем	1	1
163	психологии и практикующимся в	1	1
164	травмы рождения рождение человека	1	1
165	образом и острота только	1	1
166	смеющемся союзника и этим	1	1
167	другие безразличные подробности сна	1	1
168	частичная компенсация за отказ	1	1
169	созидают формальную структуру образов	1	1
170	сна latente traumgedanken боящиеся	1	1
171	прикрытием художественной формы инфантильная	1	1
172	кожа большой палец руки	1	1
173	дозволенного с недозволенным но	1	1
174	и самого тяжелого отделения	1	1
175	но в общем можно	1	1
176	заметим что она встречает	1	1
177	приходится повторить и об	1	1
178	всего к эстетическим явлениям	1	1
179	может во всей последующей	1	1
180	через сознание свободные мысли	1	1
181	бессознательное можно определить как	1	1
182	к врачу полутемный кабинет	1	1
183	эта первая любовь и	1	1
184	влечению законы образования этих	1	1
185	к возвращению назад в	1	1
186	вредного дозволенного и недозволенного	1	1
187	фрейда и считается самым	1	1
188	хотя бы воображаемое она	1	1
189	они являются только одною	1	1
190	тот же механизм обхода	1	1
191	о психофизическом параллелизме и	1	1
192	размежеваться с другими психологическими	1	1
193	хорошая шутка нуждается в	1	1
194	уважением со всякой духовностью	1	1
195	видения показывания или осязания	1	1
196	к современной им психологии	1	1
197	с недозволенным но всегда	1	1
198	понятен ребенку именно нормальный	1	1
199	носит либидинозный характер и	1	1
200	цепи по которой можно	1	1
201	инфантильно-эротического образы явного сновидения	1	1
202	знаменитое учение фрейда об	1	1
203	способностей какие были в	1	1
204	повторение внутриутробного положения зародыша	1	1
205	анальная зона заднепроходное отверстие	1	1
206	сводится к следующему первым	1	1
207	ли это? увы на	1	1
208	потому-то и мобилизована сила	1	1
209	палец руки или ноги	1	1
210	и его ученики по-видимому	1	1
211	доисторическое событие жизни человека	1	1
212	как изживанием и преодолением	1	1
213	бы сделать организм если	1	1
214	образы сновидения и замещают	1	1
215	в более позднее время	1	1
216	разделение душевных явлений на	1	1
217	ужас и боль этой	1	1
218	частично изживать бессознательное и	1	1
219	с вытесненным представлением так	1	1
220	сексуального действия полового удовлетворения	1	1
221	усвоила несколько сектантские навыки	1	1
222	положение зародыша только греческий	1	1
223	человек? что такое комната	1	1
224	представлением так и с	1	1
225	в форму остроты непристойность	1	1
226	не знает различия действительного	1	1
227	из этой же тяги	1	1
228	организма во время сна	1	1
229	к материнскому лону оно	1	1
230	характер своим врагам ребенок	1	1
231	матери к возвращению назад	1	1
232	слияния представлений и слов	1	1
233	сознания форму это достигается	1	1
234	в психоаналитической теории и	1	1
235	такие желания должны быть	1	1
236	составе ведает вытеснением особая	1	1
237	психическая деятельность приводится в	1	1
238	точно и подробно свое	1	1
239	первичное событие эдипова комплекса	1	1
240	он сохраняет те же	1	1
241	психофизическом параллелизме и психофизической	1	1
242	и пути в него	1	1
243	лоно мы раздеты мы	1	1
244	характеристики рая и золотого	1	1
245	симптомах в детском страхе	1	1
246	перенес в свои построения	1	1
247	освободиться от врача и	1	1
248	может быть даже того	1	1
249	этим очищать психику от	1	1
250	с ними успешно конкурируют	1	1
251	для сознания форму это	1	1
252	вытесненным инфантильным влечениям сексуальным	1	1
253	увы на самом деле	1	1
254	соединиться с любым процессом	1	1
255	его рождения признать ее	1	1
256	состояния все события взрослой	1	1
257	пути в него что	1	1
258	механически без всякого участия	1	1
259	обойти реальность освободить от	1	1
260	т.е до скрытого содержания	1	1
261	в психологии его времени	1	1
262	для них почти не	1	1
263	психика не знает различения	1	1
264	больной должен освободиться от	1	1
265	управляется его нужды создают	1	1
266	этим скрытым мыслям т.е	1	1
267	сводится к интерпретирующему истолковывающему	1	1
268	фрейд различает два момента	1	1
269	содержания сна это содержание	1	1
270	подавленных энергий творчество символов	1	1
271	дню его рождения признать	1	1
272	без материнской помощи и	1	1
273	образований сознания особого рода	1	1
274	возврата и этот страх	1	1
275	она хочет приобщить женщину	1	1
276	многообразных проявлениях наконец преодолено	1	1
277	внутриутробного положения зародыша мы	1	1
278	на первых ступенях развития	1	1
279	о действительно бывшем рае	1	1
280	ранка в этой работе	1	1
281	период жизни когда давление	1	1
282	благодаря канту ставшее общепринятым	1	1
283	человека культура и культурный	1	1
284	в область бессознательного и	1	1
285	уже не может быть	1	1
286	творчество таким образом обусловлено	1	1
287	в ходу в психологии	1	1
288	от удовлетворения всех влечений	1	1
289	и духовную привязанность не	1	1
290	непристойность рассчитана на женщину	1	1
291	им психологии и практикующимся	1	1
292	свободного фантазирования freie einf(lle	1	1
293	каких бы то ни	1	1
294	в глубине ее подавленных	1	1
295	играющий во внешнем мире	1	1
296	способ сжигать трупы также	1	1
297	в сознание потому-то и	1	1
298	дальнейшей жизни человек разыгрывает	1	1
299	обмануть его сектантской но	1	1
300	показатель где оно есть	1	1
301	острота только отдушина для	1	1
302	форму и содержание остроты	1	1
303	сопротивление во всех его	1	1
304	свирепый характер своим врагам	1	1
305	или иной эрогенной зоны	1	1
306	внутриутробного состояния все события	1	1
307	две группы патологические образования	1	1
308	вытеснений но в общем	1	1
309	рождается и тяга назад	1	1
310	обхода легального путем слияния	1	1
311	от тесных ассоциативных связей	1	1
312	на них свои вытесненные	1	1
313	на различных путях и	1	1
314	подавленных энергий бессознательного т.е	1	1
315	шутка нуждается в слушателе	1	1
316	пещера в которую забивался	1	1
317	самом деле фрейдизм перенес	1	1
318	эти две группы влечений	1	1
319	и об его зрелом	1	1
320	обусловлено как со стороны	1	1
321	преступностью и порочностью в	1	1
322	инфантильный рай с его	1	1
323	систему бессознательного группа этих	1	1
324	ученик фрейда и считается	1	1
325	ученики по-видимому в этом	1	1
326	разрыва единства с нею	1	1
327	заимствуют свою психическую силу	1	1
328	это первое доисторическое событие	1	1
329	образом обусловлено как со	1	1
330	пороки современной ему субъективной	1	1
331	можно сказать что главную	1	1
332	практикующимся в ней методам	1	1
333	непосредственно продолжающий его собственный	1	1
334	и новых вытеснений но	1	1
335	противоположных по смыслу образов	1	1
336	определения этих способностей какие	1	1
337	первым объектом эротического влечения	1	1
338	новым попыткам объективных методов	1	1
339	такое галлюцинаторное удовлетворение желаний	1	1
340	свое отношение к современной	1	1
341	образов сна стали классическими	1	1
342	в освещенной части находится	1	1
343	и др к функциональной	1	1
344	этих символов замещающих объекты	1	1
345	сновидения эта сила тормозит	1	1
346	объектов желания или во	1	1
347	сна превращением аффектов в	1	1
348	представлений желаний и чувств	1	1
349	агрессивных остротах находит себе	1	1
350	до вытесненного влечения т.е	1	1
351	сохраняет те же определения	1	1
352	внешними и внутренними раздражениями	1	1
353	подробно свое отношение к	1	1
354	собственный организм все характеристики	1	1
355	пробиться к скрытым мыслям	1	1
356	и ведет непрерывную только	1	1
357	что никакого смысла в	1	1
358	любой участок тела может	1	1
359	метод свободного фантазирования freie	1	1
360	первое доисторическое событие жизни	1	1
361	же определения этих способностей	1	1
362	собственно с акта рождения	1	1
363	не давая себе даже	1	1
364	свободные мысли и образы	1	1
365	привязанность не соединимых на	1	1
366	сделать организм если бы	1	1
367	же механизм обхода легального	1	1
368	свое травматическое отделение от	1	1
369	ними уже не может	1	1
370	этой привилегией для накопления	1	1
371	приемлемее для культурного сознания	1	1
372	и острота только отдушина	1	1
373	к гениталиям пробуждающие в	1	1
374	художественного творчества философские социальные	1	1
375	недозволенного она управляется только	1	1
376	изживать бессознательное и этим	1	1
377	отцу так называемый эдипов	1	1
378	хотя бы отдаленную связь	1	1
379	отверстие при выделении кала	1	1
380	реальности возврат в инфантильный	1	1
381	ученики противопоставляют свою концепцию	1	1
382	эта жажда возврата и	1	1
383	актом рождения в мир	1	1
384	назад в этот uterus	1	1
385	легкого и быстрого забвения	1	1
386	совсем уместные в науке	1	1
387	не попытались выяснить сколько-нибудь	1	1
388	к скрытым мыслям сна	1	1
389	не нуждается в объекте	1	1
390	любым процессом и органическим	1	1
391	в землю мать-земля сидячее	1	1
392	представляются чем-то поверхностным головным	1	1
393	психологии действительно настолько велико	1	1
394	признать ее случайным явлением	1	1
395	его в явные образы	1	1
396	желает чего-нибудь меньше смерти	1	1
397	о психическом к сожалению	1	1
398	от тетенса и благодаря	1	1
399	отца с его запретами	1	1
400	своей преступностью и порочностью	1	1
401	как наука о поведении	1	1
402	реальность освободить от серьезности	1	1
403	которой предшествовало полное органическое	1	1
404	рождения признать ее случайным	1	1
405	зародыша погребение в лодке	1	1
406	в агрессивных остротах находит	1	1
407	определяющая их цель сводится	1	1
408	на волю желания стремления	1	1
409	ощущения представления мысли притом	1	1
410	тяги к внутриутробной жизни	1	1
411	же приходится повторить и	1	1
412	сохранить какую-нибудь хотя бы	1	1
413	предшествовало полное органическое единство	1	1
414	также знаменует наиболее удачное	1	1
415	безразличных впечатлений ближайшего дня	1	1
416	и выдержать точку зрения	1	1
417	матери конец лечения воспроизводит	1	1
418	повторяет ужас рождения древнейшие	1	1
419	психику от накопившихся в	1	1
420	наилучшим суррогатом рая наиболее	1	1
421	в слушателе цель ее	1	1
