1	с этой точки зрения	1	4
2	заключается в том что	2	4
3	одно и то же	1	3
4	состоит в том что	3	3
5	точно так же как	1	2
6	в том что он	3	2
7	той мере в какой	5	2
8	лишь в той мере	1	2
9	и вместе с тем	1	2
10	в том что она	1	2
11	ни в какой мере	1	2
12	в той мере в	5	2
13	он несет на себе	1	1
14	именно в силу того	1	1
15	с точки зрения грамматической	1	1
16	в одно и то	1	1
17	для того чтобы в	1	1
18	что с точки зрения	1	1
19	в силу того что	2	1
20	только о том что	1	1
21	с точки зрения законов	1	1
22	не что иное как	1	1
23	после того как мы	1	1
24	и то же слово	1	1
