1	в то же время	8	14
2	с одной стороны и	2	6
3	бы то ни было	4	4
4	в их отношении к	1	3
5	в той или иной	3	3
6	каких бы то ни	1	2
7	но в то же	5	2
8	xviii и xix век	1	1
9	нам кажется что в	1	1
10	несмотря на то что	1	1
11	последние в свою очередь	1	1
12	не говоря уже о	1	1
13	эти последние в свою	1	1
14	может быть сведена к	1	1
15	одного и того же	4	1
16	на то или иное	1	1
17	к тому или иному	1	1
18	в том числе и	1	1
19	в этом отношении в	1	1
20	дело в том что	1	1
21	в последнее время в	1	1
22	и до настоящего времени	2	1
23	в гораздо большей степени	1	1
24	той или иной степени	2	1
25	мы можем сказать что	1	1
26	во всех этих случаях	1	1
