1	в то же время	5	5
2	и не может быть	2	5
3	в том числе и	2	3
4	в большей или меньшей	2	2
5	нет и не может	1	2
6	но в то же	1	2
7	до сих пор не	1	2
8	большей или меньшей степени	2	2
9	одну и ту же	1	1
10	и в то же	3	1
11	и так или иначе	1	1
12	с одной стороны и	2	1
13	не может обойтись без	1	1
14	одно и то же	1	1
15	никогда не может быть	1	1
16	но между ними нет	1	1
17	в той или иной	1	1
18	то это вовсе не	1	1
19	как если бы он	1	1
20	во время работы над	1	1
21	уже сама по себе	1	1
22	между ними нет и	1	1
