N	4gram	Tiupa_Hudo_1	Narrotol
391	закон собственно и составляющий	1	1
392	в анекдоте хаотичен а	1	1
393	жанр городского фольклора являет	1	1
394	проявляет себя в классическом	1	1
395	дурацкое нередко кощунственное вырастающая	1	1
396	выбора все их поступки	1	1
397	судьбой отдельных лиц слово	1	1
398	а сказание давшее литературе	1	1
399	ночной жанр посрамляющий умершее	1	1
400	литературе героический эпос усматривает	1	1
401	или попросту чудаковатое дурацкое	1	1
402	действия или субъектом этического	1	1
403	есть креативная компетенция жанра	1	1
404	выбирают а по своей	1	1
405	связаны с языком ставят	1	1
406	совершенно иной жизни и	1	1
407	маловероятное беспрецедентное анекдотическим повествованием	1	1
408	составляющий морализаторскую премудрость притчевого	1	1
409	в новелле есть нарушение	1	1
410	фигур общества фиксировавшиеся пушкиным	1	1
411	эпос усматривает во внутренне	1	1
412	к тому архаичному состоянию	1	1
413	с этой точки зрения	1	1
414	по своей природе суть	1	1
415	романным жизнеописанием биографической личности	1	1
416	и не окказиональный жребий	1	1
417	с языком ставят перед	1	1
418	и позволяет говорить о	1	1
419	говорит и как говорит	1	1
420	нашего высказывания и в	1	1
421	него выступая здесь не	1	1
422	инициатив бытийной компетенцией анекдотического	1	1
423	недостоверностью отвергает извращает осмеивает	1	1
424	существенно связаны с языком	1	1
425	как субъекты этического выбора	1	1
426	его характера инициативно-авантюрное поведение	1	1
427	как бы стержнем целой	1	1
428	и совершенно иной конкретной	1	1
429	себя в классическом романе	1	1
430	некий нравственный закон собственно	1	1
431	это мир как опыт	1	1
432	к реализации некоторой необходимости	1	1
433	обстоятельств столкновение индивидуальных инициатив	1	1
434	смысла развертывающейся жизни то	1	1
435	в акте выбора осуществляется	1	1
436	всегда эксплицированного в тексте	1	1
437	замысла поэтому форма авторства	1	1
438	он и подобен новеллистическому	1	1
439	максимальной полнотой референтная компетенция	1	1
440	релятивистская казусная картина мира	1	1
441	субъектом инициативного самообнаружения все	1	1
442	во втором эпизоде в	1	1
443	писал он еще не	1	1
444	картина мира где персонажем	1	1
445	носителем и реализатором самобытного	1	1
446	собственным смыслом ни в	1	1
447	и потому нейтральное к	1	1
448	нередко кощунственное вырастающая из	1	1
449	они хотят и свершают	1	1
450	есть биография и не	1	1
451	производящего текст речевая маска	1	1
452	претерпевшего к тому же	1	1
453	окказиональный жребий а вероятностный	1	1
454	исторически продуктивный тип высказывания	1	1
455	состоянию общественных отношений которое	1	1
456	герои сказания или анекдота	1	1
457	судьба в данном контексте	1	1
458	индивидуального речевого замысла поэтому	1	1
459	норм сколько носителем и	1	1
460	становящегося человека с его	1	1
461	названа маской в.т зависит	1	1
462	казусная картина мира которая	1	1
463	герою своей необыкновенностью и	1	1
464	самообнаружения все эти бытийные	1	1
465	частного существования мандельштам справедливо	1	1
466	самоопределения на чем и	1	1
467	или иной преемственно воспроизводимой	1	1
468	лица по мысли с.с	1	1
469	или субъектом этического выбора	1	1
470	литературы анекдот же в	1	1
471	отношений которое гегель именовал	1	1
472	человеческая жизнь писал он	1	1
473	характера инициативно-авантюрное поведение в	1	1
474	фатальный рок и не	1	1
475	веком героев бытийная компетенция	1	1
476	общения объединяющая субъекта и	1	1
477	таковы герои сказания или	1	1
478	в.т зависит от жанра	1	1
479	слухи о происшествиях неофициальной	1	1
480	участок текста характеризующийся единством	1	1
481	фатально непреложный и неоспоримый	1	1
482	отвергает извращает осмеивает всякую	1	1
483	кто говорит и кому	1	1
484	мы имеем дело с	1	1
485	не может быть и	1	1
486	действующие лица по мысли	1	1
487	по отношению к нему	1	1
488	одного и того же	2	1
489	европейского романа является как	1	1
490	мира которая своей карнавальной	1	1
491	в герое и через	1	1
492	ним определенные задания реализуют	1	1
493	в той мере в	1	1
494	и недостоверностью отвергает извращает	1	1
495	во времени старого европейского	1	1
496	беспрецедентное анекдотическим повествованием творится	1	1
497	давшее литературе героический эпос	1	1
498	жизни принципиальным условием коммуникативной	1	1
499	зависит от жанра высказывания	1	1
500	в качестве бытийной компетенции	1	1
501	него романным жизнеописанием биографической	1	1
502	нравственный закон собственно и	1	1
503	исторического бытия и где	1	1
504	выбора не всегда эксплицированного	1	1
505	и пр связь со	1	1
506	реализация такого выбора не	1	1
507	случая непредсказуемое стечение обстоятельств	1	1
508	посрамляющий умершее солнце тысяча	1	1
509	восходит к тому архаичному	1	1
510	демонстрируется как формулирует н.д	1	1
511	акте выбора осуществляется или	1	1
512	ибо жизнь личности в	1	1
513	было и не могло	1	1
514	обязательно курьезное любопытное занимательное	1	1
515	реализатором самобытного смысла развертывающейся	1	1
516	сыне это императивная картина	1	1
517	жизнеописанием биографической личности творится	1	1
518	мира это фатально непреложный	1	1
519	например слухи о происшествиях	1	1
520	маской в.т зависит от	1	1
521	в тексте может быть	1	1
522	жребий а вероятностный опыт	1	1
523	здесь не столько нарушителем	1	1
524	являет собой лишь одну	1	1
525	своей карнавальной непредвиденностью и	1	1
526	статичен в анекдоте хаотичен	1	1
527	выступая здесь не столько	1	1
528	фиксировавшиеся пушкиным или вяземским	1	1
529	преступается не предначертанность судьбы	1	1
530	или же императивную ритуальность	1	1
531	в мире случайности полноценная	1	1
532	и формы высказывания как	1	1
533	и существенно разнится от	1	1
534	становления и развития самоопределяющегося	1	1
535	быть субъектом ролевого действия	1	1
536	от жанра высказывания жанр	1	1
537	выбора в качестве бытийной	1	1
538	историческое становление мира в	1	1
539	мире всеобщей межличностной соотносительности	1	1
540	высказывания жанр в свою	1	1
541	признает никакого миропорядка жизнь	1	1
542	не признает никакого миропорядка	1	1
543	сказания или анекдота но	1	1
544	мира как центрированная вокруг	1	1
545	том или ином отношении	1	1
546	мира моделируемая притчей напротив	1	1
547	него возможны но факультативны	1	1
548	смешное но обязательно курьезное	1	1
549	напротив дискредитирующе глупое или	1	1
550	влияние со стороны художественной	1	1
551	нарушение запрета есть профанация	1	1
552	некоторой необходимости известного предназначения	1	1
553	сколько носителем и реализатором	1	1
554	форме индивидуального речевого замысла	1	1
555	анекдота новелла первоначально предполагает	1	1
556	нами не как объекты	1	1
557	дает позвоночника роману человек	1	1
558	принципиальным условием коммуникативной стратегии	1	1
559	из анекдота новелла первоначально	1	1
560	концепты героя и картины	1	1
561	некоторых норм сколько носителем	1	1
562	предначертанность судьбы а некий	1	1
563	субъекта жизни принципиальным условием	1	1
564	совершенно иной конкретной ценностно-смысловой	1	1
565	и не быть субъектом	1	1
566	частности форма авторства как	1	1
567	сказания исторически восходит к	1	1
568	и ситуацией высказывания >	1	1
569	не выбирают а по	1	1
570	в том что он	1	1
571	мы строим свою речь	1	1
572	собой лишь одну из	1	1
573	свершают картина мира моделируемая	1	1
574	новелле есть нарушение запрета	1	1
575	императивную ритуальность заданность человеческих	1	1
576	биография и не дает	1	1
577	> кто говорит и	1	1
578	анекдотического дискурса претерпевшего к	1	1
579	героев бытийная компетенция героического	1	1
580	основана жанровая форма романа	1	1
581	в форме определенной жанровой	1	1
582	инициативно-авантюрное поведение в окказионально-авантюрном	1	1
583	представляют собой традиционные для	1	1
584	от него выступая здесь	1	1
585	то есть субъектом самоопределения	1	1
586	новеллистическому герою своей необыкновенностью	1	1
587	возможность совершенно иной жизни	1	1
588	реализуют в нем определенные	1	1
589	и не дает позвоночника	1	1
590	священного новелла ночной жанр	1	1
591	не обязательно сообщает нечто	1	1
592	языком ставят перед ним	1	1
593	и основана жанровая форма	1	1
594	обязательно сообщает нечто смешное	1	1
595	чем и основана жанровая	1	1
596	времени старого европейского романа	1	1
597	же в исконном значении	1	1
598	маска есть креативная компетенция	1	1
599	нечто смешное но обязательно	1	1
600	картина мира моделируемая притчей	1	1
601	же императивную ритуальность заданность	1	1
602	как уже говорилось выше	1	1
603	и не могло быть	2	1
604	во всей его полноте	1	1
605	притче о блудном сыне	1	1
606	непредсказуемое стечение обстоятельств столкновение	1	1
607	только в вероятностном и	1	1
608	и в форме определенной	1	1
609	личности в противоположность характеру	1	1
610	этого слова таковы например	1	1
611	нарушителем некоторых норм сколько	1	1
612	группирующихся вокруг него романным	1	1
613	мы имеем дело не	1	1
614	ни притча не знают	1	1
615	не быть субъектом ролевого	1	1
616	в мире императивной нормы	1	1
617	свою очередь определяется предметом	1	1
618	как ни анекдот ни	1	1
619	жанровая форма романа неканонического	1	1
620	анекдот ни притча не	1	1
621	компетенция биографического дискурса проявляет	1	1
622	обстоятельств личностного присутствия в	1	1
623	противопоставлял житиям святых где	1	1
624	или причастной вненаходимости бахтин	1	1
625	формулирует н.д тамарченко историческое	1	1
626	самоопределяющегося субъекта жизни принципиальным	1	1
627	и непристойность необыкновенное в	1	1
628	жизнеописания может как быть	1	1
629	развертывающейся жизни то есть	1	1
630	солнце тысяча и одна	1	1
631	анекдотическим повествованием творится окказиональная	1	1
632	который в отличие от	1	1
633	определенные задания реализуют в	1	1
634	то же время они	1	1
635	именовал веком героев бытийная	1	1
636	остроумно находчивое или напротив	1	1
637	что они хотят и	1	1
638	осуществляется или преступается не	1	1
639	жанровой схемы и в	1	1
640	слова таковы например слухи	1	1
641	жизнепроцессе бытия это мир	1	1
642	креативного и рецептивного сознаний	1	1
643	для него возможны но	1	1
644	в притче он статичен	1	1
645	новелла ночной жанр посрамляющий	1	1
646	тысяча и одна ночь	1	1
647	занимательное неожиданное маловероятное беспрецедентное	1	1
648	по мысли с.с аверинцева	1	1
649	анекдот не признает никакого	1	1
650	или вяземским не обязательно	1	1
651	у себя в комнате	1	1
652	или преступается не предначертанность	1	1
653	быть так и не	1	1
654	лишь одну из модификаций	1	1
655	мира в притче он	1	1
656	свободного выбора в качестве	1	1
657	жизни и совершенно иной	1	1
658	в частности форма авторства	1	1
659	поведение в окказионально-авантюрном мире	1	1
660	притче есть реализация такого	1	1
661	стороны художественной литературы анекдот	1	1
662	бытия это мир как	1	1
663	которая своей карнавальной непредвиденностью	1	1
664	иной конкретной ценностно-смысловой картины	1	1
665	может обладать собственным смыслом	1	1
666	чудаковатое дурацкое нередко кощунственное	1	1
667	творится окказиональная случайностная релятивистская	1	1
668	становление мира в герое	1	1
669	непристойность необыкновенное в новелле	1	1
670	определяется предметом целью и	1	1
671	него концепты героя и	1	1
672	модификаций анекдотического дискурса претерпевшего	1	1
673	не всегда эксплицированного в	1	1
674	существенно разнится от него	1	1
675	бахтина облекается в молчание	1	1
676	парадигмы где образ становящегося	1	1
677	мир как опыт становления	1	1
678	императивная картина мира где	1	1
679	в тексте но всегда	1	1
680	хаотичен а сказание давшее	1	1
681	по бахтину нарушение табу	1	1
682	вяземским не обязательно сообщает	1	1
683	осмеивает всякую фатальную или	1	1
684	так и не быть	1	1
685	и одна ночь и	1	1
686	есть не что иное	1	1
687	тогда как ни анекдот	1	1
688	не фатальный рок и	1	1
689	является как бы стержнем	1	1
690	дискурса проявляет себя в	1	1
691	сыновей в иисусовой притче	1	1
692	в свою очередь определяется	1	1
693	же обратное влияние со	1	1
694	необыкновенное в новелле есть	1	1
695	высказывания > кто говорит	1	1
696	суть то что они	1	1
697	выводится в просторную сферу	1	1
698	через героя тогда как	1	1
699	запрета есть профанация священного	1	1
700	этического выбора все их	1	1
701	обладать собственным смыслом ни	1	1
