4gram	Bakhtin_FransuaRableINarodnaiaKultura_partition_part3_wordlist_4gram	Bakhtin_FransuaRableINarodnaiaKultura_partition_part2_wordlist_4gram
от несущего их целого	1	1
для этого прежде всего	1	1
мы еще вернемся в	1	2
мы имеем в виду	1	1
дело вовсе не в	1	1
почти до наших дней	1	1
и его связь с	1	1
мы проанализируем в дальнейшем	1	1
мы еще вернемся к	1	1
этого прежде всего необходимо	1	1
литературе xv и xvi	1	2
связь с материально-телесным низом	1	1
до сих пор остается	1	1
в ту эпоху была	1	1
эпизод первой книги романа	1	1
литературы в строгом смысле	1	1
письмо гаргантюа к пантагрюэлю	1	1
как мы уже говорили	2	2
прологе к первой книге	1	1
как мы уже сказали	1	1
и не может быть	1	1
и положительные и отрицательные	1	1
усиливается еще тем что	1	1
перевода их в материально-телесный	1	1
до сих пор еще	2	1
и шире и глубже	1	3
xv и xvi веков	1	2
или во всяком случае	1	1
в своей книге как	1	1
все же в этой	1	1
в виду прежде всего	2	1
была в значительной степени	1	1
рекреаций в истории средневековой	1	1
одной и той же	1	2
народная смеховая культура в	1	1
satires chrestiennes de la	1	1
большей или меньшей степени	3	2
для него существует только	1	1
в литературе xv и	1	1
в то же время	6	6
отрицательная сторона романтической концепции	1	1
его образов и его	1	1
путем перевода их в	1	2
образов и его стиля	1	1
гротескном реализме и в	1	1
то же время это	1	1
дело в том что	1	1
chrestiennes de la cuisine	1	1
прежде всего необходимо понять	1	1
и т.п то есть	1	1
смеха и его связь	1	1
еды и питья и	1	1
мы уже говорили что	1	1
но и в более	1	1
в большей или меньшей	3	2
не подлежит никакому сомнению	1	2
по сравнению с рабле	1	1
de la cuisine papale	1	1
на площадях и улицах	1	1
подлежит никакому сомнению что	1	2
но все же в	1	1
прологе к четвертой книге	1	3
брата жана и панурга	1	1
знаменитый эпизод первой книги	1	1
это играющий мальчик гераклита	1	1
но в то же	3	4
имеем в виду прежде	2	1
народной смеховой культуры и	1	3
в большую литературу и	2	1