4gram	Bakhtin_FransuaRableINarodnaiaKultura_partition_part1_wordlist_4gram	Bakhtin_FransuaRableINarodnaiaKultura_partition_part3_wordlist_4gram
книге о шекспире гюго	1	1
в том числе и	2	7
в дальнейшем по ходу	1	2
мы имеем в виду	1	1
с возрождением и обновлением	1	1
в книге о шекспире	1	2
сбрасывается в телесный низ	1	1
остановимся прежде всего на	1	1
как мы уже говорили	2	2
на отдельные чисто отрицательные	1	1
как мы уже сказали	1	3
и не может быть	1	1
имеет существенное отношение к	1	1
с точки зрения этих	1	1
и т.п все эти	1	1
до сих пор еще	1	3
отдельные чисто отрицательные явления	1	1
на мир и на	1	1
возрождающей и обновляющей силы	1	2
рабле в ряду этих	1	1
оказала определяющее влияние на	1	1
в той или иной	2	5
во всей мировой литературе	1	1
дальнейшем по ходу нашего	1	1
и в романе рабле	2	1
большей или меньшей степени	2	4
и т.п все это	1	1
и в других местах	2	1
всегда в той или	1	2
из всех классиков мировой	1	1
в то же время	6	1
его образов и его	1	1
мы встречаемся с ним	1	1
средневековья и прежде всего	1	1
дело в том что	1	2
и до сих пор	1	1
праздник дураков праздник осла	1	1
той или иной степени	1	1
мы уже говорили что	1	2
в средние века и	1	2
той или иной форме	1	4
в большей или меньшей	2	4
материально-телесного низа все это	1	1
переходят друг в друга	2	1
в смеховых обрядово-зрелищных формах	1	1
не подлежит никакому сомнению	2	1
возрождающий и обновляющий момент	1	1
но в то же	4	1
нет и не может	1	1
материально-телесный низ гротескного реализма	1	1
всех классиков мировой литературы	1	1
в тех или иных	1	1
народной смеховой культуры и	3	2