4gram	Bakhtin_FransuaRableINarodnaiaKultura_partition_part8_wordlist_4gram	Bakhtin_FransuaRableINarodnaiaKultura_partition_part3_wordlist_4gram
смерти старого и рождения	1	1
в той же книге	3	3
ни с одним из	1	2
в том числе и	2	2
в эпоху рабле в	1	1
старого и рождения нового	1	1
начала и до конца	4	3
то же время не	1	1
первой половины xvi века	1	1
хвалы и брани в	1	3
как мы уже говорили	2	1
не солидаризовался до конца	1	1
до конца ни с	1	1
в особенности на народных	1	1
рабле и его современников	1	1
как мы уже сказали	1	1
с начала и до	4	3
официальной культуры между тем	1	1
и т.п все эти	1	1
и рождения нового мира	1	1
до сих пор еще	1	4
одновременной смерти старого и	1	1
солидаризовался до конца ни	1	1
указывали на громадное значение	1	1
пролога к третьей книге	1	1
в другом месте с	1	1
в той или иной	2	1
что в романе рабле	1	1
народной смеховой культуры не	1	1
и в данном случае	1	1
и в романе рабле	2	2
кардинал жан дю белле	1	1
большей или меньшей степени	2	3
и в настоящее время	1	1
с современной ему действительностью	1	1
какой бы то ни	1	1
рамки официальной культуры между	1	1
бы то ни было	1	1
в то же время	6	10
и противопоставлены друг другу	1	1
то же время это	1	1
дело в том что	1	2
и до сих пор	1	2
уже говорили что для	1	1
той или иной степени	1	1
xvi века и в	2	1
и т.п то есть	1	1
мы уже говорили что	1	5
всегда во все эпохи	1	1
в большей или меньшей	2	3
в четвертой книге романа	1	2
в романе рабле но	1	1
к четвертой книге рабле	1	1
франции с карлом v	1	1
но в то же	4	2
брата жана и панурга	1	2
особенности на народных языках	1	1
народной смеховой культуры и	3	1
народная смеховая культура в	1	1