4gram	Bakhtin_FransuaRableINarodnaiaKultura_partition_part2_wordlist_4gram	Bakhtin_FransuaRableINarodnaiaKultura_partition_part1_wordlist_4gram
пьяниц литургия игроков и	1	1
с конца xvi века	1	1
проблемы народной смеховой культуры	2	1
смеховой культуры средневековья так	1	1
о чем мы уже	1	1
мы имеем в виду	1	1
в самом его начале	1	1
в фабльо и шванках	1	1
к народной смеховой культуре	2	1
свиньи завещание осла пародийные	1	1
как мы уже говорили	2	2
все более и более	1	1
сыграть существенную роль в	1	1
как мы уже сказали	3	1
и не может быть	1	1
животном эпосе в фабльо	1	1
и в гротескном реализме	1	1
на что не похожим	1	1
xvii и xviii веков	1	2
до сих пор еще	3	2
претензиям на незыблемость и	1	1
parodia sacra то есть	1	1
эпосе в фабльо и	1	1
между всеми телами и	1	1
сих пор еще недостаточно	1	1
на самом же деле	3	1
существенное отношение к времени	1	2
на протяжении всего средневековья	2	2
завещание осла пародийные эпитафии	1	1
были в большей или	1	1
и ни на что	1	1
в животном эпосе в	1	1
ни на что не	1	1
большей или меньшей степени	4	3
уже в xvii веке	1	1
в обряде крещения и	1	1
всеми телами и вещами	1	1
в то же время	1	6
его образов и его	1	1
дело в том что	2	1
смеховой культуры средневековья и	1	1
пасхальный смех risus paschalis	1	1
чем мы уже говорили	1	1
и др все эти	1	1
мы уже говорили что	2	1
влияние народной смеховой культуры	1	1
в большей или меньшей	4	3
праздники дураков festa stultorum	1	1
народной смеховой культуры средневековья	6	3
не подлежит никакому сомнению	1	1
завещание свиньи завещание осла	1	1
но в то же	1	3
народной смеховой культуры на	1	1
всех этих явлений не	1	1
литургия пьяниц литургия игроков	1	1
всяким претензиям на незыблемость	1	1
народной смеховой культуры и	2	1