4gram	Berdyaev_MirosozercanieDostoevskogo_partition_part2_wordlist_4gram	Berdyaev_MirosozercanieDostoevskogo_partition_part1_wordlist_4gram
есть путь страдания и	1	1
– говорит шигалев –	1	1
из безграничной свободы –	1	1
шигалев – я заключаю	1	1
переходит в безграничный деспотизм	1	1
отношений между иваном карамазовым	1	1
нет возврата к тому	1	1
в записках из подполья	1	1
свободу свободу человеческого духа	1	1
свобода переходит в рабство	1	1
свободы – говорит шигалев	1	1
безграничной свободы – говорит	1	1
– трагическая судьба человека	1	1
переходит в свою противоположность	2	1
человека когда человек в	1	1
с его отношением к	1	1
до последних пределов раздвоения	1	1
не ответствен за зло	1	1
в высшей степени динамическое	1	1
гармония не может быть	1	1
к человеку у достоевского	1	1
кириллов версилов иван карамазов	1	1
джентльмен с ретроградной и	2	1
у достоевского была идея	1	1
в высшей степени динамична	1	1
через чистилище и ад	1	1
путь свободы есть путь	2	1
выходя из безграничной свободы	1	1
избавить человека от страданий	1	1
о боге и бессмертии	1	1
не что иное как	1	3
к конечному и предельному	1	1
с ретроградной и насмешливой	3	1
легенды о великом инквизиторе	2	1
достоевский проводит человека через	1	2
место в творчестве достоевского	1	1
все творчество достоевского есть	4	1
свободу добра и зла	1	1
свободы есть путь страдания	1	1
достоевский исследует до глубины	2	1
плоть от плоти и	2	1
эвклидов ум ивана карамазова	1	1
и свободу человеческого духа	1	1
в бесах и в	1	1
и кровь от крови	2	1
во имя счастья людей	1	1
от того что человек	1	1
за зло и преступление	1	1
свобода перешедшая в своеволие	1	1
все герои достоевского –	1	1
может быть принят и	1	1
мировая гармония не может	1	1
человечества по новому штату	1	1
мыслях героя записок из	1	1
мы увидим что достоевский	1	1
свобода переходит в безграничный	1	1
образ и подобие божие	2	2
одна и та же	1	2
если нет бога если	1	2
у достоевского нет ничего	1	1
до самой глубины человеческой	1	1
говорит шигалев – я	1	1
ставрогин кириллов версилов иван	1	1
человеческого своеволия но он	1	1
человеческая свобода с божественной	1	1
от плоти и кровь	2	1
достоевского есть прежде всего	1	1
настасью филипповну и аглаю	1	2
раскольников ставрогин кириллов версилов	1	1
не может быть и	1	1
добра и зла и	2	1
плоти и кровь от	2	1
– я заключаю безграничным	1	1
он обращен к грядущему	1	1
я заключаю безграничным деспотизмом	1	1
его он хотел бы	1	1
ретроградной и насмешливой физиономией	3	1
между иваном карамазовым и	1	1
у достоевского это –	1	1
героя записок из подполья	1	1
человек замыкается в своем	1	1
тема легенды о великом	1	1