4gram	Tiupa_LitereturaIMentalnost_partition_part3_wordlist_4gram	Tiupa_LitereturaIMentalnost_partition_part2_wordlist_4gram
и выпадает функция художественного	1	1
заказа будучи попыткой адаптировать	1	1
области искусства уничтожить положение	1	1
всеми сообща и заодно	1	1
художник был бы индивидуалом	1	1
глубочайшего психического захвата рассчитанного	1	1
будет свой праздник возрождения	1	1
и поэзии и то	1	1
стихотворение не монолог но	1	1
было его онтологической характеристикой	1	1
будущем следующий по порядку	1	1
прошлое и предвидимое желаемое	1	1
коллективного мозга на долю	1	1
будучи всерьез озабочен духовной	1	1
современность ближайшее прошлое и	1	1
я не могу обойтись	1	1
искусство не может быть	1	1
политики в области искусства	1	1
не может быть вообще	1	1
на определенный круг лиц	1	1
свой праздник возрождения проблема	1	1
не знающий отца автор	1	1
сделать в ее историческом	1	1
то что ей предназначено	1	1
как воскрешение архаических культурных	1	1
краткий курс истории вкп(б	1	1
такую же личную никого	1	1