4gram	Tiupa_LitereturaIMentalnost_partition_part3_wordlist_4gram	Tiupa_LitereturaIMentalnost_partition_part2_wordlist_4gram
хотя мандельштаму не с	1	1
исходит из того что	1	1
частность оказывается общим делом	1	1
предстоит ей сделать в	1	1
расходясь в этом с	1	1
состоит в том что	3	1
на ''ты'' и ''я''	1	1
никакое другое сознание более	1	1
психического захвата рассчитанного обычно	1	1
комиссия утопического грядущего це	1	1
центральная контрольная комиссия утопического	1	1
что ей предназначено в	1	1
ролевого функционирования это бахтинское	1	1
по характеристике и.п смирнова	1	1
именно такой стих а	1	1
ближайшее прошлое и предвидимое	1	1
же личную никого не	1	1
от политбюро доклад о	1	1
органическим и таинственно-непостижимым образом	1	1
на горло собственной песне	1	1
все выше и выше	1	1
но разговор писателя с	1	1
устранила бы противопоставление на	1	1
ка ка идущих светлых	1	1
самоутверждения или соцреалистическое время	1	1
ищет именно такой стих	1	1
на читателя всю свою	1	1
читатель понимает ведущий класс	1	1
памяти жанра слова хронотопа	1	1
делающем от политбюро доклад	1	1
эта частность оказывается общим	1	1
в будущем следующий по	1	1
посоветоваться он ищет именно	1	1
я должен найти себя	1	1
без другого я должен	1	1
взаимоподчинения и обоюдного контроля	1	1
в предписанное русло однако	1	1
едва ли не наиболее	1	1
задачу социалистической культурной политики	1	1
образом связанному с саморазвитием	1	1
чередованием незаметно прожили жизнь	1	1
в единстве жизни этих	1	1
в ее историческом развитии	1	1
авторитарного менталитета искусство не	1	1
ведущий класс и искусство	1	1
что было его онтологической	1	1
вообще индивидуальным делом ленин	1	1
она как на граните	1	1
по отношению к мнимо	1	1
на таких мозгах она	1	1
все хотят увидеть всех	1	1
свой народ свой класс	1	1
отныне несет ответственность за	1	1
в себе во взаимоотражении	1	1
литер на кличку сменять	1	1
стих таинственно-родной и хотя	1	1
уничтожить положение при котором	1	1
не могу обойтись без	1	1
и заодно с правопорядком	1	1
человеческого присутствия в мире	1	2
найдя другого в себе	1	1
котором художник был бы	1	1
вечности заложник у времени	1	1
и теперь эта частность	1	1
в другом найдя другого	1	1
речь разумеется не об	1	1
справедлива даже по отношению	1	1
предписанное русло однако отыскав	1	1
соцреалистическое время ролевого функционирования	1	1
другое сознание более не	1	1
политбюро доклад о работе	1	1
наследия как неотрадиционального феномена	1	1
или соцреалистическое время ролевого	1	1
говоря уже о сталине	1	1
неотрадиционального феномена духовной культуры	1	1
направляет на читателя всю	1	1
звонкую силу поэта то	1	1
смысла будет свой праздник	1	1
и предвидимое желаемое будущее	1	1
в рамках авторитарного менталитета	1	1
политическим условиям становления тоталитаризма	1	1
частностями артистического призвания и	1	1
выпадает функция художественного мышления	1	1
художественного мышления и отражения	1	1
озабочен духовной потребностью аудитории	1	1
ответственность за открывшуюся ему	1	1
образу органическим и таинственно-непостижимым	1	1
надпись надолго сохраните на	1	1
той органической связи с	1	1
собою без другого я	1	1
свобода и ответственность неотъемлемые	1	1
нет иду я в	1	1
трактуется как воскрешение архаических	1	1
сделать их именно теми	1	1
уже о бахтинской концепции	1	1
касающуюся частность и теперь	1	1
и хотя мандельштаму не	1	1
за их чередованием незаметно	1	1
номер на литер на	1	1
равнению единодушия и единомыслия	1	1
пролетариатом той тесной близости	1	1
малое время современность ближайшее	1	1
художественного ремесла к той	1	1
широчайшего и глубочайшего психического	1	1
выше и выше и	1	1
г.а белой из творческого	1	1
противопоставление на ''ты'' и	1	1
написанными бахтиным для печати	1	1
области исторической поэтики особое	1	1
возрождения проблема большого времени	1	1
бы то ни было	1	2
в образах коллективного сознания	2	1
и индивидуальный талант до	1	1
ей сделать в ее	1	1
а не возможности самовыразиться	1	1
как такую же личную	1	1
привести мастеров художественного ремесла	1	1
другим никто его не	1	1
таких мозгах она как	1	1
принадлежит эстетике словесного творчества	1	1
находка для творца не	1	1
определенный круг лиц свой	1	1
той тесной близости которая	1	1
или направить душевную жизнь	1	1
у времени в плену	1	1
тогда как авангардное время	1	1
советчика врача на лестнице	1	1
читателя в предписанное русло	1	1
класс и искусство не	1	1
элиота традиция и индивидуальный	1	1
авангардистом одновременно не приемлет	1	1
праздник возрождения проблема большого	1	1
другого в себе во	1	1
могу обойтись без другого	1	1
связанному с саморазвитием жизни	1	1
не может быть другим	1	1
может быть другим никто	1	1
более не властно над	1	1
для печати были нет	1	1
карнавализация трактуется как воскрешение	1	1
врача на лестнице колючей	1	1
таинственно-родной и хотя мандельштаму	1	1
присутствия в мире свобода	1	1
''я'' сделать их именно	1	1
отыскав опальный стих не	1	1
именно теми клеточками коллективного	1	1
неумолимое находка для творца	1	1
эссе элиота традиция и	1	1
потребностью аудитории и кардинально	1	1
с этой точки зрения	1	1
ремесла к той органической	1	1
духовной потребностью аудитории и	1	1
в области искусства уничтожить	1	1
которая в психологии их	1	1
искусства уничтожить положение при	1	1
и ''я'' сделать их	1	1
идентификация бахтинского интеллектуального наследия	1	1
это дискурс не диалога	1	1
знающий отца автор отныне	1	1
я это дискурс не	1	1
себя в другом найдя	1	1
его онтологической характеристикой доверие	1	1
бахтинское малое время современность	1	1
художником право на творческую	1	1
абсолютно мертвого у каждого	1	1
отношению к мнимо авангардистской	1	1
хуже вас не говоря	1	1
не возможности самовыразиться безоглядно	1	1
и привести мастеров художественного	1	1
к мнимо авангардистской книге	1	1
жанра слова хронотопа последними	1	1
стих не знающий отца	1	1
званье на номер на	1	1
для творца не может	1	1
времени тогда как авангардное	1	1
в области исторической поэтики	1	1
хронотопа последними словами написанными	1	1
найти себя в другом	1	1
онтологической характеристикой доверие к	1	1
прожили жизнь как такую	1	1
и выше и выше	1	1
монолог но разговор писателя	1	1
в этом с авангардистом	1	1
и то что ей	1	1
самодвижению саморазвитию жизни и	1	1
и никакое другое сознание	1	1
говоря уже о бахтинской	1	1
акта ушло то что	1	1
он ищет именно такой	1	1
положение при котором художник	1	1
в психологии их устранила	1	1
душевную жизнь читателя в	1	1
бахтинской концепции интерсубъективной творческой	1	1
внутренних я это дискурс	1	1
к художественному образу органическим	1	1
как неотрадиционального феномена духовной	1	1
таинственно-непостижимым образом связанному с	1	1
на номер на литер	1	1
не говоря уже о	2	3
не касающуюся частность и	1	1
доверие к художественному образу	1	1
отца автор отныне несет	1	1
''ты'' и ''я'' сделать	1	1
грядущего це ка ка	1	1
рамках авторитарного менталитета искусство	1	1
самое можно сказать и	1	1
другого я должен найти	1	1
состояние мировой мысли и	1	1
обычно на определенный круг	1	1
вас не говоря уже	1	1
и глубочайшего психического захвата	1	1
творца не может быть	1	1
к равнению единодушия и	1	1
начале х годов поэт	1	1
ничего абсолютно мертвого у	1	1
другого не могу стать	1	1
личную никого не касающуюся	1	1
белой из творческого акта	1	1
теория социального заказа будучи	1	1
условиям становления тоталитаризма все	1	1
социального заказа будучи попыткой	1	1
были нет ничего абсолютно	1	1
сталине верховном читателе делающем	1	1
возможности самовыразиться безоглядно или	1	1
роман или стихотворение не	1	1
концепции интерсубъективной творческой памяти	1	1
функция художественного мышления и	1	1
с авангардистом одновременно не	1	1
себе во взаимоотражении во	1	1
во имя переделки мира	1	1
народ свой класс и	1	1
шаг который предстоит ей	1	1
коммуникативное событие взаимоподчинения и	1	1
диалога но явной или	1	1
и кардинально расходясь в	1	1
и за их чередованием	1	1
бы индивидуалом и привести	1	1
при котором художник был	1	1
проблема большого времени тогда	1	1
к той органической связи	1	1
даже по отношению к	1	1
жизнь читателя в предписанное	1	1
в том числе и	1	2
последними словами написанными бахтиным	1	1
словами написанными бахтиным для	1	1
мыслится при этом как	1	1
мнимо авангардистской книге о	1	1
от эпохального эссе элиота	1	1
частность и теперь эта	1	1
свое имя и званье	1	1
никто его не судит	1	1
право на творческую индивидуальность	1	1
неоднократно от эпохального эссе	1	1
уединенности внутренних я это	1	1
незаметно прожили жизнь как	1	1
долю которых и выпадает	1	1
и искусство не хуже	1	1
творческого акта ушло то	1	1
слова хронотопа последними словами	1	1
к новым политическим условиям	1	1
стих а не возможности	1	1
поэтики особое место в	1	1
становясь на горло собственной	1	1
без другого не могу	1	1
предназначено в будущем следующий	1	1
ушло то что было	1	1
команды к равнению единодушия	1	1
открывшуюся ему межличностную ценность	1	1
событие взаимоподчинения и обоюдного	1	1
не диалога но явной	1	1
и доверие к художественному	1	1
мозга на долю которых	1	1
из творческого акта ушло	1	1
жизни и доверие к	1	1
артистического призвания и за	1	1
властно над ним неумолимое	1	1
саморазвитию жизни и доверие	1	1
какого бы то ни	1	2
характеристикой доверие к самодвижению	1	1
у каждого смысла будет	1	1
их чередованием незаметно прожили	1	1
всю свою звонкую силу	1	1
то же самое можно	1	1
народу нужен стих таинственно-родной	1	1
художественному образу органическим и	1	1
становления тоталитаризма все еще	1	1
коллективный классовый читатель понимает	1	1
читателя всю свою звонкую	1	1
никого не касающуюся частность	1	1
с одной стороны и	1	2
за открывшуюся ему межличностную	1	1
теми клеточками коллективного мозга	1	1
искусство не хуже вас	1	1
интеллектуального наследия как неотрадиционального	1	1
мандельштаму не с кем	1	1
мысли и поэзии и	1	1
должен найти себя в	1	1
был бы индивидуалом и	1	1
другом найдя другого в	1	1
самовыразиться безоглядно или направить	1	1
были отвлечены текущими частностями	1	1
отражения в образах коллективного	1	1
над ним неумолимое находка	1	1
это бахтинское малое время	1	1
единстве жизни этих троих	1	1
и отражения в образах	1	1
русской поэзии советского периода	1	1
автор отныне несет ответственность	1	1
о бахтинской концепции интерсубъективной	1	1
имя и званье на	1	1
пишет стихотворение владимир ильич	1	1
жизнь как такую же	1	1
не хуже вас не	1	1
на долю которых и	1	1
мастеров художественного ремесла к	1	1
мировой мысли и поэзии	1	1
сознание более не властно	1	1
всерьез озабочен духовной потребностью	1	1
функционирования это бахтинское малое	1	1
надолго сохраните на таких	1	1
читателе делающем от политбюро	1	1
время современность ближайшее прошлое	1	1
утопического грядущего це ка	1	1
на лестнице колючей разговора	1	1
иду я в путь	1	1
читателя советчика врача на	1	1
эпохального эссе элиота традиция	1	1
доверие к самодвижению саморазвитию	1	1
авангардистской книге о рабле	1	1
этом с авангардистом одновременно	1	1
диктата со стороны какого	1	1
близости которая в психологии	1	1
клеточками коллективного мозга на	1	1
тесной близости которая в	1	1
отвлечены текущими частностями артистического	1	1
направить душевную жизнь читателя	1	1
ним неумолимое находка для	1	1
исторической поэтики особое место	1	1
це ка ка идущих	1	1
могу стать самим собою	1	1
во взаимоотражении во взаимоприятии	1	1
до нобелевской лекции бродского	2	1
с пролетариатом той тесной	1	1
межличностную ценность и никакое	1	1
органической связи с пролетариатом	1	1
большого времени тогда как	1	1
призвания и за их	1	1
то что было его	1	1
мире свобода без ответственности	1	1
бахтиным для печати были	1	1
позабыть свое имя и	1	1
доклад о работе стихов	1	1
может быть вообще индивидуальным	1	1
индивидуалом и привести мастеров	1	1
разговор писателя с читателем	1	1
на литер на кличку	1	1
в начале х годов	1	3
связи с пролетариатом той	1	1
мертвого у каждого смысла	1	1
их именно теми клеточками	1	1
со стороны какого бы	1	1
культурной политики в области	1	1
не властно над ним	1	1
мозгах она как на	1	1
не монолог но разговор	1	1
рассчитанного обычно на определенный	1	1
нобелевской лекции бродского научным	1	1
опальный стих не знающий	1	1
свою звонкую силу поэта	1	1
стороны какого бы то	1	1
в путь никем не	1	1
однако отыскав опальный стих	1	1
круг лиц свой народ	1	1
лестнице колючей разговора б	1	1
обойтись без другого не	1	1
за художником право на	1	1
ка идущих светлых лет	1	1
особое место в этом	1	1
классовый читатель понимает ведущий	1	1
сталинский краткий курс истории	1	1
со всеми сообща и	1	1
кем посоветоваться он ищет	1	1
быть другим никто его	1	1
теперь эта частность оказывается	1	1
сообща и заодно с	1	1
исследования в области исторической	1	1
верховном читателе делающем от	1	1
русло однако отыскав опальный	1	1
которых и выпадает функция	1	1
по порядку шаг который	1	1
понимает ведущий класс и	1	1
теорию деклассированной революционной интеллигенции	1	1
безоглядно или направить душевную	1	1
или стихотворение не монолог	1	1
текущими частностями артистического призвания	1	1
неотрадиционалист будучи всерьез озабочен	1	1
дискурс не диалога но	1	1
главную задачу социалистической культурной	1	1
заложник у времени в	1	1
порядку шаг который предстоит	1	1
не с кем посоветоваться	1	1
быть вообще индивидуальным делом	1	1
социалистической культурной политики в	1	1
и таинственно-непостижимым образом связанному	1	1
в полном соответствии с	1	2
бы противопоставление на ''ты''	1	1
о сталине верховном читателе	1	1
в то же время	9	7
я в путь никем	1	1
ценность и никакое другое	1	1
к самодвижению саморазвитию жизни	1	1
один из ведущих мотивов	1	1
состоит в том чтобы	1	1
психологии их устранила бы	1	1
который предстоит ей сделать	1	1
аудитории и кардинально расходясь	1	1
же самое можно сказать	1	1
погасших я оборванный полет	1	1
захвата рассчитанного обычно на	1	1
но явной или подразумеваемой	1	1
с кем посоветоваться он	1	1
новым политическим условиям становления	1	1
где карнавализация трактуется как	1	1
суматоха перемен и перестановок	1	1
традиция и индивидуальный талант	1	1
уже о сталине верховном	1	1
интерсубъективной творческой памяти жанра	1	1
бахтинского интеллектуального наследия как	1	1
их устранила бы противопоставление	1	1
печати были нет ничего	1	1
мышления и отражения в	1	1
поэзии и то что	1	1
менталитета искусство не может	1	1
роста пишет стихотворение владимир	1	1
кардинально расходясь в этом	1	1
стать самим собою без	1	1
лиц свой народ свой	1	1
такой стих а не	1	1
несет ответственность за открывшуюся	1	1
сохраните на таких мозгах	1	1
между я и ты	1	1
и званье на номер	1	1
контрольная комиссия утопического грядущего	1	1
не могу стать самим	1	1
нужен стих таинственно-родной и	1	1
ему межличностную ценность и	1	1
время ролевого функционирования это	1	1
творческой памяти жанра слова	1	1
каждого смысла будет свой	1	1
ей предназначено в будущем	1	1
самим собою без другого	1	1
следующий по порядку шаг	1	1
можно сказать и о	1	1
в мире свобода без	1	1
хочу позабыть свое имя	1	1
нет ничего абсолютно мертвого	1	1
