жесток потому что не	1
об абсолютном то он	1
трагическое противоречие не в	1
ничего выше красоты красота	1
которую он ощутил в	1
xix века лермонтов гоголь	1
пережитой нами трагической русской	1
бытия первичные огненные энергии	1
у достоевского нет ничего	1
лишь символически отображенные моменты	1
лежит через тьму через	1
людей на людей достоевского	1
подмены зло является в	1
что без свободы нет	1
верой на свободе человеческой	1
с предметом с самим	1
рабом лишает свободы духа	1
христианскую эпоху истории древний	1
духовной глубине человек переходит	1
в глаза глубокая иррациональность	1
напрягает и накаляет окружающую	1
достоевский до глубины исследовал	1
скажете что и это	1
более зрелый духовный возраст	1
истинным православным и глашатаем	1
метод художественная наука или	1
мог бы быть ограничением	1
только дважды два четыре	1
хрустальному дворцу к утопии	1
настасьей филипповной и рогожиным	1
нем не было бы	1
добра такое принижение человека	1
мир он возвращает человеку	1
середины и открыть духовные	1
и от многих мистиков	1
ищет последней предельной свободы	1
человеке все это нужно	1
в византизме в императорской	1
свободы и свободной любви	1
кризиса религиозного перелома в	1
этого открывались или закрывались	1
бы свободы в нем	1
жизни в середине культуры	1
а не фортепианные клавиши	1
совершающейся революции духа творчество	1
свобода есть истина четвертого	1
свободы истина делает человека	1
тревожные не знающие предела	1
самом пушкине она была	1
и человеческую и по	1
столкновения и взаимоотношения людей	1
– они ищут спасения	1
была такова что ему	1
загадочной природой которая всех	1
более поздний момент чем	1
способен понять достоевского для	1
отречение от свободы человеческого	1
провести миропорядок вера на	1
к униженным и оскорбленным	1
– свободным сердцем должен	1
не истребляется злом исключительность	1
достоевский человеком из подполья	1
них идет движение ко	1
творчество письма достоевского менее	1
человека в сверхчеловеке в	1
но и таинственная вещь	1
останавливаться уже нельзя кириллов	1
истории древний мир не	1
она истощается загадка ставрогина	1
и есть что есть	1
быть рационализирована всегда остается	1
ума по силе и	1
духовной глубины человека вовне	1
исповедание веры самого достоевского	1
живому богу он был	1
сразу еще не возгорелся	1
он сам избрал себе	1
имя достоевского должно быть	1
мудрецы что человеку надо	1
его художественного дара но	1
даны человеку обладают реальностью	1
прежде всего изображал судьбу	1
также в своем созерцании	1
его мысль занята антропологией	1
для нашего брата из	1
не только в телесном	1
с той целью чтобы	1
свободе достоевский трактует динамически	1
человека перейдет в свободу	1
свобода и в свободе	1
христианского мира бунт человеческой	1
есть дитя свободы но	1
версилов иван карамазов ставрогин	1
назвать достоевского реалистом то	1
мадонны но и в	1
у него человека у	1
этими двумя свободами лежит	1
себя почвенником он дорожил	1
но если ложная свобода	1
русских творцов это очень	1
творческое явление записки из	1
вместо людей – странные	1
знал того что познали	1
выгода хотеть же можно	1
достоевского он потряс мою	1
не ответственное существо то	1
предопределении хотя в церковном	1
открываются два я самого	1
к преступлению преступление с	1
порождает сознание собственного ничтожества	1
он проповедовал царство не	1
жизни созданием человеческого благополучия	1
всю его антиномичность допускающую	1
в течение зимы года	1
это было уже новым	1
его отношением к свободе	1
самостоятельного хотения чего бы	1
зла греческая мысль допускала	1
что в свободе подпольного	1
реальны у достоевского реальна	1
быта обращенный к прошлому	1
странником по духовным мирам	1
в истине он открывается	1
насилия принудительное добро не	1
духа реально отношение человека	1
другие писатели его легче	1
и наконец лишены были	1
христа во имя христа	1
в этой божьей жажде	1
мира идей платона идеи	1
тоже ведет к отрицанию	1
и гармонии к мировому	1
трактиры с их вонью	1
пути эти пути облегчения	1
предопределения мрачное учение кальвина	1
и богочеловечества восстает образ	1
свой пагубный фантастический элемент	1
тайна вот подросток одно	1
гуманизм духовно кончился в	1
своеволия такова роковая диалектика	1
свобода привела к отрицанию	1
жизни поэтому в россии	1
пиршество мысли и те	1
это я отвечаю за	1
в человека углубил укрепил	1
чем в папской теократии	1
сохраняется человек только христианство	1
это потому что ведь	1
мира не боится уже	1
проблема бессмертия достоевский –	1
объективному извне данному космическому	1
он определяющее значение идей	1
стоять за самые суровые	1
для русского народа потому	1
пушкина но быстро угасла	1
свою противоположность разлагает и	1
уже богом бог есть	1
судьбой человека в момент	1
все разговоры в его	1
прыжок к концу противополагают	1
разрушения и хаоса никогда	1
может быть святым но	1
любил называть себя почвенником	1
в царстве этого мира	1
должен освободить себя от	1
боли о мировом спасении	1
эту вовлекает экстатический исступленный	1
достоевского есть вихревая антропология	1
там снова открылся бог	1
мире фауст есть явление	1
своим темам он был	1
сфере как отдаление в	1
демоническое начало мы увидим	1
человека вместо твердого древнего	1
не гладок этот путь	1
небывалым радикализмом отрицает историческую	1
этом близко к гоголю	1
с неблагородной или лучше	1
от гераклитова духа все	1
трагедия их есть гимн	1
ставрогин в обоих полюсах	1
гибели человеческой индивидуальности в	1
могут производить впечатление бездельников	1
в шиллера – этим	1
принижение человека такой отказ	1
характеристику его личности менее	1
свободы и это было	1
онтологии достоевского в этом	1
наказания достоевский с ненавистью	1
все религиозное миросозерцание достоевского	1
с идеала мадонны а	1
человека на свободе начинается	1
идей идеи совершенно имманентны	1
раскрывается ему в судьбе	1
сознание может показаться уклоном	1
эстетическому миросозерцанию эллинского гения	1
динамичны в идее сосредоточена	1
вырождения личности под влиянием	1
основанную на уничтожении человеческой	1
последние подпочвенные ее слои	1
иную мировую эпоху в	1
кромешную но и в	1
участия свободы мир католический	1
не может быть свободен	1
художественное разрешение идейной задачи	1
духа стремятся к превращению	1
моя подлая и слишком	1
необходимость не есть уже	1
человеку эта безмерная свобода	1
отрицаться как ставшая недоступной	1
достоевский – великий революционер	1
свободу веры как формальное	1
в самом пушкине она	1
вторгается в отношения людей	1
о духе миросозерцание достоевского	1
низвергает все ценности почему	1
из самых замечательных и	1
– род творчества не	1
концепции подростка и бесов	1
немногие лишь достигают высшей	1
творчестве достоевского совершается извержение	1
своей свободной совести в	1
шигалев – я заключаю	1
и исторического процесса в	1
момент трагического пути человека	1
все в движении все	1
в глубину духовной жизни	1
а что господа не	1
совести в этом все	1
не поддаются реалистической трактовке	1
вопрос нужно знать может	1
свободы достигает вершины в	1
же можно и против	1
точки зрения герои достоевского	1
иисусе сына божьего но	1
средней культурной жизни поэтому	1
что достоевский обнаруживает внутреннюю	1
человеческое заложено в бездонной	1
писателя как великое явление	1
его созерцаниями творчество достоевского	1
красота есть не только	1
говорит что россия есть	1
сметает все сторожевые посты	1
этой судьбой срощенной и	1
и в самом деле	1
направлен против окостенения духа	1
ставрогин – солнце вокруг	1
чувствуют значительность версилова и	1
достоевский отличается не только	1
природу бездну в боге	1
и мира материального к	1
переходит в подземелье появляется	1
в антропологическом сознании это	1
и исступлении и в	1
тема которой он отдал	1
тем что он не	1
духовному миру кончается же	1
можно рассчитать по табличке	1
человеческого духа во имя	1
достоевскому и как ни	1
истории на мгновение блеснуло	1
у достоевского он весь	1
пор это не было	1
он был очень плохой	1
унылое бедное и полуголодное	1
потрясающих по гениальности по	1
быть и речи о	1
не знает и кириллов	1
все кажется прекрасным точно	1
человеку то свобода человеческая	1
как своеволия такова роковая	1
в своем положительном религиозном	1
его муками и страданиями	1
дороже всего – говорит	1
регулирующего закона гибель их	1
самую глубину противоречий человеческой	1
что уж одна возможность	1
намечается то что окончательно	1
шекспира он не принадлежит	1
учителей церкви учение о	1
греха высшая свобода была	1
но и явление нового	1
это – одна и	1
растерзанию человеческой индивидуальности к	1
эта радость творческого избытка	1
путем верующего целостного интуитивного	1
этот дионисизм рождает трагедию	1
в которых русские мальчики	1
к человеку и сделало	1
собой он экспериментирует над	1
его мысль была занята	1
его от л толстого	1
реализма все встречи у	1
идеи играют огромную центральную	1
освещенного дневным светом новой	1
подвергает человека духовному эксперименту	1
ума это – один	1
измерение глубины этот процесс	1
прикованы у достоевского друг	1
свобода в бунте отрицается	1
всех открытий которые достоевский	1
земле людьми и сама	1
мог бы сотворить лучший	1
в себе в свободе	1
об ungrund’е человеческое сердце	1
много нового открывается у	1
остается несомненным нет возврата	1
идти до самой глубины	1
о себе и он	1
было исступленное чувство личности	1
литературы в достоевском сгущается	1
знавший достоевского говорит о	1
этого зла в мире	1
порядка и исследует судьбу	1
безудержная свобода переходит в	1
он ведет через тьму	1
мире существование зла есть	1
человеке на протяжении всего	1
нового зла но и	1
его антиномичность допускающую возможность	1
христианства для четвертых он	1
губит человека когда человек	1
ведет к пути богочеловеческому	1
человека истребления свободы его	1
красота спасет мир для	1
людей без бога заключает	1
и богословских трактатах в	1
через свободу религия достоевского	1
эпохам в которых зло	1
все запросы человека в	1
мирам и никогда не	1
достоевского по типу своему	1
достоевский изобличает внутреннюю природу	1
к католичеству и социализму	1
а на поверхности в	1
низвергают культуру и историю	1
грани поставленные человеку эта	1
удивлюсь – говорит герой	1
нельзя к великому явлению	1
что она может породить	1
обращение ко христу было	1
достоевского и ницше дальше	1
истине христовой в своем	1
– оно есть мост	1
нем нет ничего пророческого	1
в иной мир но	1
солнцу все исходит от	1
в человеческой судьбе новая	1
посты духовные дали открываются	1
своеволие ведет к злу	1
нигилизм антиномическая полярность русской	1
должен ли человек стремиться	1
эта реальная действительность может	1
и самодовольство человека находит	1
одаренность форма вносит меру	1
из подполья – если	1
добре свободы в избрании	1
свободы не прошли даром	1
необыкновенного человека скрыта загадка	1
связывает мышкина с настасьей	1
трагедии мирового процесса не	1
мышления и статического сознания	1
мои мысли о достоевском	1
по своим темам он	1
через свободу должен идти	1
от христианства феофана затворника	1
психологом хотя с психологией	1
силы человека человек почувствовал	1
подполья намечается то что	1
ни природа ни исторические	1
через тьму через чистилище	1
добра и зла сокращен	1
уже возврат к старому	1
и последняя свобода избрания	1
к истреблению свободы человека	1
душевным складом и образом	1
достоевского не занимали особенно	1
уютного гнезда помещичьих усадеб	1
достоевский с изумительной диалектической	1
гармонии будет ли она	1
что вся духовная природа	1
– выражение которое любил	1
экстатичность самой мысли дионисична	1
что господа не столкнуть	1
преступлении а не в	1
у него нет людей	1
это достоинство свободы духа	1
они ищут в нем	1
признана русской и национальной	1
делает целый ряд открытий	1
многообразие человеческого мира нет	1
божьей жажде встретить свободную	1
отношений между иваном карамазовым	1
историческая судьба оправдала прозрения	1
религии свободы духа выходит	1
достоевский исследует динамические процессы	1
влечений в нем есть	1
неба дантовского ада уже	1
совершенным обездушиванием человека и	1
к отрицанию самой идеи	1
вихрь все творчество достоевского	1
бы такого зла таких	1
совершенно новый момент в	1
невозможна еще свобода духа	1
философии религии для нравственной	1
судьбе которая есть вместе	1
быть родство с предметом	1
мире новая душа новое	1
к тем писателям которым	1
муравейнике этот процесс перерождения	1
духовной действительности о метафизической	1
нас жизнь и творения	1
постигается бог поэтому достоевского	1
она целиком захватывает человека	1
шекспир великий ум возрождения	1
быть что и вся-то	1
достоевский верил что в	1
заложено в глубине человеческой	1
зла и страдания потому	1
последние пределы гуманистического своеволия	1
фантастический элемент именно свои	1
светом христовым отрицание первой	1
никакого другого дела никакого	1
нему как к солнцу	1
жизнь возвращается человеку но	1
даром это не было	1
которой бы кажется и	1
и испытывает эти границы	1
родиной у меня была	1
есть доказательство бытия божьего	1
по сравнению с религиозным	1
же обращен к становящемуся	1
принят бог сотворивший такой	1
божественной то нет и	1
слова он уже мало	1
достоевский попытается показать в	1
уходит как бы в	1
глубинах человеческого духа не	1
повторяются в его романах	1
первая свобода которая есть	1
истине такова неотвратимая диалектика	1
дневном быте не в	1
слова великого инквизитора в	1
токами идущими от грядущего	1
социализму в этом смысл	1
существование реалистической школы гоголя	1
человека к богочеловеку и	1
идеи притягивают его он	1
рабство соблазняющиеся добродетелью есть	1
мирового процесса она закрепляет	1
дитя свободы с этим	1
свобода погибала или от	1
душевное до духовного выйти	1
не раскрывалась еще фаустовская	1
глубинах человеческого духа зло	1
он уже пришел в	1
свобода и достоевский доказывает	1
истребляет себя и этим	1
и нужно их вскрыть	1
человек не исчезает в	1
христу порвал достоевский с	1
свободы достоевский начинает со	1
самой красоте нет покоя	1
в своей иррациональности в	1
россии по-иному относится к	1
утверждается образ человека лик	1
и противоположную возрождению изживающего	1
он отрицал реальность трансцендентного	1
был реалистом как и	1
и говорил свое творческое	1
человеческой индивидуальности в греции	1
свобода имеет свою самобытную	1
и незыблема как ему	1
– человеческий вопрос вопрос	1
ничего пророческого и вместе	1
постоянно разлетаются к черту	1
свободу человеческие силы но	1
отношения к человеку это	1
прахом единственно с той	1
был всегда путь революционной	1
более родственные достоевскому и	1
в жизни так пишет	1
через все муки раздвоения	1
человеку для них человек	1
