комнаты но город есть	1
этом пути человек находит	1
путями добывает себе внутренний	1
жизненная загадка о версилове	1
признать имманентистом в глубочайшем	1
и верного о нем	1
человеческого духа там должен	1
переход христианства из периода	1
это – свет христов	1
достоевский свою изумительную теодицею	1
конца узнать все что	1
внутренней духовной страстью душа	1
также что без свободы	1
это взяли все эти	1
тела он перестал ощущать	1
новой мировой эпохи раскрыть	1
людям так глубоко шло	1
душа получает новое огненное	1
благоразумие с одного раза	1
мира так раскрывается в	1
о человеке в судьбе	1
человек принадлежит глубине вечности	1
опять по своей глупой	1
есть город есть городские	1
чего бы это ни	1
россии не приведет к	1
избыточности ренессансного духа творят	1
нужно знать может ли	1
и сокровенный пафос его	1
творчество есть знание наука	1
говорил шваховат я в	1
всему этому положительному благоразумию	1
нормы а судьбы бытия	1
болезнь и целостный духовный	1
антропологизм достоевского – явление	1
решать этот вопрос нужно	1
он не скрыл от	1
современную душу излечить от	1
борьбе идеи у достоевского	1
понимается как материальная свобода	1
в конце и пришел	1
изображения объективного быта объективного	1
выбрасывание духовной глубины человека	1
свободой склонялся к отрицанию	1
почти все русские люди	1
как совершенно иррациональная тайна	1
душой хочет быть целителем	1
мысль должна быть насыщена	1
этому богоборчеству и мироборчеству	1
прям и не гладок	1
но в опьянении этом	1
миросозерцание достоевского не было	1
верит в бога вера	1
судьба не может не	1
и свою гибель или	1
лишь части распавшейся личности	1
и его судьбе для	1
остроте и зоркости ума	1
признать полярность самой божественной	1
и свобода человеческая истина	1
– французы – догматики	1
и это исследование открывает	1
познали что страшно свободен	1
она может породить зло	1
он был жесток потому	1
глубины этот процесс отчуждения	1
эпоху александра i быть	1
мой – н.б человек	1
достоевского означает не только	1
лишь момент трагической судьбы	1
царстве своей души и	1
в той тьме и	1
во внутреннее существо мира	1
ли удастся когда-либо ее	1
в муках город –	1
свободе его духа произошли	1
для моего религиозного мироощущения	1
нет широк человек слишком	1
наиболее интересен для западноевропейских	1
он во власти духов	1
бытие бога убийство бога	1
без основания связываются с	1
наша горькая судьба в	1
человека огромную ответственность соответствующую	1
в огненную атмосферу дионисических	1
на философские вопросы была	1
основе мира лежит свобода	1
поразительна противоположность достоевского и	1
общего имеет с жорж	1
творчестве достоевского и вот	1
экстаз у достоевского никогда	1
злой страстью или злой	1
восстает подпольный человек человек	1
и для человека в	1
и вложил очень многое	1
толстой же не умеет	1
отпал от природы оторвался	1
в недосягаемую для него	1
такова концепция центростремительного и	1
знал другое видел свет	1
личности версилова одного из	1
везде кто бы он	1
в эпоху александра i	1
не как объективный порядок	1
есть один только случай	1
недр свободной человеческой совести	1
достоевского опьяняет но в	1
не может отказаться человек	1
есть дело о ставрогине	1
себя в своем художественном	1
бог раскрывается ему в	1
криминалист исследование пределов и	1
в состоянии бурного движения	1
гуманизмом белинского если он	1
человеком когда он уже	1
и в смысле психологического	1
дьявол христа в пустыне	1
ивана карамазова свобода как	1
изображал судьбу русского скитальца	1
захваченным духом антихристианским и	1
отнятием человеческой свободы но	1
динамической точки зрения у	1
сдавлена двумя опасностями двумя	1
христа и есть свобода	1
совершенно внешние подходы мешают	1
нет мира вещей нет	1
штифтик курсив мой –	1
свобода эти бурные тревожные	1
в мире эта тема	1
только второй но и	1
люди все еще люди	1
он и гуманист то	1
вся сложность фабул вся	1
книгу о достоевском и	1
еще более становится в	1
глубине ее огненное движение	1
эпохи у которых остается	1
реальности оно менее всего	1
и вот наконец совершился	1
вину свою очень поучительно	1
часть самой истины свобода	1
всякая истинная трагедия имеет	1
настоять на своем я	1
философской антропологии для философии	1
гибель человека на пути	1
и устроения человека без	1
в свободе высшей свободе	1
в бесконечно-разнообразном человеческом царстве	1
ума против бога связан	1
подстерегает окончательное истребление свободы	1
славянофилов он по-иному относится	1
нашей критике он созерцает	1
двух свободах libеrtаs minоr	1
исследовал и постиг достоевский	1
может быть насильственно по	1
красота высший образ онтологического	1
иной высший даже сердцем	1
явление духа обозначает поворот	1
в ней совершается отречение	1
дионисического художества вовлекая в	1
ад бог и дьявол	1
о человеке после гуманистического	1
ставит границы укрепляет в	1
нет культурной среды культурной	1
духа в этом бурном	1
человеком чтобы до конца	1
а изнутри имманентно раскрывающееся	1
жизни у достоевского иной	1
состояние бурного движения он	1
один только случай только	1
пагубный фантастический элемент именно	1
достоевский с ненавистью относился	1
слово о всечеловеческом и	1
никакого навязанного благополучия тут	1
духа творчество его выражает	1
в это я отвечаю	1
он затягивает в огненную	1
может быть принята от	1
я написал книгу в	1
своем знании человеческого духа	1
именуется достоевщиной достоевский окончательно	1
и преступлении зло необъяснимо	1
мир он еще крепче	1
духу очень ранняя направленность	1
за грани благоустройства этого	1
человеческие силы но в	1
скромно говорил шваховат я	1
человека такой отказ от	1
не благоприятствует остроте и	1
только поверхность бытия но	1
– свободой в боге	1
но не имеет самостоятельного	1
человеческой бездонности чем занят	1
литературы преисполненный религиозной болью	1
литературы и литературные критики	1
стихии дионисические экстазы всегда	1
сложность фабул вся бытовая	1
сомнениями с познанием нового	1
в нем не было	1
особенно в первых своих	1
его гения была такова	1
напоминает так называемый реалистический	1
вопросе о свободе он	1
воистину горит как в	1
истина о свободе свободная	1
но ведь как говорит	1
карамазовых человек не может	1
жизни как для художника	1
не таков достоевский особенность	1
и достоевского толстой всю	1
отношении замечательно соотношение толстого	1
всего себя вложил в	1
свобода кириллова и ивана	1
земле боится оторваться от	1
отпущенным на свободу вышедшим	1
свобода божья и свобода	1
в безумии а не	1
он не был силой	1
скептики русский душевный строй	1
что человеку надо какого-то	1
ада с ужасными своими	1
и все то от	1
и достоевский проникнута этим	1
глубины во вновь раскрывающемся	1
был любил действовать так	1
свободной и эта истина	1
русское слово о всечеловеческом	1
определить почему русский человек	1
не несет в себе	1
идеи достоевского разбросанные в	1
как ставшая недоступной для	1
были быть движением во	1
глубоких недр свободной человеческой	1
но ущербная полного человека	1
низшая свобода была для	1
к которой человечество стремится	1
на поверхности в плоскостном	1
лишь с разных сторон	1
отвергнуть свободу на том	1
культуру и историю как	1
есть русское слово о	1
свобода свобода в истине	1
философии истории для философии	1
попытается показать в алеше	1
стороне художества те закрывают	1
в мир духовный и	1
в истине и добре	1
составляют глубочайшую тему романов	1
чуда тогда только вера	1
в добре бл августин	1
достоевскому о человеке? он	1
не только пытался раскрыть	1
цельности никогда не преодолевал	1
свободе – все достоинство	1
всего своего творческого пути	1
идейный писатель в платоновском	1
переходил он был человек	1
него как в бога	1
всякой идеи обрекают себя	1
конец и свою гибель	1
писателя полны уголовными процессами	1
свой путь страдания искупает	1
вне человека а внутри	1
а как христианин как	1
был заражен нигилистическим отрицанием	1
противоречивость природы версилова всех	1
решить вопрос и о	1
именем ницше после достоевского	1
о том всеобщем что	1
иррациональное начало свободы иррациональное	1
и человека если нет	1
мироощущения и миросозерцания и	1
душевной оформленности устоявшегося душевного	1
неблагообразный безобразный человек и	1
что иное как отрицание	1
достоевский весь уже в	1
конечно не толстой а	1
к гоголю особенно в	1
этим явится уже образ	1
полярность исчезает у русского	1
все его миросозерцание проникнуто	1
мальчик же я верую	1
мировая идея все это	1
своя воля бывает не	1
ставших форм жизни как	1
в своей истории апокалиптика	1
свобода свободная любовь тут	1
добродетель она не интересна	1
достоевского найти нельзя образуется	1
достоевский открывает новые миры	1
совершается искупление какой-то вины	1
но это не значит	1
наше время появилось людей	1
его понимания в период	1
психология идейная диалектика есть	1
в мире новая душа	1
в человеческой множественности не	1
те отношения и узы	1
человекобожества есть огромное различие	1
русские люди историческому и	1
жизни отрывается от духовных	1
понять его духа все	1
нет людей вместо людей	1
по достоевскому и как	1
видим оргийность экстатичность самой	1
самоутверждения которые направили свою	1
французскую революцию совершился переход	1
он исключительно видит и	1
разителен контраст между очень	1
есть господство разума над	1
всего в высшей степени	1
занята теологией и он	1
в свою противоположность эту	1
видят а в бытийственной	1
открываемый достоевским он раскрывает	1
православный не так был	1
говорят о влиянии в	1
закалена в огне он	1
воля бывает не потому	1
можно защищать исключительно с	1
мира русского востока понять	1
что достоевский пребывает в	1
имманентной неизбежностью ведет такая	1
внешнего объяснения зла и	1
и вершины греческой философии	1
миросозерцания то что называли	1
он в ней видит	1
по отношению к нему	1
о россии от идей	1
равнопритягательность идеала мадонны и	1
антихрист его во многих	1
не свободен еще свободен	1
хаос и мрак и	1
литературы – толстой и	1
зло еще большее ибо	1
христа не заставляет верить	1
периферию душевной жизни отрывается	1
началось движение к окончательному	1
видит революцию совершающуюся в	1
оказывается что свобода перешедшая	1
мысль была занята теологией	1
в антропологии достоевского нет	1
в безумной свободе в	1
ставрогине и версилове напрягает	1
с божественным образом внутренним	1
глупой воле пожить превращения	1
русская революция совершилась в	1
которые открываются два я	1
типа раскрытие глубины человека	1
другому чтобы узнать тайну	1
с этой породой ничего	1
православия перед католичеством в	1
в своей недавно вышедшей	1
условия срывает все внешние	1
свободного принятия той истины	1
человека не может быть	1
начавшийся с безграничной свободы	1
ни с того ни	1
связано с его отношением	1
рогожиным раскольникова со свидригайловым	1
душевный мир мир человеческих	1
мира более поздний момент	1
почувствовал что спасение их	1
е формула а ведь	1
человекобожества не раскрылись еще	1
силе и остроте ума	1
вокруг загадки о человеке	1
мучительность русской литературы достигает	1
реалистической школы гоголя такого	1
его подход к достоевскому	1
огненное движение духа о	1
за зло был бы	1
его поднимается огненный вихрь	1
эвклидов ум ивана карамазова	1
нигилистов и это свойство	1
толстого быть может более	1
буйном исступленном движении в	1
более имманентного его понимания	1
во тьме дневной свет	1
великий духовидец он –	1
в своих философских и	1
ставшего достоевский более сильный	1
обоих полюсах находил совпадение	1
ли может быть счастлив	1
один из самых умных	1
и многообразный человеческий душевный	1
в добре или свобода	1
все определяется в ином	1
лишь момент судьбы ставрогина	1
чему в конце и	1
романов достоевского менее всего	1
писателей – с бальзаком	1
очень отличный от мира	1
диалектике отрицает и сам	1
любви к тленным и	1
все сдвигается со своих	1
закалена в горниле сомнений	1
или облегчен этот путь	1
из подполья начинается гениальная	1
духовный возраст и христианская	1
мире лишь в христианскую	1
свобода подпольный человек хочет	1
глубокое чтение достоевского есть	1
душ пронизанных токами апокалиптической	1
к этому богоборчеству и	1
губит человека истребляет его	1
религиозным опытом в котором	1
иерархический организм не был	1
воле пожить курсив мой	1
в иной в более	1
к нему все есть	1
со свободой не существует	1
достоевский принадлежит к тем	1
затворника и потому старцы	1
граней личности у достоевского	1
куда вечно спешит не	1
жизнь идей он –	1
что ведь все дело-то	1
в романах достоевского иная	1
красота перенести я притом	1
века забредшего в россию	1
материально он ни с	1
иерархически организованного космоса бесконечное	1
нашего рассудка о выгодах	1
свободу как свободу формальную	1
сказать что дневник писателя	1
жизни ему раскрывается бесконечность	1
мир всегда вторгается в	1
ли какое угодно преступление	1
к грядущему и вместе	1
в иную мировую эпоху	1
познали достоевский и ницше	1
и свободное хотение свой	1
революционер духа он весь	1
образ но та содержательная	1
очень мною ценимый нельзя	1
чем знал ницше но	1
других истин не терпит	1
путей принуждения и насилия	1
примириться с тем что	1
к достоевскому но в	1
центре его антропологического сознания	1
спасение их было в	1
mаjоr низшая свобода была	1
бога есть убийство человека	1
человеческого свобода совести входит	1
с тем он утверждал	1
благоустройства этого мира так	1
не изменило еще коренным	1
свободы трудности разрешить ее	1
достоевским что-то от его	1
обогатил эту веру и	1
такой гармонии через свободу	1
начали слышаться подземные удары	1
ренессансной эпохи оказались исчерпанными	1
бесконечность сострадания с какой-то	1
раскрыть себя в своем	1
пределы и границы отсюда	1
истребление свободы то и	1
нужно сказать что дневник	1
бого-человека через всю жизнь	1
нигилистический бунт сметает все	1
глава i духовный образ	1
в бесах распадение необыкновенной	1
бы признать полярность самой	1
на своем я верю	1
и страдальческую судьбу наконец	1
в человеке – загадка	1
жизни их чувств и	1
из подполья – идея	1
его творчества говорят о	1
явление константина леонтьева по	1
в обществе всегда остается	1
человеческая природа никогда не	1
и его особая атмосфера	1
открылся путь ко христу	1
работу народа творчество культурных	1
на которой хотел достоевский	1
менее реалистичны отношения ивана	1
среды в гневе достоевского	1
в глубину человека этой	1
реалистом? прежде чем решать	1
к духовному опыту возвращение	1
знающие предела стремления это	1
бремя и страдание и	1
человека на пути человекобожества	1
в этом скрыта тайна	1
совершился переход от безграничной	1
и возрождающая энергия мир	1
одной этой беспрерывности процесса	1
из закрытого измерения глубины	1
сознание собственного ничтожества бессилия	1
