между добром и злом	2
в человеческом сердце в	2
беспорочные годы нет широк	1
созерцает божественный покой красоты	1
сердце в самой первооснове	1
героев достоевского и достигает	1
а поле битвы сердца	1
отбрасывать его оставаясь бессильным	1
я бы сузил все	1
ее платоновскую идею он	1
стремился к победе над	1
пережил его познал тайну	1
раскрыл свое учение о	1
раздвоение отщепенство никогда не	1
он хотел что-то сделать	1
высшему красоте если бы	1
божественной природы он приоткрывает	1
его в благородный металл	1
душе видят не те	1
ко злу но есть	1
в борьбе со злом	1
просто грехом это для	1
темное начало в самой	1
же полярность идет до	1
одна из сторон его	1
вовне зло было для	1
отрицает и идеалы мадонны	1
богатого и бесконечно сложного	1
внутренней свободы в отношении	1
красоты ее платоновскую идею	1
в призрачном бытии отбросов	1
герои достоевского он сам	1
у него в адское	1
до глубины антиномическое отношение	1
его огненной любви к	1
и эта полярность порождает	1
тьме это глубоко мистический	1
тайну зла в этом	1
него сердце его и	1
она присуща самому высшему	1
идеала мадонского и идеала	1
те которые заглянули в	1
через человека через широкую	1
в самую глубину как	1
для него также путь	1
сферу непознаваемого не выбрасывал	1
о боге то он	1
достоевского и достигает зрелости	1
уста своих героев свои	1
достоевскому противоречивой двоящейся страшной	1
добром и злом в	1
боятся заглянуть в бездну	1
горело у него в	1
бы сузил все герои	1
различием между добром и	1
есть просто борьба добра	1
это глубоко мистический мотив	1
антропологию достоевский был антиплатоником	1
сторон его бесконечно богатого	1
есть не только страшная	1
к победе над злом	1
божественное бытие и этим	1
как и в юные	1
в самой божественной природе	1
выбрасывал его вовне зло	1
ужасной он не созерцает	1
злу он всегда хотел	1
знанием зла получил возможность	1
и злом периферично огненная	1
со злом претворить его	1
покой единство в человеческом	1
антропологии достоевского различие между	1
вот оказывается что красота	1
свои через развитие героев	1
вещь тут дьявол с	1
внешней тьме это глубоко	1
самую глубину как достоевский	1
движение не допускает покоя	1
божественной природе яростное и	1
между божеским и дьявольским	1
над его темной стихией	1
просто борьба добра со	1
был гностиком он не	1
идеала содомского это не	1
отсюда вечное беспокойство красота	1
и идеалы мадонны и	1
широк я бы сузил	1
в этом он был	1
что для достоевского человеческое	1
человека через широкую слишком	1
бытия она присуща самому	1
этом он был гностиком	1
движение ее полярность красота	1
человека и всякий кто	1
заглянуть в бездну и	1
противоречивую вечно движущуюся природу	1
спасти представлялась достоевскому противоречивой	1
во внешней тьме это	1
самому высшему красоте если	1
двоящейся страшной ужасной он	1
противопоставляет им элементарных истин	1
и он всегда влагает	1
тайну раздвоения получил знание	1
ивана карамазова не противопоставляет	1
через свою гениальную антропологию	1
в сферу непознаваемого не	1
дьявольским не совпадает у	1
тайна антропологии достоевского различие	1
для достоевского человеческое сердце	1
беспокойство красота есть не	1
сложного духа и он	1
зло т.е подлинно его	1
к злу он всегда	1
а те которые боятся	1
претворить его в благородный	1
идеалы мадонны и горит	1
покоя покой единство в	1
сердца его огненной любви	1
видят не те которые	1
вихревое движение ее полярность	1
и остаются на поверхности	1
слишком широкую таинственную противоречивую	1
злу но есть у	1
отношении ко злу но	1
изнутри а не внешне	1
к человеку и христу	1
добра со злом в	1
адское огне он страстно	1
сердце его и воистину	1
бездну и остаются на	1
и горит от него	1
достоевского он сам одна	1
также путь он не	1
которые заглянули в самую	1
в человеческой душе видят	1
боге то он должен	1
из сторон его бесконечно	1
равной притягательности двух противоположных	1
видит до самого конца	1
у достоевского с обычным	1
только страшная но и	1
внешне лишь бежать от	1
в космосе в божественном	1
также и путь человека	1
бы признать двойственность в	1
не созерцает красоты в	1
бессильным над его темной	1
лишь через человека через	1
мир спасти представлялась достоевскому	1
оружием знанием зла получил	1
о равной притягательности двух	1
поверхности у достоевского было	1
преодолено и побеждено но	1
раздвоения получил знание противоположностей	1
не совпадает у достоевского	1
последней глубины ее огненное	1
для достоевского просто грехом	1
у достоевского было до	1
дмитрия и ивана карамазова	1
зрелости внутренней свободы в	1
противоречивой двоящейся страшной ужасной	1
и ставрогин говорит о	1
даже широк я бы	1
развитие героев достоевского и	1
человек совершает путь свои	1
самой первооснове своей полярно	1
а не внешне лишь	1
и этим спасти зло	1
вооружился в борьбе со	1
и вот оказывается что	1
призрачном бытии отбросов путей	1
познать тайну зла в	1
получил знание противоположностей вооружился	1
бежать от него и	1
могущественным оружием знанием зла	1
человеку и христу отпадение	1
идет до самой глубины	1
природе яростное и темное	1
победе над злом но	1
божеским и дьявольским не	1
гениальную антропологию достоевский был	1
не отодвигал зла в	1
до самого конца до	1
грехом это для него	1
достоевского выделение двойников обратных	1
что она должна мир	1
дьявол с богом борется	1
его вовне зло было	1
добром и злом периферично	1
достоевский а те которые	1
допускает покоя покой единство	1
обогащает дает знание зло	1
зло также и путь	1
достоевский был антиплатоником и	1
его бесконечно богатого и	1
которые боятся заглянуть в	1
это для него также	1
антиплатоником и ставрогин говорит	1
оно дает обогащающий опыт	1
хотел что-то сделать со	1
в другом месте говорится	1
зла в сферу непознаваемого	1
катехизиса зло должно быть	1
знание зло также и	1
сузил все герои достоевского	1
не внешне лишь бежать	1
он видит до самого	1
слишком даже широк я	1
самой божественной природе яростное	1
в раздвоении многое открывается	1
и злом в этом	1
с идеалом содомским в	1
зла получил возможность преодолеть	1
человека он не созерцает	1
достоевского различие между добром	1
всегда влагает в уста	1
злом новым могущественным оружием	1
с богом борется а	1
различие между божеским и	1
красоте если бы достоевский	1
свои собственные гениальные мысли	1
обратных подобий в призрачном	1
глубины бытия она присуща	1
его изнутри а не	1
страшная но и таинственная	1
воистину воистину горит как	1
со злом новым могущественным	1
в том-то и дело	1
созерцает красоты в космосе	1
глубине божественной природы он	1
новым могущественным оружием знанием	1
не есть просто борьба	1
мысли и вот оказывается	1
от него и отбрасывать	1
не являлось для достоевского	1
дело что для достоевского	1
в отношении ко злу	1
являлось для достоевского просто	1
обогащающий опыт в раздвоении	1
в самой глубине божественной	1
путь он не читает	1
природу человека он не	1
уже с идеалом содомским	1
него злом зло горело	1
у достоевского выделение двойников	1
и отбрасывать его оставаясь	1
путь свои через развитие	1
противоположностей вооружился в борьбе	1
опыт в раздвоении многое	1
антиномическое отношение к злу	1
совершенства о которой в	1
порождает огненное движение не	1
том-то и дело что	1
читает морали над жизненной	1
лишь бежать от него	1
как достоевский а те	1
в этом тайна антропологии	1
карамазова не противопоставляет им	1
есть у достоевского выделение	1
в юные беспорочные годы	1
а кончает идеалом содомским	1
борьба добра со злом	1
раскрывается ему лишь через	1
злом претворить его в	1
морали над жизненной трагедией	1
и путь человека и	1
другом месте говорится что	1
двойников обратных подобий в	1
богом борется а поле	1
должно быть преодолено и	1
что-то сделать со злом	1
этом тайна антропологии достоевского	1
что красота высочайший образ	1
злом зло горело у	1
путь человека и всякий	1
полярно и эта полярность	1
всякий кто прошел через	1
совпадает у достоевского с	1
а не оставить во	1
достоевский раскрыл свое учение	1
воистину горит как и	1
страшнее кто уже с	1
космосе в божественном миропорядке	1
приоткрывает эту истину через	1
притягательности двух противоположных полюсов	1
оно обогащает дает знание	1
ему лишь через человека	1
и всякий кто прошел	1
был антиплатоником и ставрогин	1
кто уже с идеалом	1
он страстно стремился к	1
в божественном миропорядке отсюда	1
но и таинственная вещь	1
огненное вихревое движение ее	1
свою гениальную антропологию достоевский	1
элементарных истин катехизиса зло	1
единство в человеческом сердце	1
непознаваемого не выбрасывал его	1
мадонны и горит от	1
человеческое сердце в самой	1
победить а не оставить	1
таинственная вещь тут дьявол	1
гениальные мысли и вот	1
было для него злом	1
его темной стихией человек	1
покой красоты ее платоновскую	1
эту истину через свою	1
нет широк человек слишком	1
полюсов идеала мадонского и	1
всегда хотел познать тайну	1
идеалом содомским еще страшнее	1
сделать со злом претворить	1
над жизненной трагедией раскольникова	1
говорит о равной притягательности	1
борется а поле битвы	1
не созерцает божественный покой	1
и пережил его познал	1
любви к человеку и	1
содомским еще страшнее кто	1
человеческом сердце в том-то	1
яростное и темное начало	1
достоевском откровение его великого	1
не выбрасывал его вовне	1
оставаясь бессильным над его	1
не отрицает и идеалы	1
отщепенство никогда не являлось	1
дает знание зло также	1
глубины ее огненное вихревое	1
в благородный металл в	1
достигает зрелости внутренней свободы	1
и идеала содомского это	1
хотел познать тайну зла	1
отпадение раздвоение отщепенство никогда	1
бы достоевский раскрыл свое	1
божественный покой красоты ее	1
своей полярно и эта	1
познал тайну раздвоения получил	1
ее огненное вихревое движение	1
влагает в уста своих	1
битвы сердца людей различие	1
он приоткрывает эту истину	1
ставрогина кириллова версилова дмитрия	1
достоевского человеческое сердце в	1
в адское огне он	1
широкую таинственную противоречивую вечно	1
высочайший образ онтологического совершенства	1
это не есть просто	1
периферично огненная же полярность	1
металл в высшее божественное	1
и бесконечно сложного духа	1
им элементарных истин катехизиса	1
злом в человеческом сердце	1
и христу отпадение раздвоение	1
него и отбрасывать его	1
бесконечно сложного духа и	1
противоположных полюсов идеала мадонского	1
она должна мир спасти	1
истину через свою гениальную	1
для него злом зло	1
сам одна из сторон	1
него в адское огне	1
не допускает покоя покой	1
идею он видит до	1
обычным различием между добром	1
мистический мотив в достоевском	1
глубины антиномическое отношение к	1
миропорядке отсюда вечное беспокойство	1
природы он приоткрывает эту	1
он сам одна из	1
достоевского просто грехом это	1
собственные гениальные мысли и	1
достоевского было до глубины	1
но оно дает обогащающий	1
темной стихией человек совершает	1
представлялась достоевскому противоречивой двоящейся	1
его оставаясь бессильным над	1
достоевского и пережил его	1
гностиком он не отодвигал	1
он не созерцает божественный	1
и побеждено но оно	1
стихией человек совершает путь	1
его познал тайну раздвоения	1
борьбе со злом новым	1
свое учение о боге	1
годы нет широк человек	1
и воистину воистину горит	1
совершает путь свои через	1
кто прошел через достоевского	1
до последней глубины ее	1
должна мир спасти представлялась	1
месте говорится что она	1
спасти зло т.е подлинно	1
учение о боге то	1
страстно стремился к победе	1
и в юные беспорочные	1
великого сердца его огненной	1
и достигает зрелости внутренней	1
если бы достоевский раскрыл	1
признать двойственность в самой	1
красоты в космосе в	1
этим спасти зло т.е	1
свободы в отношении ко	1
до самой глубины бытия	1
он всегда влагает в	1
высшее божественное бытие и	1
в достоевском откровение его	1
самого конца до последней	1
в душе не отрицает	1
широкую слишком широкую таинственную	1
мадонского и идеала содомского	1
его великого сердца его	1
он не читает морали	1
прошел через достоевского и	1
он был гностиком он	1
т.е подлинно его победить	1
бытии отбросов путей развития	1
раскольникова ставрогина кириллова версилова	1
те которые боятся заглянуть	1
не читает морали над	1
христу отпадение раздвоение отщепенство	1
выделение двойников обратных подобий	1
полярность идет до самой	1
оставить во внешней тьме	1
красота есть не только	1
красота высочайший образ онтологического	1
платоновскую идею он видит	1
божественном миропорядке отсюда вечное	1
вечное беспокойство красота есть	1
красота раскрывается ему лишь	1
полярность красота раскрывается ему	1
ставрогин говорит о равной	1
широк человек слишком даже	1
самой глубины бытия она	1
благородный металл в высшее	1
таинственную противоречивую вечно движущуюся	1
человек слишком даже широк	1
горит как и в	1
о которой в другом	1
начало в самой глубине	1
содомским в душе не	1
человеческой душе видят не	1
через развитие героев достоевского	1
истин катехизиса зло должно	1
различие между добром и	1
он не отодвигал зла	1
сердце в человеческой душе	1
в бездну и остаются	1
был бы признать двойственность	1
все герои достоевского он	1
огненная же полярность идет	1
побеждено но оно дает	1
вечно движущуюся природу человека	1
и таинственная вещь тут	1
зла в этом он	1
с обычным различием между	1
страшной ужасной он не	1
не те которые заглянули	1
никогда не являлось для	1
него также путь он	1
он не созерцает красоты	1
быть преодолено и побеждено	1
многое открывается оно обогащает	1
и дьявольским не совпадает	1
полярность порождает огненное движение	1
духа и он всегда	1
эта полярность порождает огненное	1
кончает идеалом содомским еще	1
зло должно быть преодолено	1
он должен был бы	1
злом но он хотел	1
конца до последней глубины	1
говорится что она должна	1
глубоко мистический мотив в	1
раздвоении многое открывается оно	1
зло было для него	1
открывается оно обогащает дает	1
преодолеть его изнутри а	1
юные беспорочные годы нет	1
дает обогащающий опыт в	1
душе не отрицает и	1
не противопоставляет им элементарных	1
достоевского с обычным различием	1
движущуюся природу человека он	1
было до глубины антиномическое	1
знание противоположностей вооружился в	1
получил возможность преодолеть его	1
образ онтологического совершенства о	1
в уста своих героев	1
должен был бы признать	1
огненной любви к человеку	1
возможность преодолеть его изнутри	1
своих героев свои собственные	1
еще страшнее кто уже	1
двух противоположных полюсов идеала	1
через достоевского и пережил	1
но есть у достоевского	1
остаются на поверхности у	1
отношение к злу он	1
трагедией раскольникова ставрогина кириллова	1
человеческом сердце в человеческой	1
мотив в достоевском откровение	1
подлинно его победить а	1
со злом в человеческом	1
то он должен был	1
заглянули в самую глубину	1
