и исступлениях до конца	1
по темам и интересам	1
знание полученное через экстатическое	1
собой единственно для того	1
своим вихрем за все	1
преступление и наказание напоминает	1
христа поражает сходство духа	1
идеи ницше оба они	1
лишь в явлении а	1
глубокая метафизика жизни и	1
жизни алеши достоевский так	1
слишком высоко ибо конечно	1
народник но он никогда	1
совершенные из всех когда-либо	1
остается до самого дна	1
одно но и противоположное	1
есть один только случай	1
с до конца рационализированным	1
менее активна чем на	1
великий инквизитор восклицает мы	1
и иррациональной человеческой природы	1
на западе но он	1
плач дитё все это	1
страстная жажда разгадать ее	1
рассчитать по табличке и	1
с чем и постановка	1
лик человеческий не исчезнет	1
никто еще не добирался	1
проблема человека вообще и	1
экстатического знания в самом	1
и светом и он	1
вы так твердо так	1
человеку и жестокости он	1
серьезное жизненное дело людей	1
интереса к человеку у	1
стихию такой огненной страсти	1
более верен традициям и	1
человеческую природу художественно-экспериментальным методом	1
всякий страх устремленного к	1
скованность изображена в вечном	1
должен был бы признать	1
сложнее и богаче в	1
его вечный образ остается	1
величайший ум этот великий	1
уста своих героев свои	1
в виду не старую	1
новом религиозном свете в	1
менее активен в россии	1
слабых существ лишенных свободы	1
отрицает и идеалы мадонны	1
человеческие богатства большие человеческие	1
величайшей из всего написанного	1
злоупотребляли в русской религиозно-философской	1
ни с какими задачами	1
он не созерцает божественный	1
всего мира достоевский самый	1
бесах подростке и очень	1
исследования всех возможностей и	1
версилова все насыщено страстным	1
дела переменятся и мысли	1
люди убедятся что не	1
самую глубь противоречиях глубина	1
и после записок из	1
деле господа может быть	1
знанием зла получил возможность	1
вовлекает в стихию такой	1
много было среди них	1
прошедший через раздвоение он	1
него загадка о человеке	1
и все делается пресным	1
свобода и свобода человека	1
могли казаться реалистическими в	1
у него лишь бытовая	1
и начинается настоящий достоевский	1
этого мира он всегда	1
всматривавшегося в духовные дали	1
через человека достоевский таков	1
трагедий достоевского легенда о	1
отодвигал зла в сферу	1
он был до глубины	1
вздора самой неэкономической бессмыслицы	1
миллионов счастливых младенцев в	1
даже до сумасшествия вот	1
вампирическое существование v первые	1
богаче в своей глубине	1
него не умирает в	1
тогда говорил „хочу сделать	1
он хотел что-то сделать	1
достоевский раскрывает борьбу двух	1
оболочки все устойчивые формы	1
достоевского такой исключительной по-глощенности	1
всяком случае сохраняет нам	1
боятся заглянуть в бездну	1
от него и потребовал	1
падшим русское чувство ценности	1
от которой все системы	1
твоя есть хвала иисусу	1
любовь версилова к катерине	1
динамику в самой последней	1
всем теориям и утопиям	1
влачат вампирическое существование v	1
достоевского есть лишь метод	1
антропологические откровения и проблема	1
науке возможен лишь для	1
с трудом уловимых тончайших	1
как это часто случается	1
автор преступления и наказания	1
то что достоевский предвидел	1
и пр его не	1
сострадание ко всем обойденным	1
нем хочет основать счастье	1
речь о пушкине очень	1
в отношениях мужчины и	1
двойников обратных подобий в	1
не самое совершенное произведение	1
людей и он схватывал	1
истерию русского духа истерия	1
через принуждение но в	1
творчеством достоевского такой исключительной	1
уму он был посредственным	1
достижения состояния божественного кто	1
сравниться он проник в	1
битвы сердца людей различие	1
заглянуть в бездну и	1
картину счастья и успокоения	1
с чем связана единственность	1
существования они живут призрачной	1
истин катехизиса зло должно	1
пустыне искушение хлебами и	1
почему не имеет ни	1
люди записки из мертвого	1
опьянен силой своего ума	1
тайн его творчества но	1
что творчество достоевского распадается	1
возьмем любой из романов	1
антиномических ее страстях тайна	1
него совершенно исключительны и	1
своей глупой воле пожить	1
и по-новому была поставлена	1
он опьянен силой своего	1
хотел а вовсе не	1
органически осуществляемой жизни все	1
выгоднее всех выгод даже	1
рациональна в человеке заложена	1
их душевным складом с	1
себе даже и глупейшего	1
человек не в сознании	1
развивается через судьбу всех	1
притуплена в его славянофильско-почвенной	1
он был еще гуманистом	1
все-таки достоевский дает чувство	1
художественные недостатки в нем	1
тип человека явленный достоевским	1
достигает зрелости внутренней свободы	1
сердечная жизненная задача которая	1
с подчиненностью человека дисциплине	1
природы ее скрытой глубиной	1
какого-то добровольного хотения? с	1
человек мысли и действий	1
в свободе превыше всякого	1
человеку надо непременно благоразумно-выгодного	1
в самой природе огненной	1
людьми достоевский раскрывает борьбу	1
кажется и упоминать не	1
удержать за собой единственно	1
в глубине находит божественность	1
вся сложная фабула сложная	1
не страшна у него	1
б арифметика не применима	1
людей отношение человека к	1
о человеке доступ к	1
что человек от настоящего	1
старый европейский гуманизм и	1
нас образ версиловской любви	1
с душой человеческой неспособность	1
сделать людей счастливыми устроенными	1
бесконечные миры но всегда	1
очистительный огонь всех трагедий	1
бы от него и	1
в особенных откровениях о	1
сознания в этих изумительных	1
человека лик человеческий не	1
что было не по	1
бесцветны по сравнению с	1
отбрасывать его оставаясь бессильным	1
бунтовщиком разве бунтовщики могут	1
всегда связывали с аполлонизмом	1
достоевского в каждом из	1
до последней глубины ее	1
высоко ибо конечно они	1
нем слишком известны слова	1
движении на окраинах находятся	1
мистический мотив в достоевском	1
греха а в тайне	1
россии человеческая природа менее	1
и мысли и все	1
для человеческого достоинства какая	1
озарении экстатического знания в	1
другой его половиной угрызения	1
антропологии она раскрылась лишь	1
спешит почему не имеет	1
что русский человек всегда	1
михайловского жестокий талант»[] для	1
беспредельности исчезнет человек пределы	1
достоевский не боялся что	1
иррациональное в его характере	1
а не оставить во	1
прекраснодушным наивным несвободным от	1
достоевского было сострадание к	1
по силам людей а	1
явление периферии бытия толстого	1
положительных идеях и верованиях	1
сумасшествия вот это-то все	1
любой из романов достоевского	1
что интересует его лишь	1
дела он сам и	1
мир переменится и дела	1
ужасная вещь страшная потому	1
вместе живут… красота перенести	1
типа есть глубина но	1
и насмешливой физиономией упрет	1
и вот оказывается что	1
раз уже указывали на	1
единственный путь которым можно	1
версилов как и все	1
художники изображали человека и	1
а не собственно в	1
вяч иванов[] все эти	1
воистину воистину горит как	1
серьезное решают очень важные	1
переступить границу они всей	1
не только разъединяет людей	1
лишь путем отречения от	1
и рогожиным достоевский понял	1
сам вносит свои тихие	1
вокруг ставрогина и в	1
экстатический вихрь вихрь этот	1
все поражены противоречиями его	1
динамика ее как бы	1
опять по своей глупой	1
мира их написала у	1
достоевского не могут быть	1
в дневнике писателя это	1
в божественном единстве достоевский	1
чтении достоевского есть выход	1
огненная связь существует между	1
судьбу всех героев достоевского	1
сделать со злом претворить	1
кто бы он ни	1
человеческая природа менее активна	1
дозволено эта тема о	1
самом погружении в огненную	1
два пути от бога	1
развитие героев достоевского и	1
в произволе в свободе	1
карамазова достоевский раскрыл несоизмеримость	1
человеческой души он весь	1
физически и мир переменится	1
повышен у него в	1
в идиоте очень ясно	1
униженным и оскорбленным начиная	1
не могу что иной	1
экстатическое погружение человека в	1
с их душевным складом	1
стремится только и заключается	1
не хочет уступить в	1
вихрь это есть путь	1
потому это так что	1
католичества в поэме этой	1
не было бесповоротно отрицательного	1
можешь с гордостью указать	1
всегда является адвокатом человека	1
во имя твое но	1
дороже всего его свобода	1
а белого экстаз всегда	1
сильна достоевский великий мыслитель	1
когда он начинал проповедовать	1
умереть в самом начале	1
глубину этой природы там	1
не принять мира божьего	1
о его бесконечной свободе	1
любовь мити влечет к	1
успели сделаться почти банальными	1
господствующим улавливало самое главное	1
отщепенство никогда не являлось	1
поэме это поэма о	1
у л толстого человек	1
смирись гордый человек не	1
его идущих в самую	1
что бог задал одни	1
в глубь человека исключительный	1
настолько же выгодно как	1
смерти курсив мой н	1
обращение его в простое	1
сего среди всеобщего будущего	1
великого инквизитора заключает в	1
романах в публицистических статьях	1
еще тогда полторы тысячи	1
уже указывали на то	1
атмосфере и не интересна	1
то что говорит достоевский	1
подпольного человека претворились в	1
на ограниченном пространстве статьи	1
не монист он до	1
лик глубока противоположность его	1
человек решать впредь сам	1
другом вовлекаются в притягивающую	1
рода он производит свои	1
образ остается и в	1
христова с духом заратустры	1
стихии множественность у него	1
с другом вовлекаются в	1
а определить нельзя потому	1
но он хотел что-то	1
нам человека в безысходном	1
одной этой беспрерывности процесса	1
природы человеческой всего более	1
конца признает множественность ликов	1
человеке а не в	1
был необычайно богат от	1
даже преступление не уничтожает	1
методом им самим открытым	1
изображает вечные стихии человеческого	1
выгод даже и в	1
реалистическими в этих романах	1
решать впредь сам что	1
человеческой личности чем безличное	1
ногой прахом единственно с	1
страдание? может быть страдание-то	1
все новое будет богом	1
есть вражда к человеку	1
на земле особенно в	1
недостаточно подходили к ней	1
поверхности у достоевского было	1
на примере своего творчества	1
предварительного расчета все остановит	1
к благополучию и почему	1
истолкование достоевского которое сделалось	1
само по себе недостаточное	1
карамазовых в первый период	1
эти капитаны лебядкины снегиревы	1
самом достоевском и он	1
е нашу личность и	1
есть неоформленность русского духа	1
в зачаточном виде та	1
и падшим русское чувство	1
романы и не трагедии	1
человеческом сердце в том-то	1
духовную жизнь всего мира	1
v первые свои открытия	1
более всего приковывает его	1
было всего только несколько	1
людей различие между божеским	1
зрелости внутренней свободы в	1
не только откровений о	1
довершить созидаемое здание? и	1
у него в глубине	1
и других его героев	1
вместо того чтоб овладеть	1
великолепной жертвы их во	1
искушение во имя свободы	1
человека дисциплине и норме	1
должна быть не иное	1
прежде всего и больше	1
эти мудрецы что человеку	1
в уме его не	1
неблагородного людского племени с	1
метод антропологических открытий все	1
достоевском откровение его великого	1
действие все тянется к	1
человек мысли не могли	1
скажете что и это	1
влечет к катастрофе за	1
вскрывает противоречие полярность и	1
в творчестве шекспира открылась	1
больше всего в своих	1
силах заложенных в человеке	1
свободной веры а не	1
инквизитора заключает в себе	1
он во всем безмерен	1
подросток совершенный бездельник как	1
его творческого типа у	1
человеке так ставится проблема	1
только и начинается настоящий	1
он раскрывает бога и	1
жизни не есть непременно	1
также и путь человека	1
в самой божественной природе	1
и ограниченной европе и	1
единстве гете был необъятно	1
вовлечения в глубь человеческого	1
он раскрыл в русской	1
кириллова с мыслями легенды	1
потому что бог задал	1
куда спешит почему не	1
иных случаях а в	1
человеческое кажется и действительно	1
на самом дне в	1
особенное значение придавали его	1
богоподобное достоинство человека требует	1
движение в глубь человека	1
человекобог в этом разница	1
божественное бытие и этим	1
возможности для русского человека	1
на страдание человек существо	1
не допускает покоя покой	1
и богатый человеческий мир	1
и экстатичен в нем	1
этой загадке с той	1
к человеку но сам	1
темной стихией человек совершает	1
исторические памятники ни произведения	1
этот есть метод антропологических	1
созидаемое здание? и кто	1
противоположные обличья от самого	1
так человек нарочно сумасшедшим	1
умножил ее и обременил	1
поэме этой достоевский вплотную	1
германского когда германец погружается	1
путь свои через развитие	1
половиной угрызения совести ивана	1
противоречит самым здравым заключениям	1
для человека и для	1
собственное вольное и свободное	1
и особых откровений о	1
о сложной человеческой природе	1
серьезное божеское дело человек	1
арифметики когда будет одно	1
совершенно отрешиться от полемики	1
не распыляют они образ	1
пути от бога к	1
могуществом раз навсегда его	1
свободное хотение свой собственный	1
жаждал свободной веры а	1
человеческих сил выпущенных на	1
господа может быть всего	1
идея человекобога явленная кирилловым	1
критериями и требованиями нет	1
с какими задачами истории	1
бы доктринерское отношение к	1
в бытийственной бездне не	1
тема раскольникова и ивана	1
бог у него раскрывается	1
кирилловым в ее чистой	1
эта оригинальная особенность достоевского	1
быть назван в строгом	1
всегда хотел познать тайну	1
методом имманентной диалектики раскрывает	1
это непременно вообразили они	1
жизни их чувств и	1
впоследствии называть прекрасные души	1
вообще и все что	1
и русскую идею видел	1
бога раскрывает он лишь	1
могли вытерпеть того что	1
и слабые христос отверг	1
не только бога он	1
не подходит и от	1
достоевский так и не	1
и менее активен в	1
и в ее методах	1
формы все охлажденные и	1
бесповоротно отрицательного отношения к	1
для достоевского просто грехом	1
совершенно недоступен у нее	1
надо непременно благоразумно-выгодного хотения?	1
человеке и его пути	1
гениальной диалектике достоевского о	1
необъятно умен в уме	1
и ужасная вещь страшная	1
в судьбу всякого человека	1
достоевском писали люди другого	1
высокого и прекрасного тогда	1
был бы признать двойственность	1
люди а не фортепианные	1
отношением человеческим притяжением и	1
же вопрос о боге	1
возьмет свое так человек	1
вносит свои тихие экстазы	1
изображал народа исключение составляли	1
лишь ему еще близкий	1
или записок из подполья	1
собою ты не сошел	1
длинного и трагического пути	1
призрачном бытии отбросов путей	1
грехом это для него	1
самой жизни а не	1
достоевского и достигает зрелости	1
ни с чем и	1
нам опять по своей	1
ее метафизическое духовное свойство	1
в достоевском откровение его	1
же существование есть существование	1
петербурга и в душе	1
