вытесняется в непознаваемое все	1
руководстве твой образ лишь	1
есть не только страшная	1
между иваном карамазовым и	1
обращен начал гаснуть а	1
еще до конца раскрыто	1
свободой свобода стоит в	1
стихии а не дневном	1
свое собственное вольное и	1
он отвергает чудо тайну	1
интересен он исследуется н	1
система шигалева и такова	1
идеологически отрицаться как ставшая	1
нас личность вл соловьева	1
ко второй свободе свобода	1
он мог это сказать	1
воля будет когда дело	1
устойчивом быту она всегда	1
его страдальческий опыт и	1
поэтому достоевский видит революцию	1
постоянной подменой много в	1
можно изучать наше своеобразное	1
плоскостном измерении гуманизма а	1
не прообразы бытия не	1
родство у достоевского есть	1
писателям которым удалось раскрыть	1
он принужден был бы	1
вражда достоевского к социализму	1
культуры для исторического пути	1
устремлено на людей и	1
вызванные янсенизмом уклоны лютера	1
свой конец и свою	1
неизбежность прорыва за пределы	1
но своеволие и бунт	1
человеческого духа свободы человеческой	1
в измерении глубины во	1
н страхов близко знавший	1
связано было с тем	1
августин в своей борьбе	1
любовь тут примешиваются формальные	1
– о глубочайшей духовной	1
санкцию преследованию и смертной	1
свободы человека и к	1
объявить своеволие? достоевский почувствовал	1
его судьбе для достоевского	1
любящие вскрывать разного рода	1
человеке о его пути	1
привести к достоевскому но	1
в этой любви бесконечность	1
поглощены какой-нибудь идеей опьянены	1
духовный человек решает тему	1
момент судьбы ставрогина ознаменование	1
так парадоксально формулировал этот	1
быту достоевский весь уже	1
из подполья достоевский делает	1
замкнулся в свой чисто	1
всего в свободе тот	1
для него проблема бессмертия	1
свободы добра и зла	1
проповедовал царство не от	1
вдруг ни с того	1
какую судьбу претерпевает человек	1
ничего статического нет у	1
уже определяется глубокая вражда	1
от свободы предает свободу	1
и из адского пламени	1
философии он дает бесконечно	1
к человеку делает его	1
истина христова есть истина	1
захватывает человека обычно не	1
необходимости в природном порядке	1
самой глубине не покой	1
слова петра из глубины	1
нем человек занимает существенно	1
была еще под ними	1
его есть ответ на	1
к формальной стороне художества	1
фаустовские бесконечные стремления наиболее	1
душа но дух отлетел	1
его миросозерцания то что	1
толстой и достоевский но	1
учение о боге об	1
лжи но не скрывается	1
безумии и преступлении в	1
человеческой судьбе новая душа	1
опыт гуманистического периода истории	1
в нормальных и нормированных	1
подполья раскольников ставят проблемы	1
подвиг свободы из глубоких	1
системы нельзя искать у	1
иррациональность в его характере	1
– вся она в	1
есть свобода а не	1
путь русской литературы преисполненный	1
особая атмосфера комнаты и	1
и это более подлинный	1
свободы она ведет к	1
русского нигилизма но если	1
губит человека с внутренней	1
глубины исследовал апокалипсис и	1
его веры предполагает признание	1
ничего статического нет остановки	1
опыта с новыми сомнениями	1
открывается неведомый xx век	1
принуждения и насилия принудительное	1
в их преступном опыте	1
открывается в экстатически-огненной атмосфере	1
принять бога и принять	1
борется и поле битвы	1
становится трагическим писателем в	1
прямолинейностью почти плоскостью своего	1
поверхностном пласте человека за	1
идеализме германец склонен видеть	1
книжке и в европе	1
так глубоко шло у	1
эти пределы и границы	1
и часто трудно бывает	1
праве государстве нравственности искусстве	1
не могут сохранить свободу	1
революционной свободы так в	1
тому чтобы самому стать	1
и состоит чтобы человек	1
мира не есть одно	1
ад города и там	1
загадочное природа человека антиномична	1
гениальные мысли о свободе	1
художественно выражена лишь в	1
в себе свободной силы	1
хотеть же можно и	1
реалистом и в смысле	1
бремени свободы духа он	1
существования а в подсознательном	1
как произвол и своеволие	1
противостоит исключительному господству начала	1
созерцаниями творчество достоевского бесконечно	1
трагедию человеческой судьбы у	1
свободы его духа у	1
свободу зла свобода же	1
не имея передышки и	1
кружение тоже иррациональное но	1
своеволие как долг как	1
бунте и своеволии должно	1
небывалое образ человека границы	1
все это не было	1
тьма человекобожества он был	1
миром пророком которого был	1
тремя измерениями смысл же	1
его был – пафос	1
его интересовали люди исключительно	1
таков христианский путь достоевский	1
человеке все религиозное миросозерцание	1
и обогатил эту веру	1
свободой божественной то нет	1
высшим культурным слоем между	1
в одержимость она погибает	1
заложено семя смерти свобода	1
не могут быть даны	1
писателе к достоевскому нельзя	1
о свободе достоевский трактует	1
к ней в любви	1
и рабство соблазняющиеся добродетелью	1
достоевский не только ставит	1
достоевского есть настоящее пиршество	1
глубине бытия достоевскому принадлежат	1
отношение достоевского к человеку	1
позор как бессилие и	1
е от разрушения и	1
миросозерцание связанное еще тесно	1
безблагодатной святости но и	1
он не хотел видеть	1
ему бесконечности начинается гуманистическая	1
михайловский органически был не	1
душевном плане происходят бурные	1
с нею связаны вещие	1
новым человеческим опытом они	1
мира достигает белого каления	1
его духа все бездонные	1
в нем есть черты	1
удержать за собой единственно	1
человек и есть единственное	1
предшествовать такому порядку и	1
в россии так разителен	1
с новыми горизонтами и	1
исследует это начало христос	1
энергии и мощи дантовского	1
карамазов будут загадкой потому	1
греческого дионисизма но и	1
всего того что составляет	1
исключительному господству внешнего закона	1
иметь право пожелать себе	1
центральному человеку или этот	1
процесс позитивизмом агностицизмом и	1
радость творческого избытка в	1
и на поверхности своего	1
христианского сознания просвещенного светом	1
ней нужно искать и	1
бальзаком который так же	1
миропорядка против рока –	1
николаевне есть одержимость эта	1
безмерная свобода мучит человека	1
в гениальной диалектике идей	1
в иных мирах в	1
и к разложению личности	1
т е от разрушения	1
он преодолевается как стыд	1
безграничным деспотизмом таков был	1
только и состоит чтобы	1
дух а отражение социальной	1
страдание до страсти я	1
суровых наказаний более глубоко	1
религиозным антропологическим сознанием достоевского	1
достоевский был вероятно самым	1
и падшем когда достоевский	1
миры эти миры находятся	1
преступление человек переходит свои	1
достоевского иной мир всегда	1
в праве государстве нравственности	1
августин оказал влияние на	1
всякий раз когда христианский	1
беспредметной пустой она опустошает	1
строения космоса но он	1
формой пределом не видел	1
с бальзаком который так	1
неизбежность наказания за всякое	1
изобличает пагубность путей своеволия	1
этим завершается идейная диалектика	1
определяется в ином мире	1
своем своеволии и бунте	1
гармонии через свободу должен	1
впервые в гениальной диалектике	1
вера через горнило сомнений	1
идей платона идеи достоевского	1
так много зла и	1
в своей скептической рефлексии	1
возрасте знает не все	1
философских и богословских трактатах	1
сторонники суровых наказаний более	1
быть может превосходит его	1
момент глубокого духовного кризиса	1
весь в революции духа	1
меня собрать все мои	1
ведет к истреблению самой	1
с этой динамической точки	1
и вырождения личности под	1
мнит что он мог	1
этому положительному благоразумию примешать	1
должна быть не иное	1
когда он идет в	1
реальностям предметного материального мира	1
проникает в первоосновы жизни	1
во христе когда мы	1
ему как совершенно иррациональная	1
своих сомнениях в их	1
русская литература и в	1
этой породой ничего нельзя	1
и небывалое образ человека	1
первичные сущности и уж	1
смысла соизмеримого с эвклидовым	1
философствования он был настоящим	1
мити карамазова красота –	1
мыслителей я всегда делил	1
он не как язычник	1
динамита достоевский и был	1
с истиной с совершенством	1
которой человечество стремится только	1
от страстей и влечений	1
своего пути достоевскому дано	1
в ней нет ничего	1
опасности подмены зло является	1
путями своеволия те которые	1
как кризис культуры как	1
свободу духа отрицают и	1
так человек устроен и	1
дохожу всю жизнь за	1
ход всемирной истории и	1
при дневном свете сознания	1
ставрогина тайна ставрогина –	1
в духовной подпочве он	1
мыслями у которых ослабели	1
жизни в необходимости и	1
духа немецкого – немцы	1
миросозерцания если всякий гений	1
человек переходит эти пределы	1
чтении достоевского великое освобождение	1
хочет добыть свет во	1
бы облегчить муки человеческие	1
что составляет сильную сторону	1
с тем что в	1
целиком увлеченными этим вихрем	1
свободу царству необходимости они	1
мрак и проклятие так	1
своеволия и бунта подпольного	1
интересуется поистине в достоевском	1
в динамике в трагической	1
в нем скрыта тайна	1
ознаменовывает более глубокую действительность	1
в горниле сомнений достоевский	1
целиком захватывает человека обычно	1
эта мысль сверлила его	1
силен это значит что	1
– не только для	1
достоевский имел определяющее значение	1
истории в которой изживаются	1
порвал с гуманизмом белинского	1
мог бы ответить на	1
извержение подземных подпочвенных вулканов	1
достигает последних пределов напряженности	1
человеческой природы в самой	1
последствия бунтующего рационализма для	1
есть художественное разрешение идейной	1
счастливый социальный муравейник та	1
такими странными качествами? человек	1
истина делает человека свободным	1
достоевский утверждает неизбежность наказания	1
ошибается ли разум-то в	1
православным и глашатаем русской	1
вопросами достоевского каждый раз	1
и найдет свое завершение	1
и социализму как будет	1
к тому чтобы самому	1
прежде всего видит устойчивый	1
сознание старая христианская душа	1
в идее же сосредоточена	1
быту она всегда обнаруживается	1
насмешливой и ретроградной физиономией	1
в христианском мире фауст	1
духа толстой же прежде	1
открывает достоевский вулканическую природу	1
тут кириллов кириллов сознает	1
человеческой природы порождает сознание	1
последнего предела дохожу всю	1
подходы мешают увидеть свободу	1
пределах своих должны привести	1
в истине то есть	1
загадки достоевский прежде всего	1
процесса достижения иначе сказать	1
внешне регулирующего закона гибель	1
в сторону августиновского предопределения	1
против бога за этим	1
как формальное право человека	1
раз возвращался к этой	1
преступаются границы человеческой природы	1
середине апокалиптический и нигилистический	1
именно чтобы иметь право	1
вращается вокруг этой оси	1
соответствующую достоинству свободных можно	1
жорж занд в гюго	1
это сознание уже не	1
все эти логарифмы отправились	1
влиянием одержимости злой страстью	1
остальным человечеством такова система	1
почва земли была еще	1
герой из подполья –	1
этом имя достоевского должно	1
он слишком занят проведением	1
от принуждения в добре	1
от католической теократии до	1
в нем человек занимает	1
карамазова и др начинается	1
до страсти я уверен	1
раскольникова и ставрогина кириллова	1
вершина путей безблагодатной человеческой	1
человеческом царстве достоевского найти	1
есть черты безблагодатной святости	1
только бога не только	1
город пронизан человеком но	1
христос должен явиться человеку	1
достоевский никогда не достигал	1
minоr и libеrtаs mаjоr	1
и описывал достоевский есть	1
был плоть от плоти	1
большее ибо лишь свободное	1
то свобода человеческая переходит	1
о свободе они требуют	1
кроме версилова все существует	1
и скрыта воскрешающая и	1
судьбы свобода – иррациональна	1
мир в наше трехмерное	1
единственная тема бесов единственное	1
диалектика есть особый род	1
и достоевского у данте	1
это прежде всего в	1
совестью как лишение человека	1
делает человека его рабом	1
божие его любовь к	1
критика утверждала у нас	1
ума мнит что он	1
с которой нет никаких	1
в этом созерцание достоевского	1
установить что достоевский –	1
страшная но и таинственная	1
и бунт против мирового	1
инквизиторе как кошмар давила	1
быть может наиболее важен	1
сих пор это не	1
фантастические мечты свою пошлейшую	1
пожелавшего стать богом кончается	1
своем положительном миросозерцании он	1
не было отвлеченной системой	1
там вновь откроются человеку	1
человеку извне круги ада	1
версилов – один из	1
свободное существо не дух	1
он хотел бы чтобы	1
своей недавно вышедшей интересной	1
но не как объективный	1
человеком есть исступленность и	1
у достоевского чем у	1
захвачена гераклитовым током слишком	1
поверхности своей души духовная	1
страсти все совершается у	1
дорожит этой мукой и	1
этот ответ бог именно	1
все двоится для человека	1
у достоевского же до	1
истории переносятся в мир	1
раскрывалась ему через человека	1
находятся в состоянии бурного	1
вообще человеческая природа загадочна	1
должно привести к неслыханному	1
русская национальная черта такой	1
от безграничной свободы к	1
свободой эвклидов ум мог	1
воспринимает образ человека разложившимся	1
дело которым все поглощены	1
новому периоду в самом	1
для философии он дает	1
в его характере поставлена	1
религиозно серьезный характер русской	1
неотвратимый конец гуманизма эту	1
еще в одном отношении	1
принимал бога человека и	1
преступления и наказания там	1
толстой же воспринимает жизнь	1
и зоркости ума она	1
свобода тема о человеке	1
всю жизнь свою достоевский	1
нее духовному миру кончается	1
поведать в своем творчестве	1
помогающая и облегчающая благодать	1
и свободы в человеке	1
божественной оно имеет внутренний	1
христос не есть внешний	1
бездну через раздвоение через	1
действующих лиц сталкивающихся в	1
глубины творчество не было	1
вере в человека углубил	1
свет трагедия достоевского как	1
богом борется и поле	1
социальной среды и отрицания	1
вести к учению о	1
черты своего народа –	1
пониманию его миросозерцания то	1
этой позитивно-гуманитарной теории он	1
существа одаренного такими странными	1
с собой тайну своей	1
и самый дикий каприз	1
своеволие свобода безбожная не	1
основная тема достоевского так	1
в движении в противоречиях	1
замечательных и недостаточно оцененных	1
высоте его гениального художественного	1
притягивают его он хотел	1
миром обращен к свободе	1
может быть счастлив в	1
это – пророческое художество	1
и это есть серьезное	1
и не может быть	1
настоящим философом величайшим русским	1
мы видим изумительное явление	1
те которые придут к	1
извне а как встреча	1
конце пути после фауста	1
периода художник петербурга славянофилы	1
злой идеей он исследует	1
значит понять что-то очень	1
чувствовал равнопритягательность идеала мадонны	1
быта который он исключительно	1
