подобий в призрачном бытии	1
отодвигал зла в сферу	1
в самой первооснове своей	1
злом периферично огненная же	1
двойственность в самой божественной	1
на поверхности у достоевского	1
горит от него сердце	1
содомского это не есть	1
огненное движение не допускает	1
первооснове своей полярно и	1
через широкую слишком широкую	1
онтологического совершенства о которой	1
не только страшная но	1
бесконечно богатого и бесконечно	1
от него сердце его	1
но он хотел что-то	1
огне он страстно стремился	1
идеалом содомским в душе	1
зло горело у него	1
которой в другом месте	1
откровение его великого сердца	1
версилова дмитрия и ивана	1
он всегда хотел познать	1
над злом но он	1
героев свои собственные гениальные	1
сердца людей различие между	1
тут дьявол с богом	1
и дело что для	1
оказывается что красота высочайший	1
его и воистину воистину	1
жизненной трагедией раскольникова ставрогина	1
присуща самому высшему красоте	1
и темное начало в	1
ее полярность красота раскрывается	1
его победить а не	1
глубину как достоевский а	1
и ивана карамазова не	1
кириллова версилова дмитрия и	1
самой глубине божественной природы	1
бытие и этим спасти	1
в высшее божественное бытие	1
не оставить во внешней	1
сердце в том-то и	1
злом в этом тайна	1
людей различие между божеским	1
поле битвы сердца людей	1
