дионисизма мышкин ничего не	1
одни загадки тут берега	1
бытия человека где оно	1
свои антропологические исследования через	1
познал тайну раздвоения получил	1
ведь может быть человек	1
иррациональности жизни не есть	1
неизъяснимую глубину осуществленной благообразной	1
неподчиненность пределу и норме	1
можно рассчитать по табличке	1
человекобожеству у него всегда	1
даже широк я бы	1
ее человеческая личность никогда	1
охватить всего достоевского но	1
вкус к чтению других	1
в своей публицистике его	1
сознательно пожелать себе даже	1
он вечно к ней	1
имя ему будет человекобог	1
вот тема бесов то	1
ивановне к детворе и	1
раскрыться в россии в	1
и не романы и	1
сына версилова никто не	1
но и иному миру	1
различная сторона его собственного	1
наказании идиоте бесах подростке	1
это от самой пустейшей	1
объема возможностей всякой человеческой	1
в сущности русский человек	1
трагична и влечет к	1
также исчерпывается миром огненных	1
весь откровение сердца бытия	1
материальное свойство русской природы	1
того что могучие? чем	1
личности выводит он что	1
достоевского человек в благодати	1
дмитрия и ивана карамазова	1
в духовную жизнь всего	1
и против собственной выгоды	1
все написанное достоевским и	1
нигде и никогда не	1
на бесконечные возможности достоевский	1
и бессмертие раскрываются через	1
и это все можно	1
весь был в действенно-активном	1
к кириллову как к	1
и в самом деле	1
в истории достоевский раскрывает	1
вещь тут дьявол с	1
любит брать человека в	1
преодоление рационализма и раскрытие	1
еще страшнее кто уже	1
поражены противоречиями его природы	1
расчета все остановит и	1
что он человек а	1
потом очень злоупотребляли в	1
всего христу великий инквизитор	1
бесах есть самая кристальная	1
не оставить во внешней	1
а иногда и положительно	1
в романах достоевского нет	1
центральная человеческая страсть и	1
человеческой души хотя бы	1
для антропологического исследования достоевского	1
горней свободе человека о	1
и величайшее своеобразие достоевского	1
нет ничего легче как	1
все раскрывается лишь в	1
откровение христианское чем поучения	1
жизнь а в совершенно	1
более необъятного и пронизывающего	1
монист безликость круглость платона	1
рисует картину счастья и	1
человека в устойчивом строе	1
нет ничего аполлонического нет	1
в каждом из них	1
возжелал свободной любви человека	1
романы толстого самые быть	1
откровению о человеке о	1
антропология антихрист может принимать	1
человека для человеческого достоинства	1
великом инквизиторе прежде всего	1
в монизме германского типа	1
ведет процесс с богом	1
человеческого духа в глубине	1
культурного его интересовали лишь	1
человеке в человеке же	1
и дьявольским не совпадает	1
первый период когда достоевский	1
русского народа своеобразного русского	1
и обременил ее мучениями	1
грани и пределы благообразной	1
его половиной угрызения совести	1
чем и постановка темы	1
потому что неопределимая а	1
мыслители религиозного направления существенное	1
вот оказывается что красота	1
исследование над иррациональностью человеческой	1
его ты можешь с	1
гностических откровений о человеке	1
весь иван карамазов есть	1
не было дано еще	1
уме его не было	1
прочного органического места в	1
внешней эволюции в истории	1
многих мистиков и метафизиков	1
таковы свидригайлов петр верховенский	1
тою целью чтобы все	1
ними закона нормы? можно	1
достоевский же всегда видел	1
умен острота его мысли	1
„хочу сделать вас свободными“…	1
бы эта самостоятельность ни	1
из начал человеческой природы	1
зло было для него	1
кириллова версилова дмитрия и	1
форма художественного творчества это	1
и человекобог полярности человеческой	1
в том что в	1
что уж одна возможность	1
человека требует права на	1
дорожит свободой больше счастья	1
глубину страстная огненная связь	1
обогащает дает знание зло	1
всех когда-либо написанных дают	1
ума возрождения бездна ума	1
кириллову как к выразителю	1
бесчеловеческое блаженство диалектика о	1
и ивана карамазова ни	1
подчиненное внешней эволюции в	1
в котором кончился старый	1
убить себя тот бог	1
этим спасти зло т.е	1
и великолепной жертвы их	1
а не рабских восторгов	1
я отвечаю за это	1
не отодвигал зла в	1
но и там взят	1
единого человеческого лица через	1
глубины антиномическое отношение к	1
для всякого вместе не	1
он равно настолько же	1
человека связаны и величайшие	1
и остроте на примере	1
темное начало в самой	1
в глубине человеческой природы	1
не почвенность не плавание	1
достоевского к преступлению был	1
кто хочет главной свободы	1
определить отношение к ставрогину	1
без проповедей и нравоучений	1
цель на земле к	1
огненная же полярность идет	1
интерес антропологический не только	1
о вечной жизни в	1
и пределы достоевский показал	1
тайна эта скрыта в	1
так что для германца	1
все динамично все в	1
фабулы романов достоевского неправдоподобны	1
начала путь кириллова путь	1
страстно все исступленно в	1
записок из подполья чувствуется	1
достоевскому и раскрыть в	1
в этих романах нет	1
дважды два четыре есть	1
загадка о версилове о	1
чем у его героев	1
бесконечным человеческим миром все	1
раскрывал иные миры через	1
интерес достоевского к преступлению	1
любви достоевский вскрывает противоречие	1
миры через человека достоевский	1
достоевского просто грехом это	1
и этим спасти зло	1
всего прославленного прогресса в	1
в глубину эту всегда	1
в частности может быть	1
будет одно только дважды	1
искушение хлебами и на	1
это ложное отношение к	1
он не читает морали	1
заключается в одной этой	1
более подчинен нормам широк	1
карамазова версилова или кириллова	1
теократии почти банальна не	1
доходит до таблички и	1
того чтобы ко всему	1
раскрыла сама душа мира	1
потухший вулкан но тем	1
зла получил возможность преодолеть	1
ибо ничего и никогда	1
великий инквизитор хочет сделать	1
и с умом высоким	1
не в смирении смирись	1
к человеку и от	1
все это вопрос о	1
от того что человек	1
бесконечной ценности всякой человеческой	1
или лучше сказать с	1
вопросом о человеке толстой	1
читает морали над жизненной	1
от писателей-народников он художественно	1
он говорит в конце	1
он человек а не	1
все заключено в человеке	1
соединяет их сковывает по-другому	1
новое о человеке после	1
и он схватывал только	1
человеке заложена потребность в	1
о слезинке ребенка из-за	1
страдание до страсти… я	1
начало это не кириллов	1
другу разговаривают друг с	1
активна чем на западе	1
и действий ни иван	1
вихрем за все грани	1
поглощено миром человеческих страстей	1
горит от него сердце	1
слезинка ребенка плач дитё	1
огненная мысль о любви	1
человека и не страшна	1
бездны человеческой человеческой бездонности	1
не интересовали люди крепкого	1
достоевский открыл что русский	1
что человек по природе	1
одним человеком версиловым в	1
объективного изображения человеческой и	1
глубоко различие между достоевским	1
не могут и осмыслить	1
откровений о человеке он	1
это поток раскаленной лавы	1
скитальчество и странничество русские	1
никогда не изображал народа	1
поле битвы сердца людей	1
писатель города городского интеллигентного	1
души он весь откровение	1
прогресса это какое-то исступленное	1
мысль был влюблен в	1
самостоятельности человеческой природы и	1
вообразили они что человеку	1
человечнее западного человека с	1
бытия уходящая в недра	1
через очистительный огонь всех	1
и мещан в жизни	1
ограниченной европе и русскую	1
разу ногой прахом единственно	1
постоянно разлетаются к черту	1
записки из подполья и	1
никто не имеет прочного	1
дана имманентная диалектика кириллов	1
указать на этих детей	1
мировых начал христова и	1
та самая пропущенная самая	1
богом о судьбе человеческой	1
традициям и более подчинен	1
глубь он лишь явление	1
все грани и пределы	1
духом заратустры антихристово начало	1
страстная огненная связь существует	1
бытия человек не периферия	1
сходятся тут все противоречия	1
своей жизни отвергают что	1
весь состоит из противоречий	1
познавший добро и зло	1
русское чувство ценности человеческой	1
бесконечность окончательное устроение покой	1
проблема о человеке много	1
захотел поработить человека чудом	1
раскрыл полярность русского духа	1
объясняется он весь у	1
глубока противоположность его германскому	1
он должен был бы	1
крепких берегах а перелив	1
идее о человеке viii	1
и вводящей в пределы	1
через экстатическое погружение человека	1
беден в теологии но	1
совести ивана разговор с	1
существует лишь на периферии	1
видели величайшие откровения борьбу	1
ликов плюральность и сложность	1
viii почвенная идеология самого	1
бога но и человека	1
открыл трагическое противоречие и	1
через человека через широкую	1
и ницше о сверхчеловеке	1
и пережил его познал	1
открывает и изображает вечные	1
человеке о его глубине	1
и сам щадит в	1
кириллов у достоевского есть	1
европе и русскую идею	1
тайноведение достоевского в науке	1
огромное значение записок из	1
периферии бытия но достоевский	1
вот что нужно отметить	1
бесчинстве своем не могут	1
ходят друг к другу	1
художественного катарсиса они мучительны	1
с его собственным откровением	1
имеет ни минуты передышки	1
писали люди другого духовного	1
не растерзан принцип человеческой	1
тьме это глубоко мистический	1
отношение к достоевскому он	1
него раскрывается в глубине	1
достоевского духовны и потому	1
изобличителем гуманистических утопий и	1
открылась шипучая игра человеческих	1
человеческой индивидуации и совершалось	1
да неужто же и	1
великое антропологическое открытие и	1
так и против теории	1
плохо достоевского считают криминалистом	1
все чувства всякий кто	1
важное серьезное божеское дело	1
мыслях героя из подполья	1
говорит достоевский о человеке	1
католическая обстановка и обличье	1
приковывает его загадка брата	1
возникнет какой-нибудь джентльмен с	1
заратустры антихристово начало это	1
что она должна мир	1
дионисическая стихия была внечеловечна	1
человеку выгодно? не ошибается	1
достоевского легенда о великом	1
ходит то к одному	1
что в дионисическом экстазе	1
это все можно рассчитать	1
что нужно отметить что	1
в страстной и напряженной	1
последователей найдет так человек	1
до самой глубины мышкин	1
из великих художников мира	1
благоденствие человеку выгодно? не	1
человеке вообще вся сложная	1
вихревом движении на окраинах	1
и не интересна не	1
был антиплатоником и ставрогин	1
раскрывается в судьбе раскольникова	1
человека как от существа	1
в мир и идешь	1
достоевского одни записки из	1
боль и страх тот	1
как художник и как	1
достоевского ничего и нет	1
человеческий центр какая-нибудь центральная	1
огненной человеческой природы влечет	1
между двумя женщинами и	1
изображения быта нет объективного	1
монофизитство притупляет остроту мысли	1
в идиоте быть может	1
жизни реальных людей в	1
хлеб земной вдоволь для	1
мити карамазова достоевский раскрыл	1
топили остроты ума и	1
в огненную раскаленную атмосферу	1
выгодно? не ошибается ли	1
идеала мадонского и идеала	1
в человеке глубоко взятом	1
исследования через художество вовлекающее	1
переворот после которого ему	1
человеку ко всем униженным	1
из противоречий как и	1
достоевский божественные основы человека	1
внутреннего убийства по излюбленному	1
о границах поставленных человеку	1
счастливых младенцев в этой	1
нужно искать ключ к	1
свободными потому что малосильны	1
над злом но он	1
наказании ведется иначе чем	1
вертятся вихрь страстной огненной	1
одностороннее истолкование достоевского vi	1
теолог чем достоевский весь	1
природу расплавленной в огненной	1
старого гуманизма и ему	1
форма человека его вечный	1
любит разрушение и хаос	1
подошел к этому произведению	1
других тонах эта связанность	1
всех миров всей мировой	1
этого начала ведет к	1
нашу индивидуальность курсив мой	1
имеет прочного органического места	1
безвыходности у него всегда	1
божественном единстве достоевский в	1
развития эти существа не	1
строй жизни природной и	1
каким осуществлениям сразу же	1
его бесконечном достоинстве о	1
он восклицает ивану поэма	1
он всегда влагает в	1
человеческих страстей в явлениях	1
всегда утверждает бесконечную божественную	1
и характер его интересовали	1
и потому это так	1
гуманизмом с рационалистической теорией	1
образ алеши здесь нужно	1
а это было бы	1
в единстве гете был	1
и не в доктринах	1
в руководстве твой образ	1
и чем виноваты остальные	1
он весь у достоевского	1
ли дозволено т е	1
по своей глупой воле	1
как художник но он	1
заставил умереть в самом	1
тайна и он рисует	1
фантастический элемент именно свои	1
человек пределы и формы	1
совершенно исключительны и единственны	1
и дмитрия карамазова л	1
кроме раскрытия внутренней жизни	1
дел подросток хочет раскрыть	1
с ним сравниться он	1
человеческого лица через человеческую	1
мучит лишь вопрос о	1
государственности проникнуть в правду	1
и в духовном дионисизме	1
до которой никто еще	1
для своих целей к	1
стихией в русском человеке	1
нет образа человека а	1
конца рационализированным социальным устроением	1
достоевского он убивает вкус	1
к нему отношением человеческим	1
самая глубина бытия уходящая	1
все исходит от него	1
поставлена трагическая проблема о	1
предвидел идеи ницше оба	1
кем и ни с	1
в правду души но	1
миром человеческих страстей и	1
оставляет во тьме в	1
их жизни их чувств	1
монизма духа германского когда	1
огненной страсти какой нигде	1
человек существует лишь на	1
т е нашу личность	1
сказать про него что	1
можно и против собственной	1
не трагедии и никакая	1
можно было сделать людей	1
думаю чтобы то религиозное	1
душе не отрицает и	1
разум-то в выгодах? ведь	1
в божественном единстве он	1
способ раскрытия человека версилова	1
зосимы которого не случайно	1
могут быть счастливыми? и	1
отношении ко злу но	1
антрополо исследователь человеческой природы	1
осуществленной благообразной жизни алеши	1
гениально-острому уму он был	1
ни природа ни исторические	1
строя жизни как художник	1
она стала возможной лишь	1
не дозволено? можно ли	1
есть момент в гениальной	1
об антиномических ее страстях	1
достоевском и он был	1
устойчивые формы все охлажденные	1
стихии достоевский завлекает затягивает	1
противоположности и полярности которые	1
за это потому что	1
великий инквизитор говорит с	1
не исчезает его образ	1
распадается на два периода	1
до самого социалистического от	1
уже не жизнь господа	1
притяжением и отталкиванием от	1
духа как глубочайшую его	1
богат лишь в антропологии	1
в сферу непознаваемого не	1
трагична она рождает смерть	1
обнаруживал окраины человеческой природы	1
поставил выше всего вместо	1
о бесконечных силах заложенных	1
с гордостью указать на	1
хотения чего бы эта	1
совершенно исключительное чувство христа	1
невозможная натяжка слишком многое	1
свободе у л толстого	1
земле к которой человечество	1
не удивлюсь говорит герой	1
