ставрогину разгадать его характер	1
лишь один шекспир тоже	1
него лишь бытовая лишь	1
во всем безмерен он	1
открытий он не только	1
жизнеустроением вовлеченный в вихрь	1
с обычным различием между	1
назван в строгом смысле	1
к счастью к удовлетворению	1
очень злоупотребляли в русской	1
по излюбленному приему достоевского	1
он не занят строительством	1
и ее поглощение природой	1
и норме и русский	1
ведет к гибели но	1
ты умножил ее и	1
дали вл соловьев розанов	1
отличается в этом русский	1
в антропологии достоевского все	1
это не есть просто	1
природу человеческой любви и	1
только откровений о человеческой	1
добирался и не статика	1
и демонских начал раскрытие	1
идущих в самую глубь	1
о бессмертии души но	1
одинаково как против преступления	1
человеческой неспособность государственности проникнуть	1
десятки тысяч великих и	1
не есть непременно умаление	1
и острота его мысли	1
знаменательно что величайшие свои	1
он всегда брал человеческую	1
западе но он сложнее	1
почти банальна не в	1
таинственная вещь тут дьявол	1
одному ему присущее небывалое	1
же действуют исступленные экстатические	1
гениальнейших произведений достоевского в	1
установившиеся бытовые уклады мешающие	1
больше всех царств и	1
целей к загадке достоевского	1
открытий все написанное достоевским	1
кажется что версилов потухший	1
религиозного направления существенное содержание	1
раскрытых частью в братьях	1
притяжения и отталкивания никакого	1
глубины мышкин любит разной	1
заключено в человеке в	1
достоевский открыл трагическое противоречие	1
захватывающие дух антропологические трактаты	1
он придет и имя	1
еще люди а не	1
лишь вопрос о человеке	1
гениальные эксперименты над человеческой	1
идиоте бесах подростке и	1
в активных отношениях к	1
близкий ему н страхов	1
до конца рационализированным социальным	1
нравоучений в великом озарении	1
зло горело у него	1
безликой бездны в которой	1
этому художеству нельзя подходить	1
и упоминать не стоит	1
начала ведет к гибели	1
человека в беспредельности почвенное	1
в откровении о человеке	1
эти захватывающие дух антропологические	1
острота его мысли необычайна	1
внешним обличием спокойствия временами	1
достоевский делает в записках	1
злу но есть у	1
его разрываются все грани	1
думать что достоевского всю	1
для достоевского душа человеческая	1
в царстве достоевского он	1
попирание человеческого лица обращение	1
осчастливить через принуждение но	1
в нем нет такой	1
те которые боятся заглянуть	1
откажется страдание да ведь	1
подростка братьев карамазовых в	1
исступлении в творчестве его	1
исступлении каком-то вертятся вихрь	1
раньше накопившейся тьмы раскольникова	1
не штифтик курсив мой	1
творчество достоевского полно не	1
и злом в этом	1
которой мир отвергается хотя	1
не бывало эта огненная	1
человек нарочно сумасшедшим на	1
от демонических слов великого	1
после этого только и	1
лица в романах достоевского	1
жизни отвергают что все	1
всегда есть лишь движение	1
преступников а не народ	1
человека вовеки ты возжелал	1
бездонность человеческой природы но	1
в противоположности достоевский всегда	1
к человеку и христу	1
господа не столкнуть ли	1
под внешним обличием спокойствия	1
природу человека он не	1
как и все герои	1
науку о человеке доступ	1
он глубоко отличается от	1
страдание да ведь это	1
прежде всего психолог раскрывавший	1
в ходу? дважды два	1
и вложена в уста	1
отношении к человеку он	1
пределам и концам и	1
любовь эта не может	1
только и заключается в	1
человека о бесконечно высоком	1
быть выгоднее всех выгод	1
природы это два пути	1
уж одна возможность предварительного	1
и всех миров всей	1
словах дана уже в	1
ли своя воля бывает	1
быть человек любит не	1
таинственную загадочную бездонную глубину	1
людей но и соединяет	1
в своих художественных откровениях	1
наносит удар за ударом	1
и на страдание человек	1
живут… красота перенести я	1
жизни в низкой комнате	1
все-таки чувствуется что все	1
героев свои собственные гениальные	1
разгадать его характер и	1
глубине на самом дне	1
ума что сама острота	1
откровениях о христе о	1
великим антропологическим откровениям достоевского	1
старую русскую критику типическим	1
достоевского все сложнее и	1
плоти и крови все	1
и сразу же попадает	1
метод антропологических изысканий и	1
хлопочет подросток с утра	1
образ мышкина настоящее откровение	1
антихриста божественных и демонских	1
и много высказано о	1
форм достижений и ценности	1
унизительным для человека для	1
христианский писатель потому что	1
не в дневнике писателя	1
и к нему возвращается	1
сердце в человеческой душе	1
передышки и отдыха? в	1
противоположностей вооружился в борьбе	1
было бесповоротно отрицательного отношения	1
сделать вас свободными“… великий	1
уже обнаружились особенности достоевского	1
прежде всего он в	1
романов есть раскрытие человека	1
целей антропологического эксперимента все	1
гениальной метафизической поэме быть	1
принято думать что достоевского	1
двумя периодами с достоевским	1
судьбе бог у него	1
аполлонизмом у одного достоевского	1
всякий кто хочет главной	1
ко всему этому положительному	1
вокруг образа версилова все	1
разум и выгода хотеть	1
всего раскрыться в россии	1
не старую русскую критику	1
он в глубине находит	1
раскрытия единого человеческого лица	1
человеческих отношений нет такого	1
жизнеустроения семейного общественного культурного	1
бездонности в этом он	1
дело поставлена жизненная загадка	1
против преступления так и	1
великие возможности для русского	1
россии в духовную жизнь	1
покой красоты ее платоновскую	1
кроме человека ничто не	1
и до арифметики когда	1
говорит в конце я	1
о его идущих в	1
бесконечность бездонность человеческой природы	1
иррациональное я нисколько не	1
космической жизни нет вещей	1
неизъяснимую глубь человеческое царство	1
большее религиозное откровение и	1
подойти к этой загадке	1
тогда уже обнаружились особенности	1
время великий инквизитор враг	1
детей свободы свободной любви	1
ничто не может быть	1
и аглаи в подростке	1
мистической природы русского народа	1
избранных? и великий инквизитор	1
него в ранге вознесен	1
открывает нам экстазы человека	1
потребовал а это было	1
воздухе тем же методом	1
достоевский не любит брать	1
раскаленную экстатическую атмосферу людских	1
его с которой связан	1
иной высший даже сердцем	1
вихревая антропология там открывается	1
уважая человека ты поступил	1
в россии в россии	1
творчестве его видели величайшие	1
сосредоточивается действие все тянется	1
идет у него в	1
случай сделается чтобы не	1
б достоевский раскрывает несоизмеримость	1
невозможностей заложенных в человеке	1
схоронена под внешним обличием	1
художником то что пишет	1
между мышкиным и рогожиным	1
может служить статья н	1
людей счастливыми ты хочешь	1
россии заложены большие человеческие	1
злом претворить его в	1
друг с другом вовлекаются	1
достоевского художественные недостатки в	1
видеть в том что	1
достоевскому для русской души	1
и беспредельности исчезнет человек	1
самой неэкономической бессмыслицы единственно	1
опыты и эксперименты достоевский	1
в нем все подчинено	1
счастьем больше свободы высшее	1
с ницше в котором	1
богатый человеческий мир в	1
этом расплавляются и сгорают	1
все возможности уходят в	1
в смирении смирись гордый	1
таких вырванных из жизни	1
с тем что раскрыл	1
банальна не в ней	1
для тех которые будут	1
гениальными мыслями хотя и	1
аполлонического нет умеряющей и	1
быть осуществлено во внешнем	1
и все вращается кружится	1
иметь право пожелать себе	1
того чтобы сделать людей	1
отверг первое искушение во	1
человека достоевский был народник	1
не изображал народа исключение	1
самим открытым и открывает	1
по природе своей стремится	1
сам что добро и	1
и любовь мити влечет	1
прежде всего в своем	1
своей публицистике его религиозное	1
духовности есть момент в	1
он сложнее и богаче	1
метафизическое духовное свойство ее	1
существует существа эти влачат	1
гуманизм и по-новому была	1
можно подходить с разных	1
на западе но в	1
в самую глубину как	1
глубины ее огненное вихревое	1
нормам широк русский человек	1
движение в самом последнем	1
всех сделал для раскрытия	1
подполья между этими двумя	1
до конца признает множественность	1
всеми утопиями о хрустальных	1
и бесконечных возможностях достоевский	1
можно ожидать от человека	1
все же принадлежит творческому	1
совершенно новый трагический гуманизм	1
менее бы от него	1
которые успели сделаться почти	1
в душе не отрицает	1
вчитывался в эти захватывающие	1
безмерен он всегда в	1
что-то сделать со злом	1
гуманизма и ему открылся	1
раскрыл достоевский о природе	1
пафос вот с чем	1
лица обращение его в	1
по-новому была поставлена трагическая	1
за все грани разрывает	1
написанных дают такое ощущение	1
и метафизика человека достоевский	1
в тихое безумие остается	1
которое сделалось у нас	1
уж тут своя воля	1
человеческой природе тут нужна	1
не занят строительством жизни	1
главной свободы тот должен	1
ничего не хочет уступить	1
было желания прочесть мораль	1
слова подросток совершенный бездельник	1
это интерес антропологический не	1
вредного глупого даже глупейшего	1
что величайшие свои откровения	1
насыщено страстным к нему	1
бы перестав ему сострадать	1
он схватывал только их	1
полярности которые открывались его	1
вечность всегда у него	1
все почти действующие лица	1
сам щадит в строе	1
идеала содомского это не	1
глубь человеческого духа через	1
вещей и предметов все	1
на земле к которой	1
достоевского в идиоте очень	1
природы в вихревом движении	1
муж смердяков это солома	1
сходство духа христова с	1
явный вред и противоречит	1
главное в нем ту	1
и он был до	1
достоевского с иваном карамазовым	1
глубь человеческое царство которым	1
запад это раскрывает великие	1
т е каковы границы	1
он сам различная сторона	1
свобода человека дороже всего	1
художник мучителен что нет	1
достоевскому открыть что-то небывалое	1
нет кроме человека ничто	1
должно свое собственное вольное	1
и дмитрия и раньше	1
метафизиков не преходящее явление	1
мой н б это	1
случаях а в частности	1
загадка о человеке и	1
мысли в безумном божественном	1
и наказании нет ничего	1
а движение всем видима	1
всегда образуется какой-нибудь человеческий	1
нет такой напряженной страстности	1
глубины таков высший тип	1
своем художественном творчестве он	1
бога и дьявола и	1
сторон он открывает и	1
в нас образ версиловской	1
о том все ли	1
карамазова л шестов указал	1
к каким осуществлениям сразу	1
версилова никто не занимается	1
они испугались почувствовали себя	1
все его творчество антропологические	1
на то что достоевский	1
от гордых и воротился	1
достоевского с обычным различием	1
исследует человеческую природу художественно-экспериментальным	1
дано еще религиозной антропологии	1
метафизика человека достоевский был	1
и каждый может пользоваться	1
человек существо иррациональное я	1
трагедии и никакая форма	1
петр верховенский вечный муж	1
в глубине не только	1
души должна более всего	1
человека в огненную раскаленную	1
это потому что ведь	1
статика жизненных форм достижений	1
креста потому что опять-таки	1
него не исчезает человек	1
но открытия достоевского не	1
братья карамазовы самое богатое	1
отталкиванием от него рассказ	1
со злом претворить его	1
для того чтобы самому	1
земли бытовики верные почвенным	1
как у многих мистиков	1
все застывшие оболочки все	1
что малосильны порочны ничтожны	1
божий в человеке в	1
совершенно ином измерении в	1
и человеческого беснования круговращающегося	1
он всегда показывает нам	1
вл соловьева имеет черты	1
отношение человека к человеку	1
а не чудесной жаждал	1
одну особенность достоевского он	1
исчезнет человек пределы и	1
был путем угашения всякого	1
образе в нем разрешение	1
никакая форма художественного творчества	1
им элементарных истин катехизиса	1
быть никогда и свободными	1
соучастие ивана карамазова в	1
из подполья и легенда	1
художник но он и	1
которая представляется мне центральной	1
бытия человеческого сердца иисусова	1
о человеке и страстная	1
подпольной психологии и дал	1
рассудок возьмет свое так	1
судьбы принято думать что	1
уверенность что лик человеческий	1
убедятся что не могут	1
слишком широкую таинственную противоречивую	1
идеалы мадонны и горит	1
от которого ведется рассказ	1
смертным для счастья этих	1
сразу же попадает в	1
достоевского всегда есть исступление	1
он интересовался лишь отщепенцами	1
своей новой антропологии которая	1
раскрывается бесконечность и бездонность	1
плане где строится выявленная	1
его целиком захватывает и	1
в бесах нет никакого	1
о человеке и ницше	1
достоевского есть их взаимоотношения	1
судеб антиномическая двоящаяся природа	1
людского племени с земным?	1
достоевский дионисичен и экстатичен	1
от бога к человеку	1
скажет нам всем а	1
новым могущественным оружием знанием	1
они испугались стоящего над	1
высшее божественное бытие и	1
и с чего это	1
вечера куда спешит почему	1
катерине ивановне к детворе	1
человеческой природы влечет в	1
быта нет объективного изображения	1
было всего несколько в	1
действительно в том только	1
глаза что-то глубоко иррациональное	1
какой-нибудь человеческий центр какая-нибудь	1
тут своя воля будет	1
во внешней тьме это	1
поэме быть может величайшей	1
он не отодвигал зла	1
русском человеке в россии	1
столь уважая человека ты	1
которая разумеется должна быть	1
катарсиса они мучительны они	1
сил выпущенных на свободу	1
достоевский о природе русского	1
в эти захватывающие дух	1
требует права на произвол	1
достоевский полагает основание своей	1
это было у достоевского	1
богатое по содержанию обильное	1
быть страдание-то ему равно	1
загадка проблема человека вообще	1
столь страшных даров? да	1
же попадает в раскаленную	1
опытной метафизики человеческой природы	1
есть исступление человек не	1
лица через человеческую множественность	1
очень существенные достоевский делает	1
не иметь рассудка и	1
чему бы ни привела	1
мыслитель в своем художественном	1
вовлекающее в самую таинственную	1
о человеке оба прежде	1
видеть его художественное философское	1
в прикровенную форму фантазии	1
состоит чтобы человек поминутно	1
его было устремлено на	1
сострадание к человеку ко	1
ко всем униженным и	1
этой глубины интересовала его	1
достоевского все также исчерпывается	1
инквизитор враг свободы презирающий	1
не было ключа к	1
антропологи у обоих антропология	1
и обличье поэмы не	1
на свободу в эпоху	1
возможны лишь путем отречения	1
их вовсе… вместо того	1
и невозможностей заложенных в	1
в положительных идеях и	1
многое притянуто для целей	1
приему достоевского митя ставится	1
не фортепианные клавиши если	1
знания в самом погружении	1
они живут призрачной жизнью	1
человеческих отношений князь мышкин	1
