курсив мой н б	4
в преступлении и наказании	3
в записках из подполья	3
все герои достоевского он	3
о человеке о его	3
в легенде о великом	3
легенде о великом инквизиторе	3
природы но и в	2
единственно для того чтобы	2
между добром и злом	2
сказать что они испугались	2
герои достоевского он сам	2
о великом инквизиторе есть	2
можно ли сказать что	2
за грани и пределы	2
в своем художественном творчестве	2
нужно искать не в	2
легенда о великом инквизиторе	2
чем на западе но	2
и в самой глубине	2
ли сказать что они	2
человеческой природы но и	2
что же это за	2
о человеке и его	2
у него раскрывается в	2
в человеческом сердце в	2
записки из мертвого дома	2
о природе русского человека	2
никогда у него не	2
природой человеческой вообще кроме	1
в нем нет ничего	1
благоденствие? а человек иногда	1
как благоденствие? а человек	1
проблематическое и загадочное природа	1
центральной и из которой	1
души но он преодолел	1
белинского и в творчестве	1
его интересовали люди исключительно	1
интересовали лишь гениальные эксперименты	1
есть презрение к благополучию	1
злом зло горело у	1
и невозможностей человеческой природы	1
было до глубины антиномическое	1
в потоке этом расплавляются	1
душа мира их написала	1
к злу он всегда	1
о том что интересует	1
их взаимоотношения их страстные	1
но он преодолел наивные	1
оцененных творений достоевского все	1
одни записки из подполья	1
многих почти двусмысленное и	1
грани всякой темноты тот	1
одного разу ногой прахом	1
особенных откровениях о христе	1
чувств и мыслей в	1
творения шекспира полны пронизывающей	1
и завершает он эти	1
исступленное чувство человеческой личности	1
несоизмеримостью ее ни с	1
к михайловского жестокий талант»[]	1
ему еще близкий ему	1
и его судьбу есть	1
записках из подполья то	1
в тайноведение достоевского в	1
в пустыне искушение хлебами	1
людей счастливыми… человек был	1
котором кончился старый европейский	1
высшее богоподобное достоинство человека	1
бездне не покой а	1
духа неподчиненность пределу и	1
он был даже слишком	1
миллионами многочисленными как песок	1
человек раскрывается до конца	1
станет бог тогда новая	1
версилова или кириллова с	1
строе этого мира он	1
человеческий не исчезнет в	1
и в этом знак	1
же чувствуется что любовь	1
и интеллектуализма обожал мысль	1
достоевский как художник мучителен	1
и исхода выхода искали	1
писателя а в его	1
рассказ ведется от подростка	1
из мертвого дома но	1
душа что не в	1
этой стихии он исследовал	1
из бесконечного расширения объема	1
пауками чем на исчезновение	1
в духовные дали вл	1
человек и в самой	1
к пределам и окраинам	1
их природу и характер	1
связанным обязанностью желать себе	1
первые свои открытия о	1
достоевского в науке этой	1
нет ничего кроме раскрытия	1
инквизитор говорит свобода их	1
разных сторон и я	1
достоевский может быть сопоставлен	1
потому что во всяком	1
исключительное чувство христа поражает	1
раскрывается в идиоте до	1
когда дело доходит до	1
малосильны порочны ничтожны и	1
психологом был например стендаль	1
интересовался лишь отщепенцами он	1
сделалось у нас господствующим	1
где нужно искать его	1
человеческого общества невыносимее свободы	1
эксперимент в чистом горном	1
не чудесной жаждал свободной	1
ни привела в этих	1
философское и религиозное значение	1
всех трагедий достоевского легенда	1
достоевского совершенно не интересовал	1
этих романов-трагедий могли казаться	1
для него загадка о	1
и выгода хотеть же	1
ее огненное вихревое движение	1
страстности человеческих отношений нет	1
родственного другого поколения всматривавшегося	1
из образов достоевского видит	1
собственный хотя бы самый	1
но вспомни что их	1
этом он величайший в	1
в вихрь человеческих страстей	1
на исчезновение человека в	1
достоевского нет природы нет	1
художественном творчестве в своих	1
открытие? все художники изображали	1
мысль его всегда вихревая	1
сама острота ума способствует	1
дисциплине и норме и	1
свои открытия в легенде	1
общественной не интересовал эпический	1
в проповедях и не	1
противоположности в монизме германского	1
диалектика о слезинке ребенка	1
выгоды а иногда и	1
раскрытию всех противоречий и	1
не все позволено не	1
за дела что это	1
свободным сердцем должен был	1
он был гностиком он	1
ни исторические памятники ни	1
силе и остроте на	1
экспериментатор создатель опытной метафизики	1
арифметика человек существо проблематическое	1
и в положительной форме	1
сделаться почти банальными я	1
есть глубина но нет	1
в русской и всемирной	1
у него в ранге	1
была поставлена трагическая проблема	1
идею он видит до	1
в них раскрывается ошибочно	1
а в тайне человека	1
инквизитор говорит с укором	1
о человеке о границах	1
русского человека о русской	1
своих романах в публицистических	1
множества в единстве дионисическая	1
другого жизненного строительства в	1
что есть необычайного гадательного	1
занимала особенно ни природа	1
остроте на примере своего	1
это страшная и ужасная	1
своих героев свои собственные	1
есть без проповедей и	1
другом разговоре кириллов говорит	1
призвании о бесконечных силах	1
нельзя потому что бог	1
его собственного духа сложная	1
свои силы в безмерности	1
переменится физически и мир	1
все системы и теории	1
влечет к гибели ничто	1
со всей ее тьмой	1
антиномическое отношение к злу	1
природы достоевский прежде всего	1
пройденного человеком в преступлении	1
достоевский автор преступления и	1
огромном и бесконечно разнообразном	1
какое-то исступленное чувство человеческой	1
всегда показывает нам человека	1
в русском человеке в	1
ему родственного другого поколения	1
о бесконечно высоком его	1
подполья чувствуется человек познавший	1
которой недостаточно подходили к	1
нет природы нет космической	1
высшая математика в человеке	1
какого-то исступленного интереса к	1
форме открывается в этой	1
было устремлено на людей	1
образ и лик возьмем	1
внутреннее не подчиненное внешней	1
связывали с аполлонизмом у	1
уже в зачаточном виде	1
смердяков это солома их	1
природной и общественной не	1
во всечеловечности русского человека	1
великий инквизитор говорит свобода	1
апокалиптична подходит к краям	1
сложного противоречивого иррационального характера	1
полны пронизывающей остроты ума	1
вовлеченный в вихрь человеческих	1
я притом не могу	1
божеское дело человек для	1
раскрывает бога и дьявола	1
в форме поучений старца	1
идиоте очень ясно видно	1
новой науки о человеке	1
и есть вихревая антропология	1
в том случае если	1
возрождения но открытия достоевского	1
был даже слишком умен	1
высоту слезинка ребенка плач	1
говорит он придет и	1
и из которой объясняется	1
достоевского все вращается вокруг	1
не феноменальную а онтологическую	1
твердого древнего закона свободным	1
в самой последней глубине	1
антропологический эксперимент в чистом	1
в убийстве совершенном смердяковым	1
нам явный вред и	1
дважды два четыре т	1
только единое но и	1
достоевский раскрыл жуткую огненно-страстную	1
мышкин ничего не делает	1
полагает основание своей новой	1
это есть путь посвящения	1
творчество достоевского распадается на	1
его изнутри а не	1
влагает в уста своих	1
может с ним сравниться	1
в человеке в человеке	1
почувствовали себя обыкновенными людьми?	1
антропологическая диалектика достоевского ведется	1
всю жизнь более всего	1
что человеку надо какого-то	1
природы творения шекспира полны	1
исключительную динамику обнаруживал окраины	1
противоречив и антиномичен чем	1
о бессмертии и о	1
что связано у достоевского	1
судьбу всякого человека и	1
до вечера куда спешит	1
его героев его собственная	1
и остаются на поверхности	1
о которой бы кажется	1
раскрывает тут природу человеческой	1
человеческая полярна и антиномична	1
месте и в одно	1
чего же можно ожидать	1
без моей воли четыре	1
что-то глубоко иррациональное в	1
чего это взяли все	1
во внешнем строе жизни	1
доказывал себе что он	1
в одном месте и	1
вся диалектика ивана карамазова	1
на своем я верю	1
соловьев розанов мережковский волынский	1
дневнике писателя это ложное	1
влечет к гибели и	1
экстатически-огненной атмосфере достоевский открывает	1
найти нельзя всегда образуется	1
у достоевского с иваном	1
понижался идеи его упрощались	1
монизму который всегда представляет	1
бесконечно трагична и влечет	1
иррациональной человеческой природы с	1
человеческого беснования круговращающегося вокруг	1
величайшее из дел подросток	1
диалектика достоевского ведется иначе	1
художественно-экспериментальным методом им самим	1
и утонченная психология не	1
даже глупейшего а именно	1
берега сходятся тут все	1
поставленный любовью из-за судьбы	1
чтобы то религиозное истолкование	1
а именно чтобы иметь	1
глубине человека в бытийственной	1
пренебрежении миллионами многочисленными как	1
ставрогина кириллова версилова дмитрия	1
всего великие антропологи у	1
влечет в таинственную загадочную	1
любовь к настасии филипповне	1
с его стремлением к	1
раскрывается ему лишь через	1
из подполья и завершает	1
которой связан его пафос	1
не было остроты не	1
для того чтобы ко	1
его эманация выделившееся из	1
всегда и везде кто	1
природы и несоизмеримостью ее	1
человеческой любви раскрывается в	1
безграничность не только материальное	1
всего в своем художественном	1
глубину человеческой природы в	1
человек и переменится физически	1
потоке этом расплавляются и	1
и бесконечно разнообразном человеческом	1
дитё все это вопрос	1
писатель потому что в	1
в своих антропологических исследованиях	1
начале романа дальнейшее его	1
раскольникова ставрогина мышкина версилова	1
разных аспектах с разных	1
нет широк человек слишком	1
и не статика этой	1
бессмертии и был для	1
проникновение в судьбу всякого	1
она стоит больше всех	1
уже отмечали что достоевский	1
все грани и величайшее	1
зла в этом он	1
только вопрос о бессмертии	1
все это от самой	1
бы даже до сумасшествия	1
человека в свободе у	1
все это представляется ему	1
чудом и жаждал свободной	1
имеет черты родственные с	1
еще одну особенность достоевского	1
он был еще шиллер	1
нарочно сумасшедшим на этот	1
от народной почвы открывал	1
эти влачат вампирическое существование	1
в экстазе и исступлениях	1
диалектики раскрывает достоевский божественные	1
формула а ведь дважды	1
образцом которой может служить	1
не плавание в крепких	1
переживает человека а не	1
нет ничего статического все	1
над его темной стихией	1
пронизывающего проникновения в противоположности	1
и полярности которые открывались	1
человеке о границах поставленных	1
раскрыт и менее активен	1
натура и самый христианский	1
на земле она безнадежна	1
в силе и остроте	1
и напряженной атмосфере человеческой	1
от человека к богу	1
писателя это ложное отношение	1
сложная фабула сложная интрига	1
одном месте и в	1
всей ее тьмой и	1
принять мира божьего вся	1
мучит но никогда не	1
что нет у него	1
человека дороже всего христу	1
к выгоде к счастью	1
хочет уступить в этой	1
которого сосредоточивается действие все	1
богатства большие человеческие возможности	1
творении достоевского все также	1
науке этой и в	1
всего в своих художественных	1
выделившееся из него беснование	1
с вопросом о человеке	1
победит боль и страх	1
дна бытия человек не	1
еще близкий ему н	1
есть вихревая антропология там	1
но он еще не	1
человеке же действуют исступленные	1
целиком захватывает и в	1
не приходит в голову	1
огненных человеческих отношений князь	1
в процессе мити карамазова	1
свои собственные гениальные мысли	1
тайн человеческой природы достоевский	1
в глаза что-то глубоко	1
имею в виду не	1
что у него до	1
дело-то человеческое кажется и	1
в преступлении которое у	1
юные беспорочные годы нет	1
человеческой природы ее скрытой	1
глубоко отличается от всех	1
тот ослепительный обратный свет	1
только самостоятельного хотения чего	1
страстном буйном исступленном движении	1
гибели и достоевский раскрывает	1
органического строя жизни как	1
самом начале романа дальнейшее	1
все выбиты из колеи	1
быть сопоставлены ни с	1
толстовского благообразия всегда улавливающего	1
уже с идеалом содомским	1
западный человек почвеннее он	1
нем ту центральную тему	1
оригинальная особенность достоевского связана	1
не имеет прочного органического	1
статья н к михайловского	1
прекрасного тогда уже пафосом	1
единство в человеческом сердце	1
яростное и темное начало	1
природа человеческой любви раскрывается	1
иваном карамазовым она стала	1
в том плане где	1
конца раскрытие глубины человека	1
в этой поэме это	1
единое но и множественное	1
вопрос о бессмертии но	1
порочны ничтожны и бунтовщики	1
братьях карамазовых частью в	1
никаким делом никто не	1
путь кириллова путь героического	1
изысканий и открытий он	1
для его антропологических изысканий	1
не только ниже толстого	1
и для избранных? и	1
а с ним вот	1
гордостью указать на этих	1
божественного кто победит боль	1
у достоевского есть неизбежный	1
до конца никогда не	1
рациональной государственностью ни с	1
он подошел к этому	1
занд в гюго диккенса	1
и откровение христианское чем	1
насмешливой физиономией упрет руки	1
воли четыре будет такая	1
с разных сторон и	1
великий инквизитор принимает первое	1
кроме человека и человеческих	1
криминалистом по темам и	1
в этих словах дана	1
их главное у достоевского	1
о человеке вообще вся	1
вихри достоевского духовны и	1
им для своих целей	1
ум весь был в	1
никакой органически осуществляемой жизни	1
этой оси образуется вихрь	1
все заняты одним человеком	1
человеческой всего более раскрывается	1
которые открывались его гениально-острому	1
никогда не было и	1
требованиями нет ничего легче	1
сознании греха а в	1
и бунтовщики ты обещал	1
так человек устроен и	1
глубину как достоевский а	1
что любовь к настасии	1
к ставрогину разгадать его	1
сковывает по-другому в других	1
достоевскому он мучит но	1
среди них психологов каким	1
верные почвенным бытовым традициям	1
произведений достоевского в идиоте	1
пределы искусства фабулы романов	1
ему разум и выгода	1
в органической стихии множественность	1
по себе есть выход	1
и проклятие так что	1
психологов каким тонким психологом	1
человека соучастие ивана карамазова	1
а в совершенно ином	1
тот сам станет бог	1
сама душа мира их	1
бездне остается человек не	1
ее глубин и ее	1
отмечали что достоевский как	1
зачаточном виде та гениальная	1
христианский из писателей но	1
какой-нибудь джентльмен с неблагородной	1
чего это непременно вообразили	1
открытия о сложной человеческой	1
человеколюбия и человеконенавистничества огненного	1
проповеди а в прикровенную	1
занят всеми и там	1
антропологические трактаты все герои	1
оскорбленным начиная с записок	1
их не в форму	1
только одно благоденствие человеку	1
раскольников и весь иван	1
светлом выходе из тьмы	1
исследование возможностей и невозможностей	1
и всемирной литературе у	1
