переводчиком с древних языков	1
и направился в британский	1
не только искренним но	1
а живым не в	1
отцу хорошо лоран христианство	1
может получить своего объяснения	1
с ним но на	1
безусловно является магистерская защита	1
ясной форме не указал	1
из позднейших славянофилов и	1
только всякой телеологии‚ но	1
нетрудно догадаться почему вл	1
сущее всеединство и тем	1
для вл соловьева факте	1
лекций в точности неизвестно	1
зрения кризис позитивизма еще	1
против всякого формализма в	1
книги в свет приведем	1
тут никакой нравственной связи	1
древнейшее место как египетских	1
если сравнить содержание этого	1
тем самым свое радостное	1
в адрес молодого и	1
сторону симпатии общества даже	1
очевидно указывает на его	1
но он не выходил	1
н н страхов осуждает	1
раньше того в автобиографии[	1
она навсегда также стала	1
предельное возмущение диссертантом инвективы	1
под окнами кабинета моего	1
это произошло именно так	1
всегда были в порядке	1
простыню и затем эта	1
шеллинг и гегель в	1
для допущения к магистерской	1
изучению географии и моей	1
находить в них односторонние	1
мог угомониться и принимал	1
него по воскресеньям причем	1
воззрения в я цингера	1
своих детей в саровскую	1
называл вл соловьева куку	1
не по годам умна	1
м лукьянов сделал выписки	1
большим патриотом запоем читал	1
что среди тогдашних преподавателей	1
представлениями остаются навсегда и	1
и князь е н	1
начал предполагает другое и	1
будут софиями вся эта	1
шеллингом он признавал только	1
всем рассказам видно что	1
письмами самого же вл	1
истиной имеется вот у	1
вл соловьеве в этих	1
п хитрово он познакомился	1
для извлечения меня из	1
учение о магнетических токах	1
другое и одно без	1
он расстался в лет	1
приподнятый характер ввиду необычных	1
брак и расстался с	1
божественному и к материальному	1
окончании университета он написал	1
жизни и деятельности вл	1
позднейшего философствования вл соловьева	1
в году и которая	1
первый документ это письмо	1
течение всей жизни вл	1
всякие меры чтобы стать	1
зашиты диссертации в биржевых	1
задумываться и такие рассуждения	1
года покинул москву и	1
астральной силы которая осуществляется	1
сергея михайловича соловьева был	1
излагает как содержание своего	1
лондоне что же касается	1
соловьев в припадке бурного	1
и глубоко наилучшим знатоком	1
в лондон куда он	1
восторг или ужас н	1
п хитрово к этому	1
большие права в нашем	1
права конституционный монархист и	1
когда требовалось несколько подписей	1
том и часть ii	1
нами выше однако нам	1
вл соловьева за то	1
вл соловьева свое высшее	1
к толстого где бывала	1
был магистром богословия занимал	1
ег&#;› семейной жизни если	1
верования перевернуть все человеческие	1
не тут ли зародилась	1
местах тоже у разных	1
считал возможным сводить только	1
иисуса конечно могло вызвать	1
был уже в каире	1
заниматься некогда тогда мы	1
научного аппарата в–третьих наконец	1
по годам умна и	1
нет нужды бросаться в	1
с ] студенческие годы	1
но она навсегда также	1
ноября –го и марта	1
из каких&#;нибудь корыстных или	1
д юркевич тоже боролся	1
обрядам с п хитрово	1
ходить в церковь а	1
толстого биограф вл соловьева	1
первого же года совместной	1
на материально–экономическом принципе как	1
с любезного разрешения которой	1
и вот приходит страшное	1
вл соловьеву небезразлично также	1
русской государственности был настроен	1
был оставлен при университете	1
факультета чтобы он тут	1
ввиду полного непонимания тогдашними	1
современное женское имя софья	1
книги очень любил историю	1
первоклассным романистом он все&#;таки	1
мысли соловьев работал в	1
что он говорит необыкновенная	1
будущему философу было всего	1
соловьева можно считать несомненным	1
всякую мифологию и сказочность	1
это не мешало а	1
то есть сыном двоюродной	1
можно судить по тем	1
был типический нигилист шестидесятых	1
за шиворот к родителям	1
и владиславлев который раньше	1
вл соловьев чем дальше	1
разное отношение к богу	1
а толстой дочерью ее	1
же года уже на	1
этому поводу с п	1
связи с незыблемостью для	1
границу и тут же	1
который поступил в году	1
влиянию она знала как	1
было в какие&#;то года	1
он увидел что его	1
и болот причем активная	1
московского университета кроме того	1
а к толстой со	1
в я цингера»[ там	1
ближайших приятелей вл соловьева	1
софа и толстой взявши	1
мы сейчас увидим менее	1
загадочными по одним сведениям	1
жизнь она стояла для	1
мнение владиславлева о гегеле	1
мы будем называть с	1
преимуществ в сравнении с	1
журналах и газетах как	1
поскольку соловьевская концепция всеединства	1
факультете и ни с	1
н н страхову он	1
хотя и обладал тонкой	1
эти сведения приводятся нами	1
отдельно и впоследствии включенная	1
согласно характеристике лопатина он	1
до фиваиды он так	1
что их отец юрист	1
мир и только в	1
историк н и кареев	1
кризиса западной философии ни	1
почти не имели научного	1
этом достаточно говорит например	1
о непоколебимых основах последнего	1
и все естественные науки	1
диссертацией вл соловьева принадлежит	1
и с ] имеется	1
просто не участвовать в	1
вл соловьева как это	1
и представлений человек имеет	1
теоретической признавая все умственное	1
толстых обрисованная в воспоминаниях	1
на этот раз нет	1
даже восторгом при овладении	1
но мнению лесевича тоже	1
нами раньше историк отличался	1
таков был круг мистических	1
гартмана в рецензии владиславлева	1
лет было его возлюбленной	1
защитники вроде гр строганова	1
владиславлев весьма не грубо	1
у шопенгауэра на первом	1
у философа и в	1
этому времени уже имела	1
западной философии и если	1
в году он был	1
ii тогдашнему наследнику рано	1
имение пустыньку с м	1
учение париж с ]	1
метод был очень деловым	1
еще на одно обстоятельство	1
ее обнаруживает не только	1
вл соловьев по возвращении	1
весьма приподнятый характер ввиду	1
софа называли супругу а	1
мою жизнь по поводу	1
окончания университета он был	1
другой документ приводимый у	1
отрицание слепой веры наконец	1
просьбе отца вл соловьева	1
животных что приучил меня	1
разных преподавателей на одной	1
видением и что в	1
le po&#;te alexis tolstoi	1
с целью получить картину	1
треугольниками пентаграммами и тетраграммами	1
наличие у вл соловьева	1
соловьеве вызывает изучение канта	1
н чичерина как мысль	1
образом в связи со	1
три характеристики ix [	1
все это конечно дает	1
м и владиславлева спб	1
границы вл соловьев сразу	1
ведь вл соловьев вообще	1
на земле»[ лопатин л	1
но если а м	1
троицкий никак не мог	1
детьми следил он очень	1
конституционный монархист и во	1
из книги которого мы	1
позитивистов указывает на то	1
истории христианства мировое значение	1
оценке вл соловьевым шопенгауэра	1
а вывод который нам	1
вл соловьева в британском	1
права ведров сделал интересное	1
научного образования и от	1
весьма острую материалистическую направленность	1
в трогательном союзе наполняют	1
никогда не стремился ни	1
исконном славянофильстве вл соловьева	1
москве ректор университета с	1
к логицизму довольно мягко	1
достаточно скептическим если не	1
собрание сочинений философа она	1
никем не изучался произвел	1
ли работа двух таких	1
историзм в значительной мере	1
им великих истин если	1
лет опять новый духовный	1
жизни но я имею	1
намерение почему&#;то не было	1
церквей которая как известно	1
все мои сомнения и	1
замечания которое мы сейчас	1
довольно невинного содержания но	1
ему вообще выступать против	1
он так и не	1
усиленно интересовались наблюдениями над	1
не в очень скромной	1
в полной уверенности что	1
близок со своими сверстниками	1
нем с большой симпатией	1
как и рационализм не	1
особенности любил он бывать	1
в московском университете он	1
несмотря на позднейшее разочарование	1
предполагает другое и одно	1
по одной генеалогии он	1
чем с ним но	1
племянников но с п	1
связи вл соловьев вообще	1
что он интересует вас	1
первую заграничную командировку и	1
только внешнюю действительность одни	1
отличавшийся между нами физической	1
хитрово взаимности в отношении	1
горячие аплодисменты настоящая овация	1
своими сотоварищами даже выкинуть	1
диссертации так и возражения	1
которые однако от неудобства	1
светом душа засветилась а	1
–летним молодым человеком надо	1
бывать по субботам в	1
соловьева необходимо указать еще	1
в истинные порывы чистой	1
отца»[ об этом факте	1
сынка а это и	1
устроить как раз под	1
романовой особенно в годах	1
философского развития философские воззрения	1
в меру консервативен и	1
срезневский был деканом историко–филологического	1
глупейшие кощунства я тогда	1
юркевич харьков ] влияние	1
отрицал влияние на него	1
натуралистической религии она была	1
стиле умозрительного буддизма недаром	1
чистой души которые так	1
умственной экзальтацией и с	1
мы покажем ниже имел	1
страстно убежденного это был	1
религии когда толстые были	1
я в этом возрасте	1
весьма благородно и старался	1
вл соловьева в россию	1
соловьев оказался в египте	1
и необычайно проницательных методов	1
психологии ноября по этике	1
изучался произвел анализ целого	1
соловьева михаила филолога историка	1
вл соловьева всеволод соловьев	1
начал а в годах	1
и чутко относился к	1
которые позволили ему при	1
н и кареев прямо	1
как часто теперь хочется	1
авторитет митрополита филарета был	1
нас здесь интересует духовная	1
сам н г дебольский	1
в истории философии зал	1
ему после владиславлева выступали	1
обязанности и нравственный нелегкий	1
в моем существовании»[ соловьев	1
он кончил в году	1
чтобы начать работу на	1
на защите диссертации так	1
космической лазури с женским	1
давно почти в детстве	1
формы между прочим имеются	1
совете историко–филологического факультета а	1
в п федорову вл	1
а вл соловьев с	1
было свойственно а к	1
на слово но и	1
соловьевское всеединство безусловно выше	1
словом защита диссертации прошла	1
н г о высшем	1
ею гордятся впоследствии они	1
поэта но в этот	1
рационализм и эмпиризм в	1
внимательностью к духовным потребностям	1
все же характеризовался прямым	1
экспансивный весьма жадный до	1
поскольку у нас нет	1
и гегель в германии	1
по причинам которые он	1
понятие софии вл соловьев	1
н страхова еще и	1
ее название кризис западной	1
бога но скоро сделался	1
дворянства он собственно говоря	1
имеют для них значения	1
производят хорошее впечатление его	1
к толстого отличалась мягко–романтическим	1
общей философской специализации л	1
допускали ко двору все	1
молодыми чистыми силами страдание	1
сердце все мои идеалы	1
козлов а а г	1
сам вл соловьев так	1
оказала и нетрудно догадаться	1
философские начала цельного знания	1
знати даже смущался этим	1
бросил университет и стал	1
всех своих детей в	1
разум разумно доказал свою	1
о присуждении ему искомой	1
интересует здесь не м	1
в течение первого года	1
вернулся только в июне	1
преувеличивал свой юношеский материалистический	1
всецело внимание многосотенной разнокалиберной	1
необычайно темпераментную хватку мысли	1
дела надо много думать	1
разделяла увлечение мужа спиритизмом	1
вел себя в университете	1
о спиритизме вопрос об	1
в вестнике европы но	1
академическое поприще и начал	1
который окончил в году	1
напряженно–мыслительного произведения как критика	1
с м жизнь и	1
никакого материалиста в обычном	1
ними и сама с	1
на его юношеские романы	1
на нравственный очистительный процесс	1
частными мнениями с его	1
приняли все меры для	1
магистерской диссертации вся эта	1
белую простыню и затем	1
был протоиерей михаил васильевич	1
местный мужик прибежал к	1
для него тождественную основу	1
о молодом соловьеве не	1
но зато людям слишком	1
см приложение ii.] о	1
вл соловьеву? все что	1
диссертацию под названием философия	1
то мы изобретали и	1
лет с пятнадцати и	1
таинственных мономаниях летающих столах	1
в это время не	1
союзе наполняют мое жилище»[	1
вл соловьева детские годы	1
современников и от истории	1
виде вл соловьев отказался	1
мир вызывает в нас	1
о тождестве веры и	1
и ответов на них	1
выражено заветное убеждение вл	1
и почтительным сочувствием всех	1
притом декан медицинского факультета	1
совмещалась у него с	1
какие&#;нибудь сочинения религиозного содержания	1
утром он непременно присутствовал	1
в то новое качество	1
которые переживались им часто	1
факультет на физико–математическом факультете	1
разочарование последнего во вл	1
вл соловьев но это	1
затем вторая пора развитие	1
позднейшей литературе называлось вечной	1
за что зал наградил	1
себе такие представления более	1
него наплыв ежедневных дрязг	1
очень скудных а в	1
мы дети видели и	1
уже тогда был возмущен	1
том что явилось ему	1
и с позитивизмом вообще	1
происхождения всего неоплатонизма ему	1
наивностью убежденного в непременном	1
м между прочим эту	1
вл соловьев отказался от	1
например когда дачницы купались	1
но философия остается в	1
перевела его собственная жена	1
такой благородною наивностью убежденного	1
правда понимает мистицизм слишком	1
какие&#;нибудь общественные и особенно	1
соловьева шопенгауэром которое обычно	1
детском возрасте эта софья	1
притом весьма глубокого и	1
и м и владиславлев	1
года он отбыл в	1
и получившее в истории	1
можно судить хотя бы	1
конечно со своим материализмом	1
уравновешенной и гармоничной классикой	1
всей своей жизни высоко	1
его убедительности и логичности	1
глубоко и насколько давно	1
страниц и почти не	1
и потому как необходимость	1
тех же годах вл	1
м лукьянова впервые публикуются	1
натуры вл соловьева которая	1
быстро охладел но зато	1
университете но игравший там	1
для которого философия была	1
мистической духовности в атмосфере	1
–х –е изд спб	1
времен когда диссертации содержали	1
не остались без ответа	1
будет прав но этими	1
соловьев и не различает	1
брат надевал на нас	1
сам вл соловьев сделал	1
неприятна поэтому он обыкновенно	1
соловьева напечатанная тогда же	1
к счастью о возражениях	1
что добрый дедушка беседует	1
сопоставлению платона и канта	1
в нем религиозной потребности	1
философию и научно построенное	1
] первое заграничное путешествие	1
приведем и которые как	1
появилось новое основание любить	1
вл соловьева напечатанная тогда	1
том с какой страстностью	1
солдатенковым но безвременная кончина	1
что вл соловьев вел	1
россию его друзья подсмеивались	1
даже определенно врагом с	1
за пределы натуральной магии	1
прославленного в позднейшем символиста	1
и автографическими знаками у	1
его раннем детстве то	1
и остановился только на	1
отрочества и юности вл	1
здесь стала сказываться та	1
к магистерской защите сдавались	1
нам представляется ценным его	1
философские или литературные рассуждения	1
вольного самочувствия часто переступавшего	1
пережил весьма острую материалистическую	1
вл соловьева в детские	1
поколений насколько высокая культура	1
настолько принципиально что из&#;за	1
i анну иоанновну он	1
же отвлеченным началом как	1
исключительно поглощают данные им	1
деятельности ни в каком	1
