годах вл соловьева имеются	1
если об этом и	1
или природное одно из	1
и очень глубокой близости	1
выйти замуж за вл	1
как содержание своего вступительного	1
в россии и шеллинг	1
назначение в японию отношения	1
была для своего времени	1
вл соловьев определял человека	1
не только в таком	1
из обширных исторических материалов	1
в состоянии их сравнивать	1
отразились на его дон	1
новом факультете а когда	1
вообще считали возвышенный идеализм	1
г о высшем благе	1
тогдашними позитивистами ни кризиса	1
он редко и был	1
и тогда как и	1
необычайном напоре а также	1
московском университете он читал	1
принимал их как нечто	1
вл соловьев всегда питал	1
почему он после защиты	1
тот же вечер вл	1
доску которая помещалась в	1
архивных материалах с м	1
только не может быть	1
с –.] итак по	1
те выскакивали в чем	1
и здесь достаточно скептическим	1
лет она уже читала	1
воспитании а софа была	1
он писал кате романовой	1
благожелательный и деловой он	1
[ козлов а а	1
у вл соловьева стали	1
года оказался в каире	1
юного диссертанта вл соловьева	1
жили по–своему друг друга	1
соловьев защитил в петербурге	1
уже нет никаких и	1
п хитрово пишет но	1
переход соловьева к неверию	1
источников вел себя весьма	1
к купальням и не	1
я никогда потом не	1
всех нравственных волнений человеческой	1
доме обожают софу и	1
душевные и воображение она	1
историческим методам был гораздо	1
и помогали мне всю	1
глубочайше уважавший отца собственно	1
лопатин был впоследствии известным	1
и сопоставлению платона и	1
с м соловьева был	1
и учиться и что	1
он уже в петербурге	1
своей физической природы эти	1
умом его растревоженную душу	1
на развитии разума»[ там	1
умолкавшей в нем религиозной	1
личность г с сковороды	1
речи о каких&#;нибудь идеалах	1
многочисленные чисто личные качества	1
сведения о пребывании вл	1
возвращении в россию он	1
соловьева мы скажем ниже	1
по адресу диссертанта что	1
этом смысле в адрес	1
считать несомненным и его	1
ключевский исторический метод с	1
но проявляли большую склонность	1
о крепостных но проявляли	1
деловой характер но в	1
внезапным его путешествием в	1
братьев–разбойников которое за нами	1
например с н трубецкого	1
ищущим истину иронически намекая	1
так в начале шестидесятых	1
был благочестивым мальчиком регулярно	1
вплоть до последних своих	1
толстой к этому времени	1
в этом не было	1
с п хитрово тут	1
впечатлением с удовольствием сказал	1
проявлял необычайную серьезность в	1
мысли а их&#;то вл	1
этого труда после первого	1
непременно присутствовал на обедне	1
вл соловьеве настойчиво рекомендуем	1
ни кризиса западной философии	1
западной философии даже что	1
себе и представить прочитаем	1
уже и эта ранняя	1
те же кто не	1
было сказано выше весьма	1
в этой борьбе вероятно	1
но этот мрак есть	1
или менее вероятных догадок	1
значительные явления жизни и	1
в момент защиты соловьевской	1
может быть речи о	1
характеризовать все периоды и	1
материалах с м соловьева–младшего	1
для которых он находит	1
было устроено нами пришествие	1
о вл соловьеве ценный	1
году и который окончил	1
формах в выражениях они	1
натуральной магии парацельса его	1
была пора в его	1
была против этого и	1
i&#;iii спб вл соловьев	1
не мог угомониться и	1
в фиваиду его напугали	1
этому времени уже скончался	1
все&#;таки писал романы так	1
ее часто полны тонкой	1
бы бороться в жизни	1
прошение о зачислении его	1
близкйми ќ шеллингу и	1
тоже отрицательно отзывался о	1
хитрово и написала воспоминания	1
годам умна и развита	1
содержание этого вступительного слова	1
соловьева был духовного звания	1
вл соловьева ярко свидетельствует	1
которого он не считал	1
из них не может	1
вопросе о значении личности	1
каббалы бёме сведенборга шеллинга	1
спиритами именно с востоковедом	1
кажется это было просто	1
сам соловьев называет я»[	1
как словом защита диссертации	1
высоко духовно что особенно	1
биограф вл соловьева к	1
направленность заставившую его перестать	1
были испещрены все рукописи	1
в отдалении то устремлялась	1
определения человека как существа	1
и любви ко мне	1
поскольку заграничные научные командировки	1
людей во мне развилась	1
поэтому является глубоким заблуждением	1
а с симпатией относился	1
считаться окончательно решенным как	1
нам в академических интригах	1
июня однако по причинам	1
еще раньше того в	1
последнего во вл соловьеве	1
философии тут же последовали	1
всех подобных материалов мы	1
дочь их кухарки проходила	1
с молодыми чистыми силами	1
который боялся не будет	1
философом это был видный	1
жизнь оставался символом самоотверженного	1
учению платона и опыт	1
юный ум свободен вполне	1
сказались уже в это	1
его громом аплодисментов к	1
по своей основной специальности	1
философская деятельность вл соловьева	1
примеров скажем только что	1
толстой то есть сыном	1
развития к тому же	1
если козлову вл соловьев	1
соловьевым истории философии находить	1
постоянно выступали против дилетантской	1
существу то в семье	1
правда м м троицкий	1
раз и решил направиться	1
и осталось а жившие	1
и вместо этого мы	1
уже в каире по–видимому	1
этом издании с прогрессивным	1
о сыне но гораздо	1
то что вульгарным материализмом	1
где он родился создала	1
вл соловьев философия и	1
главнейшие периоды философского и	1
существовании»[ соловьев вл письма	1
соловьева[ о нем несколько	1
возраста а также ввиду	1
против дилетантской обывательщины которая	1
стоит упомянуть в связи	1
пребывания но в окончательном	1
соловьев и князь е	1
своей специальности были весьма	1
как пожилой и умудренный	1
этот метод был очень	1
с ] по всему	1
не знаю кто из	1
и я целый день	1
заставившую его перестать ходить	1
них все мое доверие	1
вл соловьев июня года	1
ответов на них вл	1
проявляли большую склонность вообще	1
романовой селевиной от декабря	1
юркевича на вл соловьева	1
чичерин не мог без	1
путешествия в лондон и	1
а в дальнейшем получил	1
знаток и ценитель истории	1
уж во власти традиционных	1
толстые были в париже	1
щедрость сочувствие к другим	1
свои мальчишеские проделки и	1
вл соловьев уже тогда	1
из его явлений но	1
религии она была натурой	1
рассуждения б н чичерина	1
году вл соловьев получил	1
андреевну] были для меня	1
мы читаем вся в	1
верил будучи ребенком и	1
соловьева вместе с ее	1
всем известно что вл	1
все эти черновики связаны	1
идеализма но уже был	1
чисто философских наук однако	1
шеллинга и того что	1
было ничего необычного и	1
матери м ф соллогуб	1
с магистерской диссертацией с	1
не для самого вл	1
он именует иронически кротким	1
победа идейности над животностью	1
с –.] профессор богословия	1
пустота внутри тьма смерть	1
всегда выделялась от других	1
специалистом по философии в	1
зимой в летом в	1
всегда отличавшею его ум	1
и тонким отношением к	1
философия они по вл	1
выше даже и всякой	1
внуки собирались у него	1
так как поэзия и	1
в настоящем издании см	1
поэтому вл соловьев был	1
перевелся в петербург там	1
видел знаменитых спиритов и	1
высоко в молодости он	1
соловьева и э л	1
между прочим эту диссертацию	1
из незнания вл соловьевым	1
того с самых малых	1
потом с самодовольством одно	1
его детских романах которые	1
болтуны вроде французских энциклопедистов	1
поскольку с с п	1
и студентов между прочим	1
произошла резкая перемена он	1
выехал в лондон куда	1
не указал на ту	1
человеческого сердца умер он	1
обстоятельств источники свидетельствуют что	1
простить несмотря на блистательную	1
мою долю досталось провести	1
за границей об этих	1
либерализм с м соловьева	1
мы привели только потому	1
в этом первом большом	1
н цертелеву который был	1
соловьев впоследствии тоже отрицательно	1
сознательно и решительно софа	1
направления очерк развития идеи	1
соловьева л м лопатину	1
а толстой изучал сведенборга	1
менее нелепые свыкается с	1
его антикарамзинство нисколько не	1
соллогуб был родным племянником	1
и публицист из всего	1
вступительного слова на защите	1
чем гартман в итоге	1
с соловьев в журнале	1
в сторону но его	1
гордятся впоследствии они обыкновенно	1
так и возражения его	1
н с тихонравов или	1
вообще всякого реального существования	1
критический обзор литературы о	1
и не может быть	1
] в период магистерской	1
картину защиты диссертации а	1
документа весьма интересные в	1
ума побольше философии опять	1
страхова еще и о	1
самоучки как людвиг бюхнер	1
там же.] все эти	1
ниже в каире вл	1
бы указать на два	1
знает что в последние	1
всегда жалела она всегда	1
собой большой историконаучный и	1
вл соловьевым истории философии	1
тут критик совершенно не	1
московского университета а в	1
приемы которыми пользовались а	1
который объявил что мы	1
козлов а а сущность	1
софе и толстому что	1
считаем необходимым сделать нам	1
софа очень возмущались ее	1
особенностей семейной жизни вл	1
тезис вашего выступления а	1
себя в известной степени	1
какую&#;то систему в нашем	1
ему в личной форме	1
бессознательного э фон гартмана	1
о нем с большой	1
защитил диссертацию и сразу	1
соловьев это был довольно	1
можно только удивляться той	1
платона как мы увидим	1
же время весьма склонном	1
поездке и и янжула	1
был для вл соловьева	1
тогда говорил и делал	1
над бодростью и чистотой	1
соловьева в эти школьные	1
была с ними знакома	1
на первом слоге в	1
первый труд на который	1
русской историографии он считал	1
например факт что уже	1
кроме давно устаревшего в	1
владимировна происходя из украинско–польского	1
чулковой правда сам а	1
п д юркевича i	1
то почему он после	1
в провинциальных имениях своих	1
письме –летнего вл соловьева	1
в петербурге между прочим	1
навсегда также стала еще	1
удержаться надолго к концу	1
прошедший мрачный период всеотрицания	1
этот ii том был	1
имел большое значение и	1
историю сыну александра ii	1
и вытеснить все прежние	1
весьма рационалистичен но только	1
у него уже совсем	1
и многочисленные чисто личные	1
эд де мирвиль ј	1
богословие чтобы научиться чему&#;нибудь	1
вселяет в нас некоторого	1
поводу с п хитрово	1
на этом легком отрицании	1
вл соловьев был связан	1
кипучесть мысли соловьев работал	1
владиславлева производят хорошее впечатление	1
возрасте первое эмоционально–умозрительное явление	1
софией он опустился на	1
пустыньке имении с а	1
м ковалевский сообщил с	1
однако нам кажется что	1
случае не может получить	1
но вторых или третьих	1
столь положительно оценил его	1
соловьева о спиритизме вопрос	1
все исторические материалы которые	1
было несколько свободное отношение	1
правда не первых но	1
приведенных выше словах письма	1
всеми любим свое самое	1
образования его научной и	1
увидим ниже кончается конструкциями	1
юности вл соловьева свидетельствуют	1
же мог возразить лесевич	1
ударением на первом слоге	1
петербурге о том что	1
воспитания у с п	1
его образования его научной	1
в архивных материалах с	1
мы спрятавшись в кустах	1
а в годах чтения	1
иное как материализация астральной	1
и спиритизм вообще так	1
выхода этой книги в	1
дочери профессора а и	1
племянником с а толстой	1
соловьев так и называет	1
я цингера»[ там же	1
всеединства в отчетливой форме	1
таланта при постановке и	1
весьма большой культурой весьма	1
с –летнего возраста а	1
состояла главным образом в	1
документа показать как гимназические	1
всего сердца совестно вспоминать	1
противником материализма и позитивизма	1
вполне интеллектуалистических структур так	1
в меру либерален как	1
] официальными оппонентами были	1
историю английских учреждений будучи	1
не может быть авторитетнее	1
чем отличались от переживаний	1
п д юркевич харьков	1
поэтизирующее и метафизирующее поэзия	1
уже не было никакого	1
с тогдашними лондонскими спиритами[	1
но математик н в	1
было всего лет когда	1
которые как было сказано	1
времена почти все с	1
труды относящиеся ко времени	1
соловьева с семьей толстого	1
небывалой силой с неопровержимой	1
троицкого перевела его собственная	1
период отхода от наивной	1
вера в то что	1
появления в этом доме	1
на него впечатление пустейшего	1
писем поскольку она не	1
давно устаревшего в те	1
школьные годы было светским	1
сердца совестно вспоминать какие	1
с конкретным содержанием диссертации	1
петербургского университета он лично	1
только люблю но и	1
сначала студент а в	1
двоюродным племянником с а	1
до плеч вл соловьев	1
в школьные годы вл	1
учение соловьева о софии»[	1
и в личное бессмертие	1
представилось ему в личной	1
михаил васильевич соловьев ум	1
п хитрово и написала	1
же с –.] итак	1
несколько лет опять спокойно–традиционных	1
неистовых исканий с изучением	1
факультета и председателем научн&#;го	1
же перешел к положительной	1
развития русской философии стремление	1
смерть при жизни все	1
основании надежного документа показать	1
главнейших работ критикующих докторскую	1
итак мы сейчас приведем	1
что дело окончилось только	1
не было исполнено»[ там	1
михайловна тоже была дружна	1
в себе черты пантеизма	1
в период материализма сам	1
против чисто религиозных рассуждений	1
дебольским также и в	1
прыгать это увидел местный	1
что все в доме	1
у лорана его характеристику	1
отказался от намерения жениться	1
и душевные сердечные силы	1
быть никакой речи поскольку	1
сравнивает этот диспут с	1
хитрово вл соловьев всегда	1
тот духовный секрет который	1
сама с п хитрово	1
в сергиевом посаде где	1
разбирался в истории философии	1
только некоторые моменты его	1
важных для теории происхождения	1
даже для тех времен	1
лет софа была не	1
ума есть сходство но	1
м троицкий пробрался&#;таки в	1
разделения церквей которая как	1
несомненно обладал острым умом	1
методов мысли да и	1
все верования отвергнуты и	1
увлечение вл соловьева шопенгауэром	1
относился только к правителям	1
октябре года его тут	1
сделал из своего путешествия	1
и получил ту отповедь	1
серьезно смотрел на предметы	1
чтобы закончить характеристику студенческих	1
обстоятельство было весьма не	1
философской деятельности он постепенно	1
двумя последними документами несомненно	1
раскрыть тот духовный секрет	1
пишет служба и вся	1
стоило софе словом отмахнуть	1
как это было зафиксировано	1
сочувствие к другим забвение	1
быть речи о каких&#;нибудь	1
она верила в несравненное	1
в л величко человек	1
вл соловьева куку правда	1
петербург в году ведь	1
прогрессивным в те времена	1
рассматривает факт и если	1
глубокое философское рассуждение о	1
целое в то новое	1
предсказывая ей удивительную будущность	1
единственным долгом всякого человека	1
и ничего не признававшего	1
никогда не переставал быть	1
н чичерина все же	1
последовательностью всегда отличавшею его	1
м и владиславлева у	1
идеалист в философии русской	1
высокого ума внешней манерой	1
его мнения о вл	1
характерных обстоятельств источники свидетельствуют	1
всю жизнь оставался символом	1
общую связь всего существующего	1
он объясняет что статуя	1
разбирается в интеллектуалистической его	1
–го прибыл в неаполь	1
