собою как вещью когда	1
могущество и сила понятие	1
и единой вещи и	1
гипотетическая возможность»? разумеется нет	1
понятием имя вещи содержит	1
навязывать функции явления но	1
что им свойственен разный	1
камни и металлы тоже	1
принудительность некая императивность имя	1
что нео-кантианская точка зрения	1
что-нибудь это значит отождествить	1
на этой точке зрения	1
специфической природе однако должен	1
иван они могут ведь	1
взаимотождество действительности и ее	1
действительности без внешней материальной	1
просто а есть какое-нибудь	1
и яркостью и если	1
сузило бы самое явление	1
и более интересно чем	1
если не будет новой	1
вещь находится вне мыслящего	1
система или претензия на	1
взвесить измерить понюхать потрогать	1
функции явления превращая его	1
е понятие тут =	1
общения предыдущие тезисы обрисовали	1
не в шутку захотим	1
можно было выбирать вообще	1
двух более обширных иллюстрациях	1
вещь раз она общается	1
не только никакого перехода	1
чисто личностное же т	1
трансцедентализма заключается в том	1
процессы неживой природы эта	1
я сам себя понимаю	1
фактические смыслы или смыслы	1
оно ждет чтобы разрешиться	1
о шем в его	1
заклинания и кончая самыми	1
ним и не просто	1
провести первичную границу и	1
своих чисто логических позициях	1
основной структуре есть не	1
т д думают что	1
этой вещи? вещественную ли	1
проявляема в своих качествах	1
в одинаковом смысле применимо	1
быть воспринимаемой? если вещь	1
можно отметить след пропуск	1
и полному существенному выявлению	1
должно быть отведено самое	1
как тождественную себе необходимо	1
разумному оку и дает	1
угодно истерию и фантастику	1
в именуемом понимание того	1
основных методов философии вообще	1
будет действовать совсем другая	1
кресла и его отвлеченная	1
имен жизнь превратилась бы	1
один из самых абстрактных	1
вещи сходство с другими	1
соотнести ее с тем	1
имя – светло и	1
общечеловеческий и совершенно очевидный	1
собой интерпретацию предмета в	1
что она шляпа о	1
как и семя не	1
личности потому что только	1
неразрушимое тождество идеи и	1
выявил бы в березе	1
как слепое и бессмысленное	1
отличить ни отделить всякое	1
ее лечение а лечить	1
понимать в себе? следовательно	1
смысловую структуру теперь остается	1
она – сущность и	1
фактах и строит лишь	1
идущий ни на что	1
от всего окружающего –	1
и тем смазывать и	1
эта явленная и обозначенная	1
конечно кто-то реально существовал	1
есть конечно несомненно более	1
смысл в отрыве от	1
и не действительность вне	1
позитивизма и рационализма выработанная	1
x тут имена рассмотрены	1
этого инобытия этим оно	1
слились действительность и образ	1
из метафизической пропасти он	1
в в свете с	1
не так надо мыслить	1
самопониманием конституирует не только	1
подход к природе имени?	1
есть вещь т е	1
нас все же не	1
окончательный предел всех умных	1
понимая что та –	1
понимание самопонимания личности умное	1
должна быть обязательно сохранена	1
вещи так чтобы они	1
знание и явление из	1
stellt dar своего носителя	1
никакого именования самый смысл	1
любые мировоззрения любая фантастика	1
общения оно есть тот	1
движение в живом организме	1
общаемся как раз с	1
это такой смысл который	1
– пустое и темное	1
тоже есть какой-то смысл	1
утвердила и положила потому	1
именами пронизана вся культура	1
так чтобы они подпадали	1
воплотится целиком но и	1
если вещь как вещь	1
вещественным никак нельзя ибо	1
идея и материя и	1
и сама именуемая вещь	1
они несомненно будут находиться	1
осмысливает у него и	1
всех возможных инобытийных функций	1
смыслового умного общения с	1
и то что именно	1
впервые и давалось бы	1
ветухов заговоры заклинания обереги	1
имя есть окончательный и	1
что уже не есть	1
религии потому что это	1
вещи есть орудие существенно-смыслового	1
вещи – сами по	1
настроение в отношении погоды	1
к чему иному как	1
и отвлеченный принцип без	1
произвольные функции? казалось бы	1
und seine griechischen aquivalente	1
в ничто а себя	1
вещи и следовательно последний	1
и искать тождества между	1
самовыявление явление сущности вернее	1
скажут она имеет качества	1
это огромная духовная сила	1
и перестает иметь какое-нибудь	1
ними есть определенная логическая	1
никого не называющее и	1
субъективизм тут невозможен нам	1
мне закрыт доступ к	1
и это-то мне и	1
я? вещь раз она	1
различения существенного и несущественного	1
это уже не религия	1
метафизика не заслуживает того	1
самосознание но полная разумность	1
живую интеллигентную индивидуальность конечно	1
но зато общечеловечески-опытном основании	1
тупое глухо-немое общение таково	1
указал и как еще	1
парижскими просветительскими салонами да	1
бесконечно разнообразной степенью силы	1
оно будет относиться к	1
ее окружающего но только	1
уме должен говорить что	1
могущества отождествляется с ним	1
впоследствии духовно-реакционной силой а	1
нами истина а за	1
чисто греческого языка что	1
своего происхождения миф и	1
быть вещью нео-кантианство совершенно	1
слышатся голоса в защиту	1
кантовской вещи в себе	1
или кого-нибудь но этот	1
энергией она является т	1
частности – полную независимость	1
душа и есть сознание	1
и некого бояться в	1
носителя так в богослужении	1
к человеку употребляя такое	1
предполагает что есть обязательно	1
не внутреннего анализа внутри	1
зная ее не понимая	1
что смысл вещи это	1
индивидуальность тут – живая	1
качества чего-нибудь то очевидно	1
должна быть внутри нее	1
нас а тем не	1
иное как изменение бытия	1
его выявляется его ум	1
что такое звуки и	1
орган самого самосознания и	1
системах еврейской и христианской	1
действительной вещи и ее	1
а и только в	1
нами закончено имя в	1
а в уме в	1
между единым и его	1
есть образец самого классического	1
untersuchungen ii и ideen	1
я имею по крайней	1
суть сплошная алогическая текучесть	1
данной вещи должно пробуждать	1
новых вещей и имен	1
основания общечеловеческого опыта который	1
чего энергией она является	1
смысл находится в вещи	1
и она отвечает моему	1
этим наименованием ряд вполне	1
и все существующее еще	1
собою и осмысленно понимает	1
научное исследование но я	1
священную письменность то в	1
о заговорах и заклинаниях	1
наружности его выявляется его	1
механистически закономерный комплекс звуков	1
пользой для себя использует	1
это – одно а	1
гипотетический и феноменологический метод	1
уже диалектическое понятие инобытие	1
находим у jul bohmer	1
и утверждения всякого инобытия	1
понимание но это понимание	1
трансцедентальный метод различествущий лишь	1
всякой религии потому что	1
именования заключается в том	1
сам течет не переходя	1
раз ничем не отличаются	1
как символ просто дается	1
вещи с другими вещами	1
не есть какое-то реальное	1
из недр субстанциальности а	1
для многоразличных откровений и	1
механист не может отличить	1
залегающая между вещами-в-себе и	1
на своих чисто логических	1
не знаем сейчас что	1
условиях кто-нибудь с ней	1
dogmatische systeme d mittelalters	1
получается реальный объект опыта	1
таким образом получается реальный	1
всякое имя есть всегда	1
умно я отождествлен с	1
значит? вбирать в себя	1
укажу только на то	1
правы когда говорят что	1
ее эта новая категория	1
из общечеловеческого языка такой	1
происходило в самой же	1
самораскрывается и не самоутверждается	1
этого вопроса в научной	1
это новое понимание и	1
ее не понимая что	1
смысловой эманацией способной легко	1
необузданная и противоестественная фантастика	1
а вы раскапываете нам	1
вещи и – вы	1
придется дробить еще на	1
есть обезьяна должен признать	1
вещь и для своего	1
смысловость есть более полное	1
только звуком в самом	1
какую-нибудь определенную форму своего	1
тождественно со своими частями	1
еще и направить этот	1
существовать быть чем-то если	1
и интересует логике должно	1
может и – физические	1
я бы указал на	1
вещи и говорится об	1
нами как статическая завершенность	1
и злобно душит ее	1
велению этого смыслового заряда	1
как можно было бы	1
другими словами необходимо требуется	1
что вещь есть прежде	1
что я называя данного	1
одновременно теперь необходимо эту	1
уже предполагается что субъект	1
для имени надо не	1
которая именуется как пальто	1
– не только потому	1
логическую структуру имени а	1
легко заключить из предыдущего	1
потребно только расчленение внутри	1
в двух отношениях имя	1
смысла обе школы исходят	1
был бы тоже богом	1
логичнее сказать что вещь	1
суть совершенно самостоятельные и	1
ни на какие философские	1
какой-нибудь мастер которому она	1
отнесся к языку немецкий	1
эйдос – триедин троичен	1
словами – как одновременно	1
вырожденческие теории и стать	1
не быть просто слепым	1
вещь принудительно окутывает ее	1
самая дикая магия ибо	1
перестали силою имени творить	1
вещью или понимает ее?	1
собою обе первые сферы	1
их сущность но когда	1
sein verlauf abhandl d	1
непосредственно данное как некое	1
не сошедший с ума	1
которое имманентно самой вещи	1
значит что в ней	1
этой совершенно необходимой для	1
завета из числа всех	1
воплотилась в своем инобытии	1
вещи и не потому	1
altchristlichen taufe gotting якоб	1
ни с а ни	1
получится? получится что звук	1
действительности – об этом	1
при более подробном изложении	1
утвержденность некая воплощенность и	1
ничего лучшего как термин	1
ли это что она	1
заново оформляет и эту	1
каком случае только феноменологическая	1
столько повседневно человеческой природы	1
сущностях существует только сущность	1
с вещами вообще но	1
затемнило бы самый вопрос	1
очень актуально и динамично	1
е иной новый материал	1
всякого здравомыслящего человека и	1
целом с состоящем из	1
данной области действительности в	1
каждый язык по-разному понимает	1
эта формула однако ярче	1
определенным методом тут мое	1
собственно говоря общается и	1
оно и есть тут	1
отрыв имен от вещей	1
или обстоятельства их жизни	1
именно два дерева потому	1
свою субъективно-отъединенную природу он	1
есть развитие результатов полученных	1
как орудие общения словом	1
имя не есть просто	1
свой образ вовне активно	1
термин в котором подлинно	1
как начальный результат устаревшей	1
никак не является и	1
действительности по сравнению с	1
не этим они берут	1
напр пусть стоит тут	1
она понимает себя? понимание	1
доставляет вред отсюда –	1
связан с личностным бытием	1
как понятие эти две	1
в результате моего рассуждения	1
и ощущаем и не	1
стол чем-нибудь отличаются между	1
есть орудие общения это	1
т е в ней	1
не что-нибудь ничто и	1
неодушевленным и одушевленным можно	1
что оно есть самопонимание	1
неуместно почему я ограничусь	1
нео-кантианская точка зрения на	1
должен быть не просто	1
его воспринимаю но имя	1
это – только один	1
система понимания т е	1
суть книги значит понятие	1
и наторп напирают главным	1
суть только акцентуации разных	1
будет не в понятии	1
никакой позитивист не сможет	1
конституировать и выявлять вещь	1
и т д мне	1
имени в этом смысле	1
вопрос великолепно разрешили две	1
чисто логическую структуру имя	1
существования сущностей и явлений	1
данной вещью а с	1
может сделать и то	1
логических функциях и структурах	1
осмысляется и осознается да	1
исторический материал философии с	1
вытекает того что и	1
понятие как общее так	1
она есть субстанция перестает	1
его носитель а уж	1
знак не условный символ	1
предмета стол стул то	1
его от всех других	1
так оно частично тождественно	1
чисто субстанциальной стихии вещи	1
восприятия и ощущения но	1
– действительность явленная в	1
нужно иметь совсем вывихнутые	1
что есть сразу и	1
стремление и отвечает мне	1
сущности навязывать функции явления	1
существенным смыслом вещи но	1
своих прежних работах интеллигентную	1
и вскрыть значение имени	1
признает что имена как-то	1
вполне современна и уместна	1
bonam partem принося счастье	1
то есть и сущность	1
самого смысла вещи ее	1
который также имманентно содержится	1
приобщили одну вещь к	1
и феноменологически описывать можно	1
работах exner uber nominalismus	1
вещество должно оформиться определиться	1
что на ее уходящие	1
есть дело не философии	1
рационализма и дебелой тупостью	1
то что создает ту	1
активно схватывающие жизнь и	1
скрытые и глубинные возможности	1
и явление как нечто	1
и наиболее разработанное т	1
в мировом целом b	1
не есть никакие смыслы	1
анализ который мы произведем	1
сводится позиция канта в	1
или перемешать их набор	1
и достаточно оперировать тут	1
и блаженно-молитвенным сочувствием этого	1
очередь свидетельствует о том	1
что это имя есть	1
я должен был посадить	1
в учебниках еще не	1
не просто смысловое тождество	1
сферы так как мы	1
есть абсолютная полнота самовыявления	1
относится ли к себе	1
есть условие восприятия ибо	1
понимаемого смысла т е	1
сущность то это уже	1
что же вы говорите	1
ее проблем практическая очевидность	1
отдельным человеческим именам они	1
определенность т е наличие	1
понимания и даже не	1
то или только это	1
могут родиться в разных	1
их объединит и отождествит	1
понимания имя есть орудие	1
охвате ее но это	1
понимаю значит по-имаю беру	1
нисколько и это потому	1
психического расстройства кантовская позиция	1
другим построениям из того	1
она уже не просто	1
специальных вопросов куда диалектика	1
вовсе не есть звук	1
говорится о самопознании имеют	1
а и в будучи	1
именуемого не может состояться	1
ведь не из чего	1
взаимное понимание взаимное и	1
жизни в реальных своих	1
всякого фактического инобытия требует	1
тем более не имеет	1
опыта и науки это	1
кто раньше им сопротивлялся	1
знаем идея и материя	1
этого имени к другому	1
именах выводы из этого	1
цепях формализма рассудочной схематики	1
и логичнее судить об	1
его абсолютной чистоте и	1
это имя чтобы она	1
предмета это – название	1
кем-то должно быть понято	1
никогда философия языка не	1
же ибо оно нисколько	1
что она не есть	1
проявление ее тоже реально	1
есть сама явленность сама	1
весьма затруднительная но раз	1
было в свою очередь	1
в собственные т е	1
имя есть энергия взаимообщения	1
себя это значит что	1
общечеловеческого опыта который и	1
и внеощутима это значит	1
при той потребности во	1
которое есть уже в	1
я вижу его внутренние	1
говорим тут не о	1
вне всяких внутренних своих	1
– в смысле сделанности	1
т д сознания но	1
на какую угодно истерию	1
на ее полное удаление	1
кем-то двигается куда-то направляется	1
еще и нечто третье	1
быть в начале всякого	1
следовательно вне моего мышления	1
самого классического варварства в	1
исключительно в результате некоего	1
действительность есть категория все	1
как специального заместителя и	1
выделяемое в каком-то еще	1
или непосредственные образы и	1
истории когда символ понимался	1
смысла причем факты условно	1
наиболее зрелая и обстоятельная	1
своей активно вещь пассивна	1
части и их совокупное	1
я утверждаю если никакая	1
необходимостью оказываются нерушимо связанными	1
и выявлять вещь как	1
сознательно сам себя выявивший	1
и доказывать что они	1
не какая-нибудь отдельная часть	1
абсолютная абсолютно-чистая субстанциальность и	1
