никакой субъективизм тут невозможен	1
в постоянном и вечном	1
редко философы высказывают свои	1
красок когда вы надеваете	1
духовная реакция не спячка	1
вещи которая подходит к	1
материя? если он думает	1
сущности и явления по	1
вещи теперь вещь получена	1
понятии и который есть	1
значит заключаем мы она	1
взаимообщении с вещами требует	1
эта культура основанная на	1
термин – символ символ	1
философии как строгой науки	1
и одушевление какое-то внутреннее	1
одно неделимое целое это	1
самой вещью и не	1
из подробностей можно отметить	1
знает и понимает именующего	1
было бы проанализировать все	1
что я хочу какого-то	1
сам по себе то	1
в которая ни к	1
что она понимает себя?	1
о том что имя	1
миросозерцания миросозерцание есть дело	1
этой уродливой теории мы	1
потому в нем нет	1
этого зависит та особенность	1
не имеете? тогда уже	1
него – материя хорошо	1
не может быть познанной	1
расстоянию и производят действие	1
логически же умно в	1
и смысла причем факты	1
и в подлинном смысле	1
что-нибудь то всегда обязательно	1
оформляет и осмысляет материю	1
живых религий я подчеркиваю	1
ни в каком серьезном	1
в данном случае языковое	1
именовать значит понимать место	1
ясно что и вещи	1
свет ясного сознания имя	1
первые сферы мы ведь	1
она отличается чем-нибудь она	1
скреплено освящено и даже	1
отсюда первое и исходное	1
прежде всего к невещественной	1
вавилонян и ассирийцев также	1
различения факта и смысла	1
сущности и явлений в	1
новые философские тезисы ономатодоксии	1
животных d имен предметов	1
отвлеченную сферу к которой	1
ясно отсюда что имя	1
какой-нибудь определенный спецификум но	1
понимания я понял что-то	1
бытия – словом как	1
вещи с ее инобытием	1
и быстро продолжать эту	1
отказаться от кантовского дуализма	1
бы нелепо это значило	1
проявления сущности? нужно чтобы	1
во-первых об этом писано	1
безусловно содержит в себе	1
или его нет если	1
оно и уничтожается то	1
я мог бы вбирать	1
субстанцию в ее единственном	1
рационалистической и позитивистической метафизикой	1
окружающего ее фона и	1
мистика представляет очень интересный	1
в философии здоровый инстинкт	1
если я вообще тут	1
этих эмпирических установок развивается	1
тут = тезис ее	1
и здесь как и	1
между собою можно даже	1
диалектическом отношении или вещь	1
какое это будет общение	1
в науке не раз	1
удержаться на столь простой	1
собой если же она	1
представлен или замещен что	1
в смысловой сфере нет	1
и внешнее внутреннее самовыявление	1
из сущности как некоей	1
сама же именуемая вещь	1
а понимать себя значит	1
только за какое-нибудь имя	1
иегове или – внутреннее	1
общего ни с а	1
жизни не может обойтись	1
явления суть проявления вещей	1
направленность стремление обращение и	1
тупик если же оно	1
i действительность вся философия	1
позитивизма так еще крепки	1
и следовательно имеет свою	1
настойчивая потребность признавать реальность	1
находится вне меня и	1
не стоит особенно ломать	1
они тоже низводят божественные	1
более мелкие части и	1
без всякого сомнения сущность	1
и суждения о реальных	1
другом вопросе каково же	1
именно обращаются уже это	1
противоестественная фантастика и сумасшествие	1
и то что имя	1
символ имя – личностный	1
слова в отличие его	1
процессов в организме а	1
воздерживаться от суждения о	1
не опровергать ибо опровержение	1
но раз так то	1
philos h kohler realismus	1
один из видов понимания	1
изложить и проанализировать в	1
в окне своей комнаты	1
лишь на двух крупнейших	1
и существенное теперь ответьте	1
идея шкафа есть то	1
существенны иначе это не	1
прибавить еще и суждения	1
каждой из этих личностей	1
и не существовало это	1
действительность конечно ни в	1
бездонные глубины на свет	1
ровно ничего что я	1
нужно ли быть совершенно	1
в смысле когена и	1
его ум его чувства	1
если явление как-то общается	1
действительность явленная в том	1
явлению приходится брать на	1
но конечно вы этими	1
первая – это сравнительно-мифологический	1
со всем прочим и	1
что нужно для этого	1
понимать имя как обозначение	1
очень многим философам и	1
самой вещи которое не	1
зафиксировать эту неявляемую и	1
а вещь вступая с	1
или сущности существуют и	1
– что существуют те	1
что красота яркого солнечного	1
ибо сама по себе	1
например тех или иных	1
сам весел торжественен и	1
резко отличать именуемое от	1
так что и само	1
этот третий тип решения	1
отождествлен с нею как	1
не есть ни весь	1
это значит что именуемая	1
диалектически-историческое происхождение нео-кантианства и	1
твердо стоит на точке	1
же это не есть	1
чем различие однако это	1
была бы совершенным аналогом	1
языке орган самого самосознания	1
или субстанции то не	1
не вообще энергия а	1
приводит к очень милому	1
излагаема как таковая но	1
быть мышлением и восприятием	1
если это нецелесообразно то	1
умное отношение вещи с	1
того что является явление	1
этих несомненно ярчайших образцах	1
насмешек и даже угроз	1
самоутверждении и в утверждении	1
полное сходство в основном	1
и что она –	1
материя хорошо пусть это	1
что же они проявляют?	1
производим объединение в сфере	1
же самое время оставаться	1
griechischen aquivalente giessen бемер	1
жизни – на силе	1
готово вылиться в огромные	1
этого уже никакое рассуждение	1
в диалектическом отношении или	1
от этих вещей? нельзя	1
чем она реально отличается	1
с искусством она может	1
и есть законнейший и	1
– как существенный смысл	1
итак необходимо вообще говоря	1
и не излагаю их	1
выявление? кого предполагает это	1
и нет никакой действительности	1
об имени не зависит	1
несоборное изолированное неразумное не	1
т е соединение с	1
окружающего что значит общаться	1
самооткровения вещи в двух	1
работу можно только приветствовать	1
он берет его только	1
и невещественным смыслом и	1
не вещи как вещи	1
слово из философского лексикона	1
захватывать существенное ядро предмета	1
и его именем как	1
да вырожденческая философия европейского	1
призвано именовать и в	1
жизни и бытия сведение	1
антитеза бытия и инобытия	1
где нет ни света	1
и самим понятием своим	1
вере в силу слова	1
просто реализм внешней выразительности	1
самостоятельно само по себе	1
предопределенного ему смыслового круга	1
оно есть оформление самой	1
смысловую силу направленную в	1
не есть еще и	1
обрисовали тот момент в	1
сущность сама по себе	1
нечего бояться и некого	1
то отличаются они вовсе	1
чисто диалектический смысл но	1
энергия сущности но не	1
понимали теоретическую философию как	1
для себя использует всякий	1
эта категория функционирует вторые	1
что обращаться с таким	1
участвовать в любом комплексе	1
не только познаваема но	1
хотя бы даже содержащая	1
совокупность несущественных и чисто	1
не проявляется и тогда	1
она будет понимать в	1
что собственно говоря она	1
и другая вещь суть	1
обстоятельностью и провели этот	1
его и мыслю и	1
комнаты безусловно находится вне	1
о фактах как таковых	1
никакой нет а есть	1
вот почему односторонний идеализм	1
что тут сливается воедино	1
хотя бы даже приблизительную	1
я закрепляю это особыми	1
и до этики и	1
и потому имя оказалось	1
лицо по имени и	1
– обманывайте дураков сами	1
личности или ее степени	1
методов прежде всего против	1
деталей и без всякого	1
том что и предметно	1
i имя вещи есть	1
бытие какое именно –	1
понимания т е в	1
символ и мы будем	1
менее наличие и логическую	1
ставят вопрос – первые	1
того что отлично от	1
символ личностный и энергийный	1
идущим изнутри наружу выраженным	1
развратного циника и скептика	1
хочу на этих несомненно	1
большого количества работ по	1
осмыслением вещи как объективно-определенной	1
понятия чем отличается слово	1
есть проявление сущности теперь	1
о проявлении сущности сущность	1
из живого исторического процесса	1
но ясно что это	1
не уменьшилась мы перестали	1
я плохо рассуждал но	1
оно есть говорили мы	1
имя представляет stellt dar	1
во всяком другом произведении	1
субстанции вскрывает и выявляет	1
всей той заостренности и	1
изменить себя так чтобы	1
могло быть и могло	1
обязательно существуют и причинно	1
храме имя как могущество	1
материализма материализм и есть	1
переводе так как учение	1
в вещественной области а	1
и быть не может	1
другим в полной адеквации	1
мимо ее смысла? нет	1
со всякими другими вещами	1
в первой формуле гораздо	1
мы натолкнемся на огромные	1
имен и слов основано	1
как и дифференциальное исчисление	1
судьба которая настигла антитезу	1
как раз к одушевленным	1
и остается самой собой	1
самой вещью тут приходится	1
содержанием – все равно	1
зрительных слуховых и вообще	1
вещи которая есть личность	1
и новые формы и	1
этом небольшом очерке путь	1
бытие не значит ли	1
ветхо-заветных представлений именно для	1
раз название это действительно	1
и его нужно только	1
именует свою философию трансцедентальной	1
структур что метод оперирует	1
принципы только чистые возможности	1
выбирая здесь последнее я	1
есть дерево если бы	1
возможность отнесения этого имени	1
с ним оно само	1
lowe der kampf zwischen	1
скажите пожалуйста могли бы	1
это совершенно не важно	1
не реален думают что	1
бездушных типов культуры вообще	1
сфере вещь есть вещь	1
слабоумия ибо за нами	1
отвлеченным и философским для	1
есть жизнь просто но	1
понимать пусть даже оно	1
в третьем случае имя	1
самая категория религии искусства	1
высказываете и притом нечто	1
не метафизически а чисто	1
есть непосредственное знание и	1
тождества имя не есть	1
мне дороже и ближе	1
который закреплен в понятии	1
данную вещь с другими	1
какое это общение? есть	1
а нигилистический обман черная	1
просто на фактах обыденной	1
сравнению с именем образ	1
проблему самого имени или	1
двух крупнейших религиозных системах	1
себя понимает если она	1
мыслим и воспринимаем и	1
будет относиться к живой	1
враждебен жизни и злобно	1
проявления этих сущностей этих	1
решения вопроса о взаимосвязи	1
же ведь как рационалисту	1
отграничен от ее смысла	1
вопреки вопиющим фактам много	1
вещь именует первую вещь	1
есть сама вещь в	1
сила активно охватывающая инобытие	1
– как одновременно и	1
существенное совершенно очевидное общечеловечески	1
только один из видов	1
в своем месте мы	1
bohm gesellsch d wissensch	1
то что он есть	1
возьмем вещь как вещь	1
воспринимается ни внешними органами	1
ничего иного то кому	1
что они не суть	1
ее в чистое объективное	1
смыслов которым они вначале	1
истине и как часто	1
образ в результате моего	1
и нечто структурно законченное	1
вовсе еще не будет	1
переведем эту физическую картину	1
и реализацию абстракций то	1
резкого противопоставления факта и	1
phanomenologie u phanomenolog philosophic	1
же оставалась бы самой	1
в непосредственное данное бытие	1
вдаваясь в специальный анализ	1
метод построения частностей отдельные	1
просто образ ни просто	1
имя нарицательное имя а	1
смысле и о несущественном	1
выражал четыре момента выраженность	1
отождествляется со своим инобытием	1
намеренно именовать значит точно	1
имени отграничен далее как	1
совершенным аналогом того охвата	1
а на что-то другое	1
действительность вне всяких внутренних	1
и панметодизмом то что	1
понимания вещи всяким инобытием	1
для всякого философа точке	1
живого существа кошку собаку	1
есть звук имя вещи	1
их осмысления и понимания	1
учению об именах выводы	1
того чтобы обеспечить ей	1
вещью необходимо и достаточно	1
самой субстанции внутри вещи	1
субъекта т е уже	1
значит? как и чем	1
и говорится об их	1
быть теперь упоминаемо с	1
вещи и ничто нам	1
ее сущности тогда я	1
вещь но вещь имеет	1
феноменологически-описательная данность разумеется описывать	1
получить ее вполне адекватный	1
вещи едва ли это	1
следовательно она проявляется в	1
в своей повседневной практике	1
в цепях формализма рассудочной	1
можно ли обойтись без	1
потому что только от	1
не обозначает такого чем	1
капитализм в экономическом отношении	1
есть нечто обязательно связанное	1
неявляемую и неименуемую сущность	1
интересовать только те стадии	1
вещь получает имя когда	1
механисты ни расстреливали живую	1
как сущность является? само	1
ее выражения заставит выражение	1
возможных инобытийных функций вещи	1
кем-нибудь то вещь и	1
тоже люди часто хотят	1
к мысли и сознанию	1
называемый критический период его	1
это однако неверно при	1
разумным и существенным и	1
или проявляется не обязательно	1
врачевания основанные на вере	1
и это – уже	1
стать впоследствии духовно-реакционной силой	1
с действительностью как таковою	1
чего не в смысле	1
когда я сам себя	1
все же не учитывает	1
образ вовне активно употребить	1
и о них мы	1
она сказывается в поэтическом	1
самопонимания но понимание видели	1
своими умными энергиями повелительно	1
вечность шехина слава иессод	1
крупного философа который бы	1
и вывести из явлений	1
внутреннего пребывания в себе	1
как мы видим осталась	1
человеческой жизни начиная от	1
хочу в этой маленькой	1
вовне это проявление бесконечно	1
смысловой сфере никем сознательно	1
же такое восприятие вещи	1
тому как существуют разные	1
ее на физико-химические процессы	1
какое-то инобытие несомненно тут	1
умной смысловой энергии вбирая	1
по этим качествам можно	1
главным образом чисто описательным	1
быть только звучанием или	1
устаревшие вырожденческие теории и	1
a и дано историко-религиозное	1
теперь необходимо эту описательную	1
треугольник ясно что сама	1
из живой действительности какой-нибудь	1
это дает право понимать	1
пусть все это думают	1
того всякая наука и	1
изменяющееся мое настроение в	1
могу как-нибудь обратиться к	1
они такие-то и такие-то	1
атомы есть тоже моя	1
с чем быть может	1
всерьез а не в	1
я дал тут нечто	1
имя вещи есть то	1
поставил сам себя и	1
самопознания вещи однако тут	1
философией но только в	1
когда мы наметили в	1
это было бы нелепо	1
есть уже всецело диалектическая	1
наглядно зримых ноуменов поэтому	1
есть потенциальная энергия взаимопонимания	1
непознаваемы и о них	1
она готова была на	1
вещь понимает сама себя	1
о значении имен укажу	1
которые мы употребили для	1
есть именование в именовании	1
der sprache im mittelalter	1
сводится к одному исканию	1
эта смысловая заряженность некоей	1
иное как реально осуществленная	1
эту неявляемую и неименуемую	1
другой существует непроходимая пропасть	1
мы она познаваема и	1
быть может очень редко	1
самая что и сущность	1
понятиях точка зрения старого	1
есть чистая активность живой	1
распространяться здесь не следует	1
что составляет переход от	1
всякого чувства защищающего реальность	1
gottes eine sprachliche u	1
вполне удовлетворительно доказано уже	1
момента да и то	1
вполне чувственного обстояния недаром	1
объектами всегда есть живое	1
самых грубых и самых	1
спутника все это по	1
потому ее понимает и	1
тут надо усвоить только	1
данная вещь не может	1
еще не был поставлен	1
и направить этот свой	1
в моем воображении и	1
самосознательно волящего источника оно	1
трансцедентно сущность есть но	1
есть возможность зарождения то	1
вред отсюда – большое	1
как это наверное делают	1
