имя вещи есть орудие	19
не что иное как	12
бы то ни было	12
вещи есть орудие общения	11
и т д и	11
т д и т	10
есть орудие общения с	10
д и т д	10
что имя вещи есть	8
есть не что иное	8
орудие общения с нею	7
одно и то же	5
вещи с ее окружающим	5
не значит ли это	5
и тем не менее	5
имя не может быть	4
имя вещи есть предел	4
с этой точки зрения	4
не может быть только	4
ни в каком случае	4
между вещью и ее	4
имя вещи есть потенциальная	4
итак имя вещи есть	4
значит ли это что	4
дело в том что	4
в то же время	4
n o m a	4
это значит что она	4
o n o m	4
это значит что мы	4
в то время как	4
по сравнению с именем	4
смысл имя взято как	3
то это значит что	3
свидетельствует о том что	3
тем что не понимает	3
вещи есть потенциальная умная	3
i v o n	3
явлением и имя не	3
и имя не может	3
имя вещи не есть	3
v o n o	3
и сущность и явление	3
есть потенциальная умная энергия	3
а тем не менее	3
энергия взаимопонимания вещи с	3
и есть не что	3
на то что является	3
можно ли сказать что	3
указывает на то что	3
те или другие ее	3
не может быть просто	3
вещь в имени своем	3
это значит что я	3
имя есть всегда имя	3
не может быть ни	3
при переходе в явление	3
не потому что они	3
это и значит что	3
имя не есть ни	3
e i v o	3
и в то же	3
это значило бы что	3
и то же понятие	3
откровении и самовыявлении данной	2
не с голой материей	2
общение с вещью или	2
взаимного понимания между нею	2
так что в результате	2
имя вещи наступает на	2
не может понимать себя	2
с нею всего окружающего	2
самими же собой нетронутыми	2
но будучи отличным от	2
не есть орудие общения	2
не есть она сама	2
мы имеем дело не	2
вот эта вещь есть	2
что вещь в имени	2
т д до бесконечности	2
по крайней мере в	2
рассекая действительность на две	2
для тех или других	2
является т е абсолютно	2
повелительном откровении и самовыявлении	2
не есть ни просто	2
в свете с а	2
и т д до	2
не реальное и не	2
вещь имя вещи есть	2
что является или не	2
субъектом чтобы утверждать что	2
оно есть не что	2
но в чем же	2
есть не просто понимание	2
в каком случае не	2
не значит ли что	2
есть явление то есть	2
какого бы то ни	2
есть то – чтобы	2
понимания между нею и	2
или по крайней мере	2
что мы вбираем в	2
действительность на две абсолютно	2
элементы и т д	2
ту или иную сторону	2
орудие общения с вещью	2
в имени своем общается	2
в том или другом	2
только в имени своем	2
вне какого бы то	2
или что то же	2
своим инобытием т е	2
переходит в явление т	2
носить на себе следы	2
отождествление понимаемого образа с	2
содержится в вещи в	2
чтобы вторая вещь узнала	2
вещи есть орудие отличия	2
чего же проявлением будет	2
уже не может быть	2
смысл содержит в себе	2
заключается в том что	2
общается с самой собою	2
у нас в россии	2
что я мог бы	2
общения с нею всего	2
значило бы что я	2
и – мы получим	2
что такое имя вещи	2
случае не есть ни	2
по себе без всякого	2
невозможно было бы и	2
общаться с вещью можно	2
диалектически это значит что	2
есть предел ее умного	2
смысл содержится в вещи	2
как объективно-определенной и в	2
вещи в разных степенях	2
не имеет никакого отношения	2
если это так то	2
оно указывает на то	2
на действительность и образ	2
нею смысловое общение с	2
данного человека по имени	2
сказать даже больше того	2
общение с вещью в	2
к себе как к	2
именно тем что не	2
не указывает на него	2
имя это значит что	2
стоит у меня на	2
инобытие = антитезис и	2
звук или комплекс звуков	2
воплощение приведет к появлению	2
т е потому что	2
что только в имени	2
данную вещь от всего	2
себе или вне себя	2
моему пониманию будет то	2
взаимопонимания вещи с ее	2
необходимо чтобы вторая вещь	2
имеем дело не с	2
эти а и в	2
переходе в явление и	2
есть звук или комплекс	2
есть есть и есть	2
в jacob im namen	2
итак наименовать вещь значит	2
чего бы то ни	2
что не есть ни	2
предел ее умного самовыявления	2
бы сказать что она	2
то с чем мы	2
в том что он	2
от того что именно	2
namen gottes eine sprachliche	2
третье что не есть	2
вопрос о том как	2
в настоящем кратком очерке	2
можно сказать что имя	2
оно содержит в себе	2
а затем и потому	2
общения с нею смысловое	2
не различаются между собою	2
взаимопонимания между вещью и	2
имя взято как понятие	2
самой внутри себя же	2
резюме обще-человеческой веры в	2
с другими вещами –	2
что оно есть не	2
o m a и	2
общение одной вещи с	2
где она могла бы	2
тоже есть некая вещь	2
не есть ни только	2
одну или другую из	2
было бы сказать что	2
iii имя и вещь	2
вещь как вещь не	2
от всех прочих вещей	2
в себя смысл вещи	2
условиях не может быть	2
не есть то что	2
из основных методов философии	2
рационализма и позитивизма –	2
от всего прочего и	2
вещи есть предел ее	2
что-нибудь или ничего не	2
это значит что вещь	2
себя значит сравнивать себя	2
какой стороны не есть	2
или другую из них	2
есть прежде всего некая	2
должны быть не только	2
орудие взаимного понимания между	2
в природу имени мы	2
себя с собою же	2
мелкие элементы и т	2
объективно-определенной и в повелительном	2
между нею и всем	2
можно сказать даже больше	2
а если она отличается	2
проявлением будет данное явление?	2
то ни было но	2
его резюме обще-человеческой веры	2
в той или другой	2
остаются самими же собой	2
собой нетронутыми со стороны	2
никогда не есть только	2
в своей полной объективности	2
соответствует и ответствует ему	2
iv из истории имени	2
же проявлением будет данное	2
чем бы то ни	2
с нею смысловое общение	2
об отношении вещей и	2
она имеет определенное качество	2
в явление т е	2
вещи есть сама вещь	2
и в повелительном откровении	2
есть – это для	2
да будет мне позволено	2
со своим инобытием т	2
вещью и ее окружающим	2
ни с какой стороны	2
можно все что угодно	2
более мелкие элементы и	2
в вещи в разных	2
тогда воплощение приведет к	2
то не значит ли	2
нечто третье что не	2
сущность при переходе в	2
и имя вещи есть	2
и нечто третье где	2
значит? это значит что	2
тут не может быть	2
явление не может быть	2
e c n h	2
умная энергия взаимопонимания вещи	2
именуя вещь можно ли	2
нею и всем окружающим	2
внутри себя же самой	2
понимать себя значит сравнивать	2
имя вовсе не есть	2
имя вещи и есть	2
явление то есть и	2
каких условиях не может	2
сравнивать себя с собою	2
im namen gottes eine	2
пониманию будет то что	2
предел самовыявления вещи и	2
– по крайней мере	2
совершенно не относится к	2
отношении вещей и имен	2
из общего кантианского лона	2
с какой стороны не	2
нельзя было бы сказать	2
т е в сущности	2
отлично от того что	2
и самовыявлении данной личности	2
даже больше того всякая	2
то же понятие так	2
плох именно тем что	2
имени имя вещи есть	2
имя вещи есть ее	2
есть тоже момент в	2
действительность вообще и действительность	2
в себе или вне	2
не есть – это	2
можно говорить о смысле	2
или не есть –	2
одной вещи с другою	2
действительность и ее образ	2
и то же название	2
в отличии от всего	2
что значит что я	2
в своих прежних работах	2
в повелительном откровении и	2
что это значит? это	2
же собой нетронутыми со	2
лампы если не будет	2
вещи не есть просто	2
то что не есть	2
субстанция как только субстанция	2
у меня на столе	2
ее с прочими вещами	2
которая стоит у меня	2
по смыслу т е	2
с вещью в ее	2
мы можем иметь общение	2
смысловое общение с вещью	2
есть не действительность а	2
сказать что имя есть	2
смысл выявляет себя в	2
в этом отношении они	2
полную независимость ни от	2
вещи с другою в	2
пропуск – а т.-г	2
самой вещи это –	2
jacob im namen gottes	2
что образ ее –	2
иметь какое-нибудь отношение к	2
имени своем общается с	2
что вещи бывают разные	2
не предполагает что есть	2
имя вещи отличается от	2
то – чтобы быть	2
эти качества не проявляют	2
мы вбираем в себя	2
но если это так	2
значит сравнивать себя с	2
ее со всем прочим	2
и больше ничего это	2
не может быть никакого	2
это значит? это значит	2
в имени своем действительность	2
– сами по себе	2
что это именно небо	2
но не есть просто	2
в свое время была	2
идею и материю и	2
смысл сам по себе	2
об отношении имени к	2
отличии от всего иного	2
вещью и ее средой	2
судить о свете по	2
имя вещи есть сама	2
t e c n	2
выражения не будет ни	1
со всем прочим сравнение	1
– другой в отношении	1
и установок каждое новое	1
не было т е	1
что слияние и отождествление	1
одна из модификаций идеи	1
себе в свой внешний	1
смысла вещи это умный	1
вещественных общений и оно	1
и энергийный или –	1
существует ли она реально	1
имен в теперешней жизни	1
что раз есть явление	1
вещи выраженность этой выраженности	1
думал что данное лицо	1
даже вообще чем-то невещественным	1
же условен частичен подчиненный	1
всегда есть некая умная	1
моментов в инобытии также	1
сейчас накануне и уже	1
тогда наша формула о	1
без необходимости физического их	1
в физику совсем другое	1
со всякой религией так	1
ибо всмысле чистой вещественности	1
смысл вещи но что	1
вещью так взор человека	1
мы касались раньше и	1
или иной реальный аналог	1
получим и нечто существенное	1
вопросу об именах в	1
себя как реальную вещь	1
если она хочет быть	1
будучи в состоянии взглянуть	1
все равно имя вещи	1
тот же отвлеченный смысл	1
не пытается объяснить он	1
попробуем не сходить с	1
но я ограничусь только	1
занимающимся философией но только	1
бы заряд готовый каждую	1
этот путь анализа бесконечных	1
не теоретико-философское значение имени	1
и признанное различие между	1
интересует и это будет	1
это я только что	1
опять сошлюсь только на	1
неделимую единичность в которой	1
против своей воли клятва	1
ним приведет к пониманию	1
проявлений сущности это утверждение	1
что все вещи совершенно	1
как раз отличается активным	1
мое собственное имя но	1
от нее хотя и	1
бы уже самостоятельным и	1
это – самый яркий	1
еврейских коррелата т е	1
как представленный саблуковым огромный	1
запутаться в разнообразных учениях	1
но тогда на него	1
значит что вещь общается	1
явление оно указывает на	1
понимания остается весьма неопределенной	1
общается с другими вещами	1
мы лениво протираем сонные	1
труху какого-нибудь святейшего правительствующего	1
я мыслю себя в	1
образом позитивизм есть не	1
две сферы так как	1
предполагает что вещь есть	1
мы опять сравниваем ее	1
энергия в параллель к	1
человек на лице которого	1
же очерке я хочу	1
необходимо придумать такую категорию	1
в ней должен быть	1
в логическую структуру в	1
к иному другому чем	1
есть или не есть	1
идеями не с голой	1
различение будет всегда неизбежно	1
действительности не оторван от	1
смысл вещи отграничен от	1
не проникла пусть механистам	1
и универсальная антитеза мысли	1
именно тождество этого внутреннего	1
другому чем я? вещь	1
их описывает в этом	1
целесообразно начать как раз	1
цвета листьев и пр	1
милому очень уютному и	1
как раз проявления этих	1
сущности оно обозначает указание	1
духовно и материально революционным	1
него это еще яснее	1
и притом оно должно	1
хотим понять и с	1
в темноте и в	1
него и заново оформляет	1
материи тела явленности второй	1
просто орудием общения с	1
заменило бы be-schem говорит	1
него велика и непреоборима	1
расхождение обеих школ нео-кантианство	1
явлено видимо осязаемо реально	1
анализ имени раз диалектика	1
целое – совершенно особая	1
назначения мимо ее смысла?	1
сущностью и имя как-то	1
когда рационалист удушил явление	1
или реально есть или	1
нечто внутреннее вещь есть	1
не усвоят той колоссальной	1
я предполагаю изложить и	1
меня ни убеждали что	1
схему к проблеме понимания	1
собой слишком болезненный и	1
здесь философскую систематику понятий	1
ничего философского оба метода	1
мысли диалектика и рассекает	1
бытие и распинает его	1
привлечением всех существующих еврейских	1
выразится какой-нибудь второстепенный или	1
и это проявление –	1
невещественным к ужасу всех	1
что-нибудь должен и отличать	1
ум его чувства его	1
понятие же но имя	1
ведь имеет под собой	1
и воспринимаем и ощущаем	1
строго говоря и ничто	1
идеальностью и эйдетичностью но	1
вещество не есть вещь	1
и пребывает имя всегда	1
имя есть мифический символ	1
ролью которая приписывается здесь	1
и т е и	1
тут сами собой ибо	1
лечения in mal part	1
эти две стороны и	1
и наторпа эти философы	1
n h e p	1
субстанциально трансцендентализм тоже рассекая	1
существующего между самой вещью	1
совершенно не обязаны быть	1
для религиозного сознания бог	1
материя кресла и его	1
именно так но нам	1
уже чисто логической а	1
противостоящая самой сущности? нет	1
ему смыслового круга оно	1
по плоти мало будет	1
смысловую сферу на бесконечный	1
вне себя необходимо знать	1
из себя самой упорно	1
имен от бытия на	1
абсолютно или в каком-нибудь	1
умных или вещественных приятия	1
и явления есть и	1
мы должны сказать что	1
эти две совершенно самостоятельные	1
между обоими методами лежит	1
имеют и цвет и	1
ее неизбежными спутниками рационалистической	1
мы подходим к вещи	1
каждое слово выражаясь популярно	1
всегда неизбежно абстракцией следовательно	1
этот самый смысл и	1
второй конечно ничто не	1
есть явление в подлинном	1
выражена и направлена в	1
– единая осмысленная субстанция	1
действительность просто но и	1
т е понятие тут	1
быть признаваема только наряду	1
дал конст аксаков равно	1
мы вскрывали ту сторону	1
личность должна выражать свое	1
специально говорящих о некоторой	1
данный лик ее имя	1
и различны в разных	1
от всего прочего мы	1
сила слово – активный	1
слова м эти работы	1
внутреннее никак не проявляется	1
в мысли конечно можно	1
существует но что о	1
категорий и – мы	1
это тоже некие совершенно	1
ней некоторой простой смысловой	1
необозримый исторический материал философии	1
голой материей но с	1
тут антитеза бытия и	1
душу и вообще всякую	1
образ действительности – вот	1
и сущность сама по	1
а изменяющееся мое настроение	1
вещь была действительно вполне	1
смысловой сфере что значит	1
правда иванов много не	1
можем иметь никакого представления	1
и не вещественным характером	1
отсюда вытекает во-вторых и	1
с ее смыслом что	1
вовсе не потому что	1
может быть или хотя	1
брала на себя функции	1
занимаемся нет транс-цеденталисты кантианского	1
уже замечаем что в	1
даже такие рационалисты которые	1
я его воспринимаю но	1
имени а есть ли	1
актуально готово вылиться в	1
есть ни бытие физическое	1
и отличен от нее	1
их именует имена же	1
и наторпа и феноменологический	1
активно in bonam partem	1
обезьяна должен признать что	1
теперь когда этот выразительный	1
другие ее стороны те	1
к языку немецкий идеализм	1
меня всегда тошнило от	1
и что такое имя	1
и рассекает действительность на	1
выраженная действительность есть конечно	1
нами вскрыто и определено	1
итак второе решение исследуемого	1
научно описать и объяснить	1
самим понять вещь значит	1
бы мы ее ни	1
есть орудие общения ее	1
которыми только оперирует философ	1
когда я смогу инобытийному	1
вещи а не к	1
простую истину бытия и	1
подходим к вскрытию природы	1
имя есть орудие не	1
в них или эти	1
с которой мы реально	1
умная энергия самопознания вещи	1
графитом тогда воплощение приведет	1
можем ли мы говорить	1
получена и – мы	1
вещи именному самопониманию соответствует	1
и позитивизма но имя	1
бы ни мечтали удушить	1
у нас все же	1
излучение вещи оно разумно	1
это учение вскрывает и	1
