не хотело говорить ни	1
общения никакой иллюзионизм и	1
е и звук и	1
для того чтобы получилась	1
явления есть нелепость недопустимая	1
– студенистые белки приятель	1
природе имени необходимо выдвинуть	1
вещи-в-себе или сущности субъект	1
как бы его аналогом	1
и темное сплошное бытие	1
и признает одинаково сущность	1
той заостренности и конкретной	1
исходный пункт метод построения	1
необходимо чтобы первая вещь	1
и явление из субъекта	1
какой-нибудь один слой и	1
ее максимальное выявление или	1
личностное самочувствие и углубленное	1
то же самое время	1
объяснить гипотезы которые ставит	1
даже не дурно если	1
ясностью вытекает что имя	1
понимания одного и того	1
заполнишь и тут мы	1
истерию и фантастику лишь	1
начинает претендовать на полную	1
и отвечает мне как	1
таящие в себе различие	1
собою же т е	1
собственную активную смысловую заряженность	1
построениями высших религий включая	1
их конкретной и реальной	1
эту описательную категорию превратить	1
логична нисколько не вытекает	1
ему? понимать можно только	1
имена и если когда	1
этими работами я приведу	1
вещь может разумно стремиться	1
является но если оно	1
факт давным давно установленный	1
живой жизнью или как	1
первые о том как	1
чтобы исходить из реально	1
не просто энергийное напряжение	1
также и e i	1
образцах социальной силы имен	1
звуков иван ни тем	1
же самым основаниям придется	1
средой но вдумаемся получше	1
что понимание есть нечто	1
всегда картина знания представляется	1
нужно для проявления сущности?	1
заполняемая бездна этот третий	1
примитивное религиозное восприятие понимает	1
может появиться хоть какая-нибудь	1
несколько иллюстраций из всемирно-исторического	1
и цель вещи хотя	1
не может быть окончательным	1
и когда происходит понимание	1
однако я понимаю широко	1
не значит во имя	1
во внутреннем и внешнем	1
духовная сила вот понять	1
часто они искажают и	1
самую смысловую структуру теперь	1
вещественное инобытие таким образом	1
сама сущность или другая?	1
с а в свете	1
факте математического естествознания и	1
вне ощущающего и вне	1
своем существе магия ведь	1
наши кушанья со своим	1
b то что касается	1
получения самой вещи теперь	1
вещью как только общение	1
– изуродование изнасилование себя	1
палку и выходите на	1
производит теперь только комическое	1
лишь конкретнейшее выявление самой	1
смысл т е определенным	1
тогда когда могу как-нибудь	1
субстанциальность и вещность не	1
живая религия всегда отличалась	1
жизнь только и возможна	1
вещи является в общем	1
абстрактное расчленение в сфере	1
успокоиться определенно выраженная действительность	1
обращает свое внимание на	1
полную или частичную копию	1
высказали нечто следовательно сущность	1
социальное и больше ничего	1
разума без внимания без	1
предполагает что предмет слышит	1
как и нео-кантианство ничего	1
внешние судьбы ее таковы	1
таковая ясно отсюда что	1
вещь понимаемая манифестирует себя	1
с развитием чисто греческого	1
самовыявлений и самовыражений веши	1
полной ясности и законченности	1
быть совершенно лишенным разума	1
происхождение одних смысловых структур	1
готовность инобытия подчиниться велению	1
смысла нео-кантианство дает систему	1
орудие общения оно есть	1
– не пассивный образ	1
и нечто внешнее это	1
что имя всегда предполагает	1
то ни было причинного	1
формы или смысла что	1
теорию языка основанную на	1
перехода и от одной	1
именем наконец и выражение	1
как с полной диалектической	1
через край своими смысловыми	1
не хватает для полного	1
личностное понятие личности выявляет	1
растерять его в дебрях	1
приведет к пониманию этой	1
как чисто натуралистический и	1
существует только сущность но	1
отражений вещи для осмысления	1
различие но можно ли	1
богов путем постепенного перевода	1
сущности тогда я в	1
содержательным характером учение об	1
понимает одно и то	1
само же по себе	1
вещь как тождественную себе	1
буду говорить история новой	1
же деле общее между	1
да и сама вещь	1
что он покрывает несколько	1
эти текучие явления должны	1
условно ни безусловно но	1
имени что оно есть	1
вещь и вещь имеет	1
самовыражений веши если идти	1
когда вы надеваете шляпу	1
это – очень бедная	1
это – ничуть не	1
значение вместо звуков могут	1
мы воспринимаем нашими внешними	1
чтобы не видеть этой	1
с полнотой социальной а	1
и чем вещь отвечает	1
воли чей-то мельчайший волевой	1
что не было ни	1
энергийное напряжение этого понимания	1
сторона ее например какое-нибудь	1
недостаточной философией этот тип	1
метафизики можно выразить и	1
так пусть я сообразил	1
дуализм непознаваемой вещи-в-себе и	1
было другими вещь должна	1
совершенно различными вещами обе	1
обстояние этой диалектики вечного	1
из сущности как абстрактной	1
зародили бесчисленное количество новых	1
философии однако тьма исчезает	1
и тогда наступает царство	1
не менее человеческая мысль	1
воплощения? для этого нужно	1
ее окружающим вместе с	1
виде просто смыслового выражения	1
всякий согласится что для	1
не постулировать понимание самого	1
хотя знать их и	1
общение? общение – в	1
именовать вещь? что значит	1
литературных указаний которые с	1
мы говорим что вещь	1
сознание есть результат физико-химических	1
анализ производимый внутри себя	1
том что я для	1
m a и пр	1
при каких условиях не	1
должна выражать свое внутреннее	1
иное как умная эманация	1
данной теории не может	1
уместна – конечно для	1
тою же самою если	1
это делать было бы	1
весьма неопределенной и законченной	1
что и сущность есть	1
вещи которое попадая на	1
есть и такой будь	1
смерть есть тоже момент	1
д вещей только и	1
же отвергнуть один аргумент	1
высока так глубока что	1
другое ее инобытие напр	1
у всех но у	1
чем-нибудь она имеет определенное	1
возможность а представлять в	1
других исследователей высказавших мнение	1
упоминания их сходных сторон	1
вещи сознание где она	1
перво-единого средневековые учения излагаются	1
образом категория эта лежит	1
как доказано явление не	1
таким образом явлению приходится	1
как психология и биология	1
смыслом это значит что	1
всего универсально-человеческое существование заговоров	1
или глина физиологических реакций	1
самое и самое высокое	1
тождественны еще и в	1
отличить живого существа кошку	1
с нею важно только	1
ни было сознательно и	1
ясно что такая сущность	1
истину обывательского реализма и	1
энергия сущности как понятия	1
моментов самой вещи что	1
– мы получим искомую	1
менее ярко в обыденной	1
которым они относятся есть	1
как раз в их	1
религии искусства общества семьи	1
другом смысле но если	1
или принципиально может быть	1
чем то с чем	1
чисто логическую структуру имени	1
бемера а не просто	1
такое этот принцип материи	1
фактах как принципах как	1
состояться зарождения имя также	1
понимания? что значит что	1
может быть ярче чем	1
антитезу действительности или действительной	1
говорить об индивидуально-смысловой природе	1
ее именем существует по	1
к вещи говорят и	1
но во-первых все эти	1
всякой глухонемой психологии с	1
таков раз я о	1
с чем сравниваем это	1
и сам именует свою	1
r i s k	1
религий совершенно неприемлемо ни	1
внутри этих границ имя	1
уже с трудом можно	1
вообще но ведь сама-то	1
пока на ступени явленного	1
мере к его пониманию	1
сущность есть нечто –	1
в рассудочных понятиях точка	1
крайней мере интуитивно в	1
условились не сходить с	1
все время активировать выражение	1
имя есть всегда какая-то	1
уже состоять из таких	1
вещи есть умная энергия	1
смысл имя же есть	1
другие предлоги в ветхом	1
есть смысл вещи разум	1
по себе какого-нибудь его	1
же в передней что	1
и тогда явления нет	1
подобное рассуждение уже предполагает	1
бы и никого и	1
в себе какую-нибудь сущность	1
прямо превращается в явление	1
вещь и имя первая	1
как бы застыло и	1
понимают но с нею	1
смысла не отличать ее	1
всего окружающего и вопрос	1
структуры фиксируемые в феноменологическом	1
можно сказать думают почти	1
c n h указывают	1
и движение и т	1
истории религий с другой	1
вещи но что такое	1
очень сильно выражать себя	1
ясна недостаточность его в	1
оказывается недостаточным в чем	1
внемысленное и немыслимое и	1
тут на вопрос между	1
именно проявляется этот основной	1
именах то да будет	1
неустанного становления и в	1
отождествить его с этим	1
можно ли не знать	1
субъекта и доказывать что	1
не будет а есть	1
самостоятельный не сводимый ни	1
это что она уже	1
не отличаются между собою	1
разнообразных учениях об отношении	1
к очень милому очень	1
она именно инобытийна она	1
объективно чисто предметно принадлежит	1
вещью? очевидно что тут	1
религии космические функции божественных	1
ней есть лишь моя	1
в этом случае? общаются	1
же это воплощение вовне	1
его культурность столь контрастирующую	1
результате моего понимания вещи	1
наоборот она приближает к	1
против него как только	1
часто вместо имени мы	1
понимания это значит что	1
и таким образом получается	1
и только вещественного общения	1
его явление и тогда	1
не удаляет меня от	1
фактами во-вторых же –	1
мы находим в гуссерлианстве	1
якоб говорит что эксегеза	1
общается и ее понимает	1
ни под каким видом	1
возможна благодаря своим идеально-логическим	1
любые вещи и факты	1
в самом общем смысле	1
просто сам смысл имя	1
тучу возражений упреков насмешек	1
и – w heitmuller	1
признающий реальность только одной	1
инобытие т е не	1
и слов и вообще	1
ее действительности напр пусть	1
те периоды когда данная	1
охват имя ведь невещественно	1
собранные в данном наименовании	1
у гизебрехта нет и	1
логическим дуализмом тут тоже	1
иррациональную пыль в которой	1
излагаю их здесь а	1
несколько строже в диалектическом	1
оставаясь на почве рационализма	1
наш существенный смысл может	1
же конечно имени и	1
действует на него как	1
зрения которая заставляет его	1
в чисто умной области	1
как и во всяком	1
образом оформленную объективную реальность	1
с ее окружающим эту	1
как вещь продолжает быть	1
тему это – в	1
находится в вещи но	1
и подобно богу изводит	1
понятие и следовательно принятие	1
если бы я думал	1
моя иллюзия и все	1
время убивать и удушать	1
же самый смысл туже	1
состоит из дерева но	1
от более глубоких причин	1
и другие виды народного	1
культура позитивизма субъективизма психологизма	1
есть орудие письма шкаф	1
на себе следы явления	1
отвечает моему пониманию соответствует	1
навсегда отвращает нас от	1
оно может так что	1
факт если подойти к	1
и единство мы видели	1
весьма настойчивая потребность признавать	1
же смыслу итак язык	1
и познаваемым т е	1
в применении к вещи	1
себе в ней философский	1
и больше ничего то	1
актуальны экстенсивны структурны динамичны	1
не только составить о	1
общения с ними это	1
всякую сущность в отношении	1
дали ряд великолепных анализов	1
определенная трансцедентальная методика которая	1
отличило данную вещь от	1
и реального восприятия чужой	1
метафизики конечно можно понимать	1
и окончательное разъяснение если	1
выявляет вещь всегда тут	1
его понимание имя есть	1
себе а потом она	1
но и она отвечает	1
произносится внутренне или внешне	1
не проявляется или что	1
субъекта имя вещи есть	1
вещи есть как бы	1
попробовать действительно узнать доподлинно	1
и абсолютная реальность вещей	1
глубокое обследование всей проблемы	1
понимать учение о смысловых	1
мышления и т д	1
образуются тогда когда уже	1
однако остановиться на этом	1
эта самовыявительная энергия ни	1
чтобы взаимопонимание происходило в	1
вещи отнюдь не предполагает	1
обращаются уже это одно	1
важно и очень существенно	1
и вещи в субъект	1
потребность признавать реальность вещей	1
в этом они безусловно	1
несубстанциально не специально умно	1
субстанции общение одной вещи	1
быть представлен или замещен	1
этой связи очень редко	1
нет жизни в белках	1
не есть не только	1
сущности вообще отсутствует? ясно	1
ни от чего деревянного?	1
и именуемой но также	1
я это уж сделал	1
самовыявление само было в	1
момент который делает иегову	1
силе и значимости слова	1
две весьма обстоятельные работы	1
д теперь представьте себе	1
себя по сравнению со	1
и оставаясь на почве	1
возможны любые вещи и	1
значит что на ее	1
самочувствием и самосознанием не	1
мышление это восприятие это	1
разъяснений сделать это нетрудно	1
знаменитому неоплатонику v века	1
образом мифический и магический	1
суть то что мы	1
не вполне ясны но	1
самой но она является	1
логическими искусство религия семья	1
действительности как бытия –	1
путем такого отграничения мы	1
модификаций идеи i вещь	1
оставаться нематериальной пусть им	1
груза наполняющих его энергий	1
его носителя так в	1
эти вещи общаются и	1
касается божественных имен относится	1
противостояния и дуализма вещи-в-себе	1
бесконечно-малых и непрестанно уходящих	1
т д таким образом	1
д вообще все внешнее	1
разумею как сказал не	1
никогда не значит во	1
получилась это значит что	1
вещи а и в	1
имени разве имя вещи	1
реальность они превратились в	1
что вещь понимает сама	1
понятий и не голых	1
именует что существуют только	1
воспринимается она кем-нибудь или	1
и позитивизма в xix	1
ее имени отграничен далее	1
чтобы было это новое	1
абсолютного дуализма и тюрьме	1
не могли остаться надолго	1
смысла и не относятся	1
расцветает до имени имя	1
неактивен слишком висит в	1
realismus in der geschichte	1
вызванное к бытию сознательной	1
быть чем-нибудь оформленным основной	1
отождествляемый со своим инобытием	1
же внутри своей собственной	1
необычайной силой и энергией	1
с чем то понимаемый	1
постоянное наполнение и становление	1
наполнен чисто личностным содержанием	1
в смысле общесоциальном рассматривает	1
ними в самом деле	1
бы в этом инобытии	1
равным образом и действительность	1
которых мы касались раньше	1
я и думаю что	1
самые категории как кем-то	1
антиномико-синтетический т е диалектический	1
привести частично этот материал	1
вещи – по преимуществу	1
и есть ее неотъемлемая	1
так позитивисту никогда не	1
значит уметь владеть вещами	1
не есть вещь смысл	1
иных движений языка или	1
знать самой вещи это	1
явленный образ в категории	1
быть только существенно-смысловым общением	1
никак нельзя сказать что	1
действительность? можно сказать даже	1
голоса в защиту реальности	1
том что вещь эта	1
можно из этой березки	1
чувства защищающего реальность проявлений	1
е утверждается заново как	1
личности конечно можно продолжать	1
в диалектическую формулу имени	1
некоторая узость и экономика	1
и эта культура основанная	1
д отнюдь не превращается	1
кто философствует в данной	1
по имени предполагал возможность	1
чтобы вещь имела смысл	1
приведу сначала более мелкие	1
прежде всего объединить явление	1
какой-то смысл или осмысленная	1
в силу и значимость	1
этот дуализм из метафизического	1
в понятии а в	1
из моментов цельного бытия	1
вещи остаться с явлениями	1
всей жизни а потому	1
станет действительно существенным подлинным	1
тут не избавляются от	1
