истину иронически намекая на	1
весьма вредными и нравственно	1
таким людям как к	1
возражал против распространения нравственного	1
например он описывает такого	1
то дочь их кухарки	1
у него в году	1
исканиях вл соловьева в	1
том что вл соловьев	1
страстные поиски высших истин	1
и которая определялась после	1
мужикам вообще свобода и	1
из подражания духовенству но	1
был близким другом историка	1
всегда был склонен реалистически	1
могли дать ему такие	1
к канту и фихте	1
последнего где уже не	1
а вот еще пример	1
окончательном виде вл соловьев	1
–й гимназии в которую	1
вспыльчивый пугал меня,' но	1
не менее его знания	1
него не отрицанием возвышенного	1
есть насмешка над действительностью»[	1
весь май так что	1
слов такого диспута я	1
п хитрово только в	1
настроениями вл соловьев писал	1
внимание на увлечение вл	1
философии и даже боролись	1
некоторые да и то	1
с соловьевыми и он	1
даже в складе ума	1
нечто весьма жалкое видел	1
в свои мысли и	1
юношеском материализме лто мы	1
был философом это был	1
в академической карьере своего	1
ума немножко философии удаляют	1
между ними можно говорить	1
что как раз этим	1
брат вл соловьева всеволод	1
вместе с тем я	1
петербурге впрочем не лишена	1
текстами заклинаний и вызовов	1
в кустах наслаждались своим	1
над историей развития земноводных	1
совсем никак не отмечалось	1
христианских культов прославленное благодаря	1
разных местах тоже у	1
надеждами на искупление от	1
мономаниях летающих столах и	1
на несколько дней направился	1
в дальнейшем преподаватель петербургского	1
сказать что дело не	1
или школьные фразы катехизиса	1
к владимир соловьев жизнь	1
основах последнего вл соловьев	1
троицкого производила неприятное впечатление	1
самом же деле это	1
одновременно преподавал в университете	1
вл соловьева было объявлено	1
жена которая была московской	1
это традиционное спокойствие унаследованное	1
ни с того ни	1
ума и характера его	1
талантливым переводчиком с древних	1
и известнейшим символистом весьма	1
такой свободе ото всякого	1
называет я»[ соловьев с	1
нас любовь или отвращение	1
пишет но стоило софе	1
огромное значение для вл	1
через год из&#;за границы	1
только поразить даже самого	1
веры бог у них	1
многие в былые времена	1
вл соловьевым в петербурге	1
вскоре свои возражения в	1
малообщителен его гимназический и	1
этой должности попечителем московского	1
своей постоянной и очень	1
случае софья петровна хитрово	1
года он был утвержден	1
соловьева в его университетские	1
представление о предметах веры	1
в брак но она	1
часов ученой беседы так	1
чрезвычайно большой сложностью натуры	1
время когда он зачитывался	1
об отношении философа к	1
него с необычайной экспансивностью	1
они всерьез интересовались этой	1
интересные воспоминания вл соловьева	1
связаны с его занятиями	1
статью а а козлова	1
пользовался старший брат вл	1
подробно в письме к	1
федорову вл соловьев тоже	1
в годы этой карьеры	1
духовное происхождение тем не	1
если а м иванцов–платонов	1
волосы в те годы	1
английской и французской философии	1
в итоге все исследование	1
и всецело погруженном в	1
у одного итальянского кондитера…	1
систему и мыслить чисто	1
сближения соловьева с семьей	1
и школьные годы в	1
удивительным и поразительным даже	1
диссертация написание и защита	1
смысле своеобразной модой относительно	1
физические и психические особенности	1
тихим светом душа засветилась	1
вероучительных теориях знаток и	1
речке химке мы подбегали	1
мы сейчас приведем несколько	1
бороться в жизни и	1
только нудная и скучная	1
меры чтобы стать профессором	1
считая что всему свое	1
любви никакой даже эгоистической	1
доцентом если свою магистерскую	1
отвлеченных начал поэтому в	1
же с ] было	1
спокойно–традиционных в возрасте лет	1
заботился потому что его	1
влекли к себе вл	1
других трудов[ ср введенский	1
подобных материалов мы уже	1
вытеснить все прежние верования	1
же восторженных тонах письмо	1
молодости он слушал ф	1
был гораздо либеральнее его	1
и сближался с либеральными	1
при жизни а к	1
очень любил а с	1
ум в г законоучитель	1
интригах столетней давности довольно	1
и даже был магистром	1
философский диспут ноября гражданин	1
нее уже есть внуки	1
соловьева то мы можем	1
касается значительного либерализма по	1
того страшного чувства неисполненного	1
его основополагающие позитивистские труды	1
актрисы г–жи собещанская воронова	1
цель нашей деятельности за	1
м соловьев в своем	1
настроений и юмористики у	1
нас в надеждах на	1
священник не чуждый литературе	1
спиритуалистом и притом весьма	1
пр м м стасюлевич	1
и уже в декабре	1
однако эта критика пантеизма	1
восходящего к хг веку	1
ряда важных проблем по	1
даже самые серьезные философские	1
возвращению в россию только	1
некотором отношении дебольский здесь	1
к защите его докторской	1
л радлова пг ]	1
служебная деятельность были для	1
состоянии их сравнивать и	1
каждое воскресенье утром он	1
что он не очень	1
автора дон жуана поэта–романтика	1
у одного из излюбленных	1
соловьева все животные исключительно	1
он уже сидел в	1
соловьева главным образом из&#;за	1
детей вету елизавету андрея	1
изучал э гартмана который	1
возражал против чисто религиозных	1
пустейший болтун с дурными	1
видели и понимали что	1
говорит необыкновенная находчивость какое&#;то	1
наука дать отказывается некоторые	1
в году знаменитые впоследствии	1
как сам вл соловьев	1
я цингеру и н	1
обращения связанная с редкой	1
позитивистами и материалистами и	1
и шеллингианские элементы в	1
по которой видно что	1
и теперешняя философия они	1
в выражениях они отделяются	1
затем несколько лет опять	1
месяцев он уже сдал	1
соловьев зачитывался тогдашними вульгарными	1
молодом соловьеве не знавшем	1
наконец весьма важно мнение	1
началом божественным и началом	1
м троицкий для молодого	1
научная деятельность иванцова–платонова или	1
чувств возникших у него	1
года и проживал в	1
бесконечно добрый характер но	1
даже смущался этим обстоятельством	1
он нашел то чего	1
напугали разбойники и до	1
атмосфере романтической таинственности и	1
к михайловский сравнивает этот	1
же обязательным авторитетом людвига	1
в немецкой английской и	1
правда пока еще достаточно	1
годы отрочества я скорее	1
долгом всякого человека в	1
на весь свой весьма	1
любил владимира мономаха и	1
спрятавшись в кустах наслаждались	1
и вот тут&#;то б	1
хг веку был поэт	1
до какой партийности но	1
же м с соловьева	1
особым предметом моих преследований	1
жилище»[ соловьев вл письма	1
и такие рассуждения б	1
в эти школьные годы	1
убедительно преданной бескорыстному исканию	1
его удачливым соперником на	1
которых соловьев был большой	1
во всем его духовном	1
правда в очень юные	1
хотя бы по его	1
развитие философской мысли и	1
нежности и кажется любил	1
но в знак своего	1
а их&#;то вл соловьев	1
отвлеченный разум изведано и	1
историей пугачевского бунта однако	1
романовой сейчас полученное мною	1
кое&#;кто из знати даже	1
хотя бы на то	1
характеристической особенности лежит корень	1
тут между прочим залегает	1
зал наградил его громом	1
в протекающей за версту	1
эмпиризма а это можно	1
возрасте эта софья петровна	1
наблюдениями над историей развития	1
не кланяться и если	1
толстая вообще воспитывала многих	1
с удовольствием сказал отцу	1
непоколебима софу я всегда	1
человеческие идеалы и понятия	1
соловьева вообще и в	1
касается автора настоящей работы	1
автор настоящей работы в	1
сглаживали многое и я	1
м соловьев был самый	1
поэтому не приходится удивляться	1
козлов был противником материализма	1
даже унизительным что касается	1
ощутил в себе медиумические	1
вполне понятно поскольку заграничные	1
действительность жизнь для нее	1
материя»? можно утверждать только	1
христовых но он ничего	1
м троицкий никак не	1
чем кто&#;либо другой б	1
давали волю тем кто	1
спокойного раздумия традиционности и	1
времени работы вл соловьева	1
исторический метод с м	1
пантеизма у вл соловьева	1
но этот факт ярко	1
него сказывалась всегда в	1
его путешествием в египет	1
ответил в в лесевичу	1
всеединстве[ там же с	1
указать хотя бы на	1
неправильно вл соловьев здесь	1
материалиста столь страстно убежденного	1
москвы цель нашей деятельности	1
не успел он приступить	1
и трудолюбие и хотя	1
и и янжула который	1
м лопатина религиозное настроение	1
разным источникам то никакой	1
сыну читать ренана считая	1
лукьянову также и относительно	1
необычайный гнев у его	1
он говорит необыкновенная находчивость	1
присущее желание помочь и	1
соответствующими документами он своей	1
позднейшего лесевича после этого	1
ср введенский александр научная	1
пределы индуктивной логики и	1
с п хитрово а	1
называется о высшем благе	1
золотой медальер…»[ величко в	1
году и которая определялась	1
важно оно интереснейшим образом	1
добрый бесконечно добрый характер	1
и нравственно и физически»[	1
и создавал свою собственную	1
книга одна из главнейших	1
не существовало имеются сведения	1
опровергнуть тружеников науки великих	1
всегда вел себя спокойно	1
с парком кладбища и	1
был настроен достаточно либерально	1
движение должно возродить человечество	1
равно нулю трудно даже	1
оставаться на почве философии	1
статьи[ журнал министерства народного	1
что вл соловьев чем	1
в комиссиях через которые	1
днем россию можно поздравить	1
хотя вл соловьев в	1
недопущения к защите его	1
коммерческого училища о нем	1
следующим разделам октября по	1
его таланта юмористика была	1
может быть также определен	1
погруженном в свои мысли	1
его молодые годы материалы	1
в диссертации с небывалой	1
абсолютизация нравственности? заставляют задумываться	1
были полны нежности и	1
конечно с идеалистом вл	1
сначала со страхом потом	1
платонизма из многочисленных мнений	1
с н трубецкого научная	1
возмущение отца и –летнего	1
вот они обращаются к	1
и председателем научн&#;го совета	1
вл соловьеву наивная и	1
ее отец был видный	1
] влияние п д	1
у них совершенно один	1
умер он через год	1
романовой и безответно но	1
на языке самого вл	1
в университете и в	1
его научной и философской	1
социалистическую даже коммунистическую окраску	1
права тоже впоследствии и	1
не м м троицкий	1
с ] но в	1
магистром вл соловьев уже	1
он пробыл только четыре	1
что п д юркевич	1
существования мира вне человеческого	1
лопатиными в селе покровском	1
всему видно что отношение	1
хорошо сделал умерший в	1
питал как мы увидим	1
грамотный идеалист в философии	1
вл соловьев вот что	1
жизни важны также и	1
главным образом в обращении	1
такого важного дела надо	1
необычайное упорство м м	1
вл соловьева дело в	1
нами и осталось а	1
содержания но сделавшие его	1
сыграет весьма большую роль	1
ничего необычного и тогда	1
не изучался произвел анализ	1
стоит упомянуть еще младшего	1
товарищу князю д н	1
были убеждены что добрый	1
нас обоих белую простыню	1
вл соловьева против михайловского	1
благодаря первоначальному монашеству и	1
философии и на высших	1
абсолютно точно потому что	1
высшее образование вл соловьев	1
был в париже и	1
мне всю мою жизнь	1
был малообщителен его гимназический	1
мировая воля но отрицание	1
году ясно что вл	1
сказать что сам с	1
соловьевской философии отметим работу	1
светским он колоссально много	1
к изучению чисто философских	1
только обыкновенной и естественной	1
университета с м соловьев	1
которые в трогательном союзе	1
лекции по истории философии	1
дошли до двора куда	1
имении соллогубов рождествине под	1
психологического позитивизма не помешал	1
разум изведано и оказалось	1
к разного рода событиям	1
от христианства философа чем	1
счастливую и разумную жизнь	1
выступает против вл соловьева	1
ее детском возрасте эта	1
для изучения в британском	1
говорит что в своем	1
ю ф самарина с	1
не может верить так	1
монархист но и считался	1
соловьева к с п	1
особенных усилий можно усматривать	1
о лапшиным и а	1
вера сменяется периодом рассудка	1
мою симпатию смешно сказать	1
метафизического эмпиризма еще в	1
что мистицизм вл соловьева	1
оказалось негодным и сам	1
времени магистерской диссертации вл	1
же после окончания университета	1
в подробности этой полемики	1
к нему критически человек	1
нем религиозной потребности религиозное	1
особенно тем кто занимается	1
церемония произвели на меня	1
своем раннем детстве отрывки	1
подал прошение о заграничной	1
это увидел местный мужик	1
можно сказать об этих	1
идеалы в то время	1
взрослого и зрелого человека	1
что карамзин был не	1
действительности она есть насмешка	1
качестве вольнослушателя в промежутке	1
продуктивность в течение всей	1
уже сказали в ноябре	1
обширными философскими материалами основная	1
вл соловьеву никуда не	1
пантеизмом и в личное	1
ужас н н страхов	1
блистательность это его собственный	1
в бугаев был отцом	1
боялся не будет ли	1
залегали корни соловьевского либерализма	1
самом деле мчится? что	1
соловьева необходимо сказать что	1
рисует один из глубоких	1
рекомендуем другая работа о	1
и добра было^больше но	1
и теперь вспомнить тяжело	1
качество рассматривается у вл	1
непонимания тогдашними позитивистами ни	1
в переводе на современный	1
москву он декабря прошел	1
автора как плотин который	1
именно с тем что	1
бестужева–рюмина несмотря на позднейшее	1
н н страхова еще	1
года выехал из россии	1
либеральными кругами таким людям	1
этими представлениями остаются навсегда	1
изучению и сопоставлению платона	1
него иной раз даже	1
весьма жадный до всякого	1
в диссертации которые казались	1
уравновешенной атмосфере ег&#;› семейной	1
андрея и рюрика георгия	1
поощрять развитие философской мысли	1
делает соловьевское всеединство тоже	1
историк создавший множество трудов	1
и догмат и ритуал	1
соловьев вообще изучен пока	1
в я цингер и	1
известного поэта а к	1
отрицал бога но скоро	1
соловьева стали заметно холоднее	1
характеристики и речи м	1
между началом божественным и	1
и самого вл соловьева	1
соловьева за слишком высокую	1
мною письмо твое возбудило	1
с п хитрово лет	1
филарета был внезапно заменен	1
корыстных или карьеристских стремлений	1
он безнадежно много лет	1
людвига бюхнера небезынтересно будет	1
интерес к чичерину даже	1
вся эта характеристика духовной	1
с немецкими философами и	1
основной образ мыслей зрелого	1
соловьева куку правда брак	1
обществе немногих русских сходившихся	1
вполне вежливо и академически	1
как п д юркевич	1
романовой в детстве всякий	1
устроено нами пришествие антихриста	1
вот что он сообщил	1
чем не заинтересованного историка	1
вып м ] козлов	1
итак согласно сказанному выше	1
биографию которую выше мы	1
знакомых и по причинам	1
немецкая психология в текущем	1
и срезневский и м	1
и считал за окончательную	1
заграничные научные командировки всегда	1
он переживает сомнения в	1
обывательщины которая почти всегда	1
брата повалил на одной	1
оппонента с возражениями не	1
и в ярко выраженной	1
