т iii с ]	10
соловьев вл письма т	10
магистерской диссертации вл соловьева	7
там же с ]	7
письма т iii с	5
вл письма т iii	5
вл соловьева в эти	5
к е в романовой	4
дело в том что	4
к с п хитрово	4
в то же время	4
с м указ соч	4
вл соловьева в его	4
лопатин л м философские	3
там же с –.]	3
в московском университете в	3
вл письма т ii	3
то что вл соловьев	3
указ соч т iii	3
м указ соч т	3
с м соловьев был	3
соловьев вл письма с	3
лукьянов с м указ	3
в доме а к	3
письма т ii с	3
и психологии № кн	3
м философские характеристики и	3
философии и психологии №	3
у вл соловьева еще	3
л м философские характеристики	3
письме к е в	3
соч т iii с	3
соловьева в эти годы	3
философские характеристики и речи	3
воспоминаний с п хитрово	3
к д н цертелеву	2
что вл соловьев очень	2
для характеристики вл соловьева	2
в году в письме	2
для него пустым местом	2
в письме к е	2
л указ соч с	2
образование вл соловьев получил	2
свидетельствуют о том что	2
а иной раз даже	2
еще и потому что	2
один и тот же	2
владимир соловьев жизнь и	2
в письме к д	2
мнение н н страхова	2
которой рассказывает в л	2
период магистерской диссертации вл	2
мистицизм в науке м	2
указ соч с ]	2
ученом совете московского университета	2
бы обратить внимание читателя	2
вл соловьев в году	2
на ученом совете московского	2
ред э л радлова	2
э л радлова т	2
сообщил с м лукьянову	2
сергеевича соловьева под ред	2
чувства к с п	2
т i с ]	2
воспоминаниях с п хитрово	2
в том что в	2
в свое время он	2
у с п хитрово	2
о верховной цели нравственной	2
и к вл соловьеву	2
россии с древнейших времен	2
хотели бы обратить внимание	2
нас нет возможности одинаково	2
т ii с ]	2
вл соловьев получил в	2
выписки из воспоминаний с	2
году в письме к	2
письмо м а малиновского	2
в период магистерской диссертации	2
вл письма с ]	2
историка с м соловьева	2
чичерин б н мистицизм	2
софья петровна хитрово была	2
для с м соловьева	2
вл соловьева еще и	2
с в де роберти	2
с м соловьев как	2
л м лопатина а	2
второй диссертации вл соловьева	2
к этому времени уже	2
там же т iii	2
же т iii с	2
б н чичерин не	2
а к толстого в	2
и в то же	2
этому нужно прибавить что	2
благе или о верховной	2
в детские и школьные	2
детские и школьные годы	2
диссертации вл соловьева этот	2
вл соловьев никогда не	2
к этому нужно прибавить	2
владимира сергеевича соловьева под	2
философии в московском университете	2
доме а к толстого	2
был для него пустым	2
вл письма т и	2
он подал прошение о	2
и то обстоятельство что	2
после смерти а к	2
вл соловьев очень быстро	2
вл соловьева свидетельствуют о	2
вл соловьева необходимо сказать	2
характеристику студенческих лет вл	2
с вл соловьевым и	2
нет возможности одинаково подробно	2
из воспоминаний с п	2
и сам вл соловьев	2
с п хитрово по	2
магистерской диссертации вл соловьевым	2
т и с ]	2
письме к д н	2
у нас нет возможности	2
в л указ соч	2
книга б н чичерина	2
о которой рассказывает в	2
д н цертелеву от	2
о том что он	2
с п хитрово к	2
у вл соловьева уже	2
и с п хитрово	2
с его точки зрения	2
л м лопатин пишет	2
б н мистицизм в	2
письма к е в	2
мы хотели бы обратить	2
с п хитрово пишет	2
журнал министерства народного просвещения	2
характеристики и речи с	2
вл соловьев защитил в	2
или о верховной цели	2
сам с м соловьев	2
в ответ на это	2
н мистицизм в науке	2
с вл соловьевым в	2
в течение всей жизни	2
как мы увидим ниже	2
и речи с ]	2
соловьева л м лопатин	2
вопросы философии и психологии	2
к толстого в его	2
о высшем благе или	2
письма т и с	2
высшем благе или о	2
студенческих лет вл соловьева	2
как мы уже сказали	2
смерти а к толстого	2
вл соловьева л м	2
соловьева особенно рюрик всегда	1
и вести себя весьма	1
эти состояния имеют для	1
диссертации в биржевых ведомостях	1
в британском музее памятников	1
и не разбирается в	1
его мучительному состоянию при	1
из&#;за состояния источников в	1
некоторым благоговением почти что	1
в своей семье большим	1
толстой желал ввести какую&#;то	1
весьма глубокого и тонкого	1
всей этой тогдашней академической	1
в качестве вольнослушателя в	1
множества слышанных мною за	1
и верит конечно на	1
вл соловьевым особенно опекала	1
и академически но в	1
на академическом поприще по	1
черты несдержанности и раздраженности	1
земле»[ лопатин л м	1
история россии с древнейших	1
а в конце концов	1
полностью в настоящем издании	1
историкофилологический факультет но как?	1
своим религиозным взглядам весьма	1
высших женских курсах в	1
нами физической силою и	1
стасюлевича к религиозно–философским вопросам	1
от года к а	1
века вл с соловьев	1
было одной из причин	1
науки немножко ума немножко	1
конт и милль все	1
истины добыть нельзя»[ там	1
происхождением хотя предки михаила	1
момент к своему –летнему	1
с неодолимым фактом а	1
интереса к канту и	1
сдавать кандидатские экзамены или	1
досталось провести і часа	1
отвращение восторг или ужас	1
первого выпуска iii тома	1
что же касается значительного	1
переворот в соловьеве вызывает	1
и гармоничности для дворянства	1
моих преследований сговорились меня	1
как будет непонятно и	1
спор был оживленный публика	1
мы увидим ниже вл	1
овладения иностранными языками но	1
от бога побольше ума	1
и хотя с нами	1
он верил будучи ребенком	1
видный историк создавший множество	1
уже есть внуки между	1
и характера его совершенное	1
чернышевского и не очень	1
и сам с м	1
не профессором да и	1
историко–филологического факультета и на	1
юношеский материалистический период если	1
курсом по истории новейшей	1
всякий принимает уже готовые	1
сочувственных свидетелей научного торжества	1
идеей которая пронесена философом	1
л величко человек близкий	1
глубоко всех нравственных волнений	1
в законченном виде так	1
о семье он даже	1
каким был л м	1
н и стороженко определенно	1
он не очень любил	1
жизнью я никогда не	1
условия для его образования	1
июня видимо июня года	1
меня к себе на	1
изучением спинозы фейербаха канта	1
в науке»[ чичерин б	1
мы перешли к практическому	1
знаками у него впоследствии	1
дальнейшем изменил свой взгляд	1
в нем поражавшая черта	1
о нем сохранилось предание	1
год издавал по одному	1
лектором но раз и	1
с сковороды тоже иной	1
я всегда жалела она	1
сложилась весьма благоприятно для	1
потому как необходимость мир	1
но безвременная кончина вл	1
что он сам называл	1
соловьев стал овладевать философией	1
с ] если дать	1
был достаточно объективен в	1
позитивизма который подвергался критике	1
и философские взгляды в	1
м и владиславлев для	1
себя вести кланяться или	1
молодого и ярко выраженного	1
к своему отцу михаилу	1
не один идеальный мир	1
диспут но и оказался	1
принадлежит немало и других	1
ренаном пустейший болтун с	1
весьма слабого развития русской	1
чувство природы окрашено довольно	1
устаревшего в те времена	1
аппарат н г дебольского	1
сообщения м м ковалевского	1
по своей устойчивости выдержке	1
нет и не может	1
для вл соловьева имела	1
философию глупостью в особенности	1
своими романами на исторические	1
была племянницей с а	1
при этом оказалось что	1
смысле так и в	1
к молниеносной ориентировке в	1
эти древние египетскохристианские мистические	1
книги россия и вселенская	1
философ отличавшийся между нами	1
просто сама командировка но	1
и из жизненных наблюдений	1
что никаких документов которые	1
философии русской истории в	1
открыл диспут но и	1
нее главными причинами бытия	1
отправлявшемся из бриндизи в	1
середины века графа алексея	1
соловьевского либерализма принесшие в	1
попечителем московского учебного округа	1
этом пишет с п	1
распространения нравственного процесса на	1
веке в россии к	1
еще одна цитата из	1
всем пунктам ему даже	1
то как сам вл	1
м стасюлевичу пишет а	1
по–видимому одной из целей	1
соловьев покончил вероятно еще	1
интересовались наблюдениями над историей	1
нашли одобрение у такого	1
что вл соловьев был	1
деканом вновь организованного историко–филологического	1
соловьева и много о	1
веры необходимо если не	1
по плотину и дал	1
и носила весьма приподнятый	1
в –й а сразу	1
и юный ум свободен	1
настроен прогрессивно и либерально	1
и поведения нашедшими для	1
был также основателем и	1
ректором университета можно сказать	1
и творения –е изд	1
а к толстому этот	1
болезнью роста своего сына	1
по русской истории один	1
вл соловьев был охвачен	1
никакой из них не	1
ненавидел их ото всего	1
в этом смысле оно	1
содержания? вл соловьев всегда	1
в обычном смысле этого	1
ученую степень в указанном	1
которые мало чем отличались	1
слишком большие уступки эмпиризму[	1
и с широтой исторического	1
лично присутствовал на защите	1
иногда пишутся диссертации отечественные	1
сочинения теоретиков социализма и	1
его жизни когда он	1
оппонентов откуда мы приведем	1
беллетристическую литературу увлекался белинским	1
возможно не хотел попадать	1
более глубокие чувства вл	1
напечатанная тогда же отдельно	1
очень глубокой близости к	1
из излюбленных им писателей	1
не без влияния материализма	1
для теории происхождения всего	1
мое жилище»[ соловьев вл	1
что подробно исследовал биограф	1
французской философии общее же	1
это и есть тот	1
всего неоплатонизма ему принадлежит	1
строгая но справедливая и	1
не одно глубокое философское	1
вл соловьева только отвращение	1
по воскресеньям причем все	1
что они еще и	1
расстался с этой мечтой	1
доме стал питать нежные	1
ввиду необычных особенностей диссертанта	1
и магических опытах таков	1
напечатал вскоре свои возражения	1
против этого и хотела	1
фихте свидетельствует тот например	1
сыну александра ii тогдашнему	1
чертежами текстами заклинаний и	1
равнодушия с небывалой умственной	1
соловьева уже и потому	1
года был назначен профессором	1
мысли и и янжул	1
и доцентом петербургского университета	1
лукьянову из книги которого	1
характера по сообщению л	1
имела своим предком замечательного	1
допускал разного рода выходки	1
читал весь этот семестр	1
некая юлинька с играла	1
сковороды тоже иной раз	1
толстого в его повести	1
делал из него никакой	1
и знакомых постоянно и	1
он относил этот момент	1
с другой стороны мы	1
возвышенной красоты духовного портрета	1
семьей толстого общий тон	1
никакой сенсации и никакой	1
то перед младенцем софией	1
ходили слухи что в	1
абсолютной правды на земле»[	1
не очень любил и	1
на нем прыгать это	1
сказать с такой благородною	1
на всю жизнь посвящая	1
лесевич определенно заигрывает с	1
касается самого и и	1
западник но он никогда	1
философами и греческими богословами	1
было чрезвычайно положительным за	1
козлову вл соловьев не	1
был видный и авторитетный	1
периодов истории четвертый оппонент	1
№ кн например с	1
тоне разгромил диссертацию решительно	1
теперешних суждений о философском	1
времена почти никем не	1
стремился ни к какой	1
[ в скобках цифры	1
и естественной научной или	1
о магнетических токах одержимости	1
из районов самой москвы	1
средневековой философии»[ лукьянов с	1
обратили бы внимание на	1
путь вл соловьева детские	1
уже сидел в британском	1
грубо а скорее тонко	1
м иванцов–платонов оба они	1
слишком преувеличивал свой юношеский	1
вызвать у вл соловьева	1
не скоро только в	1
взглядами и требованиями яростно	1
в своем элементарном эмпиризме	1
слепой бессознательной вере конечно	1
время и безусловное основание	1
закончить характеристику студенческих лет	1
принимает уже готовые верования	1
был двоюродным племянником с	1
не много нужно ума	1
вл соловьева весьма высокое	1
сердечной близости с ним	1
вл соловьева помешала довести	1
выше всякого явления физического	1
просто не представляли себе	1
и у гартмана из	1
ректором московского университета а	1
что мы и сделаем	1
для себя наибольшее выражение	1
и университетский товарищ впоследствии	1
холостяком постоянно переезжающим с	1
довольно точно воспроизвести основное	1
так как соловьевское всеединство	1
л величко… с того	1
они еще и сейчас	1
а жившие в покровском	1
эта внутренняя уравновешенность и	1
очень часто допускал разного	1
вл соловьев поступил сначала	1
крестьяне отец вл соловьева	1
весьма тонкие правда пока	1
тенденции особенно мы обратили	1
году он окончил университет	1
длинные волосы в те	1
исканий с изучением спинозы	1
в этом доме стал	1
цели нравственной деятельности спб	1
ловкостью а также большой	1
приучил меня почти невольно	1
первая лекция января была	1
в жизни вл соловьева	1
необыкновенная находчивость какое&#;то уверенное	1
впоследствии крупный историк н	1
особенно мы обратили бы	1
и приветствия в этом	1
что этот пойдет дальше	1
но его основополагающие позитивистские	1
и шлейермахеру и содержащими	1
того у вл соловьева	1
собственно говоря никогда не	1
вынесенное мною из этих	1
с еще большим рвением	1
вести кланяться или не	1
темой диссертации но срезневский	1
м о вл с	1
возвышенно настроенном и в	1
соловьев никуда далеко не	1
атмосферы добрых и высокомыслящих	1
соловьева о софии»[ мочульский	1
дать отказывается некоторые обращаются	1
селевиной от декабря года	1
математика и физика их	1
не было более далекого	1
значительной мере перешел и	1
двух статьях философский диспут	1
на религиозные темы… переход	1
пойдет дальше в нашем	1
с м соловьев в	1
икон из окна во	1
а то мы изобретали	1
написал и защитил диссертацию	1
чисто философскими понятиями вопреки	1
догадались устроить как раз	1
меня из опасных положений»[	1
п хитрово намереваясь использовать	1
и почитательницы вл соловьева	1
соловьева о том с	1
восторженно и в то	1
литературы и относятся скорее	1
возражал и против распространения	1
полицейского права ведров сделал	1
на него шлейермахера а	1
гартман в итоге все	1
его борьбой против всякого	1
а также ввиду общей	1
основного свойства человеческой природы	1
мы должны засвидетельствовать наличие	1
одной могиле крест и	1
трудно почерпнуть в каком&#;либо	1
этого автора отличалась довольно	1
перешел и к его	1
период своей философии вл	1
знания и глубокой внимательностью	1
бурного свободомыслия к великому	1
бывать в пустыньке имении	1
саввича сковороду между прочим	1
нельзя противополагать субъект и	1
из&#;за границы вл соловьев	1
весьма отрицательным но это	1
соловьева за его попытку	1
и выше всех наша	1
нас учесть и то	1
которое нам представляется весьма	1
окружением но в заключение	1
необыкновенная вера в то	1
и с его туманными	1
поднимать скандала и не	1
совмещения но математик н	1
из многочисленных источников вел	1
года эти факты свидетельствуют	1
и совсем не банальный	1
защита диссертации состоялась ноября	1
и реален в изображении	1
однако от неудобства помещения	1
время он назывался современной	1
и следующая догадка дело	1
несомненным и его надо	1
была не по годам	1
прямым кощунством по н	1
писаревым и проникшись его	1
культурно–исторической области на этом	1
некоторые сведения о пребывании	1
жизни так и его	1
по поводу диссертации вл	1
соч с –.] в	1
а в дальнейшем преподаватель	1
умственное развитие запада явлением	1
м м троицкого производила	1
крупного автора как плотин	1
нечеловеческие крики для других	1
древнейших времен а таких	1
