набросках некий социалист нападает	1
пикареск что и делают	1
же время достоевский в	1
шекспира евгений у ног	1
комического осмеяние христа связанного	1
смог ясно осознать характер	1
повседневный трагизм истории ее	1
а мои воспоминания м	1
в году внимание писателя	1
картинку о генерале который	1
на убийцу слова настасьи	1
части он пытался изобразить	1
личностей типа раскольникова или	1
следуют друг за другом	1
героя который раньше гулял	1
составит затруднений полифоничность евгения	1
толстой с полным правом	1
смешные мешают какие-то шуточки	1
служил выявлению сверхличной мифологической	1
романом высшего класса а	1
не карикатура на тургенева	1
трактирной исповеди мармеладова обычные	1
он жесток то в	1
канцелярии комитета министров в	1
это кровь… на убийцу	1
бездетными и род кушелевых-безбородко	1
целостности которая означает в	1
людях и на себе	1
него падучая и нервные	1
дому кушелева-безбородко характер караван-сарая	1
искусство достоевского идеологично и	1
вообще говоря относится и	1
утверждает что зритель античной	1
христа жутко достоверная картина	1
хорошо известным и еще	1
иван возвращает богу входной	1
болезненности ни во что	1
пушкина этот суд тоже	1
важнейшая сцена повести многократно	1
что красота спасет мир	1
невозможной в бытовом отношении	1
мысль скрытого мифа романа	1
разоблачил и подлинное историческое	1
он приходит к сознанию	1
я панаевой с легендарным	1
у достоевского мы наблюдаем	1
реализуют метафорическое выражение родство	1
целом ряде случаев фома	1
бесспорно умный хитрый и	1
наряду с общеизвестными автобиографическими	1
а обретается в ее	1
в церкви блудницы)… в	1
что они имеют смысл	1
же дезавуируется он вышел	1
к использованию евангельской легенды	1
мифа в духе романтического	1
п достоевский художник в	1
завязкой и развязкой… прежде	1
в свой кругозор всю	1
выступает у достоевского как	1
избыточных фабул извлекаются некие	1
содержанке раздающего деньги просителям	1
между раскольниковым и порфирием	1
а а краевского чтоб	1
служит одним из условий	1
иван карамазов отвечает на	1
эпохальные масштабы захватывающие евангельскую	1
его творческий процесс советские	1
идеи и стиль м	1
мир в целом и	1
медицинские пояснения о болезни	1
писемский в году сообщал	1
все это делает ярость	1
меня по крайней мере	1
непосредственное назначение этих принципов	1
надобно мысль разрешить идейность	1
и не внешнее определение	1
терминах вечного бунта против	1
с другой стороны и	1
особенно взволновать безумцы красноречивая	1
и ее оскорбленного достоинства	1
зритель античной трагедии испытывал	1
голодные собаки во х	1
позиции так сатирический тон	1
насыщает текст традиционной символикой	1
письмо графа к дружинину	1
откажется он будет вечно	1
ему представляется весьма существенным	1
комедии данте для русского	1
идей времени построение гипотез	1
тургенев и с собр	1
романах характеры вторичны по	1
обанкротилась в этом подпольный	1
раскольникова в терминах народной	1
мальчишка накрытый юбкой пройдохи	1
статье петербургский сборник выделил	1
дорогам плыл безумец навстречу	1
статье по поводу отцов	1
создает символический фон он	1
года в дневнике что	1
пришлецов игроков мелких журналистов	1
называл манеру достоевского идеалистическим	1
нередко он спешно уходил	1
народ тысячью голосов оценивает	1
евгения онегина отмеченная м.m	1
вальтера скотта или дуэли	1
никакие изыскания прототипов не	1
своей ранней повести хозяйка	1
из многих и она	1
как она рассказана в	1
ли доказывать что приключения	1
них встает определенный художественный	1
у пушкина клейкие листочки	1
лица симпатичны читателю и	1
достоевского весьма активен к	1
львом николаевичем мышкиным если	1
в романах достоевского весьма	1
достоевского но эта функция	1
наблюдениями исследователь допустил некоторые	1
лишними людьми русской классической	1
сопоставил не без оснований	1
земной практический путь все	1
строить догадки о том	1
передает случившееся в ту	1
о ком другом в	1
мистический реализм апокалиптический реализм	1
первого взгляда узнал его?	1
области идей а обретается	1
в конце жизни очень	1
прибегает к поэзии тайны	1
считать одного сочувствия к	1
даже юлия пастрана от	1
настасьи филипповны в бордели	1
сюжета восходящего к королю	1
германн из пиковой дамы	1
достоевского бог проявляется только	1
была для него второстепенной	1
но нас интересует другое	1
она отнюдь не господствует	1
в утилитарной этической теории	1
в меру немецкий романист	1
образ князя с г	1
может быть назван вторичным	1
позднего романтика затерянного в	1
художников в то же	1
захватывающие евангельскую мифологию средневековую	1
напоминают нам нечто каждодневное	1
честь славянских представителей в	1
м м бахтин подчеркнув	1
внесубъектными косвенными средствами но	1
того факта что если	1
тысячи душ крепостных крестьян	1
внутренне свободных от морали	1
сознаниями-голосами а потому идея	1
другие карл маркс в	1
деталей жестов поступков к	1
и сложно опосредованным роком	1
определенный художественный образ и	1
самозванца в ставрогине мужички»-присяжные	1
определен как трагизм униженности	1
с женщиной имевшей на	1
и русские предтечи так	1
в высоты метафизического диалога	1
окраску трагического действа которая	1
каждым из них встает	1
как по самой своей	1
последней предшествует своему побочному	1
деталь из воспоминаний генри	1
о гармонии этой мечте	1
честь славянского съезда многочисленные	1
внезапно возникает копия с	1
романом в том же	1
большие голубые и пристальные…	1
намного печальнее юмор это	1
романе ни запланированного ранее	1
христос кончает полным безумием	1
тургенева создателя романов о	1
помогает ответить один из	1
агаты раскольников самоопределяется в	1
самое vollmachtbrief zum glücke	1
исходе не уходите пожалуйста	1
рассматриваться в дальнейшем когда	1
повторяет выпады добролюбова против	1
прерывает сам себя …	1
остроумия или сарказма у	1
как бы видим след	1
и диалога означает крайнюю	1
работы фабула новая по	1
перед соней в постыдном	1
сладострастии детоубийц и родителях-садистах	1
это великое человеческое чувство	1
мелодраматизм мы видим в	1
на настасье филипповне… в	1
года когда кушелевы удивляли	1
буржуазно ограниченный позитивизм писатель	1
величие и трагизм эпохи	1
карамазовы довольно проницательно заметил	1
играют огромную роль гротескно-реалистические	1
д наоборот достоевский сам	1
романтизм постепенно превращался в	1
это означало что скрытый	1
первой части идиота достоевский	1
дон-кихота и пиквика но	1
вот-вот уличит убийцу в	1
преступления и наказания дается	1
в обнаженном виде его	1
сюжетного развития в свою	1
увлечением следит за противоборством	1
были особенно взволновать безумцы	1
достоверная картина смерти бога	1
приоритет здоровья перед совестью	1
сам комический эффект создается	1
бы изложить славянофильскую философию	1
если у пушкина судьба	1
единственно возможным для автора	1
что случалось нередко он	1
конечное спасение имеют общую	1
обоснование права на болевой	1
внешнее введение мистических элементов	1
не он против смердякова	1
души то предстоящих ей	1
в черновиках впервые появляется	1
макара девушкина такая страшная	1
без оснований трагедию софокла	1
в году писал дружинину	1
комическое снижение подчас имеет	1
ехать туда же? ну	1
драмах байрона гюго виньи	1
так мы не находим	1
тогда часто делалось называл	1
проходимцев и красивых женщин	1
поскольку реалистический роман в	1
искажение христианского учения в	1
внутренний мир этой книги	1
невозможно жить это и	1
высоких общественных и этических	1
там же с глава	1
и болезненно сожмется от	1
самим подпольным драматургом и	1
это одна из конвенций	1
приключениями не так же	1
мучительной художественной гармонии его	1
мифологии в романе эжена	1
традиции у гоголя принцип	1
пожалуйста до меня не	1
показано в одной из	1
например в романе идиот	1
достоевский записывает главная мысль	1
реформы года граф прославился	1
отличие романа достоевского от	1
пафос буффонным юмором неприличные	1
или памятники мысли эта	1
которым предстоит сделаться организующими	1
выступает остается скрытым и	1
с присущей ему ядовитой	1
достоевского есть по преимуществу	1
м энгельгардт в работе	1
считалось что кушелев швыряет	1
черновой тетради н ф	1
ряд символических деталей намеков	1
шумное лето года когда	1
мистических элементов в реалистически	1
характеру то у древних	1
на сатирической позиции так	1
что строгое разграничение реалистических	1
уголовными историями реальными житейскими	1
этическую катастрофы его героев	1
но такое прочтение определение	1
обличительство и порою как	1
б завтра земли нашей	1
не стоит ни внимания	1
с немкой-притонодержательницей пышная дама	1
сновидениями выражающими его стихийный	1
века привело нас к	1
спасителя но ведь раскольников	1
ты как будто бы	1
бытия полифонический диалог свободных	1
диалогу образуют правильную градацию	1
в идиоте бесах и	1
служанка настасья желая разъяснить	1
нашему мнению объективным выводом	1
ходатайство о разрешении издавать	1
христианских подвижников или мучеников	1
том что в непосредственно	1
таким образом сопоставляется с	1
лотман вычленяет в романах	1
в плане романных сюжетов	1
в свою очередь расчленяется	1
произносится самим героем и	1
на наш взгляд это	1
достоевского в такой схематичной	1
графу алексею толстому ни	1
определению томаса манна достоевский	1
иван рассказывает алеше некоторого	1
великий писатель в своих	1
которым приводит воля нарушившая	1
i части герой целовал	1
откровенно а прямым антагонистом	1
психологии и в другом	1
постулировал приоритет характера и	1
противоречиями в области эстетики	1
соединяет литературоведческий термин с	1
ориентации сказав о войне	1
к дружинину с полянская	1
непонимания его мучительной художественной	1
он направлен на вовлечение	1
сбогар карл моор герои	1
повествования достоевский вскрывает трагизм	1
раскольникова на себя в	1
что не сказано автором	1
подчеркивают трагизм происходящих событий	1
в развитии сюжета порою	1
дневнике писателя оспорил это	1
в миллионы предалась необузданному	1
восприятия требует от читателей	1
которое отличается от архаического	1
и читателем ведь коллекция	1
минкус в роскошном палаццо	1
нам вместе с автором	1
главе романа отправлен был	1
прежде всего возникает гибкая	1
признак подлинно фантастического оно	1
не смешон то имеет	1
соч спб т viii	1
парижских меблирашек точно так	1
например пушкинский германн из	1
ему нужна была не	1
вячеслав иванов говорил что	1
всегда на рефлексию относительно	1
у реалиста xix века	1
упомянутого сюрреалистического кинофильма является	1
в городе говорят что	1
же с писемский а	1
льва никол и василья	1
влияние его сатирических приемов	1
романа становится историей трагического	1
подобна льву который весь	1
сюжеты европейской трагедии заново	1
вышел весь дрожа от	1
пробелы обусловленные отчасти целью	1
и священнее человека кто	1
вглубь сатирически изображаемого характера	1
возгласы толпы так и	1
в романе достоевского игрок	1
и провалившемуся генералу мучительный	1
скорбью первая часть романа	1
бы расстрелять алеша идеально	1
эпизода о воскрешении лазаря	1
д подобные определения чересчур	1
важнейшая еще сложнее способы	1
романа и даже новый	1
что замысел типа обломова	1
ранним и относительно примитивным	1
между собой например в	1
русских революционерах-террористах бесы однако	1
через сюжет выражает отношение	1
было вновь привлечено к	1
черновых набросках некий социалист	1
в концепцию бахтина высоко	1
своему побочному сюжету если	1
гроссман л п творчество	1
целостность средневекового человека достоевский	1
является все произведение с	1
в i части герой	1
добродетельные лица симпатичны читателю	1
глупого мальчишки… и елена	1
болезненное чувство трагического претерпело	1
бунт против академической философии	1
людей предсказанное иоанном богословом	1
такая деталь из воспоминаний	1
сближают с героями романтизма	1
однако народ не только	1
это создает условия для	1
двойной объяснимости сюжета есть	1
мире без ложной скромности	1
намеренно терпкими и тяжелыми	1
в действии участвует в	1
заметовым наслаждается рискованной игрой	1
потому что север для	1
это меланхолическая улыбка это	1
но болевой эффект применяет	1
результате известной полемики о	1
которого я искренно уважаю	1
достоевского со своими героями-идеологами	1
для удовлетворения нравственного чувства	1
идея превышающая первую идея	1
является его общая энергия	1
т д такое насыщение	1
по нашему мнению достоевский	1
повторно сошедший на землю	1
другим персонажам в основании	1
а проблема морального выбора	1
достоевский терзал их совесть	1
души внезапно сломили его	1
отказа от всех и	1
в душе ивана бунт	1
л п гроссманом импотенция	1
в романах достоевского отметим	1
это герои без идеи	1
рядом с ними всякий	1
примеров дело в том	1
функционирования этого романа парадоксальные	1
жизни освистана самим подпольным	1
автор дал парадоксальную похвалу	1
и наказание неизданные материалы	1
достоевского более не замыкаются	1
превращает эстетическую вину читателя	1
нас до сих пор	1
ли шокировано общество когда	1
в загородном полюстровском доме	1
некоторые современные исследователи на	1
в письме к ивановой	1
не содержится как равноправная	1
возвращается к истокам гуманизма	1
достоевского не имеет претендующего	1
не зная о значении	1
эти наблюдения объединяются понятием	1
этого общества сюда приходили	1
анекдот приключившийся с генералом	1
и средневековое религиозное искусство	1
героев с лучших людей	1
это юмор сервантеса смеявшегося	1
сделал идею формообразующим началом	1
осознано что этот жестокий	1
все решено без него	1
из диалогов главы бунт	1
фреска в целом? и	1
что события бытового ряда	1
заметках спб это был	1
герой-идеолог имеет универсальное значение	1
стадии философской символизации герой	1
имеют общую черту немотивированности	1
м реализм достоевского с	1
раскольникова в случае с	1
сих пор еще гвоздит	1
это объяснение окончательно лишается	1
эстетика тургенева яркого представителя	1
частности с образами дон-кихота	1
она рассказана в библии	1
нашему мнению герои достоевского	1
нечто вроде биографии каждого	1
с г а кушелевым-безбородко	1
мифа мифологические аллюзии вводятся	1
изобретали и такие термины	1
толстому именно в году	1
м бахтина по бахтину	1
завтрак смотреть купленный кабинет	1
не сказано автором прямо	1
атрибутов человечности и отнюдь	1
же напротив явлюсь часу	1
достоевского понятию религиозно-мифологической предопределенности	1
в полюстрове летом года	1
подняв взор на брата	1
пытается противопоставить как замену	1
так сон о трихинах	1
гораздо конкретнее создание символического	1
французского романиста было смешение	1
никогда не было то	1
формулировка фрейда иная но	1
