не знать об этой	1
карамазовых то он прямо	1
с аглаей смерть настасьи	1
как некий философский пикареск	1
пронзает сердце и потом	1
мистерия по выражению л	1
для большего уяснения себе	1
общественных и этических идеалов	1
в правом углу или	1
гибель это самая мрачная	1
этого карикатурного персонажа скверного	1
сказав о войне и	1
типа романо гуардини вычитывают	1
эстетический эффект порождает протест	1
в бытовом отношении из	1
земной поклон раскольникова на	1
ребенком с девочкой в	1
условий создания драматического напряжения	1
бросился от окна и	1
предтечи героя-идеолога занимают гордые	1
наше нравственное чувство это	1
различным переодеваниям и сочетаниям	1
граф милорадович певица дарья	1
весь роман борьба любви	1
литературной традиции и точно	1
с чувством превосходства приоритет	1
весь роман был задуман	1
повести хозяйка светлый ордынов	1
бесконечное с малым в	1
и всяческих схем но	1
стремление достоевского ориентировать характер	1
между князем мышкиным и	1
видим его перед соней	1
народного праведника в бесах	1
мерку он эксцентричен и	1
за родыш повести никогда	1
всем протяжении действия раскольников	1
у него падучая и	1
незакономерности таким образом эсхатологический	1
бы перевести как гарантийное	1
изучение прототипов необходимо важно	1
первая часть окончательного текста	1
одной буквы подчеркивая его	1
ее безумия и гибели	1
известной статье достоевский и	1
своих давних спорах с	1
а по просьбе моего	1
символизированное в самоубийстве или	1
вдовы которая учит детей	1
открывается более глубокая этическая	1
фомы опискина униженные и	1
жизненной позиции в творческом	1
но у достоевского образуются	1
это все плоды мифа	1
уровне значимое различие случайность	1
вызывает физический эффект таким	1
лучших людей своего времени	1
его идеи его философию	1
благосветлов и кушелев-безбородко в	1
так он говорит что	1
отличается от архаического смеха	1
тот же факт очень	1
тексте романа ипполит перед	1
я уже давно перестал	1
случайностей и совпадений у	1
комизм их высоких злодеяний	1
и предосудительного а по	1
весьма затруднительно по причине	1
запись от октября года	1
разоблачения смердякова и пошлого	1
сферу сюжета поэтому нам	1
прямо указывает читателю на	1
никогда не является так	1
это делает ярость раскольникова	1
и богоискатель шатов могут	1
жизненная позиция героя некогда	1
дается еще более заостренно	1
нем известно что он	1
потому что в них	1
в глазах повторяются в	1
но зато показывает что	1
в дальнейшем но сквозь	1
развития царство божие на	1
их приключения но нет	1
внимание писателя было вновь	1
и всеобъемлющей но зато	1
припоминаются например последний монолог	1
и тесно связан с	1
редуцирован приглушен смех именно	1
мыслителя однако сам он	1
сложение одного из характеров	1
его воспоминаниях и переписке	1
и мстителям сколько к	1
из древнейших атрибутов человечности	1
наиболее приближающий к специфике	1
читать как некий философский	1
вызван раскольников напряжение действия	1
читателя тоже он сыграл	1
считается что ничего не	1
в холодную ночь у	1
романах писатель со страстным	1
вряд ли похож на	1
легонькою востренькою почти совершенно	1
хотя поэт и поместил	1
всегда является внешняя формальная	1
дружинину у меня уморительный	1
бахтин лежало … смешение	1
ряда в повествовании достоевского	1
оскорблении дуни пьяная девочка	1
граф был высокий стройный	1
элитарные концепции общества которые	1
отца убил не он	1
не случайно усматривается связь	1
это возвышенное наизнанку он	1
ничего не делает у	1
скромное место в романе	1
человека достоевский прямо анализирует	1
писатели-реалисты его времени герой-идеолог	1
в сатире всегда царит	1
главы бунт в последнем	1
писатель вращался в литературном	1
подчеркнуто чтобы вызвать наше	1
своей формой между тем	1
откровенно открыть причины таковых	1
в романе в реалистической	1
универсален охватывает мир в	1
иронией отчитывает тех кому	1
идея в классической философии	1
прототипов однако затем наступает	1
где-то видела лицо князя	1
как нечто внешнее введение	1
все эти гордые бунтари	1
человека обанкротилась в этом	1
косвенно выражает то что	1
брак князя с аглаей	1
фабула затем из нее	1
роман достоевского показал отличие	1
лотман находит и в	1
раскольниковой сложный акт сочетания	1
пословице vox populi vox	1
свадьбе чиновника из его	1
бы проступила вторая идея	1
мифологических аллюзий обычно евангельских	1
о редуцированном смехе у	1
лжет сама себе буржуазное	1
его поступки пьяный мещанин	1
и елена штакеншнейдер записывает	1
предоставляя каждому полную свободу	1
к истокам гуманизма борьба	1
важный пост государственно го	1
революция стыд это действительно	1
уличная толпа играет исключительную	1
еще не имеющего сюжета	1
высшей степени целенаправленным и	1
д в литературные воспоминания	1
с квартальными и лавочниками	1
образ миньоны имя которой	1
жестокой правды какую бы	1
и внутреннего движения его	1
в самообмане внутренний реванш	1
лотмана опираясь на известие	1
ужином на человек и	1
и наконец оскорбление ребенка	1
изучила наука о достоевском	1
анекдот постепенно подтачивается всем	1
а лейкин в его	1
художественной плоти их присутствие	1
потому что граф был	1
людей соответствует романтическому историзму	1
посетителей выпроводили бы вон	1
изображении достоевского преображен символическим	1
показал отличие романа достоевского	1
до екатерины и далее	1
западе но такое прочтение	1
тему отцеубийства выделяемую фрейдом	1
достоевский так и не	1
яростное оттал кивание между	1
уходил в дальние комнаты…	1
градацию сердце его переполнилось	1
версилов несколько раз повторяет	1
традиционные типы у него	1
классической литературе было два	1
объясняется отчасти политической борьбой	1
красота спасет мир а	1
князя мышкина достоевский воспользовался	1
но если отец видит	1
поездки графа отразились в	1
к королю лиру и	1
входило в программу-максимум писателя	1
князя мышкина могла лицезреть	1
совесть пересилила мстительную злобу	1
свое глубокое переживание единства	1
ассоциации из мифо-идеологического плана	1
герой соотносится с вечным	1
суждение заранее произносится самим	1
им полную свободу самовыражения	1
и смеха говорит писарев	1
фальшивую манеру сю главным	1
от декабря года января	1
целом реалистических произведениях допускал	1
и переписке спб с	1
довольно проницательно заметил что	1
типы мистера пиквика и	1
план сюжета не является	1
уже неблаговидной выходки или	1
предсказаний князь мышкин дважды	1
от иных цитированных им	1
графине граф женился на	1
графа должна была понравиться	1
двоедушие но тот же	1
романах достоевского но играют	1
героя нет почти ничего	1
искренно уважаю откровенно открыть	1
борьба происходит не между	1
повесть и мы знаем	1
дирижер л минкус в	1
в стороне все рассуждения	1
и чуда например рулетка	1
но пуанта бездарная не	1
но ни эта фабула	1
из подполья нам буквально	1
четырежды пыталась поджечь дом	1
достоевский относит и капитализм	1
идей построена столь безупречно	1
позиция автора не содержится	1
копию себя самого в	1
мышкин окончательно превращается в	1
приключений не лежит в	1
поведение раскольникова в случае	1
правило мифологическим или легендарным	1
xix веке стал бы	1
в которую она должна	1
в русской критике м	1
но интересно и наглядно	1
и порфирием петровичем а	1
как царства меры толкование	1
звучит у достоевского как	1
великий юмо рист по	1
ласарильо с тормеса или	1
с человеком прощусь это	1
соответственно этому герои-идеологи достоевского	1
подлинно человеческое поведение кстати	1
столько чертами характеров сколько	1
с маркизом де садом	1
наглядное представление о характере	1
результатам по нашему мнению	1
остается несколько в стороне	1
достоевского бессознательная моральная оценка	1
мышкина хорошо известные историкам	1
не составит затруднений полифоничность	1
у этого героя нет	1
но не знать об	1
которой не знает скорбь	1
редакцией костомарова альбомы графики	1
рационалистического понимания человека обанкротилась	1
роман и детально обдуманный	1
сам создает окказиональные мифы	1
упоминаемый добрый приятель главного	1
удерживался на сатирической позиции	1
как гарантийное письмо на	1
романтическую точку зрения изображая	1
чувство это сон о	1
и шекспира почему офелия	1
над героем также восходит	1
смеявшегося над тем что	1
действительности презирая буржуазно ограниченный	1
в душе героя-идеолога вот	1
воздействие на ивана на	1
не понимают окружающие прослыл	1
это и есть любимая	1
беспредельным сенсуализмом несколько выше	1
чем же выразится деятельность	1
поэтики канонического текста и	1
ответственность в каждом из	1
и наказании но эти	1
достоевский великий юмо рист	1
архитектура идей построена столь	1
беспричинно и безвинно гвоздил	1
трагизм личности в смешном	1
героев достоевского не принимают	1
сливается с чудом например	1
собственная мука если он	1
не определенная конкретная фигура	1
быту однако этот быт	1
удачные примеры такой мифологизации	1
случайных голосов из уличной	1
с в творческой лаборатории	1
парафразы мифов и легенд	1
миньона исчезла а одна	1
достоевского это прежде всего	1
годунов где происходит суд	1
у кушелева в понед	1
случайно оно подготовлено долгим	1
же само построение и	1
октября года родные и	1
слова говорящий имеет в	1
старце зосиме в известной	1
мотивировку достоевский хорошо понимал	1
опровергают его идею и	1
и эти его герои	1
перелома в душе раскольникова	1
мышкин делает настасье филипповне	1
в романе драма идей	1
княгиня тем самым достоевский	1
января года написанное изысканно	1
и юм лев мей	1
сброд чужестранных и русских	1
виду что раскольников пьян	1
и дирижер л минкус	1
кушелев-безбородко в течение некоторого	1
подробную разработку характеров до	1
пример и с тургенева	1
ипполит нина александровна молодой	1
в статье итоги и	1
выродков рационализма как князь	1
общим законом литературы в	1
и не стал как	1
и на другой день	1
что достоевский должен был	1
книгой в истории человечества	1
не избегал всякие выходы	1
забору… рука мити не	1
толпы так и в	1
образом первая часть окончательного	1
бахтина о редуцированном смехе	1
рассказывает в то время	1
только его ниспровержение начинает	1
современного юмора стоит достоевский	1
пралинским в скверном анекдоте	1
трагическую предопределенность начиная со	1
д окружив себя музыкантами	1
с собственной совестью при	1
связи гораздо явственнее планируя	1
давним нежели шекспир а	1
искусстве достоевского непонимания его	1
внешним формам трагедию полного	1
он временно принимает позицию	1
гомеровской ориентации сказав о	1
рогожина к аглае брак	1
литературные воспоминания м гослитиздат	1
болевой эффект это художественный	1
ипполит в бешенстве от	1
и в п боткина	1
анекдоте подростке и др	1
парафразы повседневный трагизм истории	1
радикальные так он сначала	1
чересчур туманно предвещает князя	1
из письма вы мне	1
книг такое понимание юмора	1
об этом хотя и	1
сестрой поведение ставрогина после	1
до читателя типические явления	1
в романах достоевского философские	1
на скрытую парафразу мифа	1
это мальчишка накрытый юбкой	1
как ни пытался перед	1
угрызение совести болевой эффект	1
и хорошо образованный человек	1
исповеди ипполита эта часть	1
образом эсхатологический момент мгновенного	1
в признание которое тут	1
то что гюго и	1
и складывается скрытый миф	1
бесплотности в известной книге	1
и странное общество покамест	1
опискина оскорбление женщины деньгами	1
похоже на главного героя	1
способу построения романа несомненно	1
героев-идеологов но принцип организации	1
в трактирном разговоре с	1
твердо поняли абсурдность бытия	1
легенд огромное значение последних	1
лишь аргументом в пользу	1
идею как живое событие	1
идеологизированная картина современной достоевскому	1
юбкой пройдохи женского пола	1
не спасается а погибает	1
писатель представлял себе всякого	1
воплощению в образе князя	1
пафос гнев ярость негодование	1
убийство практика капиталистической действительности	1
начала личности за долгое	1
ответить один из диалогов	1
а лишь ее художественная	1
ни участия но всякое	1
дискуссии то есть его	1
эпоху как бы свободный	1
понять этот перелом и	1
ценил талант своего идейного	1
и прекрасным тогда как	1
трагедии отцеубийства иван карамазов	1
сознаниями достоевский изображал идею	1
ее изменения к черту	1
следует признать преувеличением весной	1
идиот напоминает христа появившегося	1
гроба марии дмитриевны апреля	1
анализировать второй план сюжета	1
то есть любви вмещающей	1
в противоположность тургеневу первоосновой	1
иванов говорил что у	1
от него отступились вследствие	1
и заявил что настоящий	1
иной альтернативой действия традиция	1
алексею толстому ни к	1
дружинину м с лемке	1
заключены и скорбь и	1
читателю главных героев это	1
говорили о принципе парадокса	1
улице соотечественников или наконец	1
женитьбы некоторое представление о	1
достоевского особая функция народной	1
трагических событий хохочут во	1
лет с небольшой русой	1
гордого одиночку в позицию	1
бы лишены художественной плоти	1
их действовать таким образом	1
построения романа несомненно яркой	1
письма а н майкову	1
евангельских эта система прямо	1
мифа романа идиот дается	1
к миру к богу	1
был юмор низкого пошиба	1
далеко отошел от прототипа	1
величие юмор универсален охватывает	1
мышкина могла лицезреть подобный	1
романа и всякого рода	1
нервная горячка взрыв безумия	1
создания драматического напряжения в	1
мей вс крестовский и	1
воспламеняет нашу мысль на	1
этики просвещения совпадающая с	1
что достоевский при этом	1
достоевского чрезвычайно ценные наблюдения	1
чехова это меланхолическая улыбка	1
этот вопрос будет рассматриваться	1
самую заурядную прозу когда	1
становятся муки совести бунтующей	1
далее вновь возродиться воскреснуть	1
властителями земли здесь мысль	1
достоевского объясняется и присутствие	1
анализа творческого процесса писателя	1
значение фантастического в поэзии	1
всегда заставлял их действовать	1
заискивающего перед нигилистами конечно	1
не считать одного сочувствия	1
разграничение реалистических типов парадоксальных	1
весов непрерывно балансируют и	1
быть назван вторичным но	1
жизни идей в изолированном	1
в братьях карамазовых не	1
нас к неожиданному выводу	1
мысль безумца какого-нибудь беранже	1
характеросложении достоевского чем парадоксальнее	1
быть полноценным субъектом в	1
смерти и воскресении раскольникова	1
настасье филипповне любовь рогожина	1
к преступнику известнейшим филантропом	1
в живых он начинает	1
же участник диалога как	1
илиада достоевский ориентировался на	1
предопределенности всего развития человечества	1
июля года и на	1
сочувствием достоевский изображает как	1
и рамками обычного сюжетного	1
реакция алеши это наша	1
улыбка стыда рисуя катастрофу	1
же время с оценочной	1
