всеми даже и самыми	1
все это конкретно комета	1
гроба и выйти на	1
знал и другие способы	1
однако урбанизм взял реванш	1
замкнутых мизансцен комнат каморок	1
сцены написаны так замедленно	1
достоевского парадоксальным образом роднит	1
начало исполнения апокалиптических пророчеств	1
вполне осознанно тема двойничества	1
как уже многократно отмечалось	1
свой художественный мир по	1
в которой рациональное является	1
отношений эти два романиста	1
всех против всех отчуждение	1
зафиксирована эта связь мы	1
готическое произведение гоголя но	1
гробовую крышку пустите добрые	1
александровича когда он идет	1
центр тяжести современного исторического	1
него натолкнулась на леденящее	1
незаметно в неописанных наслаждениях	1
и братья карамазовы описаны	1
ведь этот народ необыкновенный	1
к естественной широте и	1
в финале рассказа не	1
в романах достоевского укажем	1
вечный непреходящий смысл бытия	1
но если загнанный в	1
гигантская неслыханная чудная как	1
ассоциации и пожертвование миллионов	1
своих экстраполяции по склонности	1
меланхолии томас де квинси	1
средневековое восприятие времени он	1
и чище точно от	1
многие выступления революционных демократов	1
время трагедии закон концентрации	1
удержать руку убийцы вводя	1
традиции сновидение обычно служит	1
испугался своего собственного образа	1
свительского идейная позиция достоевского	1
этим эффектом контакт с	1
декора один раз упомянуто	1
реальной фигуры персонажа-двойника идеологически	1
гротескной обстановке рассказа светлый	1
фантазия ярко роскошно раскидывается	1
исчезает пространство тоже время	1
ситуации ореста для всех	1
как считал руссо то	1
мечтателя он бледен болен	1
безобразного в беседе с	1
и ужасов это указание	1
путем реформ однако вскоре	1
вовсе нет ни адмиралтейской	1
и филантропов он не	1
зачем к нам зашел?	1
как средство к достижению	1
петербурга в москву в	1
следуя за пушкиным медный	1
является злобная шутка подпольного	1
человека но считал для	1
поэтому герои достоевского говорят	1
нашему мнению во всей	1
по бездушному городу и	1
этого в характерах жадных	1
итак человек беспрерывно должен	1
создаваемые им картины золотого	1
начальная стадия его бунта	1
матвеевна с ямочками на	1
в гробовую крышку пустите	1
и оскорбленные находит извращенное	1
трагедию отдельного человека она	1
обусловило и крайне отрицательную	1
всей компании рогожина во	1
города но романист внес	1
восприятие и оценку вспомним	1
свободу действий в соответствии	1
отсутствие в русской жизни	1
достоевский во многом пересмотрел	1
переделывает свое лицо по	1
тут наиболее известно решение	1
из подполья послужили идеологическим	1
обмарался со своей изнеженно-брезгливой	1
висками на его румяное	1
процесса в целом со	1
показан юношей а дальше	1
в грандиозной европейской революции	1
кувшин с водой эпилептика	1
пророчеством что по достижении	1
экзистенциалистов его романтизму свойственна	1
философской символики начиная с	1
серьезно так что игра	1
мне ничего как будто	1
своих беспорядочно-шумных и нелогичных	1
с лакеем аполлоном и	1
час идет за минуту	1
исповеди подпольного человека с	1
как образчик беспредельного эгоцентризма	1
существеннее другое в повести	1
у де квинси его	1
за фактическое время прочтения	1
его мечтах книжное человеколюбие	1
герой в нравственном единоборстве	1
и достоевский итак первым	1
никак не придуманный ужас	1
дьяволиада фонарей и витрин	1
и через пространство он	1
его романов означает расположение	1
белых ночах и в	1
ваала капитализма а может	1
мрачного лабиринта города в	1
прибавляются две-три словно вырезанных	1
как омовение как некий	1
уйти подальше от свежего	1
двойника намечаются у достоевского	1
вслед за повестью слабое	1
его бодростью он живет	1
этот прогресс шел в	1
достоевского не могут быть	1
течения субъективного времени на	1
деспотическую власть в дворянском	1
площади и штурмом зимнего	1
самоутверждения вне искусственной микросреды	1
все по-видимому две крайние	1
романа составит полгода это	1
обречены на провал действительность	1
уже все сказать ведь	1
голосовкера н вильмонта и	1
от апреля года содержит	1
значит что понятия правды	1
заранее обречены на провал	1
ту или иную дорогу	1
к единению с людьми	1
связи мечтателя из белых	1
никакой морали по достоевскому	1
сфере происходит его самоопределение	1
и неустроенности общества фурье	1
достоевского тут наиболее известно	1
основа той скачкообразной динамики	1
лестницам уставленным кадками с	1
целый ряд других сюжетов	1
романтизм открыл экзотику города	1
созданной им микросреды в	1
у а и герцена	1
мысли достоевского развивается и	1
он ищет в человеке	1
эстетизма который превращает его	1
было заклеймить позором всякий	1
нельзя признать человека добрым	1
человек гиперболизирует дороговское брюзжание	1
в сплошное настоящее эта	1
горькой иронии генриха гейне	1
почему утопизм достоевского презрительно	1
презренной золотой середины он	1
одоевский применил весьма любопытное	1
из гроба и выйти	1
достоевского две линии развития	1
в возможности математически рассчитать	1
европейского просветительства равно как	1
собственном времени его внутренний	1
город мы знаем из	1
действительности но слабых женственных	1
жан-жак руссо считал что	1
у достоевского была борьба	1
достоевского часто служат совмещению	1
литературно-романтические истоки типа мечтателя	1
выход из тупика достоевский	1
человеческого времени о несинхронности	1
стыд генерал испытывает в	1
возвышается но парадоксальная реакция	1
у него есть совесть	1
ноге здесь достоевский явно	1
александровича он заслуживает особого	1
проблем этой книги разные	1
самопожертвование слияние с остальным	1
любви внутрипсихический конфликт предстает	1
за один день действительной	1
нашу задачу анализ самого	1
не подпольный человек а	1
напрасно молодости сколько великих	1
в настоящее время романа	1
среда результат мнений для	1
среда и воспитание пороки	1
чем эмпирической личностью автора	1
и недвусмысленно сказал о	1
обстоятельства социальной действительности война	1
том что я достит	1
реформ содержал нравственное осуждение	1
почти созревшим для эксперимента	1
степи с юртами кочевников	1
генерала генерал пралинский приведен	1
же время сумел выразить	1
однако уже в первом	1
но если презираешь читателя	1
занимает особое место в	1
наградил достоевского сверхразумным мистическим	1
имеет эстетическое значение рассказчик	1
его точные слова и	1
герои достоевского переживают то	1
ярко роскошно раскидывается по	1
его мироотношения автор этих	1
романист внес в них	1
образах продавцов из бакалейной	1
моментах экстаза когда время	1
рассеять мрак невежества просветители	1
реакция бежать скорее бежать	1
трагикомическое столкновение с офицером	1
эстетизации что связывает их	1
представляющий собой довольно бесцветное	1
представление о городе эпохи	1
в своих первых произведениях	1
перед нами раскрывается трагедия	1
этом см назиров р	1
известной дегуманизации искусства указывал	1
и наконец в известнейшем	1
пытаясь терроризировать его экономическим	1
проявляется в романе трояким	1
лермонтов штосс которого был	1
людьми фома напоминает своим	1
с ее характерным вызывающим	1
чтоб хоть как-нибудь до	1
эгоизма личности наслаждение результат	1
в бедных людях преобладают	1
уже видит его характер	1
на взморье и от	1
мы имеет типичное для	1
с просьбой не хоронить	1
этот город порою представляется	1
умственного развития так материализм	1
и снисхождения макар девушкин	1
его сердце рассказ становится	1
сердцем и карикатурной внешностью	1
традицией но в то	1
впечатление настроено и целый	1
отказа от участия в	1
однако специфическая форма характера	1
точно так же гамлет	1
петербургские могилы заполняются криками	1
самим собой в жалких	1
ей комнаты у достоевского	1
мечтах книжное человеколюбие переплетается	1
мне надо знаешь чего	1
совсем не похожие на	1
эти слова отнюдь не	1
i ° труды а	1
типом сознательно аккумулируя в	1
героя или неспособностью сони	1
философских дискуссиях допускаются предположения	1
мире достоевского только в	1
мягкий а вместе с	1
н г помяловского молотов	1
ортеги-и-гассета который в своей	1
только переходы из гроба	1
тине волкова кладбища и	1
это явно эпическая передача	1
относиться к слабым произведениям	1
площадь вот его точные	1
жизнь громадная гигантская неслыханная	1
это тот самый дух	1
ночи в то же	1
же оппозиция прослеживается на	1
дома и сколько в	1
между людьми отношениями между	1
места великих метрополий не	1
самый умышленный город мы	1
жажду общения все это	1
схемы противоположность между эгоистическими	1
не имеют души он	1
бездну безумия общее место	1
на соприкосновении космических природных	1
вернулся вспять к своей	1
искусства как известно одной	1
есть не принять летаргический	1
возобновил свое творчество с	1
время прочтения этой сцены	1
живучесть мещанина-накопителя пселдонимова и	1
сон смешного человека зарождается	1
пришел в мир идея	1
помощи комизма чего стоит	1
поступков так сновидение в	1
сфере полнейшее несогласие с	1
человека порою же достоевский	1
умонастроениям самого достоевского его	1
поскольку в серьезных философских	1
в отказе от субъективной	1
каждом человеке скрыто неистребимое	1
распадающемся сознании героя самым	1
уверяет себя и читателя	1
складывается из всех высказываний	1
трущобы монументами в двух	1
полоний лицемерно озабоченный здоровьем	1
просто человеком становится самим	1
и религиозного учения о	1
спящей настасьи филипповны напоминает	1
маша лежит на столе	1
в принципе неприступна для	1
предысторию действия но выступает	1
пророчества иоанна богослова и	1
беседами о литературе о	1
ньютона в котором живут	1
коли самоценность каждой человеческой	1
свободе воли и учение	1
согласно религии бог пребывает	1
в антракт между частями	1
выше приведем этот пассаж	1
фиктивной сам себе приключения	1
время романов достоевского следует	1
зеркала как городков словно	1
домике на выборгской стороне	1
земле к идеалу противоположному	1
для человека по достоевскому	1
социологию экономию он взмыл	1
особо рафинированного интеллектуализма ставящего	1
а г цейтлин писал	1
объясняется откровенным обращением достоевского	1
значение того что происходило	1
повапленный портрет-маска символизирует своеобразную	1
константин мочульский назвал этот	1
и шатов в бесах	1
стилем теперь перед нами	1
записок тоже своего рода	1
границы созданной им микросреды	1
как бы самое время	1
эпизод романа чернышевского что	1
создании мечтателя явно связан	1
чего-нибудь просят и двумя	1
исследования отрицание внешнего подхода	1
самый гадкий самый смешной	1
пророчеств апокалипсиса в романах	1
и генерализации впечатление полного	1
идее циничного космоса в	1
петровича на неминуемый провал	1
оскорбленные общее впечатление от	1
с действительностью… все вылазки	1
является более лирическим героем	1
организацией рассказа эта позиция	1
и притом это был	1
государства и насильственного прогресса	1
над аморальными тенденциями его	1
за достоевским итак одна	1
шинели он питался духовно	1
пейзаж действие движется не	1
влекущему за собой реальных	1
в хозяйке и неточке	1
что он желал нашего	1
скрытое цитирование пушкинского стихотворения	1
и главный герой преступления	1
обусловленной переменой взгляда с	1
еще труднее дышать где	1
прогресс шел в направлении	1
гоголем писать о невском	1
многословием порфирия петровича или	1
грандиозно-прекрасная по какому-то неведомому	1
а каким-то странным существом	1
антропологизма отразилась в знаменито	1
читал а ты мол	1
календарь который вел французский	1
себя искусственную микросреду отгороженное	1
основного действия трагическое подчиняется	1
артистичность порока его демонизм	1
типа отрезвление сон яд	1
общественной сущности человека и	1
равной социальной ноге здесь	1
есть о том что	1
писателей увлекает глубина и	1
поддался соблазну столь наивного	1
но нос гоголя имел	1
сюжетом повести становятся не	1
башмачкина украденная шинель трагедия	1
анализ самого образования характера	1
и грешить но в	1
готов и снова фантазия	1
между частями который в	1
не возвращался более к	1
от себя лично так	1
ситуация трагических мыслителей во	1
романах достоевский мысленно опирался	1
гостьей свое лицо он	1
цитирование пушкинского стихотворения город	1
фрагмент из повести помогает	1
трагедия изолированной личности эта	1
темпе или завершение частей	1
пассаж полностью потому что	1
бессмысленность сегодня допуская существование	1
м бахтин показал что	1
мечтание как уже многократно	1
все определения этого пушкинского	1
проблемы времени в философском	1
невозможность для значительной части	1
печальное выражение поразительны лексические	1
линией дается писателю с	1
жизни наглядно демонстрируется во	1
юмор достоевского был формой	1
смердел по выражению евангелия	1
альберто моравиа назвал простыми	1
высказана до достоевского ее	1
инженерном училище эта книга	1
признание содержит разгадку это	1
долинин в книге последние	1
циничный диалог могильщиков над	1
не вставая с кровати	1
же герои более не	1
параллели раскольникова сравнивающего муку	1
значителен как и главный	1
представил нам по преимуществу	1
исследования подпольный парадоксалист восстает	1
и сколько в этих	1
силой опровергается объектный подход	1
достоевского на голову выше	1
кадками с померанцевыми деревьями	1
достоевского вплоть до его	1
борьбу с самим собой	1
преловко прикрывает и оправдывает	1
стороны одни в анархизм	1
большого дома нормальное движение	1
более приличную более так	1
чувства времени в момент	1
распят вместе с мучениками	1
изолированной личности эта изоляция	1
человеку и дуалистического разрыва	1
в романное настоящее сон	1
сказалась гуманистическая направленность русской	1
продукта природы направленное против	1
лиризации фельетона четвертый фельетон	1
волей а навязаны внешней	1
преодолеть время во времени	1
и его создатель является	1
иную дорогу и потом	1
разлад между природными стремлениями	1
рекомендовал ее григоровичу еще	1
в рожу когда я	1
чрезвычайно уплотнено первый исследователь	1
приема явилась княжна зизи	1
писатель уже видит его	1
возможности подлинного а не	1
а строится как диалектика	1
а страх перед жизнью	1
обладает этическое а в	1
уже не скрывает а	1
присуще непонимание общественной сущности	1
зрелого творчества достоевского в	1
взглянул в зеркало и	1
концепция времени во многом	1
пристрастием тень известной патологичности	1
людей считая основными путями	1
человечества точно так же	1
уровня животного тем самым	1
только переписывал бумаги а	1
городков хотел за ней	1
слово и чего я	1
фактически трансформировал традицию исповеди	1
петербургского студента одна из	1
элементов и внутренних связей	1
