в то же время	12
м проблемы поэтики достоевского	4
бахтин м м проблемы	4
но в то же	4
м м проблемы поэтики	4
времени в романах достоевского	4
в рассказе скверный анекдот	3
в преступлении и наказании	3
дело в том что	3
проблемы поэтики достоевского с	3
из других ценностей социальное	2
см назиров р г	2
с там же с	2
действительности в материал самосознания	2
время в романах достоевского	2
человек по природе добр	2
против овеществления человека против	2
ю б проблема времени	2
переходит в свою противоположность	2
ф повести и рассказы	2
времени больше не будет	2
человек по природе этичен	2
с молчанов ю б	2
и в белых ночах	2
одоевский в ф повести	2
провалиться или вот мне	2
о свободе воли и	2
что человек по природе	2
его мгновенно изменилось улыбка	2
б проблема времени и	2
одно мгновенье исчезла с	2
ли провалиться или вот	2
мира в преступлении и	2
в творческой эволюции достоевского	2
вопросы философии № с	2
в сне смешного человека	2
с его лица насмешливая	2
что времени больше не	2
то же время он	2
а не во времени	2
средство к достижению цели	2
или вот мне чаю	2
в скверном анекдоте это	2
в том что в	2
концепция времени у достоевского	2
черепаха в свою скорлупу	2
в новых увеличенных дозах	2
в пространстве а не	2
в материал самосознания героя	2
его лица насмешливая улыбка	2
романа преступление и наказание	2
пространстве а не во	2
в ф повести и	2
как черепаха в свою	2
превращение действительности в материал	2
мгновенье исчезла с его	2
с одоевский в ф	2
времени статическая концепция времени	2
проблема времени и диалектика	2
исчезла с его лица	2
повесть записки из подполья	2
место в творчестве достоевского	2
бессмысленной и ненормальной жизни	2
исповедь англичанина употреблявшего опиум	2
вот мне чаю не	2
свету ли провалиться или	2
м м бахтин в	2
процесса в сплошное настоящее	2
курсив наш р н	2
временного процесса в сплошное	2
к человеку как к	2
м с там же	2
молчанов ю б проблема	2
мечтателя в белых ночах	2
в одно мгновенье исчезла	2
лицо его мгновенно изменилось	2
достоевского м м бахтин	2
мне чаю не пить?	2
в записках из подполья	2
гуманностью гораздо шире конкретного	1
томас де квинси подробно	1
повод для перерождения раскольникова	1
призму субъективного восприятия героев	1
в духе своей теории	1
главных проблем этой книги	1
романный мир определяется пространственно-временной	1
вещами с каких бы	1
несчастной девушки он сам	1
первенство хотенью то есть	1
скверном анекдоте с неслыханным	1
происходят скандал и катастрофа	1
этот город и не	1
на улице полны внутреннего	1
бетховена по нашему мнению	1
гулливера черный юмор достоевского	1
некоторыми теориями физиков xx	1
же царству ваала капитализма	1
шкловский верно указывает нос	1
годы даже за целую	1
вопросом а кто же	1
скомпрометирована в глазах ближайших	1
профессор антихриста утверждает что	1
волю к жизни в	1
в романе мы наблюдаем	1
выкладок статистика буржуазна она	1
но христос повелел лазарь	1
воздействия среды на человека	1
признание фигура мечтателя в	1
старой галантной литературы а	1
у подпольного человека тоже	1
трактиров русские люди в	1
как тьмы подобных ему	1
его спрячут? никуда не	1
достоевский опираясь на традиции	1
грязью и зловонием серых	1
он испытывает небывалый стыд	1
перед гостьей свое лицо	1
на вечное заключение среди	1
от фатализма и религиозного	1
от этических оценок из	1
фиксацией их продолжительности и	1
чернышевский совершенно справедливо отметил	1
вошел тихими шагами теперь	1
христе в училище достоевского	1
словно для него есть	1
перевод вышла в году	1
которое может сделать человек	1
его юношеские прогулки с	1
самораскрытию героя делает его	1
владимира городкова эксплуатирующего любовь	1
новый оттенок связанный с	1
прямое высказывание содержит двоякое	1
летопись и в белых	1
бы трактовать в более	1
христовой невозможно закон личности	1
в ту же самую	1
так что игра въелась	1
основан на контрастном сочетании	1
ролью этот романтический эстетизм	1
единый мир с его	1
лежащая в основе всех	1
пребывания изолированных наблюдателей в	1
россии петербурга и ее	1
хозяйка или униженные и	1
беспощадную критику маркса и	1
виктор-эммануил… а пропадай они	1
верно отражает этические истоки	1
среду если обстоятельства враждебны	1
заблудиться то в вертикальном	1
на убеждении в возможности	1
жилища аллаховы это достоевский	1
отвязаться от лизы бежать	1
прерии у бальзака прошедшего	1
романтизм безобразного в беседе	1
будет… вероятно это та	1
мыслитель больше чем гаусс	1
из всех на земле	1
однако в ту же	1
роман сознания придает герою	1
издания книги бахтина немецкий	1
комедии время стоит и	1
понимается им как результат	1
о небывалой активности сознания	1
замедление действия причем первое	1
д с лихачева и	1
сюжете невского проспекта гоголя	1
тогда игры было надо	1
если в традиции сновидение	1
после скверного анекдота не	1
любви или в искусстве	1
бесах в диалоге ставрогина	1
старухи пселдонимовой составляет единственное	1
так быстро что час	1
вопреки распространенным представлениям достоевский	1
пейзаже была опасность заблудиться	1
померанцевыми деревьями и ливрейными	1
в первой части повести	1
самый завистливый из всех	1
сверкает чудо ее духовного	1
вторгается в прямом смысле	1
о традициях и новаторстве	1
ненавидит окружающую среду и	1
идеального всеобщего наибольшее самоутверждение	1
прямо восходящая к гамлету	1
времени? в первую очередь	1
приближаемся к осознанию того	1
что в своих тесных	1
повести унаследовали экзистенциалисты их	1
отмечалось и развитие трагической	1
они представляют собой прямые	1
русского народа необъяснимый холод	1
трагической ошибки но на	1
датского с полонием насчет	1
неточке использовал некоторые черты	1
сворачивал он просто почувствовал	1
эта психологическая критика идет	1
именно поэтому здесь предельно	1
reductio ad absurdum подпольный	1
м.-л изд-во ан ссср	1
симпатию к ним при	1
и далее размышляя о	1
представляются нам антинаучным смешением	1
штатского генерала пралинского он	1
морального сознания весь рассказ	1
сам тебя хуже что	1
широко известно что николай	1
есть не приносил любовью	1
заправский и притом такой	1
бросил университет порвал все	1
им микросреды в лице	1
его построения в романе	1
аустерлиц увеселительные поездки во	1
это время шекспировского гамлета	1
искусствами открытие которых вызвало	1
в мировой литературе портрет	1
природе добр что в	1
подчеркивает свою исключительность унижаясь	1
в школе сб с	1
безнадежности и обогатил сам	1
ишь ведь учась и	1
внутреннего чувства романист с	1
достоевского о которой говорил	1
применима к творчеству достоевского	1
него с руссоизмом и	1
многом прав действительно динамика	1
мира нужно его просветить	1
не менее эстетичны чем	1
в бедных людях проведено	1
противоречивость современного человека внутрипсихический	1
на шутку но он	1
наталкивают нас на ту	1
добра и безобразии греховной	1
призрачности города-сна воскрешается старая	1
на воздух на площадь	1
композиции у достоевского быстрое	1
повествования пейзаж и портрет	1
цели поддержал достоинство не	1
вернулся к пушкину для	1
далек от мысли отрицать	1
и личности он говорит	1
представление о времени субъективное	1
в утопическом допуске естественной	1
ядро гибель голядкина в	1
жития великого грешника смело	1
представлялась полицейским трюком вот	1
как она это момент	1
пралинский фамилия образованная от	1
бахтина о том что	1
людей просветители считали что	1
дело? вот честное слово	1
улики преступления а дверной	1
болото хоть стучи себе	1
обнаружение коренных начал его	1
того что происходило в	1
не в его архитектурных	1
действительности война всех против	1
ускоряется пульс брызжут слезы	1
за настоящую более правильную	1
и рай и ад	1
становится мучительно серьезным отношение	1
поэтическое видение самого трагического	1
крыш писателей увлекает глубина	1
не признает этого свобода	1
идеальный общественный строй для	1
в человеке идеальное начало	1
прав томас манн заметивший	1
от свежего воздуха куда	1
и маскарад шедевры но	1
метафизическая борьба бога и	1
аполлоном которую ведет подпольный	1
летаргический сон за смерть	1
основной смысл легенды протест	1
мнению тут очень важно	1
крайности интересны глубокое падение	1
имеют душу даже целые	1
и т д любой	1
не только в греховности	1
достоевского как и сам	1
произведений с предисловием в	1
его самоопределение трус и	1
второго способа достоевского сводить	1
писатели были по-разному в	1
подпольный человек превращает свое	1
и его сознания жан-жак	1
полностью подчиняется законам своего	1
героев собственными представлениями о	1
более к этой теме	1
т ii к сожалению	1
от униженного человечества логически	1
почвенным сознанием но практическое	1
наши философы считают не	1
кончается этот безумный високосный	1
подпольный человек понимает свободу	1
только на таком островке	1
которое когда-либо было написано	1
отрицание времени как бытие	1
с самого начала дискредитированы	1
как человечества так отчасти	1
повторяет в его петербурге	1
историческим планом по сути	1
сосредоточивает действие только в	1
если нельзя признать человека	1
нервнобольной он обладал высокой	1
гончарова это остров на	1
бога было чтобы не	1
убогими эстетическими вкусами и	1
это дьявольский мираж гоголь	1
мосту и на площади	1
раз употреблен в азличных	1
не избраны их свободной	1
колеблет традиционное представление о	1
субъективное временное переживание само	1
духе трагической безнадежности и	1
выше он сам сознает	1
сложную и противоречивую концепцию	1
искал в эти годы	1
за дело? вот честное	1
повторение старого типа мечтателя	1
рай христов вся история	1
трагикомедии фельетонно-сатирический тон рассказа	1
самоотрицание остаток теории естественного	1
материал самосознания героя поскольку	1
поэзия трагической легенды так	1
собственной личности яков петрович	1
с божественной комедией мы	1
сохранил общую болезненную окраску	1
один раз упомянуто что	1
связанный со старосветскими помещиками	1
особое значение быть может	1
и оскорбленных но по	1
сюжетную перекличку герой в	1
гораздо шире конкретного социального	1
конце концов достоевский в	1
не принял бы ее	1
ущемленности своей личности трагедия	1
широк что объемлет и	1
раскиданы для контраста упоминания	1
всякую личную свободу воли	1
другой закономерно приводит нас	1
и далее отсюда же	1
повелел лазарь иди вон	1
часто служат совмещению времен	1
за гоголем петербургские повести	1
страстей фурье наивные утопии	1
деятельностью всегда с какой-нибудь	1
похож ни на одного	1
бессознательного есть удовлетворение биологических	1
записках высшей школы г	1
полонием насчет того что	1
большой силой передал субъективный	1
просветить рассеять мрак невежества	1
нуждается в зрителях всякий	1
двойнике еще более резко	1
прошли еще века авраама	1
мышления и мир его	1
у достоевского говорили о	1
однако этого ему недостаточно	1
подпольному человеку вовсе не	1
создал человека для счастья	1
личности следуя за гоголем	1
школой достоевского фурье утверждал	1
играл слишком серьезно так	1
патологичности осталась на золотых	1
останавливается он согласен с	1
наслаждение результат морального поведения	1
лебедева в идиоте отражают	1
с полонием насчет того	1
и иван карамазов как	1
религиозную проповедь о красоте	1
в традиции сновидение обычно	1
подполья занимает особое место	1
литературоведов о том будто	1
деле дальше некуда точно	1
их для всего мира	1
громадная гигантская неслыханная чудная	1
безраздельно и беззаветно и	1
роскошно раскидывается по узорчатой	1
среди органных арий дешевых	1
других ценностей социальное происхождение	1
него веяло необъяснимым холодом	1
раздуванию своих прежних мучений	1
в авангарде мирового развития	1
содержит скрытое цитирование пушкинского	1
быть может эйнштейн чувствовал	1
подполья подпольный человек говорит	1
сознает свою комичность он	1
невозможным он по мысли	1
наркомании весьма существенный еще	1
непонимание по вине богословия	1
писал между садовой улицей	1
был и великим юмористом	1
действующему лицу генералу прелинскому	1
читательского восприятия здесь превышает	1
середину романа и сохраняет	1
лишних людей однако специфическая	1
молодой романтик иван петрович	1
этическим и эстетическим прекрасная	1
достоевского лишен классического декора	1
и зло изначально присущи	1
то такой человек конечно	1
что этот распятый gekreuzigte	1
особо выразительная подлость не	1
проповедует он лежа в	1
и все просвещенное общество	1
исповеди рассказчик ставит под	1
стремился к чисто литературному	1
пространство пронизанное пафосом единства	1
морали и общественной науки	1
мира достоевского интересны не	1
лизы сама жизнь покушается	1
в современном искусстве мы	1
униженному генералу когда литературный	1
вслед за ними конец	1
языческого культа земли именно	1
в настоящем времени не	1
каруса против сеченова кроме	1
диалектика субъективной психологии героев	1
притворился что не заметил	1
и что в душе	1
обусловлен историко-литературным контекстом книги	1
видимо все это натяжка	1
одна из тысячи причин	1
он с поэтическим пафосом	1
приходил к трагическому представлению	1
кафка говорит об ужасе	1
с ее кризисным мироощущением	1
впечатления от дома квартиры	1
проза русского романтизма исследователями	1
в литературу достоевский воспринял	1
подполья считая эту повесть	1
развитие свободы личности всегда	1
смешным он предпочитает чтобы	1
если так можно выразиться	1
овеществления человека против характерной	1
связан с традицией антропологизма	1
со статикой сцена двойного	1
белых ночей за один	1
человека во плоти стало	1
показал г в плеханов	1
борясь против этого антигерой	1
французской неистовой школы и	1
наивного политиканства и оставаясь	1
не только я не	1
тем очиститься от нравственной	1
построение героем микросреды гуманных	1
сущность самого процесса следовательно	1
что в современной драме	1
об эпилептическом времени в	1
свое завершение в философии	1
своеобразного самодовольства отчаяния презрительно	1
этой области бальзак сумел	1
рассказчика повести записки из	1
род человеческий таков образ	1
сцена самоубийства кириллова доводит	1
им свою личную деформацию	1
вот некоторые из главных	1
основном вне субъектными средствами	1
объективный трагизм его положения	1
эры нигде не чувствуют	1
отрицание объективности времени вполне	1
правах реставрация эпической временности	1
романа тут и финалистские	1
есть резко увеличено число	1
и героини постепенное подтачивание	1
распаду остаточной литературности стиля	1
себя отделиться от других	1
прямо повлиял на молодого	1
давящим воздействием среды невозможностью	1
каждый раз утопия терпит	1
скандал так ли это?	1
туда запальчивость петрашевца такая	1
апокалипсиса в романах достоевского	1
он признается в своем	1
русской жизни общественных интересов	1
