случайности что прямо вело	1
для всего мира у	1
сюжетного упреждения создавая ощущение	1
мы находим у а	1
на романтиков дело не	1
париж это город-маяк провинциальных	1
рестаурации восстановления задавленной человеческой	1
что не заметил его	1
человеке человека таков его	1
на гегелевский абсолютный идеализм	1
и все же писателю	1
м т с бахтин	1
критика о преобладающем месте	1
генерала унижение становится чрезмерным	1
к трагическому представлению о	1
обязательно переносится достоевским в	1
то же время общеизвестны	1
то у достоевского сновидение	1
готико-романтической линией дается писателю	1
достоевского весьма условно оно	1
как эстетически выразительное явление	1
шкловский в за и	1
трагический жест который приведет	1
ньютоновской механики фридлендер г	1
объяснение трагедии подполья не	1
чувства он рыдает в	1
роберта оуэна в россию	1
о несинхронности индивидуальных времен	1
и наслаждается этим сознанием	1
неминуемый провал мечтатели на	1
детерминизма определяет выбор героя	1
на этом у достоевского	1
этических решений не совпадают	1
своими спасеньями во все	1
который приведет в конечном	1
для еще живого бонифация	1
рое уравновешивается райским наслаждением	1
к повести белые ночи	1
не останавливаясь ни на	1
поиграть в голове помечтать	1
гибели то и другое	1
двойник дали русской литературе	1
столкновенье-то с действительностью… все	1
импульсом который толкает человека	1
отрицала объективный характер случайности	1
героев исключительный художественный эффект	1
часть он не умел	1
под именем метьюрина автора	1
в основе этой схемы	1
противостоит ранним героям достоевского?	1
был вековечный от века	1
времени это длительность которая	1
мыслил себе нравственности нет	1
общественная пассивность также объяснялась	1
утопист пытающийся создать остров	1
в преступлении и наказания	1
современного человечества точно так	1
появляется герой несравненно более	1
этой панорамы его петербург	1
смешанной настроенностью боли и	1
говорили что в преступления	1
достоевского сводить романное время	1
концепция человека если романный	1
и предъявляет свои права	1
на эффект он не	1
постоянной у достоевского была	1
о представлена вся вселенная	1
злобного сладострастия превращающего любовь	1
в любви или в	1
человеческое существо показанное в	1
взволнованный взбешенный он побежал	1
набросал знаменитую ныне запись	1
не случайно белинский обмолвился	1
романа достоевского оппозиция гроб-воздух	1
джунгли и прерии у	1
бога и бессмертие души	1
готическая мистика популярнейший сюжет	1
его петербурге все дышит	1
достоевский показывает трагическую обреченность	1
понять пространство достоевского все	1
является одновременно цивилизатором и	1
года пролегоменами ко всему	1
жеста ведь крайняя подлость	1
р н в записках	1
достоевского м с глава	1
в лице подпольного человека	1
отрицал объективность времени достоевский	1
необъяснимый холод который навевали	1
этом сказал г м	1
служения в миру для	1
в их неразрывном единстве	1
чувству единства человеческой истории	1
и решают их для	1
ставит под сомнение правдивость	1
мучительное восхождение человека его	1
не случайно князь валковский	1
однако сохранил общую болезненную	1
возрастает сюжетное напряжение приход	1
отвлеченный характер однако эта	1
и предвещает иудушку головлева	1
впечатление полного переживания пятнадцати	1
сумел выразить в строго	1
что бы дал я	1
и возраст резко увеличился	1
в петербурге есть места	1
в бедных людях во	1
которое складывается из всех	1
полон напряжения если в	1
поразительной непоследовательностью порою это	1
мироздания для достоевского характерен	1
раскольникова к живой жизни	1
и некоторые подобные ей	1
спрячут время не предмет	1
собственного жизнесочинительства подпольный человек	1
к маленькому человеку не	1
героев и драматизация философского	1
и оправдывает влиянием этой	1
постели женщины которую только	1
оскорбил ее окончательно но	1
а дверной крючок можно	1
в романах достоевского часто	1
них смысла но если	1
жизни объявляется психологически невозможным	1
до первого издания книги	1
связывает я препятствует один	1
битвы масонская ложа князь	1
достоевский ф м петербургская	1
оскорблением в виде пятирублевой	1
черный юмор достоевского не	1
стремлении писателя овладеть содержательно	1
приема маски причем в	1
маски причем в творчестве	1
наслаждение в циничной исповеди	1
его пессимистическим высказываниям противоречит	1
ведь крайняя подлость вероломство	1
в первой главе мы	1
романтическим мыслителем нисходящим от	1
его романного искусства как	1
которых можно не принимать	1
биологических потребностей инстинктов не	1
на равной социальной ноге	1
времени народов ибо это	1
очиститься от нравственной скверны	1
на эту форму он	1
достоевского у которого уже	1
контрасты дворцов и подвалов	1
стремлениями вложенными в него	1
свойства палача в зародыше	1
заготовленное для еще живого	1
антироманах стерна возобладало время	1
большой четкостью и силой	1
жителей иных планет как	1
его свободы через зло	1
только в греховности города	1
он произносит мне не	1
точек соприкосновения с фурье	1
история человечества заново проигрывается	1
деле это декларация того	1
о жизни и положении	1
поднимается над угрозой катаклизма	1
не мир ньютона в	1
превращение петра александровича когда	1
художественных форм и историчность	1
выражению евангелия но христос	1
приносил любовью в жертву	1
явно преобладает иными словами	1
странно совпадающее с заклинаниями	1
по природе этичен даже	1
исходную ситуацию мы узнаем	1
социальной действительности достоевский провозглашал	1
удовлетворение биологических потребностей инстинктов	1
французский спелеолог мишель сифр	1
русской жизни тем поразительнее	1
самоанализом героя или неспособностью	1
жизни раб потому что	1
подавляются статическими элементами размышлениями	1
была бы бессмысленной в	1
его трансформация тематики и	1
по природе добр что	1
создается не художественной передачей	1
словно вырезанных ножом детали	1
стяжению в один момент	1
общества достоевский после каторги	1
из мемуаров что достоевский	1
скверный анекдот который является	1
художественных параллелей и ассоциаций	1
с апокалиптическим пророчеством что	1
это натяжка действие у	1
о бытии иных миров	1
ивана с чертом и	1
были обуздываемы сдерживаемы узами	1
героев достоевского придавая им	1
и дьявола антропологизм достоевского	1
несовместимо с человеческим достоинством	1
времени так весьма относительна	1
предельно унижает себя но	1
субъективно-психологический аспект времени соотнесен	1
и призраки заставляют преступников	1
добиваться литературной цели? подобно	1
котором живут герои толстого	1
не поддался соблазну столь	1
спутанность и антиномичность человеческой	1
о погоде достоевский никого	1
бабочки на огонь здесь	1
ковалева действительно гоголь дал	1
как тьмы других однако	1
субъективного переживания времени? их	1
в евангелии она приказывает	1
согласии с традиционной моралью	1
разобраться в мире значило	1
или безумия его трансформация	1
подражать их героям в	1
подобно нерону подпольный человек	1
узким чем пространство толстого	1
законом гуманизма свободная воля	1
самый сильный стыд генерал	1
читателя сжато можно сказать	1
объективный характер времени в	1
почему циников тянет обнажать	1
драматической судьбе великого романиста	1
от выбора современного человечества	1
сплошное настоящее эта тенденция	1
так замедленно что доводят	1
внешностью россии петербурга и	1
ее торжественно провозгласил в	1
вкусе щедрина»? цель достоевского	1
оно было прервано арестом	1
творчестве французской неистовой школы	1
порою представляется достоевскому чьим-то	1
которых впервые отчетливо сказали	1
его как покушение на	1
он не мыслил себе	1
романах достоевского осознание этими	1
и иван карамазов отчаянно	1
вторжение прошлого в романное	1
учение фурье о свободе	1
предугадал всемирно-историческое значение того	1
гоголя роман xix века	1
написана с издевательской болезненной	1
аберрация зрения у столь	1
правдой подпольный человек совершает	1
давления рутинного аморализма как	1
человечеству за свою посред	1
непохожие друг на друга	1
один из самых ярких	1
бодлера подпольный человек как	1
просят и двумя строками	1
г цейтлин писал между	1
и невроза сравнивая романный	1
собой в его романах	1
достоевского с чирков н	1
бедный чиновник с его	1
в его произведении является	1
никакой конченностью конкретно изображенное	1
его создатель является антигегельянцем	1
и узнают из пьесы	1
эликсире сатаны гофмана или	1
в руках подполье является	1
умел изображать дворцы и	1
выглядит как омовение как	1
сопоставим это со знаменитым	1
социализма в разные стороны	1
и пошлый майор ковалев	1
трихинах в эпилоге романа	1
закон гуманизма страдание результат	1
вкусе русского самодержавия широко	1
трансформировал традицию исповеди руссо	1
в неравной степени дороги	1
обычно включены у него	1
унизительным пассивно подчиняться обстоятельствам	1
из неточки незвановой что	1
механистического материализма эта теория	1
досаду и спешит скорее	1
которой была большая дорога	1
в россии xix века	1
столичную лихорадку отчаянный темп	1
сущности человека и его	1
пушкина гоголя и достоевского	1
промежутки времени лихорадочный темп	1
фантастики прямо повлиял на	1
подлинная столища мира дело	1
в литературе романтизма исключительным	1
из неточки п бицилли	1
раз этот роман сознания	1
характеризуется событийностью лирика бессобытийна	1
упорство и рабская живучесть	1
призрачный свет фонарей обманывает	1
идея погаснет в уме	1
четкостью и силой опровергается	1
некрасов отчасти и делает	1
нестерпимая пошлость эпигонский романтизм	1
нему словно бабочки на	1
диккенс по-своему романтизировал пошлую	1
себя по заповеди христовой	1
чиновника к генеральской дочери	1
на краю достоевский поднимается	1
к екатерингофу князь мышкин	1
самим временем существует обратная	1
я жила жизни не	1
будет потому что не	1
мира достоевского скорее наоборот	1
ночному городу с его	1
видала моя жизнь на	1
болезненным переживанием достоевский пытался	1
россию обещая ему свое	1
духота и пыль и	1
говорит о моментах экстаза	1
романтизм поначалу с презрением	1
бы раскольникова или достоевского?	1
точно передает обычное читательское	1
xix века они оставались	1
органных арий дешевых трактиров	1
выступают как поведенческие символы	1
требованиями природы человека придумать	1
можно считать остров волшебницы	1
наш р н в	1
добру свобода воли необходимое	1
его в философские символы	1
важных отличий в войне	1
предшественников диккенса и гоголя	1
близко умонастроениям самого достоевского	1
как результат болезненного мира	1
присущий ему закон гуманизма	1
достоевского включает жгучую мечту	1
о которых впервые отчетливо	1
существо должен был знать	1
похожие на здешних там	1
к наказанному генералу но	1
рассматривает как пример известного	1
явно эпическая передача времени	1
смеет совершить решающий шаг—тот	1
тем самым фурье защищал	1
неточку превращение петра александровича	1
такого изображения каморка раскольникова	1
теории социального прогресса и	1
иного рода на протяжении	1
н м чирков что	1
очень любят и у	1
природы в конечном счете	1
ненависть к обществу порождает	1
с всемирно-историческим как и	1
буржуазии время героев изоморфно	1
его образность и мышление	1
неточке просматривается связь с	1
время это есть отношение	1
он заявил что свобода	1
развития так материализм соединялся	1
жить значит сделать художественное	1
в недрах народного сознания	1
и зловонием серых будней	1
россия австрия столица деревня	1
мира дело не в	1
споры ивана с чертом	1
подготовляет внутренний протест против	1
в историческом духе воплощение	1
к фатализму на все	1
усложняют нашу задачу анализ	1
черепахи и к этому	1
проблематична но без религии	1
космических природных символов солнца	1
теориями физиков xx века	1
самого трагического и самого	1
достоевский как от себя	1
хронологии романа составит полгода	1
свое лицо он отлично	1
рассматривать в движении как	1
гибель переход в самоотрицание	1
отечества достоевский беспощаден к	1
да и в других	1
общего времени людей отстает	1
русской литературе нет более	1
в песок подпольный человек	1
или иную дорогу и	1
его правах реставрация эпической	1
унижает себя но это	1
поражает воображение и вот	1
по хозяйству время вообще	1
мой особняк моя скорлупа	1
добрые люди еще раз	1
человека человека эпохи буржуазной	1
отказаться от свободы от	1
вторым эпический рассказ прямо	1
философии фомы аквинского который	1
морально-религиозного перерождения людей считая	1
людьми взыскующими града это	1
и вызвало пресловутое обвинение	1
оппозицией порог площадь вот	1
прочь из дома на	1
слияние с остальным человечеством	1
которой осуществляются религиозные пророчества	1
а чтоб мне чай	1
англичанина употреблявшего опиум была	1
мир беспощадный к красоте	1
лицемерно было это приглашение	1
разоблачен гоголем писать о	1
истоков оппозиция земля-космос трактуемая	1
полного произвола он говори	1
вечности человеком в его	1
возможно дремотное протекание времени	1
романного пространства достоевского тут	1
не человеком а каким-то	1
он мечтал поразить своей	1
миру для творчества достоевского	1
могу быть… добрым это	1
это так? нам кажется	1
азии какое отличие от	1
рассказе скверный анекдот который	1
да не все же	1
чего чтобы вы провалились	1
каждом человеке хотя бы	1
гоголь трактует город как	1
этюд к роману преступление	1
скверном анекдоте это в	1
это ключевая фраза повести	1
не обманывает а предостерегает	1
его тематику достоевский объективно	1
науке давно зафиксирована эта	1
на неминуемый провал мечтатели	1
достоевского сновидение сплошь и	1
эсхатологические размышления самого автора	1
своих прежних мучений и	1
довольно обычный прием композиции	1
фельетона четвертый фельетон цикла	1
момент мне как-то становится	1
дав однажды такое сгущенное	1
нераскаянным гордецом в финале	1
с его романтическим историзмом	1
эта декларация принципиального отказа	1
о безысходной власти среды	1
трагическому представлению о жизни	1
повлиял на молодого достоевского	1
из тупика достоевский мыслит	1
растущую жажду деятельности обусловить	1
следовании программе натуральной школы	1
их подвижная летучая легкая	1
его истерического злобного сладострастия	1
сопереживании сатира становится невозможна	1
тщательной датировкой фиксацией их	1
романтик среди будничной действительности	1
автора лебедев профессор антихриста	1
очень уместно напомнить слова	1
свободы и естественного равенства	1
и делает это в	1
как призрак но в	1
что я достит цели	1
теперь ее был просящий	1
роман искал в эти	1
белых ночах с его	1
что рассказчик этой знаменитой	1
позиции превращение действительности в	1
