в преступлении и наказании	10
с там же с	9
в то же время	7
архива достоевского идиот неизданные	4
же с там же	4
там же с там	4
с из архива достоевского	4
из архива достоевского идиот	4
достоевского идиот неизданные материалы	4
с достоевский ф м	3
писемский а ф письма	3
преступлении и наказании и	3
идиот неизданные материалы с	3
легенда о великом инквизиторе	3
ф письма к дружинину	3
с писемский а ф	3
а ф письма к	3
в записках из подполья	3
в образе князя мышкина	2
и наказании и других	2
с штакеншнейдер е а	2
на болевой эффект в	2
лемке м политические процессы	2
а дневник и записки	2
что скрытый миф романа	2
проникновение многообразия жизни в	2
принцип двойной объяснимости сюжета	2
всякое человеческое сердце судорожно	2
показывает что жить без	2
штакеншнейдер е а дневник	2
гослитиздат с писемский а	2
ф м письма т	2
ни во что не	2
сильнее и конкретнее его	2
с лемке м политические	2
цепи случайностей и совпадений	2
штакеншнейдер записывает июля года	2
неотделима от ее носителя	2
в зимних заметках о	2
политические процессы в россии	2
процессы в россии х	2
заметках о летних впечатлениях	2
права на болевой эффект	2
зимних заметках о летних	2
достоевский ф м письма	2
жизни идей в романах	2
м гослитиздат с писемский	2
судорожно и болезненно сожмется	2
письма к дружинину с	2
творчество достоевского м с	2
и в то же	2
м письма т ii	2
я бы прошел до	2
неизданные материалы с там	2
м политические процессы в	2
е а дневник и	2
и не может быть	2
сердце судорожно и болезненно	2
влечет за собой психологию	2
идей в романах достоевского	2
родился в наше время	2
преступлении и наказании но	2
ю м лотман находит	2
письма т ii с	2
в том же году	2
в россии х гг	2
материалы с там же	2
человеческое сердце судорожно и	2
накрытый юбкой пройдохи женского	1
академической философии против абстрактного	1
открыть истинную сферу жизни	1
кульминацию сюжета братьев карамазовых	1
со своими героями-идеологами в	1
у ложа умирающего брата	1
года очевидно испугали его	1
о своем ребеночке которого	1
характеры вторичны правда характер	1
энгельгардт это положение почтительно	1
слезы то есть выражающая	1
главный экзамен экзамен общечеловеческой	1
целая нация действительно испытала	1
форма диалога автора со	1
мнению с м бонди	1
хласко в году находил	1
чувство читателя достоевского обвиняли	1
меры толкование апокалипсиса лебедевым	1
это самая неприятная часть	1
действия искусно тормозится комической	1
имеет большой идейный смысл	1
говорили что четыре раза	1
в журнале утверждается благосветлов	1
нового мыслительного усилия форма	1
белинского который подверг уничтожающему	1
преступное намерение но можно	1
собой цели социальной сатиры	1
выходить журнал графа знаменитое	1
у фонвизина и нет	1
способом познания и самопознания	1
в смешном и униженном	1
античной трагедии испытывал скорбь	1
возбужден вопрос этот и	1
заявил о своей гомеровской	1
как бы синтезом идей	1
тогда как по самой	1
только билет ему почтительнейше	1
наслаждается рискованной игрой в	1
как и для писарева	1
сам»… точка зрения извне	1
идеология достоевского всегда влечет	1
к графу в связи	1
каждом из нас за	1
нелепая связь событий находит	1
в своей катастрофе таким	1
мой друг это подобно	1
января года начал выходить	1
который подверг уничтожающему разносу	1
символом разумеется с другим	1
и сочинительством и в	1
великолепный вечер с ужином	1
занимал в конце жизни	1
многократно умножить на всем	1
представляется нам легко разрешимой	1
григ ал кушелева старший	1
царь эдип шекспировского гамлета	1
героя-повествователя не мешает его	1
я перестану если хочешь	1
трагического мифа миф присутствует	1
княгиней и трагическая жертва	1
в мартовской книжке русского	1
развитии исключительно важную роль	1
автор дает медицинские пояснения	1
на конногвардейском бульваре обморок	1
поля первого теоретика юмора	1
русского слова майков а	1
живое лицо к которому	1
подростке и др психологические	1
совесть людей при посредстве	1
не учитывает того факта	1
бессмертен он вечный скиталец	1
и свободные парафразы мифов	1
болезни по какой-то странной	1
гюго виньи траги ческий	1
шигалевщина карамазовщина смердяковщина за	1
и смеется что он	1
делают некоторые современные исследователи	1
прозаическое но в самом	1
д в известной мере	1
наделил своих героев-идеологов пронизывающе	1
и в том же	1
боли о человеке которая	1
достоевский слышал как василий	1
христа как личности ваш	1
потому атеист кириллов и	1
повторил вышеуказанную параллель из	1
над героями а сама	1
в рассказе скверный анекдот	1
что подлинный юмор включает	1
достоевского унижения раскольникова исповедь	1
что у него за	1
об оскорблении дуни пьяная	1
парадокс парадоксальное нетипичное сочетание	1
формам трагедию полного непонимания	1
глубинная ориентация заслоняется приемами	1
быть понята лишь из	1
человеческого достоинства против разума	1
на разоблачения смердякова и	1
восстановить ту силу непосредственного	1
достоевского приближается к натуралистичности	1
идеалов диктовали восприятие болезненного	1
романист задумал князя мышкина	1
в момент наивысшей опасности	1
ставрогина после удара шатова	1
и пиквик как добродетельные	1
этических истин голос народа	1
заключается в выражении его	1
братьев карамазовых он записал	1
в бордели и т	1
то исключительно любопытен пример	1
мифология полностью определяла образ	1
хитрый и хорошо образованный	1
по случайному совпадению весьма	1
следователя эти примеры можно	1
далее служанка настасья желая	1
образом если у реалиста	1
исследователь находит удачные примеры	1
которое тут же дезавуируется	1
опускает голову более того	1
визитов уж несколько раз	1
профанация дьяволов водевиль к	1
сонма фигур афинской школы	1
душе героя-идеолога вот грозная	1
моделирует отношение болевого эффекта	1
не черта их объективного	1
романа и предваряет литературу	1
сооружения или памятники мысли	1
скандалы и унижения этот	1
как личности ваш христос	1
по сей день забывают	1
в павловске среди парка	1
поколебленной только с этой	1
вмешательство высших сил то	1
и записки м.-л с	1
в ту ночь у	1
литературе в принципе художественного	1
парадокса г м фридлендер	1
себе всегда нечто более	1
завтра из мертвых воскреснуть	1
напечатан дядюшкин сон по	1
комического в этих сценах	1
видел ли он митю	1
себе не являются реалистическими	1
достоевский далеко отошел от	1
характеры вторичны по отношению	1
идиотом от матери ненавидящей	1
героя соответствует его характеру	1
единственная побудительная причина перелома	1
графа достоевский не мог	1
мы и без этого	1
и понятиями-мифологемами судьба рок	1
принял определения белинского и	1
начиная со ii части	1
творческом сознании достоевского в	1
предстоящих ей как нечто	1
ни к графу льву	1
эти окказиональные мифы представляют	1
м м бахтина признать	1
целях он направлен на	1
характерная для сюжетов достоевского	1
выразиться циничный романтизм перегоревший	1
принять как наиболее приближающий	1
офелии веселую пикировку беатриче	1
или уголино хотя поэт	1
создающегося романа поэтико-символического второго	1
кожа построенная на основе	1
окончательно лишается внутренней вероятности	1
среди пораженной ужасом и	1
странностях графа достоевский не	1
очень важен и поучителен	1
эти гордые бунтари романтические	1
ему русском быту однако	1
копия с гольбейновского трупа	1
свои руки воскликнул с	1
в романах достоевского реализация	1
в таком случае вся	1
нам невыносимо читать об	1
решающий шаг признав по	1
так что они одновременно	1
набежали как голодные собаки	1
бы продолжающей текст пуанты	1
можно читать как некий	1
она истерически зарыдала …	1
курочкин и генерал баумгартен	1
л п творчество достоевского	1
сюжета женитьба князя мышкина	1
текста как по причине	1
демонстрирует их родственную природу	1
никто в романе не	1
эта измученная женщина отказывается	1
лишь несколько иллюстраций среди	1
таковы притонодержательница бубнова в	1
у достоевского как на	1
воспоминаниях и переписке спб	1
изображаемого характера понять его	1
и еще одним из	1
поэтической аллегории resignation vollmachtbrief	1
аристократ с чертами дегенерации	1
ее собственной толще это	1
литературные ассоциации лишь частично	1
их смысла достоевский все	1
тон с самого начала	1
сила убеждения героя-повествователя не	1
достоевский пишет известные письма	1
сюжета братьев карамазовых то	1
знаменитых писателей проходимцев и	1
безобразная улыбка улыбка стыда	1
говоря что христос в	1
романа достоевского наоборот уклонение	1
религиозной мифологии в романе	1
слишком упитанной и тяжелой	1
следующие девять глав романа	1
смысле или подсказывает читателю	1
поступков все эти наблюдения	1
дегенерации абсолютно непрактичный и	1
лишь характеристику самой сложности	1
й части мы видели	1
из парижа он привез	1
и священник молча опускает	1
его очерках рассказах путевых	1
настасья филипповна дважды отмечающая	1
некоторых персонажей достоевского в	1
несколько раз повторяет боль	1
другое достоевский в целом	1
переписке сравнивал достоевского с	1
плана сюжета его скрытого	1
термины как мистический реализм	1
характер князя изменен достоевским	1
его умение перебивать трагический	1
миллионером тысячи душ крепостных	1
этом назиров р г	1
фабулы со скрытым мифом	1
развития достоевский шел в	1
равномасштабна ему представляется весьма	1
решения поступательный и катастрофически	1
происходит то вместо уничтожающего	1
спасет мир а о	1
больших романах достоевский до	1
он дает им полную	1
вновь возродиться воскреснуть аналогичную	1
внимание читателя на соотнесенность	1
кто бы он ни	1
быть человеком настоящим полным	1
стихийный гуманизм так сон	1
роман величайшей книгой в	1
спасен ведь мыслитель испытывающий	1
нечто более субстанциальное чем	1
см об этом назиров	1
вымышленных а творчески развитых	1
живого лица начинался творческий	1
упомянут эпизод не вошедший	1
не только для возмущения	1
процесса достоевского но отнюдь	1
х гг м госиздат	1
догадку читателя своими реализованными	1
и откровенно а прямым	1
раскольников должен сознаться сам	1
распространение и отвечало творческой	1
роман и русское общество	1
важную роль но которым	1
такое понимание юмора л	1
сочувствием к героям чужой	1
уже начиная с овсянико-куликовского	1
любви к человечеству для	1
есть бунт против академической	1
уважение достоевского к человеческой	1
похож ни характером ни	1
периодическая дробь весь финал	1
прожили сто тысяч рублей	1
цикла исторических былин в	1
только положительно прекрасное лицо	1
метафоры и тут же	1
дается на фоне обстановки	1
самым свое глубокое переживание	1
ряд упоминаний о графе	1
сложности юмора способного к	1
не только понять логику	1
юмор это веселая смерть	1
в какой-то мере эквивалентные	1
взамен вергнутых идет монтаж	1
для автора вообще герои	1
м лотман находит между	1
в которой он возвышается	1
либерала заискивающего перед нигилистами	1
алекс … пусть в	1
шокировал высшее общество петербурга	1
князя и рогожина после	1
всего романа в целом	1
достоевского как фантастического реализма	1
заведения не вошел в	1
или осуждения то у	1
окончил александровский лицей и	1
данные подлинных лиц прототипов	1
законом наименьшей вероятности наименее	1
размещалось по разным отделениям	1
к автору карамазовых критик	1
листочки становятся в устах	1
некоторое представление о графине	1
масштабы захватывающие евангельскую мифологию	1
преступление заставляет жить в	1
лавочниками достоевский презирал такое	1
осмеяние как в сатире	1
выработала этот механизм болевой	1
мифологии были хорошо ему	1
скорбь но не боль	1
и к анализу контраста	1
род кушелевых-безбородко пресекся со	1
пралинский обмарался и в	1
одновременно все напряженнее искал	1
драматизм штурм всякого рода	1
примешивались и прикладывались подходящие	1
юм лев мей и	1
за собой в своей	1
нарушая традицию приносил эстетическое	1
все возрастающей масштабности романтизм	1
разбудить моральное сознание как	1
дневник и записки м.-л	1
развязкой… прежде всего его	1
павловске нет в романе	1
вышеуказанную параллель из безумцев	1
в творческом сознании достоевского	1
вызванный ею характер не	1
что христианин и социалист	1
и от пошлой карикатуры	1
человеческой личности оскорбление лизы	1
о смерти и воскресении	1
знаменитые ложные узнавания впервые	1
не вторую часть а	1
с автором вовсе не	1
не вполне ясной для	1
пользу их разумного применения	1
христианскую трагедию марта года	1
комбинировал изменял усиливал глубоко	1
рогожина после чего старая	1
историзму достоевского понятию религиозно-мифологической	1
нуждения сознаний как было	1
вычеркнутая цензурой в записках	1
достоевский ориентировался на ад	1
ревизии добролюбовской оценки и	1
знаменитому доктору гаазу но	1
аргументов против этого бунта	1
одоевский последний отпрыск аристократической	1
часто сближают с героями	1
а я панаевой с	1
утилитарной этической теории бентама	1
с первого взгляда узнал	1
был последним в роде	1
но лишь аргументом в	1
между ними полубезумная красавица	1
душ допустим настасья филипповна	1
но нет смысла умножать	1
т с соловьев в	1
герои достоевского более не	1
оскорблению наше нравственное чувство	1
а милютиной я преимущественно	1
писателя за год достоевский	1
соответствии с этим xix	1
исповеди мармеладова обычные казалось	1
области эстетики и эстетика	1
хотя во многом спорны	1
о прототипе ставрогина пришел	1
чего он не знал	1
гамлета у ног офелии	1
если же это происходит	1
в романах достоевского осуществляется	1
еще дважды это явление	1
составляет для настоящего автора	1
достоевский воплощает трагедию в	1
вызывать принудительной веры в	1
а идею видим в	1
не выезжаю один никогда	1
на его месте сказал	1
фабуле ориентировка характера в	1
личностно воплощенных строит идейные	1
бубнова в униженных и	1
в статье петербургский сборник	1
скверный анекдот в котором	1
пуговкой макара девушкина такая	1
живое реальное лицо характеросложение	1
выражающая внутреннее приятие мира	1
какая ты бяка сделался	1
в его преступлении и	1
первой части он пытался	1
авторская активность в романах	1
совпадают с биографией и	1
m.-л с там же	1
прощение в церкви блудницы)…	1
таким образом г а	1
безумия в душе ивана	1
с определенным разочарованием в	1
приносил эстетическое наслаждение читателя	1
народной медицины кровь печенками	1
людьми причина этого непонимания	1
действительность через свое собственное	1
горио этот бальзаковский король	1
… до всегуманных и	1
художественной ситуации действующее лицо	1
торжестве правды итак стремление	1
пораженной ужасом и состраданием	1
прозы xviii века его	1
ее связь с ге-тевской	1
наблюдений создает драматизированную картину	1
анализа поэтики канонического текста	1
xix веке внутренний мир	1
сентиментального гуманизма любящего напудренное	1
льву который весь сжимается	1
униженных и оскорбленных лужин	1
