в эпилоге нет диалога	1
каторгу а князь валковский	1
отражает этические истоки фобии	1
является как бы прирожденным	1
что это наилучшее введение	1
девушкин достоевского наделен острым	1
еще бы ведь признав	1
первым героем достоевского одно	1
слишком мудрено достоевский прибегает	1
сон о трихинах в	1
лишь один мир беспощадный	1
романах достоевского несомненно роман	1
сделать другие выводы этот	1
при входе на лестнице	1
ассоциации достоевский тем самым	1
содержание пусть герои кафки	1
гуманность тщетно протягивает руку	1
свою исключительность унижаясь возвышается	1
обсуждение этой проблемы в	1
я и не поморщусь	1
формулы но вытекающее из	1
против замены отношений между	1
берлин сопоставляя композицию романа	1
во сне раскольников видит	1
эта традиция преломленная философствованием	1
совершенно непригоден что как	1
бессознательного человеческая проблематика составляет	1
романе трояким образом известно	1
субъективности переписывающихся между собой	1
крик души искренняя жалоба	1
предельного стыда генерала генерал	1
же нас казнят против	1
голядкина торжество совести над	1
романтической литературы сочинение жизни	1
души фактически постулируются достоевским	1
в виде пятирублевой ассигнации	1
голгофы где христос был	1
при все своих различиях	1
кладбища и стучат в	1
прохожий мещанин на улице	1
значение в действии статья	1
содержание в их неразрывном	1
на чем постоянной у	1
аморальность это романтизм подлости	1
собственно ее исчезновение гибель	1
мурин прямой потомок гоголевского	1
виктор шкловский верно указывает	1
пока что еще далеко	1
состояния совершенного идиота автоматизм	1
и пытаясь терроризировать его	1
квинси его печальным пристрастием	1
германн у пушкина падает	1
над историей антропологизм эпохи	1
а это означало полемику	1
а затем с каким	1
достоевского вступая в литературу	1
это означало бы что	1
же катастрофическая быстрота действия	1
эгоистическими влечениями человеческой натуры	1
что непосредственным источником приема	1
до своего естественного предела	1
искусно тормозится витиеватым многословием	1
учений домарксовского механистического материализма	1
эволюция героя в раннем	1
правоту уверовав в него	1
сладострастия превращающего любовь в	1
мыслит так словно для	1
свою посред ственность представляет	1
опережая наши рассуждения отметим	1
писателя как единый мир	1
а дисконтёры тигров романтизм	1
простыми персонификациями бессознательного человеческая	1
каждому безраздельно и беззаветно	1
все просвещенное общество осмеяние	1
над своими спасеньями во	1
народов ибо это явно	1
и в свою очередь	1
сразу понять раскольникова в	1
достоевского он резко отличается	1
принципиально новую интерпретацию а	1
характерность масса художественных параллелей	1
буржуазном обществе подавляет в	1
противоположно концепции зигмунда фрейда	1
на молодого достоевского фурьеризм	1
выход на воздух пока	1
хотя бы предсмертный крик	1
сифра и в моменты	1
свою слабость а нередко	1
и красота люди викторианской	1
связан с темой романтического	1
противоречия социальной действительности достоевский	1
клаустрофобия болезненная самоизоляция и	1
в котором живут герои	1
отнюдь не повергает достоевского	1
часто иной хитрый и	1
и служба и научная	1
подпольный человек сознает низость	1
за совершенную перуджинову бианку	1
наполеон из подполья повесть	1
временное пере живание иллюзия	1
поведения от вмешательства бога	1
цирцеи в одиссее пространственно-временное	1
это является ложью не	1
ночам когда мертвецы встают	1
кроме того мы предполагаем	1
порождая болевой эффект авторская	1
из апокалипсиса к ней	1
свой опыт больного как	1
и из маскарада лермонтова	1
как к предмету рационального	1
высочайшее употребление которое может	1
демократические кварталы петербурга бедные	1
генерализации впечатление полного переживания	1
подполья не дают быть	1
точно так же вся	1
скверных анекдотах но даже	1
берется весь мир а	1
свое я от давления	1
деформации пространственно-временных восприятий обратившись	1
свобода человеческого поведения от	1
субъективной психологии героев и	1
несчастная девушка тем самым	1
характер либерального реформаторства трагикомический	1
человечества логически вытекает необходимость	1
духовного состояния героев ненависть	1
я не перемечтал в	1
ее свободы означает в	1
и у кого чего-нибудь	1
в эликсире сатаны гофмана	1
давая им принципиально новую	1
первых произведениях гоголевские ассоциации	1
преступления и наказании значимы	1
оппозиция прослеживается на трех	1
иртышские степи с юртами	1
наказания только наказание не	1
чтобы какой-нибудь новоявленный пискарев	1
и резкое сближение достоевского	1
первый взгляд просто островок	1
типа свидригайлова и ставрогина	1
не так ли и	1
на мосту и на	1
протягивает руку у порталов	1
переживание времени выпадает из	1
я вздрогнула от какого-то	1
так вот оно наконец	1
не терпит резких и	1
экономических выкладок статистика буржуазна	1
присоединяясь к метафизическому бунту	1
бы ведь признав его	1
болезненная жажда общения с	1
уже пространственно-временная организация романа	1
погаснет в уме кириллов	1
у порталов банкирских дворцов	1
сознает что все это	1
городу с его готовностью	1
с высот минутного успеха	1
в своей известной дегуманизации	1
путями к этому христианскую	1
с миллионами собратьев по	1
названы и марлинский и	1
упреки сторонники этой теории	1
роднит с первым героем	1
и обрекало образ ивана	1
взял реванш в творчестве	1
героем микросреды гуманных отношений	1
в болевой эффект читатель	1
к достижению цели не	1
все плачут и целуют	1
со своего пути уличных	1
всякий эстетический факт необходимо	1
собой яркий тип эстетствующего	1
петербургская летопись из неизданных	1
добра и зла трактуя	1
последовать но боясь разбудить	1
повышенной говорливостью выступают как	1
постоянный характер за петром	1
с история русской литературы	1
же писателю был нужен	1
противоположными результатами аркадий долгорукий	1
времени в известном смысле	1
не бедный чиновник с	1
тем более эта истина	1
мире достоевского это антитеза	1
до усиленного сердцебиения заставляя	1
трактует город как призрак	1
большого города урбанистическая тема	1
образом время основного действия	1
назвал простыми персонификациями бессознательного	1
утопизм достоевского презрительно чужд	1
к петербургу на протяжении	1
общества путем реформ однако	1
иллюзии в своих гигантских	1
чем постоянной у достоевского	1
дешевой краски гниющей рыбы	1
и я вздрогнула от	1
до белых ночей в	1
субъективного восприятия героев время	1
влечениями человеческой натуры закон	1
конвульсии вспомним что скорлупа	1
как от себя лично	1
самим собой как призыв	1
портрет отчасти страшная месть	1
в прекрасное и высокое	1
по смыслу а по	1
как у других мастеров	1
же заколдованном кругу объясняя	1
изображение раздвоенных мучимых совестью	1
и богато как у	1
находим у а и	1
лишь на некоторые функции	1
чувствовать страдание кото рое	1
навеки отравило в нем	1
показанное в его произведении	1
пример подлинно гуманистического устроения	1
и гуманной иллюзии мечтатель	1
мещанина-мстителя злобного выродка романтического	1
настоящее время романа тут	1
любовь иными словами уже	1
в финале идиота знаменитое	1
этот момент мне как-то	1
александр освободитель и все	1
и того что свидригайлов	1
намеками как бы отсылая	1
отвлеченной мысли и не	1
просветительской традиции в русской	1
для утверждения своей свободы	1
среднего рода мечтателем автобиографические	1
потому что не надо	1
то в хозяйке и	1
с беллетристикой великий писатель	1
понимание человека признавая обоснованность	1
вальтер скотт прославил времена	1
за то что его	1
и оставаясь формально верноподданным	1
приобрела символический смысл контраст	1
пселдонимова и он учиняет	1
словно бабочки на огонь	1
философию чернышевского сколько на	1
он признается самому себе	1
не сворачивал он просто	1
обоняния тут и духота	1
квинси подробно описывает свои	1
хитрый и понимающий дело	1
ней же он вернулся	1
с чирков н м	1
истории литературного мотива в	1
мученики а в романе	1
берегов ганга и миссисипи	1
чертом и даже жителей	1
миндаль бросил миндальничать и	1
раскольникова сравнивающего муку и	1
пессимистическим высказываниям противоречит светлая	1
еще острее и болезненнее	1
знаменитую ныне запись люблю	1
времени героями они живут	1
зловонием серых будней петербурга	1
для достоевского существенно только	1
истина применима к творчеству	1
бедных людей достоевский никуда	1
в точном расчислении хронологии	1
находился центр тяжести современного	1
сравнивающего муку и страсть	1
лабиринта города в нашей	1
и было положено в	1
но если нельзя признать	1
его антропологизма отразилась в	1
в одиссее пространственно-временное единство	1
попрания личности партнера я	1
теми двумя искусствами открытие	1
эта секунда заключает в	1
убегают от жизни в	1
особым пространством обломова выборгская	1
тенденция записок из подполья	1
в интересах его искусства	1
выезжают прямо в антракт	1
христос немало спорила русская	1
философия времени ибо у	1
призрак крадущий шинели достоевский	1
зависим от людей которыми	1
плане временной организации субъективное	1
каком-то жесте выражающем его	1
всего вверх от подвалов	1
мужественного трагического усилия человека	1
глубокий исторический смысл итак	1
рассказчик этой знаменитой книги	1
является исходной ситуацией не	1
пауперизма вот почему утопия	1
наказания единственный видимый повод	1
указывающий на соприсутствие прошлого	1
захлебыванием уверяет себя и	1
достоевского чрезвычайно уплотнено первый	1
пространство выглядит несравненно более	1
юртами кочевников на том	1
мученический опыт болезни наградил	1
петербургу городу трагического величия	1
гоголевского подхода к маленькому	1
демонизм демонические персонажи достоевского	1
когда он приходит к	1
поэтическая индивидуальность как единство	1
парадоксалиста о петербурге самый	1
этой связи очень уместно	1
лермонтов угрожал убийцам пушкина	1
наглядно демонстрируют рождение урбанистической	1
и назвал это состояние	1
парадоксальным образом роднит их	1
в рим… здесь пародируется	1
личности прямо солидаризуясь при	1
вероломство жестокость эстетичны ведь	1
времени как бытие в	1
преломленная философствованием жан-жака руссо	1
победа субъективно-лирического переживания момента	1
с каким захлебыванием уверяет	1
гоголю продолжая казалось бы	1
открытой народной жизни на	1
очень важную роль в	1
бросают чтение ибо удовлетворились	1
находятся в остром противоречии	1
целом со всеми его	1
он эксплуатирует факт несовпадения	1
краски гниющей рыбы прокисших	1
энгельса с другой стороны	1
картины френхофера тем самым	1
это довольно обычный прием	1
ни на чем постоянной	1
сенной площадью герои достоевского	1
взгляды суммировал уолтер кауфман	1
синтез социальности и натурализма	1
в нем желчь и	1
собратьев по несчастью немедленно	1
пункта в котором оно	1
европейского романа начало усложняться	1
отчаяния презрительно третируя благодушных	1
причина его появления отсутствие	1
поза …потому что я	1
топором в руках подполье	1
диалог могильщиков над гробом	1
и собор это тот	1
достоевского является функцией их	1
мышкина и имеет тот	1
мира искренность сливается с	1
шаг и публично поставил	1
известно решение м м	1
достоевского одно общее качество	1
творчестве достоевского русская демократическая	1
вне искусственной микросреды заранее	1
судьбе великого романиста мы	1
отпечатавшихся в душах всех	1
проявление всей жизни и	1
маленького человека таким образом	1
года до первого издания	1
прямо связанный со старосветскими	1
отчасти и делает это	1
герой противопоставленный анонимной толпе	1
различных закрытых помещений видимо	1
м.-л с см назиров	1
человека опровергается новейшей психологической	1
его классической архитектурой статуей	1
всего они играют очень	1
признаком особо рафинированного интеллектуализма	1
автору достоевскому еще за	1
той же романтической традицией	1
воскрешения лазаря который лежал	1
этого обезличенного человека сердцевину	1
грешника смело трактовал соотношение	1
отношений отношениями между вещами	1
ее безграничной добротой антигерой	1
мы обнаруживаем сжатую и	1
той скачкообразной динамики в	1
центральных учений домарксовского механистического	1
клаустрофобией боязнью замкнутого пространства	1
до них за дело?	1
подпольного человека болезненно сталкивается	1
в создании образа мрачного	1
сахаре миндаль бросил миндальничать	1
мечтателя во многом неуспех	1
свидригайлов говорит что такое	1
диссонанса между этическим и	1
же самая секунда в	1
замыслов в своей книге	1
откровенным обращением достоевского к	1
конца по мере приближения	1
лицо он отлично осознает	1
способен на эту форму	1
первый исследователь этой проблемы	1
исключение умывание этой простой	1
дном и двойник прямое	1
проникнут смешанной настроенностью боли	1
и этот гнилой склизкий	1
год с самого начала	1
жизнь покушается на подполье	1
не уступил ни на	1
мнений для изменения мира	1
это и послужило причиной	1
сновидений прежде всего они	1
нравственности нет добродетели если	1
зенон и платон обсуждение	1
публичном доме куда попадает	1
мотивы новелл владимира одоевского	1
чичерина д с лихачева	1
как бы заранее обессиливало	1
бы позиций он ни	1
тяготение достоевского к пространственно-экстенсивному	1
социальное положение талант добродетель	1
художественном воплощении учитывает бесконечное	1
так смотрят дети на	1
финале мертвого дома и	1
является функцией их сознания	1
напоминает описание некоей картины	1
человека убившего собственную совесть	1
через жесточайшую гиперболизацию быта	1
неравенства руссо объявил частную	1
гейне имя которого не	1
на повесть записки из	1
говорит о мечтателях они	1
повести подпольный человек может	1
содержит деталь перенесенную из	1
мира достоевского не отдельные	1
лирическим героем чем эмпирической	1
болен истерзан и счастлив	1
свобода предполагает ответственность тогда	1
действительно отправной пункт философствования	1
когда писатель мучительно переживал	1
его искусства подчеркивать грубость	1
для характеристики этого негодяя	1
минуты вы доходите до	1
повести белые ночи в	1
ночей за один день	1
не к злу это	1
защищаясь от жестокой и	1
времени у достоевского сочетается	1
сверхразумным мистическим знанием представляются	1
тут и финалистские представления	1
достоевского это антитеза гроба	1
называли романом скверных запахов	1
читателя то к чему	1
карамазов как правило эта	1
этих каморках оторванные от	1
фантастического города в мире	1
пародирующий романтико-философскую терминологию вечная	1
что в каждом человеке	1
исследователь этой проблемы а	1
человекобогом такое представление о	1
других мастеров критического реализма	1
