татьяну и уменьшенную копию	1
добролюбовской оценки и объявил	1
вывести прочного суждения идейная	1
известные цитаты из писания	1
героя-идеолога характерно сходство с	1
идеологического завершения художественное завершение	1
положительно прекрасное лицо христос	1
не могли удовлетворить писателя	1
у достоевского нет никаких	1
и извинений вот выдержка	1
прием взят из гамлета	1
говорить о религиозных мотивах	1
в п боткина а	1
слагается сама фабула рассказа	1
будучи не в силах	1
прототипов какое место занимает	1
сочетается с болезненным гиперболизмом	1
французские дипломаты офицеры журналисты	1
или нет об этом	1
заставляет нас искать символический	1
мне удалось подойти очень	1
вещь мой друг это	1
же время бессознательно изобличает	1
автора как носителя концепции	1
комитета министров в году	1
героев ана логичным образом	1
на известие положения отечественной	1
чувством превосходства приоритет здоровья	1
сам достоевский в отличие	1
гуманизм сонечки ни та	1
если дон-кихот и пиквик	1
и вновь начать жить	1
грехах изданием двухтомника своих	1
образом впечатления действительности текущая	1
все рассуждения об эдиповом	1
посредстве жестокой правды какую	1
образа князя мышкина хорошо	1
остается взыскующим и бодрствующим	1
сюжета отмщения и тогда	1
были большие голубые и	1
девицей рассказывает о своем	1
и особенно в жизни	1
князя но когда герой	1
обстояло противоположным образом если	1
ни та ни другая	1
счет на деле дюма	1
главная борьба происходит не	1
хаос вторгается в идеологию	1
своего воплощения вплоть до	1
воздоровления sic но только	1
в предательстве завета таким	1
смердякова и пошлого черта	1
это отношение прямо не	1
ленского и татьяну и	1
в ее собственной толще	1
забавляется но вследствие этической	1
и символа достоевский был	1
но тоже включающая в	1
бездарности нечего иначе думать	1
князя мышкина первая запись	1
продолжается за пределами текста	1
рода гнев только обращенный	1
третий раз за гр	1
результату к острому чувству	1
этом могут пожалуй упрекнуть	1
также мея полонского памятники	1
подростка где версилов рассказывает	1
карамазов потрясает христианскую более	1
видно никакого воскресения христоподобный	1
со своим собственным прошлым	1
его бунта сильнее и	1
отдает ранним и относительно	1
основном его христоподобных героев	1
включая газетную хронику и	1
становится эксперимент проверочный опыт	1
ночь у колодца в	1
параллель из безумцев беранже	1
всегда перестраивающая начальную фабулу	1
сопереживаем осмеянному и провалившемуся	1
а к выявлению своего	1
понятия юмора достоевский как	1
грушенькой бытовая фабула романов	1
и пытаются практически решать	1
рассчитался со своим собственным	1
князь мышкин настасья филипповна	1
княгиня а только борется	1
и т д авторская	1
цыпочках и вдруг обнять	1
действительную жизнь в сфере	1
болевого эффекта между автором	1
образа но сам приглушается	1
поехал ванька в питер	1
более захватывающие чем рыцарские	1
в нем самом потерпело	1
достоевскому ничтожество христа как	1
ту эпоху тип обличителя	1
инквизиторе где повторно сошедший	1
фигуры того или иного	1
развивается с большей силой	1
рода не замечая что	1
с настасьей филипповной в	1
в бесах н м	1
покрытую мухами или иудушку	1
в терминах народной медицины	1
и расхождения взглядов порождают	1
попытаемся для начала дать	1
госиздат с штакеншнейдер е	1
фет а а мои	1
тип включает и осмеяние	1
omnium contra omnes выработала	1
немотивированный вид ю м	1
ужасной вечности это самое	1
купил за тысячи все	1
гоголя принцип двойной объяснимости	1
гуманность генерала пралинского выглядит	1
сознания повествователем рассказчиком рассказчиком-героем	1
романа создан настасье филипповне	1
ту силу непосредственного воздействия	1
шуточки или великий юморист»?	1
любви с ненавистью итак	1
то вместо уничтожающего смех	1
трагику достоевского от романтической	1
своего развития достоевский шел	1
как было блестяще показано	1
парадокса особенно любопытна характерная	1
болезненного гиперболизма трагедии у	1
за которой последует победа	1
прогулки в экипажах графа	1
в трагическом развитии исключительно	1
совершенно новым идеологическим содержанием	1
карикатурой на шиллеровщину в	1
достоевского с его жестокостью	1
подряд и мы же	1
с примерами совсем иного	1
по крайней мере пишется	1
граф прославился широкой благотворительностью	1
жертва героя стала внутренней	1
возобновиться от исконных первоначал	1
характером его происхождением его	1
л и кушелева-безбородко уже	1
тетради н ф не	1
мифа в братьях карамазовых	1
целый бы мир осветила	1
сочинительством и в году	1
достоевского родствен романтической гиперболизации	1
человечности и отнюдь не	1
ческий герой резко обособлен	1
милой графине граф женился	1
о характере этого слабого	1
гюго и шиллер эти	1
литературу символизма однако достоевский	1
литературы такое же уклонение	1
новыми платьями а затем	1
либеральное двоедушие но тот	1
руками безобразная потерянная улыбка	1
их историю до начала	1
это мещанская позиция краткая	1
запланированного ранее завтрака у	1
любой в принципе человек	1
глав идиота достоевский пишет	1
в черновых набросках некий	1
не в себе я	1
мне кажется дурачком я	1
и от паразитического подражающего	1
филистерства которые украсили его	1
в честь славянского съезда	1
вечно презирать себя отказаться	1
отчаянии вскричал ломая свои	1
романтические мировосприятия героев-идеологов без	1
он следует тому принципу	1
д все это размещалось	1
раскольникова позволительно предположить что	1
социалистом белинский тотчас согласился	1
пустого и предосудительного а	1
царя ирода богородица не	1
чем цель болевого эффекта?	1
со ставрогиным оставшаяся девицей	1
очищено огнем путь спасения	1
детский клуб образовавшийся вокруг	1
незримо присутствующим в бытовой	1
начиная с овсянико-куликовского осознано	1
не означает что всегда	1
идейность и бескорыстие как	1
вскоре в петербург прибыли	1
истерического ощущения в котором	1
романа отправлен был за	1
женщиной имевшей на жизнь	1
случилось с генералом пралинским	1
читателя в бунт героя	1
мещанин на сенной решает	1
из всего романа в	1
затем из этой уже	1
князем настасье филипповне в	1
гроссман говорил о романах	1
могут функционировать и сегодня	1
это основная форма диалога	1
тоже живое событие оказывают	1
с новыми платьями а	1
верные суждения о соотношении	1
либеральное обличительство высоко ценил	1
всего возникает гибкая и	1
первой части идиота напряженно	1
подал ходатайство о разрешении	1
и противопоставлен всему миру	1
можно многократно умножить на	1
знаменной финальной сцены следует	1
старухи-процентщицы эта перипетия имеет	1
ли вы льва никол	1
материалы и исследования л	1
и такие термины как	1
для определения литературной генеалогии	1
идеологических конфликтов …непредсказуемость и	1
собаки во х это	1
теодоры причем характер последней	1
антон контский василий курочкин	1
это перевернутый тип романтика-мечтателя	1
развитию действия автор столь	1
не первым и не	1
моральное осуждение героя для	1
так и подымает в	1
и генерал баумгартен русские	1
идей говоря несколько обобщенно	1
с князем валковским и	1
юма женившегося на свояченице	1
др психологические издевательства игра	1
в характере но почему	1
новый идиот кроткий чудак	1
и через него выше	1
при виде гибели героя	1
кушелев-безбородко напомнил о своих	1
удвоение автора это одна	1
нем самом потерпело неудачу	1
больших романов достоевского в	1
точное замечание а в	1
писателем который наслаждается самоцельной	1
к аглае брак князя	1
мир этой книги становится	1
а его бунт необходимым	1
метафора петь лазаря постепенно	1
древнюю религиозно-мистическую окраску трагического	1
неуловимого злодея зато в	1
чудо отрицает самой своей	1
конце х годов входили	1
в пользу отказа от	1
стихией комического но понятие	1
явно превышает обычную житейскую	1
от романтической мелодрамы эффекты	1
показано как романист ослабил	1
у него иные способы	1
весь финал повести три	1
определения манеры достоевского как	1
расквитался новым романом в	1
на вечере на цитре	1
критики героя через сюжет	1
мысль еще чересчур туманно	1
трагизма и катарсиса мира	1
метафизическая картина всемирной истории	1
противоположному развитию действия автор	1
и воплощенная в романе	1
несомненно исследователей отпугивает сама	1
средневековой житийной легенды и	1
рода трудностей уже этот	1
дают оснований для заключения	1
еще не все по	1
родство душ допустим настасья	1
журналисты в полюстрово побывала	1
старину девочку привязанную к	1
подлинности а к выявлению	1
среди несгораемых касс сюжет	1
в конкретизации замысел характера	1
у него своей функцией	1
фантастического оно никогда не	1
трудно дать однозначный ответ	1
статье достоевский и отцеубийство	1
ветхозаветного евангельского мифа средневековой	1
достоевского нет ничего кроме	1
слова любое нравственное суждение	1
как и в записках	1
воплотиться наконец очень важно	1
о болезни князя но	1
однако мистериальность трагики достоевского	1
затем из нее вырастают	1
область мифа парафраза имеет	1
достоевского лежит парадокс парадоксальное	1
нам представляется что для	1
с ними всякий сброд	1
последует победа христа история	1
мыслитель испытывающий такого рода	1
улыбка бунта юмор это	1
совершил это садистское надругательство	1
косвенно через сюжет выражает	1
хочешь ничего я тоже	1
ключевых фраз система аллюзий	1
христос родился в наше	1
сенсуализмом несколько выше на	1
обобщенно в его романах	1
модернизации христианской мифологии были	1
один месяц они прожили	1
одной философии зато человечность	1
графу в его болезни	1
ниже добролюбов подходит к	1
всякий сброд чужестранных и	1
метафор косвенно выражает то	1
как борьба бога и	1
индивидуальном сознании человека идея	1
пронизывающе убедительным самоанализом романтического	1
крайней мере уже почувствовал	1
свидригайловым а польский писатель	1
какую бы боль она	1
и предметом анализа автор	1
считает односторонним интересно в	1
в эпизод его духовной	1
в столкновениях героев которые	1
хочет сделать благо человечеству	1
в их изображении реализм	1
романа парадоксальные характеры достоевского	1
сочувствовать и мезальянсу графа	1
соня мудрый сердцем идиот	1
вежливость отчаяния юмор улыбка	1
увлекает нас за собой	1
названный в дневнике писателя	1
достоевского не могут быть	1
страдал с хореей кушелева-безбородко	1
быть определен как трагизм	1
внимания ни участия но	1
любови ив николай иванович	1
романа идиот князя мышкина	1
и он приходит к	1
мучений тургенев в своей	1
а скорее отождествляется с	1
у достоевского испытание глубин	1
о божественной комедии данте	1
искренняя причина моей сомкнутости	1
например как ненавидят друг	1
к привлечению романтического художественного	1
создает драматизированную картину пореформенной	1
перешедшего в руки благосветлова	1
к человечеству с необходимостью	1
экзамен общечеловеческой практики гуманистическое	1
бунт в последнем романе	1
сквозь слезы»—это определение жан	1
боль боль указывает всегда	1
на сенной обставляется пьяным	1
хотя быть может и	1
о корман в статье	1
главе версилов несколько раз	1
имеют смысл достоевский самою	1
личности это сказывается в	1
социалист нападает на князя	1
средствами но проводится с	1
в полюстрово побывала даже	1
о великом инквизиторе история	1
только борется быть иль	1
сюжет как христианскую трагедию	1
современного испанского писателя для	1
к выявлению своего художественно-фило	1
моменту испытывая стыд иван	1
смеха в структуре изображенной	1
к самой жизни вам	1
же современной трагедии лежит	1
завершающего суждения последнего приговора	1
того самоунижения которое бедность	1
самой своей форме есть	1
декабря года писатель бросил	1
или легендарным возможно давно	1
толстого и в п	1
художественное восприятие л с	1
умному человеку устоять даже	1
начинает выводить идеи из	1
знать об этом хотя	1
позже расквитался новым романом	1
образе князя мышкина достоевский	1
сцепленной нелепо и случайно	1
общественной позиции тургенева что	1
лежит в плане материальной	1
жжет сердце достоевского весьма	1
о генерале который на	1
литературе было два мастера	1
причем к силам зла	1
устами своих героев однако	1
попову графа я никогда	1
место как предтечи героя-идеолога	1
из подполья писатель в	1
столь безупречно что храмы	1
а ивановой от i	1
в своей переписке сравнивал	1
предмету изображения и по	1
являются как бы синтезом	1
мышкина достоевский перестает заботиться	1
обрисовался данный характер очень	1
уже говорили о принципе	1
гибели эту самую красоту	1
наследства х годов xix	1
когда разговор пойдет о	1
столь внезапно мы столь	1
ставрогина пришел к выводу	1
диалога как и любой	1
явки с повинной мы	1
отличает трагику достоевского от	1
шиллеровской поэтической аллегории resignation	1
таким образом парафраза достоевского	1
мире достоевского не менее	1
на улице соотечественников или	1
типизации и эти его	1
перед совестью это мещанская	1
кихота сервантеса достоевский признавал	1
ясной и вот отличительный	1
льщею частью не вымышленных	1
это действительно победа французской	1
с ней идеологическая доминанта	1
жить без народа невозможно	1
л вып гроссман л	1
катерина отразились в схеме	1
спорах с белинским критик	1
многочисленные изменения сюжета порою	1
александровича в году младший	1
и его обитатели с	1
др однако эти ассоциации	1
которая учит детей нелепому	1
символический фон он насыщает	1
до сих пор еще	1
неизданные материалы с см	1
включает в свой кругозор	1
знаменующие конечную гибель и	1
года он еще не	1
превращая его в субъект	1
наблюдаем трагедию отпадения от	1
современном ему русском быту	1
о необходимости их постоянного	1
с беспредельным сенсуализмом несколько	1
эта фабула ни вызванный	1
на земле миллениум который	1
голову более того эта	1
о собственных ошибках и	1
текста была завершена в	1
а гальцева главная тема	1
направленностью метода в самом	1
стыд бессознательное признание в	1
обладала средневековая литература и	1
персонаж не может быть	1
якобсона представляется упростительской концепцией	1
или торможения сцен в	1
направлен на вовлечение читателя	1
в виноградов называл манеру	1
учит детей нелепому танцу	1
и абсолютная необходимость юмора	1
идиот устами своих героев	1
и эпилептическим припадком характер	1
это это специфическое воздействие	1
но смысл таков можно	1
о романах достоевского как	1
стремление достоевского проникнуть вглубь	1
ли не главного виновника	1
и потому антигуманного разума	1
связанном с начальным периодом	1
достоевский соединяет эпилепсию которой	1
этот принцип отменяется приводит	1
некоторые соображения м м	1
тоже реализуют метафорическое выражение	1
ну что с эдаким	1
его окончательного телесно-бытового воплощения	1
играют большую роль в	1
объясняется и присутствие библейского	1
