белуджской сказке героиня говорит	1
с одной стороны начинается	1
мифы мы находим в	1
жизни и географические особенности	1
дворец неприступен и усмотрели	1
она живет в воде	1
то египтолог может дать	1
дань в виде девушек	1
перед началом рыболовного сезона	1
кюстер в народной вере	1
и не замечали как	1
повлиять на плодородие страны.<неи	1
красотой перед нереидами и	1
между боем с чудовищем	1
дхобичанд минаев сходно эта	1
в царство солнца.<неи связь	1
в воздухе в многообразных	1
озеро попытка поглотить пришельца	1
они выдают замуж за	1
видишь почему виро величается	1
однажды случилось что не	1
еще в архаическую эпоху	1
елена золотая коса непокрытая	1
не доносит так в	1
происходит и бой геракл	1
красная краса черная коса	1
уходя в дальний путь	1
душой имеют и эринии	1
с божеством смерти умерший	1
а продолжали существовать независимо	1
на первый план богов	1
дорога в иное царство	1
мамонт пойдет там реки	1
магические силы и здоровье	1
содержит попытку внести пропорцию	1
эротическая окраска представлений о	1
сказке но и в	1
он подумал кто тут	1
и когти змея и	1
голод на первых порах	1
когда нам сообщают что	1
проблемы здесь нас интересуют	1
вздумать ни взгадать ни	1
чего он вступает в	1
кит змей бочка всегда	1
и рощи зеленые и	1
перенесение имело ряд последствий	1
как поглотителя солнца здесь	1
этим объясняются львы и	1
змеей она отомстила тем	1
пасти его были зубы	1
обычные самые распространенные животные	1
или иначе представляется небо	1
исполнена проклятиями по адресу	1
эти представления связанные с	1
говорится не столько о	1
здесь отодвинута на задний	1
ее гидрой горгоной медузой	1
рассказывается о молодом человеке	1
земледельческой концепции его эту	1
всегда золотые отсюда и	1
чудище и едет к	1
так сильна что ударяя	1
исходит даже от ее	1
сходство при этом нет	1
жертвоприношение нужно и с	1
так эскимосский торнарсук похищающий	1
и извергать может и	1
устанавливает кюстер он прежде	1
народов эта древнейшая мотивировка	1
весь сад так как	1
египте своего полного развития	1
главным змееборцем книги мертвых	1
ограждение израильтян от змеев	1
андромеде здесь персей попадает	1
китае и в меньшей	1
мотив запретного ларчика.<неи первоначально	1
на высоких теремах белокаменных	1
на помощь ему является	1
в бегство при приближении	1
в муравья через стену	1
совсем легко в противоположность	1
плоть и оставляет только	1
своим хозяином и она-то	1
поднятыми вода в озере	1
облако как бы с	1
представление имеется в мифе	1
как по сказочному канону	1
поставить также вопрос о	1
была пещера змея змея	1
придан моральный оттенок пожиранию	1
здесь уже ясно все	1
рыб их делается все	1
страны и что от	1
тураев например в истории	1
последовательностью ни единообразием но	1
встречаются не так часто	1
ним никак не могла".<неи	1
проглатывания и изрыгания то	1
он скакал с пылью	1
двум сторонам дороги она	1
похитил умерший обычно в	1
у народов не достигших	1
амуре и психее позднее	1
а потом и ведьма	1
особыми сильно пахучими травами	1
души пока не будут	1
также в колодцах морской	1
враги главный змееборец ра	1
во дворце живет отец	1
установить животное т е	1
с новыми интересами и	1
метрах от источника алисы	1
любовь там стремление похитителя	1
горы почему именно на	1
yin yang кадушки для	1
змеи не похожи на	1
о крокодил живущий на	1
мифологии между тем одно	1
оно удаляется когда небо	1
а во-вторых они особенно	1
змея от змея.<неи гибель	1
создавать богов с появлением	1
сказке умилостивленный человеческой жертвой	1
что видно по энеиде	1
просто приводит в движение	1
сам он принимают огненную	1
горный хрусталь или также	1
наолакоа там постоянно шел	1
мы можем обнаружить что	1
методологическое заключение явление должно	1
приукрашены и носят характер	1
охранителя входа в тридесятое	1
сторожевая роль змея здесь	1
дымом принимались за чудовища	1
она роняет перо это	1
его весьма древним но	1
он предупреждает чтобы в	1
у народов знающих примитивное	1
из этого пруда будто	1
стоящего на месте в	1
чуждо ему нужны солнце	1
древнейшие представления о благом	1
островах содружества полагают что	1
голова и хвостом он	1
другими словами одна из	1
религиозной окраски сказка.<неи очень	1
случае не яга следует	1
он только водяное существо.<неи	1
же сохраняют зооморфность на	1
превратились в змей-драконов 'по	1
остров на котором обитает	1
этот обряд и соответствующие	1
он также мраморный или	1
как и христианская религия	1
отдельности все же можно	1
борьбы с ним? внешне	1
совершенно отсутствует эротический момент	1
сарай горит закричал во	1
когда змей побеждается тем	1
жаловаться что изучение и	1
сердца означало смерть поднимание	1
заслонила более древнюю культовую	1
с этой точки зрения	1
деформируются переосмысливаются или трактуются	1
происходит оттого что три	1
змея в данном случае	1
русской сказке она функционально	1
духи нерожденных детей или	1
обнаруживает в том что	1
же эта связь не	1
долганском мифе говорится встав	1
нам индра он имеющий	1
не стал красавица была	1
непосредственно ниоткуда не видно	1
они приносят болезнь муки	1
представляющих душу в более	1
обряд насильственной выдачи девушки	1
здесь сон имеет совсем	1
если технически беспомощному охотнику	1
и он-то и поражается	1
в нечто ужасное и	1
количество воды что создает	1
острова дворцы явно идут	1
здесь функции шамана а	1
принести такую еду оттуда	1
подробные материалы см у	1
другое животное.<неи когда нам	1
землей но так как	1
самого от апопа и	1
и до восхода вся	1
чем объяснить эту много-головость?	1
выраженная в образе быстрота	1
при всех его отвратительных	1
не подтверждается материалами медное	1
одной стороны начинается разложение	1
больше и они опрокидывают	1
начиная от более древних	1
проходит сквозь змея в	1
потому что он поглотитель	1
всему мотиву придан моральный	1
в классической греции или	1
превращается в него и	1
животного то скотоводу управляющему	1
царей и блаженные покойники	1
четвертая всегда остается в	1
птиц собирались вокруг меня	1
связана с появлением собственности	1
дворец выстроен а во	1
время закрывается и открывается	1
всему миру boas неи	1
и оставляли ее на	1
понять этот мотив необходимо	1
спенсер и гиллен есть	1
он колени опускает опускается	1
и давшему очень яркий	1
пополам и с визгом	1
на героя перед сражением	1
обманул посейдона посейдон выстроил	1
и усаживают на берегу	1
в дворце из прозрачных	1
какое-нибудь другое животное.<неи когда	1
такого народа как ваджагга	1
жизненные интересы народа его	1
он перелезает в других	1
как брак с божеством	1
неи но ничего специфически	1
бы заняться историей представлений	1
наmblу здесь уже ясно	1
которых речь будет ниже	1
двери с зубами и	1
так за жену себе	1
рождение от рыбы и	1
связав ее в образе	1
благо людям но при	1
имеем перенесение змея в	1
т е индра ниспосылает	1
реки здесь девушка приносилась	1
того или другого человека	1
по наблюдениям н п	1
водой одного озера так	1
который обрастает живой плотью	1
параллели приводимые ими относятся	1
мире не только поразительно	1
он погибнет от его	1
животных он имеет много	1
солнца апоп и он-то	1
там где особенно развиты	1
и землю летит по	1
возникших из моих членов	1
в египте неииз всех	1
то у нас на	1
могут служить египет вавилон	1
пониманию того откуда идет	1
продолжает свое производство там	1
чаяний и желаний овладевает	1
и увидел светившуюся без	1
может развиться уже лишенная	1
прикладывали змеев если они	1
рванул так сильно что	1
тлингит выдре приписывается особая	1
по своей воле такое	1
змееборства у первобытных в	1
так просто ответить но	1
виде острова дворцы явно	1
перемена вполне объяснима если	1
соответствующие обряды могли производиться	1
змей в доклассовом обществе	1
водой дающими вечную юность	1
ожидает умершего если он	1
показывают такое поразительное сходство	1
больше относится к пути	1
царевича это мы имеем	1
есть царевна 'подобно этому	1
из которых как мы	1
клевать меня но в	1
пришел тебя известь хочешь	1
по голове на обоих	1
птичьего языка так и	1
делается все больше и	1
появлением пространственных представлений с	1
враг хтонический змей связан	1
пасть самого героя мне	1
умерших т е тех	1
то дети этим самым	1
очередь царя отправить меня	1
животное то это животное	1
также должна быть объяснена	1
исида и другие богини	1
здешний охотник населяет его	1
водяной но перенесенный в	1
вынужден изрыгнуть все что	1
сказка архаичнее этих мифов	1
в сказке мы встречались	1
быть проглоченным было первым	1
с другой стороны оно	1
объяснение может быть дано	1
отсутствует эротический момент который	1
хотя египетские представления не	1
какой-нибудь золотой атрибут она	1
внешнего единства в картине	1
это приводит нас к	1
интересна деталь что индра	1
населено животными и что	1
тридесятом царстве все же	1
знает что он погибнет	1
эта связь также не	1
жизнью и смертью над	1
солнцевой сестре в то	1
а приносящий предмет обеспечивающий	1
становится существом небесным солнечным	1
вида.<неи когда геракл по	1
вошли они застонал столб	1
над рекой и всем	1
аф вар в сказке	1
огромная работа сколько материалов	1
края так и поздние	1
посылающему урожай переносятся на	1
было расширено и видоизменено	1
похитителем царевны является животное	1
и новые формы сосуществуя	1
духи умерших женщин подкрадываются	1
когда небо омрачено на	1
на берегах этой страны	1
в чужую землю этим	1
сзади гиппопотам в середине	1
ли под этим вращением	1
этого предмета и до	1
перешел в европу это	1
там нет там обычно	1
узнать издали они пытаются	1
уже поглотил всю воду	1
и унесение человека в	1
очень интересный случай который	1
связь с идеями плодородия	1
той лишь разницей что	1
много лет пролетело и	1
неиумершим существовавшим в силу	1
этого слова.<неи пасть и	1
лестницы засверкали все кровельки	1
фантастический вид она живет	1
теремах белокаменных ложнорусский стиль	1
пандоре запретный ларчик содержит	1
рассматриваются как воплощение духа	1
зелениным в его табу	1
было идолопоклонническим каждый месяц	1
матери завернула меня в	1
концепция развитого земледельческого народа	1
он вступает в обетованное	1
представление конечно также имеет	1
стоит и на челе	1
змей очень сложное и	1
объяснению его значение многообразно	1
предел святой т е	1
и при помощи меча.<неи	1
змей дающий силу и	1
не истощался там души	1
так как тридесятое царство	1
подобны бровям человека они	1
и т д в	1
царства мертвых характерная концепция	1
совершенно ясна в родовом	1
что такие представления таят	1
ясно вытекает что кербер	1
сказки с мифом следует	1
от источника алисы говорят	1
живущий на западе потому	1
фантастику мы видим в	1
тридесятого царства при стремлении	1
трудные вопросы в частности	1
убивает его чтобы овладеть	1
далее текущие воды теряющиеся	1
черта то царство иногда	1
будем приводить материалов доказывающих	1
бы черпают воду для	1
они подземным ходом вдруг	1
охраны та же опасность	1
за исключением змея дающего	1
полную форму змея за	1
того этот случай отличается	1
на смерть падчерицу требует	1
царства есть внутрисказочное образование	1
имеющих совершенно единообразное представление	1
лишь только вошли они	1
и черепа девушек а	1
при захоронении при этом	1
есть только змей враг	1
этой стороне вроде солнца	1
с развитием религии животное	1
говорит ящерица представляет смерть	1
двери на горы почему	1
что выплюнула такое количество	1
то время как вся	1
здесь можно бы заняться	1
и этим мотивируется бой.<неи	1
в русской сказке змей	1
особо похотливыми и с	1
природа змея как поглотителя	1
раздвинетца тогда отворяются и	1
сторожевой ролью его филологи-классики	1
замкнул его рот и	1
людей смотря по тому	1
материалах мы этой детали	1
или хрустальный этот дворец	1
служит защитой другими словами	1
и наконец четвертое последствие	1
преобладает змей водяной но	1
змей имеет связь с	1
попал в подземное царство	1
в микронезии о-ва гилберта	1
индии совершенно утеряна сторожевая	1
этого сидел задумавшись вдруг	1
в первую комнату и	1
уносить украдкой людей и	1
уже нет самого обряда	1
матушка настасья золотая коса	1
жители на следующий день	1
не людей он поглощает	1
имеющую такую жизненную важность	1
боги смерти похоронная процессия	1
и сине море широкое	1
змею он имеет вид	1
найденные в гробницах изображают	1
и его повергает самый	1
на западе потому что	1
кишат то было змеиное	1
обручение но обручается герой	1
живущие быстро пускаются в	1
полным правом назвать это	1
приветливо виляет хвостом пришельцам	1
требует в жертву ребенка	1
у народов живущих замкнуто	1
момента мы проследим при	1
формой такого волшебного средства	1
царевна представлена воинственной девой	1
почерпнула из народных представлений	1
волшебного средства добываемого в	1
освобождает гесиону.<неи в сказании	1
случаях когда упоминается о	1
дитериха он земная глубина	1
в нем иногда имеются	1
в тьму кромешную я	1
свет даже когда не	1
такой величайший шум как	1
не оказалась девственницей он	1
охотился и здесь с	1
царства.<неи золотая окраска предметов	1
бы колосился хлеб.<неи зато	1
душу из тела и	1
хембли hambly неи как	1
кадушки yin yang кадушки	1
в грудь запустил и	1
видов смерти с этой	1
уже видели как впоследствии	1
при приближении духов так	1
уверены что духи умерших	1
задерживает дождь но он	1
происходит по воде или	1
поглощения змеем как блага	1
мауи здесь мауи отправляется	1
жар-птица она роняет перо	1
всегда тесно связан с	1
человека новой культуры.<неи мы	1
мертвецы встречают нового пришельца	1
конем ведьма стала просить	1
вытекает достаточно полно но	1
пышными дворцами из золота	1
если они их не	1
выходя из рыбы рождается	1
и может ее поглотить	1
об искусниках там мы	1
из которых вышло все	1
возникает засуха за воротами	1
девушек отправляется их навестить	1
минимальную роль.<неи такое же	1
так позднее и по	1
скотоводу управляющему животными по	1
почтенную гору когда доехал	1
здесь как и в	1
по другим на запад	1
что змей проглатывает или	1
апопа и других змей	1
сам змей.<неи как на	1
уносит ее в царство	1
значит что египет есть	1
не может быть уничтожен	1
штернберга состоят в том	1
где встречаются небо и	1
предыдущие сделаны серебряным и	1
он в царство львиное	1
на растерзание пожирателю мертвых	1
с первобытным мышлением или	1
и змей-поглотитель водяной змей	1
индии ни у якутов	1
камнями и лишена жизни	1
в северной америке здесь	1
дает отражение этих интересов.<неи	1
видим и в мифах	1
царства стали своего рода	1
ведической индии ни у	1
змей живет и берлогах.<неи	1
хозяйственную орбиту моря движения	1
ведьма полезла только ступила	1
население острова речь идет	1
если наклониться над водой	1
родина русской сказки и	1
сказка.<неи очень ясно и	1
по гесиоду он приветливо	1
перед собой гору которая	1
его отрицать и отклонять	1
таинственного чертога с образом	1
здесь слились в одно	1
нет в ней нет	1
исключительный враг и супостат	1
избавление если дочь царя	1
них похититель еще не	1
общие им всем змея	1
