лишенная религиозной основы такую	1
не сказано но сквозит	1
живых процесс образования представления	1
в них не утеряна	1
с чего оно повелось	1
совершенно одолевшие землю худяков	1
на задний план на	1
в полном соответствии с	1
вар.).<неи что между этими	1
маленькая птичка тивакавака смеется	1
помощи другого змея здесь	1
водяной стихии напомню о	1
обе стороны расходятся лишь	1
забыта а сторожевая его	1
интересов.<неи эти соображения показывают	1
языке и можно предполагать	1
связь с урожаем здесь	1
змея народ.<неи все эти	1
великое множество свеч аф	1
соображения высказанные здесь помогут	1
от него слух неи	1
этапы поглотителя стоящего на	1
не хватает еще одного	1
по синю морю плывет	1
островов восточной индии угрожала	1
мотива в сказке мотив	1
наконец пристал в государство	1
случайной та же периодичность	1
коротко ли приезжает он	1
есть душа тела которая	1
шествие вокруг алтаря аналогично	1
и андромеды древнее сказки	1
народов не достигших государственности	1
не будем приводить материалов	1
и дворцов и садов	1
так чудно и светло	1
случаев имеются три черты	1
религиозные представления могут дать	1
эры.<неи ранний благой змей-поглотитель	1
принес их под такие	1
полночь как будто облака	1
это представление как кажется	1
для дитериха он земная	1
и анализ его облика	1
давно потеряли свой животный	1
тело посвящаемого и что	1
подводят нас к сказке	1
обычно они все три	1
отрублены от тебя".<неи еще	1
он отражает собой обряд	1
недугов очень ранней формой	1
не останавливает представление рыбы	1
из преисподней я привожу	1
то и другое происходит	1
все попытки шамана спасти	1
эти представления становятся реакционными	1
речь идет о мальдивских	1
огонь неи нож торчит	1
волос мертвеца который родственники	1
показывает что изменилось отношение	1
поразительно похож на большой	1
сказать хотя такая замена	1
ангелы не знающие милосердия	1
привожу только наиболее интересующие	1
признак начавшегося сочувствия к	1
пример зародышевого состояния мифа	1
же мы можем наблюдать	1
вступает в обетованное царство.<неи	1
передний план выдвинут победивший	1
змей живет на дне	1
здесь обряду самый процесс	1
их под такие крутые	1
постоянных водоемах и представляет	1
в жены зеленин в	1
убитого медведя говорит он	1
водоемах и проглатывающим прохожих	1
великий страх который народ	1
традиции борьбы с поглотителями	1
сказочный змей?<неи чтобы ответить	1
выветриваются имена богов изменяются	1
в развитых религиях подобных	1
все окружающее змея и	1
ряд в свои волосы	1
надо сказать что такие	1
реакционными но тут же	1
с царевной то он	1
от жажды белуджские сказки	1
архаичны чем сказка похититель-животное	1
отрезание языков змея она	1
с пещерами потому что	1
африканских скотоводов они есть	1
она распространена в полинезии	1
и первобытной формации мифа.<неи	1
птица действительно прилетает из	1
так у банту человек	1
из масла кокосового ореха	1
развития змея.<неи быть проглоченным	1
велика чтобы быть случайной	1
и фигурируют в сборниках	1
воды айну рассказывают что	1
оказывается что змей есть	1
на гнездо ексюкю бывшее	1
побеждается тем что в	1
к матери завернула меня	1
мотив перешел в европу	1
лет они выдают замуж	1
там где земледелие зависит	1
что распростершаяся змея удерживала	1
которые очень редки это	1
яблоки живую и мертвую	1
восемь ног и это	1
обеспечить разлив и получить	1
уже совершенно ясна в	1
ни взойти ни взъехать	1
сколько материалов таится еще	1
голове неи его ухо	1
отражает собой обряд насильственной	1
отсутствует негры ваджагга рассказывают	1
все наше внимание пока	1
подтверждая наши наблюдения такой	1
случаев в том что	1
же представление имеется в	1
через некоторое время он	1
через стену он иногда	1
ниоткуда не видно русская	1
якутов фигура змея очень	1
это происходит потому что	1
сам рожденный от змея	1
неи этот случай интересен	1
рекой и всем что	1
водяной связь его с	1
субститут поглощения однако и	1
также водяное существо.<неи нам	1
сверхъестественная сила между прочим	1
путь пытались задобрить муказу	1
богини маит или пера	1
исключительно водяное земное и	1
сказке прямо не сказано	1
что дом солнца находится	1
на восток и проходит	1
момент присоединился позже malten	1
змеем есть связь от	1
родился на морском берегу	1
или первобытным народам изучение	1
эта связь не случайна	1
изучавший медвежий праздник гиляков	1
это жертвоприношение мотивируется просто	1
не живущих исключительно лесной	1
как штольни рудников существа	1
и якорь бросил никаких	1
очевидно еще яснее солнечный	1
с переходом к регулярному	1
ложу и шествие вокруг	1
передвигаться аф часто он	1
а тяжелый приводит к	1
круга причитающих родственников смерть	1
дворце из прозрачных камней	1
змеи находилось на короне	1
змей царит в царстве	1
можно найти чрезвычайно много	1
вод небесных он представляется	1
сказочном каноне уже имеется	1
друг на друга но	1
болезни сохранилось изображение этих	1
совсем другое а именно	1
совершенно ясно что пасть	1
с ним? внешне со	1
коротко выражает эту мысль	1
не прекращается еда если	1
по морэ оно встречается	1
в полинезии и меланезии	1
отца этой девушки обрядить	1
там вдали как жар	1
часто является умерший же	1
после того как ра	1
более вероятным чем объяснение	1
подошел к крутой скале	1
большой дом он иногда	1
истекают быстрые воды его	1
с земли на горизонт	1
здесь девушка приносилась в	1
в долинах нила ганга	1
бубнами и палкой вот	1
огненность огненное озеро попытка	1
виляет хвостом пришельцам но	1
есть одно и то	1
она функционально не отражена	1
у индейцев муиска змею	1
что египет есть родина	1
взять с собой наши	1
дворец тот золотой и	1
высокой ступени культуры знающих	1
самый бой никогда не	1
горах стук стучит и	1
так как боги плодородия	1
этом будет сказано несколько	1
свет и думая что	1
нет прилива и отлива	1
якуты неив индии совершенно	1
горы и ее мера	1
выше когда мы рассматривали	1
ничего не доказывают все	1
а изрыгают отбросы сами	1
чрезвычайно богата и интересна	1
царство солнца.<неи связь змея	1
оборвались или небо треснуло	1
а упоминается наряду с	1
жители замечали этот корабль	1
рек реки текут только	1
тогда ясно почему змею	1
небесным солнечным и огненным	1
неи кербер неине случайно	1
настасья золотая коса у	1
и мн др типичность	1
египет есть родина русской	1
если я перевешу так	1
и бросали ее в	1
его многоголовости подобно тому	1
животных сменяется просто обилием	1
здесь элементы встречаются в	1
между ними нельзя провести	1
на колеснице плутон бог	1
настолько укрепилась в уме	1
в очень полной форме	1
здесь ночь а утром	1
такой случай мы имеем	1
солнца красавицу стоявшую на	1
голову он насквозь разрезал	1
там где еще не	1
вышли они на широкое	1
является змей то и	1
чем к царству но	1
другого процесса от процесса	1
песок весь сплошь из	1
цветами натирают благовониями и	1
другая более поздняя чисто	1
греческой мифологии любовниц из	1
которыми по-видимому особой разницы	1
к змею он имеет	1
что кербер жрет падаль	1
сказках где девушка гуляющая	1
воле такое стремление совершенно	1
африке поклоняются змею живущему	1
водяное земное и небесное	1
чтобы они не имели	1
защитником и ничто никогда	1
хотели насытить богов чтобы	1
зависимости от окружающей природы	1
видели что народы приписывают	1
сказке<неи локальность неицарство в	1
это перенесение связано с	1
мириады мух жужжали вокруг	1
греческое явление и не	1
этому небывалому государству еще	1
здесь важно отметить что	1
вполне выработалась кербер отличается	1
молодильных яблоках.<неи до сих	1
довольно долгое время перелетел	1
разные черви совершенно одолевшие	1
мы видели что фигура	1
заменяется положением в ларец	1
там где предел святой	1
же было хорошо известно	1
индре мощью и силой	1
тридесятое царство есть последний	1
принадлежат к самым важным	1
он не будет подкован	1
дома уже знакомых нам	1
забыт змей дающий силу	1
а того государства больше	1
если этот рожденный от	1
черта что утверждение все	1
подымался и от зуб	1
есть художественно-преувеличенное внесение пропорции	1
с одной стороны он	1
могло быть религии солнца	1
разводящие сады эта форма	1
греции он отражает собой	1
успех в рыбной ловле	1
такие тексты где положение	1
послал страшное наводнение и	1
только он колени опускает	1
я отнял у него	1
сказке она функционально не	1
как бы он многими	1
именно здесь кроется разгадка	1
него три собачьих головы	1
выражаясь по-сказочному с царем	1
у островитян нуку-хивы и	1
берегу в долганской сказке	1
окраску река становится границей	1
tangou или kenit днем	1
получает от месяца некий	1
общественного развития это представление	1
здох таким образом и	1
возлюбленную или возлюбленного среди	1
случай поздний по отношению	1
воспринимается как жало и	1
меня и дала мне	1
змея.<неи быть проглоченным было	1
социальную значимость становится сказкой	1
результату генстически змей связан	1
ее в реку и	1
эту пещеру мало думая	1
от слепоты старости болезней	1
копьем золотым если упомянуты	1
или женщин умерших в	1
том что иной мир	1
божество или иное существо	1
представление о смерти и	1
безличное бледное божество самое	1
ни единообразием но все	1
убиения огненность огненное озеро	1
золоторогий олень золотохвостый олень	1
большой змеей она отомстила	1
вдруг на высокую почтенную	1
задержку вод и этим	1
и девушек которых он	1
жалом и т д	1
также двери с зубами	1
отделил обернувшихся вокруг меня	1
не только свое социальное	1
штернберг назвал это явление	1
железном серебряном и золотом	1
ними нельзя провести точной	1
а именно смерть как	1
вырезал язык из его	1
зарю ты не имел	1
женщин умерших в родах	1
делают вундт панцер и	1
замена впрыгивания в пасть	1
сне в виде старика	1
от месяца некий ларчик	1
не утеряна первоначальная связь	1
именно как страж царства	1
и запас кокосовых орехов	1
по наружности и функционально	1
по мере того как	1
особо развивать или доказывать	1
не попасть в литературу	1
и можно предполагать ее	1
в существо охраняющее небесное	1
мы возьмем все водоемы	1
чешет их золотым гребнем	1
погоде этот дворец можно	1
и лишая их сознания	1
ясно все окончательно можно	1
такие представления таят в	1
формой религии ведическая индия	1
на место воздержания".<неи это	1
объясняет другой постоянной особенности	1
и в религиозных представлениях	1
этом обряд иногда долго	1
мы наблюдали коня есть	1
островах палау поверье о	1
яркие формы его дает	1
frazer мертвые тянут за	1
рекой огненной огненным становится	1
в них похититель еще	1
других другими словами одна	1
связан с комическим возвеличением	1
что отношение между мифом	1
герой возвращается в лодке	1
как бы в том	1
наблюдать совершенно ясные общие	1
были осуждены на судилище	1
змея? ведь почему-то в	1
мертвых только при развитии	1
radermacher таблички найденные в	1
обрядами также широко засвидетельствована	1
одновременно в греции еще	1
вздутыми глазами с бубнами	1
туда же куда восходит	1
сопротивление отсутствует негры ваджагга	1
берегах этой страны образует	1
мир людей этим можно	1
врагов солнца но мы	1
представлений о пути умершего	1
даже представление что легкий	1
посылая его к своему	1
умерших женщин подкрадываются к	1
на свою посмертную лошадь	1
добыть ветку с золотой	1
это мы уже видели	1
ежедневно на своем пути	1
отец как предок и	1
две сменяющие друг друга	1
раздавленным то же откусывание	1
чудовище фрэзер неи в	1
частей деталь с вырезыванием	1
царства царевне всегда присущ	1
у такого народа как	1
его не доносит так	1
приведем текст в афанасьевском	1
нечто вроде маленькой энциклопедии	1
эти случаи вплотную подводят	1
на том свете люди	1
огненным становится и сам	1
ее имя теперь после	1
рот и его губы	1
боги плодородия считались божествами	1
долганский фольклор у ама-зулу	1
о своем рождении я	1
царь за которым вода	1
они играют большую роль	1
уже говорили нам необходимо	1
на землю и запас	1
герой гуляет по лесу	1
известно что он жил	1
а именно здесь кроется	1
их солнечности в некоторых	1
мертвых держится в греции	1
бочка всегда связаны с	1
земную глубь но и	1
религия поздняя жреческая отражающая	1
государство долго ли коротко	1
фрэзер и штернберг довольно	1
его пути в книге	1
местах это чудовище зовется	1
вместе с тем привлекательность	1
неи в полном соответствии	1
представление что убиение змея	1
драконов дает воду волшебный	1
кости неи я ежедневно	1
достигших более высокой ступени	1
приехали глядит стеклянная гора	1
встречает мамонта где мамонт	1
но и эта связь	1
сравнительно поздно и вносится	1
формы производства материальной жизни	1
отдельных случаев имеются три	1
черное большое облако как	1
также не подтверждается материалами	1
лугах и садах которые	1
и эти два представления	1
локтей ее длины покрыты	1
здесь рыба чаще всего	1
свете сравнительных материалов отличается	1
урожая этих условий нет	1
предполагать ее известной нам	1
объект похищения в приведенных	1
как он охотился и	1
жертвы желаемые и указанные	1
змея причем в очень	1
красавицы становится ясным то	1
он иногда просто совпадает	1
соответствующими им формами социальной	1
священных мест осириса бусириса	1
и уничтожает его после	1
была власть над волей	1
и здесь с той	1
злого божества и предвестник	1
связаны с дубиной которая	1
расходятся лишь только вошли	1
пересказе в том царстве	1
что духи речного залива	1
живущим в форме огненных	1
невозможно нужно нарисовать несколько	1
где еще не развилась	1
в греции с ее	1
своей ладье канат барки	1
многоголовость змея многократность пасти	1
даже боялись проходить змей	1
заключить что небесная окраска	1
установлению тураева еще в	1
драконом но как устанавливает	1
и в ином мире	1
жертвы krickeberg неи в	1
до девяти по аполлодору	1
того самого змея которого	1
умереть и живой человек	1
человеком и богом должно	1
одну из душ умершего	1
защищал его самого от	1
индивида приписывается избранничеству так	1
ближе мы можем обнаружить	1
эту жертву не приносить	1
смерть от молнии случайная	1
жизнь племени майя говорит	1
необходимости утверждать что одно	1
в силу объективизации души	1
фрэзера можно найти чрезвычайно	1
драконов или быков таким	1
находится на западе над	1
сказок стеклянную гору немецких	1
убил вритру и выпустил	1
что змей есть защитник	1
наиболее тесное сходство по	1
отделено от отцовского дома	1
мифологии считают это представление	1
спине и на голове	1
iv на том свете	1
божество избирает себе возлюбленную	1
герой никогда не поддается	1
при обряде выход из	1
которого означает смерть или	1
пещеры считались входом в	1
феноменальных лентяев гримм такую	1
небесной реки ни огненного	1
наверх на небо черное	1
индия классовое государство и	1
его встречает девица прекрасная	1
шум как будто его	1
красивых женщин каких себе	1
должен изучаться не как	1
что формы локализации иного	1
и м тронский в	1
приблизился так скоро как	1
прилив река или вернее	1
и семейных отношений а	1
неи с другой стороны	1
аф вот и сине	1
змею на челе бога	1
кербер отличается от сказочного	1
