долго ли коротко ли	5
о персее и андромеде	3
приходит к заключению что	3
с представлениями о смерти	3
в то время как	3
мы имеем и в	3
в тех случаях когда	3
в нем обитает змей	2
такое количество воды что	2
связь с представлениями о	2
время подскакал иван-царевич к	2
такой же как у	2
мы можем установить что	2
оконце солнцева сестрица отворила	2
развито в ведической индии	2
солнце солнце отвори оконце	2
я глава книги мертвых	2
вскочил в него вместе	2
в то самое время	2
за тридевять земель в	2
солнцева сестрица отворила окно	2
связей с представлениями о	2
и в сказке герой	2
у якутов т е	2
могу погибнуть только через	2
о том что в	2
случай мы имеем в	2
происходит оно только угрожает	2
на более ранних ступенях	2
мы уже знаем что	2
что эти три царства	2
отвори оконце солнцева сестрица	2
и царевич вскочил в	2
рожденный от змея убивает	2
подскакал иван-царевич к теремам	2
я могу погибнуть только	2
иван-царевич к теремам солнцевой	2
закричал солнце солнце отвори	2
убивает змея что он	2
все больше и больше	2
чтобы получить власть над	2
самое время подскакал иван-царевич	2
солнце отвори оконце солнцева	2
солнцевой сестрицы и закричал	2
же как у нас	2
деревья и эти деревья	2
гибель змея от змея	2
до сих пор мы	2
входом в иное царство	2
царевич вскочил в него	2
случаи гибели змея от	2
эти материалы показывают что	2
с другой стороны он	2
не происходит оно только	2
то самое время подскакал	2
окно и царевич вскочил	2
иной мир не только	2
рожденный от змея т	2
якутов т е у	2
змеи охраняющие вход во	2
от змея т е	2
к теремам солнцевой сестрицы	2
книге о том что	2
том что в ином	2
в этом случае интересно	2
теремам солнцевой сестрицы и	2
в него вместе с	2
уже не происходит оно	2
т е у народа	2
поехал за тридевять земель	2
там свет такой же	2
или одну из душ	2
к утверждению я могу	2
коня и поехал за	2
к солнцевой сестре в	2
показывают что водяной змей	2
отворила окно и царевич	2
сестрица отворила окно и	2
что в ином мире	2
свет такой же как	2
сестрицы и закричал солнце	2
неи в этом случае	2
утверждению я могу погибнуть	2
тянут за собой живых	2
в мифе о мауи	2
него вместе с конем	2
даже в тех случаях	2
и закричал солнце солнце	2
но мы уже знаем	2
сводится к утверждению я	2
львы и змеи охраняющие	2
отсюда же идут и	2
в русской сказке она	2
и змеи охраняющие вход	2
душу или одну из	2
медное серебряное и золотое	2
в которое попадает герой	2
и там свет такой	2
и поехал за тридевять	2
ее к себе в	2
что душу похитил умерший	2
развития по представлению обитателей	1
в ней нет в	1
посвящая ему девственниц призванных	1
охранителя границ а именно	1
в греции еще очень	1
тот свет уже совершенно	1
хроникеров живьем были брошены	1
с ним не связан	1
сказке о жар-птице сидит	1
свою посмертную лошадь оденься	1
или наоборот выхаркивает такое	1
идолопоклонническим каждый месяц к	1
в нем кто-то царствует	1
во-первых меняется объект поглощения	1
описывается как огромный угорь	1
змея бог.<неи здесь интересна	1
эта неприступность однако не	1
новая отправка то два	1
представления рассмотренные нами выше	1
и пастушеской африке особенно	1
комбинируются друг с другом	1
хипе-нуи-те-по мауи хочет ее	1
змеи кишат то было	1
только поздними когда змей-пожиратель	1
третьего видит чудесный дворец	1
его матушка настасья золотая	1
жизни народа они играют	1
в сапогах говорит герою	1
было зажжено великое множество	1
в тридесятое государство долго	1
и он убивается как	1
ином мире тураев и	1
мифологии солнце как око	1
граде китеже вар неи	1
островом двойника не двойника	1
родился царь индра а	1
должны быть случаи когда	1
этот мотив перешел в	1
всегда уже только враг	1
вид которого ужасал глядевшего	1
огненным становится и озеро	1
boas неи в полном	1
змей подробные материалы см	1
это явление избранничеством божество	1
бы в том покое	1
к другому конечному пункту	1
земле".<неи здесь сохранено даже	1
сторожевая роль небесного змея	1
пучке волос мертвеца который	1
с золотыми яичками интересен	1
подробностей о государстве мы	1
которое на берегах этой	1
ясно однако одно сказка	1
строя и его экономическими	1
только через себя тем	1
как письменный памятник но	1
даст право утверждать что	1
сказке царевны или вообще	1
сказку сохранившую взвешивание душ	1
источник как драгоценное хранилище	1
у хембли hambly неи	1
не пускает чтобы умиротворить	1
золотой оградой в сказке	1
море широкое и раздольное	1
в эту солнечную страну	1
тронский и действительно миф	1
в страшное существо но	1
в египте или в	1
в землю т е	1
далеко за горизонтом и	1
гидрой горгоной медузой пифоном	1
видим с пером жар-птицы	1
герой получает от месяца	1
в египте в китае	1
озеро как в сказании	1
наши кадушки то он	1
его в свое время	1
вар неи независимо от	1
считаться убитым вот почему	1
царство есть вместе с	1
наличия и городов и	1
пусть принесут ее к	1
все царства и земли	1
красно-пламенные огни вот какая	1
кроется источник представления о	1
зеленин в египте каждый	1
что сказочный иван потому	1
сердце на своем месте	1
во-первых потому что подобные	1
не смертельно то дети	1
на челе его земного	1
другой стороны герой приносящий	1
половой голод на первых	1
рыбы рождается этот случай	1
другой стороны происходит окаменение	1
? неи я сжег	1
с богом или с	1
рассмотрение пришло к концу	1
и случилось что когда	1
и с того дворца	1
теленков взвил всю сухую	1
заставляя георгия убить змея	1
какую картину дает нам	1
давался в руки умершему	1
земли от захода и	1
том что она действительно	1
можно вообразить там зрелые	1
в колодцах морской змей	1
знакомо здесь мы имеем	1
что души умерших обладают	1
yang кадушки для носки	1
чужбину возвращаясь когда бог	1
животные составляющие змея охранитель	1
глаза и язык убитой	1
более ранних ступенях например	1
богом она остается женой	1
раздражен и решил перейти	1
и супостат что заставить	1
от животного и он	1
ежели принесть его в	1
нансен анализируя слово торнарсук	1
об аргонавтах с падением	1
троянском побережье на девушку	1
она в большом золотом	1
из этого мира не	1
месте росло дерево денжес	1
о неисчерпаемом изобилии там	1
не только ра но	1
мертвых и проглатывают сердца	1
священная змея охраняющая солнце	1
героя перед сражением есть	1
эти представления находятся несколько	1
путем утопления ее причем	1
именно гладкого без всяких	1
уже выше в главе	1
числа выражения качества через	1
нас но так как	1
оно особенно распространено в	1
его функция переносится на	1
влезать в ее пасть	1
его связь с представлениями	1
весьма похожи друг на	1
и под водой а	1
и дьявольской на той	1
сквозь воду так позднее	1
головы из пасти которых	1
она затопила всю землю	1
нечестивец нарушающий самые жизненные	1
морском берегу ты обращение	1
воду и создает засуху	1
представление что змей проглатывает	1
египте на небо по-видимому	1
угрожала опасность со стороны	1
грудь запустил и рванул	1
сказка похититель-животное здесь преобразован	1
werner другими словами из	1
изображение змеи с открытой	1
змея т е вышел	1
держался и вундт возможно	1
в царство идет через	1
блаженства.<неи психостасия неипожирание здесь	1
по существу и по	1
восходит к описанному здесь	1
и становится существом небесным	1
царства и земли как	1
еще в сборниках по	1
свою предысторию для которой	1
арабским завоеванием такой же	1
связь кристаллов кварца с	1
вот почему и злая	1
ясна сопротивление отсутствует негры	1
него человек ведший грешное	1
и жреческая мудрость выдвигающая	1
также надо несколько присмотреться	1
характерно что этот обычай	1
урожайности это видно во-первых	1
вот близко вот нагонит	1
наличие вообще трех царств	1
для жертв в виде	1
побережье и оставляли ее	1
страшный змей-поглотитель встретились здесь	1
религиозной основы такую фантастику	1
эта концепция не совсем	1
приписывают потустороннему царству ту	1
с царем змей волков	1
правом назвать это тридесятое	1
содержат момент смерти в	1
не умирали бы frobenius	1
же эта сторона его	1
на которой стояли краснокожие	1
мексиканском сказании народ терпит	1
рассветает одновременно появляется река	1
девушек сватаются сокол ворон	1
довольно ясно вытекает что	1
двоякая в более ранних	1
проводила здесь ночь а	1
не удалось найти никаких	1
взлети на свою посмертную	1
под угрозу урожай в	1
и народ вполне был	1
солнце стоит и на	1
никого не останавливает представление	1
что от этого местность	1
отношение между мифом и	1
и золотое пялечко с	1
следующее с острова новая	1
это значит что она	1
категория определенного множества есть	1
говорит существовало также представление	1
она маленькая птичка тивакавака	1
мауи герой-бог рассказывает о	1
страшным существом теряет связь	1
и небесное существо и	1
них наслаиваются новые до	1
обряды должны были увеличить	1
или погибают от этого	1
какого пола то или	1
чудно и светло что	1
быть проанализированы и остальные	1
уничтожение всех его частей	1
книга мертвых гл согласно	1
в преисподней в своей	1
смерть.<неи под объективизацией понимается	1
трактовка этого мотива в	1
мотивируется бой.<неи в античной	1
собственность появляется с земледелием.<неи	1
жар-птицы птицу подкарауливает иван-царевич	1
или другое чем змей	1
змей есть одно и	1
появляется сравнительно поздно и	1
же роль что у	1
же образом возникает мотив	1
кто тут живет? пошел	1
высказана яснее в преисподней	1
комедии больте-поливка iii об	1
находили мертвой но потерявшей	1
другую ставили правду в	1
существо он вообще ничего	1
здесь играют роль пространственные	1
животного как объекта охоты	1
в описаниях отдельных случаев	1
и раскрытии та же	1
водяное существо.<неи чтобы проследить	1
влечет за собой поднятие	1
змея.<неи поборы змея неирассмотрение	1
имеется это избушка яги	1
и ребенок по предписанию	1
bush soul обладателем такой	1
горы что под самое	1
надо несколько остановиться так	1
миф совершенно явно относится	1
появляется особая новая форма	1
содержанию подробно описывается путешествие	1
возникает мотив борьбы с	1
в христианство освобожденный им	1
прилив и отлив frobenius	1
случаях развивается та линия	1
змеи а потом змея-дракона	1
посейдон выстроил троянские стены	1
в меньшей мере в	1
прохода не вполне забыта	1
и сказал я потерял	1
принесут ее к водовороту	1
к жертве но при	1
у народов говорящих на	1
вод т е у	1
вначале тесно связано с	1
вечное потребление.<неи появление таких	1
встретиться с хозяином или	1
в его близости далее	1
не накормила не напоила	1
плодородием в мексиканском сказании	1
змея и тем освободившем	1
никогда не осуществляется есть	1
корабль к большому богатому	1
наоборот смерть есть своего	1
морскому чудовищу сохранилась так	1
виро величается вором почему	1
воды неизменно влечет за	1
прилегли только раз в	1
из видов смерти известно	1
если таким образом генетически	1
сапогах говорит герою есть	1
природу и окраску река	1
бы два брака один	1
до vi века нашей	1
кто-то похитил душу или	1
степени объясняют змея как	1
тридесятом царстве ни одной	1
бой никогда не описывается	1
с обрядами также широко	1
живет совершенно особый и	1
связи нет в прямом	1
назад".<неи подобного рода жертвоприношения	1
взморья к скале это	1
как кажется было особенно	1
время он становится предком	1
имеющиеся и создавшиеся ранее	1
мотив злоупотребления змеем своей	1
забыто здесь только что	1
посмертную лошадь оденься в	1
зверей они вырывают из	1
чрезвычайно ценный для фольклориста	1
три собачьих головы из	1
в иное царство к	1
автор что путем добровольной	1
его с плодородием змея	1
помещаются тысячи людей а	1
земледелие зависит от рек	1
сказка на русском языке	1
озере приносятся жертвы krickeberg	1
от нее как от	1
по названию мрувиа полагали	1
той горы и ее	1
эпитет это богатырский сон	1
богини своими заклинаниями связывают	1
растительности у рыболовных народов	1
что кто-то похитил душу	1
обиталище змея в полной	1
колеснице плутон бог преисподней	1
защитить мириады мух жужжали	1
похищении менее архаичны чем	1
древнем египте и древний	1
на этой стадии никого	1
тураев сходные явления имеются	1
зашел в такую землю	1
холме обитатель в своем	1
переносит туда же и	1
пожирание также никогда не	1
он весь на золоте	1
оно нам еще пригодится	1
течение рек о чем	1
существом хтоническим или он	1
неи этот список можно	1
на обоих концах тела	1
силой красть души живых	1
а миф типа персея	1
в образе черного коня	1
начали борьбу с большой	1
воды он пригнал море	1
самой обитательнице этого царства	1
нет письменности и жреческая	1
аграрная и соответствующие обряды	1
связан он приподнятый на	1
мы проследим при анализе	1
схематически могут быть зафиксированы	1
следы этих божеств также	1
промаха но позднее на	1
миф типа персея и	1
'унес его в царство	1
точности соответствует русским сказкам.<неи	1
следующий день принесли жертвы	1
но здесь еще нет	1
что водяная природа змея	1
пожирания уже не происходит	1
ли приезжает он на	1
его небо своевременно не	1
него же от змея	1
китайских мифах и других	1
сообщает что несколько человек	1
заставить самого змея выступить	1
ни вздумать ни взгадать	1
в преисподней родился царь	1
в себе очень большую	1
в темную горницу то	1
для этого даже не	1
двойника ли боится и	1
одной из рек и	1
его как и вся	1
боя беседует с царевной	1
богами.<неи все эти случаи	1
одно существо так как	1
вне человека для этого	1
пропустили героя вбрасывание в	1
во дворец.<неи мы не	1
границы вход в царство	1
связи сказки с мифом	1
первобытного человека что даже	1
евфрата и тигра желтой	1
величается вором почему он	1
это из приведенных материалов	1
преждевременно родился на морском	1
запас кокосовых орехов и	1
на какой стадии общественного	1
на горизонт связь ее	1
можно возразить что царевна	1
это далеко не единственный	1
трагических фактов жизни индивида	1
далее есть дух который	1
социальную опасность они приводят	1
царевна 'подобно этому случаю	1
что индра убил вритру	1
индра убивает змея уже	1
из плодов хлебного дерева	1
червяк облака летающего ударяет	1
не доказывают все же	1
подробное обсуждение этого вопроса	1
я потерял жену и	1
человеком царевичем но есть	1
иного царства отражающие наиболее	1
еда если принести такую	1
план на передний план	1
мы начнем присматриваться к	1
так появляются все новые	1
по воде это приводит	1
сели и царь-медведь принес	1
предположить что и волшебный	1
пожирал в своем лабиринте	1
развитого жреческого сословия здесь	1
прудах и озерах так	1
не двойника ли боится	1
хрустальную гору ехали ехали	1
родовом обществе охотник всецело	1
какую-то связь с солнцем	1
развиваются представления о тридесятом	1
на фигуру похитителя фигура	1
горе ни взойти ни	1
оставляет в живых кербер	1
земная глубина открытая пасть	1
так что мимо них	1
случай бросить его в	1
любовное похищение как один	1
ганга евфрата и тигра	1
способом опознавания героя а	1
свете люди змеи львы	1
эта птица действительно прилетает	1
является чтобы унести магические	1
он перевесит пусть меня	1
литературу наоборот выдача девушки	1
вопрос о хрустальной горе	1
государством может принимать золотую	1
ни взъехать на эту	1
