где положение этого царства	1
со свистом за верст	1
своими собачьими головами эти	1
встречает девица прекрасная из	1
циновки у островитян нуку-хивы	1
медузой пифоном лернейским змеем	1
герой очень часто именно	1
только в раннеземледельческих странах.<неи	1
самым подтверждая наши наблюдения	1
время как вся книга	1
него корона со змеей	1
царевна похищенная смертью в	1
ли увидел золотой дворец	1
представление о змее-охранительнице вод	1
чиченица были найдены кости	1
же есть постройки и	1
но как только мы	1
объясняют змея как охранителя	1
разрешения покинуть пекин после	1
в которых он имеется	1
преисподней уносит кору дочь	1
земледелия при умении наблюдать	1
и тем не менее	1
g(ntert это сказывается и	1
и сказочного змея.<неи представление	1
замуж за бога-змея женщин	1
лежала большая змея обвившись	1
здесь не удастся также	1
распространенные животные представляющие душу	1
еще одну сторону змея	1
качестве равнодействующей получается комическая	1
магического вооружения повергает змея	1
сказка посвященной главным образом	1
или хозяина эти животные	1
осириса бусириса и мендеса	1
они заставили поэтому отца	1
он и по наружности	1
почему он покровитель воров	1
борьба но в сказках	1
дочь лаомедонта ее отец	1
именно что золотая или	1
секте офитов возводившей змея	1
имеет много голов чем	1
или обремененная грехами на	1
страшные змеи на золотых	1
нем надо несколько остановиться	1
мире духов штернберг неи	1
глаз и сердца т	1
существа приписывались два сильнейших	1
явно относится к мифу	1
также лежит много живых	1
насильственный со зверем брачная	1
жертвенные венчания совершались перед	1
что в крылатой фигуре	1
яги кроме названий эти	1
нас к сказке вряд	1
встав начал прохаживаться видит	1
неиуже выше когда мы	1
обоих случаях развивается та	1
тигра желтой реки здесь	1
великой воды этим он	1
змей настолько исключительный враг	1
комическую трактовку мы имеем	1
мифах неиот этих общих	1
огненную природу и окраску	1
есть какая-то связь это	1
молодой девушке они заставили	1
в образе животного неотделим	1
вода и сл).<неи этот	1
и водяного змея на	1
что связано с тридесятым	1
связь со своим хозяином	1
предположить что и царь-медведь	1
ничто никогда не повергнет	1
ту же роль что	1
переносится в небесную высь	1
живых мужчин и женщин	1
соответствуют обряду предоставления девушек	1
к одной молодой девушке	1
земледельческом происхождении этого мотива	1
пропп здесь же мы	1
змее из которых как	1
что заставить самого змея	1
подземным ходом вдруг забрезжился	1
и идеалы в борьбе	1
довольно убедительно показывают что	1
в реку и народ	1
наш сказочный змей?<неи чтобы	1
с одной стороны и	1
в одной фигуре оба	1
донце-золотое веретенце серебряное блюдо	1
горного хрусталя он взял	1
за собой живых процесс	1
едок мертвых это последняя	1
царя будет выдана этой	1
переходит к богам которые	1
нс исчезают а продолжают	1
змей царевну и потащил	1
стука хлопнуло на его	1
перламутра но для исследователя	1
но позднее на том	1
в змее мы уже	1
пришел такой величайший шум	1
неотделим от другого процесса	1
царство соколов можно предположить	1
мотив в греческой комедии	1
уничтожает его после чего	1
годовалых теленков взвил всю	1
фалла он представляет собой	1
за собой живых папуасы	1
окуналось чтобы достигнуть своего	1
и днем в образе	1
мифы достигают только в	1
птичка тивакавака смеется чудовище	1
описывается как змееподобное чудовище	1
также не должен засыпать	1
туземцы акикуйю в бывшей	1
мыслили себе в воде	1
случай показывает что обложенность	1
финисте-ясном соколе девушка прибыв	1
быть признаны весьма архаичными	1
сухую землю как волосы	1
форма земледельческого производства разведение	1
у народов достигших более	1
повергнет меня на землю".<неи	1
где он предстал перед	1
dieseldorf соответствующие мифы мы	1
становится сказкой тронский и	1
родственников смерть в древней	1
чтобы они пропустили героя	1
миф оно могло и	1
себе возлюбленную или возлюбленного	1
и она-то и вызывает	1
есть печать иного царства	1
ночи царевича и царевны.<неиv	1
особенности змея его многоголовости	1
человечеству сама природа змея	1
развития этот обряд и	1
дух возлюбив того или	1
ею управлять так как	1
отчаявшийся лаомедонт не отдал	1
потому что труд становится	1
может дать более подробную	1
царство поэтому змей живет	1
умертвить чужая ж сила	1
героизации.<неи этим же объясняется	1
вид она живет в	1
т д но человек	1
сторона его существа исконно	1
может быть засвидетельствован на	1
ясно почему змею известен	1
и сам он принимают	1
водяного змея в хтонического	1
уничтожен изнутри но вот	1
шныряет по этому миру	1
раздробил его зубы неи	1
интересной и значительной форме	1
от того какое дает	1
озера делаются долганский фольклор	1
бога не случайно что	1
преследуют женщин духи умерших	1
комплекс змееборства ступени развития	1
указывающих на связь этого	1
интересно что и в	1
и хотя это указание	1
данный мотив и этим	1
жизнь больного наступила оттого	1
отлива змей просто приводит	1
достаточно полно но он	1
горы мы должны помнить	1
из моря в образе	1
героиню уносит танатос безличное	1
пожранью сохранено также что	1
здесь тысячи лет и	1
семь голов и тело	1
означает он историческое явление	1
по образцу китайского императора	1
случилось что когда я	1
под такие крутые да	1
сказка правда в очень	1
религии уже начавшей создавать	1
гиппопотам в середине лев	1
под землей примитивное земледелие	1
и природу змея.<неи таким	1
именно тех представлений в	1
дне моря в дворце	1
продовольствия принц правит справедливо	1
на другую ставили правду	1
красы неописанной что ни	1
голова с хвостом сходились	1
засох бы баганды уходя	1
коня восьминогий конь известен	1
вод позже создатель плодородия	1
не встречалась к изучению	1
в греции еще не	1
стены но обещанной награды	1
особенно распространено в античной	1
своем пути он встречает	1
именно линию представления о	1
водяной змей<неи водяная природа	1
провалившиеся в озеро как	1
похитителем чаще всего является	1
пожирает т с заставляет	1
обеспечивают потребление без применения	1
в прядь своих волос	1
рекам i индра убил	1
наталкивается на троянском побережье	1
ней должен быть рассмотрен	1
с фрэзером жаловаться что	1
стадии его становления уже	1
в русских сказках хрустальная	1
человека или бога по	1
но все же можно	1
еще не вполне выработалась	1
у них его еще	1
почему змею известен враг	1
яго хате яны разламили	1
тела мертвых и проглатывают	1
свои функции и свои	1
а именно как страж	1
которых он пожирал в	1
и не хочешь уведу	1
книги мертвых мы читаем	1
утеряна первоначальная связь с	1
древнее но и то	1
элементы перенесение зияющей пасти	1
весь сплошь из бисера	1
таким образом она имеет	1
а одно золотое этапом	1
собственным защитником и ничто	1
субституция приведен зелениным в	1
так я его съем	1
уже поколениями изучение культур	1
пришли в тридесятое царство	1
книга делится на частей	1
посмотрим какую картину дает	1
золотая окраска есть печать	1
волосами и огромная пасть	1
явные очевидные случаи гибели	1
он представляется в сказке	1
встречает голового змея голов	1
связан с представлениями о	1
представления что душу похитил	1
людям воды и реки	1
змей и царство мертвых<неи	1
только те которые связаны	1
подземном хранителе царства мертвых	1
восьминогом медном лабазе замотавши	1
все еще испытывается как	1
отдал ему своей собственной	1
так в микронезии о-ва	1
генетически мотив похищенной красавицы	1
мог быть только миф	1
змея которого убил кекропс	1
что посредством горного хрусталя	1
северной америке всегда число	1
пола то или другое	1
сейд любитель женщин ему	1
он бы вернул ее	1
древних представлений.<неи сторожевая роль	1
змея что змей видит	1
гиляков приходит к заключению	1
нас предположить что сказочный	1
но сквозит в мотиве	1
каналы потому что город	1
тураев близок к тому	1
змей мыслился сидящим в	1
индия классическая страна коневодства	1
зависит от змея вовсе	1
на колеснице сидит королевна	1
ему единое объяснение заранее	1
всякие попытки свести весь	1
нужны солнце дождь и	1
воды или в воде	1
если он это разрешит	1
это означает смерть radermacher	1
еще шире этот круг	1
моря в образе судна	1
богам которые уносят сердца	1
постройки и это всегда	1
ему раны ? неи	1
фантастическую даль у такого	1
дочь солнца четвертая из	1
е человеческой земли и	1
отсюда и ее имя	1
не представляет собой проблемы	1
еще далеко не кончено	1
половое общение между человеком	1
серебряном а навес над	1
мы видим начало материализации	1
кербер жрет падаль для	1
них в этом направлении	1
над жизнью и смертью	1
крылатые звероподобные фигуры тураев	1
гармония его супруга к	1
получилась чистая фантастика лишенная	1
произойти последствиях змей был	1
видели и вышел весь	1
viii и др.).<неи водяным	1
котором жила его матушка	1
базисом на котором этот	1
отомстила тем что выплюнула	1
вопрос не развилось ли	1
таким же частным случаем	1
там в более древние	1
пущенная привезла их к	1
длины покрыты кремнем и	1
земле называются tangou или	1
хватай ведра беги заливать	1
счастливой страной богатой тестом	1
подневольность труда связана с	1
предступень к змею он	1
объясняет и крылья и	1
пособника прохода не вполне	1
фольклориста это некоторый остаток	1
здесь сохранено даже представление	1
они улеглись неи иногда	1
рек вритру ср весь	1
но боги эти все	1
ладье канат барки превращается	1
сохранившую взвешивание душ или	1
и садах которые свободно	1
знаю что я преждевременно	1
ее но и горный	1
иван-царевич а потом и	1
эти все же сохраняют	1
поборов с соответствующими мифами	1
к господину солнцу дочь	1
будет исчерпана отсюда скатерть-самобранка.<неи	1
приписывают засуху задержку вод	1
связь от рождения это	1
исследователей античности к этим	1
где особенно развиты представления	1
кербера в свете сравнительных	1
правда для нас змей	1
утро светающее его небо	1
заменяется богом но боги	1
требуют девушку пусть принесут	1
случаями есть какая-то связь	1
менее архаичны чем сказка	1
которые имели общение с	1
до сих пор материалах	1
городу остановился в пристани	1
носки воды и в	1
также какую-то связь и	1
развито в африке во	1
в вавилоне еще совершенно	1
представлений.<неи страна обилия неимы	1
борьбы с ним на	1
она скачет на статном	1
или огоньков духи умерших	1
исчезли сон разгадывается принц	1
жрецов утешая народ перспективой	1
рождением что между героем	1
таких представлений показывает что	1
существо.<неи нам необходимо установить	1
другое обратное значение сон	1
такая эротика появляется сравнительно	1
у якутов оно есть	1
вход в подземный мир	1
тела и отправляющаяся по	1
озера так как в	1
ней никогда нет леса	1
противоположном берегу в долганской	1
образовала меня и дала	1
хрусталь имеется широко распространенная	1
но месяц запрещает открывать	1
ясна она в греции	1
как категория определенного множества	1
них даже боялись проходить	1
принимают такие пышные формы.<неи	1
отметить что охотник на	1
мгновенье ангелы не знающие	1
имели в сказке сон	1
как урожай в египте	1
того какое дает дитерих	1
этот папирус давался в	1
плодами взошли на тот	1
в когтях что-то неи	1
это разрешит и позволит	1
и камнях.<неи эротическая окраска	1
не пашут не сеют	1
умерший достигает вечного блаженства.<неи	1
бросали ее в нил	1
живет и берлогах.<неи мы	1
небо на том поле	1
черная коса царь-девица катается	1
мы имеем в амуре	1
голов и тело их	1
забытое представление о птице	1
вопроса здесь можно не	1
здесь только что сам	1
его что его невеста	1
уже и многоголовость другой	1
животные сады острова сохранились	1
представление облечено не в	1
он вынужден изрыгнуть все	1
читаем он ра пронзил	1
миф переродился в сказку.<неи	1
восточной африке поклоняются змею	1
плодов хлебного дерева свининой	1
же когда мои глаза	1
зародышевом состоянии оно имеется	1
змеем и уничтожение его	1
вере он имел чистый	1
папирус давался в руки	1
змееборец ра проходит сквозь	1
со стороны водяных животных	1
обе стороны и как	1
никогда не описывается зато	1
ясные общие черты имеющиеся	1
переносятся на несчастную жертву	1
жреческая отражающая однако народные	1
то отсюда пошел обычай	1
урожай или вообще на	1
пахучими травами и поэтому	1
стороны эта похотливость была	1
канат барки превращается в	1
вскоре он заметил что	1
божеств также как мы	1
представления связанные с рождением	1
является животное то это	1
также широко засвидетельствована в	1
многоголовой змеей число голов	1
отправляется туда где встречаются	1
истолкован как неполная субституция	1
плоды и бросало их	1
из нашего сознания явлений	1
в древней вере воспринималась	1
похититель уносит похищенную здесь	1
той культурной ступени на	1
мифа.<неи все эти детали	1
изолированно поглотителя переплывающего большие	1
вода точно таким же	1
словами из хозяина стихии	1
африке особенно развита фаллическая	1
заключение змей очень сложное	1
этих двух противоречивых сил	1
есть новое явление по	1
совершенно утеряна сторожевая роль	1
психея другой с человеком	1
др типичность уступает место	1
пребывания в рыбе.<неи такое	1
представляется тучей задерживающей воду	1
желтой реки здесь девушка	1
равно как штольни рудников	1
эта связь ясна исследователю	1
но даже в тех	1
избил его отец он	1
водой или на горах	1
от лица мумии и	1
государствах а именно как	1
индейцев хопи змея поднялась	1
выдают замуж за бога-змея	1
психостасию это ведьма и	1
интересный случай который может	1
объясняет нам хрустальную гору	1
божественности от зверя к	1
ужасный рак покрывает пасть	1
когда царевна представлена воинственной	1
суд и судилище есть	1
похищение зевсом европы и	1
собаку не дозволяет достать	1
дано только предположительно.<неи что	1
размеров пасти в русской	1
время когда змей полоз	1
конечно нарушает запрет со	1
пошел и отворил дверь	1
скотоводческого народа по людвигу	1
выстроен а во дворце	1
пялечко с иголочкой неи	1
имеет совсем другое обратное	1
вырывают из их рук	1
полтора переезда идет с	1
которая была так сильна	1
после которой с одной	1
пруда до неба и	1
и в сказочном тридесятом	1
и охранитель царства мертвых	1
они сторожат у излучины	1
это ее дом он	1
и могущество такие материалы	1
таких животных является и	1
он прошел сквозь змея	1
ясным то это еще	1
называются tangou или kenit	1
если рожденный от змеи	1
ворон и орел брат	1
огненное горящее море лег	1
очевидно связь же с	1
назвал это явление избранничеством	1
и вскоре увидел перед	1
и случаи когда двух	1
же категории относится и	1
змей.<неи как на пример	1
видит и там свет	1
проходит мимо древних священных	1
палец и всунул их	1
общих чертах можно установить	1
царства возникли как утроение	1
и птица животные составляющие	1
его в страну врага	1
собирались вокруг меня чтобы	1
количество рыб их делается	1
так сияло как бы	1
нетрудовое изобилие сам гибнет	1
часто в них не	1
сторона змеи в других	1
предупреждает змея что у	1
литературная символическая обработка все	1
пока наконец в египте	1
противопоставлены два царства и	1
