или меньшая сложность ничего	1
людей которые своими фамилиями	1
если европейцы не совершеннее	1
культуры все последние ближайшие	1
сознает сущность европейского космополитизма	1
дикаря однако такое соотношение	1
лестнице помещаются несколько ниже	1
другой стороны разве сущность	1
же как европеец толкует	1
маленького европейца если мы	1
должен быть раз навсегда	1
теоретические основания так называемого	1
романогерманцев подстегивать и подгонять	1
одну из возможных культур	1
создавших ее европейская культура	1
домогательства иностранцев всякий уважающий	1
тарда тем не менее	1
элементами культуры общими ему	1
смесью романогерманской с туземной	1
внимание несколько обстоятельств во	1
родственны с наречием рима	1
же замаскированный шовинизм все	1
сих пор достигнуто людьми	1
в сознании данной культурной	1
большою быстротою и с	1
сразу заимствует у в	1
том приобщение без антропологического	1
открытие распространяется среди других	1
народа поставлена в гораздо	1
обыкновенно менее сильно и	1
то они вредны и	1
космополитизма среди не-романогерманских народов	1
из какого-то таинственного источника	1
эти последние приняли свою	1
т.е что дикари тоже	1
традицию и без того	1
последствия европеизации настолько тяжелы	1
мышления правда европеизация в	1
в угоду европейской наконец	1
синтез элементов шовинизма и	1
и постараться плодотворно исправить	1
что говорили является причиной	1
попали народы по существу	1
того же общего запаса	1
культуры он не может	1
познаний и сведений он	1
что культура современных романогерманцев	1
течение более долгого промежутка	1
в первое время после	1
при оценке европейского космополитизма	1
приспешников империалистическую колониальную политику	1
выводов до сих пор	1
ясно что выйти из	1
меньшей интенсивности промышленной жизни	1
и без того приходится	1
собственной психике ее нет	1
быть коренным образом преобразована	1
конечно не без влияния	1
здесь отпор тоже обыкновенно	1
и убеждения этих чудаков	1
смесь создается в каждом	1
европейских фабрик если бы	1
причем эта взаимная борьба	1
собою всю культуру романогерманцев	1
будет представляться нам всегда	1
культуры были тождественны между	1
он сам такой же	1
же оптическом обмане и	1
но почти неизбежным дополнением	1
место европейца а наоборот	1
непрерывности и органичности развития	1
образом по отношению к	1
социально-политического уклада жизни европы	1
социалистическом обществе деления на	1
только мы вспомним искусственность	1
его теории нам приходится	1
европейца должна быть признана	1
того же явления шовинист	1
эти смешанные культуры как	1
им постоянно приходится признавать	1
племени принять не только	1
от европейских норм реакцией	1
поставленного выше вопроса жизнь	1
и в течение более	1
цивилизации то ведь и	1
романогерманской культуре в конце	1
национальное самоутверждение большею частью	1
смешение культур как общее	1
дикарями является взаимным т.е	1
и руководящих политических кругов	1
замечает что он сам	1
с b заключают в	1
непонятной т.к эта часть	1
его народом лучше совершеннее	1
тогда не требует доказательств	1
не только не считают	1
людям будет восхвалять те	1
различных элементов при чем	1
иногда тоже весьма сложного	1
открытия которые носят на	1
тщательном рассмотрении эти квази-научные	1
или ином объеме никто	1
солью земли лучшим из	1
ценностями его можно рассматривать	1
себя действительно высшее что	1
времени успевает создать лишь	1
традиции целый ряд элементов	1
культур не может объективно	1
клеймит его направление как	1
распространении столкновение ценностей не	1
в друге почти все	1
скрываются очень определенные и	1
называемого мирового прогресса этот	1
общеживотную психологию а отличия	1
к этому надо присоединить	1
которых они развились сообразно	1
религии общечеловеческой оказывается антикультурное	1
на европейцев впечатление взрослых	1
габриэль тард в своих	1
двух разнородных культур открытия	1
признавая их лишь историческими	1
своем превосходстве над всеми	1
больше тормозит распространение всяких	1
сильна что в правильности	1
млекопитающих сами млекопитающие совершеннее	1
истории создавшей некий общий	1
чаще всего дело разрешается	1
европейцами далее культурные народы	1
ниже европейцев а в	1
говорило бы не в	1
умер не подготовив себе	1
обеспечения детей так и	1
в виде теории борьбы	1
земле совершенства может назвать	1
что бумага на которой	1
проповедовать господство в мире	1
единственным носителем всех возможных	1
культурой будут свободны от	1
и научное или философское	1
культуры проник тогда и	1
считает высшим самого себя	1
abrupto то что у	1
постепенно в результате долгой	1
элементарный психический процесс подражания	1
особенностями в отдельных местностях	1
какими-то странностями чудачеством соединение	1
них единой культуры общего	1
приемлемыми для романогерманцев являются	1
уже о том что	1
государства галлии испании британии	1
но основанные на таких	1
всегда превышают число своих	1
романогерманской культуры пороки и	1
преодолев все эти препятствия	1
сожаления навсегда отбросит от	1
приспособления к среде но	1
народа в? конечно нет	1
следует что вопрос наш	1
по существу он не	1
культуре ибо культура рима	1
положение аристократов а прочие	1
приняты меры как для	1
расположены в вышеуказанном порядке	1
и этого остроумного исследователя	1
одно из непременных условий	1
таким образом культура всякого	1
и умнее моего знакомого	1
они сумели замаскировать все	1
виде эту традицию приходится	1
университет вскоре однако он	1
которые вытекают из самой	1
оба основных процесса имеют	1
чрезвычайно вредно отражаться на	1
процесса имеют между собою	1
принципа градации народов и	1
традицию приходится прививать через	1
все от того же	1
ученый в данном случае	1
устраняет одну из борющихся	1
образом психика дикаря должна	1
подвербовывавших солдат и из	1
романогерманцев по своей культуре	1
которые имеются и у	1
с неразвитым чувством национальной	1
необходимо во-первых потому что	1
имеет место например при	1
милитаризма и капитализма а	1
как для обеспечения детей	1
своих манер тонкостью своей	1
ученые помещают на вершине	1
стороне врожденной причем этот	1
всем представителям других народов	1
та культура которая по	1
что на нас не	1
не в пользу европейской	1
спиной и продолжать развивать	1
бы на их расстояние	1
заранее убеждены в своем	1
оптическом обмане мы воспринимаем	1
врожденных индивидуальных у них	1
долю нецелесообразного чудачества то	1
они возьмут из нее	1
при виде европейца либо	1
всю эту культуру нечего	1
нет из предыдущего совершенно	1
не выше всякой другой	1
в совершенстве изучил жизнь	1
стороны разве сущность учения	1
европейцы всегда обещаются исправиться	1
находящиеся под полным их	1
не различается поэтому европейцу	1
каких-то общечеловеческих а на	1
римская культура так или	1
между собой или старыми	1
законом вечного отставания ждет	1
для европеизированного народа но	1
называемых дикарей равноценными с	1
культурными единицами как бы	1
все эти осложнения можно	1
те элементы которые им	1
туземными культурами элементы греческой	1
оцененный в европе французский	1
эта же разобщенность частей	1
как тот так и	1
цепь мы все же	1
который можно назвать историческим	1
антропологическом смешении таковы напр	1
считается прогрессом а всякое	1
ли они стараясь во	1
и вообще от характерного	1
у а к запасу	1
разных точках ее и	1
ее от эгоцентризма если	1
самом деле надо принять	1
в различных пропорциях элементов	1
будет считать этого последнего	1
но постепенно в своем	1
на европейцев как на	1
оценки делающий из этой	1
кончается победой белых и	1
каждого поколения полученная таким	1
тогда как достаточно малейшего	1
с европейской часть с	1
теснейшую связь новых открытий	1
остальные части народа процесс	1
целого народа полного приобщения	1
или лучше сказать уже	1
а органический мир совершеннее	1
на этом оптическом обмане	1
оживленное культурное общение совершенно	1
европейская наука в этой	1
будут свободны от предрассудков	1
нивелирующему воздействию греческой и	1
тоже с точки зрения	1
всех отношениях лучше и	1
своему состоянию чем в	1
а эту культуру позаимствовавшего	1
части действительно становится сизифовым	1
ненаучно наивно наконец просто	1
этому строю иначе т.е	1
мерило что похоже на	1
все социальное целое данное	1
культуры одежды жилища орудий	1
при чем конечно у	1
признается тот в который	1
отношении действительности к эволюции	1
их будет казаться детскими	1
в виде требования единого	1
примером представьте себе семь	1
будет наоборот будет высший	1
больше сложности чем многие	1
природных романогерманцев в силу	1
и иноземной культуры таким	1
своей материальной культуры и	1
существующих культурных ценностей согласно	1
русского интеллигента не страшит?	1
посмотрим какое содержание вкладывают	1
а прочие отсталые народы	1
из этого делают вывод	1
выше заметим кстати что	1
психологии передаваемой путем наследственности	1
центр тяжести должен быть	1
и понимает в другом	1
а всякое отклонение от	1
каждую историческую эпоху эта	1
разрешается борьбой двух эгоцентрически	1
низкой степени культуры заметим	1
случайности будет выражаться отношением	1
различия между отдельными первобытными	1
стоят все европейские эволюционные	1
смысл что касается до	1
никакой роли в вопросе	1
усматривает в барине известное	1
в его теории нам	1
своей культуре это единственный	1
лучше совершеннее всех остальных	1
определенной этнической группы романских	1
римского военного господства как	1
на долю нецелесообразного чудачества	1
конечно будет носить особый	1
его хотят сами же	1
у предполагаемого народа а	1
у изобретателя так и	1
чувствует эгоцентрическую основу шовинизма	1
элементов самых разнородных культур	1
пруссов полабов и лужичан	1
даже хитроумная система австралийского	1
интересующего нас вопроса о	1
имеет параллель в миросозерцании	1
та цивилизация та культура	1
запас романогерманской культуры тем	1
деле есть культура лишь	1
как натуры не самоуверенные	1
каждого человека состоит из	1
иметь единую культуру нецивилизованные	1
вытесняет другую а наоборот	1
логики что только на	1
психика народа с культурой	1
над дикарями многим может	1
котором идет речь в	1
останутся товары фабричного производства	1
всех остальных подобных им	1
с величайшими затруднениями эгоцентрическая	1
европейской культурой будут свободны	1
же строй во всем	1
оценку культуры то ему	1
знать определенно где лежит	1
двух разнородных культур вполне	1
наконец не от чего	1
них в гораздо большем	1
тогда когда их проповедует	1
открытие неразложимо вполне на	1
цивилизации? эгоцентризм заслуживает осуждения	1
новый принцип равноценности и	1
романогерманцев и от эгоцентризма	1
прикрытые маской объективной научности	1
и европейцы так же	1
из себя чудовищное petitio	1
многие из них попытавшись	1
и социальной среды наблюдателя	1
duel logique по терминологии	1
эволюции верно то придется	1
отличалась от римской но	1
приняли свою оценку за	1
но так как эта	1
европейскую культуру таким образом	1
того же процесса подражания	1
отличия от современных романогерманцев	1
соединение разных более мелких	1
ниже стоять культурные народы	1
естественно при этом что	1
народов создавших ее европейская	1
их квасной патриотизм смешным	1
но того кто пожелает	1
эти квадратики расположены на	1
что психика народа с	1
всего в эти эпохи	1
институт групповых браков у	1
более как две ступени	1
европейскому шовинизму и космополитизму	1
с перевесом на стороне	1
европеизации и определить являются	1
романогерманцев и растрачивают свои	1
подражания на все социальное	1
и европеизируют его насильственно	1
низшая раса здесь эгоцентрическая	1
на эволюционной лестнице помещаются	1
чувствуя подводных камней на	1
члена семьи цивилизованных народов	1
кровосмешений вообще говоря большая	1
как шовинист считающий своими	1
immitation тоже термин тарда	1
существующая культура мы должны	1
речь придется принять их	1
мы сказали выше что	1
профессиональные различия в среде	1
постоянное постепенное приближение к	1
человека принадлежащие к двум	1
не может не замечать	1
правильнее было бы называть	1
принимать все то что	1
вооруженного мира распространится конечно	1
выше и других ступеней	1
скоро должны погибнуть уступив	1
в их быте и	1
открытий типа b+b не	1
развития культуры для процесса	1
точки зрения этой-то социологической	1
и при таком смешении	1
точно такие чувства при	1
к эмиссару народа х	1
ибо в ней естественно	1
из себя довольно пеструю	1
предается слепому подражанию европейцам	1
антропологического смешения обоих народов	1
будет всегда превышать культурный	1
в другом только то	1
рассматривать такую проповедь как	1
этих ценностей вытесняется другой	1
оттиски вырезки или просто	1
как природный романогерманец идет	1
действительно ложны то они	1
тяжелые условия усвоения и	1
определенной группы народов создавших	1
обстоятельство зависит опять-таки все	1
не имея возможности идти	1
как элементарно разрешен этот	1
культуры элементов вполне однородных	1
одно это ставит его	1
запасом культурных ценностей этот	1
с точки зрения всякой	1
что общая сумма культурных	1
утвердительном ответе на все	1
тот факт что с	1
культурами каждый из этих	1
в подготовленности сознания общества	1
называемого космополитизма они не	1
ничем не хуже других	1
никакой нет в самом	1
самих методов и выводов	1
достижимо лишь при условии	1
европеизации настолько тяжелы и	1
и того же явления	1
другу чем их отцы	1
за венец эволюции человечества	1
разобранным историческим аргументом именно	1
культуры ибо такие открытия	1
народов все-таки не будут	1
единую культуру нецивилизованные народы	1
нивелировки всех своих частей	1
культурного языка то станет	1
мы видели что при	1
с ее развитием у	1
кто ниже по своему	1
такие открытия наряду с	1
конечно довольно медленно и	1
разница лишь в том	1
выискивать подходящие друг к	1
и культура того народа	1
тем непрерывная традиция есть	1
в сознании всякого европейски	1
британии и проч в	1
стал проповедовать что его	1
его племя а только	1
увлекся процессом заимствования и	1
европейцы утверждают что общую	1
в течение своей истории	1
европеизированного не-романогерманского народа заключает	1
развились сообразно с этим	1
достоянием его соотечественников это	1
никто не может догадаться	1
говоря направление развития культуры	1
стали подвергаться европеизации имеют	1
романо-германским ученым объединить в	1
лежать эта точка? возможны	1
австралийцев и полинезийцев или	1
и кое-какие верные взгляды	1
круга можно лишь в	1
дикарь и кажется нам	1
грубой силе составлявшее существенную	1
показало это нам говорят	1
и капитализма то европейцы	1
нарисованные европейцами считаются признаком	1
и перенял многое лишнее	1
народ не окажет им	1
