полным приобщением мы разумеем	1
так думает шовинист и	1
древнейших предков романогерманцев так	1
возможны три случая во-первых	1
самоуверенных хотя зачастую и	1
так значительны как бы	1
том что предки современных	1
у всех социологов и	1
дальнейшем будут свободно изменять	1
в зависимости от среды	1
перенесен в область психологии	1
все-таки не в равных	1
заботе о наружности дикари	1
группу значит разница только	1
дикарей равноценными с культурой	1
культуры пороки и вредные	1
власть более решительных и	1
не усомнился и оно	1
европеизированному народу приходится держать	1
говорить что в таком	1
не в хаотическом беспорядке	1
в барине известное чудачество	1
на которой я пишу	1
изображающая путь пройденный культурой	1
и подобных источников более	1
собою те потребности которые	1
часто идет в сторону	1
вид эгоцентризма может быть	1
над всеми прочими сословиями	1
верным будет только одно	1
хотя мы примыкаем в	1
романогерманских т.е иностранных идеалов	1
и z у взрослого	1
которой числитель есть общая	1
и тем больше психология	1
и географических условий они	1
усвоили язык веру и	1
психику можно представить себе	1
навеянным предшествующими открытиями или	1
к психологии животных что	1
этим различиям присоединяются различия	1
сейчас стоит какой-нибудь застрявший	1
что противники всеобщей европеизации	1
народу одному принадлежит право	1
дело когда эгоцентризм распространяется	1
принять романогерманскую культуру можно	1
сделать никакого вывода о	1
историко-филологический факультет за господина	1
что таким образом современные	1
все у него хорошо	1
приобщение является только кажущимся	1
быть всякому что тот	1
чем максимальные человеческому уму	1
и предложите кому-нибудь не	1
предков романогерманцев так и	1
у европейцев военной техники	1
своими культурами и традициями	1
романогерманцев не имели никакого	1
ближе к а чем	1
подлежит сомнению что та	1
у него с нами	1
более или менее значительный	1
ибо в отдельных культурах	1
помещаются несколько ниже все	1
всеми прочими культурами земного	1
убеждения что такие люди	1
современных эскимосов и кафров	1
или социальной борьбе буржуазия	1
родной веры языка культуры	1
быстро становятся жертвою какого-нибудь	1
как ложные ведь если	1
в стремлении к полной	1
наше отношение к такой	1
ранняя историческая форма этой	1
несоизмеримости народов и культур	1
нашу мысль примером представьте	1
таким образом мало того	1
более или менее длительных	1
романогерманцами и постепенно отставая	1
видом общечеловеческой цивилизации на	1
истории благодаря постоянному общению	1
источника сверхъестественное откровение позволившее	1
европейцу шовинизм и космополитизм	1
эволюции поистине ужасны за	1
автор без всякого сожаления	1
нашли бы себе проявление	1
в этом народе совершенно	1
больше из приведенных выше	1
отрицательных последствий неизбежность эта	1
и детьми здесь будет	1
процесса подражания immitation особенность	1
установила вышеупомянутую лестницу а	1
они систематизированы правда не	1
оно тем не менее	1
принятие романогерманской культуры за	1
но отказ этот необходим	1
целый ряд поколений говоря	1
при этом у нас	1
должен в конце концов	1
коснуться еще одной подробности	1
бы господство народа а	1
состоянию чем в эпохи	1
новое открытие в то	1
европейца вид y’ z’	1
европы под цивилизованными народами	1
им точно также та	1
и индивидуальной психиками не	1
себя свою культуру и	1
при этом однако совершенно	1
же ходе истории все	1
носит именно такой характер	1
а в с и	1
правильности этого положения никто	1
и в дальнейшем будут	1
тех взглядов на национальный	1
земле основано на эгоцентрической	1
т.д в результате окинув	1
видоизменяет старые делая необходимым	1
культурными напр курение табака	1
ряда вопросов а именно	1
современному своему состоянию чем	1
природных романогерманцев но и	1
а и в следующее	1
более что он протекает	1
элементы культуры а проникнут	1
каждом этапе пути пройденного	1
господство постулируется для культуры	1
усвоению им новых культурных	1
результате получилось не приобщение	1
части у обоих сравниваемых	1
в может быть и	1
всякий конечно отнесся бы	1
такой проповеди никакого эгоцентризма	1
развитии благодаря длительному и	1
ними завязывается борьба за	1
следовательно связанными с чуждой	1
которые сумели вполне ассимилироваться	1
определить место этой культуры	1
наконец просто глупо только	1
победы кочевников над оседлыми	1
мы считаем уместным коснуться	1
и определить являются ли	1
эту культуру позаимствовавшего а	1
смысле начиная с воспроизведения	1
о возможности для целого	1
слова т.е свободному общению	1
же человечества которые несмотря	1
расценивает европеец и истории	1
той же культуры элементов	1
ведь шовинист хочет чтобы	1
не только с точки	1
каком-нибудь отношении оказывается сложнее	1
наконец для того чтобы	1
морю выработавшие в силу	1
выше всякой другой если	1
изобретателя так и у	1
результат регресса постепенного одичания	1
европеизации? на первый взгляд	1
чистых романогерманских народов или	1
ничем не выше всякой	1
товары фабричного производства таким	1
и трудному процессу постепенной	1
народа х присланному вести	1
этнографического человечества однако посмотрим	1
развитии человеком хотя и	1
национальный вопрос которые занимают	1
народами прежде всего опять-таки	1
большинство были близко родственны	1
от эгоцентрических предрассудков дается	1
он должен сознать что	1
отдаленные в самые отдаленные	1
многих других наших общих	1
такому представлению об эволюционной	1
другие аргументы имеющие вид	1
вполне т.е получить культуру	1
либо наконец как к	1
открытия заключается большею частью	1
говоря инвентарь культуры для	1
духовным укладом невозможна как	1
нормальной эволюции совершенно ясно	1
классификацию народов и культур	1
совершенно ясно что прыжки	1
больше отстает история европеизированных	1
то надо думать ему	1
и b заимствованных у	1
историю что только для	1
так как из них	1
народа имеются шовинисты проповедующие	1
эгоцентризм все-таки ясен и	1
не исчерпывается невыгодность положения	1
этнографические понятия европейская культура	1
что стоит на пути	1
этнографические понятия одураченные романогерманцами	1
они долго жили одною	1
семьи цивилизованных народов сначала	1
должны будут исчезнуть подчинившись	1
и наконец объединившиеся благодаря	1
не своего народа а	1
раса лучше всех остальных	1
все-таки не могут им	1
области не знает почти	1
и подгонять отсталые народы	1
особенности культур отдельных романо-германских	1
удовлетворению этих новых потребностей	1
недооцененный тардом наследственность дополняет	1
же европейцы романогерманцы или	1
по степени близости сходства	1
эволюции человечества самих себя	1
новую почву оказываются роковыми	1
приходится прививать через школу	1
многое из того что	1
что в психическом отношении	1
народов из того же	1
инородцам ассимилировавшимся с господствующим	1
нами два народа скажем	1
одним из главных условий	1
все привычки животных такие	1
расстояние ас будет равно	1
дикарей что каждый раз	1
уровня цивилизации в силу	1
наследственность однако ни то	1
слова человечество общечеловеческая цивилизация	1
особенностей в презрении ко	1
с романогерманцами однако при	1
данный момент у старшего	1
как оно существует в	1
оценят эти изменения романогерманцы	1
сделались приемлемыми для представителей	1
страсть к обобщениям и	1
биографии каждого отдельного субъекта	1
в историю какого-нибудь современного	1
чужой культуры каждое поколение	1
те открытия которые носят	1
но из всего предшествующего	1
черты наивной полудетской психологии	1
пытаются облекать его в	1
историю дикарей можно изобразить	1
иную то ясно что	1
центром вселенной венцом создания	1
было неминуемо все это	1
мы говорили выше социология	1
этот процесс вполне завершится	1
та или иная культура	1
дикарем так же трудно	1
или первобытные народы понятия	1
всего человечества а лишь	1
удовлетворения своих насущных потребностей	1
решений будет не а	1
и самоочевидной истиной которую	1
вид и поэтому более	1
двух культур тогда как	1
полабов и лужичан в	1
народами европейской культуры природные	1
органичности всего развития культуры	1
в одну кучу первобытных	1
быть приняты другими народами	1
основанные на этой душевной	1
голова дикаря набита основательно	1
развития алхимии кое-какие правильные	1
культура предков европейцев представляла	1
я пишу бела однако	1
культурой дикаря не имеющей	1
совершенств на самом деле	1
смесью культур а и	1
создают в результате некоторую	1
первыми пробуждениями первобытного искусства	1
удовлетворять данную потребность при	1
того перегруженные работой в	1
же мало способны проникнуться	1
целом настолько физически сильно	1
на второй из поставленных	1
современные дикари представляют из	1
момент представляет из себя	1
установлении в европейских странах	1
и сейчас стоит какой-нибудь	1
народа всегда развит чрезвычайно	1
тем более сколько-нибудь достоверных	1
может быть заложено ничего	1
что указывало бы на	1
римской культуры и сильно	1
схеме эволюции человечества которую	1
достоинством данного произведения в	1
все только что сказанное	1
чудачество и черты наивной	1
обман сохраняет свою силу	1
имеет свою культуру ибо	1
англию воспитали в колледже	1
из борющихся сторон поэтому	1
том чтобы народ-победитель в	1
поверхностными в научной литературе	1
европейские эволюционные науки в	1
приблизительно одинаково чтобы их	1
какого-нибудь другого иностранного народа	1
это эпитетом варварства европеизированный	1
удобным для практических целей	1
чертежа ограничен окружностью нашего	1
не следует чтобы самое	1
сравните с этим детально	1
в этом представлении играет	1
и проч чем объясняется	1
если она не кончается	1
экономии национальных сил европеизированного	1
должна представиться романогерманцу как	1
самых просвещенных европейских гуманистов	1
европейцы давно уже прошли	1
даже эта враждебность имеет	1
различная цвета кожи стонут	1
в глазах европейцев на	1
культуры само проникнуто эгоцентризмом	1
романизацию аппенинского полуострова нельзя	1
другие народы которые приняли	1
своему соплеменнику если бы	1
неподвижности или застою таким	1
расчленение нации вызывает обострение	1
путь пройденный культурой данного	1
как проявление первобытной дикости	1
та же участь достаточно	1
между отцами и детьми	1
между людьми вся его	1
и того же народа	1
данный момент представляет из	1
родного ему национального характера	1
устами говорит воля к	1
народа если социальные различия	1
предшествующую историческую эпоху отличалась	1
но и с точки	1
которой мы говорили выше	1
радиуса ав т.е больше	1
материальной культуры и для	1
и все что тождественно	1
при помощи этой ценности	1
романизированных провинций была всегда	1
знаем у европеизированного народа	1
культуры будет тем сильнее	1
таким образом оба стимула	1
шара и подчинении их	1
с ярко выраженной эгоцентрической	1
из собственного детства но	1
что все эти доказательства	1
дикари суть иначе говоря	1
основано на этом оптическом	1
целом ряде важных пунктов	1
нам то непосредственное впечатление	1
строившихся на нем европейские	1
и создавать сразу ex	1
сильно перемешавшиеся между собой	1
становится до некоторой степени	1
приспособления для передвижения романогерманцы	1
останавливались на разных точках	1
сломить такой эгоцентризм труднее	1
среди славян арабов турок	1
другом ряд общих культурных	1
неизбежность эта остается независимо	1
агрессивен получает и заслуженные	1
скачущая эволюция еще больше	1
были дикарями и что	1
комбинаций в различных пропорциях	1
созданных природными романогерманцами таким	1
в романогерманской цивилизации где	1
а семья с покон	1
скачущей эволюции поистине ужасны	1
не без влияния подражания	1
культурах при таком представления	1
согласно такому представлению об	1
ценностей следовательно этот общий	1
недостаток своей культуры конечно	1
у народа с однородной	1
и заставить их призадуматься	1
круга изображает максимальное отличие	1
которые часто признаются с	1
осуждают но практически допускают	1
что голубой должен стоять	1
случаем культурного заимствованная о	1
сентиментальные европейские филантропы и	1
за соответствующее вознаграждение во	1
дикаря утратится а а	1
благоприобретенными всегда производит впечатление	1
удалось это сделать и	1
прилагается европейскими учеными как	1
в семье социалистических народов	1
неизбежности европеизации и ее	1
цвет человечества не вызывает	1
традицию культуры в а	1
то настоящие европейцы всегда	1
очевидность эта не объективна	1
народов имевших общую историю	1
и наконец свои шовинизм	1
она не выше и	1
так же часто идет	1
только если они верно	1
а и поэтому мы	1
которые обособляют культуру отдельных	1
наивной полудетской психологии несмотря	1
культурными ценностями его можно	1
раньше культурной ценностью в	1
распространяется на более широкую	1
говорить о степени совершенства	1
передает традиции этой новой	1
из этого круга можно	1
круга им уже не	1
строя европейцам пришлось бы	1
при антропологическом смешении таковы	1
бы европеизация является неизбежным	1
психическом отношении оба ребенка	1
по своему развитию ниже	1
все что отличается от	1
с этим европейские ученые	1
чрезвычайно тяжелые условия усвоения	1
племена земного шара по	1
современной романогерманской строго говоря	1
z’ элементы x z	1
общаясь с простым народом	1
все же все упомянутые	1
признать несравнимыми и несоизмеримыми	1
племени кодекс его морали	1
что их психика должна	1
частей d окажется для	1
на другую то каждый	1
это человечество объединилось в	1
спорадичности таких ощущений отсталости	1
на нашу будет нам	1
субъективной эгоцентрической психологией таким	1
в общем безразлично принять	1
культуры таким образом в	1
правильного разрешения задачи здесь	1
поэтому такой народ с	1
переходный цвет находился между	1
взрослых детей при соприкосновении	1
над другим надо считать	1
романогерманцев и их оценку	1
однако сами никогда своих	1
все эти элементы будут	1
последствиями? в последующем изложении	1
уже привыкли пользоваться для	1
может рассматриваться как отсталый	1
на прежней высоте и	1
по степеням совершенства новый	1
романогерманцев все-таки будут с	1
с каким-нибудь не-романогерманским народом	1
здесь гораздо меньше чем	1
же направлении в том	1
распространенный но еще менее	1
лишь как на одну	1
саму грецию так что	1
максимального отличия от современных	1
на эгоцентрической психологии как	1
эволюция еще больше растрачивает	1
народов европы является лишь	1
между тем с такой	1
в виде с’ и	1
дробь в которой числитель	1
знают лишь одно мерило	1
для успешного дальнейшего развития	1
народ стоит и топчется	1
мы должны выяснить те	1
адресу болгария софия университет	1
в крайне невыгодное положение	1
