культуре созданной другим народом	5
к культуре созданной другим	5
о котором идет речь	5
которых мы говорили выше	4
в том случае если	4
до сих пор не	4
о которых мы говорили	4
народа к культуре созданной	4
лишь в том что	3
целого народа к культуре	3
отличаются друг от друга	3
о которых идет речь	3
заключается в том что	3
из элементов уже существующих	3
одного и того же	3
приобщение к чужой культуре	3
в каждый данный момент	3
уже существующих культурных ценностей	3
не подлежит сомнению что	3
совершенно так же как	3
слагается из элементов уже	3
возможно ли полное приобщение	3
европейской культуре поскольку такое	2
народами а и в	2
убежденные в том что	2
поставленных выше вопросов на	2
народов и культур не	2
указывают на то что	2
возможно благом или злом?	2
между народами а и	2
народ о котором идет	2
культур ныне существующих или	2
чем больше отличается культура	2
сходства с современными романогерманцами	2
как бы то ни	2
лишь в том случае	2
знаем и то что	2
ли приобщение к европейской	2
поскольку такое приобщение возможно	2
по своей культуре и	2
что как сказано выше	2
несмотря на то что	2
сохранятся и при социалистическом	2
полное приобщение к чужой	2
носят на себе отпечаток	2
мы все же не	2
этнологии антропологии и истории	2
положение по отношению к	2
народов и культур по	2
элементов уже существующих культурных	2
национальной и иноземной культуры	2
еще не следует чтобы	2
нога в ногу с	2
народы которые по своей	2
другом узами родства и	2
вопрос возможно ли полное	2
по сравнению с общим	2
два человека принадлежащие к	2
выше мы сказали что	2
те народы которые по	2
объективно доказать что культура	2
а т.к европеизированный народ	2
которой врожденные черты преобладают	2
полное приобщение целого народа	2
частного случая европеизации по	2
идти нога в ногу	2
к европейской культуре поскольку	2
в то же время	2
бы то ни было	2
круга в этом случае	2
элементов национальной и иноземной	2
европейская культура не есть	2
нечего и говорить что	2
культуре поскольку такое приобщение	2
прочих культур ныне существующих	2
совершеннее всех прочих культур	2
культурная работа европеизированного народа	2
на вопрос возможно ли	2
аргументы в пользу превосходства	2
выше вопросов на вопрос	2
что культурная работа европеизированного	2
у европеизированного народа всегда	2
друг от друга именно	2
можно ли объективно доказать	2
первое время после заимствования	2
существующих или когда-либо существовавших	2
общий запас культурных ценностей	2
большего или меньшего сходства	2
указанных выше причин не	2
приобщение возможно благом или	2
наивно убежденные в том	2
равноценности и качественной несоизмеримости	2
культуры у народа в	2
к современному своему состоянию	2
из поставленных выше вопросов	2
приобщения к чужой культуре	2
которые носят на себе	2
что до сих пор	2
национального тела европеизированного народа	2
с другом узами родства	2
в том что дикари	2
расчленение национального тела европеизированного	2
всех прочих культур ныне	2
без антропологического смешения обоих	2
которые по своей культуре	2
с европейской точки зрения	2
такое приобщение возможно благом	2
друг с другом узами	2
о которой мы говорили	2
отличающиеся от современных романогерманцев	2
узами родства и общей	2
приобщение к европейской культуре	2
когда-либо существовавших на земле?	2
ли объективно доказать что	2
является ли приобщение к	2
в которой врожденные черты	2
ее начало и конец	2
приобщение целого народа к	2
антропологии и истории культуры	2
и культур не может	2
и без того уже	2
сравнению с общим случаем	2
романогерманцев совершеннее всех прочих	2
основано на оптическом обмане	2
европеизации по сравнению с	2
открытие слагается из элементов	2
европейской этнологии антропологии и	2
или когда-либо существовавших на	2
превосходства романогерманской цивилизации над	2
народу о котором идет	2
и при социалистическом строе	2
что же касается до	2
надо принять во внимание	2
для того чтобы быть	2
только черты врожденной психики	2
случая европеизации по сравнению	2
ныне существующих или когда-либо	2
но загипнотизированные их престижем	1
соотношение врожденной и благоприобретенной	1
народы древности т.е те	1
колониальную политику и вандалистическое	1
благоприобретенные черты стоят в	1
распространения открытия заключается большею	1
некоторые черты наблюдаемого покажутся	1
степени чуткости один немного	1
смертью в пьяной драке	1
стоять уже малокультурные народы	1
образом должно действовать отсутствие	1
группой с этим понятием	1
дело идет об этнических	1
в ученых работах но	1
этапе пути пройденного человечеством	1
сущности эгоцентрических предрассудков далеко	1
же промежуток времени создадут	1
и от эгоцентрических предрассудков	1
как будто неизбежна все	1
или конца эволюции объективно	1
венец эволюции человечества самих	1
в оживленное культурное общение	1
вывезли в англию воспитали	1
частях разных социальных группах	1
индивидуального брака тем не	1
две стороны одного и	1
и отсталости постепенно приводит	1
поступает космополит отрицает различия	1
х типу утратившему всякое	1
что во-вторых полное приобщение	1
субъекта человеком остановившимся в	1
а эклектизм синтез нескольких	1
призрачность этого аргумента становится	1
тюрко-болгар к культуре славян	1
существом не то уродливой	1
не благом а злом	1
ближе к современному своему	1
сопротивляться то для того	1
это взрослые дети с	1
надо сказать что при	1
себя чудовищное petitio principii	1
отвечать этому требованию и	1
убеждения этих чудаков большею	1
условия чем работа природного	1
единое целое отдельные части	1
через которую европейцы давно	1
прогресса если допустить что	1
и мечем водворить тот	1
будем признать что между	1
открытие становится фактом социальной	1
и люди с более	1
совершенно в таком же	1
а позаимствовавшего ее будет	1
эгоцентризм труднее чаще всего	1
указывают на эллинизм и	1
как на отсталых остановившихся	1
а раз европейская наука	1
культуру народа в спрашивается	1
одной стороны мешать плодотворной	1
самой совершенной из всех	1
средневековья эти примеры показывают	1
должно быть едино и	1
на природу социальных процессов	1
для европейца совершенной чуждой	1
культуру состоящую исключительно из	1
расположил бы их европейский	1
в эти первые шаги	1
с европейцами борьба кончается	1
культуры то ему и	1
эгоцентризма редки и обыкновенно	1
ценностей у обоих народов	1
принять не только внешний	1
позиции которые может занять	1
конечно на все народы	1
культур его народу одному	1
антропологических типов таким образом	1
заимствовании чужой культуры каждое	1
этого последнего человеком близким	1
до себе еще для	1
шовинизма что силой победить	1
военного господства как бы	1
они имелись в младенчестве	1
как сказано выше всякое	1
европейца их умственные багажи	1
классы сословия профессии представляют	1
вполне на свои составные	1
будет считать психологию наблюдаемого	1
bulgarie sofia universite’ faculte’	1
национальными особенностями в такой	1
в пользу превосходства романогерманской	1
европеизация неизбежной? как бороться	1
и историкам культуры где	1
определенной этнической группы германские	1
а для этого нужна	1
руководствоваться не своей собственной	1
дал увлечь себя а	1
должна коренным образом измениться	1
она имеет другой вид	1
детстве вся психика состоит	1
пор не могла выработать	1
марки и вернувшихся в	1
романогерманцев должна попасть в	1
сам народ в будет	1
своем развитии благодаря длительному	1
бы называть откровенно общероманогерманским	1
эволюции неизбежно погибнет бесцельно	1
том ложном пути на	1
в создавшего культуру и	1
которую именно поэтому нельзя	1
других племен которые все	1
тем вопрос о превосходстве	1
человечества эта страсть к	1
как разные этапы общего	1
к культуре собственного народа	1
удается но крайние ее	1
положение культура а в	1
индивидуальных у них обоих	1
армию заводы фабрики и	1
европейской культуры все последние	1
эти две культуры различны	1
и от эгоцентризма проникающего	1
что сказанное может породить	1
проявление первобытной дикости объективных	1
ужасный вопрос что если	1
дикарей призрачность этого аргумента	1
в вышеуказанном порядке то	1
за тем чтобы ни	1
в конце концов неизбежно	1
культур подлежащих группировке не	1
цивилизация и прочее являются	1
культ императора другие же	1
то для того чтобы	1
социализм возможен только при	1
открытий таким образом оказывается	1
сущность его состоит в	1
от традиции его семьи	1
романизация в этих областях	1
самой культурной ценности или	1
следует искать конечно в	1
течением времени к ним	1
может быть вполне очевидно	1
выгодные условия чем работа	1
в строжайшие рамки и	1
начало или конец эволюции	1
в риме конечно разумели	1
полно воспринимает духовную культуру	1
ценности в прошлом что	1
отношениях сложнее культуры дикаря	1
как бы синтез элементов	1
естественно придется проектировать точку	1
трудом нетрудно понять к	1
и темпераменты тех кто	1
убедился благодаря нескольким случайным	1
всему этому европейский космополитизм	1
том что развитие европейцев	1
англию так что от	1
наделенным чертами детской психики	1
которую испытывают космополиты по	1
историческую эпоху второй случай	1
малокультурных или первобытных народов	1
как сильно отличающиеся по	1
половой жизни к семейному	1
положения как ложные ведь	1
выше причин не в	1
таким инородцам ассимилировавшимся с	1
настроенных групп при чем	1
общее черты общемлекопитающей и	1
случайным встречам им нужно	1
этот человек принадлежит признается	1
не противодействующие своей отсталости	1
ученый но по другим	1
тем началам которые обособляют	1
собой и общую сумму	1
что все их члены	1
сознать что как тот	1
на прямой линии при	1
высшие классы приняли иноземную	1
надо жертвовать национальными особенностями	1
в свою очередь совершеннее	1
очень определенные этнографические понятия	1
или с уже признанной	1
из этих ценностей вытесняется	1
долго и логически доказывать	1
но не подлежит сомнению	1
новшеств и открытий и	1
первобытными народами основанные на	1
обозначим их через b	1
культуры европеизированный или стремящийся	1
расовой племенной семейной и	1
культуру позаимствовавшего а были	1
вершина романогерманской цивилизации покоится	1
культуры в общей эволюции	1
цель достигнутой с другой	1
романогерманцами основан еще один	1
собой на основании этих	1
черты животной психики которые	1
проявляют отсутствие объективности они	1
образом от тех элементов	1
этот аргумент который можно	1
смесь древней греческой культуры	1
эволюции объективно мы находим	1
господина доцент н с	1
окажется для европейца совершенной	1
таким же образом как	1
ее совершенно так же	1
нельзя ибо в отдельных	1
романогерманцев до сих пор	1
при социалистическом строе как	1
с большою быстротою и	1
привести в порядок культуру	1
будут принадлежать к одному	1
идеологами не чувствуя подводных	1
внесен чисто субъективной эгоцентрической	1
народа но даже когда	1
создатель культуры и заимствователь	1
вопросов на вопрос можно	1
потому романогерманцы признают себя	1
наблюдаемого исключительно элементарной усматривая	1
папуасе которого вывезли в	1
в противоречие причем эта	1
тому же пропитанный как	1
мы возьмем теперь европейского	1
без всякого сожаления навсегда	1
промышленной жизни в других	1
приобщение народа к культуре	1
народы азии письменность государственность	1
борьба за первенство duel	1
не чувствуя подводных камней	1
с лежит за пределами	1
голос представителя народа в	1
и потому они обыкновенно	1
самой сущности европеизации и	1
отдельных этнических групп входящих	1
имеющихся налицо у данного	1
романогерманские историки культуры со	1
у европеизированного народа а	1
отдаленных предков современных романогерманцев	1
культурой романогерманской таких европейцев	1
от себя эти неприятные	1
в данном случае не	1
свою национальную физиономию ко	1
заимствовавшем чужую культуру каждое	1
которые вытекают из этого	1
и внесен чисто субъективной	1
на то что европейская	1
принцип разделения труда неминуемо	1
общего с психологией и	1
таким образом все эти	1
себя представитель в за	1
пределами шовинизмом с одной	1
из области общей социологии	1
природным романогерманцам вследствие этого	1
культуру которую в совместной	1
коммунизм анархизм все это	1
исконные романогерманцы хотя бы	1
фамилиями и антропологическими признаками	1
традиции новой заимствованной культуры	1
ибо ввиду отрицательности понятия	1
обмане мы воспринимаем в	1
не может признать положения	1
имеют между собою иного	1
у животных истолкует эту	1
каждый имеет свою культуру	1
такого что указывало бы	1
говоря настоящий прогресс наблюдается	1
свергающая аристократию столь же	1
добросовестно пытались ассимилироваться с	1
без предубеждения вникнуть в	1
общем довольно бесцельны такие	1
нам всегда неправильно с	1
об эволюции и постараться	1
римской колонизации и римского	1
отличия вносимые расовой племенной	1
двадцатого века прошли в	1
врожденной психики и уже	1
существование и приспособления к	1
ценностями с которыми они	1
на отвержении тех начал	1
и предписания этикета иногда	1
до романогерманского шовинизма так	1
на то что представление	1
психике взрослого европейца нет	1
совершенстве изучил жизнь окружающей	1
враждебно настроены ко всяким	1
психика будет казаться тем	1
результате на все три	1
в сознании общества между	1
совершеннее всего что на	1
народ приучается презирать все	1
заставить славянина насторожиться? почему	1
допустить что такое представление	1
открытии между сталкивающимися ценностями	1
ряд общих культурных ценностей	1
должна быть отвергнута и	1
lettres mr n troubetzkoy	1
что многие из них	1
романогерманцы хотя бы это	1
самого представления об эволюции	1
объективная наука установила вышеупомянутую	1
конца римского владычества когда	1
еще различия во вкусах	1
над оседлыми народами а	1
тем мы знаем что	1
все это делает совершенно	1
надеяться на то что	1
культурном отношении выше нас	1
еще больше растрачивает национальные	1
элемент а будет несколько	1
более сложные чем соответствующие	1
и тюрко-болгар к культуре	1
сознании всякого европейски образованного	1
словом дикарь выше мы	1
и искоренению остатков национальной	1
всеми усовершенствованиями европейской техники	1
вся эта лестница представляет	1
причем россия усвоила именно	1
общеживотной психологий этих черт	1
все же они существуют	1
понимает в другом только	1
распространения открытий propagation des	1
особенно ярка европейцы совершенно	1
эгоцентрическая психология особенно ярка	1
y z у европейца	1
усвоили тот дух который	1
можно отнести на долю	1
он все же никогда	1
всех этих понятиях тем	1
этой цивилизации в основе	1
горизонтальную плоскость вместо принципа	1
эволюционной лестнице помещаются несколько	1
господствующим народом даже та	1
может столкнуться и вступить	1
