ниже истинно взрослых европейцев	1
и там усвоила методы	1
облекать его в научную	1
или преклонения перед достоинством	1
открытий у европеизированного народа	1
себя довольно пеструю смесь	1
европеизация как будто неизбежна	1
господство которого в данном	1
эскимосов и кафров еще	1
психологической точки зрения весьма	1
работа его в значительной	1
между ними нет что	1
черты благоприобретенные но основанные	1
этом народе совершенно параллельно	1
на следующей точке и	1
разнородных культур греко-римского мира	1
вместе с тем устанавливающий	1
разрабатывать целую систему основанную	1
отношение к половой жизни	1
набита основательно несмотря на	1
последствием наличности у европейцев	1
полученными уже ответами на	1
культурное расчленение национального тела	1
правителей и руководящих политических	1
силы лишь на согласовании	1
как бы топчась на	1
мы говорили выше на	1
и более или менее	1
если народ не окажет	1
открытия типа a+a всеми	1
же уверена в своем	1
менее играет самую выдающуюся	1
как и в нашем	1
эгоцентризм романогерманец считает высшим	1
том случае если бы	1
такая оценка чужой психики	1
в начале этой работы	1
дальнейших открытий и это	1
открытий должны чрезвычайно вредно	1
космополит со своей стороны	1
либо на оптическом обмане	1
объективных научных методов ни	1
японцы на этой позиции	1
новым рассадником капитализма но	1
касается до милитаризма и	1
иноплеменным народам те произведения	1
она зависит не от	1
от современных романо-германцев по	1
других европейских теорий основанных	1
не имеющей ничего общего	1
народами основанные на особенностях	1
вестись эта переоценка не	1
пропитанный как и все	1
но все же они	1
друга непохожие например эскимосы	1
труда на непроизводительную работу	1
при классовой или социальной	1
наших но психология в	1
поэтому мы всегда вправе	1
это не случайно социализм	1
подражанием чужим открытиям отсталость	1
они вовсе не принадлежат	1
столкновение в индивидуальном сознании	1
китая гиксов к культуре	1
не мог удержаться многие	1
последствиями этой стороны европейской	1
европой народу о котором	1
типа a+b значительная часть	1
земле? возможно ли полное	1
понятны и доступны только	1
а так как из	1
оказываются осуществленными в быте	1
борьбе за существование в	1
порядке оно может только	1
что та работа как	1
в силу общих этнографических	1
незачем будет заимствовать непременно	1
отдельных европейских социологов которые	1
различие между отцами и	1
своих собственных доморощенных нечего	1
в университет вскоре однако	1
считается последним криком цивилизации	1
стремление к полной европеизации	1
романогерманцев но величины большие	1
если господствующее в европейской	1
и например в вопросе	1
культуры между тем европейская	1
культуре наиболее соприкасаются и	1
согласованием элементов двух разнородных	1
человечество общечеловеческая цивилизация и	1
еще один аргумент в	1
различия в этом народе	1
в целом есть наивысшее	1
на национальный вопрос которые	1
к шовинистам и вообще	1
следует чтобы самое решение	1
исторический аргумент самый веский	1
выше и кто ниже	1
являются в лучшем случае	1
это необходимо во-первых потому	1
россия взяв из европы	1
национальной культуры и предается	1
его душе сейчас же	1
навсегда отказаться как от	1
то же время сохраняют	1
это элементы x y	1
и топчась на следующей	1
европейской культуры и доверчиво	1
общения с романогерманцами делает	1
предрассудков от кумиров общечеловеческой	1
подражательном стремлении пошла гораздо	1
ценности можно назвать общим	1
существующие в настоящее время	1
народов полнее приобщившихся к	1
эти прыжки нарушают весь	1
животные в свою очередь	1
и подражанием чужим открытиям	1
оптическом обмане этот обман	1
а нашего чертежа ограничен	1
время от времени различие	1
лиц здесь отпор тоже	1
доступны только те черты	1
немцев лишь их военную	1
антикультурное начало эгоцентризм положение	1
от северо-американских дикарей что	1
и сильно перемешавшиеся между	1
жалкую и трагическую участь	1
все же являются скорее	1
сразу ex abrupto то	1
или стремящийся к европеизации	1
этот глубоко вкоренившийся эгоцентрический	1
при распространении столкновение ценностей	1
гордости и приверженностью к	1
поколение вырабатывает свою смесь	1
ex nihilo nihil fit	1
рассуждения в общем довольно	1
не доказуемы как не	1
психика европейца по тем	1
медленно и с затруднениями	1
эту традицию приходится прививать	1
одинаковом порядке оно может	1
максимально отличающимися друг от	1
но для этого нужны	1
романогерманцев состоит скорее в	1
шовинизм и в космополитизм	1
имело исторических прецедентов из	1
европейской культуры максимально а	1
колонией и европеизируют его	1
не окажет им сопротивления	1
сознанию их превосходства над	1
первобытных то европейский ученый	1
человечество общечеловеческий цивилизация мировой	1
очень мало отличается от	1
дальше отстоит от него	1
наконец третий случай с	1
культурного заимствованная о которой	1
путем подражания старшим культуру	1
предрассудками труднее освободиться от	1
дикарь хороший дикарь-охотник обладающий	1
словом создаются такие условия	1
градации народов и культур	1
на этой мысли прилагать	1
более резкой чем у	1
ввиду того что именно	1
умерялась здоровым инстинктом национальной	1
во всем ассимилироваться с	1
культура во многих отношениях	1
из непременных условий непрерывности	1
социологии мы можем приступить	1
с уже существующим общим	1
и некоторые несомненно целесообразные	1
чем у европейцев не	1
наконец более или менее	1
дикаря в предшествующую историческую	1
него хуже поэтому всякая	1
появятся люди которые будут	1
a+a всеми этими тормозами	1
европеец толкует черту x’	1
начале своей деятельности хотел	1
происхождения этот процесс чрезвычайно	1
на свои составные части	1
остановившихся в своем развитии	1
уродливой не то комической	1
что рано или поздно	1
им сопротивления европейцы завоюют	1
их на прямой линии	1
происходила с большой постепенностью	1
на остальные части народа	1
своей европеизации этот народ	1
положение их рабов итак	1
с трубецкой bulgarie sofia	1
европе под это представление	1
самое необходимое но в	1
восемнадцатый век прошел для	1
эгоцентризма может быть оправдан	1
пытались ассимилироваться с культурой	1
строжайшие рамки и при	1
в мире если мы	1
проявление взрывами гомерического смеха	1
ясно что их психика	1
момент оценки должен быть	1
на эгоцентрической психологии должен	1
постепенность исторического развития разрушают	1
людей вполне освободиться от	1
поправки с точки зрения	1
на тех кто отвергнет	1
в состоянии то ему	1
стремлении пошла гораздо дальше	1
романизация более отдаленных провинций	1
в в самом народе	1
близкий к романогерманскому таким	1
работе словом создаются такие	1
такое вооруженное состояние части	1
норме усвоения данного положения	1
каждым поколением элементы старой	1
все прочие культуры есть	1
черту совершенно так же	1
вопросов а именно можно	1
о них мы говорили	1
многочисленные анекдоты о европейцах	1
в теперь мы должны	1
его успевают сменить друг	1
полного приобщения к чужой	1
уже слабо развитую у	1
сильнее чем у народа	1
хроническое запаздывание уровень сохраняется	1
часть психики дикаря как	1
до истории не-романогерманских народов	1
к историческим традициям но	1
способа удовлетворять данную потребность	1
теоретическая так и практическая	1
народов эта психология должна	1
которого надо привести в	1
наивно наконец просто глупо	1
с современными романогерманцами момент	1
слова что ни одна	1
на шовинистические домогательства иностранцев	1
этой области между двумя	1
либо как к одураченному	1
признает ценным лишь то	1
эгоцентризме нет высших и	1
в начале этой главы	1
увлечь себя а может	1
космополитизм эта вершина романогерманской	1
что в таком же	1
заключающие в себе никаких	1
что это есть не	1
надо отожествлять смешение культур	1
и антропологические особенности но	1
этой новой смеси поколению	1
для всех них запас	1
над культурами других народов	1
запас культурных ценностей иначе	1
окрашенных в один общий	1
и продолжать развивать свою	1
совершенно не считаясь с	1
с особенностями социалистического хозяйства	1
европейца если мы к	1
на все эти вопросы	1
итальянцев а затем подвербовывавших	1
последствиях которые вытекают из	1
первобытная культура тот факт	1
культура этого народа похожа	1
европейцев была ближе к	1
образом и в жизни	1
историческими прыжками не имея	1
просто нет из предыдущего	1
к народам по своей	1
наличность этого одинакового запаса	1
даже при достижении максимальной	1
полуострова нельзя рассматривать как	1
которые уже более ти	1
будто неизбежна все только	1
стоять не налево а	1
в себе и элемент	1
эта эволюционная лестница иметь	1
противоречие причем эта взаимная	1
это ставит его в	1
одной стороны фабрики и	1
основной цели все же	1
очевидно что с европеизацией	1
из него все соки	1
цепи быстро построили всю	1
не вечны они возникли	1
рассматриваться как отсталый а	1
виде европейца либо пугаются	1
культурную ценность за деятельностью	1
жизни из элементов своей	1
сущности того что европейцы	1
последствий о которых мы	1
двух эгоцентрически настроенных групп	1
они постепенно поддавались гипнотизму	1
об отношении действительности к	1
на субъективном и отрицательном	1
шовинизмом с одной и	1
романогерманских государств не играет	1
и если бы при	1
национальную физиономию на общероманогерманскую	1
шовинизм а сам не	1
к культуре немцев таким	1
развитию остатков собственной национальной	1
должны быть уничтожены цивилизованное	1
и в целом ряде	1
создателя не противоречили психическому	1
и самого себя свой	1
значит разница только в	1
романогерманцев надеяться на то	1
нечего ссылаться на исторические	1
исправиться от этих недостатков	1
эта традиция тоже станет	1
романогерманской культуры данной эпохи	1
себя совершенно так же	1
известное хроническое запаздывание уровень	1
то ему приходится ограничиваться	1
казаться детскими чертами благодаря	1
позаимствовавшего а были народы	1
дикари при виде европейца	1
столь же родной как	1
ученым объединить в одну	1
ли полное приобщение народа	1
с психологией и культурой	1
бы смотрели на нее	1
свою очередь совершеннее растений	1
и что голубой должен	1
читателей на время отказаться	1
что при заимствовании чужой	1
тут-то и возникает ужасный	1
европейцы просто приняли за	1
что несмотря на всю	1
и будут казаться наблюдателю	1
трудному процессу постепенной культурной	1
указание на то что	1
поверил аргументу представителя а	1
сливаются в одно культурное	1
материала умственной жизни дикаря	1
имела другой вид и	1
и не может быть	1
только такие которые имеются	1
этика отвергает решение вопросов	1
история культуры станут настоящими	1
почти всю целиком а	1
присоединить еще различия во	1
тон родного ему национального	1
уже малокультурные народы и	1
чем отдавать на сторону	1
семь квадратиков из которых	1
рядом и культуры малосходные	1
чертами детскими нечего и	1
которого немыслим социализм еще	1
достаточно упомянуть талантливого французского	1
животное сохранит как x	1
поистине ужасны за каждым	1
эта психология должна быть	1
относятся европейскими учеными в	1
греческой культуры вынесло на	1
с законом вечного отставания	1
его национального тела очень	1
логически то не менее	1
всегда может рассматриваться как	1
усвоение культуры чужого народа	1
кстати что такая оценка	1
в а традицию смеси	1
к культуре древнейших предков	1
отдельных элементов романогерманской культуры	1
и изгнав его последствия	1
ученых работах но все	1
хотя европейцы и пытаются	1
внимания тот факт что	1
для дикарей что многие	1
сама до себе еще	1
гуманистов разбирать его логическую	1
с европейцами он принужден	1
концу этого века умы	1
таких основаниях которые коренным	1
европейцев мы не знаем	1
в своем развитии представителей	1
почти неизбежным дополнением борьбы	1
здесь во всей красе	1
первоначально собирались взять из	1
необходимое но в дальнейшем	1
может наблюдать ее и	1
сразу сделался бы новым	1
общего с европейской часть	1
что он протекает очень	1
и у нас т.е	1
в общие запасы культурных	1
вносятся тою чертой романогерманцев	1
низшим все что отличается	1
делает его отсталость роковым	1
наивысшее достижение цвет человечества	1
знает что квадратики первоначально	1
его в зависимое положение	1
варварами и хотя часто	1
последние ближайшие к нашим	1
большая или меньшая сложность	1
нам пришлось ответить отрицательно	1
ее истинной эгоцентрической подкладки	1
идею сверхнациональной мировой цивилизации	1
указаниями разума логики что	1
о дикарях подробности стоящей	1
наблюдателя культурой они останутся	1
и несоизмеримыми между собою	1
с другом общие элементы	1
связаны с элементами культуры	1
уже и со своим	1
и сумма возможных открытий	1
народы по существу совершенно	1
в каждый имеет свою	1
возможных открытий далеко не	1
не менее играет самую	1
врожденные черты а благоприобретенных	1
а позднее и алкоголизмом	1
этом случае расстояние ас	1
как на исходящую от	1
конце концов европеизироваться вполне	1
делу и подходить к	1
и полинезийцев или сложнейшие	1
и предается слепому подражанию	1
первоначально тоже были дикарями	1
составные части и заключает	1
европейца стоящего в точке	1
семья существует официально покровительствуемая	1
всех указанных выше причин	1
этой классификации лестницу ступеней	1
во-вторых отпечатка личности творца	1
неправильно с перевесом на	1
сохранится без изменений но	1
такие крайние проявления эгоцентризма	1
а это достижимо лишь	1
культуры как известно элемент	1
более или менее далекие	1
двум младенцам прибавим еще	1
таким образом по отношению	1
общежитию в широком смысле	1
в то что бессознательная	1
культуре египта варягов и	1
европейца а вследствие этой	1
заключают в себе и	1
мере восприняли романогерманскую культуру	1
очень много но все	1
всего назвать эгоцентризмом человек	1
некоторых врожденных индивидуальных у	1
для каждого поколения полученная	1
непохожей на нашу будет	1
историю какого-нибудь современного дикого	1
в том что как	1
долю народов менее культурных	1
особые болезни приносимые европейскими	1
им поднесли под видом	1
угоду европейской наконец не	1
от современных романогерманцев по	1
то станет понятным что	1
и единственным носителем всех	1
европеизации этот народ роковым	1
работой романогерманского народа в	1
народы и наконец совсем	1
всеобщей европеизации должны мечтать	1
приобретут неоспоримый авторитет то	1
косности и отсталости постепенно	1
поскольку открытие является всегда	1
будет тем сильнее преобладать	1
и заключает в себе	1
виде в котором они	1
софистикой и жонглируем общими	1
те последствия которые вытекают	1
а направо от него	1
традиции прежней национальной культуры	1
и к разрешению интересующего	1
заметим что при этом	1
