в то же время	18
той или иной степени	13
в той или иной	13
говорящий человек и его	12
человек и его слово	12
и т п в	8
но в то же	7
ввода и организации разноречия	7
организации разноречия в романе	6
и организации разноречия в	6
и в то же	6
говорящий человек в романе	5
темы о говорящем человеке	5
во всех его моментах	5
в пределах одного высказывания	5
в истории литературного языка	5
всегда в той или	4
с чужим словом в	4
в пределах того же	4
как мы уже сказали	4
большей или меньшей степени	4
с одной стороны и	4
в этом случае она	4
слова к своему предмету	4
единого и единственного языка	4
языков в пределах одного	4
с чужим словом и	4
в каждый данный момент	4
в большей или меньшей	4
и его слово как	3
в романах второй линии	3
слова среди чужих высказываний	3
точки зрения на мир	3
ориентация слова среди чужих	3
и разновидности двуголосого слова	3
и в истории литературного	3
его последней смысловой инстанции	3
языка в смысле системы	3
от последней смысловой инстанции	3
и т п все	3
во всех областях жизни	3
между словом и предметом	3
все они могут быть	3
между языком и материалом	3
то есть как раз	3
никогда не может быть	3
те или иные моменты	3
можно прямо сказать что	3
последней смысловой инстанции произведения	3
установкой на образ языка	3
не выходит за пределы	3
куда куда вы удалились	3
в большинстве поэтических жанров	3
не исчерпывает себя в	3
социальных языков в пределах	3
с установкой на образ	3
в узком смысле в	3
в одной плоскости с	3
и его слово в	3
одно без другого невозможно	3
о говорящем человеке и	3
языка лингвистика и стилистика	3
речь на чужом языке	3
конципирование словом своего предмета	3
разрыв между языком и	3
чужая речь на чужом	3
в истории европейского романа	3
человеке и его слове	3
быть более или менее	3
знают друг о друге	3
точка зрения на мир	3
одно и то же	3
по ту сторону всякого	3
как оно и следует	3
типы и разновидности двуголосого	3
философия языка лингвистика и	3
говорящем человеке и его	3
во всех своих моментах	2
именно на фоне этого	2
и т д можно	2
чужим словом о нем	2
жизнь с ее событиями	2
и его слово для	2
в различные эпохи и	2
говорит и при каких	2
слова могут быть весьма	2
и с другой стороны	2
всякой прямой и непосредственной	2
в новое положение чтобы	2
непонимание в романе всегда	2
лежащая в их основе	2
дурака в дальнейшем развитии	2
и т п повсюду	2
в то время как	2
может быть разной степени	2
с точки зрения самого	2
выделена в отношении к	2
установка на слушателя и	2
на слушателя и на	2
отношение к своему языку	2
здесь у него нет	2
случае она мотивирует себя	2
всех областях жизни и	2
языка от последней смысловой	2
слова во всех его	2
вне себя то есть	2
лежит на границе между	2
или иной степени объектны	2
в этической и правовой	2
слова при его передаче	2
этом случае перед нами	2
во всех его многообразных	2
слово в узком смысле	2
образом ведут к нему	2
идея становления и воспитания	2
романа исключительно важную роль	2
формы ввода и организации	2
исчерпывает себя в них	2
значение риторических форм для	2
двух языков в пределах	2
романная проза рождается и	2
к своему предмету и	2
и т п или	2
в том и в	2
форм передачи чужой речи	2
бы они ни были	2
и т п и	2
передачи чужого слова в	2
первой и второй стилистической	2
его именно на фоне	2
и тем и другим	2
к своему стилистическому пределу	2
то же время он	2
разнообразными степенями точности и	2
одному и единому языку	2
всех его моментах в	2
во всех сферах жизни	2
художественного изображения чужой речи	2
ни в чем не	2
и его последней смысловой	2
со всеми разнообразными степенями	2
о нем и его	2
в процессе идеологического становления	2
двух планах в плане	2
все эти языки и	2
в диалогическом взаимодействии с	2
так и вне его	2
то же время и	2
слово как предмет слова	2
только изображает но и	2
между человеком и его	2
в стороне от большой	2
ближайшим образом ведут к	2
бытовых и полулитературных жанров	2
это не значит конечно	2
его слово как предмет	2
словом о нем и	2
к чужому слову к	2
языка в юмористическом романе	2
например белкин как рассказчик	2
и в другом случае	2
радклиф уолпол и др	2
значения темы о говорящем	2
одного синтаксического целого часто	2
друг о друге и	2
стилизации жанровых профессиональных и	2
не может быть существенно	2
глухое и темное смешение	2
о нем и в	2
и в этом случае	2
своего и чужого слова	2
аналогично обстоит дело и	2
на ту же тему	2
в стройную художественную систему	2
филдинга смоллетта и стерна	2
из многих языков разноречия	2
и не может быть	2
слово живет вне себя	2
общего языка в смысле	2
отношение к чужому слову	2
человека и его слова	2
стороне от большой дороги	2
не меньше чем в	2
смысловых и экспрессивных интенций	2
в нем в стройную	2
конкретных стилистических анализов романной	2
из комического плана в	2
и т п эти	2
приходится иметь дело с	2
единым и единственным языком	2
роман воспитания и становления	2
в двух планах в	2
зоне контакта с незавершенной	2
этической и правовой сфере	2
перестает быть тем чем	2
в зависимости от характера	2
смысловые и экспрессивные пласты	2
философия слова и лингвистика	2
категории внежанровой литературности языка	2
рассказчика или условного автора	2
дело с чужим словом	2
оно и следует сановнику	2
романа испытания и романа	2
европейская романная проза рождается	2
и т п но	2
и в сюжетном движении	2
и в том и	2
с этой точки зрения	2
идеологического становления индивидуального сознания	2
чужим словом и с	2
с ним до конца	2
и связанных с ними	2
льюис радклиф уолпол и	2
многообразно скрещиваются между собой	2
прозу и в особенности	2
никак нельзя отнести к	2
центростремительных сил словесно-идеологической жизни	2
и поэтическое слово в	2
пределах того же национального	2
до сих пор не	2
например во франции в	2
своему предмету и к	2
жанровых профессиональных и других	2
не исключают друг друга	2
на материале стилизуемого языка	2
к чужому слову в	2
в английском юмористическом романе	2
стилистических анализов романной прозы	2
и то же слово	2
имеет дело не с	2
испытания литературного слова могут	2
и на античной почве	2
они могут быть сопоставлены	2
в отношении к разноречию	2
или иные моменты языка	2
в нем новые стороны	2
может быть до конца	2
или во всяком случае	2
чужим словом в предмете	2
поэтическое слово в узком	2
это глухое и темное	2
этом случае она мотивирует	2
второй стилистической линии романа	2
внутренне убедительным чужим словом	2
видит понимает и мыслит	2
индивидуальные и направленческие обертоны	2
на чужие языки на	2
т п все это	2
в смысле системы общих	2
привело к тому что	2
может быть более или	2
два индивидуализованных языковых сознания	2
слова художественно не используется	2
и в новое время	2
языков в пределах того	2
разновидности романа у стерна	2
для понимания романного стиля	2
дневники и т п	2
и направленческие обертоны стиля	2
глупости и непонимания и	2
религиозного мышления и слова	2
и т п оно	2
большого романа второй линии	2
у филдинга смоллетта и	2
значение темы о говорящем	2
тем что он есть	2
его социальная разноречивость и	2
в точном смысле слова	2
романную прозу и в	2
на всю романную прозу	2
не значит конечно что	2
романы первой стилистической линии	2
каждый данный момент его	2
чужому слову к чужому	2
в этом случае перед	2
далее эта категория может	2
всеми разнообразными степенями точности	2
языковых сознания корреляты двух	2
героя и его слова	2
классический стихотворный рыцарский роман	2
гиппель и жан-поль в	2
т п эти языки	2
авторитарное слово требует от	2
слов оценок и акцентов	2
не может быть до	2
и в особенности на	2
жизни и идеологического творчества	2
слово требует от нас	2
контакта с незавершенной современностью	2
или в лучшем случае	2
разноречие остается вне романа	2
героя в романе испытания	2
том и в другом	2
лежат в одной плоскости	2
языка не может быть	2
письма дневники и т	2
во франции в xvii	2
в намеренном и сознательном	2
ощущение языка и слова	2
различных форм передачи чужой	2
то же время это	2
диалогичность слова художественно не	2
плут шут и дурак	2
в романе испытания и	2
философии языка лингвистики и	2
чужих слов оценок и	2
с известным правом можно	2
глупость непонимание в романе	2
в смысловом и экспрессивном	2
быть тем чем он	2
из одного в другой	2
нем в стройную художественную	2
того же национального языка	2
человек в романе существенно	2
говорящего человека и его	2
уходит своими корнями в	2
к новому материалу к	2
лежит в одной плоскости	2
национальных языков в пределах	2
именно там где она	2
языковое сознание стилизатора и	2
борьбы с чужим словом	2
того или иного конкретного	2
учителя и т п	2
взаимоориентации с чужим словом	2
степенями точности и беспристрастия	2
и второй стилистической линии	2
не для того чтобы	2
о говорящих людях и	2
и его слове во	2
на фоне этого разноречия	2
входит в задание стиля	2
и обрамления чужого слова	2
по своим синтаксическим признакам	2
не только изображает но	2
особых формальных приемов речи	2
о которых мы говорили	2
и т п можно	2
то же время в	2
сливается с авторским словом	2
в диалогах и в	2
различные эпохи и в	2
